[I 2025-06-20 12:15:25,865] Trial 408 finished with value: -1.5494784291613402 and parameters: {'booster': 'gbtree', 'lambda': 5.550783001253685e-08, 'alpha': 0.0001810759147838712, 'subsample': 0.8662109024027652, 'colsample_bytree': 0.6004690516188068, 'max_depth': 3, 'min_child_weight': 5, 'eta': 0.07583593976916932, 'gamma': 2.6666705441626695}. Best is trial 164 with value: -1.5157670549647289.
[I 2025-06-20 12:15:34,728] Trial 409 finished with value: -1.718851442818462 and parameters: {'booster': 'dart', 'lambda': 3.7740280269112885e-08, 'alpha': 4.008086391544437e-05, 'subsample': 0.7761595833427223, 'colsample_bytree': 0.52423295938914, 'max_depth': 4, 'min_child_weight': 6, 'eta': 0.06910234010927495, 'gamma': 4.069223963949671, 'rate_drop': 0.16369870477156206, 'skip_drop': 2.9771610379962772e-08}. Best is trial 164 with value: -1.5157670549647289.
[I 2025-06-20 12:15:35,159] Trial 410 finished with value: -1.5578039043040723 and parameters: {'booster': 'gbtree', 'lambda': 1.4034495061010166e-08, 'alpha': 0.0005367214838096901, 'subsample': 0.7663964572933727, 'colsample_bytree': 0.5105877213699455, 'max_depth': 4, 'min_child_weight': 5, 'eta': 0.054981107680188206, 'gamma': 3.130450536388578}. Best is trial 164 with value: -1.5157670549647289.
[I 2025-06-20 12:15:35,443] Trial 411 finished with value: -1.5427080412239584 and parameters: {'booster': 'gbtree', 'lambda': 9.161573855414455e-08, 'alpha': 0.03166038945357975, 'subsample': 0.7849824683074255, 'colsample_bytree': 0.5609493224068053, 'max_depth': 4, 'min_child_weight': 5, 'eta': 0.09611359005605644, 'gamma': 3.6328089104626238}. Best is trial 164 with value: -1.5157670549647289.
[I 2025-06-20 12:15:35,880] Trial 412 finished with value: -1.536420834076529 and parameters: {'booster': 'gbtree', 'lambda': 0.0054100393891181615, 'alpha': 0.00944821394278322, 'subsample': 0.8051638123237161, 'colsample_bytree': 0.5790309942106897, 'max_depth': 4, 'min_child_weight': 8, 'eta': 0.045824945477846636, 'gamma': 3.3323023378459022}. Best is trial 164 with value: -1.5157670549647289.
[I 2025-06-20 12:15:36,279] Trial 413 finished with value: -1.5700789312621923 and parameters: {'booster': 'gbtree', 'lambda': 8.60137922927791e-05, 'alpha': 0.010304533719480029, 'subsample': 0.7545748723908686, 'colsample_bytree': 0.5868023246367509, 'max_depth': 5, 'min_child_weight': 8, 'eta': 0.043847662577645836, 'gamma': 3.3906109726463973}. Best is trial 164 with value: -1.5157670549647289.
[I 2025-06-20 12:15:36,670] Trial 414 finished with value: -1.5774935440863298 and parameters: {'booster': 'gbtree', 'lambda': 0.0009148302324417973, 'alpha': 0.007623080425683076, 'subsample': 0.7983456605790834, 'colsample_bytree': 0.5805302322339434, 'max_depth': 4, 'min_child_weight': 8, 'eta': 0.03598930642554306, 'gamma': 4.292364013415589}. Best is trial 164 with value: -1.5157670549647289.
[I 2025-06-20 12:15:41,492] Trial 415 finished with value: -1.8740711463421333 and parameters: {'booster': 'dart', 'lambda': 0.004477441654868888, 'alpha': 0.014419299957107804, 'subsample': 0.7751124254802875, 'colsample_bytree': 0.5962219240863115, 'max_depth': 4, 'min_child_weight': 8, 'eta': 0.19818628365195945, 'gamma': 3.2961657030654843, 'rate_drop': 0.9626942297504653, 'skip_drop': 1.0587497242624707e-05}. Best is trial 164 with value: -1.5157670549647289.
[I 2025-06-20 12:15:41,725] Trial 416 finished with value: -1.544344294130981 and parameters: {'booster': 'gbtree', 'lambda': 0.009871773730112223, 'alpha': 0.004706643441299339, 'subsample': 0.7458908694828744, 'colsample_bytree': 0.5743974995967122, 'max_depth': 4, 'min_child_weight': 8, 'eta': 0.13010626949398302, 'gamma': 3.335405370569751}. Best is trial 164 with value: -1.5157670549647289.
[I 2025-06-20 12:15:42,129] Trial 417 finished with value: -1.5437650764460495 and parameters: {'booster': 'gbtree', 'lambda': 0.0026262028145654093, 'alpha': 0.009653222831677096, 'subsample': 0.8214546334021, 'colsample_bytree': 0.5683492078248953, 'max_depth': 3, 'min_child_weight': 8, 'eta': 0.06395100368949626, 'gamma': 3.1836381089548915}. Best is trial 164 with value: -1.5157670549647289.
[I 2025-06-20 12:15:42,478] Trial 418 finished with value: -1.570444774522082 and parameters: {'booster': 'gbtree', 'lambda': 0.016515011534531193, 'alpha': 0.46719631824415736, 'subsample': 0.8361191667940571, 'colsample_bytree': 0.5828242379191204, 'max_depth': 4, 'min_child_weight': 8, 'eta': 0.08080891844857184, 'gamma': 0.005294686055683069}. Best is trial 164 with value: -1.5157670549647289.
[I 2025-06-20 12:15:42,796] Trial 419 finished with value: -1.570457777016108 and parameters: {'booster': 'gbtree', 'lambda': 1.0012935645783497e-08, 'alpha': 0.006557852227693107, 'subsample': 0.7646399824447601, 'colsample_bytree': 0.7949310869795408, 'max_depth': 4, 'min_child_weight': 8, 'eta': 0.05674889268858112, 'gamma': 3.0484978988046127}. Best is trial 164 with value: -1.5157670549647289.
[I 2025-06-20 12:15:50,651] Trial 420 finished with value: -1.9432904323490074 and parameters: {'booster': 'dart', 'lambda': 2.240088514161441e-08, 'alpha': 0.022732359106265077, 'subsample': 0.7899837572254709, 'colsample_bytree': 0.5570115565036087, 'max_depth': 4, 'min_child_weight': 6, 'eta': 0.039983119445619886, 'gamma': 3.486530893954286, 'rate_drop': 0.32925073475884176, 'skip_drop': 6.57615272745469e-08}. Best is trial 164 with value: -1.5157670549647289.
[I 2025-06-20 12:15:51,095] Trial 421 finished with value: -1.556943697889988 and parameters: {'booster': 'gbtree', 'lambda': 1.569077028435481e-08, 'alpha': 0.01591878269038685, 'subsample': 0.7780962235050032, 'colsample_bytree': 0.547963760189281, 'max_depth': 3, 'min_child_weight': 8, 'eta': 0.05040605165480374, 'gamma': 2.524255353589922}. Best is trial 164 with value: -1.5157670549647289.
[I 2025-06-20 12:15:51,437] Trial 422 finished with value: -1.5833449494076546 and parameters: {'booster': 'gbtree', 'lambda': 2.8938199301815628e-08, 'alpha': 0.0032727784559292068, 'subsample': 0.8023737260669798, 'colsample_bytree': 0.6145989159645633, 'max_depth': 4, 'min_child_weight': 9, 'eta': 0.06783080100734776, 'gamma': 4.174254159310855}. Best is trial 164 with value: -1.5157670549647289.
[I 2025-06-20 12:15:51,854] Trial 423 finished with value: -1.5672010014455442 and parameters: {'booster': 'gbtree', 'lambda': 2.546729968187081e-05, 'alpha': 0.010551607807784571, 'subsample': 0.7607757701023126, 'colsample_bytree': 0.6506208284243941, 'max_depth': 4, 'min_child_weight': 6, 'eta': 0.05914507236653185, 'gamma': 3.9891881482546205}. Best is trial 164 with value: -1.5157670549647289.
[I 2025-06-20 12:15:52,204] Trial 424 finished with value: -1.565976302550115 and parameters: {'booster': 'gbtree', 'lambda': 2.0490990574702714e-08, 'alpha': 0.04929340110925133, 'subsample': 0.7336689043547002, 'colsample_bytree': 0.5748895444476944, 'max_depth': 4, 'min_child_weight': 5, 'eta': 0.04587256779316279, 'gamma': 3.818174944916236}. Best is trial 164 with value: -1.5157670549647289.
[I 2025-06-20 12:15:56,339] Trial 425 finished with value: -1.6085062103519003 and parameters: {'booster': 'dart', 'lambda': 1.3945927297029005e-08, 'alpha': 6.70675391242716e-05, 'subsample': 0.7843291025008983, 'colsample_bytree': 0.5616260401372624, 'max_depth': 7, 'min_child_weight': 5, 'eta': 0.051947282536759974, 'gamma': 3.2538655779953682, 'rate_drop': 0.000864687885407519, 'skip_drop': 1.672081637371884e-05}. Best is trial 164 with value: -1.5157670549647289.
[I 2025-06-20 12:15:56,600] Trial 426 finished with value: -1.5759507958394512 and parameters: {'booster': 'gbtree', 'lambda': 0.34968080537420715, 'alpha': 0.07790609783456184, 'subsample': 0.7704843120094292, 'colsample_bytree': 0.5893228961443951, 'max_depth': 4, 'min_child_weight': 6, 'eta': 0.0748745611615877, 'gamma': 4.943212170786091}. Best is trial 164 with value: -1.5157670549647289.
[I 2025-06-20 12:15:56,934] Trial 427 finished with value: -1.5870767954652552 and parameters: {'booster': 'gbtree', 'lambda': 1.0070352085955285e-08, 'alpha': 0.0059101069846615294, 'subsample': 0.7939950352487416, 'colsample_bytree': 0.5503666979478944, 'max_depth': 3, 'min_child_weight': 6, 'eta': 0.06277561112320713, 'gamma': 2.8864673857859438}. Best is trial 164 with value: -1.5157670549647289.
[I 2025-06-20 12:15:57,188] Trial 428 finished with value: -1.629463256426981 and parameters: {'booster': 'gbtree', 'lambda': 0.05937419406480888, 'alpha': 0.00336304732374049, 'subsample': 0.6975890125074216, 'colsample_bytree': 0.5398926765527288, 'max_depth': 4, 'min_child_weight': 5, 'eta': 0.09111841076183254, 'gamma': 3.8949683946687332}. Best is trial 164 with value: -1.5157670549647289.
[I 2025-06-20 12:15:57,535] Trial 429 finished with value: -1.5754810208501964 and parameters: {'booster': 'gbtree', 'lambda': 3.927800428532967e-08, 'alpha': 0.009027946166687664, 'subsample': 0.8108777558195027, 'colsample_bytree': 0.5004286415368786, 'max_depth': 4, 'min_child_weight': 7, 'eta': 0.0411025436085368, 'gamma': 3.7505290412648713}. Best is trial 164 with value: -1.5157670549647289.
[I 2025-06-20 12:16:06,437] Trial 430 finished with value: -2.152955205956438 and parameters: {'booster': 'dart', 'lambda': 2.2290062285550142e-08, 'alpha': 0.02152508841007846, 'subsample': 0.7534876594861456, 'colsample_bytree': 0.5673339844920604, 'max_depth': 4, 'min_child_weight': 5, 'eta': 0.004456874739906804, 'gamma': 3.4331626427884885, 'rate_drop': 0.12081970520333545, 'skip_drop': 2.037615229959915e-08}. Best is trial 164 with value: -1.5157670549647289.
[I 2025-06-20 12:16:06,837] Trial 431 finished with value: -1.537804066488594 and parameters: {'booster': 'gbtree', 'lambda': 2.9230170424020523e-08, 'alpha': 0.002184683832726357, 'subsample': 0.7828914271817324, 'colsample_bytree': 0.5325760018599803, 'max_depth': 4, 'min_child_weight': 5, 'eta': 0.05632382284599725, 'gamma': 3.539905950863391}. Best is trial 164 with value: -1.5157670549647289.
[I 2025-06-20 12:16:07,262] Trial 432 finished with value: -1.5552229815616718 and parameters: {'booster': 'gbtree', 'lambda': 4.83722881382405e-08, 'alpha': 0.0013414267696013984, 'subsample': 0.7761889665418336, 'colsample_bytree': 0.5320200710983515, 'max_depth': 4, 'min_child_weight': 6, 'eta': 0.04859180420431355, 'gamma': 3.5273973096514073}. Best is trial 164 with value: -1.5157670549647289.
[I 2025-06-20 12:16:07,700] Trial 433 finished with value: -1.530426451505227 and parameters: {'booster': 'gbtree', 'lambda': 0.14426524713608954, 'alpha': 0.0018392260325211004, 'subsample': 0.7665367093449542, 'colsample_bytree': 0.5343023762151464, 'max_depth': 4, 'min_child_weight': 8, 'eta': 0.053993413046420635, 'gamma': 3.647707620499639}. Best is trial 164 with value: -1.5157670549647289.
[I 2025-06-20 12:16:08,005] Trial 434 finished with value: -1.648116338531652 and parameters: {'booster': 'gbtree', 'lambda': 0.07961193965211143, 'alpha': 0.0015089482452816693, 'subsample': 0.7630330807282089, 'colsample_bytree': 0.5390447829573718, 'max_depth': 3, 'min_child_weight': 8, 'eta': 0.25629922249867276, 'gamma': 3.634474717298208}. Best is trial 164 with value: -1.5157670549647289.
[I 2025-06-20 12:16:08,542] Trial 435 finished with value: -1.5501617299735373 and parameters: {'booster': 'gbtree', 'lambda': 1.8948309855250882, 'alpha': 0.0032122263704661026, 'subsample': 0.7657387452324944, 'colsample_bytree': 0.5331826591028421, 'max_depth': 4, 'min_child_weight': 8, 'eta': 0.04603164315147055, 'gamma': 3.568615137903593}. Best is trial 164 with value: -1.5157670549647289.
[I 2025-06-20 12:16:08,945] Trial 436 finished with value: -1.5767561448498346 and parameters: {'booster': 'gbtree', 'lambda': 2.475790375837108e-07, 'alpha': 0.002007780874508065, 'subsample': 0.7407052700709716, 'colsample_bytree': 0.5472825498073229, 'max_depth': 6, 'min_child_weight': 8, 'eta': 0.05198875710353372, 'gamma': 2.36580223404938}. Best is trial 164 with value: -1.5157670549647289.
[I 2025-06-20 12:16:09,388] Trial 437 finished with value: -1.5692963071922366 and parameters: {'booster': 'gbtree', 'lambda': 1.0037951085069028, 'alpha': 0.0013862102219257735, 'subsample': 0.7467573219406206, 'colsample_bytree': 0.5306683758710306, 'max_depth': 5, 'min_child_weight': 8, 'eta': 0.033660347350709316, 'gamma': 3.677908410361108}. Best is trial 164 with value: -1.5157670549647289.
[I 2025-06-20 12:16:09,972] Trial 438 finished with value: -1.6035149415537222 and parameters: {'booster': 'gbtree', 'lambda': 0.00033043051960400765, 'alpha': 0.002538306084772522, 'subsample': 0.7582484256744599, 'colsample_bytree': 0.9544500357336339, 'max_depth': 10, 'min_child_weight': 8, 'eta': 0.01823383574613393, 'gamma': 2.615341839768016}. Best is trial 164 with value: -1.5157670549647289.
[I 2025-06-20 12:16:10,320] Trial 439 finished with value: -1.5626095309924013 and parameters: {'booster': 'gbtree', 'lambda': 1.337001113936236e-07, 'alpha': 0.0023659569314996368, 'subsample': 0.7845162965894078, 'colsample_bytree': 0.5391326126952642, 'max_depth': 4, 'min_child_weight': 9, 'eta': 0.05761165381939938, 'gamma': 3.518273003826266}. Best is trial 164 with value: -1.5157670549647289.
[I 2025-06-20 12:16:10,647] Trial 440 finished with value: -1.5463729294978021 and parameters: {'booster': 'gbtree', 'lambda': 0.024870638540563955, 'alpha': 0.0010884756392446878, 'subsample': 0.7732524620118465, 'colsample_bytree': 0.5527768660243659, 'max_depth': 4, 'min_child_weight': 8, 'eta': 0.06924497550242849, 'gamma': 3.7434559101498075}. Best is trial 164 with value: -1.5157670549647289.
[I 2025-06-20 12:16:10,950] Trial 441 finished with value: -1.589767771753707 and parameters: {'booster': 'gbtree', 'lambda': 0.4395547789190081, 'alpha': 0.0024153830486956566, 'subsample': 0.8876153109750118, 'colsample_bytree': 0.7368818618676375, 'max_depth': 4, 'min_child_weight': 7, 'eta': 0.04130520811179637, 'gamma': 2.7887317047045665}. Best is trial 164 with value: -1.5157670549647289.
[I 2025-06-20 12:16:11,354] Trial 442 finished with value: -1.5626318313860563 and parameters: {'booster': 'gbtree', 'lambda': 3.133768364803703e-08, 'alpha': 0.0009553369218979637, 'subsample': 0.7530116755938305, 'colsample_bytree': 0.5224551991392369, 'max_depth': 4, 'min_child_weight': 8, 'eta': 0.05443498634876635, 'gamma': 3.442262807739847}. Best is trial 164 with value: -1.5157670549647289.
[I 2025-06-20 12:16:11,621] Trial 443 finished with value: -1.5573303007594934 and parameters: {'booster': 'gbtree', 'lambda': 0.00602271451666554, 'alpha': 0.003921413761573326, 'subsample': 0.7966427077729522, 'colsample_bytree': 0.5427190264888953, 'max_depth': 3, 'min_child_weight': 5, 'eta': 0.08182804319876104, 'gamma': 3.682437243365772}. Best is trial 164 with value: -1.5157670549647289.
[I 2025-06-20 12:16:11,941] Trial 444 finished with value: -1.5570854039195865 and parameters: {'booster': 'gbtree', 'lambda': 0.6480194054912773, 'alpha': 0.0038944303297779137, 'subsample': 0.8242314574574088, 'colsample_bytree': 0.5296627364375683, 'max_depth': 4, 'min_child_weight': 6, 'eta': 0.0612821118555661, 'gamma': 3.6157847981078945}. Best is trial 164 with value: -1.5157670549647289.
[I 2025-06-20 12:16:12,273] Trial 445 finished with value: -1.550588790059341 and parameters: {'booster': 'gbtree', 'lambda': 4.8591653211665025e-08, 'alpha': 0.002018226351439277, 'subsample': 0.782487302735619, 'colsample_bytree': 0.5557626207372456, 'max_depth': 4, 'min_child_weight': 8, 'eta': 0.047695582577042074, 'gamma': 3.5540951031780956}. Best is trial 164 with value: -1.5157670549647289.
[I 2025-06-20 12:16:12,567] Trial 446 finished with value: -1.5616070861491371 and parameters: {'booster': 'gbtree', 'lambda': 4.024373713021034, 'alpha': 0.0013858749493606557, 'subsample': 0.7653348440500681, 'colsample_bytree': 0.546734176507913, 'max_depth': 4, 'min_child_weight': 5, 'eta': 0.07128799600554138, 'gamma': 3.742229821623989}. Best is trial 164 with value: -1.5157670549647289.
[I 2025-06-20 12:16:13,004] Trial 447 finished with value: -1.5721847948210097 and parameters: {'booster': 'gbtree', 'lambda': 4.19723667317434e-05, 'alpha': 0.005098293853930245, 'subsample': 0.6828390132505212, 'colsample_bytree': 0.5180834032243992, 'max_depth': 4, 'min_child_weight': 7, 'eta': 0.044097188521839255, 'gamma': 2.7265702071746722}. Best is trial 164 with value: -1.5157670549647289.
[I 2025-06-20 12:16:13,325] Trial 448 finished with value: -1.5586849361620778 and parameters: {'booster': 'gbtree', 'lambda': 1.719048258475121e-08, 'alpha': 0.0017867410539210242, 'subsample': 0.806558087023978, 'colsample_bytree': 0.5376902477558412, 'max_depth': 4, 'min_child_weight': 5, 'eta': 0.10646338602481564, 'gamma': 3.455793395303728}. Best is trial 164 with value: -1.5157670549647289.
[I 2025-06-20 12:16:13,734] Trial 449 finished with value: -1.5752711177374643 and parameters: {'booster': 'gbtree', 'lambda': 6.263003174306646e-08, 'alpha': 1.635659019345009, 'subsample': 0.7888916873503065, 'colsample_bytree': 0.5575803938110847, 'max_depth': 3, 'min_child_weight': 6, 'eta': 0.05295592485909279, 'gamma': 4.042576938558834}. Best is trial 164 with value: -1.5157670549647289.
[I 2025-06-20 12:16:14,196] Trial 450 finished with value: -1.5856172858343145 and parameters: {'booster': 'gbtree', 'lambda': 1.536516915840672e-05, 'alpha': 2.663365454100169e-05, 'subsample': 0.7712863833384922, 'colsample_bytree': 0.5266629289162306, 'max_depth': 4, 'min_child_weight': 2, 'eta': 0.06055898183348752, 'gamma': 3.6423404396596437}. Best is trial 164 with value: -1.5157670549647289.
[I 2025-06-20 12:16:14,559] Trial 451 finished with value: -1.5763015307217096 and parameters: {'booster': 'gbtree', 'lambda': 0.24517535305319044, 'alpha': 0.006422737670116136, 'subsample': 0.7268922450832044, 'colsample_bytree': 0.5348405261831327, 'max_depth': 4, 'min_child_weight': 5, 'eta': 0.04929101557332515, 'gamma': 3.885365189569052}. Best is trial 164 with value: -1.5157670549647289.
[I 2025-06-20 12:16:14,855] Trial 452 finished with value: -1.5560967999892423 and parameters: {'booster': 'gbtree', 'lambda': 0.0012133455111810634, 'alpha': 0.0009542626923944622, 'subsample': 0.7565492943250297, 'colsample_bytree': 0.5497490181064789, 'max_depth': 5, 'min_child_weight': 6, 'eta': 0.06658994554448526, 'gamma': 3.7639342233002577}. Best is trial 164 with value: -1.5157670549647289.
[I 2025-06-20 12:16:15,180] Trial 453 finished with value: -1.559827733349168 and parameters: {'booster': 'gbtree', 'lambda': 0.032648560368576184, 'alpha': 5.197720809125235e-05, 'subsample': 0.7053104640819232, 'colsample_bytree': 0.5192412918984816, 'max_depth': 4, 'min_child_weight': 5, 'eta': 0.05717208121400607, 'gamma': 2.584904080081242}. Best is trial 164 with value: -1.5157670549647289.
[I 2025-06-20 12:16:15,554] Trial 454 finished with value: -1.5829345295813906 and parameters: {'booster': 'gbtree', 'lambda': 7.712109180647106, 'alpha': 0.013546040929522746, 'subsample': 0.6664243723612827, 'colsample_bytree': 0.5687626672577336, 'max_depth': 4, 'min_child_weight': 8, 'eta': 0.03677099566510754, 'gamma': 4.403511041070163}. Best is trial 164 with value: -1.5157670549647289.
[I 2025-06-20 12:16:15,962] Trial 455 finished with value: -1.5632617540801932 and parameters: {'booster': 'gbtree', 'lambda': 2.5158098925354617e-08, 'alpha': 0.00010108839565274812, 'subsample': 0.7964515076463722, 'colsample_bytree': 0.5418356895356697, 'max_depth': 3, 'min_child_weight': 5, 'eta': 0.07737218057385437, 'gamma': 3.3759732205515696}. Best is trial 164 with value: -1.5157670549647289.
[I 2025-06-20 12:16:16,387] Trial 456 finished with value: -1.5620003153154558 and parameters: {'booster': 'gbtree', 'lambda': 1.0226920514786756e-07, 'alpha': 0.0030517225194217406, 'subsample': 0.7822747820968335, 'colsample_bytree': 0.5276756111865661, 'max_depth': 4, 'min_child_weight': 9, 'eta': 0.041377094727105226, 'gamma': 0.13595682522487}. Best is trial 164 with value: -1.5157670549647289.
[I 2025-06-20 12:16:16,726] Trial 457 finished with value: -1.5392341972854782 and parameters: {'booster': 'gbtree', 'lambda': 3.717403277223494e-08, 'alpha': 0.0006849036271026072, 'subsample': 0.7718189653368256, 'colsample_bytree': 0.5617037475526371, 'max_depth': 4, 'min_child_weight': 6, 'eta': 0.06482774196296776, 'gamma': 2.9528553861748645}. Best is trial 164 with value: -1.5157670549647289.
[I 2025-06-20 12:16:17,068] Trial 458 finished with value: -1.5411748000758907 and parameters: {'booster': 'gbtree', 'lambda': 4.063249418565975e-08, 'alpha': 0.0008500093464598117, 'subsample': 0.761411035022532, 'colsample_bytree': 0.5613599808700316, 'max_depth': 4, 'min_child_weight': 6, 'eta': 0.07391844137454591, 'gamma': 2.7927274735684624}. Best is trial 164 with value: -1.5157670549647289.
[I 2025-06-20 12:16:17,475] Trial 459 finished with value: -1.5695387899740723 and parameters: {'booster': 'gbtree', 'lambda': 7.567672145390412e-08, 'alpha': 0.0006058156555639374, 'subsample': 0.7450717692950672, 'colsample_bytree': 0.5555520740620137, 'max_depth': 4, 'min_child_weight': 6, 'eta': 0.0845050426550153, 'gamma': 3.027121240746941}. Best is trial 164 with value: -1.5157670549647289.
[I 2025-06-20 12:16:18,170] Trial 460 finished with value: -1.8325910977593582 and parameters: {'booster': 'gbtree', 'lambda': 1.7053602082076363e-07, 'alpha': 2.084207854064296e-06, 'subsample': 0.7696734003602761, 'colsample_bytree': 0.5453177181036077, 'max_depth': 4, 'min_child_weight': 6, 'eta': 0.005605509279788193, 'gamma': 2.851775335860705}. Best is trial 164 with value: -1.5157670549647289.
[I 2025-06-20 12:16:18,601] Trial 461 finished with value: -1.5315802938422407 and parameters: {'booster': 'gbtree', 'lambda': 3.877552849909602e-08, 'alpha': 0.0006583623814866396, 'subsample': 0.7544341404297639, 'colsample_bytree': 0.5131034803093167, 'max_depth': 4, 'min_child_weight': 6, 'eta': 0.06492771549443492, 'gamma': 2.76616072078883}. Best is trial 164 with value: -1.5157670549647289.
