[I 2025-06-20 12:13:11,851] Trial 301 finished with value: -1.5394006275424987 and parameters: {'booster': 'gbtree', 'lambda': 2.9407376524861975e-08, 'alpha': 0.00030759388838179477, 'subsample': 0.7774740429249477, 'colsample_bytree': 0.5062786603340527, 'max_depth': 4, 'min_child_weight': 4, 'eta': 0.05501086918659753, 'gamma': 3.827691458171256}. Best is trial 164 with value: -1.5157670549647289.
[I 2025-06-20 12:13:12,187] Trial 302 finished with value: -1.696329238139631 and parameters: {'booster': 'gbtree', 'lambda': 2.939772187746961e-08, 'alpha': 0.00020109154273846924, 'subsample': 0.7861614212590399, 'colsample_bytree': 0.5007931782480245, 'max_depth': 4, 'min_child_weight': 4, 'eta': 0.011110425179634868, 'gamma': 3.823807453584121}. Best is trial 164 with value: -1.5157670549647289.
[I 2025-06-20 12:13:12,477] Trial 303 finished with value: -1.5411068922761493 and parameters: {'booster': 'gbtree', 'lambda': 1.8680277934952057e-08, 'alpha': 0.0004139630140557983, 'subsample': 0.7802165220051976, 'colsample_bytree': 0.5057007267477976, 'max_depth': 4, 'min_child_weight': 4, 'eta': 0.04514352147539784, 'gamma': 3.8487657987526758}. Best is trial 164 with value: -1.5157670549647289.
[I 2025-06-20 12:13:12,761] Trial 304 finished with value: -1.5664490762416778 and parameters: {'booster': 'gbtree', 'lambda': 3.828550664388351e-08, 'alpha': 0.0003220586715151677, 'subsample': 0.7791529315677969, 'colsample_bytree': 0.503004944356172, 'max_depth': 3, 'min_child_weight': 4, 'eta': 0.038144449888534125, 'gamma': 3.8300342589032006}. Best is trial 164 with value: -1.5157670549647289.
[I 2025-06-20 12:13:13,004] Trial 305 finished with value: -1.582884815494745 and parameters: {'booster': 'gbtree', 'lambda': 1.0059037992257728e-08, 'alpha': 0.00035117317412318325, 'subsample': 0.7760894279574287, 'colsample_bytree': 0.5008652924264602, 'max_depth': 4, 'min_child_weight': 4, 'eta': 0.04331065081555698, 'gamma': 3.891992606773871}. Best is trial 164 with value: -1.5157670549647289.
[I 2025-06-20 12:13:13,404] Trial 306 finished with value: -1.549865677717913 and parameters: {'booster': 'gbtree', 'lambda': 2.2754688875797525e-08, 'alpha': 0.00023769268640771177, 'subsample': 0.7875116600334846, 'colsample_bytree': 0.5172370986855418, 'max_depth': 4, 'min_child_weight': 4, 'eta': 0.045005524057604454, 'gamma': 3.7380037741486825}. Best is trial 164 with value: -1.5157670549647289.
[I 2025-06-20 12:13:13,692] Trial 307 finished with value: -1.5475122485362747 and parameters: {'booster': 'gbtree', 'lambda': 5.343004948092741e-08, 'alpha': 0.0003760682890804646, 'subsample': 0.7733104994141363, 'colsample_bytree': 0.5199585375592615, 'max_depth': 4, 'min_child_weight': 4, 'eta': 0.057583386918458275, 'gamma': 3.9235379690916097}. Best is trial 164 with value: -1.5157670549647289.
[I 2025-06-20 12:13:14,052] Trial 308 finished with value: -1.5358910183613859 and parameters: {'booster': 'gbtree', 'lambda': 2.027872174148823e-08, 'alpha': 9.030087152412217e-05, 'subsample': 0.7956202953181035, 'colsample_bytree': 0.5093353407191836, 'max_depth': 4, 'min_child_weight': 4, 'eta': 0.04869805433985897, 'gamma': 3.6430510780774137}. Best is trial 164 with value: -1.5157670549647289.
[I 2025-06-20 12:13:14,296] Trial 309 finished with value: -1.557434221972871 and parameters: {'booster': 'gbtree', 'lambda': 2.4638789247540232e-08, 'alpha': 6.040076591381077e-05, 'subsample': 0.7931114747119636, 'colsample_bytree': 0.5157038541435335, 'max_depth': 4, 'min_child_weight': 4, 'eta': 0.05222347788669133, 'gamma': 3.6429157931734215}. Best is trial 164 with value: -1.5157670549647289.
[I 2025-06-20 12:13:14,578] Trial 310 finished with value: -1.5792306468110595 and parameters: {'booster': 'gbtree', 'lambda': 3.4908878951133177e-08, 'alpha': 0.00010441716251107732, 'subsample': 0.8109000263246599, 'colsample_bytree': 0.5250314406739182, 'max_depth': 4, 'min_child_weight': 4, 'eta': 0.05939762770944276, 'gamma': 3.678569340499705}. Best is trial 164 with value: -1.5157670549647289.
[I 2025-06-20 12:13:14,835] Trial 311 finished with value: -1.5679701270434727 and parameters: {'booster': 'gbtree', 'lambda': 5.980385224645716e-08, 'alpha': 0.0001175493356785889, 'subsample': 0.7937594889154704, 'colsample_bytree': 0.5094280764644873, 'max_depth': 4, 'min_child_weight': 4, 'eta': 0.04992234609956506, 'gamma': 3.7701549082147694}. Best is trial 164 with value: -1.5157670549647289.
[I 2025-06-20 12:13:15,142] Trial 312 finished with value: -1.5689098438263356 and parameters: {'booster': 'gbtree', 'lambda': 1.0079835573879374e-08, 'alpha': 0.0001439362835142369, 'subsample': 0.800003022412784, 'colsample_bytree': 0.532974721295719, 'max_depth': 3, 'min_child_weight': 4, 'eta': 0.055885410467788305, 'gamma': 3.631160254777649}. Best is trial 164 with value: -1.5157670549647289.
[I 2025-06-20 12:13:15,371] Trial 313 finished with value: -1.6397090811265358 and parameters: {'booster': 'gbtree', 'lambda': 1.5939068390562094e-08, 'alpha': 0.00019849611286773539, 'subsample': 0.8163318365223731, 'colsample_bytree': 0.5261234160578743, 'max_depth': 8, 'min_child_weight': 4, 'eta': 0.06366149646822643, 'gamma': 3.7366820489159407}. Best is trial 164 with value: -1.5157670549647289.
[I 2025-06-20 12:13:15,691] Trial 314 finished with value: -1.5537661315171512 and parameters: {'booster': 'gbtree', 'lambda': 3.2131387565306705e-08, 'alpha': 0.0007695752393114321, 'subsample': 0.7722635893239089, 'colsample_bytree': 0.5145292042397815, 'max_depth': 4, 'min_child_weight': 3, 'eta': 0.038556233090418245, 'gamma': 3.545459456566958}. Best is trial 164 with value: -1.5157670549647289.
[I 2025-06-20 12:13:16,017] Trial 315 finished with value: -1.5568183562527196 and parameters: {'booster': 'gbtree', 'lambda': 2.338106152015791e-08, 'alpha': 8.24885724818831e-05, 'subsample': 0.7891664365538993, 'colsample_bytree': 0.5417398493637539, 'max_depth': 4, 'min_child_weight': 4, 'eta': 0.04799200210894588, 'gamma': 3.9788911042113813}. Best is trial 164 with value: -1.5157670549647289.
[I 2025-06-20 12:13:16,346] Trial 316 finished with value: -1.56077941464569 and parameters: {'booster': 'gbtree', 'lambda': 5.1364360127185575e-08, 'alpha': 0.0001558136213892004, 'subsample': 0.8433579255273457, 'colsample_bytree': 0.5220657741625847, 'max_depth': 4, 'min_child_weight': 8, 'eta': 0.03542043413417767, 'gamma': 3.6269736258038834}. Best is trial 164 with value: -1.5157670549647289.
[I 2025-06-20 12:13:16,676] Trial 317 finished with value: -1.6042662880300402 and parameters: {'booster': 'gbtree', 'lambda': 1.485424283516355e-08, 'alpha': 6.324055968851099, 'subsample': 0.7578702412611804, 'colsample_bytree': 0.5315912348216045, 'max_depth': 4, 'min_child_weight': 4, 'eta': 0.053839795241651354, 'gamma': 3.827645364370962}. Best is trial 164 with value: -1.5157670549647289.
[I 2025-06-20 12:13:16,898] Trial 318 finished with value: -1.5804907830838415 and parameters: {'booster': 'gbtree', 'lambda': 7.36263475581685e-08, 'alpha': 5.295453525233096e-05, 'subsample': 0.7685828959213022, 'colsample_bytree': 0.5118621157566337, 'max_depth': 4, 'min_child_weight': 4, 'eta': 0.07371140813200322, 'gamma': 3.4683380642895187}. Best is trial 164 with value: -1.5157670549647289.
[I 2025-06-20 12:13:17,250] Trial 319 finished with value: -1.7819878859616416 and parameters: {'booster': 'gbtree', 'lambda': 3.141269832930718e-08, 'alpha': 4.162371336988473e-05, 'subsample': 0.782200638729934, 'colsample_bytree': 0.5516118629601544, 'max_depth': 4, 'min_child_weight': 8, 'eta': 0.007511352188932573, 'gamma': 4.682458352071206}. Best is trial 164 with value: -1.5157670549647289.
[I 2025-06-20 12:13:17,486] Trial 320 finished with value: -1.5670843343637728 and parameters: {'booster': 'gbtree', 'lambda': 1.9107834427060004e-08, 'alpha': 7.375199198413842e-05, 'subsample': 0.7998307933818671, 'colsample_bytree': 0.5426843441544396, 'max_depth': 4, 'min_child_weight': 5, 'eta': 0.05935003494771974, 'gamma': 3.727282604719635}. Best is trial 164 with value: -1.5157670549647289.
[I 2025-06-20 12:13:17,809] Trial 321 finished with value: -1.5634434988140655 and parameters: {'booster': 'gbtree', 'lambda': 4.291233216454672e-08, 'alpha': 0.0002563804499325686, 'subsample': 0.8084341661035584, 'colsample_bytree': 0.5221756381422622, 'max_depth': 4, 'min_child_weight': 4, 'eta': 0.0421309777484, 'gamma': 3.9975145693915723}. Best is trial 164 with value: -1.5157670549647289.
[I 2025-06-20 12:13:18,139] Trial 322 finished with value: -1.544894802621877 and parameters: {'booster': 'gbtree', 'lambda': 1.6002578634351903e-08, 'alpha': 0.0017357232727955964, 'subsample': 0.7881566783631798, 'colsample_bytree': 0.5021440366767916, 'max_depth': 4, 'min_child_weight': 5, 'eta': 0.048480558534526104, 'gamma': 3.8863582215713635}. Best is trial 164 with value: -1.5157670549647289.
[I 2025-06-20 12:13:18,379] Trial 323 finished with value: -1.565086095210962 and parameters: {'booster': 'gbtree', 'lambda': 8.464188860877826e-08, 'alpha': 0.000725062243226072, 'subsample': 0.7700459231907922, 'colsample_bytree': 0.5333993888542637, 'max_depth': 5, 'min_child_weight': 8, 'eta': 0.07049967432755545, 'gamma': 3.380274566621799}. Best is trial 164 with value: -1.5157670549647289.
[I 2025-06-20 12:13:18,638] Trial 324 finished with value: -1.5725249291694048 and parameters: {'booster': 'gbtree', 'lambda': 1.0281337749817817e-08, 'alpha': 1.6745219880972907e-07, 'subsample': 0.7562148420547946, 'colsample_bytree': 0.5130097616336796, 'max_depth': 4, 'min_child_weight': 5, 'eta': 0.06322608620264063, 'gamma': 3.585127079476715}. Best is trial 164 with value: -1.5157670549647289.
[I 2025-06-20 12:13:18,947] Trial 325 finished with value: -1.5474556399280452 and parameters: {'booster': 'gbtree', 'lambda': 2.736234790807431e-08, 'alpha': 0.0004967414787393911, 'subsample': 0.7780296015050351, 'colsample_bytree': 0.5455150398329167, 'max_depth': 4, 'min_child_weight': 3, 'eta': 0.05350329721213162, 'gamma': 3.6934505358568286}. Best is trial 164 with value: -1.5157670549647289.
[I 2025-06-20 12:13:19,255] Trial 326 finished with value: -1.5639097713762158 and parameters: {'booster': 'gbtree', 'lambda': 4.312728231658396e-08, 'alpha': 0.00017592543920029327, 'subsample': 0.8194396503719915, 'colsample_bytree': 0.500334117962186, 'max_depth': 4, 'min_child_weight': 5, 'eta': 0.08620430699599452, 'gamma': 3.820498485426983}. Best is trial 164 with value: -1.5157670549647289.
[I 2025-06-20 12:13:19,534] Trial 327 finished with value: -1.5691373842697367 and parameters: {'booster': 'gbtree', 'lambda': 2.2550389761296727e-08, 'alpha': 0.006376599340168824, 'subsample': 0.7959400351315605, 'colsample_bytree': 0.5676859782356973, 'max_depth': 4, 'min_child_weight': 4, 'eta': 0.04605908148156353, 'gamma': 3.5229544182835206}. Best is trial 164 with value: -1.5157670549647289.
[I 2025-06-20 12:13:19,834] Trial 328 finished with value: -1.5656906689534602 and parameters: {'booster': 'gbtree', 'lambda': 1.544861568483898e-08, 'alpha': 9.629671603968532e-05, 'subsample': 0.7627780842866652, 'colsample_bytree': 0.5294145588339049, 'max_depth': 3, 'min_child_weight': 5, 'eta': 0.06025482848168043, 'gamma': 3.648907452872449}. Best is trial 164 with value: -1.5157670549647289.
[I 2025-06-20 12:13:20,110] Trial 329 finished with value: -1.5601689605242153 and parameters: {'booster': 'gbtree', 'lambda': 1.214114214013968e-07, 'alpha': 0.0003269286755408926, 'subsample': 0.78314384257041, 'colsample_bytree': 0.5529707673686385, 'max_depth': 4, 'min_child_weight': 5, 'eta': 0.0543505606417598, 'gamma': 3.776664903053637}. Best is trial 164 with value: -1.5157670549647289.
[I 2025-06-20 12:13:20,334] Trial 330 finished with value: -1.5676657778693688 and parameters: {'booster': 'gbtree', 'lambda': 5.89452316846073e-08, 'alpha': 4.840353741375556e-07, 'subsample': 0.7479132582252218, 'colsample_bytree': 0.575104575609871, 'max_depth': 5, 'min_child_weight': 7, 'eta': 0.06933194908714672, 'gamma': 3.9973881787345893}. Best is trial 164 with value: -1.5157670549647289.
[I 2025-06-20 12:13:20,654] Trial 331 finished with value: -1.5531913750624364 and parameters: {'booster': 'gbtree', 'lambda': 2.7669875340881265e-08, 'alpha': 0.0010139291167137888, 'subsample': 0.8045709945617159, 'colsample_bytree': 0.5384051479722389, 'max_depth': 4, 'min_child_weight': 4, 'eta': 0.04137352581768326, 'gamma': 3.4729265251248416}. Best is trial 164 with value: -1.5157670549647289.
[I 2025-06-20 12:13:20,977] Trial 332 finished with value: -1.5547461151943882 and parameters: {'booster': 'gbtree', 'lambda': 1.0201223846466338e-08, 'alpha': 0.015466132016269035, 'subsample': 0.7708820478800961, 'colsample_bytree': 0.5207585180503571, 'max_depth': 4, 'min_child_weight': 5, 'eta': 0.048564710652071276, 'gamma': 3.2833747484105467}. Best is trial 164 with value: -1.5157670549647289.
[I 2025-06-20 12:13:21,153] Trial 333 finished with value: -1.5917859592706158 and parameters: {'booster': 'gbtree', 'lambda': 3.701874033342278e-08, 'alpha': 3.1784093415581625e-05, 'subsample': 0.7912144297061598, 'colsample_bytree': 0.5111319341973476, 'max_depth': 4, 'min_child_weight': 5, 'eta': 0.07901343501945048, 'gamma': 3.9009468655762434}. Best is trial 164 with value: -1.5157670549647289.
[I 2025-06-20 12:13:21,498] Trial 334 finished with value: -1.9503967784252036 and parameters: {'booster': 'gbtree', 'lambda': 1.7307175001274523e-08, 'alpha': 0.0005907633276980706, 'subsample': 0.7795767235435643, 'colsample_bytree': 0.5643623252920356, 'max_depth': 4, 'min_child_weight': 5, 'eta': 0.0032824599853527037, 'gamma': 4.076518523776485}. Best is trial 164 with value: -1.5157670549647289.
[I 2025-06-20 12:13:21,753] Trial 335 finished with value: -1.5460443861153128 and parameters: {'booster': 'gbtree', 'lambda': 7.685973710353137e-08, 'alpha': 0.0333556767824355, 'subsample': 0.8133469234229961, 'colsample_bytree': 0.552008955931025, 'max_depth': 4, 'min_child_weight': 5, 'eta': 0.062007582770812635, 'gamma': 3.59480557273027}. Best is trial 164 with value: -1.5157670549647289.
[I 2025-06-20 12:13:22,129] Trial 336 finished with value: -1.555976495298792 and parameters: {'booster': 'gbtree', 'lambda': 2.220412917612362e-08, 'alpha': 0.0016770448659593363, 'subsample': 0.8263172178410635, 'colsample_bytree': 0.5302708443546564, 'max_depth': 4, 'min_child_weight': 8, 'eta': 0.05519844609269071, 'gamma': 3.7374797807579037}. Best is trial 164 with value: -1.5157670549647289.
[I 2025-06-20 12:13:22,491] Trial 337 finished with value: -1.5332848121698455 and parameters: {'booster': 'gbtree', 'lambda': 1.39596519905267e-08, 'alpha': 0.005834833786933655, 'subsample': 0.7670076639104024, 'colsample_bytree': 0.5000673764034442, 'max_depth': 3, 'min_child_weight': 3, 'eta': 0.06694449897898266, 'gamma': 2.839577867718437}. Best is trial 164 with value: -1.5157670549647289.
[I 2025-06-20 12:13:23,011] Trial 338 finished with value: -1.5898662750566184 and parameters: {'booster': 'gbtree', 'lambda': 4.200096788691014e-08, 'alpha': 0.004380192291474691, 'subsample': 0.7547534011357256, 'colsample_bytree': 0.5022255471985761, 'max_depth': 3, 'min_child_weight': 2, 'eta': 0.0684074279833034, 'gamma': 2.9352979070070204}. Best is trial 164 with value: -1.5157670549647289.
[I 2025-06-20 12:13:23,639] Trial 339 finished with value: -1.6026310171040334 and parameters: {'booster': 'gbtree', 'lambda': 1.3449908276961101e-08, 'alpha': 0.0025833342899659914, 'subsample': 0.7971487193860408, 'colsample_bytree': 0.5133003541971712, 'max_depth': 3, 'min_child_weight': 3, 'eta': 0.0898300231487618, 'gamma': 2.835135431874974}. Best is trial 164 with value: -1.5157670549647289.
[I 2025-06-20 12:13:24,373] Trial 340 finished with value: -1.5638277409058223 and parameters: {'booster': 'gbtree', 'lambda': 1.1502812939999652e-07, 'alpha': 0.005546477886232548, 'subsample': 0.7837055320761492, 'colsample_bytree': 0.5092882965580486, 'max_depth': 3, 'min_child_weight': 3, 'eta': 0.07121845048081492, 'gamma': 3.056974144987698}. Best is trial 164 with value: -1.5157670549647289.
[I 2025-06-20 12:13:25,003] Trial 341 finished with value: -1.554522332924838 and parameters: {'booster': 'gbtree', 'lambda': 2.9466401726187663e-08, 'alpha': 0.00602504218601313, 'subsample': 0.7641726459947202, 'colsample_bytree': 0.5208763007562146, 'max_depth': 3, 'min_child_weight': 2, 'eta': 0.06148309934479278, 'gamma': 2.845883031034182}. Best is trial 164 with value: -1.5157670549647289.
[I 2025-06-20 12:13:25,574] Trial 342 finished with value: -1.6022543969545442 and parameters: {'booster': 'gbtree', 'lambda': 2.0816206192079285e-08, 'alpha': 0.00026291380822804654, 'subsample': 0.738988467655742, 'colsample_bytree': 0.5010858631111262, 'max_depth': 3, 'min_child_weight': 3, 'eta': 0.07811832093859186, 'gamma': 2.7272223105849274}. Best is trial 164 with value: -1.5157670549647289.
[I 2025-06-20 12:13:26,133] Trial 343 finished with value: -1.5403506594086211 and parameters: {'booster': 'gbtree', 'lambda': 6.062676384615879e-08, 'alpha': 0.00015123063362965528, 'subsample': 0.7757715967482917, 'colsample_bytree': 0.5180372758148544, 'max_depth': 3, 'min_child_weight': 3, 'eta': 0.05081129674585083, 'gamma': 2.7699939537925613}. Best is trial 164 with value: -1.5157670549647289.
[I 2025-06-20 12:13:26,702] Trial 344 finished with value: -1.562239531450931 and parameters: {'booster': 'gbtree', 'lambda': 6.387762133591192e-08, 'alpha': 0.00014862054566087388, 'subsample': 0.7743603786234805, 'colsample_bytree': 0.5197302427847507, 'max_depth': 3, 'min_child_weight': 3, 'eta': 0.06490992759880637, 'gamma': 2.9356381007568797}. Best is trial 164 with value: -1.5157670549647289.
[I 2025-06-20 12:13:27,561] Trial 345 finished with value: -1.5698500055284896 and parameters: {'booster': 'gbtree', 'lambda': 4.1908342713908124e-08, 'alpha': 0.00015627584482325288, 'subsample': 0.755313772958821, 'colsample_bytree': 0.5093611058255384, 'max_depth': 3, 'min_child_weight': 3, 'eta': 0.05552749532530004, 'gamma': 2.755873285892282}. Best is trial 164 with value: -1.5157670549647289.
[I 2025-06-20 12:13:28,098] Trial 346 finished with value: -1.5456155347854772 and parameters: {'booster': 'gbtree', 'lambda': 1.0211407281339494e-08, 'alpha': 9.008577774618685e-05, 'subsample': 0.7664144644011918, 'colsample_bytree': 0.5260761001021388, 'max_depth': 3, 'min_child_weight': 3, 'eta': 0.07941521098215856, 'gamma': 2.7554829945119637}. Best is trial 164 with value: -1.5157670549647289.
[I 2025-06-20 12:13:28,736] Trial 347 finished with value: -1.5771661055464838 and parameters: {'booster': 'gbtree', 'lambda': 2.7939037645711412e-08, 'alpha': 0.0002872059374351135, 'subsample': 0.8037562286491569, 'colsample_bytree': 0.5360464165254677, 'max_depth': 3, 'min_child_weight': 3, 'eta': 0.04572997008071668, 'gamma': 2.6188171795042856}. Best is trial 164 with value: -1.5157670549647289.
[I 2025-06-20 12:13:29,292] Trial 348 finished with value: -1.586216029745795 and parameters: {'booster': 'gbtree', 'lambda': 1.568435579336128e-08, 'alpha': 6.57604450184184e-05, 'subsample': 0.7728266085345671, 'colsample_bytree': 0.5157679727206933, 'max_depth': 3, 'min_child_weight': 2, 'eta': 0.10012690641348276, 'gamma': 2.8018046401396393}. Best is trial 164 with value: -1.5157670549647289.
[I 2025-06-20 12:13:30,294] Trial 349 finished with value: -1.569085736484897 and parameters: {'booster': 'gbtree', 'lambda': 5.3477203169018766e-08, 'alpha': 0.0003903763299625224, 'subsample': 0.7938461476330536, 'colsample_bytree': 0.5248510996470401, 'max_depth': 3, 'min_child_weight': 3, 'eta': 0.051809651904992204, 'gamma': 2.5779115934147714}. Best is trial 164 with value: -1.5157670549647289.
[I 2025-06-20 12:13:31,045] Trial 350 finished with value: -1.543625038695058 and parameters: {'booster': 'gbtree', 'lambda': 2.2501678221600173e-08, 'alpha': 0.0002208796976829061, 'subsample': 0.7787899885588435, 'colsample_bytree': 0.5016274762269434, 'max_depth': 3, 'min_child_weight': 4, 'eta': 0.061830440493125444, 'gamma': 2.9319408044130117}. Best is trial 164 with value: -1.5157670549647289.
[I 2025-06-20 12:13:31,933] Trial 351 finished with value: -1.5798313618318378 and parameters: {'booster': 'gbtree', 'lambda': 1.4944765575532885e-08, 'alpha': 0.00010016735802977002, 'subsample': 0.7502621993458798, 'colsample_bytree': 0.5404988764745837, 'max_depth': 3, 'min_child_weight': 8, 'eta': 0.035105852284705454, 'gamma': 2.677562194254608}. Best is trial 164 with value: -1.5157670549647289.
[I 2025-06-20 12:13:32,603] Trial 352 finished with value: -1.5921002826050634 and parameters: {'booster': 'gbtree', 'lambda': 3.289608298623826e-08, 'alpha': 0.0013336764631156931, 'subsample': 0.7889209071536345, 'colsample_bytree': 0.5133004640157517, 'max_depth': 3, 'min_child_weight': 3, 'eta': 0.040155194694925136, 'gamma': 2.5219663833989525}. Best is trial 164 with value: -1.5157670549647289.
[I 2025-06-20 12:13:33,559] Trial 353 finished with value: -1.5521384091344814 and parameters: {'booster': 'gbtree', 'lambda': 1.989119165021184e-08, 'alpha': 0.00012657904533418422, 'subsample': 0.7648308447511543, 'colsample_bytree': 0.5343741371924037, 'max_depth': 4, 'min_child_weight': 7, 'eta': 0.06915980350408558, 'gamma': 3.69779628322211}. Best is trial 164 with value: -1.5157670549647289.
[I 2025-06-20 12:13:34,655] Trial 354 finished with value: -1.5607829185612447 and parameters: {'booster': 'gbtree', 'lambda': 6.930126377651114e-08, 'alpha': 0.0005960636480870633, 'subsample': 0.7270363149236424, 'colsample_bytree': 0.521109483878161, 'max_depth': 4, 'min_child_weight': 3, 'eta': 0.05639342583044908, 'gamma': 3.0136693468137037}. Best is trial 164 with value: -1.5157670549647289.
