[I 2025-06-20 12:05:26,120] Trial 95 finished with value: -1.5913045167845108 and parameters: {'booster': 'dart', 'lambda': 1.6651178909057198e-08, 'alpha': 1.3671890317198312e-06, 'subsample': 0.5072674657168974, 'colsample_bytree': 0.5582604573379186, 'max_depth': 5, 'min_child_weight': 7, 'eta': 0.03206711046693418, 'gamma': 2.758466791057367, 'rate_drop': 0.00040059245955476264, 'skip_drop': 6.918092514758959e-07}. Best is trial 33 with value: -1.544202524037621.
[I 2025-06-20 12:05:26,528] Trial 96 finished with value: -1.5774702256948887 and parameters: {'booster': 'gbtree', 'lambda': 3.48874750059717e-08, 'alpha': 1.9893501770860333e-05, 'subsample': 0.6192701931463528, 'colsample_bytree': 0.5167460019115289, 'max_depth': 5, 'min_child_weight': 8, 'eta': 0.04398731033804263, 'gamma': 2.515156139474613}. Best is trial 33 with value: -1.544202524037621.
[I 2025-06-20 12:05:33,162] Trial 97 finished with value: -1.5692547746289927 and parameters: {'booster': 'dart', 'lambda': 8.866871386253135e-08, 'alpha': 5.820273666410902e-06, 'subsample': 0.6517805214316943, 'colsample_bytree': 0.6398710548229251, 'max_depth': 4, 'min_child_weight': 6, 'eta': 0.03508087761983309, 'gamma': 2.330954549828196, 'rate_drop': 0.00015877499479680158, 'skip_drop': 2.12153965896315e-06}. Best is trial 33 with value: -1.544202524037621.
[I 2025-06-20 12:05:35,918] Trial 98 finished with value: -1.5799422829533167 and parameters: {'booster': 'dart', 'lambda': 1.6366970260700837e-08, 'alpha': 2.805189840274989e-05, 'subsample': 0.579588923057845, 'colsample_bytree': 0.5548756435407631, 'max_depth': 5, 'min_child_weight': 7, 'eta': 0.0554665006685157, 'gamma': 2.143299612613876, 'rate_drop': 0.0021544964278366087, 'skip_drop': 7.477439713016117e-06}. Best is trial 33 with value: -1.544202524037621.
[I 2025-06-20 12:05:38,877] Trial 99 finished with value: -1.557716615793971 and parameters: {'booster': 'dart', 'lambda': 1.8607609085435156e-07, 'alpha': 5.873184505277011e-05, 'subsample': 0.6422286960829835, 'colsample_bytree': 0.5327682591057017, 'max_depth': 4, 'min_child_weight': 8, 'eta': 0.06819917259547714, 'gamma': 2.8332179962973814, 'rate_drop': 0.001222233270308144, 'skip_drop': 2.7692971647098077e-07}. Best is trial 33 with value: -1.544202524037621.
[I 2025-06-20 12:05:42,894] Trial 100 finished with value: -1.5940089930564965 and parameters: {'booster': 'dart', 'lambda': 1.971022712014575e-07, 'alpha': 6.68233877326634e-05, 'subsample': 0.6081121056255383, 'colsample_bytree': 0.6898745656022796, 'max_depth': 4, 'min_child_weight': 8, 'eta': 0.07036512701136101, 'gamma': 3.0548526371951246, 'rate_drop': 0.0012844534189865007, 'skip_drop': 2.330886396787479e-07}. Best is trial 33 with value: -1.544202524037621.
[I 2025-06-20 12:05:52,116] Trial 101 finished with value: -1.5586194746568618 and parameters: {'booster': 'dart', 'lambda': 2.3812022620181806e-08, 'alpha': 3.3930891744982105e-05, 'subsample': 0.6449119149581591, 'colsample_bytree': 0.5298495594070148, 'max_depth': 4, 'min_child_weight': 8, 'eta': 0.038725263681862604, 'gamma': 2.6990215942016746, 'rate_drop': 0.004371094608687963, 'skip_drop': 5.3298546113523274e-08}. Best is trial 33 with value: -1.544202524037621.
[I 2025-06-20 12:06:01,305] Trial 102 finished with value: -1.605796077268767 and parameters: {'booster': 'dart', 'lambda': 2.5154082529673433e-08, 'alpha': 8.455318104157134e-06, 'subsample': 0.668152449036689, 'colsample_bytree': 0.5730606030173698, 'max_depth': 4, 'min_child_weight': 9, 'eta': 0.030937284811074325, 'gamma': 2.890385044591928, 'rate_drop': 0.013419982535795027, 'skip_drop': 2.695082400395547e-08}. Best is trial 33 with value: -1.544202524037621.
[I 2025-06-20 12:06:06,796] Trial 103 finished with value: -1.5235573851059487 and parameters: {'booster': 'dart', 'lambda': 1.7829572125383045e-08, 'alpha': 8.077239889602024e-05, 'subsample': 0.6939771826399944, 'colsample_bytree': 0.5420070212297171, 'max_depth': 4, 'min_child_weight': 8, 'eta': 0.04842344292271269, 'gamma': 2.720085405644389, 'rate_drop': 0.003509648654315891, 'skip_drop': 9.781262733708816e-08}. Best is trial 103 with value: -1.5235573851059487.
[I 2025-06-20 12:06:14,164] Trial 104 finished with value: -1.5322937898993219 and parameters: {'booster': 'dart', 'lambda': 1.6503922498838602e-08, 'alpha': 0.0005473783414651227, 'subsample': 0.691328652727298, 'colsample_bytree': 0.5107070798338892, 'max_depth': 4, 'min_child_weight': 8, 'eta': 0.047874692519285285, 'gamma': 2.722496427036575, 'rate_drop': 0.003908633906804883, 'skip_drop': 5.458385571416025e-08}. Best is trial 103 with value: -1.5235573851059487.
[I 2025-06-20 12:06:19,205] Trial 105 finished with value: -1.5790778834268306 and parameters: {'booster': 'dart', 'lambda': 1.2722322091931518e-08, 'alpha': 0.0005618111458962955, 'subsample': 0.6876108659034541, 'colsample_bytree': 0.5031483688314176, 'max_depth': 4, 'min_child_weight': 8, 'eta': 0.06430001834778049, 'gamma': 2.0407839047917578, 'rate_drop': 0.0034218005801934562, 'skip_drop': 5.607891242114081e-08}. Best is trial 103 with value: -1.5235573851059487.
[I 2025-06-20 12:06:23,236] Trial 106 finished with value: -1.5676453341189749 and parameters: {'booster': 'dart', 'lambda': 4.31224837852972e-08, 'alpha': 0.001345069888895601, 'subsample': 0.6974900352952692, 'colsample_bytree': 0.5254441451290697, 'max_depth': 4, 'min_child_weight': 8, 'eta': 0.08895813418647987, 'gamma': 2.8292487201501957, 'rate_drop': 0.006446082794168283, 'skip_drop': 2.084369357620927e-08}. Best is trial 103 with value: -1.5235573851059487.
[I 2025-06-20 12:06:32,290] Trial 107 finished with value: -1.5618771324241607 and parameters: {'booster': 'dart', 'lambda': 1.2749056729325446e-07, 'alpha': 0.0004372364556685974, 'subsample': 0.6797511673250344, 'colsample_bytree': 0.5403569924056071, 'max_depth': 4, 'min_child_weight': 9, 'eta': 0.048790279412262036, 'gamma': 2.680470241430692, 'rate_drop': 0.02437035956762592, 'skip_drop': 2.3689789153377153e-07}. Best is trial 103 with value: -1.5235573851059487.
[I 2025-06-20 12:06:41,308] Trial 108 finished with value: -1.6280346421190135 and parameters: {'booster': 'dart', 'lambda': 1.0583236883545536e-07, 'alpha': 0.0001433754074203287, 'subsample': 0.6772887968911903, 'colsample_bytree': 0.5397088904562856, 'max_depth': 4, 'min_child_weight': 10, 'eta': 0.05012396075186606, 'gamma': 2.4992214032001843, 'rate_drop': 0.04897731935077104, 'skip_drop': 3.094089332846874e-07}. Best is trial 103 with value: -1.5235573851059487.
[I 2025-06-20 12:06:50,485] Trial 109 finished with value: -1.6001082419064083 and parameters: {'booster': 'dart', 'lambda': 6.240294706212125e-08, 'alpha': 0.002404249876954007, 'subsample': 0.7033018912481743, 'colsample_bytree': 0.525257552710608, 'max_depth': 4, 'min_child_weight': 9, 'eta': 0.03996414397214922, 'gamma': 2.357401546513217, 'rate_drop': 0.026669322134643778, 'skip_drop': 6.786941106820225e-08}. Best is trial 103 with value: -1.5235573851059487.
[I 2025-06-20 12:06:50,987] Trial 110 finished with value: -1.5710148200662541 and parameters: {'booster': 'gbtree', 'lambda': 3.5056078439231085e-07, 'alpha': 0.028832337316903614, 'subsample': 0.7173351956001772, 'colsample_bytree': 0.505440631532942, 'max_depth': 5, 'min_child_weight': 9, 'eta': 0.046524685721091745, 'gamma': 3.014983246021417}. Best is trial 103 with value: -1.5235573851059487.
[I 2025-06-20 12:06:59,443] Trial 111 finished with value: -1.5874780081323867 and parameters: {'booster': 'dart', 'lambda': 3.3455581222329784e-08, 'alpha': 0.0004973200682626307, 'subsample': 0.6575716566343178, 'colsample_bytree': 0.9340903810313879, 'max_depth': 4, 'min_child_weight': 8, 'eta': 0.038098021450011434, 'gamma': 2.6851421647663907, 'rate_drop': 0.009810549140891234, 'skip_drop': 9.121570431291689e-08}. Best is trial 103 with value: -1.5235573851059487.
[I 2025-06-20 12:07:01,779] Trial 112 finished with value: -1.5710708273083143 and parameters: {'booster': 'dart', 'lambda': 1.348941126426043e-07, 'alpha': 7.771833768705675e-05, 'subsample': 0.6897548416810793, 'colsample_bytree': 0.5163223909950853, 'max_depth': 4, 'min_child_weight': 8, 'eta': 0.08025964818607452, 'gamma': 2.9503945280528687, 'rate_drop': 0.0028457463039162556, 'skip_drop': 3.18283948468604e-07}. Best is trial 103 with value: -1.5235573851059487.
[I 2025-06-20 12:07:08,270] Trial 113 finished with value: -1.5757449573040017 and parameters: {'booster': 'dart', 'lambda': 2.5481406522277073e-08, 'alpha': 0.00014330068706576118, 'subsample': 0.6696029845759253, 'colsample_bytree': 0.5456304614748304, 'max_depth': 4, 'min_child_weight': 9, 'eta': 0.046012379207018596, 'gamma': 2.7052281916411354, 'rate_drop': 0.0006355530499187141, 'skip_drop': 1.626819480990691e-07}. Best is trial 103 with value: -1.5235573851059487.
[I 2025-06-20 12:07:14,694] Trial 114 finished with value: -1.5745217324376206 and parameters: {'booster': 'dart', 'lambda': 1.396026447796874e-08, 'alpha': 4.6063631451725234e-05, 'subsample': 0.7254643113070776, 'colsample_bytree': 0.5114214288808194, 'max_depth': 4, 'min_child_weight': 10, 'eta': 0.06320936402514127, 'gamma': 3.3521612524081936, 'rate_drop': 0.0035191114568508806, 'skip_drop': 4.666380436244589e-08}. Best is trial 103 with value: -1.5235573851059487.
[I 2025-06-20 12:07:21,097] Trial 115 finished with value: -1.5586906725868699 and parameters: {'booster': 'dart', 'lambda': 5.6786494267384e-08, 'alpha': 0.0010561530295916666, 'subsample': 0.6322920109116257, 'colsample_bytree': 0.5270632084190037, 'max_depth': 4, 'min_child_weight': 9, 'eta': 0.07331571793678285, 'gamma': 2.50584193402417, 'rate_drop': 0.0017974736939363831, 'skip_drop': 1.117514255425698e-08}. Best is trial 103 with value: -1.5235573851059487.
[I 2025-06-20 12:07:24,853] Trial 116 finished with value: -1.580583153277505 and parameters: {'booster': 'dart', 'lambda': 8.503123136587366e-07, 'alpha': 0.0003259968646409483, 'subsample': 0.6316276361831059, 'colsample_bytree': 0.5280962067026505, 'max_depth': 4, 'min_child_weight': 9, 'eta': 0.0737263184825736, 'gamma': 2.47604184843629, 'rate_drop': 0.004950299779257014, 'skip_drop': 1.2135706566830371e-08}. Best is trial 103 with value: -1.5235573851059487.
[I 2025-06-20 12:07:31,970] Trial 117 finished with value: -1.9801890967736084 and parameters: {'booster': 'dart', 'lambda': 6.612342119280276e-08, 'alpha': 0.001029372213730877, 'subsample': 0.6763637535474099, 'colsample_bytree': 0.5001167780906834, 'max_depth': 4, 'min_child_weight': 9, 'eta': 0.051648719399100214, 'gamma': 2.6359707732356976, 'rate_drop': 0.4764357130795957, 'skip_drop': 3.989922712477941e-08}. Best is trial 103 with value: -1.5235573851059487.
[I 2025-06-20 12:07:37,026] Trial 118 finished with value: -1.5381342211468687 and parameters: {'booster': 'dart', 'lambda': 9.502108440236532e-08, 'alpha': 0.0035342541565707296, 'subsample': 0.6949813562156465, 'colsample_bytree': 0.543975479532921, 'max_depth': 4, 'min_child_weight': 8, 'eta': 0.057724498550240644, 'gamma': 2.8476152253307974, 'rate_drop': 0.0016533964469968433, 'skip_drop': 1.2028415144125793e-06}. Best is trial 103 with value: -1.5235573851059487.
[I 2025-06-20 12:07:43,110] Trial 119 finished with value: -1.5742128496502403 and parameters: {'booster': 'dart', 'lambda': 1.8444005544427137e-07, 'alpha': 0.004717705336868628, 'subsample': 0.7002972473827301, 'colsample_bytree': 0.623933229781456, 'max_depth': 4, 'min_child_weight': 8, 'eta': 0.06822147669287755, 'gamma': 3.0789886553251393, 'rate_drop': 0.0017855725924270163, 'skip_drop': 3.3131975018979445e-08}. Best is trial 103 with value: -1.5235573851059487.
[I 2025-06-20 12:07:44,289] Trial 120 finished with value: -1.5970813043344971 and parameters: {'booster': 'dart', 'lambda': 8.150835243635376e-08, 'alpha': 0.001967089796124804, 'subsample': 0.6549195105358777, 'colsample_bytree': 0.5299598448952912, 'max_depth': 5, 'min_child_weight': 8, 'eta': 0.09154381412446568, 'gamma': 2.2704674500150586, 'rate_drop': 0.0009660491180348931, 'skip_drop': 1.7336481487469465e-08}. Best is trial 103 with value: -1.5235573851059487.
[I 2025-06-20 12:07:51,088] Trial 121 finished with value: -1.5575516880989244 and parameters: {'booster': 'dart', 'lambda': 4.9155575028498967e-08, 'alpha': 0.015696860760931228, 'subsample': 0.7461181001378266, 'colsample_bytree': 0.5439678159989367, 'max_depth': 4, 'min_child_weight': 8, 'eta': 0.058170889833283126, 'gamma': 2.8989112569522755, 'rate_drop': 0.0075901024943022845, 'skip_drop': 9.612693777303787e-07}. Best is trial 103 with value: -1.5235573851059487.
[I 2025-06-20 12:07:57,961] Trial 122 finished with value: -1.5546958755681064 and parameters: {'booster': 'dart', 'lambda': 4.430796522573829e-08, 'alpha': 0.02498349206998421, 'subsample': 0.7499967181380145, 'colsample_bytree': 0.5162142087183413, 'max_depth': 4, 'min_child_weight': 8, 'eta': 0.05644276115629159, 'gamma': 2.869085034027637, 'rate_drop': 0.01433106695666075, 'skip_drop': 1.1286780481683824e-06}. Best is trial 103 with value: -1.5235573851059487.
[I 2025-06-20 12:08:04,814] Trial 123 finished with value: -1.5721203360277611 and parameters: {'booster': 'dart', 'lambda': 1.063455068749399e-08, 'alpha': 0.013875821012646686, 'subsample': 0.7548791220789348, 'colsample_bytree': 0.5163807604089115, 'max_depth': 4, 'min_child_weight': 8, 'eta': 0.05775966231132039, 'gamma': 2.8443597150216653, 'rate_drop': 0.01451232371129471, 'skip_drop': 3.196002123094356e-06}. Best is trial 103 with value: -1.5235573851059487.
[I 2025-06-20 12:08:13,438] Trial 124 finished with value: -1.5570466017620208 and parameters: {'booster': 'dart', 'lambda': 3.5845313901605114e-08, 'alpha': 0.009161422154451829, 'subsample': 0.7337382014114047, 'colsample_bytree': 0.5483018372230513, 'max_depth': 4, 'min_child_weight': 8, 'eta': 0.04212738896498298, 'gamma': 2.9898892658766743, 'rate_drop': 0.0072829968913220855, 'skip_drop': 1.162294162682026e-06}. Best is trial 103 with value: -1.5235573851059487.
[I 2025-06-20 12:08:22,740] Trial 125 finished with value: -1.54647938090733 and parameters: {'booster': 'dart', 'lambda': 3.4036041741564505e-08, 'alpha': 0.010647828003819276, 'subsample': 0.7798688082231128, 'colsample_bytree': 0.5712889472062443, 'max_depth': 4, 'min_child_weight': 8, 'eta': 0.05516533480867437, 'gamma': 3.187380873316721, 'rate_drop': 0.008882665802180742, 'skip_drop': 8.789585092492666e-07}. Best is trial 103 with value: -1.5235573851059487.
[I 2025-06-20 12:08:32,148] Trial 126 finished with value: -1.6190481943516044 and parameters: {'booster': 'dart', 'lambda': 3.6681227730779415e-08, 'alpha': 0.009547473780715241, 'subsample': 0.7824154036246191, 'colsample_bytree': 0.6009113129266417, 'max_depth': 5, 'min_child_weight': 8, 'eta': 0.04196877918057098, 'gamma': 3.149308087774344, 'rate_drop': 0.042921669393079113, 'skip_drop': 1.0873738293016437e-06}. Best is trial 103 with value: -1.5235573851059487.
[I 2025-06-20 12:08:39,591] Trial 127 finished with value: -1.5407029707134152 and parameters: {'booster': 'dart', 'lambda': 1.568428785843723e-08, 'alpha': 0.018951632324897615, 'subsample': 0.7672394629988529, 'colsample_bytree': 0.5609107038086848, 'max_depth': 4, 'min_child_weight': 5, 'eta': 0.05498777143873591, 'gamma': 3.4293609594756256, 'rate_drop': 0.007142798174002949, 'skip_drop': 1.1899879006618046e-06}. Best is trial 103 with value: -1.5235573851059487.
[I 2025-06-20 12:08:46,431] Trial 128 finished with value: -1.5518858154371 and parameters: {'booster': 'dart', 'lambda': 3.052765301929585e-08, 'alpha': 0.01946043072076726, 'subsample': 0.7686005044311128, 'colsample_bytree': 0.5687921650053301, 'max_depth': 4, 'min_child_weight': 5, 'eta': 0.044054044610791716, 'gamma': 3.4304985843356306, 'rate_drop': 0.010131530279968352, 'skip_drop': 3.812666126183134e-07}. Best is trial 103 with value: -1.5235573851059487.
[I 2025-06-20 12:08:55,570] Trial 129 finished with value: -1.5683895916016548 and parameters: {'booster': 'dart', 'lambda': 1.576118607470048e-08, 'alpha': 0.04095356668953996, 'subsample': 0.811401895328826, 'colsample_bytree': 0.56992899223479, 'max_depth': 3, 'min_child_weight': 5, 'eta': 0.053867559746882336, 'gamma': 3.430407639643931, 'rate_drop': 0.011665135280319433, 'skip_drop': 4.325806590527309e-07}. Best is trial 103 with value: -1.5235573851059487.
[I 2025-06-20 12:09:04,710] Trial 130 finished with value: -1.5395632575062745 and parameters: {'booster': 'dart', 'lambda': 1.0351952320760826e-08, 'alpha': 0.006419588287536559, 'subsample': 0.7914284046531025, 'colsample_bytree': 0.5784393413808246, 'max_depth': 4, 'min_child_weight': 5, 'eta': 0.06324929586565953, 'gamma': 3.3238570661476006, 'rate_drop': 0.016616792982175645, 'skip_drop': 1.5203823725221379e-06}. Best is trial 103 with value: -1.5235573851059487.
[I 2025-06-20 12:09:14,146] Trial 131 finished with value: -1.591659382539084 and parameters: {'booster': 'dart', 'lambda': 1.8177656834295188e-08, 'alpha': 0.08258288169264232, 'subsample': 0.7929628733002403, 'colsample_bytree': 0.5822759214653402, 'max_depth': 4, 'min_child_weight': 5, 'eta': 0.04675451457019535, 'gamma': 3.3169227606003293, 'rate_drop': 0.030483451931121362, 'skip_drop': 4.7024081373796395e-07}. Best is trial 103 with value: -1.5235573851059487.
[I 2025-06-20 12:09:23,114] Trial 132 finished with value: -1.619179131506341 and parameters: {'booster': 'dart', 'lambda': 1.110800004883591e-08, 'alpha': 0.026515408154119787, 'subsample': 0.770754788816156, 'colsample_bytree': 0.5642377989617203, 'max_depth': 4, 'min_child_weight': 5, 'eta': 0.08025506597880196, 'gamma': 3.441458977995376, 'rate_drop': 0.10060895696424228, 'skip_drop': 1.3073433025778913e-06}. Best is trial 103 with value: -1.5235573851059487.
[I 2025-06-20 12:09:30,598] Trial 133 finished with value: -1.5884620196708987 and parameters: {'booster': 'dart', 'lambda': 2.8406010119593726e-08, 'alpha': 0.02212774794061865, 'subsample': 0.8351359324073349, 'colsample_bytree': 0.5963958755786093, 'max_depth': 4, 'min_child_weight': 4, 'eta': 0.0620520875247478, 'gamma': 3.5273184298174693, 'rate_drop': 0.018908260812350954, 'skip_drop': 1.6938326044150962e-06}. Best is trial 103 with value: -1.5235573851059487.
[I 2025-06-20 12:09:38,836] Trial 134 finished with value: -1.5659913714638265 and parameters: {'booster': 'dart', 'lambda': 1.8832796692406522e-08, 'alpha': 0.007195865904873754, 'subsample': 0.7587932373215578, 'colsample_bytree': 0.6173220012249782, 'max_depth': 4, 'min_child_weight': 5, 'eta': 0.05221016371615801, 'gamma': 3.181489567052145, 'rate_drop': 0.005597675555420269, 'skip_drop': 5.126862658850126e-07}. Best is trial 103 with value: -1.5235573851059487.
[I 2025-06-20 12:09:48,001] Trial 135 finished with value: -1.5637836218243908 and parameters: {'booster': 'dart', 'lambda': 7.863875237720906e-08, 'alpha': 0.004095509981291891, 'subsample': 0.784049306529526, 'colsample_bytree': 0.5697018202138093, 'max_depth': 4, 'min_child_weight': 5, 'eta': 0.04542574643909034, 'gamma': 3.7196609860428973, 'rate_drop': 0.0150995116811798, 'skip_drop': 3.6420296454802155e-06}. Best is trial 103 with value: -1.5235573851059487.
[I 2025-06-20 12:09:48,433] Trial 136 finished with value: -2.0892754128309816 and parameters: {'booster': 'gbtree', 'lambda': 0.0017497596635292461, 'alpha': 0.012914375207493707, 'subsample': 0.7447526568193077, 'colsample_bytree': 0.5879380226992157, 'max_depth': 4, 'min_child_weight': 4, 'eta': 0.0015128339444238357, 'gamma': 0.5505562734887586}. Best is trial 103 with value: -1.5235573851059487.
[I 2025-06-20 12:09:57,304] Trial 137 finished with value: -1.646953678343634 and parameters: {'booster': 'dart', 'lambda': 0.014333072437513136, 'alpha': 0.0639168991795747, 'subsample': 0.7649996950969782, 'colsample_bytree': 0.5794261424962986, 'max_depth': 4, 'min_child_weight': 5, 'eta': 0.035688767970287916, 'gamma': 3.0943611468267753, 'rate_drop': 0.050242399184344554, 'skip_drop': 1.6415575418598402e-07}. Best is trial 103 with value: -1.5235573851059487.
[I 2025-06-20 12:09:58,496] Trial 138 finished with value: -1.5842357717637399 and parameters: {'booster': 'dart', 'lambda': 1.1704830075203906e-08, 'alpha': 0.006212280087314996, 'subsample': 0.8047554352358849, 'colsample_bytree': 0.5572276409966606, 'max_depth': 4, 'min_child_weight': 5, 'eta': 0.10801886030598935, 'gamma': 3.286449113623744, 'rate_drop': 0.0101070606589126, 'skip_drop': 7.471470958601947e-07}. Best is trial 103 with value: -1.5235573851059487.
[I 2025-06-20 12:10:03,318] Trial 139 finished with value: -1.5657801542294238 and parameters: {'booster': 'dart', 'lambda': 6.126512716257028e-06, 'alpha': 0.15723439807513023, 'subsample': 0.712587776756171, 'colsample_bytree': 0.6027280164431291, 'max_depth': 3, 'min_child_weight': 6, 'eta': 0.060379708063427254, 'gamma': 3.0284559100528585, 'rate_drop': 0.002652184010184388, 'skip_drop': 5.384431202751221e-06}. Best is trial 103 with value: -1.5235573851059487.
[I 2025-06-20 12:10:06,649] Trial 140 finished with value: -1.6359414691187613 and parameters: {'booster': 'dart', 'lambda': 0.0011053467635495616, 'alpha': 0.00345400474272066, 'subsample': 0.7767600953019693, 'colsample_bytree': 0.8102161394457281, 'max_depth': 5, 'min_child_weight': 5, 'eta': 0.05440603061478245, 'gamma': 3.6242512954815855, 'rate_drop': 0.00904843760024689, 'skip_drop': 2.3879982624351777e-06}. Best is trial 103 with value: -1.5235573851059487.
[I 2025-06-20 12:10:15,369] Trial 141 finished with value: -1.556485194943471 and parameters: {'booster': 'dart', 'lambda': 3.3905240935153274e-08, 'alpha': 0.038028958446127435, 'subsample': 0.7307035007946994, 'colsample_bytree': 0.5509580910303599, 'max_depth': 4, 'min_child_weight': 5, 'eta': 0.04194707637948935, 'gamma': 2.9489929152545966, 'rate_drop': 0.007525934386926741, 'skip_drop': 1.542164586300015e-06}. Best is trial 103 with value: -1.5235573851059487.
