[I 2025-06-20 12:10:24,567] Trial 142 finished with value: -1.5593684549679536 and parameters: {'booster': 'dart', 'lambda': 2.8061707519357096e-08, 'alpha': 0.04016825684869601, 'subsample': 0.7315615103094019, 'colsample_bytree': 0.550886917892174, 'max_depth': 4, 'min_child_weight': 5, 'eta': 0.04198507416772835, 'gamma': 3.2070034102409473, 'rate_drop': 0.016951691893106205, 'skip_drop': 3.0593758151558785e-06}. Best is trial 103 with value: -1.5235573851059487.
[I 2025-06-20 12:10:33,753] Trial 143 finished with value: -1.548058388466273 and parameters: {'booster': 'dart', 'lambda': 1.696524478511768e-08, 'alpha': 0.020164937506525028, 'subsample': 0.7437632900692146, 'colsample_bytree': 0.5728535585028444, 'max_depth': 4, 'min_child_weight': 6, 'eta': 0.03803361194388092, 'gamma': 3.405868444531582, 'rate_drop': 0.004330117131177699, 'skip_drop': 9.240021072817263e-07}. Best is trial 103 with value: -1.5235573851059487.
[I 2025-06-20 12:10:42,941] Trial 144 finished with value: -1.5560451831890065 and parameters: {'booster': 'dart', 'lambda': 1.6992927457545498e-08, 'alpha': 0.019297392846377333, 'subsample': 0.7422018154379769, 'colsample_bytree': 0.634731785791119, 'max_depth': 4, 'min_child_weight': 6, 'eta': 0.036458041620442645, 'gamma': 3.3586202414139747, 'rate_drop': 0.003970832498316639, 'skip_drop': 1.9315475016653613e-05}. Best is trial 103 with value: -1.5235573851059487.
[I 2025-06-20 12:10:50,055] Trial 145 finished with value: -1.5815563643674224 and parameters: {'booster': 'dart', 'lambda': 1.0231713508654901e-08, 'alpha': 0.011440974631305367, 'subsample': 0.8226951514456089, 'colsample_bytree': 0.5927702375062028, 'max_depth': 4, 'min_child_weight': 6, 'eta': 0.049033868425316623, 'gamma': 3.5283269912128685, 'rate_drop': 0.0006826570807321762, 'skip_drop': 8.482550980631223e-07}. Best is trial 103 with value: -1.5235573851059487.
[I 2025-06-20 12:10:52,363] Trial 146 finished with value: -1.6191250610468473 and parameters: {'booster': 'dart', 'lambda': 4.599975244643765e-08, 'alpha': 0.022291309457925405, 'subsample': 0.7529281046361781, 'colsample_bytree': 0.5742339232766535, 'max_depth': 4, 'min_child_weight': 6, 'eta': 0.0649308164028363, 'gamma': 3.911563752798848, 'rate_drop': 8.245425916437524e-05, 'skip_drop': 5.235459015946761e-07}. Best is trial 103 with value: -1.5235573851059487.
[I 2025-06-20 12:11:01,839] Trial 147 finished with value: -1.5762184513525372 and parameters: {'booster': 'dart', 'lambda': 1.7298444511253272e-05, 'alpha': 0.0029111059725315685, 'subsample': 0.7992185573542916, 'colsample_bytree': 0.56254868867057, 'max_depth': 4, 'min_child_weight': 6, 'eta': 0.028828412660620174, 'gamma': 3.26381419832408, 'rate_drop': 5.7808713999796904e-08, 'skip_drop': 9.239962441789745e-08}. Best is trial 103 with value: -1.5235573851059487.
[I 2025-06-20 12:11:11,259] Trial 148 finished with value: -1.5930207767143838 and parameters: {'booster': 'dart', 'lambda': 5.5069654044260026e-05, 'alpha': 0.006321861625896349, 'subsample': 0.7896810964422418, 'colsample_bytree': 0.6112949364778761, 'max_depth': 4, 'min_child_weight': 4, 'eta': 0.0555726994847188, 'gamma': 3.1499958321804082, 'rate_drop': 0.033839844688782726, 'skip_drop': 0.002545505909001435}. Best is trial 103 with value: -1.5235573851059487.
[I 2025-06-20 12:11:20,692] Trial 149 finished with value: -1.552808657127876 and parameters: {'booster': 'dart', 'lambda': 9.410118019183573e-08, 'alpha': 0.00906261923226462, 'subsample': 0.7661930482258364, 'colsample_bytree': 0.5390932044837321, 'max_depth': 5, 'min_child_weight': 6, 'eta': 0.037737912309430376, 'gamma': 3.4137263612904, 'rate_drop': 0.004532368703979729, 'skip_drop': 1.5742748566378535e-07}. Best is trial 103 with value: -1.5235573851059487.
[I 2025-06-20 12:11:30,513] Trial 150 finished with value: -1.5673096504125976 and parameters: {'booster': 'dart', 'lambda': 1.1445482185044338e-07, 'alpha': 0.004803754599435491, 'subsample': 0.762321789288987, 'colsample_bytree': 0.5796482499514, 'max_depth': 5, 'min_child_weight': 6, 'eta': 0.02238832647911566, 'gamma': 3.460419722103604, 'rate_drop': 0.005139523951031522, 'skip_drop': 1.5036353801374856e-07}. Best is trial 103 with value: -1.5235573851059487.
[I 2025-06-20 12:11:39,083] Trial 151 finished with value: -1.5463260625040183 and parameters: {'booster': 'dart', 'lambda': 0.027893102213294507, 'alpha': 0.010896559096168261, 'subsample': 0.7701524673449677, 'colsample_bytree': 0.5370336299605917, 'max_depth': 4, 'min_child_weight': 6, 'eta': 0.037659206517736965, 'gamma': 3.3685942805421965, 'rate_drop': 0.0020705863390884463, 'skip_drop': 6.379843268056743e-07}. Best is trial 103 with value: -1.5235573851059487.
[I 2025-06-20 12:11:48,230] Trial 152 finished with value: -1.5451498589385864 and parameters: {'booster': 'dart', 'lambda': 8.520925439371433e-08, 'alpha': 0.010739322891310809, 'subsample': 0.7743854125099262, 'colsample_bytree': 0.5379938552827597, 'max_depth': 4, 'min_child_weight': 6, 'eta': 0.03354273019574458, 'gamma': 3.7685311240878585, 'rate_drop': 0.0037740265966285645, 'skip_drop': 3.6826579415714514e-07}. Best is trial 103 with value: -1.5235573851059487.
[I 2025-06-20 12:11:57,605] Trial 153 finished with value: -1.5897088629207037 and parameters: {'booster': 'dart', 'lambda': 8.965173359701229e-08, 'alpha': 0.014144285591209827, 'subsample': 0.7774320011325452, 'colsample_bytree': 0.5141450671261413, 'max_depth': 7, 'min_child_weight': 6, 'eta': 0.03734893124603831, 'gamma': 4.11406821495281, 'rate_drop': 0.0026975537918198064, 'skip_drop': 6.093670735596246e-07}. Best is trial 103 with value: -1.5235573851059487.
[I 2025-06-20 12:12:06,901] Trial 154 finished with value: -1.573359146642488 and parameters: {'booster': 'dart', 'lambda': 0.026685311514698443, 'alpha': 0.009367471128573404, 'subsample': 0.7694695212691529, 'colsample_bytree': 0.534883862133726, 'max_depth': 4, 'min_child_weight': 5, 'eta': 0.026837928973258665, 'gamma': 3.7878964562538453, 'rate_drop': 0.0016192581822289803, 'skip_drop': 3.6751719912903494e-07}. Best is trial 103 with value: -1.5235573851059487.
[I 2025-06-20 12:12:16,388] Trial 155 finished with value: -1.5476587733535188 and parameters: {'booster': 'dart', 'lambda': 2.8073521179675837e-07, 'alpha': 0.002134349713710475, 'subsample': 0.7501291944251607, 'colsample_bytree': 0.5618532509992243, 'max_depth': 6, 'min_child_weight': 6, 'eta': 0.045371005685930825, 'gamma': 3.5684238233452463, 'rate_drop': 0.003733943832500157, 'skip_drop': 1.6540123713608344e-07}. Best is trial 103 with value: -1.5235573851059487.
[I 2025-06-20 12:12:21,180] Trial 156 finished with value: -1.5584471386631789 and parameters: {'booster': 'dart', 'lambda': 5.420890753541835e-08, 'alpha': 0.001957940064498173, 'subsample': 0.7498439019193255, 'colsample_bytree': 0.5639935401451963, 'max_depth': 6, 'min_child_weight': 6, 'eta': 0.04449188640997694, 'gamma': 3.644936376512987, 'rate_drop': 0.004654643533948578, 'skip_drop': 1.3793287633466327e-07}. Best is trial 103 with value: -1.5235573851059487.
[I 2025-06-20 12:12:28,272] Trial 157 finished with value: -1.5912291218170405 and parameters: {'booster': 'dart', 'lambda': 4.5970853497315473e-07, 'alpha': 0.0014354551128830495, 'subsample': 0.7871608960979547, 'colsample_bytree': 0.5450894546832373, 'max_depth': 5, 'min_child_weight': 5, 'eta': 0.03905190131452693, 'gamma': 3.5752552764399823, 'rate_drop': 0.0022083096460095743, 'skip_drop': 1.9613853011475176e-07}. Best is trial 103 with value: -1.5235573851059487.
[I 2025-06-20 12:12:31,977] Trial 158 finished with value: -1.6002174317105324 and parameters: {'booster': 'dart', 'lambda': 7.83275165739735e-08, 'alpha': 0.02938041741872789, 'subsample': 0.8139634709185435, 'colsample_bytree': 0.5399282660528503, 'max_depth': 5, 'min_child_weight': 6, 'eta': 0.048555018023211285, 'gamma': 3.3923106828716696, 'rate_drop': 0.0038683862259794735, 'skip_drop': 1.1441318856691305e-07}. Best is trial 103 with value: -1.5235573851059487.
[I 2025-06-20 12:12:32,353] Trial 159 finished with value: -1.5458084850808003 and parameters: {'booster': 'gbtree', 'lambda': 2.0953506077067587e-07, 'alpha': 0.0031019209563754994, 'subsample': 0.7707034835892405, 'colsample_bytree': 0.5577692396455178, 'max_depth': 4, 'min_child_weight': 6, 'eta': 0.070389223060855, 'gamma': 3.7034422165602496}. Best is trial 103 with value: -1.5235573851059487.
[I 2025-06-20 12:12:32,558] Trial 160 finished with value: -1.58679688126112 and parameters: {'booster': 'gbtree', 'lambda': 2.5889351528871505e-07, 'alpha': 0.0031432063712235492, 'subsample': 0.7963074405053392, 'colsample_bytree': 0.555291081767571, 'max_depth': 5, 'min_child_weight': 6, 'eta': 0.07400360749208561, 'gamma': 3.84789157046498}. Best is trial 103 with value: -1.5235573851059487.
[I 2025-06-20 12:12:32,903] Trial 161 finished with value: -1.5230259639523342 and parameters: {'booster': 'gbtree', 'lambda': 2.51074564940927e-08, 'alpha': 0.005688554697216366, 'subsample': 0.7711169189468491, 'colsample_bytree': 0.5695504273822514, 'max_depth': 4, 'min_child_weight': 6, 'eta': 0.06058825615087848, 'gamma': 3.5272122835076964}. Best is trial 161 with value: -1.5230259639523342.
[I 2025-06-20 12:12:33,166] Trial 162 finished with value: -1.567435442415943 and parameters: {'booster': 'gbtree', 'lambda': 2.4789299484464333e-08, 'alpha': 0.0007648623637557056, 'subsample': 0.7772224600386604, 'colsample_bytree': 0.5705509321455399, 'max_depth': 4, 'min_child_weight': 6, 'eta': 0.06741350994906069, 'gamma': 3.714573472345954}. Best is trial 161 with value: -1.5230259639523342.
[I 2025-06-20 12:12:33,440] Trial 163 finished with value: -1.5421324603836528 and parameters: {'booster': 'gbtree', 'lambda': 6.503165913898247e-07, 'alpha': 0.006564629055319597, 'subsample': 0.7643196917762625, 'colsample_bytree': 0.5594171238195179, 'max_depth': 4, 'min_child_weight': 6, 'eta': 0.0629893212311128, 'gamma': 3.5317251538556267}. Best is trial 161 with value: -1.5230259639523342.
[I 2025-06-20 12:12:33,776] Trial 164 finished with value: -1.5157670549647289 and parameters: {'booster': 'gbtree', 'lambda': 1.5993897256570317e-07, 'alpha': 0.005471372950546692, 'subsample': 0.7596710440384961, 'colsample_bytree': 0.5848805012129601, 'max_depth': 4, 'min_child_weight': 6, 'eta': 0.0779567942528632, 'gamma': 3.9808380603128763}. Best is trial 164 with value: -1.5157670549647289.
[I 2025-06-20 12:12:34,073] Trial 165 finished with value: -1.5460239598438068 and parameters: {'booster': 'gbtree', 'lambda': 2.396472149551746e-07, 'alpha': 0.0044336840052525495, 'subsample': 0.7605808527922584, 'colsample_bytree': 0.5791274335756991, 'max_depth': 4, 'min_child_weight': 6, 'eta': 0.08355215615327609, 'gamma': 3.738096450608045}. Best is trial 164 with value: -1.5157670549647289.
[I 2025-06-20 12:12:34,298] Trial 166 finished with value: -1.5621930018664532 and parameters: {'booster': 'gbtree', 'lambda': 2.6743984348516796e-07, 'alpha': 0.0045929130030292155, 'subsample': 0.7837923735610647, 'colsample_bytree': 0.5862732041032356, 'max_depth': 4, 'min_child_weight': 6, 'eta': 0.0817514665101809, 'gamma': 3.99943992171554}. Best is trial 164 with value: -1.5157670549647289.
[I 2025-06-20 12:12:34,569] Trial 167 finished with value: -1.5703027305413646 and parameters: {'booster': 'gbtree', 'lambda': 7.054653374705462e-07, 'alpha': 0.0027814770792776947, 'subsample': 0.7593522975328221, 'colsample_bytree': 0.5947077451815895, 'max_depth': 4, 'min_child_weight': 6, 'eta': 0.09781709829905166, 'gamma': 3.9143686485449045}. Best is trial 164 with value: -1.5157670549647289.
[I 2025-06-20 12:12:34,753] Trial 168 finished with value: -1.5694934842762582 and parameters: {'booster': 'gbtree', 'lambda': 4.057166220975546e-07, 'alpha': 0.006103499250796936, 'subsample': 0.8015474795307961, 'colsample_bytree': 0.5787296563349907, 'max_depth': 4, 'min_child_weight': 6, 'eta': 0.08495771953950466, 'gamma': 3.7646320878986304}. Best is trial 164 with value: -1.5157670549647289.
[I 2025-06-20 12:12:35,046] Trial 169 finished with value: -1.559461581875728 and parameters: {'booster': 'gbtree', 'lambda': 1.6965766442486174e-07, 'alpha': 0.00687341563305242, 'subsample': 0.7573698124143349, 'colsample_bytree': 0.5624843097157517, 'max_depth': 4, 'min_child_weight': 6, 'eta': 0.06411233988723833, 'gamma': 3.566618517116446}. Best is trial 164 with value: -1.5157670549647289.
[I 2025-06-20 12:12:35,321] Trial 170 finished with value: -1.5484444716326404 and parameters: {'booster': 'gbtree', 'lambda': 6.515495888648696e-07, 'alpha': 0.001969951882487777, 'subsample': 0.7728437620433438, 'colsample_bytree': 0.5862730409871367, 'max_depth': 4, 'min_child_weight': 6, 'eta': 0.06990966057439672, 'gamma': 4.036912836880447}. Best is trial 164 with value: -1.5157670549647289.
[I 2025-06-20 12:12:35,590] Trial 171 finished with value: -1.5454671985194146 and parameters: {'booster': 'gbtree', 'lambda': 1.7048219483024545e-06, 'alpha': 0.00350309212391914, 'subsample': 0.7734625330201071, 'colsample_bytree': 0.5850615999432667, 'max_depth': 4, 'min_child_weight': 6, 'eta': 0.07336819590505288, 'gamma': 4.0456790053195695}. Best is trial 164 with value: -1.5157670549647289.
[I 2025-06-20 12:12:35,832] Trial 172 finished with value: -1.6112708071565063 and parameters: {'booster': 'gbtree', 'lambda': 1.624094867426007e-06, 'alpha': 0.0037923936255613564, 'subsample': 0.7433560523620086, 'colsample_bytree': 0.5753247049649394, 'max_depth': 4, 'min_child_weight': 6, 'eta': 0.07445980673553755, 'gamma': 3.6746008922353925}. Best is trial 164 with value: -1.5157670549647289.
[I 2025-06-20 12:12:36,012] Trial 173 finished with value: -1.6280285112336443 and parameters: {'booster': 'gbtree', 'lambda': 1.1105012975781078e-06, 'alpha': 0.011772742359035719, 'subsample': 0.7908466720027281, 'colsample_bytree': 0.556559879683899, 'max_depth': 4, 'min_child_weight': 6, 'eta': 0.09246038267453652, 'gamma': 4.130329778280659}. Best is trial 164 with value: -1.5157670549647289.
[I 2025-06-20 12:12:36,329] Trial 174 finished with value: -1.5454025688241029 and parameters: {'booster': 'gbtree', 'lambda': 2.496149500569304e-07, 'alpha': 0.0043764662913481234, 'subsample': 0.7644855052812629, 'colsample_bytree': 0.8600359384424379, 'max_depth': 4, 'min_child_weight': 6, 'eta': 0.06027509684199973, 'gamma': 4.219152373216235}. Best is trial 164 with value: -1.5157670549647289.
[I 2025-06-20 12:12:36,542] Trial 175 finished with value: -1.6142698185982722 and parameters: {'booster': 'gbtree', 'lambda': 2.940923406963303e-07, 'alpha': 0.0014983368887139502, 'subsample': 0.7777293122031901, 'colsample_bytree': 0.9047009079059927, 'max_depth': 4, 'min_child_weight': 6, 'eta': 0.06283169612614932, 'gamma': 4.2258702044912315}. Best is trial 164 with value: -1.5157670549647289.
[I 2025-06-20 12:12:36,705] Trial 176 finished with value: -1.5554865942272909 and parameters: {'booster': 'gbtree', 'lambda': 1.3049067907632982e-07, 'alpha': 0.0023450849999759296, 'subsample': 0.7639964780812581, 'colsample_bytree': 0.9893023192801562, 'max_depth': 4, 'min_child_weight': 6, 'eta': 0.13920852896212188, 'gamma': 4.33506086104881}. Best is trial 164 with value: -1.5157670549647289.
[I 2025-06-20 12:12:36,909] Trial 177 finished with value: -1.6111473631852378 and parameters: {'booster': 'gbtree', 'lambda': 2.2436264277695273e-07, 'alpha': 0.0041719389395131305, 'subsample': 0.7526350143319869, 'colsample_bytree': 0.8439933965492564, 'max_depth': 4, 'min_child_weight': 6, 'eta': 0.08001185456838804, 'gamma': 3.8787813904239004}. Best is trial 164 with value: -1.5157670549647289.
[I 2025-06-20 12:12:37,080] Trial 178 finished with value: -1.569789507367805 and parameters: {'booster': 'gbtree', 'lambda': 5.584269302966265e-07, 'alpha': 0.00614517017258333, 'subsample': 0.7861458736211829, 'colsample_bytree': 0.8701168348143008, 'max_depth': 4, 'min_child_weight': 6, 'eta': 0.10336313476003986, 'gamma': 3.8157667281606953}. Best is trial 164 with value: -1.5157670549647289.
[I 2025-06-20 12:12:37,394] Trial 179 finished with value: -1.5659293768330311 and parameters: {'booster': 'gbtree', 'lambda': 3.5607828448970036e-07, 'alpha': 0.003011325134770773, 'subsample': 0.7370068363675428, 'colsample_bytree': 0.7670468455849954, 'max_depth': 3, 'min_child_weight': 6, 'eta': 0.05628401305908343, 'gamma': 4.017244792331298}. Best is trial 164 with value: -1.5157670549647289.
[I 2025-06-20 12:12:37,641] Trial 180 finished with value: -1.5496226312435057 and parameters: {'booster': 'gbtree', 'lambda': 1.758427543541479e-07, 'alpha': 0.008403569331145094, 'subsample': 0.7708599624682702, 'colsample_bytree': 0.5650473943288028, 'max_depth': 4, 'min_child_weight': 5, 'eta': 0.08598143494554113, 'gamma': 3.6260397939554148}. Best is trial 164 with value: -1.5157670549647289.
[I 2025-06-20 12:12:37,958] Trial 181 finished with value: -1.5552197594638297 and parameters: {'booster': 'gbtree', 'lambda': 1.6694196646139443e-08, 'alpha': 0.013418527542064905, 'subsample': 0.7594530521290295, 'colsample_bytree': 0.5853597365259567, 'max_depth': 4, 'min_child_weight': 6, 'eta': 0.06464303860177847, 'gamma': 4.442394283609395}. Best is trial 164 with value: -1.5157670549647289.
[I 2025-06-20 12:12:38,290] Trial 182 finished with value: -1.5776311271523962 and parameters: {'booster': 'gbtree', 'lambda': 3.454833154919598e-07, 'alpha': 0.004830070926542004, 'subsample': 0.721141230880572, 'colsample_bytree': 0.6038430917832988, 'max_depth': 4, 'min_child_weight': 6, 'eta': 0.05919115831074619, 'gamma': 3.5155445787717308}. Best is trial 164 with value: -1.5157670549647289.
[I 2025-06-20 12:12:38,614] Trial 183 finished with value: -1.533138985520237 and parameters: {'booster': 'gbtree', 'lambda': 1.403085105613875e-07, 'alpha': 0.008776359408150422, 'subsample': 0.7781418608288413, 'colsample_bytree': 0.574310337298299, 'max_depth': 4, 'min_child_weight': 6, 'eta': 0.052790084910260486, 'gamma': 3.941495881534942}. Best is trial 164 with value: -1.5157670549647289.
[I 2025-06-20 12:12:38,909] Trial 184 finished with value: -1.550751128579577 and parameters: {'booster': 'gbtree', 'lambda': 1.2430959705189684e-07, 'alpha': 0.009268978919997043, 'subsample': 0.7776144651777986, 'colsample_bytree': 0.5535846396727971, 'max_depth': 4, 'min_child_weight': 6, 'eta': 0.07650862113469349, 'gamma': 3.950632452317179}. Best is trial 164 with value: -1.5157670549647289.
[I 2025-06-20 12:12:39,195] Trial 185 finished with value: -1.5712938740740394 and parameters: {'booster': 'gbtree', 'lambda': 5.5423370271339916e-08, 'alpha': 0.003713051581963939, 'subsample': 0.7979161233166573, 'colsample_bytree': 0.5736847549699946, 'max_depth': 4, 'min_child_weight': 6, 'eta': 0.052900228198195426, 'gamma': 3.7554348604216132}. Best is trial 164 with value: -1.5157670549647289.
[I 2025-06-20 12:12:39,525] Trial 186 finished with value: -1.5467438913602443 and parameters: {'booster': 'gbtree', 'lambda': 2.2887868910558854e-07, 'alpha': 0.0021285738459884246, 'subsample': 0.7673579983707002, 'colsample_bytree': 0.5638006852934747, 'max_depth': 4, 'min_child_weight': 5, 'eta': 0.07042027564615966, 'gamma': 4.186379350043485}. Best is trial 164 with value: -1.5157670549647289.
[I 2025-06-20 12:12:39,837] Trial 187 finished with value: -1.542258204533764 and parameters: {'booster': 'gbtree', 'lambda': 2.2439894266386292e-07, 'alpha': 0.0012245704096427814, 'subsample': 0.7624485460353727, 'colsample_bytree': 0.5605055061862931, 'max_depth': 4, 'min_child_weight': 5, 'eta': 0.06895888310111986, 'gamma': 4.102361176197113}. Best is trial 164 with value: -1.5157670549647289.
[I 2025-06-20 12:12:40,080] Trial 188 finished with value: -1.535272829840587 and parameters: {'booster': 'gbtree', 'lambda': 1.8537410147513005e-07, 'alpha': 0.000931934274137413, 'subsample': 0.7664196738623289, 'colsample_bytree': 0.5468749720562068, 'max_depth': 4, 'min_child_weight': 5, 'eta': 0.06974745594274392, 'gamma': 4.230811352762343}. Best is trial 164 with value: -1.5157670549647289.
[I 2025-06-20 12:12:40,261] Trial 189 finished with value: -1.5957165815773715 and parameters: {'booster': 'gbtree', 'lambda': 1.4876871493846583e-07, 'alpha': 0.0010573562992366617, 'subsample': 0.7863843871295307, 'colsample_bytree': 0.5434732939605481, 'max_depth': 4, 'min_child_weight': 5, 'eta': 0.0744653934005527, 'gamma': 4.112222565717945}. Best is trial 164 with value: -1.5157670549647289.
[I 2025-06-20 12:12:40,510] Trial 190 finished with value: -1.5822051529868553 and parameters: {'booster': 'gbtree', 'lambda': 5.11297257552345e-07, 'alpha': 0.0005849878011800171, 'subsample': 0.776175353286033, 'colsample_bytree': 0.5234065604559675, 'max_depth': 4, 'min_child_weight': 5, 'eta': 0.09105749842983299, 'gamma': 4.261459767519095}. Best is trial 164 with value: -1.5157670549647289.
[I 2025-06-20 12:12:40,706] Trial 191 finished with value: -1.5981641796958685 and parameters: {'booster': 'gbtree', 'lambda': 1.6454720456051891e-07, 'alpha': 0.0003104409215334357, 'subsample': 0.7699108808146575, 'colsample_bytree': 0.5536913072524924, 'max_depth': 4, 'min_child_weight': 5, 'eta': 0.07129248657939129, 'gamma': 4.088849656934279}. Best is trial 164 with value: -1.5157670549647289.
[I 2025-06-20 12:12:40,996] Trial 192 finished with value: -1.5696559526781984 and parameters: {'booster': 'gbtree', 'lambda': 8.883779110454424e-07, 'alpha': 0.0013256901803488867, 'subsample': 0.7611789570480515, 'colsample_bytree': 0.5664591941870523, 'max_depth': 4, 'min_child_weight': 5, 'eta': 0.06396747530960908, 'gamma': 4.167012251802923}. Best is trial 164 with value: -1.5157670549647289.
