[I 2025-06-20 12:12:55,404] Trial 247 finished with value: -1.5823658042839268 and parameters: {'booster': 'gbtree', 'lambda': 1.8451714561736918e-08, 'alpha': 3.087311150046735e-08, 'subsample': 0.7723996953882756, 'colsample_bytree': 0.7108330010998903, 'max_depth': 4, 'min_child_weight': 6, 'eta': 0.05174205703133608, 'gamma': 4.159458587499543}. Best is trial 164 with value: -1.5157670549647289.
[I 2025-06-20 12:12:55,699] Trial 248 finished with value: -1.5947457519818962 and parameters: {'booster': 'gbtree', 'lambda': 3.778391374461895e-08, 'alpha': 0.0042215253357722185, 'subsample': 0.7396871370772101, 'colsample_bytree': 0.5451454893976945, 'max_depth': 4, 'min_child_weight': 1, 'eta': 0.0633023698670027, 'gamma': 3.4298868794488286}. Best is trial 164 with value: -1.5157670549647289.
[I 2025-06-20 12:12:56,053] Trial 249 finished with value: -1.5482342844352919 and parameters: {'booster': 'gbtree', 'lambda': 1.6267605996593601e-07, 'alpha': 0.013229390091220254, 'subsample': 0.7626812475238165, 'colsample_bytree': 0.5616524048570309, 'max_depth': 4, 'min_child_weight': 6, 'eta': 0.05775786318930064, 'gamma': 3.7096983845907845}. Best is trial 164 with value: -1.5157670549647289.
[I 2025-06-20 12:12:56,355] Trial 250 finished with value: -1.5405407297871285 and parameters: {'booster': 'gbtree', 'lambda': 9.683653009989943e-08, 'alpha': 0.00823396061797899, 'subsample': 0.7863493750544553, 'colsample_bytree': 0.578460989241639, 'max_depth': 4, 'min_child_weight': 5, 'eta': 0.048104548734125854, 'gamma': 3.8407965923439344}. Best is trial 164 with value: -1.5157670549647289.
[I 2025-06-20 12:12:56,663] Trial 251 finished with value: -1.5438038944362973 and parameters: {'booster': 'gbtree', 'lambda': 8.246772630390704e-08, 'alpha': 0.025357891279599178, 'subsample': 0.7902576775991891, 'colsample_bytree': 0.5892486809050769, 'max_depth': 4, 'min_child_weight': 5, 'eta': 0.046302059624682576, 'gamma': 3.928327261119631}. Best is trial 164 with value: -1.5157670549647289.
[I 2025-06-20 12:12:56,982] Trial 252 finished with value: -1.5594025441217128 and parameters: {'booster': 'gbtree', 'lambda': 6.902302629989825e-08, 'alpha': 0.04424776276720708, 'subsample': 0.7916643979023699, 'colsample_bytree': 0.5978430020914238, 'max_depth': 4, 'min_child_weight': 5, 'eta': 0.04519639594888604, 'gamma': 3.9509802178419466}. Best is trial 164 with value: -1.5157670549647289.
[I 2025-06-20 12:12:57,239] Trial 253 finished with value: -1.564706768618044 and parameters: {'booster': 'gbtree', 'lambda': 9.936247173264459e-08, 'alpha': 0.028970330263566588, 'subsample': 0.7834496324444752, 'colsample_bytree': 0.5791065573516777, 'max_depth': 4, 'min_child_weight': 5, 'eta': 0.04710682056996863, 'gamma': 4.070445405679534}. Best is trial 164 with value: -1.5157670549647289.
[I 2025-06-20 12:12:57,535] Trial 254 finished with value: -1.5462004423070344 and parameters: {'booster': 'gbtree', 'lambda': 3.257866914001398e-08, 'alpha': 0.018848422216039305, 'subsample': 0.8050985895327675, 'colsample_bytree': 0.5907324459518051, 'max_depth': 4, 'min_child_weight': 5, 'eta': 0.051031856479714754, 'gamma': 3.8915539508882726}. Best is trial 164 with value: -1.5157670549647289.
[I 2025-06-20 12:12:57,818] Trial 255 finished with value: -1.539283228404604 and parameters: {'booster': 'gbtree', 'lambda': 1.5141061376983712e-08, 'alpha': 0.014716318481801266, 'subsample': 0.7914595309400628, 'colsample_bytree': 0.5959495006590133, 'max_depth': 4, 'min_child_weight': 5, 'eta': 0.05350318450526863, 'gamma': 4.009909150178686}. Best is trial 164 with value: -1.5157670549647289.
[I 2025-06-20 12:12:58,145] Trial 256 finished with value: -1.5668368741779228 and parameters: {'booster': 'gbtree', 'lambda': 1.6135539256685015e-08, 'alpha': 0.02451033496091324, 'subsample': 0.8010444339658422, 'colsample_bytree': 0.592505779499566, 'max_depth': 4, 'min_child_weight': 5, 'eta': 0.04335094983561863, 'gamma': 4.264377601367782}. Best is trial 164 with value: -1.5157670549647289.
[I 2025-06-20 12:12:58,426] Trial 257 finished with value: -1.585378073118335 and parameters: {'booster': 'gbtree', 'lambda': 5.0690347413788394e-08, 'alpha': 0.013790893460317102, 'subsample': 0.8314368694593247, 'colsample_bytree': 0.5687944213743874, 'max_depth': 3, 'min_child_weight': 5, 'eta': 0.04988547333329222, 'gamma': 3.9941449495235823}. Best is trial 164 with value: -1.5157670549647289.
[I 2025-06-20 12:12:58,668] Trial 258 finished with value: -1.5643480731961648 and parameters: {'booster': 'gbtree', 'lambda': 2.2981281037522384e-08, 'alpha': 0.010619053854314777, 'subsample': 0.8134186272922114, 'colsample_bytree': 0.8289822378137557, 'max_depth': 4, 'min_child_weight': 5, 'eta': 0.052971335723927516, 'gamma': 3.8892511509165733}. Best is trial 164 with value: -1.5157670549647289.
[I 2025-06-20 12:12:58,997] Trial 259 finished with value: -1.5821905570566752 and parameters: {'booster': 'gbtree', 'lambda': 1.3597866322246926e-08, 'alpha': 0.018107247696599237, 'subsample': 0.8652913447722795, 'colsample_bytree': 0.887046948167754, 'max_depth': 4, 'min_child_weight': 5, 'eta': 0.04653900703568573, 'gamma': 3.482444152755952}. Best is trial 164 with value: -1.5157670549647289.
[I 2025-06-20 12:12:59,259] Trial 260 finished with value: -1.5578516098726287 and parameters: {'booster': 'gbtree', 'lambda': 3.161370141966022e-08, 'alpha': 0.009121729241690451, 'subsample': 0.7955812054467217, 'colsample_bytree': 0.5373789854079027, 'max_depth': 4, 'min_child_weight': 5, 'eta': 0.05723412589435703, 'gamma': 3.8549314359746694}. Best is trial 164 with value: -1.5157670549647289.
[I 2025-06-20 12:12:59,565] Trial 261 finished with value: -1.5707169844362283 and parameters: {'booster': 'gbtree', 'lambda': 6.280217920824298e-08, 'alpha': 0.052008349396237157, 'subsample': 0.7871257348186228, 'colsample_bytree': 0.6036045861886536, 'max_depth': 4, 'min_child_weight': 5, 'eta': 0.04279808252556024, 'gamma': 4.138975129056433}. Best is trial 164 with value: -1.5157670549647289.
[I 2025-06-20 12:12:59,888] Trial 262 finished with value: -1.5941497890626992 and parameters: {'booster': 'gbtree', 'lambda': 2.2352793408948766e-08, 'alpha': 0.02284286499488086, 'subsample': 0.6849627337015731, 'colsample_bytree': 0.5525714635496951, 'max_depth': 5, 'min_child_weight': 5, 'eta': 0.054953676121060696, 'gamma': 3.3632900820993834}. Best is trial 164 with value: -1.5157670549647289.
[I 2025-06-20 12:13:00,143] Trial 263 finished with value: -1.5618379082338927 and parameters: {'booster': 'gbtree', 'lambda': 4.043035912362332e-08, 'alpha': 0.014230772038392217, 'subsample': 0.7894737271290851, 'colsample_bytree': 0.572780210080259, 'max_depth': 4, 'min_child_weight': 5, 'eta': 0.058662014418080104, 'gamma': 3.588147044130343}. Best is trial 164 with value: -1.5157670549647289.
[I 2025-06-20 12:13:00,445] Trial 264 finished with value: -1.534861798524163 and parameters: {'booster': 'gbtree', 'lambda': 1.1732238433351785e-07, 'alpha': 0.007648872441703507, 'subsample': 0.7793152339325637, 'colsample_bytree': 0.5309920574609723, 'max_depth': 4, 'min_child_weight': 5, 'eta': 0.0630958762657121, 'gamma': 3.6426170622894434}. Best is trial 164 with value: -1.5157670549647289.
[I 2025-06-20 12:13:00,687] Trial 265 finished with value: -1.5582031995847214 and parameters: {'booster': 'gbtree', 'lambda': 9.586873639800199e-08, 'alpha': 0.007634827117554151, 'subsample': 0.7800467145066668, 'colsample_bytree': 0.5310833986631517, 'max_depth': 4, 'min_child_weight': 5, 'eta': 0.06519536106241006, 'gamma': 3.7780286346968053}. Best is trial 164 with value: -1.5157670549647289.
[I 2025-06-20 12:13:01,009] Trial 266 finished with value: -1.5220467772610775 and parameters: {'booster': 'gbtree', 'lambda': 1.4311144181565368e-08, 'alpha': 0.0002826013720009469, 'subsample': 0.8038230751035841, 'colsample_bytree': 0.5423688446712258, 'max_depth': 4, 'min_child_weight': 5, 'eta': 0.04814440641443323, 'gamma': 3.6180779006574975}. Best is trial 164 with value: -1.5157670549647289.
[I 2025-06-20 12:13:01,302] Trial 267 finished with value: -1.5399928700540846 and parameters: {'booster': 'gbtree', 'lambda': 7.379975887031278e-08, 'alpha': 0.0003419986073523159, 'subsample': 0.8059945242443084, 'colsample_bytree': 0.5207792777156467, 'max_depth': 4, 'min_child_weight': 4, 'eta': 0.04797404761990649, 'gamma': 3.6341550783855294}. Best is trial 164 with value: -1.5157670549647289.
[I 2025-06-20 12:13:01,552] Trial 268 finished with value: -1.5714860833318671 and parameters: {'booster': 'gbtree', 'lambda': 5.285576935379241e-08, 'alpha': 0.00023145325481080227, 'subsample': 0.8094380106805407, 'colsample_bytree': 0.5143986411262786, 'max_depth': 4, 'min_child_weight': 3, 'eta': 0.048190750857605054, 'gamma': 3.6289584005665336}. Best is trial 164 with value: -1.5157670549647289.
[I 2025-06-20 12:13:01,856] Trial 269 finished with value: -1.585870243548224 and parameters: {'booster': 'gbtree', 'lambda': 2.9638465605283533e-08, 'alpha': 0.0003489885272316425, 'subsample': 0.8208764437466236, 'colsample_bytree': 0.5196882081092311, 'max_depth': 3, 'min_child_weight': 4, 'eta': 0.04422902901664664, 'gamma': 3.5137386663326575}. Best is trial 164 with value: -1.5157670549647289.
[I 2025-06-20 12:13:02,195] Trial 270 finished with value: -1.6518694696234684 and parameters: {'booster': 'gbtree', 'lambda': 1.1884351034143948e-07, 'alpha': 0.00015272617820902807, 'subsample': 0.8169126054049932, 'colsample_bytree': 0.5277897803083459, 'max_depth': 9, 'min_child_weight': 4, 'eta': 0.050378254241903786, 'gamma': 3.460537540776252}. Best is trial 164 with value: -1.5157670549647289.
[I 2025-06-20 12:13:02,477] Trial 271 finished with value: -1.5471320291157673 and parameters: {'booster': 'gbtree', 'lambda': 1.2734835910389013e-08, 'alpha': 0.00010042489373917292, 'subsample': 0.8037811778990789, 'colsample_bytree': 0.5485740738283809, 'max_depth': 4, 'min_child_weight': 4, 'eta': 0.04141569134953995, 'gamma': 3.6636478667132386}. Best is trial 164 with value: -1.5157670549647289.
[I 2025-06-20 12:13:02,750] Trial 272 finished with value: -1.538407830029739 and parameters: {'booster': 'gbtree', 'lambda': 2.113247417639857e-08, 'alpha': 0.0004433297224984154, 'subsample': 0.7992732422347109, 'colsample_bytree': 0.512156154556948, 'max_depth': 4, 'min_child_weight': 5, 'eta': 0.0541746258533936, 'gamma': 2.580121350948316}. Best is trial 164 with value: -1.5157670549647289.
[I 2025-06-20 12:13:03,034] Trial 273 finished with value: -1.5550438947554401 and parameters: {'booster': 'gbtree', 'lambda': 2.1532993872833732e-08, 'alpha': 0.0006806477109433245, 'subsample': 0.7945277657445247, 'colsample_bytree': 0.5087218826263217, 'max_depth': 4, 'min_child_weight': 5, 'eta': 0.05182608295500661, 'gamma': 2.634922403422062}. Best is trial 164 with value: -1.5157670549647289.
[I 2025-06-20 12:13:03,341] Trial 274 finished with value: -1.5627349338386065 and parameters: {'booster': 'gbtree', 'lambda': 4.011917012323653e-08, 'alpha': 0.0003054950281282035, 'subsample': 0.8217178202565005, 'colsample_bytree': 0.5194178200274383, 'max_depth': 4, 'min_child_weight': 5, 'eta': 0.04638936345025597, 'gamma': 2.5260200874820247}. Best is trial 164 with value: -1.5157670549647289.
[I 2025-06-20 12:13:03,645] Trial 275 finished with value: -1.542102433490596 and parameters: {'booster': 'gbtree', 'lambda': 1.5612232438593394e-08, 'alpha': 0.0006214805018635389, 'subsample': 0.8030234186023881, 'colsample_bytree': 0.5102032560643442, 'max_depth': 4, 'min_child_weight': 5, 'eta': 0.05214978809701904, 'gamma': 2.6269747601248388}. Best is trial 164 with value: -1.5157670549647289.
[I 2025-06-20 12:13:03,958] Trial 276 finished with value: -1.5585732790843225 and parameters: {'booster': 'gbtree', 'lambda': 1.5762916007176966e-08, 'alpha': 0.0004078315234871328, 'subsample': 0.8282646058207382, 'colsample_bytree': 0.519579413457045, 'max_depth': 4, 'min_child_weight': 5, 'eta': 0.041791924399209854, 'gamma': 2.408005060724896}. Best is trial 164 with value: -1.5157670549647289.
[I 2025-06-20 12:13:04,204] Trial 277 finished with value: -1.571445274722167 and parameters: {'booster': 'gbtree', 'lambda': 2.4493631711571655e-08, 'alpha': 0.000516094335562806, 'subsample': 0.9192444886022314, 'colsample_bytree': 0.5003167276917168, 'max_depth': 4, 'min_child_weight': 5, 'eta': 0.052814919062169396, 'gamma': 2.6459455623898913}. Best is trial 164 with value: -1.5157670549647289.
[I 2025-06-20 12:13:04,507] Trial 278 finished with value: -1.5940914070903287 and parameters: {'booster': 'gbtree', 'lambda': 1.0298142191460687e-08, 'alpha': 0.0007727654841625303, 'subsample': 0.8058968328737983, 'colsample_bytree': 0.5102604275967983, 'max_depth': 5, 'min_child_weight': 5, 'eta': 0.047247197697450824, 'gamma': 3.35042757029899}. Best is trial 164 with value: -1.5157670549647289.
[I 2025-06-20 12:13:04,795] Trial 279 finished with value: -1.5478675508365995 and parameters: {'booster': 'gbtree', 'lambda': 1.9437096054999598e-08, 'alpha': 0.00029765157435655436, 'subsample': 0.8014823731918049, 'colsample_bytree': 0.5088072323440305, 'max_depth': 4, 'min_child_weight': 5, 'eta': 0.054773586878501895, 'gamma': 2.555707513792308}. Best is trial 164 with value: -1.5157670549647289.
[I 2025-06-20 12:13:05,026] Trial 280 finished with value: -1.583969204849446 and parameters: {'booster': 'gbtree', 'lambda': 7.33360208716362e-08, 'alpha': 0.0001777976863184529, 'subsample': 0.8133326542472896, 'colsample_bytree': 0.5974095366923771, 'max_depth': 4, 'min_child_weight': 4, 'eta': 0.060423008637118865, 'gamma': 2.5827998990094274}. Best is trial 164 with value: -1.5157670549647289.
[I 2025-06-20 12:13:05,299] Trial 281 finished with value: -1.5447887408468048 and parameters: {'booster': 'gbtree', 'lambda': 3.050459625998528e-08, 'alpha': 0.0005193933130620657, 'subsample': 0.7959918778553687, 'colsample_bytree': 0.5818312242663412, 'max_depth': 4, 'min_child_weight': 5, 'eta': 0.048689754378040885, 'gamma': 2.8057713542818123}. Best is trial 164 with value: -1.5157670549647289.
[I 2025-06-20 12:13:05,583] Trial 282 finished with value: -1.5695325213856663 and parameters: {'booster': 'gbtree', 'lambda': 4.607243020563655e-08, 'alpha': 0.00025463926122741717, 'subsample': 0.7881055590858537, 'colsample_bytree': 0.5686774066710926, 'max_depth': 3, 'min_child_weight': 3, 'eta': 0.054511898594366816, 'gamma': 2.7242527347354373}. Best is trial 164 with value: -1.5157670549647289.
[I 2025-06-20 12:13:05,892] Trial 283 finished with value: -1.5875542057939682 and parameters: {'booster': 'gbtree', 'lambda': 1.6152266462442204e-08, 'alpha': 0.0004282528279636435, 'subsample': 0.8011469723470732, 'colsample_bytree': 0.5264432561215393, 'max_depth': 4, 'min_child_weight': 2, 'eta': 0.04222996615544569, 'gamma': 2.7447903366254622}. Best is trial 164 with value: -1.5157670549647289.
[I 2025-06-20 12:13:06,223] Trial 284 finished with value: -2.014110171597859 and parameters: {'booster': 'gbtree', 'lambda': 1.3506351324710396e-08, 'alpha': 0.0009434595210058193, 'subsample': 0.7882050269044899, 'colsample_bytree': 0.5585338345510966, 'max_depth': 4, 'min_child_weight': 5, 'eta': 0.0023937678513459917, 'gamma': 3.9798845067259134}. Best is trial 164 with value: -1.5157670549647289.
[I 2025-06-20 12:13:06,434] Trial 285 finished with value: -1.5488442510735816 and parameters: {'booster': 'gbtree', 'lambda': 1.0488456177270204e-08, 'alpha': 0.00013486103700970835, 'subsample': 0.8092437600155852, 'colsample_bytree': 0.5851321209671505, 'max_depth': 4, 'min_child_weight': 5, 'eta': 0.06470894953859163, 'gamma': 2.411451542080454}. Best is trial 164 with value: -1.5157670549647289.
[I 2025-06-20 12:13:06,756] Trial 286 finished with value: -1.5360378070625003 and parameters: {'booster': 'gbtree', 'lambda': 2.764664434884805e-08, 'alpha': 0.00021323484464442891, 'subsample': 0.7966783790495987, 'colsample_bytree': 0.5144486866810646, 'max_depth': 4, 'min_child_weight': 5, 'eta': 0.05118459824086324, 'gamma': 3.8309492991166425}. Best is trial 164 with value: -1.5157670549647289.
[I 2025-06-20 12:13:07,173] Trial 287 finished with value: -1.5445331742159838 and parameters: {'booster': 'gbtree', 'lambda': 6.723955242651362e-08, 'alpha': 0.0005143591691545466, 'subsample': 0.8386059133088228, 'colsample_bytree': 0.5117469243293337, 'max_depth': 4, 'min_child_weight': 5, 'eta': 0.0491402635494402, 'gamma': 3.8368043780698224}. Best is trial 164 with value: -1.5157670549647289.
[I 2025-06-20 12:13:07,610] Trial 288 finished with value: -1.55491544338148 and parameters: {'booster': 'gbtree', 'lambda': 2.502997447518827e-08, 'alpha': 0.001093329844674993, 'subsample': 0.7959560195658579, 'colsample_bytree': 0.508482266536114, 'max_depth': 4, 'min_child_weight': 5, 'eta': 0.041531939618311205, 'gamma': 3.476138198805948}. Best is trial 164 with value: -1.5157670549647289.
[I 2025-06-20 12:13:08,015] Trial 289 finished with value: -1.5497223735675343 and parameters: {'booster': 'gbtree', 'lambda': 1.269097635609938e-07, 'alpha': 0.0002567881771826251, 'subsample': 0.7828989479431414, 'colsample_bytree': 0.5251296440407666, 'max_depth': 4, 'min_child_weight': 4, 'eta': 0.05268877783723545, 'gamma': 3.583485750306742}. Best is trial 164 with value: -1.5157670549647289.
[I 2025-06-20 12:13:08,357] Trial 290 finished with value: -1.5619539283855093 and parameters: {'booster': 'gbtree', 'lambda': 4.9297320840183175e-08, 'alpha': 0.0005015401166976375, 'subsample': 0.8174745572136157, 'colsample_bytree': 0.5023537211398564, 'max_depth': 4, 'min_child_weight': 5, 'eta': 0.059238856200545524, 'gamma': 0.6186704935948439}. Best is trial 164 with value: -1.5157670549647289.
[I 2025-06-20 12:13:08,750] Trial 291 finished with value: -1.5371143571998722 and parameters: {'booster': 'gbtree', 'lambda': 3.488949327650627e-08, 'alpha': 7.524704393874718e-05, 'subsample': 0.8052427478115894, 'colsample_bytree': 0.5210780472732703, 'max_depth': 4, 'min_child_weight': 5, 'eta': 0.04569940417667252, 'gamma': 3.7820091700750873}. Best is trial 164 with value: -1.5157670549647289.
[I 2025-06-20 12:13:09,195] Trial 292 finished with value: -1.5757158544031247 and parameters: {'booster': 'gbtree', 'lambda': 3.747995128533396e-08, 'alpha': 8.676653698833818e-05, 'subsample': 0.8079104800561733, 'colsample_bytree': 0.5246931751865871, 'max_depth': 4, 'min_child_weight': 5, 'eta': 0.039250951383930026, 'gamma': 3.7715240245552444}. Best is trial 164 with value: -1.5157670549647289.
[I 2025-06-20 12:13:09,569] Trial 293 finished with value: -1.5493333137023546 and parameters: {'booster': 'gbtree', 'lambda': 2.1246201819863692e-08, 'alpha': 7.208007241979174e-05, 'subsample': 0.7988691251567022, 'colsample_bytree': 0.5169628412562309, 'max_depth': 4, 'min_child_weight': 5, 'eta': 0.055277111373698104, 'gamma': 3.2911956483446816}. Best is trial 164 with value: -1.5157670549647289.
[I 2025-06-20 12:13:09,823] Trial 294 finished with value: -1.5342466053540624 and parameters: {'booster': 'gbtree', 'lambda': 2.9405630889956464e-08, 'alpha': 0.0009113039788694024, 'subsample': 0.7803168851511342, 'colsample_bytree': 0.5315263819480902, 'max_depth': 4, 'min_child_weight': 5, 'eta': 0.06383035780045487, 'gamma': 3.62625605913461}. Best is trial 164 with value: -1.5157670549647289.
[I 2025-06-20 12:13:10,122] Trial 295 finished with value: -1.559545042966261 and parameters: {'booster': 'gbtree', 'lambda': 3.255420528107924e-08, 'alpha': 0.0007163118367093075, 'subsample': 0.7790384059599567, 'colsample_bytree': 0.5169970921541556, 'max_depth': 4, 'min_child_weight': 5, 'eta': 0.06668676161934496, 'gamma': 2.4832860932505048}. Best is trial 164 with value: -1.5157670549647289.
[I 2025-06-20 12:13:10,459] Trial 296 finished with value: -1.556644007875662 and parameters: {'booster': 'gbtree', 'lambda': 1.4881425701082453e-08, 'alpha': 0.000173612305211119, 'subsample': 0.7819411932047551, 'colsample_bytree': 0.5344789148974128, 'max_depth': 4, 'min_child_weight': 5, 'eta': 0.045898109973758636, 'gamma': 2.693077917715926}. Best is trial 164 with value: -1.5157670549647289.
[I 2025-06-20 12:13:10,772] Trial 297 finished with value: -1.6052870210504069 and parameters: {'booster': 'gbtree', 'lambda': 2.640798771038061e-08, 'alpha': 4.8294252641899136e-05, 'subsample': 0.8245780634352573, 'colsample_bytree': 0.5335143132819943, 'max_depth': 10, 'min_child_weight': 5, 'eta': 0.06561392099373185, 'gamma': 3.5293139332283}. Best is trial 164 with value: -1.5157670549647289.
[I 2025-06-20 12:13:11,022] Trial 298 finished with value: -1.564583699630723 and parameters: {'booster': 'gbtree', 'lambda': 1.8819007339945192e-08, 'alpha': 0.0011710830679314821, 'subsample': 0.8056971079149229, 'colsample_bytree': 0.5122892972916181, 'max_depth': 4, 'min_child_weight': 5, 'eta': 0.05028308508411239, 'gamma': 3.73743622047967}. Best is trial 164 with value: -1.5157670549647289.
[I 2025-06-20 12:13:11,262] Trial 299 finished with value: -1.5727796524843891 and parameters: {'booster': 'gbtree', 'lambda': 4.407700676799166e-08, 'alpha': 0.00011671335619401416, 'subsample': 0.795512044595911, 'colsample_bytree': 0.5271458155519062, 'max_depth': 4, 'min_child_weight': 10, 'eta': 0.07739275011133237, 'gamma': 3.4070266072586066}. Best is trial 164 with value: -1.5157670549647289.
[I 2025-06-20 12:13:11,575] Trial 300 finished with value: -1.5401488673949275 and parameters: {'booster': 'gbtree', 'lambda': 2.7089859275648312e-08, 'alpha': 0.000777729963010049, 'subsample': 0.7754209787405704, 'colsample_bytree': 0.5023247815659883, 'max_depth': 4, 'min_child_weight': 4, 'eta': 0.0594876426190255, 'gamma': 3.8283402474318544}. Best is trial 164 with value: -1.5157670549647289.
