[I 2025-06-20 12:12:41,213] Trial 193 finished with value: -1.5811414883201154 and parameters: {'booster': 'gbtree', 'lambda': 2.3370605997974214e-07, 'alpha': 0.0019058553889897216, 'subsample': 0.7647210533089036, 'colsample_bytree': 0.5352417423916168, 'max_depth': 4, 'min_child_weight': 5, 'eta': 0.06971666446339252, 'gamma': 4.366821993458152}. Best is trial 164 with value: -1.5157670549647289.
[I 2025-06-20 12:12:41,501] Trial 194 finished with value: -1.5637700869828115 and parameters: {'booster': 'gbtree', 'lambda': 7.482620937442875e-08, 'alpha': 0.005664803595149507, 'subsample': 0.7923052697717461, 'colsample_bytree': 0.5494531785423232, 'max_depth': 4, 'min_child_weight': 5, 'eta': 0.0587355996985964, 'gamma': 3.9726713598609504}. Best is trial 164 with value: -1.5157670549647289.
[I 2025-06-20 12:12:41,662] Trial 195 finished with value: -1.5996438620785922 and parameters: {'booster': 'gbtree', 'lambda': 1.0845441864638379e-07, 'alpha': 0.0028226071112971464, 'subsample': 0.7817043947404649, 'colsample_bytree': 0.5827941559809566, 'max_depth': 4, 'min_child_weight': 4, 'eta': 0.08231009010997949, 'gamma': 4.265080745801569}. Best is trial 164 with value: -1.5157670549647289.
[I 2025-06-20 12:12:41,964] Trial 196 finished with value: -1.5624396594225471 and parameters: {'booster': 'gbtree', 'lambda': 2.1708738729707832e-07, 'alpha': 0.007337741973255383, 'subsample': 0.7556142525316029, 'colsample_bytree': 0.5932169258686351, 'max_depth': 4, 'min_child_weight': 5, 'eta': 0.06057983389884699, 'gamma': 4.529681810206175}. Best is trial 164 with value: -1.5157670549647289.
[I 2025-06-20 12:12:42,285] Trial 197 finished with value: -1.5812708401647988 and parameters: {'booster': 'gbtree', 'lambda': 4.282898965554753e-07, 'alpha': 0.0010677485122978416, 'subsample': 0.7700411478970227, 'colsample_bytree': 0.740488812730015, 'max_depth': 4, 'min_child_weight': 5, 'eta': 0.05218665814429539, 'gamma': 4.181663446454014}. Best is trial 164 with value: -1.5157670549647289.
[I 2025-06-20 12:12:42,552] Trial 198 finished with value: -1.5586523602023263 and parameters: {'booster': 'gbtree', 'lambda': 1.062321338001836e-07, 'alpha': 0.004729913869209563, 'subsample': 0.9725041349426062, 'colsample_bytree': 0.560232227274792, 'max_depth': 4, 'min_child_weight': 5, 'eta': 0.0675317981314934, 'gamma': 3.839741286637365}. Best is trial 164 with value: -1.5157670549647289.
[I 2025-06-20 12:12:42,803] Trial 199 finished with value: -1.571659354732734 and parameters: {'booster': 'gbtree', 'lambda': 3.75206815280248e-08, 'alpha': 0.0006080619616776135, 'subsample': 0.8104583509042049, 'colsample_bytree': 0.5754683171266806, 'max_depth': 4, 'min_child_weight': 4, 'eta': 0.05655861936461137, 'gamma': 4.00208653222789}. Best is trial 164 with value: -1.5157670549647289.
[I 2025-06-20 12:12:43,022] Trial 200 finished with value: -1.5548020804828948 and parameters: {'booster': 'gbtree', 'lambda': 3.6840493380949704e-06, 'alpha': 0.0033846528378297896, 'subsample': 0.7793354563835708, 'colsample_bytree': 0.5474635322570818, 'max_depth': 4, 'min_child_weight': 5, 'eta': 0.08174074202361888, 'gamma': 4.058125786660009}. Best is trial 164 with value: -1.5157670549647289.
[I 2025-06-20 12:12:43,306] Trial 201 finished with value: -1.55083537000119 and parameters: {'booster': 'gbtree', 'lambda': 3.070274599415327e-07, 'alpha': 0.001830901282460224, 'subsample': 0.7496749780265259, 'colsample_bytree': 0.5639241335155405, 'max_depth': 4, 'min_child_weight': 6, 'eta': 0.04936360138195851, 'gamma': 3.899758133136189}. Best is trial 164 with value: -1.5157670549647289.
[I 2025-06-20 12:12:43,647] Trial 202 finished with value: -1.8024376212405622 and parameters: {'booster': 'gbtree', 'lambda': 1.9779793514090638e-07, 'alpha': 0.002438091999467182, 'subsample': 0.7628742198748304, 'colsample_bytree': 0.5599959606505202, 'max_depth': 4, 'min_child_weight': 5, 'eta': 0.006386126634017095, 'gamma': 3.7728950188943977}. Best is trial 164 with value: -1.5157670549647289.
[I 2025-06-20 12:12:43,942] Trial 203 finished with value: -1.5447476627191674 and parameters: {'booster': 'gbtree', 'lambda': 6.64150533636578e-07, 'alpha': 0.011306960802265448, 'subsample': 0.7498226936684961, 'colsample_bytree': 0.5397262483374037, 'max_depth': 4, 'min_child_weight': 6, 'eta': 0.06484912713303348, 'gamma': 3.6910648204143706}. Best is trial 164 with value: -1.5157670549647289.
[I 2025-06-20 12:12:44,187] Trial 204 finished with value: -1.5450941057981378 and parameters: {'booster': 'gbtree', 'lambda': 9.932298538439214e-07, 'alpha': 0.009279013811849507, 'subsample': 0.6965616206236718, 'colsample_bytree': 0.5343510525601319, 'max_depth': 4, 'min_child_weight': 6, 'eta': 0.07241402905570417, 'gamma': 3.676445143809862}. Best is trial 164 with value: -1.5157670549647289.
[I 2025-06-20 12:12:44,429] Trial 205 finished with value: -1.5462030874799437 and parameters: {'booster': 'gbtree', 'lambda': 1.6675034192357588e-06, 'alpha': 0.011552411421161505, 'subsample': 0.6998277900953707, 'colsample_bytree': 0.5265302107145219, 'max_depth': 4, 'min_child_weight': 6, 'eta': 0.11625446248955192, 'gamma': 3.702276446813626}. Best is trial 164 with value: -1.5157670549647289.
[I 2025-06-20 12:12:44,593] Trial 206 finished with value: -1.6104562810848753 and parameters: {'booster': 'gbtree', 'lambda': 2.3241788354524517e-06, 'alpha': 0.01122915243177897, 'subsample': 0.695414175527905, 'colsample_bytree': 0.5256885444081211, 'max_depth': 4, 'min_child_weight': 6, 'eta': 0.11332605180460681, 'gamma': 3.6699260791489006}. Best is trial 164 with value: -1.5157670549647289.
[I 2025-06-20 12:12:44,753] Trial 207 finished with value: -1.609808818659942 and parameters: {'booster': 'gbtree', 'lambda': 1.2437346216055472e-06, 'alpha': 0.006884956292306583, 'subsample': 0.6875532162972636, 'colsample_bytree': 0.5319178122749169, 'max_depth': 4, 'min_child_weight': 6, 'eta': 0.1227720213193811, 'gamma': 3.69278568425865}. Best is trial 164 with value: -1.5157670549647289.
[I 2025-06-20 12:12:44,921] Trial 208 finished with value: -1.5862596750323965 and parameters: {'booster': 'gbtree', 'lambda': 1.5653572825510783e-06, 'alpha': 0.015400815257776734, 'subsample': 0.7072527965471549, 'colsample_bytree': 0.5092571645339199, 'max_depth': 4, 'min_child_weight': 6, 'eta': 0.09614622972578728, 'gamma': 3.8542391353530014}. Best is trial 164 with value: -1.5157670549647289.
[I 2025-06-20 12:12:45,219] Trial 209 finished with value: -1.5929889731373863 and parameters: {'booster': 'gbtree', 'lambda': 9.259939423906281e-07, 'alpha': 0.008147706771047243, 'subsample': 0.6979855970354167, 'colsample_bytree': 0.5342892815599996, 'max_depth': 4, 'min_child_weight': 6, 'eta': 0.07590568176387771, 'gamma': 3.7418630419959764}. Best is trial 164 with value: -1.5157670549647289.
[I 2025-06-20 12:12:45,516] Trial 210 finished with value: -1.5862889968319278 and parameters: {'booster': 'gbtree', 'lambda': 5.982872056132899e-07, 'alpha': 0.015150701732598108, 'subsample': 0.6906477535416778, 'colsample_bytree': 0.5208363898029547, 'max_depth': 4, 'min_child_weight': 6, 'eta': 0.06405562924464402, 'gamma': 3.5289573627934474}. Best is trial 164 with value: -1.5157670549647289.
[I 2025-06-20 12:12:45,823] Trial 211 finished with value: -1.543381629176869 and parameters: {'booster': 'gbtree', 'lambda': 7.414018273834177e-07, 'alpha': 0.01043693671827534, 'subsample': 0.7128765756592239, 'colsample_bytree': 0.5435510091123974, 'max_depth': 4, 'min_child_weight': 6, 'eta': 0.05824263583368541, 'gamma': 3.6223393361179843}. Best is trial 164 with value: -1.5157670549647289.
[I 2025-06-20 12:12:46,083] Trial 212 finished with value: -1.5712643215111262 and parameters: {'booster': 'gbtree', 'lambda': 7.853309366169181e-07, 'alpha': 0.005667301170860238, 'subsample': 0.7166410932732865, 'colsample_bytree': 0.5403981194692616, 'max_depth': 4, 'min_child_weight': 6, 'eta': 0.05945691943361596, 'gamma': 3.633114236645214}. Best is trial 164 with value: -1.5157670549647289.
[I 2025-06-20 12:12:46,213] Trial 213 finished with value: -1.7053498872331603 and parameters: {'booster': 'gbtree', 'lambda': 2.4077691689637613e-06, 'alpha': 0.009064256658066368, 'subsample': 0.704701591539531, 'colsample_bytree': 0.544267131118301, 'max_depth': 4, 'min_child_weight': 6, 'eta': 0.24174827185296127, 'gamma': 3.815952814373562}. Best is trial 164 with value: -1.5157670549647289.
[I 2025-06-20 12:12:46,481] Trial 214 finished with value: -1.5740109080946254 and parameters: {'booster': 'gbtree', 'lambda': 5.052330791023835e-07, 'alpha': 0.004236866456011275, 'subsample': 0.6876209013043882, 'colsample_bytree': 0.5296088377968367, 'max_depth': 4, 'min_child_weight': 6, 'eta': 0.06934147357728138, 'gamma': 3.6038650158890992}. Best is trial 164 with value: -1.5157670549647289.
[I 2025-06-20 12:12:46,787] Trial 215 finished with value: -1.5625482384998686 and parameters: {'booster': 'gbtree', 'lambda': 1.4303078842430352e-06, 'alpha': 0.011200841280897616, 'subsample': 0.708182387994383, 'colsample_bytree': 0.7883829708653581, 'max_depth': 4, 'min_child_weight': 6, 'eta': 0.07931917765467371, 'gamma': 3.8928608467463808}. Best is trial 164 with value: -1.5157670549647289.
[I 2025-06-20 12:12:46,981] Trial 216 finished with value: -1.6008680640904642 and parameters: {'booster': 'gbtree', 'lambda': 6.100636460263171e-07, 'alpha': 0.007171554262771227, 'subsample': 0.678000187912995, 'colsample_bytree': 0.5428898798525725, 'max_depth': 4, 'min_child_weight': 6, 'eta': 0.16228793118787435, 'gamma': 3.507934719579981}. Best is trial 164 with value: -1.5157670549647289.
[I 2025-06-20 12:12:47,246] Trial 217 finished with value: -1.5890926591235917 and parameters: {'booster': 'gbtree', 'lambda': 3.58405171423744e-07, 'alpha': 0.0002094341478478617, 'subsample': 0.7307896398627444, 'colsample_bytree': 0.5235887706042114, 'max_depth': 4, 'min_child_weight': 6, 'eta': 0.060443889412238404, 'gamma': 3.9562817367634775}. Best is trial 164 with value: -1.5157670549647289.
[I 2025-06-20 12:12:47,530] Trial 218 finished with value: -1.549927088917917 and parameters: {'booster': 'gbtree', 'lambda': 3.5473685453027264e-06, 'alpha': 0.028472318646500818, 'subsample': 0.6983327572983655, 'colsample_bytree': 0.551578903488244, 'max_depth': 4, 'min_child_weight': 6, 'eta': 0.05194476292403984, 'gamma': 3.72047448459227}. Best is trial 164 with value: -1.5157670549647289.
[I 2025-06-20 12:12:47,816] Trial 219 finished with value: -1.5738734955965452 and parameters: {'booster': 'gbtree', 'lambda': 1.1142075607629715e-06, 'alpha': 0.004784769969414994, 'subsample': 0.7416238624072706, 'colsample_bytree': 0.5362824479166768, 'max_depth': 4, 'min_child_weight': 6, 'eta': 0.06557116637947046, 'gamma': 4.069830419457169}. Best is trial 164 with value: -1.5157670549647289.
[I 2025-06-20 12:12:47,993] Trial 220 finished with value: -1.589990148109609 and parameters: {'booster': 'gbtree', 'lambda': 1.4484829552186602e-08, 'alpha': 0.01636002275758023, 'subsample': 0.6712273654572021, 'colsample_bytree': 0.5140510752403313, 'max_depth': 4, 'min_child_weight': 6, 'eta': 0.0897288675040704, 'gamma': 3.718039311182486}. Best is trial 164 with value: -1.5157670549647289.
[I 2025-06-20 12:12:48,247] Trial 221 finished with value: -1.5658743264565942 and parameters: {'booster': 'gbtree', 'lambda': 2.4474860535780064e-08, 'alpha': 0.0109194785784458, 'subsample': 0.7847147688959873, 'colsample_bytree': 0.551371869253311, 'max_depth': 4, 'min_child_weight': 6, 'eta': 0.053095601054281676, 'gamma': 3.3097168683010545}. Best is trial 164 with value: -1.5157670549647289.
[I 2025-06-20 12:12:48,497] Trial 222 finished with value: -1.5494324227816347 and parameters: {'booster': 'gbtree', 'lambda': 5.961032611362838e-08, 'alpha': 0.011940181922514274, 'subsample': 0.7721998872098146, 'colsample_bytree': 0.5765308733555924, 'max_depth': 4, 'min_child_weight': 6, 'eta': 0.05717426706582872, 'gamma': 3.493301782580016}. Best is trial 164 with value: -1.5157670549647289.
[I 2025-06-20 12:12:48,724] Trial 223 finished with value: -1.534285116976654 and parameters: {'booster': 'gbtree', 'lambda': 1.0750386146691622e-08, 'alpha': 0.0064517307426858765, 'subsample': 0.7591052495188226, 'colsample_bytree': 0.5420161286391236, 'max_depth': 4, 'min_child_weight': 6, 'eta': 0.0675979580335346, 'gamma': 3.6124683487152103}. Best is trial 164 with value: -1.5157670549647289.
[I 2025-06-20 12:12:49,003] Trial 224 finished with value: -1.5608472051913618 and parameters: {'booster': 'gbtree', 'lambda': 1.0246827890813159e-08, 'alpha': 0.0036980891184706303, 'subsample': 0.757972859488168, 'colsample_bytree': 0.5393095339748376, 'max_depth': 4, 'min_child_weight': 6, 'eta': 0.07197303287727086, 'gamma': 3.5987137118433328}. Best is trial 164 with value: -1.5157670549647289.
[I 2025-06-20 12:12:49,305] Trial 225 finished with value: -1.597958554961749 and parameters: {'booster': 'gbtree', 'lambda': 1.8510656558177016e-08, 'alpha': 0.005580752164925842, 'subsample': 0.6819316837770111, 'colsample_bytree': 0.5208069567150483, 'max_depth': 4, 'min_child_weight': 6, 'eta': 0.06227382874662056, 'gamma': 3.774970711525291}. Best is trial 164 with value: -1.5157670549647289.
[I 2025-06-20 12:12:49,519] Trial 226 finished with value: -1.6034695841730024 and parameters: {'booster': 'gbtree', 'lambda': 3.7773755641493097e-07, 'alpha': 0.007489822296200947, 'subsample': 0.7550094158764961, 'colsample_bytree': 0.9373972011062526, 'max_depth': 4, 'min_child_weight': 6, 'eta': 0.07713851918486332, 'gamma': 3.8473118322448236}. Best is trial 164 with value: -1.5157670549647289.
[I 2025-06-20 12:12:49,830] Trial 227 finished with value: -1.5470771951414282 and parameters: {'booster': 'gbtree', 'lambda': 7.544434601481735e-07, 'alpha': 0.0035898561126017667, 'subsample': 0.7144073621942297, 'colsample_bytree': 0.5508817990111514, 'max_depth': 4, 'min_child_weight': 6, 'eta': 0.10062565261596915, 'gamma': 3.633982265516368}. Best is trial 164 with value: -1.5157670549647289.
[I 2025-06-20 12:12:50,137] Trial 228 finished with value: -1.5629362438550733 and parameters: {'booster': 'gbtree', 'lambda': 1.3724446793203372e-07, 'alpha': 0.000431764276317955, 'subsample': 0.74645779669365, 'colsample_bytree': 0.5322738907620325, 'max_depth': 4, 'min_child_weight': 6, 'eta': 0.06682188438311619, 'gamma': 3.9386748681095205}. Best is trial 164 with value: -1.5157670549647289.
[I 2025-06-20 12:12:50,304] Trial 229 finished with value: -1.6054867674500495 and parameters: {'booster': 'gbtree', 'lambda': 1.045975266409073e-08, 'alpha': 0.0008116825839132335, 'subsample': 0.7660242384939332, 'colsample_bytree': 0.5003455514317169, 'max_depth': 4, 'min_child_weight': 5, 'eta': 0.08761107736404578, 'gamma': 3.50370697215355}. Best is trial 164 with value: -1.5157670549647289.
[I 2025-06-20 12:12:50,607] Trial 230 finished with value: -1.5385417190255148 and parameters: {'booster': 'gbtree', 'lambda': 2.5310793782255855e-08, 'alpha': 0.01898848511344806, 'subsample': 0.7903008373621803, 'colsample_bytree': 0.5583056541893129, 'max_depth': 3, 'min_child_weight': 6, 'eta': 0.04859725613782423, 'gamma': 3.6786653660402737}. Best is trial 164 with value: -1.5157670549647289.
[I 2025-06-20 12:12:50,924] Trial 231 finished with value: -1.5642979169544367 and parameters: {'booster': 'gbtree', 'lambda': 2.5855863999980316e-08, 'alpha': 0.020248574916127905, 'subsample': 0.7923831659997835, 'colsample_bytree': 0.5591602658683233, 'max_depth': 3, 'min_child_weight': 6, 'eta': 0.04952949534769951, 'gamma': 3.677740439864461}. Best is trial 164 with value: -1.5157670549647289.
[I 2025-06-20 12:12:51,241] Trial 232 finished with value: -1.5453555909857999 and parameters: {'booster': 'gbtree', 'lambda': 1.522170182902138e-08, 'alpha': 0.008384176239042009, 'subsample': 0.7717997412291522, 'colsample_bytree': 0.5434614784426586, 'max_depth': 4, 'min_child_weight': 6, 'eta': 0.05831349790770871, 'gamma': 3.572778327566916}. Best is trial 164 with value: -1.5157670549647289.
[I 2025-06-20 12:12:51,538] Trial 233 finished with value: -1.5473335533007768 and parameters: {'booster': 'gbtree', 'lambda': 1.437496922295206e-08, 'alpha': 0.006334840052179442, 'subsample': 0.7755139514627145, 'colsample_bytree': 0.5471848141553367, 'max_depth': 3, 'min_child_weight': 6, 'eta': 0.0604411423410162, 'gamma': 3.783871224649303}. Best is trial 164 with value: -1.5157670549647289.
[I 2025-06-20 12:12:51,812] Trial 234 finished with value: -1.5681538340522008 and parameters: {'booster': 'gbtree', 'lambda': 2.1342838925784346e-08, 'alpha': 0.014784594921689357, 'subsample': 0.8022038864571266, 'colsample_bytree': 0.5561194949442856, 'max_depth': 3, 'min_child_weight': 6, 'eta': 0.07215966741765233, 'gamma': 3.6213591869169477}. Best is trial 164 with value: -1.5157670549647289.
[I 2025-06-20 12:12:52,173] Trial 235 finished with value: -1.538412930779116 and parameters: {'booster': 'gbtree', 'lambda': 1.4478727442653374e-08, 'alpha': 0.009063218966182535, 'subsample': 0.7605796843170751, 'colsample_bytree': 0.5683295729047391, 'max_depth': 4, 'min_child_weight': 6, 'eta': 0.05440138267066694, 'gamma': 3.579329425606696}. Best is trial 164 with value: -1.5157670549647289.
[I 2025-06-20 12:12:52,492] Trial 236 finished with value: -1.548583678864352 and parameters: {'booster': 'gbtree', 'lambda': 1.3939882376476615e-08, 'alpha': 0.004943235481344459, 'subsample': 0.7589665181747982, 'colsample_bytree': 0.5690833499125235, 'max_depth': 4, 'min_child_weight': 6, 'eta': 0.05510896544589729, 'gamma': 3.556691358288033}. Best is trial 164 with value: -1.5157670549647289.
[I 2025-06-20 12:12:52,781] Trial 237 finished with value: -1.5808480283969273 and parameters: {'booster': 'gbtree', 'lambda': 2.1433414597513102e-08, 'alpha': 0.003119185442621129, 'subsample': 0.7814862499278022, 'colsample_bytree': 0.5811939279297108, 'max_depth': 3, 'min_child_weight': 5, 'eta': 0.047555683789521214, 'gamma': 4.351019947080975}. Best is trial 164 with value: -1.5157670549647289.
[I 2025-06-20 12:12:53,070] Trial 238 finished with value: -1.5647352104177972 and parameters: {'booster': 'gbtree', 'lambda': 1.0693810013207792e-08, 'alpha': 0.007347492489731331, 'subsample': 0.7500129352502111, 'colsample_bytree': 0.5694044988564836, 'max_depth': 4, 'min_child_weight': 7, 'eta': 0.06272806481475653, 'gamma': 4.050306418578939}. Best is trial 164 with value: -1.5157670549647289.
[I 2025-06-20 12:12:53,330] Trial 239 finished with value: -1.5689071091881215 and parameters: {'booster': 'gbtree', 'lambda': 3.0128513901974666e-08, 'alpha': 0.001410981297755764, 'subsample': 0.7660625602591867, 'colsample_bytree': 0.5566292774669959, 'max_depth': 4, 'min_child_weight': 6, 'eta': 0.05471341617561504, 'gamma': 3.4448484783130753}. Best is trial 164 with value: -1.5157670549647289.
[I 2025-06-20 12:12:53,561] Trial 240 finished with value: -1.5753984982131986 and parameters: {'booster': 'gbtree', 'lambda': 1.650828816178664e-08, 'alpha': 0.03364307117223975, 'subsample': 0.7935656199099913, 'colsample_bytree': 0.5867732783425156, 'max_depth': 4, 'min_child_weight': 5, 'eta': 0.06613115090194145, 'gamma': 3.9480818635106862}. Best is trial 164 with value: -1.5157670549647289.
[I 2025-06-20 12:12:53,829] Trial 241 finished with value: -1.5247493659241018 and parameters: {'booster': 'gbtree', 'lambda': 4.263266094350054e-08, 'alpha': 0.009667235037752905, 'subsample': 0.7725078101390862, 'colsample_bytree': 0.5509220865714287, 'max_depth': 4, 'min_child_weight': 6, 'eta': 0.07809245634526117, 'gamma': 3.707456922534009}. Best is trial 164 with value: -1.5157670549647289.
[I 2025-06-20 12:12:54,125] Trial 242 finished with value: -1.5767697791836617 and parameters: {'booster': 'gbtree', 'lambda': 4.014149707549957e-08, 'alpha': 0.008107878895933346, 'subsample': 0.7697365746601895, 'colsample_bytree': 0.5473936599669689, 'max_depth': 4, 'min_child_weight': 6, 'eta': 0.07786339763593143, 'gamma': 3.585751495595704}. Best is trial 164 with value: -1.5157670549647289.
[I 2025-06-20 12:12:54,376] Trial 243 finished with value: -1.5632143441501043 and parameters: {'booster': 'gbtree', 'lambda': 8.335581101671151e-08, 'alpha': 0.019825068037899095, 'subsample': 0.7852123292395785, 'colsample_bytree': 0.563459965110096, 'max_depth': 4, 'min_child_weight': 6, 'eta': 0.06946761975529511, 'gamma': 3.6843480424121537}. Best is trial 164 with value: -1.5157670549647289.
[I 2025-06-20 12:12:54,709] Trial 244 finished with value: -1.551336516911566 and parameters: {'booster': 'gbtree', 'lambda': 5.257035653208813e-08, 'alpha': 0.005698542363252201, 'subsample': 0.7608577833795875, 'colsample_bytree': 0.5408756278035721, 'max_depth': 4, 'min_child_weight': 6, 'eta': 0.05831642659526907, 'gamma': 3.8206557780979336}. Best is trial 164 with value: -1.5157670549647289.
[I 2025-06-20 12:12:54,939] Trial 245 finished with value: -1.5675966632791523 and parameters: {'booster': 'gbtree', 'lambda': 2.4361717036684778e-08, 'alpha': 0.008838805932755262, 'subsample': 0.7767434358599936, 'colsample_bytree': 0.5721902746459745, 'max_depth': 4, 'min_child_weight': 6, 'eta': 0.08186702377086442, 'gamma': 3.557507760938064}. Best is trial 164 with value: -1.5157670549647289.
[I 2025-06-20 12:12:55,166] Trial 246 finished with value: -1.5564534998637367 and parameters: {'booster': 'gbtree', 'lambda': 1.002806492354425e-08, 'alpha': 0.002556109284786204, 'subsample': 0.7523098995000947, 'colsample_bytree': 0.5547737283116615, 'max_depth': 4, 'min_child_weight': 6, 'eta': 0.07267830768798315, 'gamma': 3.789153482202439}. Best is trial 164 with value: -1.5157670549647289.
