[I 2025-06-20 12:13:35,866] Trial 355 finished with value: -1.572308123339263 and parameters: {'booster': 'gbtree', 'lambda': 4.19719549526159e-08, 'alpha': 0.0009260776569040701, 'subsample': 0.8120781231943887, 'colsample_bytree': 0.5084544400925815, 'max_depth': 4, 'min_child_weight': 8, 'eta': 0.048086720349439456, 'gamma': 3.6703625764030736}. Best is trial 164 with value: -1.5157670549647289.
[I 2025-06-20 12:13:36,497] Trial 356 finished with value: -1.5333156269739818 and parameters: {'booster': 'gbtree', 'lambda': 1.4456144725717618e-08, 'alpha': 0.00020573961180319505, 'subsample': 0.7791903704943491, 'colsample_bytree': 0.5447448151776845, 'max_depth': 3, 'min_child_weight': 4, 'eta': 0.08595901494435848, 'gamma': 0.047747246288146084}. Best is trial 164 with value: -1.5157670549647289.
[I 2025-06-20 12:13:37,130] Trial 357 finished with value: -1.5931545303063732 and parameters: {'booster': 'gbtree', 'lambda': 1.0082741858968427e-08, 'alpha': 0.0004877397021350118, 'subsample': 0.799373846333529, 'colsample_bytree': 0.549302615352445, 'max_depth': 4, 'min_child_weight': 4, 'eta': 0.09323592438584147, 'gamma': 1.196164696956337}. Best is trial 164 with value: -1.5157670549647289.
[I 2025-06-20 12:13:37,758] Trial 358 finished with value: -1.6262194295815504 and parameters: {'booster': 'gbtree', 'lambda': 1.295794936566532e-08, 'alpha': 0.0027068556488679804, 'subsample': 0.7819666706462757, 'colsample_bytree': 0.5470815868545732, 'max_depth': 5, 'min_child_weight': 4, 'eta': 0.07938641975541394, 'gamma': 0.1969641041025566}. Best is trial 164 with value: -1.5157670549647289.
[I 2025-06-20 12:13:38,248] Trial 359 finished with value: -1.5666187664166675 and parameters: {'booster': 'gbtree', 'lambda': 2.0163092329006797e-08, 'alpha': 0.003843436335330978, 'subsample': 0.7588863835126951, 'colsample_bytree': 0.5398347497051156, 'max_depth': 4, 'min_child_weight': 4, 'eta': 0.07579998379734981, 'gamma': 3.785855399696155}. Best is trial 164 with value: -1.5157670549647289.
[I 2025-06-20 12:13:39,163] Trial 360 finished with value: -1.5745106614700024 and parameters: {'booster': 'gbtree', 'lambda': 1.4778331920550561e-08, 'alpha': 0.00035341413758796487, 'subsample': 0.7893621848274063, 'colsample_bytree': 0.5298567444203041, 'max_depth': 4, 'min_child_weight': 4, 'eta': 0.08874116083447339, 'gamma': 1.6367260054279091}. Best is trial 164 with value: -1.5157670549647289.
[I 2025-06-20 12:13:40,118] Trial 361 finished with value: -1.5954810423212256 and parameters: {'booster': 'gbtree', 'lambda': 2.525484087931478e-08, 'alpha': 0.005954638649313521, 'subsample': 0.7405842969610235, 'colsample_bytree': 0.5588349525218721, 'max_depth': 4, 'min_child_weight': 4, 'eta': 0.06772090140710778, 'gamma': 3.5623630722022863}. Best is trial 164 with value: -1.5157670549647289.
[I 2025-06-20 12:13:40,777] Trial 362 finished with value: -1.5560180201455243 and parameters: {'booster': 'gbtree', 'lambda': 1.015821868672812e-08, 'alpha': 0.0002250508188279754, 'subsample': 0.8060855113517135, 'colsample_bytree': 0.5433879650368172, 'max_depth': 4, 'min_child_weight': 4, 'eta': 0.08263976517880961, 'gamma': 2.320661322801757}. Best is trial 164 with value: -1.5157670549647289.
[I 2025-06-20 12:13:41,668] Trial 363 finished with value: -1.5994791657165388 and parameters: {'booster': 'gbtree', 'lambda': 3.359356116050802e-08, 'alpha': 0.000797464932024345, 'subsample': 0.7713793192498972, 'colsample_bytree': 0.5331691335846084, 'max_depth': 4, 'min_child_weight': 4, 'eta': 0.10225286015034941, 'gamma': 3.9136283139171835}. Best is trial 164 with value: -1.5157670549647289.
[I 2025-06-20 12:13:42,444] Trial 364 finished with value: -1.6449280188285926 and parameters: {'booster': 'gbtree', 'lambda': 1.8366141732525672e-08, 'alpha': 0.0003689268899439615, 'subsample': 0.7916307071657337, 'colsample_bytree': 0.5010343020394258, 'max_depth': 9, 'min_child_weight': 5, 'eta': 0.062182532163861416, 'gamma': 1.9771017884131505}. Best is trial 164 with value: -1.5157670549647289.
[I 2025-06-20 12:13:42,861] Trial 365 finished with value: -1.5530063601873914 and parameters: {'booster': 'gbtree', 'lambda': 2.6778160052837347e-08, 'alpha': 0.012408462396166952, 'subsample': 0.8273529484355711, 'colsample_bytree': 0.5512894872543563, 'max_depth': 4, 'min_child_weight': 7, 'eta': 0.06841869147261961, 'gamma': 0.992755358790189}. Best is trial 164 with value: -1.5157670549647289.
[I 2025-06-20 12:13:43,874] Trial 366 finished with value: -2.1374297071624437 and parameters: {'booster': 'gbtree', 'lambda': 1.5095484228928623e-08, 'alpha': 0.0017775367841858535, 'subsample': 0.7631433028019493, 'colsample_bytree': 0.5311471688797749, 'max_depth': 4, 'min_child_weight': 5, 'eta': 0.001003488651015174, 'gamma': 4.103439157318659}. Best is trial 164 with value: -1.5157670549647289.
[I 2025-06-20 12:13:44,740] Trial 367 finished with value: -1.5795989830124013 and parameters: {'booster': 'gbtree', 'lambda': 2.145381841707935e-08, 'alpha': 0.00022518794766804954, 'subsample': 0.7810476272584612, 'colsample_bytree': 0.7531572237092503, 'max_depth': 4, 'min_child_weight': 4, 'eta': 0.057466111815735924, 'gamma': 0.6233048115803038}. Best is trial 164 with value: -1.5157670549647289.
[I 2025-06-20 12:13:45,693] Trial 368 finished with value: -1.5784680561177364 and parameters: {'booster': 'gbtree', 'lambda': 1.6851136407755287e-07, 'alpha': 0.009042869779990737, 'subsample': 0.8178405059243963, 'colsample_bytree': 0.5650482116902033, 'max_depth': 3, 'min_child_weight': 8, 'eta': 0.08495679304336903, 'gamma': 3.662972622078162}. Best is trial 164 with value: -1.5157670549647289.
[I 2025-06-20 12:14:00,963] Trial 369 finished with value: -1.702245352430703 and parameters: {'booster': 'dart', 'lambda': 3.6961567258592086e-08, 'alpha': 1.6207700010259047e-05, 'subsample': 0.7973901904825023, 'colsample_bytree': 0.5257637867060585, 'max_depth': 6, 'min_child_weight': 5, 'eta': 0.07322695534767606, 'gamma': 3.804380002828191, 'rate_drop': 0.24089163091700191, 'skip_drop': 2.5683705808143387e-08}. Best is trial 164 with value: -1.5157670549647289.
[I 2025-06-20 12:14:01,679] Trial 370 finished with value: -1.5455618140309075 and parameters: {'booster': 'gbtree', 'lambda': 1.3315959006803408e-08, 'alpha': 4.132551470582175e-05, 'subsample': 0.751251893344549, 'colsample_bytree': 0.7008156351452342, 'max_depth': 4, 'min_child_weight': 4, 'eta': 0.04183581131245483, 'gamma': 3.544517251755688}. Best is trial 164 with value: -1.5157670549647289.
[I 2025-06-20 12:14:02,360] Trial 371 finished with value: -1.5736255998318398 and parameters: {'booster': 'gbtree', 'lambda': 1.0101304102353372e-08, 'alpha': 0.005023889116065758, 'subsample': 0.7747822549887097, 'colsample_bytree': 0.5416209596408398, 'max_depth': 4, 'min_child_weight': 5, 'eta': 0.05906904851757433, 'gamma': 4.022745509026562}. Best is trial 164 with value: -1.5157670549647289.
[I 2025-06-20 12:14:03,072] Trial 372 finished with value: -1.565482122274047 and parameters: {'booster': 'gbtree', 'lambda': 2.543653659903696e-08, 'alpha': 0.0007222664731062495, 'subsample': 0.8086207431236957, 'colsample_bytree': 0.5146430294673539, 'max_depth': 5, 'min_child_weight': 7, 'eta': 0.05098591014652791, 'gamma': 4.198849618819516}. Best is trial 164 with value: -1.5157670549647289.
[I 2025-06-20 12:14:03,817] Trial 373 finished with value: -1.5534179179500895 and parameters: {'booster': 'gbtree', 'lambda': 4.929443027552947e-08, 'alpha': 0.0026214308283623723, 'subsample': 0.7834858046373404, 'colsample_bytree': 0.5561798120876799, 'max_depth': 4, 'min_child_weight': 4, 'eta': 0.06494466093006397, 'gamma': 0.42216135966624835}. Best is trial 164 with value: -1.5157670549647289.
[I 2025-06-20 12:14:19,656] Trial 374 finished with value: -1.7284673494424023 and parameters: {'booster': 'dart', 'lambda': 1.8017586290411337e-08, 'alpha': 0.01578603974054236, 'subsample': 0.7640875561973811, 'colsample_bytree': 0.5230183031321459, 'max_depth': 4, 'min_child_weight': 5, 'eta': 0.07417766130516733, 'gamma': 4.369029214581564, 'rate_drop': 0.20270806421590676, 'skip_drop': 7.137062783532078e-08}. Best is trial 164 with value: -1.5157670549647289.
[I 2025-06-20 12:14:20,530] Trial 375 finished with value: -1.5818277162979555 and parameters: {'booster': 'gbtree', 'lambda': 3.0858802257817514e-08, 'alpha': 0.0004438587149960694, 'subsample': 0.6666932827469102, 'colsample_bytree': 0.5093487123779511, 'max_depth': 4, 'min_child_weight': 8, 'eta': 0.04414824240799356, 'gamma': 2.1833015093347887}. Best is trial 164 with value: -1.5157670549647289.
[I 2025-06-20 12:14:21,243] Trial 376 finished with value: -1.590610314780062 and parameters: {'booster': 'gbtree', 'lambda': 8.327063295662018e-06, 'alpha': 0.007178012286056709, 'subsample': 0.8004781958548428, 'colsample_bytree': 0.5759539077891858, 'max_depth': 3, 'min_child_weight': 10, 'eta': 0.05708194092068161, 'gamma': 1.3671407547323793}. Best is trial 164 with value: -1.5157670549647289.
[I 2025-06-20 12:14:21,623] Trial 377 finished with value: -1.5876902949253047 and parameters: {'booster': 'gbtree', 'lambda': 1.754619129336785e-08, 'alpha': 0.0013387492186273935, 'subsample': 0.7886210170576807, 'colsample_bytree': 0.5454707634045799, 'max_depth': 4, 'min_child_weight': 5, 'eta': 0.10842610425717217, 'gamma': 1.0067645819414222}. Best is trial 164 with value: -1.5157670549647289.
[I 2025-06-20 12:14:22,584] Trial 378 finished with value: -1.5300513898067059 and parameters: {'booster': 'gbtree', 'lambda': 8.816745691519512e-08, 'alpha': 7.606817730855215e-05, 'subsample': 0.8599157420387218, 'colsample_bytree': 0.5342423273296953, 'max_depth': 4, 'min_child_weight': 5, 'eta': 0.06337395671459115, 'gamma': 0.05399818767662991}. Best is trial 164 with value: -1.5157670549647289.
[I 2025-06-20 12:14:35,261] Trial 379 finished with value: -1.7001968612848881 and parameters: {'booster': 'dart', 'lambda': 1.0434136670974657e-07, 'alpha': 5.221232394450972e-05, 'subsample': 0.8578668279151299, 'colsample_bytree': 0.5382786954119193, 'max_depth': 4, 'min_child_weight': 5, 'eta': 0.015107755696475688, 'gamma': 0.13755944171022041, 'rate_drop': 0.06803098417663786, 'skip_drop': 0.543700774682055}. Best is trial 164 with value: -1.5157670549647289.
[I 2025-06-20 12:14:35,554] Trial 380 finished with value: -1.6020828868452388 and parameters: {'booster': 'gbtree', 'lambda': 1.0547884387960708e-07, 'alpha': 6.420114607760398e-05, 'subsample': 0.7436766130088814, 'colsample_bytree': 0.555131507111933, 'max_depth': 4, 'min_child_weight': 5, 'eta': 0.06670537120587677, 'gamma': 0.0555857771039894}. Best is trial 164 with value: -1.5157670549647289.
[I 2025-06-20 12:14:35,917] Trial 381 finished with value: -1.5517107191500696 and parameters: {'booster': 'gbtree', 'lambda': 1.668347070074588e-07, 'alpha': 0.00010629854279357549, 'subsample': 0.7341060525999107, 'colsample_bytree': 0.5331898755643191, 'max_depth': 3, 'min_child_weight': 5, 'eta': 0.09408627697284835, 'gamma': 3.438897668467723}. Best is trial 164 with value: -1.5157670549647289.
[I 2025-06-20 12:14:36,305] Trial 382 finished with value: -1.5714099512646478 and parameters: {'booster': 'gbtree', 'lambda': 7.26349170940445e-08, 'alpha': 3.224267994719914e-05, 'subsample': 0.919287069828096, 'colsample_bytree': 0.5631004882883915, 'max_depth': 4, 'min_child_weight': 5, 'eta': 0.05133467678531869, 'gamma': 0.40159260768148136}. Best is trial 164 with value: -1.5157670549647289.
[I 2025-06-20 12:14:36,672] Trial 383 finished with value: -1.564023374578119 and parameters: {'booster': 'gbtree', 'lambda': 3.9583167648026184e-08, 'alpha': 8.235025202078541e-05, 'subsample': 0.9060834184440562, 'colsample_bytree': 0.5452582605181253, 'max_depth': 4, 'min_child_weight': 5, 'eta': 0.07522607353557566, 'gamma': 0.09173068876091202}. Best is trial 164 with value: -1.5157670549647289.
[I 2025-06-20 12:14:43,555] Trial 384 finished with value: -1.9984540408703575 and parameters: {'booster': 'dart', 'lambda': 1.3843437385681735e-07, 'alpha': 0.00016610166996226366, 'subsample': 0.7594968416264425, 'colsample_bytree': 0.5305726073813528, 'max_depth': 4, 'min_child_weight': 5, 'eta': 0.044886062714366015, 'gamma': 0.14858530525870225, 'rate_drop': 0.481396335301588, 'skip_drop': 9.585160085571283e-06}. Best is trial 164 with value: -1.5157670549647289.
[I 2025-06-20 12:14:43,907] Trial 385 finished with value: -1.5430154570023922 and parameters: {'booster': 'gbtree', 'lambda': 5.741045971975817e-08, 'alpha': 0.00011180534190995688, 'subsample': 0.8321761291612161, 'colsample_bytree': 0.5680001271419287, 'max_depth': 4, 'min_child_weight': 5, 'eta': 0.06453896774806038, 'gamma': 0.04742857057155814}. Best is trial 164 with value: -1.5157670549647289.
[I 2025-06-20 12:14:44,287] Trial 386 finished with value: -1.5729650748720405 and parameters: {'booster': 'gbtree', 'lambda': 1.5352432610035947e-08, 'alpha': 0.003783389012798842, 'subsample': 0.8765758581385885, 'colsample_bytree': 0.5523146513403699, 'max_depth': 4, 'min_child_weight': 5, 'eta': 0.03808703789833634, 'gamma': 3.629237205606316}. Best is trial 164 with value: -1.5157670549647289.
[I 2025-06-20 12:14:44,644] Trial 387 finished with value: -1.5414383515201622 and parameters: {'booster': 'gbtree', 'lambda': 9.258287769297075e-08, 'alpha': 0.00022643202247124282, 'subsample': 0.8766312902711472, 'colsample_bytree': 0.6822136429734099, 'max_depth': 3, 'min_child_weight': 8, 'eta': 0.053445558049246875, 'gamma': 3.2137611195156817}. Best is trial 164 with value: -1.5157670549647289.
[I 2025-06-20 12:14:45,007] Trial 388 finished with value: -1.5851355808007168 and parameters: {'booster': 'gbtree', 'lambda': 1.018111363798522e-08, 'alpha': 0.011865819921349198, 'subsample': 0.6904422694646515, 'colsample_bytree': 0.5399077558971761, 'max_depth': 4, 'min_child_weight': 5, 'eta': 0.031784777786651716, 'gamma': 3.5127071504954044}. Best is trial 164 with value: -1.5157670549647289.
[I 2025-06-20 12:14:52,951] Trial 389 finished with value: -1.7081882352163702 and parameters: {'booster': 'dart', 'lambda': 4.6479190269215324e-08, 'alpha': 5.6422092834337036e-05, 'subsample': 0.8439738397593768, 'colsample_bytree': 0.5225614707263682, 'max_depth': 4, 'min_child_weight': 1, 'eta': 0.08791788479092383, 'gamma': 3.3686322933843758, 'rate_drop': 0.2087801615445507, 'skip_drop': 1.0435772656208754e-08}. Best is trial 164 with value: -1.5157670549647289.
[I 2025-06-20 12:14:53,340] Trial 390 finished with value: -1.5518549385065703 and parameters: {'booster': 'gbtree', 'lambda': 2.260620878293364e-08, 'alpha': 0.007976718357900845, 'subsample': 0.8529940587122008, 'colsample_bytree': 0.5784771188317906, 'max_depth': 4, 'min_child_weight': 5, 'eta': 0.047790696735330776, 'gamma': 0.020967396363502123}. Best is trial 164 with value: -1.5157670549647289.
[I 2025-06-20 12:14:53,667] Trial 391 finished with value: -1.658201923542239 and parameters: {'booster': 'gbtree', 'lambda': 1.3875063805854773e-08, 'alpha': 0.02093980083871061, 'subsample': 0.8951854790894391, 'colsample_bytree': 0.5491314896501218, 'max_depth': 8, 'min_child_weight': 6, 'eta': 0.0591977954751172, 'gamma': 0.7787241250254024}. Best is trial 164 with value: -1.5157670549647289.
[I 2025-06-20 12:14:53,941] Trial 392 finished with value: -1.5889238037807878 and parameters: {'booster': 'gbtree', 'lambda': 7.920248601784962e-08, 'alpha': 0.0053906547267439, 'subsample': 0.7691682193777547, 'colsample_bytree': 0.5267379913534177, 'max_depth': 5, 'min_child_weight': 5, 'eta': 0.07004003808696752, 'gamma': 0.28598402086478913}. Best is trial 164 with value: -1.5157670549647289.
[I 2025-06-20 12:14:54,305] Trial 393 finished with value: -2.079991232682738 and parameters: {'booster': 'gbtree', 'lambda': 3.140624312766747e-08, 'alpha': 0.00014434465764655248, 'subsample': 0.972400896756871, 'colsample_bytree': 0.5185236233679275, 'max_depth': 4, 'min_child_weight': 6, 'eta': 0.001570996675223066, 'gamma': 0.32994059240248497}. Best is trial 164 with value: -1.5157670549647289.
[I 2025-06-20 12:15:03,128] Trial 394 finished with value: -1.5684007652321683 and parameters: {'booster': 'dart', 'lambda': 2.224688808193152e-08, 'alpha': 0.00033304794700679264, 'subsample': 0.9411284097514453, 'colsample_bytree': 0.5583950765040315, 'max_depth': 3, 'min_child_weight': 5, 'eta': 0.053366359402932634, 'gamma': 3.703761591443432, 'rate_drop': 0.00047571208614994643, 'skip_drop': 6.211230396592479e-06}. Best is trial 164 with value: -1.5157670549647289.
[I 2025-06-20 12:15:03,373] Trial 395 finished with value: -1.575725712649021 and parameters: {'booster': 'gbtree', 'lambda': 5.1412732605504115e-08, 'alpha': 0.010237910122903393, 'subsample': 0.7913528055011613, 'colsample_bytree': 0.5382924365468461, 'max_depth': 4, 'min_child_weight': 6, 'eta': 0.07876923535341653, 'gamma': 3.5605318150577294}. Best is trial 164 with value: -1.5157670549647289.
[I 2025-06-20 12:15:03,717] Trial 396 finished with value: -1.5524896914085227 and parameters: {'booster': 'gbtree', 'lambda': 1.7286248986510765e-07, 'alpha': 0.0032418970222691202, 'subsample': 0.7488755575586983, 'colsample_bytree': 0.5674615726541317, 'max_depth': 4, 'min_child_weight': 5, 'eta': 0.06255833886857741, 'gamma': 2.4553718138316873}. Best is trial 164 with value: -1.5157670549647289.
[I 2025-06-20 12:15:04,190] Trial 397 finished with value: -1.5759376598054806 and parameters: {'booster': 'gbtree', 'lambda': 1.58293640873155e-08, 'alpha': 0.00020711113323192596, 'subsample': 0.8167815897129695, 'colsample_bytree': 0.5882411524147605, 'max_depth': 4, 'min_child_weight': 7, 'eta': 0.042626167673227765, 'gamma': 0.21356532292441827}. Best is trial 164 with value: -1.5157670549647289.
[I 2025-06-20 12:15:04,526] Trial 398 finished with value: -1.5582108455591612 and parameters: {'booster': 'gbtree', 'lambda': 3.0444304506287946e-08, 'alpha': 0.007273351919038992, 'subsample': 0.7797850644344131, 'colsample_bytree': 0.5318200813335912, 'max_depth': 4, 'min_child_weight': 5, 'eta': 0.04930001805252857, 'gamma': 3.925281764588938}. Best is trial 164 with value: -1.5157670549647289.
[I 2025-06-20 12:15:13,477] Trial 399 finished with value: -1.5669081116662096 and parameters: {'booster': 'dart', 'lambda': 1.0217526964729428e-08, 'alpha': 7.48119060654273e-05, 'subsample': 0.8004725287114107, 'colsample_bytree': 0.51498860542329, 'max_depth': 4, 'min_child_weight': 2, 'eta': 0.05730295381366516, 'gamma': 3.7300316529324404, 'rate_drop': 0.0002778684944566591, 'skip_drop': 1.5617487889444678e-08}. Best is trial 164 with value: -1.5157670549647289.
[I 2025-06-20 12:15:13,857] Trial 400 finished with value: -1.5814823752878324 and parameters: {'booster': 'gbtree', 'lambda': 4.130809001262877e-08, 'alpha': 0.013474305826591886, 'subsample': 0.7571218907271653, 'colsample_bytree': 0.5437806177165935, 'max_depth': 4, 'min_child_weight': 9, 'eta': 0.07111717303092953, 'gamma': 4.526388541914789}. Best is trial 164 with value: -1.5157670549647289.
[I 2025-06-20 12:15:14,154] Trial 401 finished with value: -1.613097461057335 and parameters: {'booster': 'gbtree', 'lambda': 1.9455508228513714e-08, 'alpha': 0.0001143563705441405, 'subsample': 0.7227082593414166, 'colsample_bytree': 0.6652563914914166, 'max_depth': 5, 'min_child_weight': 6, 'eta': 0.08391733719131235, 'gamma': 3.6290534321532837}. Best is trial 164 with value: -1.5157670549647289.
[I 2025-06-20 12:15:14,620] Trial 402 finished with value: -1.6028437871414285 and parameters: {'booster': 'gbtree', 'lambda': 0.00020447312587946304, 'alpha': 2.037271294441814e-05, 'subsample': 0.6804951649611473, 'colsample_bytree': 0.5555922908379715, 'max_depth': 4, 'min_child_weight': 8, 'eta': 0.0639231460993417, 'gamma': 3.753764110345163}. Best is trial 164 with value: -1.5157670549647289.
[I 2025-06-20 12:15:15,053] Trial 403 finished with value: -1.559591907819958 and parameters: {'booster': 'gbtree', 'lambda': 7.416086476673119e-08, 'alpha': 0.0055343747148384964, 'subsample': 0.7696692257516389, 'colsample_bytree': 0.524338837115042, 'max_depth': 3, 'min_child_weight': 5, 'eta': 0.05426785217907213, 'gamma': 3.455477602479203}. Best is trial 164 with value: -1.5157670549647289.
[I 2025-06-20 12:15:24,063] Trial 404 finished with value: -1.6659573884503442 and parameters: {'booster': 'dart', 'lambda': 1.543280690967188e-08, 'alpha': 0.0003239570329124459, 'subsample': 0.7854514793239652, 'colsample_bytree': 0.571342348028013, 'max_depth': 4, 'min_child_weight': 6, 'eta': 0.04501292561165399, 'gamma': 3.9522392615287596, 'rate_drop': 0.07541189963407438, 'skip_drop': 4.052822384132466e-08}. Best is trial 164 with value: -1.5157670549647289.
[I 2025-06-20 12:15:24,598] Trial 405 finished with value: -1.5754259426243336 and parameters: {'booster': 'gbtree', 'lambda': 1.3983194619016503e-07, 'alpha': 0.002154492476252434, 'subsample': 0.810177736921299, 'colsample_bytree': 0.5116034928994264, 'max_depth': 4, 'min_child_weight': 5, 'eta': 0.03807955767881757, 'gamma': 3.855716679272894}. Best is trial 164 with value: -1.5157670549647289.
[I 2025-06-20 12:15:25,049] Trial 406 finished with value: -1.5505057388954027 and parameters: {'booster': 'gbtree', 'lambda': 2.9648890176175803e-08, 'alpha': 0.018309805241425843, 'subsample': 0.7077898345210046, 'colsample_bytree': 0.5360891569588561, 'max_depth': 4, 'min_child_weight': 7, 'eta': 0.04974393247740547, 'gamma': 2.856396329483546}. Best is trial 164 with value: -1.5157670549647289.
[I 2025-06-20 12:15:25,354] Trial 407 finished with value: -1.5621834115284303 and parameters: {'booster': 'gbtree', 'lambda': 2.071608334446823e-08, 'alpha': 0.004325970193707636, 'subsample': 0.7937468167875141, 'colsample_bytree': 0.5457632309215844, 'max_depth': 4, 'min_child_weight': 6, 'eta': 0.06071867360574572, 'gamma': 3.5606624751542073}. Best is trial 164 with value: -1.5157670549647289.
