[I 2025-06-20 12:16:19,043] Trial 462 finished with value: -1.5598975745953014 and parameters: {'booster': 'gbtree', 'lambda': 0.10892919807862339, 'alpha': 0.0017969960147177853, 'subsample': 0.7345557535225855, 'colsample_bytree': 0.5098144542748426, 'max_depth': 3, 'min_child_weight': 6, 'eta': 0.09052283988575999, 'gamma': 2.680934977110974}. Best is trial 164 with value: -1.5157670549647289.
[I 2025-06-20 12:16:19,474] Trial 463 finished with value: -1.6321218168051594 and parameters: {'booster': 'gbtree', 'lambda': 5.963950234251098e-08, 'alpha': 8.557322583040813e-08, 'subsample': 0.7458538555088983, 'colsample_bytree': 0.5159794871529005, 'max_depth': 5, 'min_child_weight': 6, 'eta': 0.06930286344401118, 'gamma': 4.6970245993572615}. Best is trial 164 with value: -1.5157670549647289.
[I 2025-06-20 12:16:20,070] Trial 464 finished with value: -1.757654475583846 and parameters: {'booster': 'gbtree', 'lambda': 1.1095680483327007e-07, 'alpha': 0.0005465820744464044, 'subsample': 0.7560481411030586, 'colsample_bytree': 0.5172396971092307, 'max_depth': 4, 'min_child_weight': 6, 'eta': 0.007952978514340913, 'gamma': 2.5488438787316925}. Best is trial 164 with value: -1.5157670549647289.
[I 2025-06-20 12:16:20,521] Trial 465 finished with value: -1.587989476409453 and parameters: {'booster': 'gbtree', 'lambda': 0.0006078163084307307, 'alpha': 0.0012735449822829574, 'subsample': 0.5189603350422094, 'colsample_bytree': 0.5271345937720259, 'max_depth': 4, 'min_child_weight': 6, 'eta': 0.06061260226858746, 'gamma': 2.843716495231914}. Best is trial 164 with value: -1.5157670549647289.
[I 2025-06-20 12:16:20,771] Trial 466 finished with value: -1.5920569499382766 and parameters: {'booster': 'gbtree', 'lambda': 2.882103533864499e-08, 'alpha': 0.0008567687424104507, 'subsample': 0.7151109494609148, 'colsample_bytree': 0.513868986138557, 'max_depth': 4, 'min_child_weight': 8, 'eta': 0.06572464763316918, 'gamma': 2.678634343123814}. Best is trial 164 with value: -1.5157670549647289.
[I 2025-06-20 12:16:21,055] Trial 467 finished with value: -1.572084932958857 and parameters: {'booster': 'gbtree', 'lambda': 5.0444658839609176e-08, 'alpha': 0.00012645619105627323, 'subsample': 0.7526857084903031, 'colsample_bytree': 0.5317013324912676, 'max_depth': 4, 'min_child_weight': 6, 'eta': 0.07694382105037595, 'gamma': 3.560788168467987}. Best is trial 164 with value: -1.5157670549647289.
[I 2025-06-20 12:16:21,470] Trial 468 finished with value: -1.5595139789658845 and parameters: {'booster': 'gbtree', 'lambda': 2.3302087234853752e-08, 'alpha': 0.0004778081196239355, 'subsample': 0.6730787279593791, 'colsample_bytree': 0.5063646333631796, 'max_depth': 4, 'min_child_weight': 6, 'eta': 0.05633706482110313, 'gamma': 1.4768780512603432}. Best is trial 164 with value: -1.5157670549647289.
[I 2025-06-20 12:16:21,877] Trial 469 finished with value: -1.574942659356332 and parameters: {'booster': 'gbtree', 'lambda': 0.17460693590074072, 'alpha': 0.004113375768793108, 'subsample': 0.7364505060764969, 'colsample_bytree': 0.5240859776437208, 'max_depth': 3, 'min_child_weight': 7, 'eta': 0.04947369247012617, 'gamma': 2.429786650645052}. Best is trial 164 with value: -1.5157670549647289.
[I 2025-06-20 12:16:22,244] Trial 470 finished with value: -1.5747718862584743 and parameters: {'booster': 'gbtree', 'lambda': 2.6346607784081444, 'alpha': 0.00245532920350773, 'subsample': 0.6898621244413967, 'colsample_bytree': 0.5357797761727923, 'max_depth': 4, 'min_child_weight': 8, 'eta': 0.060588497053833235, 'gamma': 2.7320861210148646}. Best is trial 164 with value: -1.5157670549647289.
[I 2025-06-20 12:16:22,671] Trial 471 finished with value: -1.5403799972202878 and parameters: {'booster': 'gbtree', 'lambda': 3.298351552594357e-08, 'alpha': 9.225178898530303e-05, 'subsample': 0.7637048673189196, 'colsample_bytree': 0.5111577644019066, 'max_depth': 4, 'min_child_weight': 6, 'eta': 0.07307640140101017, 'gamma': 3.490102980862442}. Best is trial 164 with value: -1.5157670549647289.
[I 2025-06-20 12:16:23,061] Trial 472 finished with value: -1.5780500773803319 and parameters: {'booster': 'gbtree', 'lambda': 7.284934003088904e-08, 'alpha': 3.630293394574591e-05, 'subsample': 0.7815224786955659, 'colsample_bytree': 0.5215174240218248, 'max_depth': 4, 'min_child_weight': 6, 'eta': 0.04432122154386312, 'gamma': 2.940171903338219}. Best is trial 164 with value: -1.5157670549647289.
[I 2025-06-20 12:16:23,391] Trial 473 finished with value: -1.5491857303102732 and parameters: {'booster': 'gbtree', 'lambda': 2.2140238576065885e-08, 'alpha': 0.00108050645253664, 'subsample': 0.7493156311879157, 'colsample_bytree': 0.5416430351455471, 'max_depth': 4, 'min_child_weight': 8, 'eta': 0.09880542514083253, 'gamma': 3.6528001132576793}. Best is trial 164 with value: -1.5157670549647289.
[I 2025-06-20 12:16:23,717] Trial 474 finished with value: -1.5742772463156842 and parameters: {'booster': 'gbtree', 'lambda': 2.9038727375618803e-07, 'alpha': 0.005702012990019359, 'subsample': 0.7698077537823361, 'colsample_bytree': 0.5010223500149937, 'max_depth': 4, 'min_child_weight': 6, 'eta': 0.08527508636580276, 'gamma': 3.570346890748021}. Best is trial 164 with value: -1.5157670549647289.
[I 2025-06-20 12:16:24,262] Trial 475 finished with value: -1.5605747297739228 and parameters: {'booster': 'gbtree', 'lambda': 1.6749328891440428e-08, 'alpha': 0.00023614674830341585, 'subsample': 0.7616980431966893, 'colsample_bytree': 0.5320236309232546, 'max_depth': 4, 'min_child_weight': 8, 'eta': 0.05325482458826062, 'gamma': 0.8103936692946001}. Best is trial 164 with value: -1.5157670549647289.
[I 2025-06-20 12:16:24,750] Trial 476 finished with value: -1.5424953349480108 and parameters: {'booster': 'gbtree', 'lambda': 3.765705269692339e-08, 'alpha': 0.007784004398933986, 'subsample': 0.7771051495017742, 'colsample_bytree': 0.5493401462052236, 'max_depth': 3, 'min_child_weight': 7, 'eta': 0.06221420311473479, 'gamma': 3.728359417171725}. Best is trial 164 with value: -1.5157670549647289.
[I 2025-06-20 12:16:25,173] Trial 477 finished with value: -1.5232304858908976 and parameters: {'booster': 'gbtree', 'lambda': 2.0403847804926278e-07, 'alpha': 0.0020054412759115173, 'subsample': 0.8053344384645933, 'colsample_bytree': 0.5182998591441635, 'max_depth': 4, 'min_child_weight': 5, 'eta': 0.04725116290639785, 'gamma': 3.388174873516458}. Best is trial 164 with value: -1.5157670549647289.
[I 2025-06-20 12:16:25,602] Trial 478 finished with value: -1.5355353143109138 and parameters: {'booster': 'gbtree', 'lambda': 1.9022419391864697e-07, 'alpha': 0.0020078172895469024, 'subsample': 0.8169507093544361, 'colsample_bytree': 0.5120330688309587, 'max_depth': 4, 'min_child_weight': 5, 'eta': 0.06833132261971817, 'gamma': 3.31465132831359}. Best is trial 164 with value: -1.5157670549647289.
[I 2025-06-20 12:16:25,823] Trial 479 finished with value: -1.5758064742252917 and parameters: {'booster': 'gbtree', 'lambda': 2.5190656506708714e-07, 'alpha': 0.001959142219110958, 'subsample': 0.8320733016281695, 'colsample_bytree': 0.5097964305060033, 'max_depth': 4, 'min_child_weight': 5, 'eta': 0.07940791160135098, 'gamma': 3.177725759021349}. Best is trial 164 with value: -1.5157670549647289.
[I 2025-06-20 12:16:26,150] Trial 480 finished with value: -1.5538994213824233 and parameters: {'booster': 'gbtree', 'lambda': 1.49695549919518e-07, 'alpha': 0.0013245921224201494, 'subsample': 0.815883680964301, 'colsample_bytree': 0.5189872018589498, 'max_depth': 4, 'min_child_weight': 5, 'eta': 0.07220609582797644, 'gamma': 3.326355639633312}. Best is trial 164 with value: -1.5157670549647289.
[I 2025-06-20 12:16:26,455] Trial 481 finished with value: -1.5384421682839413 and parameters: {'booster': 'gbtree', 'lambda': 2.818579204419963e-07, 'alpha': 0.0017966811017091154, 'subsample': 0.8197136556164669, 'colsample_bytree': 0.5121254176001167, 'max_depth': 4, 'min_child_weight': 5, 'eta': 0.06780153861043738, 'gamma': 3.2259953597391244}. Best is trial 164 with value: -1.5157670549647289.
[I 2025-06-20 12:16:26,871] Trial 482 finished with value: -1.6549599726361588 and parameters: {'booster': 'gbtree', 'lambda': 4.0660201104649273e-07, 'alpha': 0.002586454318903489, 'subsample': 0.8403844310307469, 'colsample_bytree': 0.5008140307755692, 'max_depth': 4, 'min_child_weight': 5, 'eta': 0.013360402387452801, 'gamma': 3.339674498108199}. Best is trial 164 with value: -1.5157670549647289.
[I 2025-06-20 12:16:29,567] Trial 483 finished with value: -1.5635237305808316 and parameters: {'booster': 'dart', 'lambda': 1.8480239605969133e-07, 'alpha': 0.0016550578244205851, 'subsample': 0.8079593165631361, 'colsample_bytree': 0.5234649103478507, 'max_depth': 4, 'min_child_weight': 5, 'eta': 0.08458162400330672, 'gamma': 3.0921847854316287, 'rate_drop': 1.7329479817546546e-08, 'skip_drop': 0.00034291362510524353}. Best is trial 164 with value: -1.5157670549647289.
[I 2025-06-20 12:16:29,837] Trial 484 finished with value: -1.587426084157908 and parameters: {'booster': 'gbtree', 'lambda': 1.648630233335164e-07, 'alpha': 0.0011215782994027778, 'subsample': 0.8269552696600097, 'colsample_bytree': 0.510280625869175, 'max_depth': 4, 'min_child_weight': 5, 'eta': 0.11653023388242618, 'gamma': 3.3095385502055685}. Best is trial 164 with value: -1.5157670549647289.
[I 2025-06-20 12:16:30,235] Trial 485 finished with value: -1.5716668895508528 and parameters: {'booster': 'gbtree', 'lambda': 1.1353236271695425e-07, 'alpha': 1.1047217509147234e-08, 'subsample': 0.8655930546540188, 'colsample_bytree': 0.5186911425678057, 'max_depth': 4, 'min_child_weight': 5, 'eta': 0.06598920862581355, 'gamma': 3.452597588415356}. Best is trial 164 with value: -1.5157670549647289.
[I 2025-06-20 12:16:30,570] Trial 486 finished with value: -1.581722549064306 and parameters: {'booster': 'gbtree', 'lambda': 2.668509528516042e-07, 'alpha': 0.003071797490101124, 'subsample': 0.8000006454677315, 'colsample_bytree': 0.5000055663620937, 'max_depth': 4, 'min_child_weight': 5, 'eta': 0.07514702514436136, 'gamma': 1.7567285460909499}. Best is trial 164 with value: -1.5157670549647289.
[I 2025-06-20 12:16:30,941] Trial 487 finished with value: -1.5259061890841739 and parameters: {'booster': 'gbtree', 'lambda': 1.2024404262263861e-07, 'alpha': 0.0006136122066542039, 'subsample': 0.8141270022480952, 'colsample_bytree': 0.5277718509734043, 'max_depth': 4, 'min_child_weight': 9, 'eta': 0.09126787209027525, 'gamma': 3.1201576774355053}. Best is trial 164 with value: -1.5157670549647289.
[I 2025-06-20 12:16:31,246] Trial 488 finished with value: -1.5661019001082537 and parameters: {'booster': 'gbtree', 'lambda': 2.0204498056525355e-07, 'alpha': 0.0007374406086760566, 'subsample': 0.8177564928982498, 'colsample_bytree': 0.5260550264762434, 'max_depth': 5, 'min_child_weight': 9, 'eta': 0.09334719024905481, 'gamma': 3.1963851626187405}. Best is trial 164 with value: -1.5157670549647289.
[I 2025-06-20 12:16:33,900] Trial 489 finished with value: -1.5846210593041359 and parameters: {'booster': 'dart', 'lambda': 1.1902005336346301e-07, 'alpha': 0.0018866339868450453, 'subsample': 0.8437303610374678, 'colsample_bytree': 0.5332996454532413, 'max_depth': 4, 'min_child_weight': 10, 'eta': 0.10675728679663572, 'gamma': 3.0521412577184486, 'rate_drop': 2.2298617897919245e-07, 'skip_drop': 4.072878892953436e-06}. Best is trial 164 with value: -1.5157670549647289.
[I 2025-06-20 12:16:34,256] Trial 490 finished with value: -1.548387286012145 and parameters: {'booster': 'gbtree', 'lambda': 2.0187419237170009e-07, 'alpha': 0.0012857025018500306, 'subsample': 0.8115681793315989, 'colsample_bytree': 0.5347481066574887, 'max_depth': 4, 'min_child_weight': 9, 'eta': 0.0933106118649934, 'gamma': 3.1350837016803625}. Best is trial 164 with value: -1.5157670549647289.
[I 2025-06-20 12:16:34,727] Trial 491 finished with value: -1.568450515360719 and parameters: {'booster': 'gbtree', 'lambda': 4.1307972433028763e-07, 'alpha': 0.00315825102825112, 'subsample': 0.819972318169301, 'colsample_bytree': 0.5247506913925972, 'max_depth': 6, 'min_child_weight': 10, 'eta': 0.0996618865285189, 'gamma': 3.2645941079863183}. Best is trial 164 with value: -1.5157670549647289.
[I 2025-06-20 12:16:34,997] Trial 492 finished with value: -1.5713217813043436 and parameters: {'booster': 'gbtree', 'lambda': 9.490252821869318e-08, 'alpha': 0.0009477525691647151, 'subsample': 0.8295593330945801, 'colsample_bytree': 0.5381269509411474, 'max_depth': 4, 'min_child_weight': 10, 'eta': 0.08297371311605017, 'gamma': 3.414216735916436}. Best is trial 164 with value: -1.5157670549647289.
[I 2025-06-20 12:16:35,464] Trial 493 finished with value: -1.5899269098975783 and parameters: {'booster': 'gbtree', 'lambda': 1.4305799988587733e-07, 'alpha': 0.0006265462470568, 'subsample': 0.9054623012045264, 'colsample_bytree': 0.7248815792169553, 'max_depth': 4, 'min_child_weight': 9, 'eta': 0.030791328395384794, 'gamma': 3.0104610669013874}. Best is trial 164 with value: -1.5157670549647289.
[I 2025-06-20 12:16:35,711] Trial 494 finished with value: -1.5812498173291911 and parameters: {'booster': 'gbtree', 'lambda': 9.445988717888223e-08, 'alpha': 0.0038205774296839186, 'subsample': 0.8075230411454253, 'colsample_bytree': 0.5191484832829562, 'max_depth': 4, 'min_child_weight': 9, 'eta': 0.08110673583736638, 'gamma': 3.2748297152852883}. Best is trial 164 with value: -1.5157670549647289.
[I 2025-06-20 12:16:38,260] Trial 495 finished with value: -1.5962723015505442 and parameters: {'booster': 'dart', 'lambda': 1.3301772125430303e-07, 'alpha': 0.002415130824562732, 'subsample': 0.8053553149893143, 'colsample_bytree': 0.5291565685017483, 'max_depth': 4, 'min_child_weight': 5, 'eta': 0.07216878375350744, 'gamma': 3.3809372648956524, 'rate_drop': 0.00021021441427818705, 'skip_drop': 2.4914841351605406e-06}. Best is trial 164 with value: -1.5157670549647289.
[I 2025-06-20 12:16:38,593] Trial 496 finished with value: -1.5785166842368763 and parameters: {'booster': 'gbtree', 'lambda': 3.5731421226084194e-07, 'alpha': 6.927362658167538e-05, 'subsample': 0.8123297146808813, 'colsample_bytree': 0.5377653581032125, 'max_depth': 4, 'min_child_weight': 9, 'eta': 0.1128588064421812, 'gamma': 3.1067724104695635}. Best is trial 164 with value: -1.5157670549647289.
[I 2025-06-20 12:16:38,829] Trial 497 finished with value: -1.5771517418598033 and parameters: {'booster': 'gbtree', 'lambda': 1.0348184303159904e-07, 'alpha': 0.0015163455983748003, 'subsample': 0.8546152873473134, 'colsample_bytree': 0.5197222996852706, 'max_depth': 4, 'min_child_weight': 10, 'eta': 0.09090043418819092, 'gamma': 3.3899663110423375}. Best is trial 164 with value: -1.5157670549647289.
[I 2025-06-20 12:16:39,204] Trial 498 finished with value: -1.5611875315292543 and parameters: {'booster': 'gbtree', 'lambda': 0.00015332395881823016, 'alpha': 0.0008522470229675277, 'subsample': 0.827482105708564, 'colsample_bytree': 0.5291551255120721, 'max_depth': 4, 'min_child_weight': 7, 'eta': 0.06678903297843668, 'gamma': 3.186174926401061}. Best is trial 164 with value: -1.5157670549647289.
[I 2025-06-20 12:16:39,777] Trial 499 finished with value: -1.5579266876348137 and parameters: {'booster': 'gbtree', 'lambda': 0.0030897926096365258, 'alpha': 0.00043111511538927554, 'subsample': 0.7946506898632792, 'colsample_bytree': 0.541221211850619, 'max_depth': 4, 'min_child_weight': 9, 'eta': 0.03881150626085873, 'gamma': 3.3071322868640585}. Best is trial 164 with value: -1.5157670549647289.
Number of finished trials:  500
Best trial:
  Value (RMSE): 1.5158
  MSE: 2.2976
  R²: 0.3957
  Params: 
    booster: gbtree
    lambda: 1.5993897256570317e-07
    alpha: 0.005471372950546692
    subsample: 0.7596710440384961
    colsample_bytree: 0.5848805012129601
    max_depth: 4
    min_child_weight: 6
    eta: 0.0779567942528632
    gamma: 3.9808380603128763
Model saved to /vol/models/th_student_score_predictor_optuna_xgb.pkl
Training started. TensorBoard will be available at the Modal-provided URL.
Terminating app.
✓ App completed. View run at https://modal.com/apps/thinh0704hcm/main/ap-z26n4jMsggQK1ri6yoerL3
PS D:\machile_nearning\wecode_score_prediction\dataset-full-raw\XGBoost-TH> python -m modal run --detach .\predict.py
Note that running a local entrypoint in detached mode only keeps the last triggered Modal function alive after the parent process has been killed or disconnected.
✓ Initialized. View run at https://modal.com/apps/thinh0704hcm/main/ap-QouFLmrHkqGx2NskawuEVC
✓ Created objects.                                                                                                                                        
├── 🔨 Created mount D:\machile_nearning\wecode_score_prediction\dataset-full-raw\XGBoost-TH\predict.py                                                   
└── 🔨 Created function predict_scores.                                                                                                                   
Students to predict: 727
/usr/local/lib/python3.13/site-packages/xgboost/core.py:729: UserWarning: [12:26:56] WARNING: /workspace/src/common/error_msg.cc:27: The tree method `gpu_hist` is deprecated since 2.0.0. To use GPU training, set the `device` parameter to CUDA instead.

    E.g. tree_method = "hist", device = "cuda"

  return func(**kwargs)
Predictions saved to /vol/predictions/unscored_predictions.csv
Prediction completed. Sample results:
                                   student_id  predicted_exam_score
3    0134f9f410c65ad0e8c2254a7e9288670e02a183              7.204445
20   035f97702f2c01d26ab1fae8f39ea2f98a0caa3c              7.456319
68   0aaebc88f6106684d6993c156104c1ef36cf94e0              6.817969
80   0bf111a9caedf02804f6991792490e63bc21058a              8.104749
120  12887fd9a4df4ba9b88a71f3fb1d2502a75995dd              8.163316
✓ App completed. View run at https://modal.com/apps/thinh0704hcm/main/ap-QouFLmrHkqGx2NskawuEVC                                                           
PS D:\machile_nearning\wecode_score_prediction\dataset-full-raw\XGBoost-TH> 