[I 2025-06-20 11:56:45,211] A new study created in memory with name: no-name-a664cf88-f2da-4a34-a715-a9573fd3812a
[I 2025-06-20 11:56:55,372] Trial 0 finished with value: -1.8990978459552996 and parameters: {'booster': 'dart', 'lambda': 3.3496623507864705, 'alpha': 0.13802965209750476, 'subsample': 0.6154056689225882, 'colsample_bytree': 0.9061672059975343, 'max_depth': 10, 'min_child_weight': 4, 'eta': 0.0038111065070016454, 'gamma': 2.3330828183904755, 'rate_drop': 6.429262210761483e-05, 'skip_drop': 0.0007989637793461748}. Best is trial 0 with value: -1.8990978459552996.
[I 2025-06-20 11:56:55,952] Trial 1 finished with value: -1.869883264977992 and parameters: {'booster': 'gbtree', 'lambda': 0.0007347895094382412, 'alpha': 3.3353755733929127, 'subsample': 0.9524489989554734, 'colsample_bytree': 0.5844009049224299, 'max_depth': 7, 'min_child_weight': 3, 'eta': 0.004333300217427372, 'gamma': 1.4647992637507945}. Best is trial 1 with value: -1.869883264977992.
[I 2025-06-20 11:57:04,514] Trial 2 finished with value: -1.6437742416252836 and parameters: {'booster': 'dart', 'lambda': 0.02954399804802957, 'alpha': 1.7386981906715715e-05, 'subsample': 0.6998013956050393, 'colsample_bytree': 0.6377940846808869, 'max_depth': 4, 'min_child_weight': 10, 'eta': 0.015661592494874033, 'gamma': 4.658003855955691, 'rate_drop': 7.938813890496775e-07, 'skip_drop': 2.524977105546492e-08}. Best is trial 2 with value: -1.6437742416252836.
[I 2025-06-20 11:57:04,654] Trial 3 finished with value: -1.7141986369005748 and parameters: {'booster': 'gbtree', 'lambda': 2.3059701341793798e-05, 'alpha': 0.0007436331554150033, 'subsample': 0.605163642240302, 'colsample_bytree': 0.6461988560713143, 'max_depth': 4, 'min_child_weight': 8, 'eta': 0.20853754631956464, 'gamma': 1.0755004813885365}. Best is trial 2 with value: -1.6437742416252836.
[I 2025-06-20 11:57:05,014] Trial 4 finished with value: -2.082051205832901 and parameters: {'booster': 'gbtree', 'lambda': 9.780109403533955e-08, 'alpha': 0.10897472323056956, 'subsample': 0.7226498309053743, 'colsample_bytree': 0.6180499203328346, 'max_depth': 4, 'min_child_weight': 4, 'eta': 0.0014961350391532108, 'gamma': 2.925071652911436}. Best is trial 2 with value: -1.6437742416252836.
[I 2025-06-20 11:57:14,553] Trial 5 finished with value: -1.9530256771416146 and parameters: {'booster': 'dart', 'lambda': 0.8855075369121567, 'alpha': 9.166801220338906e-05, 'subsample': 0.7211393169176112, 'colsample_bytree': 0.5098215275450089, 'max_depth': 8, 'min_child_weight': 1, 'eta': 0.002775440528520014, 'gamma': 3.741210528563495, 'rate_drop': 4.355962402243707e-08, 'skip_drop': 0.9155020009988095}. Best is trial 2 with value: -1.6437742416252836.
[I 2025-06-20 11:57:14,669] Trial 6 finished with value: -1.7327225667301691 and parameters: {'booster': 'gbtree', 'lambda': 5.714858107984577e-05, 'alpha': 0.0005677334575240304, 'subsample': 0.5262944429219351, 'colsample_bytree': 0.9113057080437295, 'max_depth': 4, 'min_child_weight': 5, 'eta': 0.2457799568932365, 'gamma': 4.069664454765199}. Best is trial 2 with value: -1.6437742416252836.
[I 2025-06-20 11:57:16,694] Trial 7 finished with value: -1.5808411340879847 and parameters: {'booster': 'dart', 'lambda': 5.432696727693608e-06, 'alpha': 0.00013328964076547261, 'subsample': 0.6887466341462398, 'colsample_bytree': 0.5604043228750932, 'max_depth': 10, 'min_child_weight': 6, 'eta': 0.1650800185113077, 'gamma': 4.5605600488813645, 'rate_drop': 0.10696782172045813, 'skip_drop': 0.006828494892707488}. Best is trial 7 with value: -1.5808411340879847.
[I 2025-06-20 11:57:26,019] Trial 8 finished with value: -2.024544797396501 and parameters: {'booster': 'dart', 'lambda': 1.0390425434512085e-08, 'alpha': 9.377027191568589e-07, 'subsample': 0.5542368690235078, 'colsample_bytree': 0.644332685896388, 'max_depth': 5, 'min_child_weight': 1, 'eta': 0.004841331827056446, 'gamma': 3.3031900440694635, 'rate_drop': 0.04682216679478281, 'skip_drop': 0.0017304547722209872}. Best is trial 7 with value: -1.5808411340879847.
[I 2025-06-20 11:57:26,600] Trial 9 finished with value: -2.0949581788609466 and parameters: {'booster': 'gbtree', 'lambda': 2.8732147155811154e-07, 'alpha': 0.027334942744235872, 'subsample': 0.7868854705533056, 'colsample_bytree': 0.9585381138905121, 'max_depth': 6, 'min_child_weight': 6, 'eta': 0.001047900565441278, 'gamma': 4.354621738290815}. Best is trial 7 with value: -1.5808411340879847.
[I 2025-06-20 11:57:29,097] Trial 10 finished with value: -1.6717613629651353 and parameters: {'booster': 'dart', 'lambda': 3.3482179442351315e-06, 'alpha': 7.729227021387492e-08, 'subsample': 0.8478370350705322, 'colsample_bytree': 0.7939489557020053, 'max_depth': 10, 'min_child_weight': 7, 'eta': 0.07462202536797428, 'gamma': 0.18404874020760875, 'rate_drop': 0.8058402055365452, 'skip_drop': 0.5203854623969415}. Best is trial 7 with value: -1.5808411340879847.
[I 2025-06-20 11:57:38,864] Trial 11 finished with value: -1.6047497199320282 and parameters: {'booster': 'dart', 'lambda': 0.011545134504500844, 'alpha': 9.37537631429541e-06, 'subsample': 0.6679411865871719, 'colsample_bytree': 0.7327206787931222, 'max_depth': 8, 'min_child_weight': 10, 'eta': 0.01820387016333729, 'gamma': 4.834109092879558, 'rate_drop': 9.084358706661044e-07, 'skip_drop': 1.5144852989296905e-08}. Best is trial 7 with value: -1.5808411340879847.
[I 2025-06-20 11:57:43,463] Trial 12 finished with value: -1.6223531418281107 and parameters: {'booster': 'dart', 'lambda': 0.0030577422716353874, 'alpha': 5.2274071134722835e-06, 'subsample': 0.6498028047899197, 'colsample_bytree': 0.754331721822431, 'max_depth': 9, 'min_child_weight': 10, 'eta': 0.04196545955039648, 'gamma': 4.994780084448569, 'rate_drop': 0.0010726953622002106, 'skip_drop': 1.3465355142224145e-08}. Best is trial 7 with value: -1.5808411340879847.
[I 2025-06-20 11:57:53,165] Trial 13 finished with value: -1.6316791934661588 and parameters: {'booster': 'dart', 'lambda': 0.04503162072437384, 'alpha': 1.6466018954686248e-08, 'subsample': 0.7925291631332798, 'colsample_bytree': 0.8195647980556223, 'max_depth': 8, 'min_child_weight': 8, 'eta': 0.017497973470183784, 'gamma': 4.989633025289405, 'rate_drop': 7.768089932646832e-06, 'skip_drop': 3.9900123059044296e-06}. Best is trial 7 with value: -1.5808411340879847.
[I 2025-06-20 11:57:55,598] Trial 14 finished with value: -1.5823701541540172 and parameters: {'booster': 'dart', 'lambda': 0.011495030963334056, 'alpha': 5.8325030133061e-07, 'subsample': 0.8831979693035881, 'colsample_bytree': 0.5018029729111562, 'max_depth': 9, 'min_child_weight': 8, 'eta': 0.0836242101595439, 'gamma': 3.5573074505790947, 'rate_drop': 0.0018998786587898586, 'skip_drop': 1.9057203564509396e-05}. Best is trial 7 with value: -1.5808411340879847.
[I 2025-06-20 11:57:58,192] Trial 15 finished with value: -1.5897329346220832 and parameters: {'booster': 'dart', 'lambda': 0.00018919691794018928, 'alpha': 3.0663506292854047e-07, 'subsample': 0.9006743131049094, 'colsample_bytree': 0.5059024178372032, 'max_depth': 10, 'min_child_weight': 8, 'eta': 0.09886108291129457, 'gamma': 3.520081419463416, 'rate_drop': 0.004730398573655248, 'skip_drop': 1.4879686487117605e-05}. Best is trial 7 with value: -1.5808411340879847.
[I 2025-06-20 11:58:00,600] Trial 16 finished with value: -1.6309358423063742 and parameters: {'booster': 'dart', 'lambda': 4.3338310516875705e-06, 'alpha': 0.004594517548123221, 'subsample': 0.8585225381653501, 'colsample_bytree': 0.5492126085664634, 'max_depth': 9, 'min_child_weight': 6, 'eta': 0.11185663068741221, 'gamma': 2.6827265004021967, 'rate_drop': 0.12190018755341937, 'skip_drop': 0.010654808928550722}. Best is trial 7 with value: -1.5808411340879847.
[I 2025-06-20 11:58:04,083] Trial 17 finished with value: -1.6344646156922902 and parameters: {'booster': 'dart', 'lambda': 0.607322984217342, 'alpha': 5.55226539885176e-07, 'subsample': 0.9885418252049569, 'colsample_bytree': 0.5627984984057836, 'max_depth': 9, 'min_child_weight': 7, 'eta': 0.045222330903142385, 'gamma': 4.163776164295618, 'rate_drop': 0.0015630472843900262, 'skip_drop': 1.9067482679690747e-06}. Best is trial 7 with value: -1.5808411340879847.
[I 2025-06-20 11:58:04,642] Trial 18 finished with value: -1.5996666315507169 and parameters: {'booster': 'dart', 'lambda': 0.0010438724567875537, 'alpha': 5.394369812115361e-05, 'subsample': 0.7718907932505435, 'colsample_bytree': 0.6969219545754856, 'max_depth': 7, 'min_child_weight': 9, 'eta': 0.28667447744352365, 'gamma': 2.106074944037119, 'rate_drop': 0.020259182158078957, 'skip_drop': 0.022604624899733475}. Best is trial 7 with value: -1.5808411340879847.
[I 2025-06-20 11:58:14,197] Trial 19 finished with value: -1.6281953234241058 and parameters: {'booster': 'dart', 'lambda': 2.374457299956376e-06, 'alpha': 1.0924128637130236e-08, 'subsample': 0.8317475637270983, 'colsample_bytree': 0.5028535510747183, 'max_depth': 9, 'min_child_weight': 5, 'eta': 0.03739419713924683, 'gamma': 3.2652968897038113, 'rate_drop': 0.00018550526539510596, 'skip_drop': 0.00013411511655895555}. Best is trial 7 with value: -1.5808411340879847.
[I 2025-06-20 11:58:21,055] Trial 20 finished with value: -1.7727472274141598 and parameters: {'booster': 'dart', 'lambda': 2.5552917539522593e-05, 'alpha': 2.5700563983360165e-06, 'subsample': 0.9301918561424172, 'colsample_bytree': 0.6831924918227625, 'max_depth': 6, 'min_child_weight': 7, 'eta': 0.1493610398080109, 'gamma': 3.96202896762678, 'rate_drop': 0.6529473534691373, 'skip_drop': 7.069697833156279e-07}. Best is trial 7 with value: -1.5808411340879847.
[I 2025-06-20 11:58:23,139] Trial 21 finished with value: -1.6336033046136504 and parameters: {'booster': 'dart', 'lambda': 0.0001676832877486725, 'alpha': 1.3397779609457447e-07, 'subsample': 0.9004204204454768, 'colsample_bytree': 0.5433138449509348, 'max_depth': 10, 'min_child_weight': 8, 'eta': 0.08650505128620808, 'gamma': 3.556004447341233, 'rate_drop': 0.005340392958113268, 'skip_drop': 1.222712849158543e-05}. Best is trial 7 with value: -1.5808411340879847.
[I 2025-06-20 11:58:23,866] Trial 22 finished with value: -1.6153045312851546 and parameters: {'booster': 'dart', 'lambda': 0.00021502403855856942, 'alpha': 3.5167515845716824e-07, 'subsample': 0.8910488577016087, 'colsample_bytree': 0.5001371428107897, 'max_depth': 10, 'min_child_weight': 9, 'eta': 0.1440005430790112, 'gamma': 3.020266062144117, 'rate_drop': 0.008633044526862326, 'skip_drop': 6.29970785719834e-05}. Best is trial 7 with value: -1.5808411340879847.
[I 2025-06-20 11:58:26,702] Trial 23 finished with value: -1.6615741027206883 and parameters: {'booster': 'dart', 'lambda': 0.09575089496379582, 'alpha': 6.752086251504533e-08, 'subsample': 0.9965283206517656, 'colsample_bytree': 0.6053271579143374, 'max_depth': 10, 'min_child_weight': 9, 'eta': 0.055978227507244994, 'gamma': 3.6302293246284956, 'rate_drop': 0.0003903333750859197, 'skip_drop': 5.719164483972817e-05}. Best is trial 7 with value: -1.5808411340879847.
[I 2025-06-20 11:58:36,429] Trial 24 finished with value: -1.7639716041425635 and parameters: {'booster': 'dart', 'lambda': 0.004758407788771105, 'alpha': 7.071857884763589e-05, 'subsample': 0.8196431429618457, 'colsample_bytree': 0.5513236180402251, 'max_depth': 9, 'min_child_weight': 6, 'eta': 0.02563657028370775, 'gamma': 4.28841069028697, 'rate_drop': 0.0982585474138636, 'skip_drop': 6.681380499313483e-07}. Best is trial 7 with value: -1.5808411340879847.
[I 2025-06-20 11:58:46,396] Trial 25 finished with value: -1.6781458537432579 and parameters: {'booster': 'dart', 'lambda': 3.487842097893588e-07, 'alpha': 1.6897254931630523e-06, 'subsample': 0.8937132973991591, 'colsample_bytree': 0.5914301419259546, 'max_depth': 8, 'min_child_weight': 7, 'eta': 0.009703753509040852, 'gamma': 3.37107279647192, 'rate_drop': 0.0026410923127541714, 'skip_drop': 0.00045937384063853346}. Best is trial 7 with value: -1.5808411340879847.
[I 2025-06-20 11:58:46,774] Trial 26 finished with value: -1.6265720537545436 and parameters: {'booster': 'gbtree', 'lambda': 7.938219834246812e-05, 'alpha': 0.002572350494715388, 'subsample': 0.9382421134317753, 'colsample_bytree': 0.5313105195290504, 'max_depth': 10, 'min_child_weight': 8, 'eta': 0.07635192726208927, 'gamma': 4.438833102895238}. Best is trial 7 with value: -1.5808411340879847.
[I 2025-06-20 11:58:49,906] Trial 27 finished with value: -1.5871061089842025 and parameters: {'booster': 'dart', 'lambda': 7.995670726074689e-06, 'alpha': 1.8680943076082057e-07, 'subsample': 0.754624369504446, 'colsample_bytree': 0.5739772704704639, 'max_depth': 3, 'min_child_weight': 9, 'eta': 0.12259131334292522, 'gamma': 3.8194061669083874, 'rate_drop': 4.359765988185455e-05, 'skip_drop': 0.052249665620503864}. Best is trial 7 with value: -1.5808411340879847.
[I 2025-06-20 11:58:50,639] Trial 28 finished with value: -1.6097432431335386 and parameters: {'booster': 'dart', 'lambda': 9.740056163547539e-06, 'alpha': 4.41186866101647e-08, 'subsample': 0.748806416584259, 'colsample_bytree': 0.6941341993330334, 'max_depth': 5, 'min_child_weight': 9, 'eta': 0.1658453232137145, 'gamma': 1.9007140615978264, 'rate_drop': 0.00011214413362902462, 'skip_drop': 0.08976550099305135}. Best is trial 7 with value: -1.5808411340879847.
[I 2025-06-20 11:58:59,719] Trial 29 finished with value: -1.6289659508061172 and parameters: {'booster': 'dart', 'lambda': 4.6111308380187115, 'alpha': 1.9800518885925749, 'subsample': 0.6073038461297724, 'colsample_bytree': 0.8414055085660969, 'max_depth': 3, 'min_child_weight': 4, 'eta': 0.027357060376073876, 'gamma': 2.5890223521439215, 'rate_drop': 3.2412676823074176e-05, 'skip_drop': 0.005575848305132972}. Best is trial 7 with value: -1.5808411340879847.
[I 2025-06-20 11:59:02,160] Trial 30 finished with value: -1.5684447348178578 and parameters: {'booster': 'dart', 'lambda': 1.0428584206639425e-06, 'alpha': 4.037732318536494e-05, 'subsample': 0.6515122515315173, 'colsample_bytree': 0.576694737016389, 'max_depth': 3, 'min_child_weight': 3, 'eta': 0.1243043307402261, 'gamma': 3.894139877352989, 'rate_drop': 1.0492350639352672e-05, 'skip_drop': 0.04076259839528978}. Best is trial 30 with value: -1.5684447348178578.
[I 2025-06-20 11:59:03,505] Trial 31 finished with value: -1.6203726279229713 and parameters: {'booster': 'dart', 'lambda': 1.5953563655349607e-07, 'alpha': 2.1233888483737088e-05, 'subsample': 0.657642895659146, 'colsample_bytree': 0.5777881683750264, 'max_depth': 3, 'min_child_weight': 2, 'eta': 0.12955067404455667, 'gamma': 3.888203398668725, 'rate_drop': 6.691666855539334e-06, 'skip_drop': 0.08206764945849902}. Best is trial 30 with value: -1.5684447348178578.
[I 2025-06-20 11:59:05,530] Trial 32 finished with value: -1.6433457880108615 and parameters: {'booster': 'dart', 'lambda': 1.220416639176933e-06, 'alpha': 4.225889043640486e-06, 'subsample': 0.583222582777216, 'colsample_bytree': 0.5818755969914085, 'max_depth': 3, 'min_child_weight': 3, 'eta': 0.20707941557396267, 'gamma': 4.566527082166279, 'rate_drop': 8.514337464876539e-06, 'skip_drop': 0.10195982024215085}. Best is trial 30 with value: -1.5684447348178578.
[I 2025-06-20 11:59:11,342] Trial 33 finished with value: -1.544202524037621 and parameters: {'booster': 'dart', 'lambda': 2.2345922815468164e-08, 'alpha': 0.00023625515838174212, 'subsample': 0.6802594532091009, 'colsample_bytree': 0.6065815211133664, 'max_depth': 5, 'min_child_weight': 5, 'eta': 0.06207932207867602, 'gamma': 3.9398932878206274, 'rate_drop': 1.963395265224416e-06, 'skip_drop': 0.003689817706581206}. Best is trial 33 with value: -1.544202524037621.
[I 2025-06-20 11:59:11,579] Trial 34 finished with value: -1.6361992917980155 and parameters: {'booster': 'gbtree', 'lambda': 1.0511834538899907e-08, 'alpha': 0.0002446657667933772, 'subsample': 0.6873716691591356, 'colsample_bytree': 0.6230906922219934, 'max_depth': 5, 'min_child_weight': 3, 'eta': 0.06227327379454357, 'gamma': 4.628861554093039}. Best is trial 33 with value: -1.544202524037621.
[I 2025-06-20 11:59:12,002] Trial 35 finished with value: -1.7451523970359462 and parameters: {'booster': 'dart', 'lambda': 3.080030082792938e-08, 'alpha': 0.00186434646745063, 'subsample': 0.6287267288603837, 'colsample_bytree': 0.6725259878992108, 'max_depth': 7, 'min_child_weight': 4, 'eta': 0.19647811644391214, 'gamma': 3.0003230205333704, 'rate_drop': 4.887090594729608e-07, 'skip_drop': 0.004368960468846793}. Best is trial 33 with value: -1.544202524037621.
[I 2025-06-20 11:59:21,452] Trial 36 finished with value: -1.6717363980892221 and parameters: {'booster': 'dart', 'lambda': 1.2093414667419298e-06, 'alpha': 0.00018351977189839166, 'subsample': 0.7083235579481485, 'colsample_bytree': 0.5301349944783608, 'max_depth': 6, 'min_child_weight': 5, 'eta': 0.010189918799392005, 'gamma': 4.1374704757319245, 'rate_drop': 1.198246482952116e-07, 'skip_drop': 0.0003362627537611175}. Best is trial 33 with value: -1.544202524037621.
[I 2025-06-20 11:59:21,743] Trial 37 finished with value: -1.6469247215739784 and parameters: {'booster': 'gbtree', 'lambda': 3.2423739565223536e-08, 'alpha': 0.029397551852949868, 'subsample': 0.6855531767852663, 'colsample_bytree': 0.6113790681820721, 'max_depth': 4, 'min_child_weight': 2, 'eta': 0.058189292615337215, 'gamma': 4.679911526955083}. Best is trial 33 with value: -1.544202524037621.
[I 2025-06-20 11:59:22,157] Trial 38 finished with value: -1.7179025803094248 and parameters: {'booster': 'dart', 'lambda': 5.631022825940604e-07, 'alpha': 3.055242059916123e-05, 'subsample': 0.6265984130673523, 'colsample_bytree': 0.6529603436485718, 'max_depth': 5, 'min_child_weight': 2, 'eta': 0.28979848850521583, 'gamma': 1.1087988673829412, 'rate_drop': 2.297280184258322e-06, 'skip_drop': 0.0018518478340020534}. Best is trial 33 with value: -1.544202524037621.
[I 2025-06-20 11:59:22,350] Trial 39 finished with value: -1.648768620286422 and parameters: {'booster': 'gbtree', 'lambda': 7.215764339995565e-08, 'alpha': 0.000952310587717625, 'subsample': 0.5666935092648709, 'colsample_bytree': 0.5363676998891446, 'max_depth': 4, 'min_child_weight': 5, 'eta': 0.09614288569435356, 'gamma': 3.8415417804068395}. Best is trial 33 with value: -1.544202524037621.
[I 2025-06-20 11:59:29,288] Trial 40 finished with value: -1.5730662945841523 and parameters: {'booster': 'dart', 'lambda': 0.20589730007378768, 'alpha': 0.007729725980531197, 'subsample': 0.7337376058448286, 'colsample_bytree': 0.6312397410675519, 'max_depth': 7, 'min_child_weight': 6, 'eta': 0.030546962431758865, 'gamma': 3.078381277220293, 'rate_drop': 2.010047824605826e-05, 'skip_drop': 0.021084284120316838}. Best is trial 33 with value: -1.544202524037621.
[I 2025-06-20 11:59:35,929] Trial 41 finished with value: -1.5685876046811809 and parameters: {'booster': 'dart', 'lambda': 0.09367219251163783, 'alpha': 0.007411463870915662, 'subsample': 0.7104542851573014, 'colsample_bytree': 0.6291330294934508, 'max_depth': 7, 'min_child_weight': 6, 'eta': 0.03956776177294384, 'gamma': 3.195213312661691, 'rate_drop': 2.1879767500582994e-05, 'skip_drop': 0.02353290518999204}. Best is trial 33 with value: -1.544202524037621.
[I 2025-06-20 11:59:45,421] Trial 42 finished with value: -1.5547100415390487 and parameters: {'booster': 'dart', 'lambda': 0.7288867882012976, 'alpha': 0.008478969893055001, 'subsample': 0.7236621606482339, 'colsample_bytree': 0.6350186388219177, 'max_depth': 7, 'min_child_weight': 6, 'eta': 0.03023003661882667, 'gamma': 2.3025595986095255, 'rate_drop': 2.614410627917681e-05, 'skip_drop': 0.016147408655756774}. Best is trial 33 with value: -1.544202524037621.
[I 2025-06-20 11:59:55,369] Trial 43 finished with value: -1.6326953355723264 and parameters: {'booster': 'dart', 'lambda': 0.5687292497671987, 'alpha': 0.011100412567410563, 'subsample': 0.7354848828434831, 'colsample_bytree': 0.6543754313409431, 'max_depth': 7, 'min_child_weight': 4, 'eta': 0.023441886374384855, 'gamma': 2.4126951121858964, 'rate_drop': 2.0611241978977464e-05, 'skip_drop': 0.3087200608201729}. Best is trial 33 with value: -1.544202524037621.
[I 2025-06-20 12:00:04,997] Trial 44 finished with value: -1.5734199044566588 and parameters: {'booster': 'dart', 'lambda': 0.17921190477363785, 'alpha': 0.7548669025557548, 'subsample': 0.7246943105601983, 'colsample_bytree': 0.7263429847747974, 'max_depth': 6, 'min_child_weight': 5, 'eta': 0.03276848666530585, 'gamma': 1.8005219679306705, 'rate_drop': 1.605117630009324e-06, 'skip_drop': 0.02174342638892037}. Best is trial 33 with value: -1.544202524037621.
[I 2025-06-20 12:00:15,147] Trial 45 finished with value: -1.6296409527786844 and parameters: {'booster': 'dart', 'lambda': 2.355411358721433, 'alpha': 0.11265173450039194, 'subsample': 0.7077791366571948, 'colsample_bytree': 0.6278706166095449, 'max_depth': 7, 'min_child_weight': 6, 'eta': 0.01300546819567544, 'gamma': 2.7190193941324527, 'rate_drop': 3.118518188378442e-06, 'skip_drop': 0.21925101948090236}. Best is trial 33 with value: -1.544202524037621.
[I 2025-06-20 12:00:18,310] Trial 46 finished with value: -1.5870178614997141 and parameters: {'booster': 'dart', 'lambda': 0.19404490900969082, 'alpha': 0.038837009662503676, 'subsample': 0.6721559722492058, 'colsample_bytree': 0.715200965334976, 'max_depth': 7, 'min_child_weight': 6, 'eta': 0.04716399283779513, 'gamma': 3.152948464523448, 'rate_drop': 2.896964387494303e-07, 'skip_drop': 0.0016024723119087703}. Best is trial 33 with value: -1.544202524037621.
[I 2025-06-20 12:00:28,150] Trial 47 finished with value: -1.6052804192140997 and parameters: {'booster': 'dart', 'lambda': 2.1356217950693, 'alpha': 0.008556741224051605, 'subsample': 0.509907240770479, 'colsample_bytree': 0.5999620184787203, 'max_depth': 8, 'min_child_weight': 7, 'eta': 0.02243176047770901, 'gamma': 2.249741283051881, 'rate_drop': 1.7988474146645663e-05, 'skip_drop': 0.028194596715640976}. Best is trial 33 with value: -1.544202524037621.
