[I 2025-06-20 12:00:28,730] Trial 48 finished with value: -1.602165642899053 and parameters: {'booster': 'gbtree', 'lambda': 7.835316221037073, 'alpha': 0.0005247495336349622, 'subsample': 0.7969355137422026, 'colsample_bytree': 0.7687164190360427, 'max_depth': 6, 'min_child_weight': 5, 'eta': 0.03239427875643266, 'gamma': 2.7660089745999583}. Best is trial 33 with value: -1.544202524037621.
[I 2025-06-20 12:00:38,304] Trial 49 finished with value: -1.735633524604568 and parameters: {'booster': 'dart', 'lambda': 0.027293537386827327, 'alpha': 0.44955013768601004, 'subsample': 0.768325991409589, 'colsample_bytree': 0.6424506829413317, 'max_depth': 7, 'min_child_weight': 4, 'eta': 0.006774907580100012, 'gamma': 2.8762859164423142, 'rate_drop': 2.1012509266451177e-08, 'skip_drop': 0.010754873626367565}. Best is trial 33 with value: -1.544202524037621.
[I 2025-06-20 12:00:47,909] Trial 50 finished with value: -1.9733536321754985 and parameters: {'booster': 'dart', 'lambda': 0.000975196109936152, 'alpha': 0.0012275097185519678, 'subsample': 0.6563447708443606, 'colsample_bytree': 0.6622411846092047, 'max_depth': 6, 'min_child_weight': 6, 'eta': 0.0024571307773036052, 'gamma': 1.542093575733118, 'rate_drop': 0.0003498555608104136, 'skip_drop': 0.002724659470140241}. Best is trial 33 with value: -1.544202524037621.
[I 2025-06-20 12:00:52,792] Trial 51 finished with value: -1.6079640617483961 and parameters: {'booster': 'dart', 'lambda': 0.16749543364852781, 'alpha': 1.4575194348492952, 'subsample': 0.7381965299292805, 'colsample_bytree': 0.7303154336058333, 'max_depth': 6, 'min_child_weight': 5, 'eta': 0.03449217747848994, 'gamma': 1.8669261801916828, 'rate_drop': 2.063616350854518e-06, 'skip_drop': 0.023012933705803786}. Best is trial 33 with value: -1.544202524037621.
[I 2025-06-20 12:01:02,432] Trial 52 finished with value: -1.5927849914101242 and parameters: {'booster': 'dart', 'lambda': 0.33629619688711987, 'alpha': 0.7840863859907101, 'subsample': 0.7210973827786704, 'colsample_bytree': 0.625495126174613, 'max_depth': 8, 'min_child_weight': 5, 'eta': 0.02014239445368496, 'gamma': 1.5691408148208967, 'rate_drop': 1.0968241302886262e-06, 'skip_drop': 0.030149271570189762}. Best is trial 33 with value: -1.544202524037621.
[I 2025-06-20 12:01:09,306] Trial 53 finished with value: -1.6260195019295014 and parameters: {'booster': 'dart', 'lambda': 1.4014638827322854, 'alpha': 0.04936310702829299, 'subsample': 0.716608886668615, 'colsample_bytree': 0.7720411756453631, 'max_depth': 7, 'min_child_weight': 7, 'eta': 0.030003078548318973, 'gamma': 1.1015170177947913, 'rate_drop': 6.926694410292494e-05, 'skip_drop': 0.9437136949630254}. Best is trial 33 with value: -1.544202524037621.
[I 2025-06-20 12:01:18,905] Trial 54 finished with value: -1.6820032780482397 and parameters: {'booster': 'dart', 'lambda': 0.06217170748466815, 'alpha': 7.596197557843902, 'subsample': 0.6379644517271102, 'colsample_bytree': 0.7120525522145004, 'max_depth': 6, 'min_child_weight': 6, 'eta': 0.014528880750922662, 'gamma': 2.1928150868430993, 'rate_drop': 9.888492481395932e-06, 'skip_drop': 0.010765624948101602}. Best is trial 33 with value: -1.544202524037621.
[I 2025-06-20 12:01:22,249] Trial 55 finished with value: -1.607167749130346 and parameters: {'booster': 'dart', 'lambda': 0.017673426575628665, 'alpha': 0.013808153915391015, 'subsample': 0.6931697475405164, 'colsample_bytree': 0.6773956704243411, 'max_depth': 5, 'min_child_weight': 3, 'eta': 0.04707573964437564, 'gamma': 0.2625294442876971, 'rate_drop': 3.390161018596206e-06, 'skip_drop': 0.1993481227160478}. Best is trial 33 with value: -1.544202524037621.
[I 2025-06-20 12:01:25,270] Trial 56 finished with value: -1.5864709820522809 and parameters: {'booster': 'dart', 'lambda': 0.003606038572494586, 'alpha': 0.22374765392277957, 'subsample': 0.674543991691628, 'colsample_bytree': 0.8703380419987081, 'max_depth': 7, 'min_child_weight': 6, 'eta': 0.06102376866197582, 'gamma': 2.44903204763242, 'rate_drop': 1.759492567695292e-05, 'skip_drop': 0.0010977528122337679}. Best is trial 33 with value: -1.544202524037621.
[I 2025-06-20 12:01:30,407] Trial 57 finished with value: -1.6072039961668436 and parameters: {'booster': 'dart', 'lambda': 0.3054303486283526, 'alpha': 0.003509252525384458, 'subsample': 0.7377461795444598, 'colsample_bytree': 0.9767423272074636, 'max_depth': 6, 'min_child_weight': 5, 'eta': 0.04082094558486247, 'gamma': 3.373372975760028, 'rate_drop': 1.4276914951438488e-07, 'skip_drop': 0.04637808281365135}. Best is trial 33 with value: -1.544202524037621.
[I 2025-06-20 12:01:39,643] Trial 58 finished with value: -1.6192876407597312 and parameters: {'booster': 'dart', 'lambda': 1.022176839829021, 'alpha': 0.00039805567822775, 'subsample': 0.776023139437551, 'colsample_bytree': 0.6364069294664225, 'max_depth': 4, 'min_child_weight': 1, 'eta': 0.01823170345473276, 'gamma': 1.7311927268554892, 'rate_drop': 1.1428243201597426e-06, 'skip_drop': 0.016998435014428295}. Best is trial 33 with value: -1.544202524037621.
[I 2025-06-20 12:01:41,598] Trial 59 finished with value: -1.5833259870404466 and parameters: {'booster': 'dart', 'lambda': 0.10500885212639949, 'alpha': 0.0057797572683721985, 'subsample': 0.6473591760234517, 'colsample_bytree': 0.5960066027342944, 'max_depth': 7, 'min_child_weight': 7, 'eta': 0.06853866758750483, 'gamma': 1.303630488251656, 'rate_drop': 0.0001589736950546938, 'skip_drop': 0.004263117893541199}. Best is trial 33 with value: -1.544202524037621.
[I 2025-06-20 12:01:46,096] Trial 60 finished with value: -1.5950207295204661 and parameters: {'booster': 'dart', 'lambda': 0.00760942649461026, 'alpha': 1.0402427770622045e-05, 'subsample': 0.759526258269518, 'colsample_bytree': 0.5617514558363834, 'max_depth': 8, 'min_child_weight': 6, 'eta': 0.05228483122210524, 'gamma': 2.0310881519708133, 'rate_drop': 4.1070124368382336e-06, 'skip_drop': 0.12490587208745756}. Best is trial 33 with value: -1.544202524037621.
[I 2025-06-20 12:01:52,573] Trial 61 finished with value: -1.5985579119337263 and parameters: {'booster': 'dart', 'lambda': 1.3365299077778153e-05, 'alpha': 0.00011040149828479431, 'subsample': 0.7008908726442404, 'colsample_bytree': 0.6146835624804903, 'max_depth': 5, 'min_child_weight': 6, 'eta': 0.03688492829255567, 'gamma': 4.036162825693596, 'rate_drop': 4.498333273853704e-05, 'skip_drop': 0.007515559446282169}. Best is trial 33 with value: -1.544202524037621.
[I 2025-06-20 12:01:55,277] Trial 62 finished with value: -1.5829832324777138 and parameters: {'booster': 'dart', 'lambda': 0.04914466165625328, 'alpha': 4.406731388101791e-05, 'subsample': 0.8069593752334042, 'colsample_bytree': 0.5657855655795851, 'max_depth': 6, 'min_child_weight': 5, 'eta': 0.09746735221407826, 'gamma': 3.70562584158474, 'rate_drop': 0.0005842964936759384, 'skip_drop': 0.014423635601198734}. Best is trial 33 with value: -1.544202524037621.
[I 2025-06-20 12:02:04,401] Trial 63 finished with value: -1.567100261741228 and parameters: {'booster': 'dart', 'lambda': 0.0004094708242035041, 'alpha': 9.745060479879847e-05, 'subsample': 0.5893252992011393, 'colsample_bytree': 0.5842365057528379, 'max_depth': 4, 'min_child_weight': 7, 'eta': 0.028760268661477757, 'gamma': 4.23964634312914, 'rate_drop': 1.1675676656561907e-05, 'skip_drop': 0.0005817155611542802}. Best is trial 33 with value: -1.544202524037621.
[I 2025-06-20 12:02:13,546] Trial 64 finished with value: -1.5695615402274528 and parameters: {'booster': 'dart', 'lambda': 0.36409783913535, 'alpha': 0.00027989572194938195, 'subsample': 0.5860697870187099, 'colsample_bytree': 0.5920736980736013, 'max_depth': 4, 'min_child_weight': 7, 'eta': 0.027610254991891858, 'gamma': 3.1426868091428863, 'rate_drop': 1.2536990188925727e-05, 'skip_drop': 0.0005470889607607069}. Best is trial 33 with value: -1.544202524037621.
[I 2025-06-20 12:02:22,847] Trial 65 finished with value: -1.599026022698103 and parameters: {'booster': 'dart', 'lambda': 5.6663293854629, 'alpha': 0.000351748034310085, 'subsample': 0.5453122055575248, 'colsample_bytree': 0.5891546247001419, 'max_depth': 4, 'min_child_weight': 7, 'eta': 0.02492451281222727, 'gamma': 3.127804101763867, 'rate_drop': 1.1793287771015707e-05, 'skip_drop': 0.0006224939606575648}. Best is trial 33 with value: -1.544202524037621.
[I 2025-06-20 12:02:31,868] Trial 66 finished with value: -1.7219689319030171 and parameters: {'booster': 'dart', 'lambda': 5.4021931430028886e-05, 'alpha': 0.00011741519239377473, 'subsample': 0.60365652020229, 'colsample_bytree': 0.525107262766566, 'max_depth': 3, 'min_child_weight': 8, 'eta': 0.012413186776583108, 'gamma': 4.354564739179622, 'rate_drop': 5.871220229767419e-06, 'skip_drop': 0.00031181603443517544}. Best is trial 33 with value: -1.544202524037621.
[I 2025-06-20 12:02:32,240] Trial 67 finished with value: -1.596489839874642 and parameters: {'booster': 'gbtree', 'lambda': 0.874894655520881, 'alpha': 0.0016240305651685403, 'subsample': 0.5844450248319533, 'colsample_bytree': 0.6017198828358333, 'max_depth': 3, 'min_child_weight': 7, 'eta': 0.02894108741553056, 'gamma': 3.4857866695482986}. Best is trial 33 with value: -1.544202524037621.
[I 2025-06-20 12:02:41,373] Trial 68 finished with value: -1.5499102876431685 and parameters: {'booster': 'dart', 'lambda': 0.00046962548486987764, 'alpha': 0.0007466688158507819, 'subsample': 0.5919000730144134, 'colsample_bytree': 0.5520763794813514, 'max_depth': 4, 'min_child_weight': 8, 'eta': 0.039978302273390866, 'gamma': 3.2263837140102583, 'rate_drop': 9.203608392159741e-05, 'skip_drop': 0.00017769210560568256}. Best is trial 33 with value: -1.544202524037621.
[I 2025-06-20 12:02:47,478] Trial 69 finished with value: -1.5906797239526982 and parameters: {'booster': 'dart', 'lambda': 0.0006535880020135013, 'alpha': 0.0008346952714059926, 'subsample': 0.5455749675975664, 'colsample_bytree': 0.5552471180890126, 'max_depth': 4, 'min_child_weight': 8, 'eta': 0.07381037423178505, 'gamma': 4.240963681634677, 'rate_drop': 0.0001071076038091671, 'skip_drop': 0.0002573539546310119}. Best is trial 33 with value: -1.544202524037621.
[I 2025-06-20 12:02:53,949] Trial 70 finished with value: -1.5828357369958663 and parameters: {'booster': 'dart', 'lambda': 2.4827168972989526e-05, 'alpha': 1.5179950943608639e-05, 'subsample': 0.5861216435100036, 'colsample_bytree': 0.5186844059958062, 'max_depth': 4, 'min_child_weight': 8, 'eta': 0.03841397453043937, 'gamma': 3.9906652524404174, 'rate_drop': 5.442932754583773e-05, 'skip_drop': 0.00013318825610256647}. Best is trial 33 with value: -1.544202524037621.
[I 2025-06-20 12:03:03,025] Trial 71 finished with value: -1.6156444236890029 and parameters: {'booster': 'dart', 'lambda': 0.0004893409030427212, 'alpha': 0.002776402950269257, 'subsample': 0.6147705811322483, 'colsample_bytree': 0.5782725068379164, 'max_depth': 3, 'min_child_weight': 7, 'eta': 0.021892774316875464, 'gamma': 3.2432937189613176, 'rate_drop': 3.4006703930399186e-05, 'skip_drop': 0.0009782271542896613}. Best is trial 33 with value: -1.544202524037621.
[I 2025-06-20 12:03:09,451] Trial 72 finished with value: -1.5480890415278081 and parameters: {'booster': 'dart', 'lambda': 0.00011023955042102061, 'alpha': 0.017453793612778552, 'subsample': 0.5958033740362941, 'colsample_bytree': 0.612049412557623, 'max_depth': 4, 'min_child_weight': 7, 'eta': 0.049747899636717406, 'gamma': 2.931578101744949, 'rate_drop': 2.3584256192815087e-05, 'skip_drop': 3.546165557277309e-05}. Best is trial 33 with value: -1.544202524037621.
[I 2025-06-20 12:03:15,858] Trial 73 finished with value: -1.5548758145817083 and parameters: {'booster': 'dart', 'lambda': 0.0022759590259492654, 'alpha': 0.018833480687973504, 'subsample': 0.5762662350892861, 'colsample_bytree': 0.5455559286614259, 'max_depth': 4, 'min_child_weight': 7, 'eta': 0.050155572612435737, 'gamma': 2.8934648029829564, 'rate_drop': 0.0002932249985363199, 'skip_drop': 3.0150456960734796e-05}. Best is trial 33 with value: -1.544202524037621.
[I 2025-06-20 12:03:19,732] Trial 74 finished with value: -1.6207569909940058 and parameters: {'booster': 'dart', 'lambda': 0.0015139541777159256, 'alpha': 0.018532519124309896, 'subsample': 0.566651536278241, 'colsample_bytree': 0.5443549666277122, 'max_depth': 5, 'min_child_weight': 8, 'eta': 0.05168316342760368, 'gamma': 2.8770741719587516, 'rate_drop': 0.000255463015631636, 'skip_drop': 3.565059295552012e-05}. Best is trial 33 with value: -1.544202524037621.
[I 2025-06-20 12:03:22,485] Trial 75 finished with value: -1.5909533714803923 and parameters: {'booster': 'dart', 'lambda': 0.0001091075154087032, 'alpha': 0.2126517203357821, 'subsample': 0.5273595701435195, 'colsample_bytree': 0.5755911897536038, 'max_depth': 3, 'min_child_weight': 7, 'eta': 0.0868363919823474, 'gamma': 3.4418111887076175, 'rate_drop': 0.0008657804114366888, 'skip_drop': 2.9288331445331516e-05}. Best is trial 33 with value: -1.544202524037621.
[I 2025-06-20 12:03:25,056] Trial 76 finished with value: -1.5903455147811787 and parameters: {'booster': 'dart', 'lambda': 0.00032082878319451586, 'alpha': 0.01909668102711023, 'subsample': 0.6025512482457149, 'colsample_bytree': 0.6145369939059644, 'max_depth': 4, 'min_child_weight': 8, 'eta': 0.06618576400799012, 'gamma': 2.5916494756716983, 'rate_drop': 8.915068928860804e-05, 'skip_drop': 4.350019438908537e-06}. Best is trial 33 with value: -1.544202524037621.
[I 2025-06-20 12:03:31,513] Trial 77 finished with value: -1.5764461280067246 and parameters: {'booster': 'dart', 'lambda': 3.578729951946107e-05, 'alpha': 0.07752921118642941, 'subsample': 0.6257290302716636, 'colsample_bytree': 0.5662145952876325, 'max_depth': 4, 'min_child_weight': 7, 'eta': 0.04303311004809589, 'gamma': 3.7967330299371396, 'rate_drop': 2.6714006376706782e-05, 'skip_drop': 7.069861214525405e-06}. Best is trial 33 with value: -1.544202524037621.
[I 2025-06-20 12:03:31,888] Trial 78 finished with value: -1.5987799286497333 and parameters: {'booster': 'gbtree', 'lambda': 0.0020858902992818363, 'alpha': 4.685544049361476e-05, 'subsample': 0.5653834646007613, 'colsample_bytree': 0.5197043994096222, 'max_depth': 5, 'min_child_weight': 9, 'eta': 0.07935423969218271, 'gamma': 3.671172122187401}. Best is trial 33 with value: -1.544202524037621.
[I 2025-06-20 12:03:38,570] Trial 79 finished with value: -1.574102737841591 and parameters: {'booster': 'dart', 'lambda': 0.00028254263723261834, 'alpha': 0.005029996597204301, 'subsample': 0.6343724231882918, 'colsample_bytree': 0.5475867471055269, 'max_depth': 4, 'min_child_weight': 6, 'eta': 0.05338096150409012, 'gamma': 2.973100393882763, 'rate_drop': 0.0001880191345595993, 'skip_drop': 6.871279906762922e-05}. Best is trial 33 with value: -1.544202524037621.
[I 2025-06-20 12:03:42,300] Trial 80 finished with value: -1.5802742271106835 and parameters: {'booster': 'dart', 'lambda': 0.006534234129682867, 'alpha': 0.05344816689167942, 'subsample': 0.6804097248882826, 'colsample_bytree': 0.66781086814076, 'max_depth': 3, 'min_child_weight': 7, 'eta': 0.10636267706560935, 'gamma': 4.824061685118336, 'rate_drop': 5.360995554684947e-07, 'skip_drop': 0.00017385889336016833}. Best is trial 33 with value: -1.544202524037621.
[I 2025-06-20 12:03:51,442] Trial 81 finished with value: -1.5676499999970437 and parameters: {'booster': 'dart', 'lambda': 2.464615798991668e-06, 'alpha': 0.0002182090129369975, 'subsample': 0.5978672672384598, 'colsample_bytree': 0.5899162982744927, 'max_depth': 4, 'min_child_weight': 7, 'eta': 0.02643669684299982, 'gamma': 3.2663230595160533, 'rate_drop': 1.3011499034123294e-05, 'skip_drop': 7.44443331867763e-05}. Best is trial 33 with value: -1.544202524037621.
[I 2025-06-20 12:03:58,477] Trial 82 finished with value: -1.5763287612092822 and parameters: {'booster': 'dart', 'lambda': 1.324900293503951e-07, 'alpha': 0.0002274470493530624, 'subsample': 0.615889232054605, 'colsample_bytree': 0.6088866660759092, 'max_depth': 4, 'min_child_weight': 8, 'eta': 0.04197423636283672, 'gamma': 2.8042564985030047, 'rate_drop': 5.416061320755811e-06, 'skip_drop': 2.5842338783941782e-05}. Best is trial 33 with value: -1.544202524037621.
[I 2025-06-20 12:04:07,583] Trial 83 finished with value: -1.6219080609226109 and parameters: {'booster': 'dart', 'lambda': 0.00012464278925267526, 'alpha': 6.166438680209598e-05, 'subsample': 0.5953658062068141, 'colsample_bytree': 0.5846186724228601, 'max_depth': 4, 'min_child_weight': 7, 'eta': 0.016041726120994488, 'gamma': 3.233558388780892, 'rate_drop': 6.168999373497221e-05, 'skip_drop': 9.672564880701744e-05}. Best is trial 33 with value: -1.544202524037621.
[I 2025-06-20 12:04:14,160] Trial 84 finished with value: -1.5775903825618924 and parameters: {'booster': 'dart', 'lambda': 2.0704117547322343e-06, 'alpha': 0.000772447081402001, 'subsample': 0.6604487358160624, 'colsample_bytree': 0.6515356572599819, 'max_depth': 5, 'min_child_weight': 6, 'eta': 0.03560419519057252, 'gamma': 4.4628177304959245, 'rate_drop': 3.253566137955652e-05, 'skip_drop': 9.50125192054806e-06}. Best is trial 33 with value: -1.544202524037621.
[I 2025-06-20 12:04:20,501] Trial 85 finished with value: -1.567471962000759 and parameters: {'booster': 'dart', 'lambda': 4.6924055497640186e-08, 'alpha': 2.7608238110734703e-05, 'subsample': 0.6443221281246199, 'colsample_bytree': 0.5343422543182599, 'max_depth': 3, 'min_child_weight': 7, 'eta': 0.057292508354968574, 'gamma': 2.6113601555067856, 'rate_drop': 1.1793208655720311e-05, 'skip_drop': 4.204056962475638e-05}. Best is trial 33 with value: -1.544202524037621.
[I 2025-06-20 12:04:23,373] Trial 86 finished with value: -1.5853478664080916 and parameters: {'booster': 'dart', 'lambda': 4.6722674890648007e-08, 'alpha': 9.075347340015038e-05, 'subsample': 0.640407884750942, 'colsample_bytree': 0.5356616194893855, 'max_depth': 3, 'min_child_weight': 8, 'eta': 0.12026686508097476, 'gamma': 2.567474089699175, 'rate_drop': 8.766403982930618e-06, 'skip_drop': 4.611511796585192e-05}. Best is trial 33 with value: -1.544202524037621.
[I 2025-06-20 12:04:29,734] Trial 87 finished with value: -1.580712702593891 and parameters: {'booster': 'dart', 'lambda': 4.7618991042117514e-07, 'alpha': 0.00017260394496756482, 'subsample': 0.6179170252396575, 'colsample_bytree': 0.5086447210185067, 'max_depth': 3, 'min_child_weight': 7, 'eta': 0.04837877819638348, 'gamma': 2.4201767078404113, 'rate_drop': 1.3774191462224615e-05, 'skip_drop': 1.377479510850615e-05}. Best is trial 33 with value: -1.544202524037621.
[I 2025-06-20 12:04:31,644] Trial 88 finished with value: -1.6162210107123576 and parameters: {'booster': 'dart', 'lambda': 2.5100168850593547e-07, 'alpha': 2.5555489233628535e-05, 'subsample': 0.5531344543148391, 'colsample_bytree': 0.5680413461085141, 'max_depth': 3, 'min_child_weight': 3, 'eta': 0.1714561032195133, 'gamma': 2.64614048030623, 'rate_drop': 3.0714237894970603e-06, 'skip_drop': 1.0361757334542487e-07}. Best is trial 33 with value: -1.544202524037621.
[I 2025-06-20 12:04:40,742] Trial 89 finished with value: -1.6150156562498807 and parameters: {'booster': 'dart', 'lambda': 2.161651108686321e-08, 'alpha': 6.812254378600841e-06, 'subsample': 0.570742494214013, 'colsample_bytree': 0.5489421295109547, 'max_depth': 4, 'min_child_weight': 9, 'eta': 0.01948027547728854, 'gamma': 2.2759690298035324, 'rate_drop': 0.00011909378136074945, 'skip_drop': 7.78189305714885e-05}. Best is trial 33 with value: -1.544202524037621.
[I 2025-06-20 12:04:43,564] Trial 90 finished with value: -1.5876861165521643 and parameters: {'booster': 'dart', 'lambda': 1.0308019415509095e-08, 'alpha': 1.358405673571076e-05, 'subsample': 0.5363446469347891, 'colsample_bytree': 0.5367471494102007, 'max_depth': 3, 'min_child_weight': 7, 'eta': 0.05932431591336002, 'gamma': 3.5961796542885747, 'rate_drop': 5.891220378560684e-06, 'skip_drop': 0.00016460248504962486}. Best is trial 33 with value: -1.544202524037621.
[I 2025-06-20 12:04:50,495] Trial 91 finished with value: -1.5548146158264098 and parameters: {'booster': 'dart', 'lambda': 1.9258386244507293e-08, 'alpha': 4.07004601452361e-05, 'subsample': 0.660395381299956, 'colsample_bytree': 0.6223897274077244, 'max_depth': 4, 'min_child_weight': 6, 'eta': 0.03360336764990039, 'gamma': 2.8657712350588005, 'rate_drop': 2.4262189251349878e-05, 'skip_drop': 2.5910056302908266e-05}. Best is trial 33 with value: -1.544202524037621.
[I 2025-06-20 12:04:59,655] Trial 92 finished with value: -1.5928313152976161 and parameters: {'booster': 'dart', 'lambda': 6.15433924674802e-08, 'alpha': 3.5616705081152108e-06, 'subsample': 0.6653195184705349, 'colsample_bytree': 0.6072456796200648, 'max_depth': 4, 'min_child_weight': 6, 'eta': 0.02528528375427495, 'gamma': 2.93169528092703, 'rate_drop': 3.35541823724704e-05, 'skip_drop': 1.8266624501735573e-05}. Best is trial 33 with value: -1.544202524037621.
[I 2025-06-20 12:05:09,777] Trial 93 finished with value: -1.5625728507777086 and parameters: {'booster': 'dart', 'lambda': 2.2830824942492013e-08, 'alpha': 2.4374728899549612e-05, 'subsample': 0.6453961334661653, 'colsample_bytree': 0.5569951294293615, 'max_depth': 4, 'min_child_weight': 7, 'eta': 0.03261749418079426, 'gamma': 2.7547071715048563, 'rate_drop': 5.970529378330559e-05, 'skip_drop': 4.466490555383344e-05}. Best is trial 33 with value: -1.544202524037621.
[I 2025-06-20 12:05:16,726] Trial 94 finished with value: -1.5662649398773998 and parameters: {'booster': 'dart', 'lambda': 1.8928200052468447e-08, 'alpha': 2.5712804931665545e-05, 'subsample': 0.5971867123197226, 'colsample_bytree': 0.5581212545123186, 'max_depth': 5, 'min_child_weight': 7, 'eta': 0.032953298173729224, 'gamma': 2.7552585650057146, 'rate_drop': 0.0003962614263705697, 'skip_drop': 2.155698846467172e-06}. Best is trial 33 with value: -1.544202524037621.
