[I 2025-06-23 11:25:47,617] Trial 48 finished with value: -1.5265826013083335 and parameters: {'booster': 'dart', 'lambda': 0.0016262496348724397, 'alpha': 0.01769485393294192, 'subsample': 0.5306609339384148, 'colsample_bytree': 0.5000126470572279, 'max_depth': 5, 'min_child_weight': 7, 'eta': 0.005163247923892536, 'gamma': 4.598852198269242, 'rate_drop': 7.001529941846048e-05, 'skip_drop': 6.634927169197797e-08}. Best is trial 22 with value: -1.5172525819846097.
[I 2025-06-23 11:25:55,315] Trial 49 finished with value: -1.5361143843823886 and parameters: {'booster': 'dart', 'lambda': 0.5482675978563453, 'alpha': 0.004070622866947197, 'subsample': 0.6396775810804274, 'colsample_bytree': 0.6709827549387737, 'max_depth': 3, 'min_child_weight': 8, 'eta': 0.007461019388125283, 'gamma': 4.805115914593378, 'rate_drop': 0.010302618218504912, 'skip_drop': 0.17925705248690676}. Best is trial 22 with value: -1.5172525819846097.
Number of finished trials:  50
Best trial:
  Value (RMSE): 1.5173
  MSE: 2.3021
  R²: 0.4320
Model saved to ck_student_score_predictor_optuna_xgb_with_th_score.pkl
PS D:\machile_nearning\wecode_score_prediction\dataset-core-extracted\XGBoost-CK> python .\predict_with_th_score.py       
Found 733 students without CK scores
Predictions saved to ck_score_predictions_with_th_score.csv
Sample predictions:
                                  student_id  predicted_ck_score
3   0134f9f410c65ad0e8c2254a7e9288670e02a183            4.592175
20  035f97702f2c01d26ab1fae8f39ea2f98a0caa3c            4.632960
40  06024da8147b5cf6105beb4c403f67cf1ff0aea1            4.666337
68  0aaebc88f6106684d6993c156104c1ef36cf94e0            4.725479
80  0bf111a9caedf02804f6991792490e63bc21058a            4.711559