PS D:\machile_nearning\wecode_score_prediction\dataset-core-extracted\XGBoost-CK> python .\train_with_th_score.py
[I 2025-06-23 11:23:57,912] A new study created in memory with name: no-name-f31eb995-b99d-490c-88ae-f2801a39cdd4
[I 2025-06-23 11:23:57,960] Trial 0 finished with value: -1.613847632448365 and parameters: {'booster': 'gbtree', 'lambda': 3.7508580013456356e-08, 'alpha': 4.737347313029306e-08, 'subsample': 0.8978818272063349, 'colsample_bytree': 0.9228623819253187, 'max_depth': 5, 'min_child_weight': 5, 'eta': 0.13590789421311184, 'gamma': 1.126754894722351}. Best is trial 0 with value: -1.613847632448365.
[I 2025-06-23 11:23:58,009] Trial 1 finished with value: -1.568964564167687 and parameters: {'booster': 'gbtree', 'lambda': 0.0021767315107184384, 'alpha': 0.2186551296644377, 'subsample': 0.9989690925771681, 'colsample_bytree': 0.7886093039252375, 'max_depth': 5, 'min_child_weight': 3, 'eta': 0.03584241151782955, 'gamma': 1.4610278161121715}. Best is trial 1 with value: -1.568964564167687.
[I 2025-06-23 11:23:58,146] Trial 2 finished with value: -1.5279003125826305 and parameters: {'booster': 'gbtree', 'lambda': 0.07403050743054031, 'alpha': 1.0097484241819502e-08, 'subsample': 0.7309075868875632, 'colsample_bytree': 0.5182854929994202, 'max_depth': 9, 'min_child_weight': 6, 'eta': 0.009617273158058185, 'gamma': 4.711351290738863}. Best is trial 2 with value: -1.5279003125826305.
[I 2025-06-23 11:23:58,401] Trial 3 finished with value: -1.543178345084835 and parameters: {'booster': 'gbtree', 'lambda': 0.0002832809628067502, 'alpha': 4.84598453918976e-08, 'subsample': 0.6679128130649492, 'colsample_bytree': 0.7348680736758642, 'max_depth': 8, 'min_child_weight': 8, 'eta': 0.004823024399591013, 'gamma': 1.915588599568373}. Best is trial 2 with value: -1.5279003125826305.
[I 2025-06-23 11:23:58,431] Trial 4 finished with value: -1.6293203106583518 and parameters: {'booster': 'gbtree', 'lambda': 2.098202357262994e-06, 'alpha': 0.8938684383839157, 'subsample': 0.8151002142303043, 'colsample_bytree': 0.9048052411339271, 'max_depth': 6, 'min_child_weight': 7, 'eta': 0.16324862980123128, 'gamma': 1.8528136672349915}. Best is trial 2 with value: -1.5279003125826305.
[I 2025-06-23 11:23:58,554] Trial 5 finished with value: -1.6099763161150393 and parameters: {'booster': 'dart', 'lambda': 0.011754569884601941, 'alpha': 0.01652568632884311, 'subsample': 0.6320755207407617, 'colsample_bytree': 0.998965841878763, 'max_depth': 4, 'min_child_weight': 1, 'eta': 0.12794390278925385, 'gamma': 4.54826202007672, 'rate_drop': 0.3539666961793347, 'skip_drop': 0.272384216754161}. Best is trial 2 with value: -1.5279003125826305.
[I 2025-06-23 11:23:58,715] Trial 6 finished with value: -1.5676102526852222 and parameters: {'booster': 'gbtree', 'lambda': 1.1285588365663292e-06, 'alpha': 0.20257481400566107, 'subsample': 0.9677921085612549, 'colsample_bytree': 0.5808196631561073, 'max_depth': 4, 'min_child_weight': 2, 'eta': 0.0032549122642946933, 'gamma': 0.6298220495530699}. Best is trial 2 with value: -1.5279003125826305.
[I 2025-06-23 11:23:59,175] Trial 7 finished with value: -1.5638549146146754 and parameters: {'booster': 'dart', 'lambda': 3.805467587685737e-05, 'alpha': 1.2495852680479086e-08, 'subsample': 0.8703287141008516, 'colsample_bytree': 0.6621805459624551, 'max_depth': 9, 'min_child_weight': 6, 'eta': 0.10994493737068324, 'gamma': 3.0992695007733695, 'rate_drop': 0.45663228831797087, 'skip_drop': 0.13951741075843557}. Best is trial 2 with value: -1.5279003125826305.
[I 2025-06-23 11:23:59,206] Trial 8 finished with value: -1.61247399980612 and parameters: {'booster': 'gbtree', 'lambda': 0.0017363622921709797, 'alpha': 8.656505905610281e-07, 'subsample': 0.5109274184388779, 'colsample_bytree': 0.6735959631864088, 'max_depth': 9, 'min_child_weight': 6, 'eta': 0.09348929690247404, 'gamma': 4.546405361546835}. Best is trial 2 with value: -1.5279003125826305.
[I 2025-06-23 11:23:59,229] Trial 9 finished with value: -1.6139079208480513 and parameters: {'booster': 'gbtree', 'lambda': 5.5242622100415695e-06, 'alpha': 2.5210359461101746, 'subsample': 0.8753722960579899, 'colsample_bytree': 0.6514177590512911, 'max_depth': 6, 'min_child_weight': 2, 'eta': 0.1960826159237698, 'gamma': 2.048296929582136}. Best is trial 2 with value: -1.5279003125826305.
[I 2025-06-23 11:24:06,205] Trial 10 finished with value: -1.765210057682342 and parameters: {'booster': 'dart', 'lambda': 7.712799538104196, 'alpha': 9.344653184767082e-05, 'subsample': 0.7311262608909187, 'colsample_bytree': 0.5103112696054175, 'max_depth': 10, 'min_child_weight': 10, 'eta': 0.0012649220739688314, 'gamma': 3.3892756709285483, 'rate_drop': 2.7624477244404914e-08, 'skip_drop': 3.204203251948052e-08}. Best is trial 2 with value: -1.5279003125826305.
[I 2025-06-23 11:24:06,391] Trial 11 finished with value: -1.5415266297958685 and parameters: {'booster': 'gbtree', 'lambda': 0.1646304652967313, 'alpha': 3.2219033136225934e-06, 'subsample': 0.6879339789958271, 'colsample_bytree': 0.7709271219276129, 'max_depth': 8, 'min_child_weight': 9, 'eta': 0.00811991412165017, 'gamma': 3.0379342773383744}. Best is trial 2 with value: -1.5279003125826305.
[I 2025-06-23 11:24:06,551] Trial 12 finished with value: -1.5463388801909137 and parameters: {'booster': 'gbtree', 'lambda': 0.3066517477486094, 'alpha': 5.4721207414948615e-06, 'subsample': 0.6176511906280816, 'colsample_bytree': 0.7956337077356098, 'max_depth': 8, 'min_child_weight': 10, 'eta': 0.013790472165609073, 'gamma': 3.4067843184259083}. Best is trial 2 with value: -1.5279003125826305.
[I 2025-06-23 11:24:06,688] Trial 13 finished with value: -1.552362427512316 and parameters: {'booster': 'gbtree', 'lambda': 0.08511889325341854, 'alpha': 2.7834639583489463e-06, 'subsample': 0.7467545311001579, 'colsample_bytree': 0.8631167196227749, 'max_depth': 8, 'min_child_weight': 8, 'eta': 0.013480013571387362, 'gamma': 4.019588946870398}. Best is trial 2 with value: -1.5279003125826305.
[I 2025-06-23 11:24:14,115] Trial 14 finished with value: -1.5373754068792693 and parameters: {'booster': 'dart', 'lambda': 2.090532128780603, 'alpha': 0.0003896570423224415, 'subsample': 0.5382452873970376, 'colsample_bytree': 0.507644510857321, 'max_depth': 10, 'min_child_weight': 4, 'eta': 0.005914546085399262, 'gamma': 4.834944837802516, 'rate_drop': 3.5185436827421344e-06, 'skip_drop': 2.1687013002245784e-08}. Best is trial 2 with value: -1.5279003125826305.
[I 2025-06-23 11:24:14,680] Trial 15 finished with value: -1.5598467469289445 and parameters: {'booster': 'dart', 'lambda': 4.936777475007458, 'alpha': 0.0016429043406629526, 'subsample': 0.5138080723631119, 'colsample_bytree': 0.504694732405021, 'max_depth': 10, 'min_child_weight': 4, 'eta': 0.04358023253363529, 'gamma': 4.998197378023079, 'rate_drop': 3.223855346152673e-06, 'skip_drop': 1.715714347347169e-08}. Best is trial 2 with value: -1.5279003125826305.
[I 2025-06-23 11:24:22,157] Trial 16 finished with value: -1.565003860889233 and parameters: {'booster': 'dart', 'lambda': 0.6343895304370791, 'alpha': 0.00014024019195053346, 'subsample': 0.5887974910530166, 'colsample_bytree': 0.5853571500135808, 'max_depth': 10, 'min_child_weight': 4, 'eta': 0.0027558112705120424, 'gamma': 4.058583455934929, 'rate_drop': 9.82168516505793e-05, 'skip_drop': 1.9364728192369718e-05}. Best is trial 2 with value: -1.5279003125826305.
[I 2025-06-23 11:24:22,991] Trial 17 finished with value: -1.527391573463354 and parameters: {'booster': 'dart', 'lambda': 0.015510521214301177, 'alpha': 0.002466190865538156, 'subsample': 0.5737391466477655, 'colsample_bytree': 0.5680357737433601, 'max_depth': 9, 'min_child_weight': 5, 'eta': 0.02659796393585676, 'gamma': 3.927811147266559, 'rate_drop': 2.2444951209480356e-07, 'skip_drop': 1.4334204563305067e-05}. Best is trial 17 with value: -1.527391573463354.
[I 2025-06-23 11:24:23,404] Trial 18 finished with value: -1.5442904207102044 and parameters: {'booster': 'dart', 'lambda': 0.015691137529779742, 'alpha': 0.00760418884207375, 'subsample': 0.7892749164343092, 'colsample_bytree': 0.5772845711077154, 'max_depth': 7, 'min_child_weight': 5, 'eta': 0.030605258058537844, 'gamma': 3.9505431665959394, 'rate_drop': 1.4742350997173443e-08, 'skip_drop': 5.954874998991733e-05}. Best is trial 17 with value: -1.527391573463354.
[I 2025-06-23 11:24:23,734] Trial 19 finished with value: -1.5985507791325781 and parameters: {'booster': 'dart', 'lambda': 0.019574271557747075, 'alpha': 0.05561999020456082, 'subsample': 0.5788635115490489, 'colsample_bytree': 0.6229045145705407, 'max_depth': 9, 'min_child_weight': 7, 'eta': 0.05604832513432391, 'gamma': 2.537310218781939, 'rate_drop': 0.0020129685094929985, 'skip_drop': 0.003665471572703679}. Best is trial 17 with value: -1.527391573463354.
[I 2025-06-23 11:24:24,871] Trial 20 finished with value: -1.5278989799677265 and parameters: {'booster': 'dart', 'lambda': 0.00014770328380559324, 'alpha': 0.0012939298473512606, 'subsample': 0.6919882367921745, 'colsample_bytree': 0.5577673094397133, 'max_depth': 7, 'min_child_weight': 7, 'eta': 0.02211256217994741, 'gamma': 3.776445321487805, 'rate_drop': 1.4791218966984021e-06, 'skip_drop': 8.314312661572914e-07}. Best is trial 17 with value: -1.527391573463354.
[I 2025-06-23 11:24:25,888] Trial 21 finished with value: -1.5345294340493336 and parameters: {'booster': 'dart', 'lambda': 0.00013423957800952682, 'alpha': 2.4205884298666295e-05, 'subsample': 0.6888286396037625, 'colsample_bytree': 0.5612908154710272, 'max_depth': 7, 'min_child_weight': 7, 'eta': 0.021744336164514263, 'gamma': 3.8675118369690553, 'rate_drop': 1.0719440734846887e-06, 'skip_drop': 3.047406651147826e-06}. Best is trial 17 with value: -1.527391573463354.
[I 2025-06-23 11:24:30,491] Trial 22 finished with value: -1.5172525819846097 and parameters: {'booster': 'dart', 'lambda': 0.0017575766276049672, 'alpha': 0.001493669978440287, 'subsample': 0.7863556906111246, 'colsample_bytree': 0.5461996936810113, 'max_depth': 9, 'min_child_weight': 6, 'eta': 0.00943572594663163, 'gamma': 4.481329605154361, 'rate_drop': 2.837881391365813e-07, 'skip_drop': 1.0089592641051935e-06}. Best is trial 22 with value: -1.5172525819846097.
[I 2025-06-23 11:24:31,550] Trial 23 finished with value: -1.5493656110983884 and parameters: {'booster': 'dart', 'lambda': 0.002036722421650682, 'alpha': 0.0022010334809384937, 'subsample': 0.7860019762276074, 'colsample_bytree': 0.7038239652275344, 'max_depth': 3, 'min_child_weight': 8, 'eta': 0.022173783271852134, 'gamma': 4.262782356363116, 'rate_drop': 2.5350304847846417e-07, 'skip_drop': 9.846670657933223e-07}. Best is trial 22 with value: -1.5172525819846097.
[I 2025-06-23 11:24:31,817] Trial 24 finished with value: -1.579164321572669 and parameters: {'booster': 'dart', 'lambda': 3.493648854356819e-05, 'alpha': 0.001750534440188267, 'subsample': 0.6511385462082113, 'colsample_bytree': 0.6320399315314076, 'max_depth': 7, 'min_child_weight': 5, 'eta': 0.06180387333894121, 'gamma': 3.599565058248467, 'rate_drop': 3.704903615980666e-05, 'skip_drop': 1.2813019147388305e-06}. Best is trial 22 with value: -1.5172525819846097.
[I 2025-06-23 11:24:33,096] Trial 25 finished with value: -1.5383390495148876 and parameters: {'booster': 'dart', 'lambda': 0.0008894004737897373, 'alpha': 0.0004370334103505287, 'subsample': 0.561226874524708, 'colsample_bytree': 0.546491038759942, 'max_depth': 9, 'min_child_weight': 7, 'eta': 0.016732387239372704, 'gamma': 2.904631343703468, 'rate_drop': 1.9530182858111073e-07, 'skip_drop': 2.9848172432137067e-07}. Best is trial 22 with value: -1.5172525819846097.
[I 2025-06-23 11:24:35,844] Trial 26 finished with value: -1.535107357721064 and parameters: {'booster': 'dart', 'lambda': 5.380912511607035e-05, 'alpha': 0.01250483511949746, 'subsample': 0.8121997514109742, 'colsample_bytree': 0.6122207386895621, 'max_depth': 8, 'min_child_weight': 6, 'eta': 0.009187766735780487, 'gamma': 2.598548042878688, 'rate_drop': 1.4275036832653745e-05, 'skip_drop': 0.0005162832075074308}. Best is trial 22 with value: -1.5172525819846097.
[I 2025-06-23 11:24:36,544] Trial 27 finished with value: -1.5366306125224058 and parameters: {'booster': 'dart', 'lambda': 9.932586184809093e-06, 'alpha': 3.1085083108516635e-05, 'subsample': 0.7028491831333183, 'colsample_bytree': 0.5451939932115208, 'max_depth': 6, 'min_child_weight': 9, 'eta': 0.026166629861656587, 'gamma': 4.312073604231435, 'rate_drop': 0.0021347823433839346, 'skip_drop': 8.000950101361826e-06}. Best is trial 22 with value: -1.5172525819846097.
[I 2025-06-23 11:24:36,816] Trial 28 finished with value: -1.5692801794682736 and parameters: {'booster': 'dart', 'lambda': 4.5086274028511774e-07, 'alpha': 0.034631901937127965, 'subsample': 0.8399624299784085, 'colsample_bytree': 0.6984222543034195, 'max_depth': 7, 'min_child_weight': 3, 'eta': 0.06735381217529561, 'gamma': 3.7317247567740743, 'rate_drop': 2.398075718909558e-07, 'skip_drop': 0.000366166224231771}. Best is trial 22 with value: -1.5172525819846097.
[I 2025-06-23 11:24:44,273] Trial 29 finished with value: -1.6132398660248988 and parameters: {'booster': 'dart', 'lambda': 8.448215619024615e-08, 'alpha': 0.0026751713347851237, 'subsample': 0.9344542764200843, 'colsample_bytree': 0.6047754539889828, 'max_depth': 5, 'min_child_weight': 5, 'eta': 0.0018633360824637966, 'gamma': 0.15314745605238533, 'rate_drop': 5.776496603968602e-08, 'skip_drop': 1.8299155424168619e-07}. Best is trial 22 with value: -1.5172525819846097.
[I 2025-06-23 11:24:46,551] Trial 30 finished with value: -1.5210729261217528 and parameters: {'booster': 'dart', 'lambda': 0.006612389324450063, 'alpha': 0.0006867744555034014, 'subsample': 0.766790735157605, 'colsample_bytree': 0.5466307184167225, 'max_depth': 9, 'min_child_weight': 5, 'eta': 0.013516486917954667, 'gamma': 3.285040699206067, 'rate_drop': 1.2080192954670687e-06, 'skip_drop': 1.8914587597656368e-07}. Best is trial 22 with value: -1.5172525819846097.
[I 2025-06-23 11:24:49,487] Trial 31 finished with value: -1.5298545682166735 and parameters: {'booster': 'dart', 'lambda': 0.009794939064195204, 'alpha': 0.0006170345740629617, 'subsample': 0.7597623118036719, 'colsample_bytree': 0.5386204223757424, 'max_depth': 9, 'min_child_weight': 5, 'eta': 0.012029989140650229, 'gamma': 3.407461047043962, 'rate_drop': 6.986243385910706e-07, 'skip_drop': 2.679640564494746e-07}. Best is trial 22 with value: -1.5172525819846097.
[I 2025-06-23 11:24:55,153] Trial 32 finished with value: -1.5322325286364502 and parameters: {'booster': 'dart', 'lambda': 0.0005780761222760543, 'alpha': 7.358779990113605e-05, 'subsample': 0.7743295557826727, 'colsample_bytree': 0.5983430717315488, 'max_depth': 10, 'min_child_weight': 4, 'eta': 0.005988990659225833, 'gamma': 4.298838319809688, 'rate_drop': 8.895435644638824e-06, 'skip_drop': 9.965838380656758e-06}. Best is trial 22 with value: -1.5172525819846097.
[I 2025-06-23 11:24:55,836] Trial 33 finished with value: -1.5490830446465218 and parameters: {'booster': 'dart', 'lambda': 0.004716235268099448, 'alpha': 0.005213443677401887, 'subsample': 0.7172267250309249, 'colsample_bytree': 0.5477179311913345, 'max_depth': 9, 'min_child_weight': 6, 'eta': 0.03387065150378058, 'gamma': 2.8074016087437137, 'rate_drop': 1.3220806026107137e-06, 'skip_drop': 1.3410536291926856e-07}. Best is trial 22 with value: -1.5172525819846097.
[I 2025-06-23 11:24:56,614] Trial 34 finished with value: -1.5487995926301907 and parameters: {'booster': 'dart', 'lambda': 0.00020774100138029947, 'alpha': 0.1299103892744113, 'subsample': 0.8227899558803027, 'colsample_bytree': 0.8262372883455483, 'max_depth': 8, 'min_child_weight': 5, 'eta': 0.019973798620877243, 'gamma': 3.6306375746918658, 'rate_drop': 8.447124247886611e-08, 'skip_drop': 1.4362484519915762e-06}. Best is trial 22 with value: -1.5172525819846097.
[I 2025-06-23 11:24:57,067] Trial 35 finished with value: -1.5383414640931443 and parameters: {'booster': 'dart', 'lambda': 0.04732997124185754, 'alpha': 0.00079431066911781, 'subsample': 0.6672045667819235, 'colsample_bytree': 0.5346421159783054, 'max_depth': 8, 'min_child_weight': 7, 'eta': 0.040794247493203914, 'gamma': 3.18240470179417, 'rate_drop': 0.0008373258532366147, 'skip_drop': 2.4898848737164247e-05}. Best is trial 22 with value: -1.5172525819846097.
[I 2025-06-23 11:25:05,207] Trial 36 finished with value: -1.5303691012254816 and parameters: {'booster': 'dart', 'lambda': 0.0054610006495420926, 'alpha': 0.0001691317043570325, 'subsample': 0.6237121688924597, 'colsample_bytree': 0.5708505789502589, 'max_depth': 9, 'min_child_weight': 6, 'eta': 0.004285991773187653, 'gamma': 4.466604336967306, 'rate_drop': 4.304293625866896e-07, 'skip_drop': 3.1134582464032096e-06}. Best is trial 22 with value: -1.5172525819846097.
[I 2025-06-23 11:25:05,375] Trial 37 finished with value: -1.6458149425012132 and parameters: {'booster': 'dart', 'lambda': 0.0005595956509665876, 'alpha': 0.9137628254353127, 'subsample': 0.8526096371637484, 'colsample_bytree': 0.6393581893949736, 'max_depth': 7, 'min_child_weight': 3, 'eta': 0.2875052732057414, 'gamma': 4.754560867273061, 'rate_drop': 1.1075071341484962e-08, 'skip_drop': 6.328867055725379e-08}. Best is trial 22 with value: -1.5172525819846097.
[I 2025-06-23 11:25:07,819] Trial 38 finished with value: -1.5529340708413344 and parameters: {'booster': 'dart', 'lambda': 0.050611565045693696, 'alpha': 1.9357182159191344e-05, 'subsample': 0.7284993808760765, 'colsample_bytree': 0.7379782936091456, 'max_depth': 10, 'min_child_weight': 8, 'eta': 0.00854345140198716, 'gamma': 1.5636507128078272, 'rate_drop': 3.591303276517363e-06, 'skip_drop': 6.21553756858019e-07}. Best is trial 22 with value: -1.5172525819846097.
[I 2025-06-23 11:25:08,665] Trial 39 finished with value: -1.5684774060154207 and parameters: {'booster': 'dart', 'lambda': 8.962496288119465e-05, 'alpha': 0.030769306235357775, 'subsample': 0.9138329823434774, 'colsample_bytree': 0.9863082234008504, 'max_depth': 6, 'min_child_weight': 4, 'eta': 0.016055733471328798, 'gamma': 2.0590998761901456, 'rate_drop': 1.431145763311688e-07, 'skip_drop': 8.873521539585847e-05}. Best is trial 22 with value: -1.5172525819846097.
[I 2025-06-23 11:25:12,150] Trial 40 finished with value: -1.5234249366062909 and parameters: {'booster': 'dart', 'lambda': 0.0026083435984720015, 'alpha': 0.0045958950106875455, 'subsample': 0.5950054079135216, 'colsample_bytree': 0.527694637446007, 'max_depth': 4, 'min_child_weight': 7, 'eta': 0.010269251520775369, 'gamma': 4.1209123548080395, 'rate_drop': 3.788730417699257e-05, 'skip_drop': 3.515936092043664e-06}. Best is trial 22 with value: -1.5172525819846097.
[I 2025-06-23 11:25:15,575] Trial 41 finished with value: -1.5255031805846362 and parameters: {'booster': 'dart', 'lambda': 0.0023032698246525335, 'alpha': 0.006210156360811718, 'subsample': 0.5912006316551391, 'colsample_bytree': 0.5273145529158193, 'max_depth': 4, 'min_child_weight': 7, 'eta': 0.01119737767583472, 'gamma': 4.047198495667837, 'rate_drop': 0.0002460310148882028, 'skip_drop': 4.13133590519189e-06}. Best is trial 22 with value: -1.5172525819846097.
[I 2025-06-23 11:25:19,078] Trial 42 finished with value: -1.5262467934277968 and parameters: {'booster': 'dart', 'lambda': 0.0032101739682387606, 'alpha': 0.007726316793469665, 'subsample': 0.5982792336477774, 'colsample_bytree': 0.5192545524231827, 'max_depth': 4, 'min_child_weight': 6, 'eta': 0.0109672520353635, 'gamma': 4.229241884476093, 'rate_drop': 0.00033459202966309195, 'skip_drop': 5.0359599721280695e-06}. Best is trial 22 with value: -1.5172525819846097.
[I 2025-06-23 11:25:22,558] Trial 43 finished with value: -1.5278115970980457 and parameters: {'booster': 'dart', 'lambda': 0.0026444746157245603, 'alpha': 0.07794021715581398, 'subsample': 0.5951601167033449, 'colsample_bytree': 0.5175983204547706, 'max_depth': 4, 'min_child_weight': 6, 'eta': 0.0110653550150363, 'gamma': 4.5558001508802874, 'rate_drop': 0.0006839634952199014, 'skip_drop': 3.631078900738499e-06}. Best is trial 22 with value: -1.5172525819846097.
[I 2025-06-23 11:25:30,033] Trial 44 finished with value: -1.614096099530376 and parameters: {'booster': 'dart', 'lambda': 0.0007528470253211933, 'alpha': 0.00848327042510168, 'subsample': 0.5536252047146611, 'colsample_bytree': 0.5258319075401454, 'max_depth': 3, 'min_child_weight': 8, 'eta': 0.006883410291039581, 'gamma': 4.407563534730803, 'rate_drop': 0.020154989647007744, 'skip_drop': 4.651272479253508e-06}. Best is trial 22 with value: -1.5172525819846097.
[I 2025-06-23 11:25:30,296] Trial 45 finished with value: -1.5388036432280938 and parameters: {'booster': 'gbtree', 'lambda': 0.0042563755186856, 'alpha': 0.25504996658565576, 'subsample': 0.6097248973043787, 'colsample_bytree': 0.5964043401147044, 'max_depth': 4, 'min_child_weight': 7, 'eta': 0.0037144134951576178, 'gamma': 4.1633933232603395}. Best is trial 22 with value: -1.5172525819846097.
[I 2025-06-23 11:25:38,210] Trial 46 finished with value: -1.5218171475002296 and parameters: {'booster': 'dart', 'lambda': 0.0012630196446139655, 'alpha': 0.018208316667279224, 'subsample': 0.6431880390751004, 'colsample_bytree': 0.5213457011703022, 'max_depth': 5, 'min_child_weight': 6, 'eta': 0.005014974027271091, 'gamma': 4.711025562319623, 'rate_drop': 0.00016102673266394182, 'skip_drop': 6.969621477384496e-08}. Best is trial 22 with value: -1.5172525819846097.
[I 2025-06-23 11:25:38,466] Trial 47 finished with value: -1.5849385034720729 and parameters: {'booster': 'gbtree', 'lambda': 0.0003108811115733261, 'alpha': 0.3955415114376787, 'subsample': 0.6475242566148062, 'colsample_bytree': 0.5032270581916002, 'max_depth': 5, 'min_child_weight': 9, 'eta': 0.0026933373663906735, 'gamma': 4.998168404271114}. Best is trial 22 with value: -1.5172525819846097.
