[I 2025-06-20 12:32:14,981] Trial 421 finished with value: -1.042451655135684 and parameters: {'booster': 'dart', 'lambda': 7.3200283934349135e-06, 'alpha': 0.03310092405196463, 'subsample': 0.5125940785909928, 'colsample_bytree': 0.727691828812686, 'max_depth': 3, 'min_child_weight': 10, 'eta': 0.09395117245489021, 'gamma': 2.1716949842702613, 'rate_drop': 1.4838412624846417e-08, 'skip_drop': 3.4169703889450243e-06}. Best is trial 366 with value: -0.989605092644619.
[I 2025-06-20 12:32:16,177] Trial 422 finished with value: -1.1605585752898788 and parameters: {'booster': 'dart', 'lambda': 2.6518939869748028e-06, 'alpha': 0.06008203164360457, 'subsample': 0.5281692429128774, 'colsample_bytree': 0.6952844267521429, 'max_depth': 3, 'min_child_weight': 10, 'eta': 0.1398935112085968, 'gamma': 2.060585141346784, 'rate_drop': 3.7800442800046444e-08, 'skip_drop': 2.085832913928682e-05}. Best is trial 366 with value: -0.989605092644619.
[I 2025-06-20 12:32:20,488] Trial 423 finished with value: -1.0611284022276042 and parameters: {'booster': 'dart', 'lambda': 5.874105825214388e-07, 'alpha': 0.09320079371669689, 'subsample': 0.5437284747334292, 'colsample_bytree': 0.7160339296602924, 'max_depth': 3, 'min_child_weight': 10, 'eta': 0.15987820568446479, 'gamma': 2.305305974388193, 'rate_drop': 1.0111122211042482e-08, 'skip_drop': 5.250060499428115e-06}. Best is trial 366 with value: -0.989605092644619.
[I 2025-06-20 12:32:29,331] Trial 424 finished with value: -1.0285918257963573 and parameters: {'booster': 'dart', 'lambda': 4.0432143512009575e-06, 'alpha': 0.15364467547072297, 'subsample': 0.5190103597453435, 'colsample_bytree': 0.6828868423532541, 'max_depth': 3, 'min_child_weight': 10, 'eta': 0.1026383200708823, 'gamma': 1.9210811852027374, 'rate_drop': 2.9195465452771655e-08, 'skip_drop': 9.180997006482252e-06}. Best is trial 366 with value: -0.989605092644619.
[I 2025-06-20 12:32:35,939] Trial 425 finished with value: -1.0135943133209961 and parameters: {'booster': 'dart', 'lambda': 1.5185026020035786e-05, 'alpha': 0.40327792618429864, 'subsample': 0.5346231813773633, 'colsample_bytree': 0.7045168986697036, 'max_depth': 3, 'min_child_weight': 10, 'eta': 0.11500360377531932, 'gamma': 2.1871529198894697, 'rate_drop': 1.8531758672114154e-08, 'skip_drop': 2.2953950277226537e-06}. Best is trial 366 with value: -0.989605092644619.
[I 2025-06-20 12:32:42,297] Trial 426 finished with value: -1.0496610954110228 and parameters: {'booster': 'dart', 'lambda': 1.436416926530847e-05, 'alpha': 0.4381205796679408, 'subsample': 0.5363099194645852, 'colsample_bytree': 0.7251443099620452, 'max_depth': 3, 'min_child_weight': 10, 'eta': 0.10997159833774299, 'gamma': 2.4738201273893625, 'rate_drop': 4.152225152385396e-08, 'skip_drop': 2.216069521491621e-06}. Best is trial 366 with value: -0.989605092644619.
[I 2025-06-20 12:32:50,949] Trial 427 finished with value: -1.0325726462275244 and parameters: {'booster': 'dart', 'lambda': 1.9683960920624487e-06, 'alpha': 0.7656206764936662, 'subsample': 0.5485797280722826, 'colsample_bytree': 0.7056366531311455, 'max_depth': 3, 'min_child_weight': 10, 'eta': 0.09499090153826655, 'gamma': 2.2188086619198018, 'rate_drop': 1.9118876822929395e-08, 'skip_drop': 2.3229395763982218e-06}. Best is trial 366 with value: -0.989605092644619.
[I 2025-06-20 12:32:57,512] Trial 428 finished with value: -1.0242608622072298 and parameters: {'booster': 'dart', 'lambda': 5.738403369653634e-06, 'alpha': 0.05563885126588424, 'subsample': 0.8405699988910952, 'colsample_bytree': 0.7125995053218535, 'max_depth': 3, 'min_child_weight': 10, 'eta': 0.11732741671457389, 'gamma': 2.3656590995772344, 'rate_drop': 4.964095249045229e-08, 'skip_drop': 3.2549536955466217e-06}. Best is trial 366 with value: -0.989605092644619.
[I 2025-06-20 12:33:04,738] Trial 429 finished with value: -1.085871171640593 and parameters: {'booster': 'dart', 'lambda': 1.267205331285285e-05, 'alpha': 0.027817880200358514, 'subsample': 0.5372882860690882, 'colsample_bytree': 0.738928964227461, 'max_depth': 3, 'min_child_weight': 10, 'eta': 0.09240956482129638, 'gamma': 2.1846492891463387, 'rate_drop': 2.8693549144370162e-08, 'skip_drop': 3.7332730364865174e-06}. Best is trial 366 with value: -0.989605092644619.
[I 2025-06-20 12:33:12,923] Trial 430 finished with value: -1.039552037328642 and parameters: {'booster': 'dart', 'lambda': 9.320870533554998e-07, 'alpha': 0.04195732750176459, 'subsample': 0.5092129511303097, 'colsample_bytree': 0.6872769317829479, 'max_depth': 3, 'min_child_weight': 10, 'eta': 0.1058744481544626, 'gamma': 1.9109656563232633, 'rate_drop': 1.897737675297631e-08, 'skip_drop': 1.8524937874595464e-06}. Best is trial 366 with value: -0.989605092644619.
[I 2025-06-20 12:33:19,345] Trial 431 finished with value: -1.028385018749952 and parameters: {'booster': 'dart', 'lambda': 3.817932354951293e-07, 'alpha': 0.09956235780822677, 'subsample': 0.521255248019496, 'colsample_bytree': 0.7207177307180499, 'max_depth': 3, 'min_child_weight': 10, 'eta': 0.12296488591854822, 'gamma': 2.3249699162855664, 'rate_drop': 0.0014253362566525977, 'skip_drop': 2.265679106437041e-06}. Best is trial 366 with value: -0.989605092644619.
[I 2025-06-20 12:33:19,685] Trial 432 finished with value: -1.096591030771223 and parameters: {'booster': 'gbtree', 'lambda': 2.7733942904340098e-06, 'alpha': 0.14720646749760194, 'subsample': 0.5465124447338209, 'colsample_bytree': 0.7038869133986589, 'max_depth': 3, 'min_child_weight': 10, 'eta': 0.09601089461248531, 'gamma': 2.471585430273551}. Best is trial 366 with value: -0.989605092644619.
[I 2025-06-20 12:33:27,561] Trial 433 finished with value: -1.0487644224694865 and parameters: {'booster': 'dart', 'lambda': 1.0391096276814763e-05, 'alpha': 0.07804341700273995, 'subsample': 0.5321538421015548, 'colsample_bytree': 0.6937957970794467, 'max_depth': 3, 'min_child_weight': 10, 'eta': 0.11275671292332966, 'gamma': 2.131183116762046, 'rate_drop': 2.45851490602797e-08, 'skip_drop': 4.377597849787939e-06}. Best is trial 366 with value: -0.989605092644619.
[I 2025-06-20 12:33:34,674] Trial 434 finished with value: -1.0091906968291033 and parameters: {'booster': 'dart', 'lambda': 1.6866210641646945e-05, 'alpha': 0.047250992797592296, 'subsample': 0.5205043474985912, 'colsample_bytree': 0.7121799104144723, 'max_depth': 3, 'min_child_weight': 10, 'eta': 0.1018572407088089, 'gamma': 1.9988712180311483, 'rate_drop': 1.500196846915039e-08, 'skip_drop': 1.7642692744595231e-06}. Best is trial 366 with value: -0.989605092644619.
[I 2025-06-20 12:33:41,288] Trial 435 finished with value: -1.0864615005980276 and parameters: {'booster': 'dart', 'lambda': 1.6877446745401135e-05, 'alpha': 0.031107714884671345, 'subsample': 0.5099107303180854, 'colsample_bytree': 0.7105137083094426, 'max_depth': 3, 'min_child_weight': 10, 'eta': 0.08952694182717193, 'gamma': 1.9955710424186504, 'rate_drop': 1.4249745016116934e-08, 'skip_drop': 1.997172126699562e-06}. Best is trial 366 with value: -0.989605092644619.
[I 2025-06-20 12:33:50,112] Trial 436 finished with value: -1.0595822209507564 and parameters: {'booster': 'dart', 'lambda': 1.7222111034376492e-05, 'alpha': 0.04648612697138886, 'subsample': 0.5185710403783779, 'colsample_bytree': 0.7005452935004549, 'max_depth': 3, 'min_child_weight': 10, 'eta': 0.12176902204005413, 'gamma': 2.2086370562920874, 'rate_drop': 1.577262303422689e-08, 'skip_drop': 2.914514984095874e-06}. Best is trial 366 with value: -0.989605092644619.
[I 2025-06-20 12:33:57,565] Trial 437 finished with value: -1.0117682852873993 and parameters: {'booster': 'dart', 'lambda': 1.0082957555358303e-05, 'alpha': 0.05288238502631602, 'subsample': 0.5265583493246607, 'colsample_bytree': 0.6836634384977861, 'max_depth': 3, 'min_child_weight': 10, 'eta': 0.10313919257731458, 'gamma': 2.2887093070720113, 'rate_drop': 2.0129935233004475e-08, 'skip_drop': 1.423811450794161e-06}. Best is trial 366 with value: -0.989605092644619.
[I 2025-06-20 12:34:06,530] Trial 438 finished with value: -1.0473633347847189 and parameters: {'booster': 'dart', 'lambda': 9.096031937843425e-06, 'alpha': 0.02796769479946437, 'subsample': 0.5015032650682223, 'colsample_bytree': 0.6816217913857585, 'max_depth': 3, 'min_child_weight': 10, 'eta': 0.09949713738808846, 'gamma': 2.399060659340802, 'rate_drop': 1.509124399356426e-08, 'skip_drop': 1.4883638373830997e-06}. Best is trial 366 with value: -0.989605092644619.
[I 2025-06-20 12:34:15,685] Trial 439 finished with value: -1.23592507763085 and parameters: {'booster': 'dart', 'lambda': 1.625957339450294e-05, 'alpha': 0.047189559498478244, 'subsample': 0.5185349569586315, 'colsample_bytree': 0.6813219311332445, 'max_depth': 3, 'min_child_weight': 10, 'eta': 0.011459096237145812, 'gamma': 2.2858918619007214, 'rate_drop': 3.318491541518127e-08, 'skip_drop': 2.2005885306148822e-06}. Best is trial 366 with value: -0.989605092644619.
[I 2025-06-20 12:34:23,980] Trial 440 finished with value: -1.078540862739023 and parameters: {'booster': 'dart', 'lambda': 7.322115843506604e-06, 'alpha': 0.052309214136995116, 'subsample': 0.5093901755635887, 'colsample_bytree': 0.6754576818437417, 'max_depth': 3, 'min_child_weight': 10, 'eta': 0.08644647746015094, 'gamma': 2.286633919270704, 'rate_drop': 5.069619657164728e-08, 'skip_drop': 1.5968963210666263e-06}. Best is trial 366 with value: -0.989605092644619.
[I 2025-06-20 12:34:28,235] Trial 441 finished with value: -1.0511237379363567 and parameters: {'booster': 'dart', 'lambda': 1.2949358719990369e-05, 'alpha': 0.028466278248811733, 'subsample': 0.5272991213033413, 'colsample_bytree': 0.6892463093656709, 'max_depth': 3, 'min_child_weight': 10, 'eta': 0.10378455952287347, 'gamma': 2.480780707452691, 'rate_drop': 2.3267410514680884e-08, 'skip_drop': 2.6469052443333215e-05}. Best is trial 366 with value: -0.989605092644619.
[I 2025-06-20 12:34:29,372] Trial 442 finished with value: -1.1990442462189586 and parameters: {'booster': 'dart', 'lambda': 6.253454584718311e-06, 'alpha': 0.018475927526293075, 'subsample': 0.5213342956148532, 'colsample_bytree': 0.7086428868699264, 'max_depth': 3, 'min_child_weight': 10, 'eta': 0.0900179833942253, 'gamma': 2.3625543365458674, 'rate_drop': 1.3400746759823428e-08, 'skip_drop': 0.8370192446300874}. Best is trial 366 with value: -0.989605092644619.
[I 2025-06-20 12:34:36,508] Trial 443 finished with value: -1.0496164123735219 and parameters: {'booster': 'dart', 'lambda': 1.2342358676676123e-05, 'alpha': 0.32365540644430263, 'subsample': 0.5254216911524175, 'colsample_bytree': 0.7211547467061319, 'max_depth': 3, 'min_child_weight': 10, 'eta': 0.1057891696905695, 'gamma': 1.9203013775324442, 'rate_drop': 2.0317936405818325e-08, 'skip_drop': 1.654480053390759e-06}. Best is trial 366 with value: -0.989605092644619.
[I 2025-06-20 12:34:40,703] Trial 444 finished with value: -1.0829752538233328 and parameters: {'booster': 'dart', 'lambda': 4.314620736253579e-06, 'alpha': 0.0773282473707731, 'subsample': 0.5413854151990135, 'colsample_bytree': 0.7021341114691539, 'max_depth': 3, 'min_child_weight': 10, 'eta': 0.09613209140803684, 'gamma': 2.532398123459969, 'rate_drop': 1.37481871012955e-08, 'skip_drop': 1.5530794370520024e-06}. Best is trial 366 with value: -0.989605092644619.
[I 2025-06-20 12:34:45,111] Trial 445 finished with value: -1.1047448801320745 and parameters: {'booster': 'dart', 'lambda': 2.651855958739736e-07, 'alpha': 0.10343177032743807, 'subsample': 0.7544511399757858, 'colsample_bytree': 0.6740954770347678, 'max_depth': 3, 'min_child_weight': 10, 'eta': 0.08661120618231706, 'gamma': 2.034801011927192, 'rate_drop': 2.5111131857601938e-08, 'skip_drop': 4.9338787295343537e-05}. Best is trial 366 with value: -0.989605092644619.
[I 2025-06-20 12:34:48,542] Trial 446 finished with value: -1.1209868664790648 and parameters: {'booster': 'dart', 'lambda': 1.781117110642674e-05, 'alpha': 0.16755073936067272, 'subsample': 0.5118208456254211, 'colsample_bytree': 0.6853630500436425, 'max_depth': 3, 'min_child_weight': 10, 'eta': 0.12675078572198267, 'gamma': 4.8188303876136676, 'rate_drop': 3.291621244709433e-08, 'skip_drop': 3.1112140961685327e-06}. Best is trial 366 with value: -0.989605092644619.
[I 2025-06-20 12:34:52,752] Trial 447 finished with value: -1.0844200463210962 and parameters: {'booster': 'dart', 'lambda': 9.18876047735465e-06, 'alpha': 1.4993985458143326, 'subsample': 0.5319583665180206, 'colsample_bytree': 0.6991683097806677, 'max_depth': 3, 'min_child_weight': 2, 'eta': 0.11003788250305739, 'gamma': 2.204567930304481, 'rate_drop': 1.0160929167438902e-08, 'skip_drop': 1.573328509700799e-05}. Best is trial 366 with value: -0.989605092644619.
[I 2025-06-20 12:35:01,349] Trial 448 finished with value: -1.1221388089891444 and parameters: {'booster': 'dart', 'lambda': 5.290938841136259e-06, 'alpha': 0.02132929000087076, 'subsample': 0.500264182345989, 'colsample_bytree': 0.7126754347716832, 'max_depth': 3, 'min_child_weight': 10, 'eta': 0.09393788742107625, 'gamma': 2.0915573476269627, 'rate_drop': 0.03130007545740625, 'skip_drop': 2.4201214086523205e-06}. Best is trial 366 with value: -0.989605092644619.
[I 2025-06-20 12:35:06,153] Trial 449 finished with value: -1.0905083645390277 and parameters: {'booster': 'dart', 'lambda': 8.126197617570226e-06, 'alpha': 0.03904484069129704, 'subsample': 0.5481432995766499, 'colsample_bytree': 0.7308194912915961, 'max_depth': 3, 'min_child_weight': 10, 'eta': 0.149365202763259, 'gamma': 2.263923810518115, 'rate_drop': 5.2973489874074965e-08, 'skip_drop': 9.838583465235551e-06}. Best is trial 366 with value: -0.989605092644619.
[I 2025-06-20 12:35:10,632] Trial 450 finished with value: -1.0652333121288045 and parameters: {'booster': 'dart', 'lambda': 1.3228588883018036e-06, 'alpha': 0.06399815207239802, 'subsample': 0.5172016773371487, 'colsample_bytree': 0.6903727352060177, 'max_depth': 3, 'min_child_weight': 10, 'eta': 0.08431691351586121, 'gamma': 2.4265241790516283, 'rate_drop': 1.5997141216669608e-08, 'skip_drop': 1.4076344680738161e-06}. Best is trial 366 with value: -0.989605092644619.
[I 2025-06-20 12:35:17,761] Trial 451 finished with value: -0.9851783303475563 and parameters: {'booster': 'dart', 'lambda': 2.02400373741535e-05, 'alpha': 0.12862438269599935, 'subsample': 0.5279319405022942, 'colsample_bytree': 0.6683444282519245, 'max_depth': 3, 'min_child_weight': 10, 'eta': 0.11355552239049593, 'gamma': 1.8797333976296575, 'rate_drop': 3.9383604355543334e-08, 'skip_drop': 6.194800828155941e-06}. Best is trial 451 with value: -0.9851783303475563.
[I 2025-06-20 12:35:18,078] Trial 452 finished with value: -1.0567475750194324 and parameters: {'booster': 'gbtree', 'lambda': 1.5210360272822665e-05, 'alpha': 0.1746607101147113, 'subsample': 0.5250178873897838, 'colsample_bytree': 0.6668260416956395, 'max_depth': 3, 'min_child_weight': 10, 'eta': 0.12605877709992241, 'gamma': 1.8487006590363557}. Best is trial 451 with value: -0.9851783303475563.
[I 2025-06-20 12:35:21,331] Trial 453 finished with value: -1.076671675979804 and parameters: {'booster': 'dart', 'lambda': 1.9562816793329736e-05, 'alpha': 0.12938844342069705, 'subsample': 0.5118820199571009, 'colsample_bytree': 0.674652659425905, 'max_depth': 3, 'min_child_weight': 10, 'eta': 0.13915788424753842, 'gamma': 1.9260058178477402, 'rate_drop': 3.091797069178177e-08, 'skip_drop': 5.853500608244542e-06}. Best is trial 451 with value: -0.9851783303475563.
[I 2025-06-20 12:35:25,827] Trial 454 finished with value: -1.0856305917815612 and parameters: {'booster': 'dart', 'lambda': 1.0571839075196854e-05, 'alpha': 0.08726200504414164, 'subsample': 0.5383424392422492, 'colsample_bytree': 0.6644785845027597, 'max_depth': 3, 'min_child_weight': 10, 'eta': 0.11361227165356973, 'gamma': 1.989430173407862, 'rate_drop': 3.998504745339331e-08, 'skip_drop': 8.392010970261688e-06}. Best is trial 451 with value: -0.9851783303475563.
[I 2025-06-20 12:35:34,012] Trial 455 finished with value: -1.0362743986856802 and parameters: {'booster': 'dart', 'lambda': 2.318741058683477e-05, 'alpha': 0.054997293458073755, 'subsample': 0.5277428027744716, 'colsample_bytree': 0.7199598206402723, 'max_depth': 3, 'min_child_weight': 10, 'eta': 0.10598323193892421, 'gamma': 1.8866697213167631, 'rate_drop': 2.043385255571025e-08, 'skip_drop': 0.0001011566827260885}. Best is trial 451 with value: -0.9851783303475563.
[I 2025-06-20 12:35:37,379] Trial 456 finished with value: -1.0844894773521767 and parameters: {'booster': 'dart', 'lambda': 5.8680432381183906e-06, 'alpha': 0.5264120272112552, 'subsample': 0.5187986462166595, 'colsample_bytree': 0.6826144394711535, 'max_depth': 3, 'min_child_weight': 6, 'eta': 0.12591088206581272, 'gamma': 2.041154009543779, 'rate_drop': 5.45698675916486e-08, 'skip_drop': 3.9626433256781705e-06}. Best is trial 451 with value: -0.9851783303475563.
[I 2025-06-20 12:35:39,840] Trial 457 finished with value: -1.0910600523962772 and parameters: {'booster': 'dart', 'lambda': 2.1951076082629445e-06, 'alpha': 0.036327254390398606, 'subsample': 0.5519382802169329, 'colsample_bytree': 0.7069750882160817, 'max_depth': 3, 'min_child_weight': 10, 'eta': 0.1472261866858505, 'gamma': 1.83682793053969, 'rate_drop': 3.8535573797428026e-08, 'skip_drop': 5.9693728735813045e-06}. Best is trial 451 with value: -0.9851783303475563.
[I 2025-06-20 12:35:46,285] Trial 458 finished with value: -1.0294419580231147 and parameters: {'booster': 'dart', 'lambda': 1.1912528933487208e-05, 'alpha': 0.2269286410567975, 'subsample': 0.5298672899176999, 'colsample_bytree': 0.9827066816781775, 'max_depth': 3, 'min_child_weight': 10, 'eta': 0.10196827014530627, 'gamma': 2.11842712001427, 'rate_drop': 2.513235661601184e-08, 'skip_drop': 1.175996663306453e-05}. Best is trial 451 with value: -0.9851783303475563.
[I 2025-06-20 12:35:49,956] Trial 459 finished with value: -1.0776639173888298 and parameters: {'booster': 'dart', 'lambda': 3.7176581250848765e-06, 'alpha': 0.1228838332288012, 'subsample': 0.5084336335455184, 'colsample_bytree': 0.6961035936142662, 'max_depth': 3, 'min_child_weight': 10, 'eta': 0.11632721480602766, 'gamma': 2.02089169916635, 'rate_drop': 1.4845132126386351e-08, 'skip_drop': 2.7703509186607456e-06}. Best is trial 451 with value: -0.9851783303475563.
[I 2025-06-20 12:35:58,291] Trial 460 finished with value: -1.0375823132900583 and parameters: {'booster': 'dart', 'lambda': 8.126236390352798e-06, 'alpha': 0.06421247982133385, 'subsample': 0.5398324284954985, 'colsample_bytree': 0.6730575464951453, 'max_depth': 3, 'min_child_weight': 10, 'eta': 0.16821842900793907, 'gamma': 2.1624901821671045, 'rate_drop': 1.8899334839431862e-08, 'skip_drop': 4.610279723700543e-06}. Best is trial 451 with value: -0.9851783303475563.
[I 2025-06-20 12:36:06,958] Trial 461 finished with value: -1.0103730844440149 and parameters: {'booster': 'dart', 'lambda': 2.3002995376812032e-05, 'alpha': 0.34304842369937877, 'subsample': 0.5196092482000254, 'colsample_bytree': 0.7316951931552206, 'max_depth': 3, 'min_child_weight': 10, 'eta': 0.13158552506924093, 'gamma': 1.9308508595758405, 'rate_drop': 1.0067931774223194e-08, 'skip_drop': 1.8903310193815688e-06}. Best is trial 451 with value: -0.9851783303475563.
[I 2025-06-20 12:36:11,490] Trial 462 finished with value: -1.0791968191562469 and parameters: {'booster': 'dart', 'lambda': 5.131553572114268e-06, 'alpha': 0.3692684307335752, 'subsample': 0.6649162002279582, 'colsample_bytree': 0.736728449442681, 'max_depth': 3, 'min_child_weight': 10, 'eta': 0.15027102489850755, 'gamma': 3.53782002443021, 'rate_drop': 1.0140329806581465e-08, 'skip_drop': 2.9010584387627323e-06}. Best is trial 451 with value: -0.9851783303475563.
[I 2025-06-20 12:36:16,584] Trial 463 finished with value: -1.1137889984867317 and parameters: {'booster': 'dart', 'lambda': 1.719422045824374e-08, 'alpha': 0.571093114548323, 'subsample': 0.5168971043931886, 'colsample_bytree': 0.730005039909772, 'max_depth': 3, 'min_child_weight': 4, 'eta': 0.13318460768661952, 'gamma': 1.9535136629210146, 'rate_drop': 1.1692603033000645e-08, 'skip_drop': 1.862666259382803e-06}. Best is trial 451 with value: -0.9851783303475563.
[I 2025-06-20 12:36:21,831] Trial 464 finished with value: -1.060592060524779 and parameters: {'booster': 'dart', 'lambda': 1.4886623594207045e-05, 'alpha': 0.9943206351338038, 'subsample': 0.5074305131413039, 'colsample_bytree': 0.7444049141568017, 'max_depth': 3, 'min_child_weight': 10, 'eta': 0.13683826151129913, 'gamma': 2.1311373987864166, 'rate_drop': 1.4474944558497413e-08, 'skip_drop': 6.931969539672766e-06}. Best is trial 451 with value: -0.9851783303475563.
[I 2025-06-20 12:36:30,930] Trial 465 finished with value: -1.1600908106845653 and parameters: {'booster': 'dart', 'lambda': 8.929923716704155e-06, 'alpha': 0.18948058751673758, 'subsample': 0.5193329024468595, 'colsample_bytree': 0.7241399840169922, 'max_depth': 3, 'min_child_weight': 3, 'eta': 0.036554060922850275, 'gamma': 2.22139481921352, 'rate_drop': 1.933073423255383e-08, 'skip_drop': 4.100848956474378e-06}. Best is trial 451 with value: -0.9851783303475563.
[I 2025-06-20 12:36:33,411] Trial 466 finished with value: -1.1153894543162757 and parameters: {'booster': 'dart', 'lambda': 3.1434536471550377e-06, 'alpha': 0.22134902829662914, 'subsample': 0.5001709632833339, 'colsample_bytree': 0.7297266408988068, 'max_depth': 3, 'min_child_weight': 10, 'eta': 0.12186150952154975, 'gamma': 2.020919841092366, 'rate_drop': 1.0083320341153069e-08, 'skip_drop': 0.07581593914237461}. Best is trial 451 with value: -0.9851783303475563.
