[I 2025-06-20 12:04:01,399] Trial 96 finished with value: -1.0721880389835274 and parameters: {'booster': 'dart', 'lambda': 1.9920219775543165e-05, 'alpha': 0.2504080043820557, 'subsample': 0.6140537790358518, 'colsample_bytree': 0.8875894021000539, 'max_depth': 4, 'min_child_weight': 9, 'eta': 0.09116213998388717, 'gamma': 1.3374224321630885, 'rate_drop': 1.0594935192771342e-08, 'skip_drop': 1.657810211053205e-08}. Best is trial 91 with value: -1.0164875258596158.
[I 2025-06-20 12:04:01,647] Trial 97 finished with value: -1.1239716438166498 and parameters: {'booster': 'gbtree', 'lambda': 6.568472194984933e-05, 'alpha': 0.1301857368135078, 'subsample': 0.5940823036362611, 'colsample_bytree': 0.9113658805713413, 'max_depth': 6, 'min_child_weight': 10, 'eta': 0.1202228182068342, 'gamma': 1.2125127932177442}. Best is trial 91 with value: -1.0164875258596158.
[I 2025-06-20 12:04:10,260] Trial 98 finished with value: -1.4662730122036665 and parameters: {'booster': 'dart', 'lambda': 3.8813678418013474e-05, 'alpha': 0.6777381090496263, 'subsample': 0.6695402392867008, 'colsample_bytree': 0.8119141731116725, 'max_depth': 4, 'min_child_weight': 9, 'eta': 0.0012334692419546872, 'gamma': 1.8546017192934379, 'rate_drop': 1.611535479379162e-07, 'skip_drop': 1.7519104189861012e-07}. Best is trial 91 with value: -1.0164875258596158.
[I 2025-06-20 12:04:17,046] Trial 99 finished with value: -1.091784221404468 and parameters: {'booster': 'dart', 'lambda': 0.00010901277603181993, 'alpha': 0.04673375079169265, 'subsample': 0.7700462359210345, 'colsample_bytree': 0.8706135922863283, 'max_depth': 3, 'min_child_weight': 9, 'eta': 0.1421946888505363, 'gamma': 0.46886372276618726, 'rate_drop': 3.098887201893902e-08, 'skip_drop': 1.075520421987928e-06}. Best is trial 91 with value: -1.0164875258596158.
[I 2025-06-20 12:04:25,622] Trial 100 finished with value: -1.0853337455640373 and parameters: {'booster': 'dart', 'lambda': 0.0002228864153293307, 'alpha': 0.008875136048196107, 'subsample': 0.6236569823178749, 'colsample_bytree': 0.9531088789022013, 'max_depth': 4, 'min_child_weight': 10, 'eta': 0.0740437852833297, 'gamma': 1.5322662619748575, 'rate_drop': 1.7685473379143922e-05, 'skip_drop': 2.167747660857303e-06}. Best is trial 91 with value: -1.0164875258596158.
[I 2025-06-20 12:04:34,193] Trial 101 finished with value: -1.0652895688379191 and parameters: {'booster': 'dart', 'lambda': 6.002251743194322e-06, 'alpha': 0.004979956569110419, 'subsample': 0.6381400789139354, 'colsample_bytree': 0.8758475175996026, 'max_depth': 4, 'min_child_weight': 9, 'eta': 0.06003903017941446, 'gamma': 2.0761197378316143, 'rate_drop': 2.342577949573873e-07, 'skip_drop': 6.992316885936128e-07}. Best is trial 91 with value: -1.0164875258596158.
[I 2025-06-20 12:04:39,151] Trial 102 finished with value: -1.0512137307509766 and parameters: {'booster': 'dart', 'lambda': 2.8401466251387086e-05, 'alpha': 0.01642732850159039, 'subsample': 0.6106784470063269, 'colsample_bytree': 0.5115854513696416, 'max_depth': 4, 'min_child_weight': 9, 'eta': 0.08932051085826619, 'gamma': 1.6696380373646342, 'rate_drop': 4.226608093880452e-07, 'skip_drop': 2.8842002574530177e-07}. Best is trial 91 with value: -1.0164875258596158.
[I 2025-06-20 12:04:44,329] Trial 103 finished with value: -1.026035075477842 and parameters: {'booster': 'dart', 'lambda': 0.0005525989435229841, 'alpha': 0.02522003870752597, 'subsample': 0.5481328168300241, 'colsample_bytree': 0.777739022411062, 'max_depth': 4, 'min_child_weight': 9, 'eta': 0.08845512876325722, 'gamma': 1.6897320521860963, 'rate_drop': 1.1010314504558599e-06, 'skip_drop': 7.801357289927858e-08}. Best is trial 91 with value: -1.0164875258596158.
[I 2025-06-20 12:04:51,187] Trial 104 finished with value: -1.078330476576722 and parameters: {'booster': 'dart', 'lambda': 0.0006098091288044393, 'alpha': 0.02308898621498771, 'subsample': 0.546773252370082, 'colsample_bytree': 0.8482966746234016, 'max_depth': 5, 'min_child_weight': 9, 'eta': 0.05584500846442483, 'gamma': 1.7774940125877186, 'rate_drop': 1.0517250357210225e-06, 'skip_drop': 2.756390909966237e-07}. Best is trial 91 with value: -1.0164875258596158.
[I 2025-06-20 12:04:55,577] Trial 105 finished with value: -1.0595147187160752 and parameters: {'booster': 'dart', 'lambda': 9.070253749863069e-06, 'alpha': 5.271760076417911e-05, 'subsample': 0.5619364803596598, 'colsample_bytree': 0.781255597179816, 'max_depth': 4, 'min_child_weight': 10, 'eta': 0.11303195669635542, 'gamma': 1.5286387582420402, 'rate_drop': 2.894351957262165e-05, 'skip_drop': 1.2860083543578732e-07}. Best is trial 91 with value: -1.0164875258596158.
[I 2025-06-20 12:05:03,577] Trial 106 finished with value: -1.0769002111864958 and parameters: {'booster': 'dart', 'lambda': 1.4857762527174878e-05, 'alpha': 0.00331582823369574, 'subsample': 0.5797850068373372, 'colsample_bytree': 0.7456219963038992, 'max_depth': 5, 'min_child_weight': 9, 'eta': 0.04618763132166202, 'gamma': 2.7838699572213503, 'rate_drop': 3.64791248805136e-07, 'skip_drop': 2.5797865856310474e-07}. Best is trial 91 with value: -1.0164875258596158.
[I 2025-06-20 12:05:11,663] Trial 107 finished with value: -1.2008753456170032 and parameters: {'booster': 'dart', 'lambda': 0.000711545107005753, 'alpha': 0.0012897740857037232, 'subsample': 0.5321400023562198, 'colsample_bytree': 0.9017135680309538, 'max_depth': 4, 'min_child_weight': 10, 'eta': 0.06716064868517187, 'gamma': 1.3639901744837242, 'rate_drop': 0.1174869752359912, 'skip_drop': 6.569704030014264e-08}. Best is trial 91 with value: -1.0164875258596158.
[I 2025-06-20 12:05:12,432] Trial 108 finished with value: -1.189168731795724 and parameters: {'booster': 'dart', 'lambda': 3.3287198369857116e-05, 'alpha': 0.010683799631934282, 'subsample': 0.5521950789256475, 'colsample_bytree': 0.7649087813646483, 'max_depth': 4, 'min_child_weight': 4, 'eta': 0.17309867962597555, 'gamma': 1.9801835043763858, 'rate_drop': 9.068236051214991e-08, 'skip_drop': 2.1522651385791077e-08}. Best is trial 91 with value: -1.0164875258596158.
[I 2025-06-20 12:05:14,522] Trial 109 finished with value: -1.1458068550657359 and parameters: {'booster': 'dart', 'lambda': 2.1841147226969106e-06, 'alpha': 2.6387044466177542e-05, 'subsample': 0.5666186898562854, 'colsample_bytree': 0.512798029790722, 'max_depth': 4, 'min_child_weight': 6, 'eta': 0.08528354089999553, 'gamma': 1.7256442057717867, 'rate_drop': 1.2237573900583259e-05, 'skip_drop': 5.638170953122222e-08}. Best is trial 91 with value: -1.0164875258596158.
[I 2025-06-20 12:05:15,260] Trial 110 finished with value: -1.1327250130541016 and parameters: {'booster': 'dart', 'lambda': 0.24643113341576883, 'alpha': 0.00013223082749562308, 'subsample': 0.8344084246611948, 'colsample_bytree': 0.8543323347478744, 'max_depth': 5, 'min_child_weight': 9, 'eta': 0.13257437855948348, 'gamma': 1.8701969681694879, 'rate_drop': 2.1490537145680113e-06, 'skip_drop': 1.8063265000349039e-07}. Best is trial 91 with value: -1.0164875258596158.
[I 2025-06-20 12:05:21,690] Trial 111 finished with value: -1.0549890576912062 and parameters: {'booster': 'dart', 'lambda': 8.722887170340076e-06, 'alpha': 0.09937544954041914, 'subsample': 0.5607293908736455, 'colsample_bytree': 0.780762392445873, 'max_depth': 4, 'min_child_weight': 10, 'eta': 0.10845400609991823, 'gamma': 1.5422841455531588, 'rate_drop': 3.189231082651731e-05, 'skip_drop': 1.1319079508915213e-07}. Best is trial 91 with value: -1.0164875258596158.
[I 2025-06-20 12:05:25,036] Trial 112 finished with value: -1.1181287632851447 and parameters: {'booster': 'dart', 'lambda': 7.573211934021673e-06, 'alpha': 0.08976650931782088, 'subsample': 0.5032820122815518, 'colsample_bytree': 0.795042509645755, 'max_depth': 4, 'min_child_weight': 10, 'eta': 0.07406193734156064, 'gamma': 1.215166659091401, 'rate_drop': 6.018036154065903e-05, 'skip_drop': 8.630679891168358e-07}. Best is trial 91 with value: -1.0164875258596158.
[I 2025-06-20 12:05:26,075] Trial 113 finished with value: -1.1081793158491204 and parameters: {'booster': 'dart', 'lambda': 3.9117435222162664e-06, 'alpha': 0.40166566926051456, 'subsample': 0.6089186856767097, 'colsample_bytree': 0.8242630938901366, 'max_depth': 7, 'min_child_weight': 10, 'eta': 0.10186862326956214, 'gamma': 1.4895557787824611, 'rate_drop': 3.9391494259259927e-05, 'skip_drop': 8.141454312462117e-08}. Best is trial 91 with value: -1.0164875258596158.
[I 2025-06-20 12:05:32,580] Trial 114 finished with value: -1.0630860047856978 and parameters: {'booster': 'dart', 'lambda': 0.0004341787289531868, 'alpha': 9.690726055694506e-06, 'subsample': 0.5861639361563105, 'colsample_bytree': 0.7841754482683189, 'max_depth': 4, 'min_child_weight': 9, 'eta': 0.08764045265349246, 'gamma': 1.0806977848642734, 'rate_drop': 0.00016820036877199652, 'skip_drop': 3.9669455142247545e-07}. Best is trial 91 with value: -1.0164875258596158.
[I 2025-06-20 12:05:41,186] Trial 115 finished with value: -1.0655574719322551 and parameters: {'booster': 'dart', 'lambda': 0.002154381922424469, 'alpha': 0.027886873463168562, 'subsample': 0.5725398555694137, 'colsample_bytree': 0.751531941996451, 'max_depth': 4, 'min_child_weight': 10, 'eta': 0.05518979398116899, 'gamma': 1.601869487979374, 'rate_drop': 0.00010239274964137825, 'skip_drop': 7.547193435731356e-06}. Best is trial 91 with value: -1.0164875258596158.
[I 2025-06-20 12:05:41,382] Trial 116 finished with value: -1.1445070580354315 and parameters: {'booster': 'gbtree', 'lambda': 0.00014809306695365613, 'alpha': 0.11973949023703084, 'subsample': 0.5473505830069031, 'colsample_bytree': 0.7701599489816897, 'max_depth': 4, 'min_child_weight': 9, 'eta': 0.11590544271945857, 'gamma': 2.057930913564725}. Best is trial 91 with value: -1.0164875258596158.
[I 2025-06-20 12:05:45,288] Trial 117 finished with value: -1.063741290298025 and parameters: {'booster': 'dart', 'lambda': 0.019652268422599393, 'alpha': 0.05497733905043053, 'subsample': 0.5334566691225804, 'colsample_bytree': 0.5114507530915916, 'max_depth': 5, 'min_child_weight': 8, 'eta': 0.14897810717659835, 'gamma': 2.173550837619862, 'rate_drop': 0.00029378156206526413, 'skip_drop': 2.150471046928253e-06}. Best is trial 91 with value: -1.0164875258596158.
[I 2025-06-20 12:05:49,758] Trial 118 finished with value: -1.0144065882993771 and parameters: {'booster': 'dart', 'lambda': 2.3850896983962154e-05, 'alpha': 0.015704827012049102, 'subsample': 0.522887502020678, 'colsample_bytree': 0.7192071369264547, 'max_depth': 3, 'min_child_weight': 9, 'eta': 0.12340305048693516, 'gamma': 1.7126004870626357, 'rate_drop': 7.148804418060476e-08, 'skip_drop': 7.43032471412469e-05}. Best is trial 118 with value: -1.0144065882993771.
[I 2025-06-20 12:05:50,461] Trial 119 finished with value: -1.2624676466251938 and parameters: {'booster': 'dart', 'lambda': 2.5037273267758073e-05, 'alpha': 0.013386953916116773, 'subsample': 0.5231981158832446, 'colsample_bytree': 0.7160731217188074, 'max_depth': 3, 'min_child_weight': 2, 'eta': 0.29267901704143356, 'gamma': 1.6818533169430667, 'rate_drop': 6.818579344843339e-08, 'skip_drop': 1.660237756544355e-07}. Best is trial 118 with value: -1.0144065882993771.
[I 2025-06-20 12:05:53,732] Trial 120 finished with value: -1.0894905375346695 and parameters: {'booster': 'dart', 'lambda': 4.90264225035732e-05, 'alpha': 0.033223812062876085, 'subsample': 0.5169956293185729, 'colsample_bytree': 0.9312623164045888, 'max_depth': 3, 'min_child_weight': 9, 'eta': 0.18168517044601182, 'gamma': 2.372527198995038, 'rate_drop': 4.268930972115501e-08, 'skip_drop': 4.2683463717463175e-08}. Best is trial 118 with value: -1.0144065882993771.
[I 2025-06-20 12:06:02,210] Trial 121 finished with value: -1.0895849000819309 and parameters: {'booster': 'dart', 'lambda': 1.0689722713717172e-05, 'alpha': 0.00033505430865046884, 'subsample': 0.5759623693102827, 'colsample_bytree': 0.7357923034307997, 'max_depth': 3, 'min_child_weight': 9, 'eta': 0.12706441199840093, 'gamma': 1.278514778063688, 'rate_drop': 1.5722579219197916e-07, 'skip_drop': 7.579357293715171e-05}. Best is trial 118 with value: -1.0144065882993771.
[I 2025-06-20 12:06:10,099] Trial 122 finished with value: -1.068882663046049 and parameters: {'booster': 'dart', 'lambda': 9.058671358584833e-05, 'alpha': 0.0162952707845465, 'subsample': 0.5591559707182177, 'colsample_bytree': 0.8103619911656565, 'max_depth': 4, 'min_child_weight': 10, 'eta': 0.09854484824495778, 'gamma': 1.87567646817866, 'rate_drop': 4.602616166205839e-07, 'skip_drop': 2.401298823831652e-08}. Best is trial 118 with value: -1.0144065882993771.
[I 2025-06-20 12:06:18,627] Trial 123 finished with value: -1.0797075021023135 and parameters: {'booster': 'dart', 'lambda': 1.7120419969347556e-05, 'alpha': 0.007145403974080082, 'subsample': 0.5934272729669311, 'colsample_bytree': 0.5606539679036906, 'max_depth': 3, 'min_child_weight': 9, 'eta': 0.06451288593346748, 'gamma': 1.3871567840015073, 'rate_drop': 2.8518933625640662e-05, 'skip_drop': 3.855301264896164e-07}. Best is trial 118 with value: -1.0144065882993771.
[I 2025-06-20 12:06:21,972] Trial 124 finished with value: -1.1106482126436719 and parameters: {'booster': 'dart', 'lambda': 2.9286711737702185e-05, 'alpha': 0.2591569567210553, 'subsample': 0.6220672545278764, 'colsample_bytree': 0.6821844576162575, 'max_depth': 4, 'min_child_weight': 8, 'eta': 0.07530909672816989, 'gamma': 1.565976285661144, 'rate_drop': 9.526081346470282e-07, 'skip_drop': 9.169798050422537e-08}. Best is trial 118 with value: -1.0144065882993771.
[I 2025-06-20 12:06:28,904] Trial 125 finished with value: -1.065705355511491 and parameters: {'booster': 'dart', 'lambda': 6.113849690591406e-05, 'alpha': 0.001961133434624547, 'subsample': 0.6066439973444459, 'colsample_bytree': 0.5259107180245305, 'max_depth': 3, 'min_child_weight': 9, 'eta': 0.08827703359365707, 'gamma': 0.8497351554346134, 'rate_drop': 6.9711149475566355e-06, 'skip_drop': 0.00013741357381229013}. Best is trial 118 with value: -1.0144065882993771.
[I 2025-06-20 12:06:29,141] Trial 126 finished with value: -1.1232429357968652 and parameters: {'booster': 'gbtree', 'lambda': 6.105241968448535e-06, 'alpha': 0.00019871036127604177, 'subsample': 0.5862091917410437, 'colsample_bytree': 0.5754167940732928, 'max_depth': 4, 'min_child_weight': 9, 'eta': 0.1089898350997808, 'gamma': 1.7500980181405055}. Best is trial 118 with value: -1.0144065882993771.
[I 2025-06-20 12:06:30,142] Trial 127 finished with value: -1.1759551069801175 and parameters: {'booster': 'dart', 'lambda': 1.3952008151967199e-05, 'alpha': 8.196628280978413e-05, 'subsample': 0.5272152391525271, 'colsample_bytree': 0.863623251165765, 'max_depth': 4, 'min_child_weight': 10, 'eta': 0.2383415569740022, 'gamma': 1.436566183170757, 'rate_drop': 2.785853882121375e-07, 'skip_drop': 0.00043195897964429903}. Best is trial 118 with value: -1.0144065882993771.
[I 2025-06-20 12:06:36,558] Trial 128 finished with value: -1.0794165255161454 and parameters: {'booster': 'dart', 'lambda': 2.1570885446511354e-06, 'alpha': 0.04140349413198951, 'subsample': 0.5429362336052372, 'colsample_bytree': 0.7939842875077009, 'max_depth': 8, 'min_child_weight': 9, 'eta': 0.12564407349885276, 'gamma': 4.468566096071401, 'rate_drop': 1.1908153359654722e-07, 'skip_drop': 5.32646944573306e-05}. Best is trial 118 with value: -1.0144065882993771.
[I 2025-06-20 12:06:45,091] Trial 129 finished with value: -1.1009643287312796 and parameters: {'booster': 'dart', 'lambda': 0.036446092257752645, 'alpha': 0.07798215301548009, 'subsample': 0.568032513292314, 'colsample_bytree': 0.8272379318729024, 'max_depth': 3, 'min_child_weight': 5, 'eta': 0.04889870333455625, 'gamma': 0.5977356827041638, 'rate_drop': 1.4134443993978533e-05, 'skip_drop': 1.4669813380272717e-06}. Best is trial 118 with value: -1.0144065882993771.
[I 2025-06-20 12:06:45,947] Trial 130 finished with value: -1.163237542207519 and parameters: {'booster': 'dart', 'lambda': 0.07207896899505509, 'alpha': 0.0034706333369481776, 'subsample': 0.5979572626482608, 'colsample_bytree': 0.5526576801011329, 'max_depth': 4, 'min_child_weight': 10, 'eta': 0.1958008572946039, 'gamma': 4.924839698393648, 'rate_drop': 7.115322356152536e-05, 'skip_drop': 2.977723675098784e-05}. Best is trial 118 with value: -1.0144065882993771.
[I 2025-06-20 12:06:50,646] Trial 131 finished with value: -1.0535213443542573 and parameters: {'booster': 'dart', 'lambda': 1.0622601794917754e-05, 'alpha': 1.665597471244782e-05, 'subsample': 0.5597701672701456, 'colsample_bytree': 0.7593104955319154, 'max_depth': 4, 'min_child_weight': 10, 'eta': 0.11882368996208034, 'gamma': 1.6522105002332115, 'rate_drop': 1.919565185193021e-05, 'skip_drop': 1.2298758621782373e-07}. Best is trial 118 with value: -1.0144065882993771.
[I 2025-06-20 12:06:55,833] Trial 132 finished with value: -1.082207103806063 and parameters: {'booster': 'dart', 'lambda': 8.650611553361493e-06, 'alpha': 5.230092916843857e-06, 'subsample': 0.5501913558230697, 'colsample_bytree': 0.7512654612752283, 'max_depth': 4, 'min_child_weight': 10, 'eta': 0.09341686923309575, 'gamma': 1.6612566853274282, 'rate_drop': 1.909379767011306e-05, 'skip_drop': 2.3825924339531742e-07}. Best is trial 118 with value: -1.0144065882993771.
[I 2025-06-20 12:06:58,160] Trial 133 finished with value: -1.1075704367193728 and parameters: {'booster': 'dart', 'lambda': 4.020418735542781e-06, 'alpha': 1.7239364776046722e-05, 'subsample': 0.5766139140024482, 'colsample_bytree': 0.769986174204135, 'max_depth': 4, 'min_child_weight': 9, 'eta': 0.16219838441519663, 'gamma': 1.1408960274276403, 'rate_drop': 4.302463160554286e-05, 'skip_drop': 1.307047769292239e-07}. Best is trial 118 with value: -1.0144065882993771.
[I 2025-06-20 12:07:02,569] Trial 134 finished with value: -1.0318184074218217 and parameters: {'booster': 'dart', 'lambda': 0.00023671255776785922, 'alpha': 2.9029336119278433e-05, 'subsample': 0.5394648012026491, 'colsample_bytree': 0.7364576974519386, 'max_depth': 4, 'min_child_weight': 10, 'eta': 0.07818158588714756, 'gamma': 1.8296558686406466, 'rate_drop': 8.118858055331476e-08, 'skip_drop': 0.0002841933997350319}. Best is trial 118 with value: -1.0144065882993771.
[I 2025-06-20 12:07:11,116] Trial 135 finished with value: -1.056325233261024 and parameters: {'booster': 'dart', 'lambda': 0.0001342439998075642, 'alpha': 2.7523665509126185e-05, 'subsample': 0.5082531491872623, 'colsample_bytree': 0.7312813086796004, 'max_depth': 4, 'min_child_weight': 10, 'eta': 0.10451024347403798, 'gamma': 1.9480694361896391, 'rate_drop': 3.9416623451144244e-08, 'skip_drop': 0.0010975031488327095}. Best is trial 118 with value: -1.0144065882993771.
[I 2025-06-20 12:07:14,477] Trial 136 finished with value: -1.1242927602795876 and parameters: {'booster': 'dart', 'lambda': 0.00015965113219845161, 'alpha': 2.1905041314502856e-05, 'subsample': 0.5071110352701949, 'colsample_bytree': 0.7037774736102155, 'max_depth': 4, 'min_child_weight': 10, 'eta': 0.06976181032188983, 'gamma': 1.9727009431117302, 'rate_drop': 1.6407465221422957e-08, 'skip_drop': 0.0016919211249259009}. Best is trial 118 with value: -1.0144065882993771.
[I 2025-06-20 12:07:18,916] Trial 137 finished with value: -1.0207409997816008 and parameters: {'booster': 'dart', 'lambda': 0.00020886293146961678, 'alpha': 4.949755617770025e-05, 'subsample': 0.5360803127069853, 'colsample_bytree': 0.7246123286765981, 'max_depth': 4, 'min_child_weight': 10, 'eta': 0.10609826502145857, 'gamma': 1.8252461754071192, 'rate_drop': 3.2943556382207925e-08, 'skip_drop': 0.001170450107276034}. Best is trial 118 with value: -1.0144065882993771.
[I 2025-06-20 12:07:19,179] Trial 138 finished with value: -1.1224919238305366 and parameters: {'booster': 'gbtree', 'lambda': 8.890339284977685e-05, 'alpha': 5.199377387666084e-05, 'subsample': 0.5357889867744041, 'colsample_bytree': 0.7251173843555896, 'max_depth': 5, 'min_child_weight': 10, 'eta': 0.08229848403943808, 'gamma': 1.721776007585821}. Best is trial 118 with value: -1.0144065882993771.
[I 2025-06-20 12:07:22,670] Trial 139 finished with value: -1.1387852608747118 and parameters: {'booster': 'dart', 'lambda': 0.00036994822604185195, 'alpha': 7.612921259810487e-05, 'subsample': 0.526617787425378, 'colsample_bytree': 0.7614292596069581, 'max_depth': 6, 'min_child_weight': 10, 'eta': 0.11690091172822087, 'gamma': 1.7991670719769557, 'rate_drop': 6.883757597071072e-08, 'skip_drop': 7.269409707722758e-08}. Best is trial 118 with value: -1.0144065882993771.
[I 2025-06-20 12:07:27,343] Trial 140 finished with value: -1.0620610664024923 and parameters: {'booster': 'dart', 'lambda': 2.0478804618302222e-05, 'alpha': 4.274594706146875e-05, 'subsample': 0.5427650426893939, 'colsample_bytree': 0.703299518891078, 'max_depth': 4, 'min_child_weight': 10, 'eta': 0.057157958463282046, 'gamma': 2.115632668994436, 'rate_drop': 2.381237449294801e-08, 'skip_drop': 3.1981094693912676e-07}. Best is trial 118 with value: -1.0144065882993771.
[I 2025-06-20 12:07:31,709] Trial 141 finished with value: -1.060791918676102 and parameters: {'booster': 'dart', 'lambda': 0.0001279846850472955, 'alpha': 1.2639042550165968e-05, 'subsample': 0.5105252520390955, 'colsample_bytree': 0.7264811335025547, 'max_depth': 4, 'min_child_weight': 10, 'eta': 0.09955193653424332, 'gamma': 1.8974288087194953, 'rate_drop': 3.4521592418665594e-08, 'skip_drop': 0.0014265844494852531}. Best is trial 118 with value: -1.0144065882993771.
[I 2025-06-20 12:07:35,958] Trial 142 finished with value: -1.08466879428731 and parameters: {'booster': 'dart', 'lambda': 0.0002105876991377104, 'alpha': 2.970506745518433e-05, 'subsample': 0.523192686890272, 'colsample_bytree': 0.7331366816896615, 'max_depth': 4, 'min_child_weight': 10, 'eta': 0.10396496663605685, 'gamma': 1.4852512897291001, 'rate_drop': 1.4697196839568184e-08, 'skip_drop': 0.0027624551335963606}. Best is trial 118 with value: -1.0144065882993771.
