[I 2025-06-20 12:11:54,426] Trial 189 finished with value: -1.0514976153498268 and parameters: {'booster': 'dart', 'lambda': 3.029937915172019e-05, 'alpha': 1.653988957242526e-08, 'subsample': 0.5286779073561491, 'colsample_bytree': 0.6296879861852177, 'max_depth': 4, 'min_child_weight': 8, 'eta': 0.08683508413763695, 'gamma': 2.033762292699134, 'rate_drop': 7.864819273317797e-07, 'skip_drop': 5.405038183700808e-06}. Best is trial 118 with value: -1.0144065882993771.
[I 2025-06-20 12:11:59,727] Trial 190 finished with value: -1.068901779260268 and parameters: {'booster': 'dart', 'lambda': 5.574547112148444e-05, 'alpha': 1.2758542354745067e-07, 'subsample': 0.5677762233441064, 'colsample_bytree': 0.6200255368497225, 'max_depth': 4, 'min_child_weight': 9, 'eta': 0.09200490461458952, 'gamma': 2.1164438681781657, 'rate_drop': 4.1577703945899687e-07, 'skip_drop': 1.7866590952811003e-06}. Best is trial 118 with value: -1.0144065882993771.
[I 2025-06-20 12:12:04,112] Trial 191 finished with value: -1.0646689324505587 and parameters: {'booster': 'dart', 'lambda': 0.0001441770987291558, 'alpha': 2.5394209101158886e-07, 'subsample': 0.525746447468422, 'colsample_bytree': 0.6586112936686367, 'max_depth': 4, 'min_child_weight': 9, 'eta': 0.10958713613846222, 'gamma': 2.12615226672535, 'rate_drop': 1.2346865524659741e-07, 'skip_drop': 9.537890899575851e-07}. Best is trial 118 with value: -1.0144065882993771.
[I 2025-06-20 12:12:07,450] Trial 192 finished with value: -1.1479295072838942 and parameters: {'booster': 'dart', 'lambda': 0.00026491590904931066, 'alpha': 1.2285861315871632e-07, 'subsample': 0.5160907296788372, 'colsample_bytree': 0.6440882068175189, 'max_depth': 4, 'min_child_weight': 3, 'eta': 0.08293728044712345, 'gamma': 2.395161218878313, 'rate_drop': 5.26677721952557e-08, 'skip_drop': 2.401587976111223e-06}. Best is trial 118 with value: -1.0144065882993771.
[I 2025-06-20 12:12:09,600] Trial 193 finished with value: -1.0957065670371082 and parameters: {'booster': 'dart', 'lambda': 0.00018371731198784576, 'alpha': 5.989834543256795e-08, 'subsample': 0.8860678196773708, 'colsample_bytree': 0.6670305382833802, 'max_depth': 4, 'min_child_weight': 9, 'eta': 0.10150854603359476, 'gamma': 1.9144155055553478, 'rate_drop': 1.0087493289342903e-07, 'skip_drop': 0.0006747832122344924}. Best is trial 118 with value: -1.0144065882993771.
[I 2025-06-20 12:12:12,006] Trial 194 finished with value: -1.1160936736803757 and parameters: {'booster': 'dart', 'lambda': 8.926667072642737e-05, 'alpha': 2.875488009079201e-08, 'subsample': 0.5118330420885815, 'colsample_bytree': 0.6559062846996896, 'max_depth': 4, 'min_child_weight': 9, 'eta': 0.12750166040975247, 'gamma': 2.047036067563799, 'rate_drop': 5.08256477375031e-07, 'skip_drop': 3.373780949934809e-07}. Best is trial 118 with value: -1.0144065882993771.
[I 2025-06-20 12:12:16,698] Trial 195 finished with value: -1.0554623269948216 and parameters: {'booster': 'dart', 'lambda': 0.0003759690224570291, 'alpha': 2.8201022987034834e-08, 'subsample': 0.5453072986136939, 'colsample_bytree': 0.6401999644440002, 'max_depth': 4, 'min_child_weight': 9, 'eta': 0.07869526682503221, 'gamma': 1.6140283743401802, 'rate_drop': 1.0751881873739059e-06, 'skip_drop': 1.2091898430467165e-06}. Best is trial 118 with value: -1.0144065882993771.
[I 2025-06-20 12:12:25,403] Trial 196 finished with value: -1.025582121410934 and parameters: {'booster': 'dart', 'lambda': 0.00013624300613619865, 'alpha': 3.995828478455501e-08, 'subsample': 0.5302799257925274, 'colsample_bytree': 0.6866847200596217, 'max_depth': 4, 'min_child_weight': 9, 'eta': 0.0943494479610719, 'gamma': 2.652895462154567, 'rate_drop': 2.9999221099782154e-07, 'skip_drop': 3.922508793929127e-06}. Best is trial 118 with value: -1.0144065882993771.
[I 2025-06-20 12:12:27,485] Trial 197 finished with value: -1.1026661404289395 and parameters: {'booster': 'dart', 'lambda': 4.471018515985e-05, 'alpha': 1.6457301989703927e-08, 'subsample': 0.9911404846899213, 'colsample_bytree': 0.6812087075712188, 'max_depth': 4, 'min_child_weight': 9, 'eta': 0.09600360415190524, 'gamma': 2.6228425553377512, 'rate_drop': 3.1682139984854517e-06, 'skip_drop': 9.2198673529299e-06}. Best is trial 118 with value: -1.0144065882993771.
[I 2025-06-20 12:12:34,380] Trial 198 finished with value: -1.0528381356837446 and parameters: {'booster': 'dart', 'lambda': 0.00012530506384744787, 'alpha': 1.024560289363889e-08, 'subsample': 0.5318634138486458, 'colsample_bytree': 0.6928727800984209, 'max_depth': 4, 'min_child_weight': 9, 'eta': 0.07551735364064875, 'gamma': 2.8097557493659315, 'rate_drop': 2.6605790698023726e-07, 'skip_drop': 4.052448331404531e-06}. Best is trial 118 with value: -1.0144065882993771.
[I 2025-06-20 12:12:38,967] Trial 199 finished with value: -1.098601030541682 and parameters: {'booster': 'dart', 'lambda': 6.888108025829729e-05, 'alpha': 3.893830311792495e-08, 'subsample': 0.5429659872989034, 'colsample_bytree': 0.6271483935757916, 'max_depth': 4, 'min_child_weight': 9, 'eta': 0.08610492861176393, 'gamma': 3.667815255361818, 'rate_drop': 1.6924099286510987e-07, 'skip_drop': 1.9803230409482645e-06}. Best is trial 118 with value: -1.0144065882993771.
[I 2025-06-20 12:12:42,366] Trial 200 finished with value: -1.0526684375392268 and parameters: {'booster': 'dart', 'lambda': 3.0313519252447486e-05, 'alpha': 8.674546490219827e-08, 'subsample': 0.5887530545369881, 'colsample_bytree': 0.6102568325555527, 'max_depth': 4, 'min_child_weight': 8, 'eta': 0.11391164149335174, 'gamma': 2.7525847153347702, 'rate_drop': 1.9514342017378292e-07, 'skip_drop': 2.9235680158686204e-06}. Best is trial 118 with value: -1.0144065882993771.
[I 2025-06-20 12:12:51,181] Trial 201 finished with value: -1.082434202875564 and parameters: {'booster': 'dart', 'lambda': 0.0002352292366517069, 'alpha': 2.982013147581048e-08, 'subsample': 0.5254130342840018, 'colsample_bytree': 0.6714729720594964, 'max_depth': 4, 'min_child_weight': 9, 'eta': 0.09802287687841409, 'gamma': 2.8979818125647108, 'rate_drop': 7.588822632434886e-08, 'skip_drop': 7.953151857201474e-07}. Best is trial 118 with value: -1.0144065882993771.
[I 2025-06-20 12:12:59,799] Trial 202 finished with value: -1.0407435021635147 and parameters: {'booster': 'dart', 'lambda': 0.0001465294082934741, 'alpha': 1.9142047577589588e-08, 'subsample': 0.5346242080750119, 'colsample_bytree': 0.6852302075779915, 'max_depth': 4, 'min_child_weight': 9, 'eta': 0.08845629865456844, 'gamma': 2.495828339260338, 'rate_drop': 3.6109585966936465e-07, 'skip_drop': 1.2992745669030558e-06}. Best is trial 118 with value: -1.0144065882993771.
[I 2025-06-20 12:13:08,459] Trial 203 finished with value: -1.0075881538032834 and parameters: {'booster': 'dart', 'lambda': 0.00010330728162400734, 'alpha': 1.8567993957624364e-08, 'subsample': 0.534711182113646, 'colsample_bytree': 0.6842979914745496, 'max_depth': 4, 'min_child_weight': 9, 'eta': 0.08731336896941443, 'gamma': 2.508666223043161, 'rate_drop': 3.451665254419739e-07, 'skip_drop': 1.9674370673678638e-06}. Best is trial 203 with value: -1.0075881538032834.
[I 2025-06-20 12:13:12,830] Trial 204 finished with value: -1.0655240343219414 and parameters: {'booster': 'dart', 'lambda': 0.00012664561751993717, 'alpha': 8.544988072467319e-05, 'subsample': 0.5621693525757482, 'colsample_bytree': 0.6829189956415689, 'max_depth': 4, 'min_child_weight': 9, 'eta': 0.08894433834292138, 'gamma': 2.6849810827184286, 'rate_drop': 3.7229626996245827e-07, 'skip_drop': 0.0011033308078115549}. Best is trial 203 with value: -1.0075881538032834.
[I 2025-06-20 12:13:21,413] Trial 205 finished with value: -1.007585085076739 and parameters: {'booster': 'dart', 'lambda': 0.00032551557544365124, 'alpha': 1.8009535870685638e-07, 'subsample': 0.5457597491884468, 'colsample_bytree': 0.7170301600117066, 'max_depth': 4, 'min_child_weight': 9, 'eta': 0.08354963104271501, 'gamma': 2.491687265685532, 'rate_drop': 6.8739993670963e-07, 'skip_drop': 2.2340550355754555e-06}. Best is trial 205 with value: -1.007585085076739.
[I 2025-06-20 12:13:26,222] Trial 206 finished with value: -1.0597074442447998 and parameters: {'booster': 'dart', 'lambda': 0.0003240752112609631, 'alpha': 2.4024738012805473e-07, 'subsample': 0.544053091377873, 'colsample_bytree': 0.7170729833197618, 'max_depth': 4, 'min_child_weight': 9, 'eta': 0.08206989960633614, 'gamma': 2.470020406014612, 'rate_drop': 9.373506384563174e-07, 'skip_drop': 2.918960509071995e-06}. Best is trial 205 with value: -1.007585085076739.
[I 2025-06-20 12:13:28,685] Trial 207 finished with value: -1.0854588233044078 and parameters: {'booster': 'dart', 'lambda': 0.00014757038592234478, 'alpha': 1.733456648832008e-07, 'subsample': 0.5374223268352891, 'colsample_bytree': 0.7011913874480133, 'max_depth': 4, 'min_child_weight': 9, 'eta': 0.10565478039116406, 'gamma': 2.4584286639251673, 'rate_drop': 5.785086444590034e-07, 'skip_drop': 5.074334165724946e-06}. Best is trial 205 with value: -1.007585085076739.
[I 2025-06-20 12:13:33,491] Trial 208 finished with value: -1.0627573414869709 and parameters: {'booster': 'dart', 'lambda': 5.291402485791051e-05, 'alpha': 4.3121226560279735e-08, 'subsample': 0.5495056816777061, 'colsample_bytree': 0.73870925411731, 'max_depth': 4, 'min_child_weight': 9, 'eta': 0.136697562726481, 'gamma': 2.5766936883323353, 'rate_drop': 7.280121570853181e-07, 'skip_drop': 2.098722618259335e-06}. Best is trial 205 with value: -1.007585085076739.
[I 2025-06-20 12:13:40,300] Trial 209 finished with value: -1.05481412082073 and parameters: {'booster': 'dart', 'lambda': 9.405661376513324e-05, 'alpha': 7.146893310319418e-08, 'subsample': 0.5005112929038465, 'colsample_bytree': 0.7249621270555836, 'max_depth': 4, 'min_child_weight': 9, 'eta': 0.07199281126486158, 'gamma': 3.036772490018182, 'rate_drop': 3.1543974637669927e-07, 'skip_drop': 3.7109969346351818e-06}. Best is trial 205 with value: -1.007585085076739.
[I 2025-06-20 12:13:44,803] Trial 210 finished with value: -1.0567306599776465 and parameters: {'booster': 'dart', 'lambda': 0.00042425036571966715, 'alpha': 0.008508998285418793, 'subsample': 0.5767819636002963, 'colsample_bytree': 0.6994965242677256, 'max_depth': 4, 'min_child_weight': 9, 'eta': 0.08219500058368133, 'gamma': 1.8331374216265959, 'rate_drop': 1.3767277068879114e-06, 'skip_drop': 1.4003557165508832e-06}. Best is trial 205 with value: -1.007585085076739.
[I 2025-06-20 12:13:47,747] Trial 211 finished with value: -1.1059155027076635 and parameters: {'booster': 'dart', 'lambda': 0.00022911516658914342, 'alpha': 4.351053974738057e-07, 'subsample': 0.5606906106955971, 'colsample_bytree': 0.9342447125864373, 'max_depth': 4, 'min_child_weight': 9, 'eta': 0.0948480764316578, 'gamma': 2.5455316515732043, 'rate_drop': 4.727827021164661e-07, 'skip_drop': 3.915023433479868e-07}. Best is trial 205 with value: -1.007585085076739.
[I 2025-06-20 12:13:52,139] Trial 212 finished with value: -1.0197595557900048 and parameters: {'booster': 'dart', 'lambda': 7.864206591879585e-05, 'alpha': 1.9870586631236997e-08, 'subsample': 0.5334865554785364, 'colsample_bytree': 0.688060158900622, 'max_depth': 4, 'min_child_weight': 9, 'eta': 0.08971949173395345, 'gamma': 2.389566986687396, 'rate_drop': 2.622256771616685e-07, 'skip_drop': 0.0021019736306663486}. Best is trial 205 with value: -1.007585085076739.
[I 2025-06-20 12:13:55,357] Trial 213 finished with value: -1.0875527363785225 and parameters: {'booster': 'dart', 'lambda': 6.661155627814231e-05, 'alpha': 2.0232839703520547e-08, 'subsample': 0.5346518673684075, 'colsample_bytree': 0.6958746691922493, 'max_depth': 4, 'min_child_weight': 9, 'eta': 0.11714766397919786, 'gamma': 2.7114821816357195, 'rate_drop': 2.913072812439892e-07, 'skip_drop': 0.006053441541451786}. Best is trial 205 with value: -1.007585085076739.
[I 2025-06-20 12:13:59,766] Trial 214 finished with value: -1.0402876554471083 and parameters: {'booster': 'dart', 'lambda': 3.979113495109876e-05, 'alpha': 1.008746394422195e-08, 'subsample': 0.5256710836472912, 'colsample_bytree': 0.6630474197618799, 'max_depth': 4, 'min_child_weight': 9, 'eta': 0.07751542398118341, 'gamma': 2.3907244635734033, 'rate_drop': 2.0050424839616417e-07, 'skip_drop': 0.0019118818764905492}. Best is trial 205 with value: -1.007585085076739.
[I 2025-06-20 12:14:06,880] Trial 215 finished with value: -1.0538040478011654 and parameters: {'booster': 'dart', 'lambda': 0.00012570167237786834, 'alpha': 0.023580617475260492, 'subsample': 0.5241846361873775, 'colsample_bytree': 0.661843125542952, 'max_depth': 4, 'min_child_weight': 9, 'eta': 0.0651555292571645, 'gamma': 2.5197385350653367, 'rate_drop': 2.1301994773741778e-07, 'skip_drop': 0.0008050280143296045}. Best is trial 205 with value: -1.007585085076739.
[I 2025-06-20 12:14:13,220] Trial 216 finished with value: -1.0156075475654345 and parameters: {'booster': 'dart', 'lambda': 2.4515495280043772e-05, 'alpha': 3.406906287859134e-08, 'subsample': 0.5300455946168016, 'colsample_bytree': 0.6769923535747295, 'max_depth': 4, 'min_child_weight': 9, 'eta': 0.08634868861268853, 'gamma': 2.3690074999190536, 'rate_drop': 4.700126461235917e-07, 'skip_drop': 0.0027986394802258937}. Best is trial 205 with value: -1.007585085076739.
[I 2025-06-20 12:14:17,256] Trial 217 finished with value: -1.0751923022158347 and parameters: {'booster': 'dart', 'lambda': 1.8241047495484153e-05, 'alpha': 4.953842781789912e-08, 'subsample': 0.5114647264741834, 'colsample_bytree': 0.6753046210505359, 'max_depth': 4, 'min_child_weight': 9, 'eta': 0.09160562833773768, 'gamma': 2.384008717468585, 'rate_drop': 4.447522752431447e-07, 'skip_drop': 0.0020621727326209766}. Best is trial 205 with value: -1.007585085076739.
[I 2025-06-20 12:14:18,049] Trial 218 finished with value: -1.1834374338220897 and parameters: {'booster': 'dart', 'lambda': 2.8161472988056325e-05, 'alpha': 9.235198416235238e-08, 'subsample': 0.5244980956716216, 'colsample_bytree': 0.9768977445509285, 'max_depth': 4, 'min_child_weight': 9, 'eta': 0.10594556253447648, 'gamma': 2.38539359802815, 'rate_drop': 5.557459573324322e-07, 'skip_drop': 0.0023854066372530906}. Best is trial 205 with value: -1.007585085076739.
[I 2025-06-20 12:14:22,509] Trial 219 finished with value: -1.0887314019155758 and parameters: {'booster': 'dart', 'lambda': 0.0002540588097608441, 'alpha': 2.1848842478064305e-08, 'subsample': 0.5382589078635666, 'colsample_bytree': 0.690171441513489, 'max_depth': 4, 'min_child_weight': 9, 'eta': 0.0744362323614466, 'gamma': 2.564050091037405, 'rate_drop': 3.1261700559107155e-07, 'skip_drop': 0.005784946362217083}. Best is trial 205 with value: -1.007585085076739.
[I 2025-06-20 12:14:31,101] Trial 220 finished with value: -1.0430268896412764 and parameters: {'booster': 'dart', 'lambda': 0.00010963293797751121, 'alpha': 1.091101641190861e-08, 'subsample': 0.5320800968717354, 'colsample_bytree': 0.7071184126842207, 'max_depth': 4, 'min_child_weight': 9, 'eta': 0.09342523020712806, 'gamma': 2.208612325796866, 'rate_drop': 8.762408906436837e-07, 'skip_drop': 0.003319287503555905}. Best is trial 205 with value: -1.007585085076739.
[I 2025-06-20 12:14:35,944] Trial 221 finished with value: -1.0563641037920974 and parameters: {'booster': 'dart', 'lambda': 7.95816615907783e-05, 'alpha': 2.72725431627471e-08, 'subsample': 0.5432612165334733, 'colsample_bytree': 0.6772298191731758, 'max_depth': 4, 'min_child_weight': 9, 'eta': 0.08264233043651985, 'gamma': 2.4586745828229666, 'rate_drop': 1.9639066589451055e-07, 'skip_drop': 0.0016477170007917297}. Best is trial 205 with value: -1.007585085076739.
[I 2025-06-20 12:14:40,404] Trial 222 finished with value: -1.0817162552769315 and parameters: {'booster': 'dart', 'lambda': 3.8234719238311616e-05, 'alpha': 3.6249936691023094e-08, 'subsample': 0.5240557152551891, 'colsample_bytree': 0.6640233693424261, 'max_depth': 4, 'min_child_weight': 9, 'eta': 0.08384964517364886, 'gamma': 2.6196950771516865, 'rate_drop': 2.786299334425312e-07, 'skip_drop': 0.0013185547853818446}. Best is trial 205 with value: -1.007585085076739.
[I 2025-06-20 12:14:45,126] Trial 223 finished with value: -1.0994127268924792 and parameters: {'booster': 'dart', 'lambda': 0.00015102287531620564, 'alpha': 1.6223682600503066e-08, 'subsample': 0.5092576525809706, 'colsample_bytree': 0.7197984788405629, 'max_depth': 4, 'min_child_weight': 9, 'eta': 0.06895857135959234, 'gamma': 1.589238787523096, 'rate_drop': 4.5492750890792543e-07, 'skip_drop': 0.013774609625460765}. Best is trial 205 with value: -1.007585085076739.
[I 2025-06-20 12:14:49,924] Trial 224 finished with value: -1.0429185083786876 and parameters: {'booster': 'dart', 'lambda': 6.523835154732635e-05, 'alpha': 6.189941238456426e-08, 'subsample': 0.5482745137823507, 'colsample_bytree': 0.6859530630025208, 'max_depth': 4, 'min_child_weight': 9, 'eta': 0.10022259672278515, 'gamma': 1.661161921930989, 'rate_drop': 1.722553806866604e-07, 'skip_drop': 0.0032820964500043263}. Best is trial 205 with value: -1.007585085076739.
[I 2025-06-20 12:14:58,949] Trial 225 finished with value: -1.3556401634760693 and parameters: {'booster': 'dart', 'lambda': 2.530444418956124e-05, 'alpha': 2.0901742664658907e-08, 'subsample': 0.5342373582787275, 'colsample_bytree': 0.9019158538100783, 'max_depth': 4, 'min_child_weight': 9, 'eta': 0.0034763100310121445, 'gamma': 2.3223361840095156, 'rate_drop': 1.842416968574814e-06, 'skip_drop': 0.002097550359104212}. Best is trial 205 with value: -1.007585085076739.
[I 2025-06-20 12:15:04,148] Trial 226 finished with value: -1.0467453638820972 and parameters: {'booster': 'dart', 'lambda': 0.0005336557404450095, 'alpha': 0.012806880651343075, 'subsample': 0.5199993977960652, 'colsample_bytree': 0.6742607163091354, 'max_depth': 4, 'min_child_weight': 9, 'eta': 0.0874018982501897, 'gamma': 1.7637097394911754, 'rate_drop': 6.666840737033155e-07, 'skip_drop': 1.8646932623337715e-06}. Best is trial 205 with value: -1.007585085076739.
[I 2025-06-20 12:15:09,111] Trial 227 finished with value: -1.018426344741612 and parameters: {'booster': 'dart', 'lambda': 1.1771974623747056e-08, 'alpha': 1.1931139084151462e-07, 'subsample': 0.5302054833020412, 'colsample_bytree': 0.6577600068610316, 'max_depth': 4, 'min_child_weight': 9, 'eta': 0.07545463051084021, 'gamma': 2.468125571171381, 'rate_drop': 3.181178266725817e-07, 'skip_drop': 0.0009700839495737294}. Best is trial 205 with value: -1.007585085076739.
[I 2025-06-20 12:15:16,201] Trial 228 finished with value: -1.0831088810243175 and parameters: {'booster': 'dart', 'lambda': 0.0001973443191652482, 'alpha': 9.419786810291853e-08, 'subsample': 0.5139464599341477, 'colsample_bytree': 0.6546460401485542, 'max_depth': 4, 'min_child_weight': 9, 'eta': 0.062486080091029315, 'gamma': 2.447583442453747, 'rate_drop': 3.582128953979622e-07, 'skip_drop': 0.001453737676984416}. Best is trial 205 with value: -1.007585085076739.
[I 2025-06-20 12:15:23,172] Trial 229 finished with value: -1.0471767945432808 and parameters: {'booster': 'dart', 'lambda': 0.00034798526078100517, 'alpha': 1.508405053019622e-07, 'subsample': 0.5313620668302248, 'colsample_bytree': 0.6641661498081686, 'max_depth': 4, 'min_child_weight': 10, 'eta': 0.07696880046780501, 'gamma': 2.8050692272527815, 'rate_drop': 2.390229204644833e-07, 'skip_drop': 0.00048658720139504677}. Best is trial 205 with value: -1.007585085076739.
[I 2025-06-20 12:15:27,518] Trial 230 finished with value: -1.0779395038773487 and parameters: {'booster': 'dart', 'lambda': 1.7576648229149e-08, 'alpha': 2.7753053168400864e-07, 'subsample': 0.5418992090352035, 'colsample_bytree': 0.8390558440491805, 'max_depth': 4, 'min_child_weight': 8, 'eta': 0.11557078863950017, 'gamma': 2.680651244684695, 'rate_drop': 4.2456398579255516e-07, 'skip_drop': 0.0011497995444891978}. Best is trial 205 with value: -1.007585085076739.
[I 2025-06-20 12:15:36,026] Trial 231 finished with value: -1.0490150678764856 and parameters: {'booster': 'dart', 'lambda': 6.013367201372755e-08, 'alpha': 3.9126841595109383e-08, 'subsample': 0.5200809410006657, 'colsample_bytree': 0.6501514593556854, 'max_depth': 4, 'min_child_weight': 9, 'eta': 0.08772389417448756, 'gamma': 2.5036037002287714, 'rate_drop': 1.6374234160450307e-07, 'skip_drop': 0.0008797028794444078}. Best is trial 205 with value: -1.007585085076739.
[I 2025-06-20 12:15:40,621] Trial 232 finished with value: -1.0561546712768914 and parameters: {'booster': 'dart', 'lambda': 4.346188338300174e-05, 'alpha': 6.667784281522833e-08, 'subsample': 0.5296176876719555, 'colsample_bytree': 0.6724753896617247, 'max_depth': 4, 'min_child_weight': 9, 'eta': 0.072466919261042, 'gamma': 2.38098286785185, 'rate_drop': 1.311154729689318e-07, 'skip_drop': 1.1240989793443502e-06}. Best is trial 205 with value: -1.007585085076739.
[I 2025-06-20 12:15:48,913] Trial 233 finished with value: -1.043147807386326 and parameters: {'booster': 'dart', 'lambda': 2.5151411304613137e-07, 'alpha': 3.3551687854967864e-08, 'subsample': 0.5513107944416802, 'colsample_bytree': 0.6856245793096839, 'max_depth': 4, 'min_child_weight': 9, 'eta': 0.07722085871799665, 'gamma': 1.5096205972065917, 'rate_drop': 2.67482717049372e-07, 'skip_drop': 0.00267744724892952}. Best is trial 205 with value: -1.007585085076739.
[I 2025-06-20 12:15:53,470] Trial 234 finished with value: -1.056140883647188 and parameters: {'booster': 'dart', 'lambda': 9.121180683174168e-05, 'alpha': 1.0180742984355306e-08, 'subsample': 0.5418710842824536, 'colsample_bytree': 0.6571091064276533, 'max_depth': 4, 'min_child_weight': 9, 'eta': 0.09592185716427497, 'gamma': 2.2418692808457696, 'rate_drop': 6.767184518489763e-07, 'skip_drop': 1.0814066188246946e-08}. Best is trial 205 with value: -1.007585085076739.
