[I 2025-06-20 12:36:36,628] Trial 467 finished with value: -1.0607503537411294 and parameters: {'booster': 'dart', 'lambda': 1.7982905090466785e-06, 'alpha': 0.11631204915275636, 'subsample': 0.54030229534867, 'colsample_bytree': 0.7148032292310003, 'max_depth': 3, 'min_child_weight': 10, 'eta': 0.17035074297931085, 'gamma': 2.09173027053777, 'rate_drop': 2.852601171606039e-08, 'skip_drop': 3.269767281721077e-05}. Best is trial 451 with value: -0.9851783303475563.
[I 2025-06-20 12:36:45,541] Trial 468 finished with value: -1.0672346720216124 and parameters: {'booster': 'dart', 'lambda': 2.18338571182963e-05, 'alpha': 0.3189979383297242, 'subsample': 0.5272919707774707, 'colsample_bytree': 0.717641368966922, 'max_depth': 3, 'min_child_weight': 10, 'eta': 0.12159549780078624, 'gamma': 2.30642865827076, 'rate_drop': 1.558777632973194e-08, 'skip_drop': 2.495306324739342e-06}. Best is trial 451 with value: -0.9851783303475563.
[I 2025-06-20 12:36:49,833] Trial 469 finished with value: -1.060089548790617 and parameters: {'booster': 'dart', 'lambda': 7.119729669113829e-06, 'alpha': 0.38086863125812737, 'subsample': 0.5512077290582105, 'colsample_bytree': 0.7358481576474655, 'max_depth': 3, 'min_child_weight': 10, 'eta': 0.11081396452156125, 'gamma': 1.9894681961237684, 'rate_drop': 2.2608755825845903e-08, 'skip_drop': 1.775402319229046e-06}. Best is trial 451 with value: -0.9851783303475563.
[I 2025-06-20 12:36:53,434] Trial 470 finished with value: -1.0613458865706782 and parameters: {'booster': 'dart', 'lambda': 1.0326689999875216e-08, 'alpha': 0.09645607169856474, 'subsample': 0.5140471621129543, 'colsample_bytree': 0.7132661133823569, 'max_depth': 3, 'min_child_weight': 10, 'eta': 0.21875310484661606, 'gamma': 1.9033762903685782, 'rate_drop': 1.3952251813665086e-08, 'skip_drop': 1.5130544771519688e-05}. Best is trial 451 with value: -0.9851783303475563.
[I 2025-06-20 12:36:56,944] Trial 471 finished with value: -1.0710168085847342 and parameters: {'booster': 'dart', 'lambda': 4.875746639324461e-06, 'alpha': 0.2748790318336439, 'subsample': 0.6536332705076173, 'colsample_bytree': 0.7012907324383796, 'max_depth': 3, 'min_child_weight': 10, 'eta': 0.1452989317491475, 'gamma': 2.1921975963223375, 'rate_drop': 1.013787396503206e-08, 'skip_drop': 2.9425189624222414e-06}. Best is trial 451 with value: -0.9851783303475563.
[I 2025-06-20 12:36:57,313] Trial 472 finished with value: -1.0994812956975462 and parameters: {'booster': 'gbtree', 'lambda': 1.4365966450437293e-05, 'alpha': 0.17518352365943768, 'subsample': 0.5338579521978908, 'colsample_bytree': 0.7463571071109696, 'max_depth': 3, 'min_child_weight': 10, 'eta': 0.1326646506313808, 'gamma': 1.8078854675539573}. Best is trial 451 with value: -0.9851783303475563.
[I 2025-06-20 12:37:04,335] Trial 473 finished with value: -1.044467349129875 and parameters: {'booster': 'dart', 'lambda': 2.4309261208369728e-08, 'alpha': 0.021052074806224726, 'subsample': 0.5227474709245349, 'colsample_bytree': 0.7252033971626597, 'max_depth': 3, 'min_child_weight': 10, 'eta': 0.10674712633225847, 'gamma': 2.099390096803274, 'rate_drop': 2.6580418292144404e-08, 'skip_drop': 5.129350625344213e-06}. Best is trial 451 with value: -0.9851783303475563.
[I 2025-06-20 12:37:11,379] Trial 474 finished with value: -1.0553504410752994 and parameters: {'booster': 'dart', 'lambda': 5.752113151590847e-07, 'alpha': 0.6411962483542392, 'subsample': 0.5384504488192959, 'colsample_bytree': 0.7082797469968299, 'max_depth': 3, 'min_child_weight': 10, 'eta': 0.11291709426007294, 'gamma': 2.257448234243425, 'rate_drop': 3.7459420716470183e-08, 'skip_drop': 9.77288017766983e-06}. Best is trial 451 with value: -0.9851783303475563.
[I 2025-06-20 12:37:18,563] Trial 475 finished with value: -1.0692312166516729 and parameters: {'booster': 'dart', 'lambda': 1.0161083976912727e-05, 'alpha': 0.001522860165175223, 'subsample': 0.5445919105785149, 'colsample_bytree': 0.699091106483174, 'max_depth': 3, 'min_child_weight': 7, 'eta': 0.10191386485224835, 'gamma': 1.9144830714309984, 'rate_drop': 1.8122544362131033e-08, 'skip_drop': 1.389138113570043e-06}. Best is trial 451 with value: -0.9851783303475563.
[I 2025-06-20 12:37:21,771] Trial 476 finished with value: -1.1148588059122122 and parameters: {'booster': 'dart', 'lambda': 3.3774495495900907e-06, 'alpha': 0.07488168905495074, 'subsample': 0.509870571441428, 'colsample_bytree': 0.7176297673822492, 'max_depth': 3, 'min_child_weight': 10, 'eta': 0.1255207166396826, 'gamma': 4.372386664633948, 'rate_drop': 1.8881909004618263e-08, 'skip_drop': 3.4641358746031395e-06}. Best is trial 451 with value: -0.9851783303475563.
[I 2025-06-20 12:37:23,121] Trial 477 finished with value: -1.130698425795426 and parameters: {'booster': 'dart', 'lambda': 5.639416587546216e-06, 'alpha': 0.1328791059516929, 'subsample': 0.5240180657171611, 'colsample_bytree': 0.7069848761896166, 'max_depth': 3, 'min_child_weight': 10, 'eta': 0.18735261502010092, 'gamma': 2.353611232552819, 'rate_drop': 2.8776200802181838e-08, 'skip_drop': 2.15838895293609e-06}. Best is trial 451 with value: -0.9851783303475563.
[I 2025-06-20 12:37:26,790] Trial 478 finished with value: -1.0582338907706639 and parameters: {'booster': 'dart', 'lambda': 1.6988515977556353e-05, 'alpha': 0.05021346569973871, 'subsample': 0.5318970244908372, 'colsample_bytree': 0.6923593928413442, 'max_depth': 3, 'min_child_weight': 10, 'eta': 0.14710857169811586, 'gamma': 2.535205105602692, 'rate_drop': 1.3602691528242865e-08, 'skip_drop': 6.767015539158391e-06}. Best is trial 451 with value: -0.9851783303475563.
[I 2025-06-20 12:37:33,882] Trial 479 finished with value: -1.0553374486817575 and parameters: {'booster': 'dart', 'lambda': 1.5581615436834378e-06, 'alpha': 0.0985079434004705, 'subsample': 0.5175815922487356, 'colsample_bytree': 0.6521585347289895, 'max_depth': 3, 'min_child_weight': 10, 'eta': 0.09477034237711775, 'gamma': 2.037976385330217, 'rate_drop': 4.139340548294898e-08, 'skip_drop': 2.0040700764079348e-05}. Best is trial 451 with value: -0.9851783303475563.
[I 2025-06-20 12:37:40,543] Trial 480 finished with value: -1.0372130292710229 and parameters: {'booster': 'dart', 'lambda': 7.666579554817102e-06, 'alpha': 0.07185142968877622, 'subsample': 0.5548799406696489, 'colsample_bytree': 0.6787225553928873, 'max_depth': 3, 'min_child_weight': 10, 'eta': 0.11870073279117278, 'gamma': 2.181893644194, 'rate_drop': 2.0611437913467474e-08, 'skip_drop': 4.584406884781554e-06}. Best is trial 451 with value: -0.9851783303475563.
[I 2025-06-20 12:37:49,424] Trial 481 finished with value: -1.4417120551799865 and parameters: {'booster': 'dart', 'lambda': 2.4137203981385286e-05, 'alpha': 0.04260971158442129, 'subsample': 0.5444591764000126, 'colsample_bytree': 0.66937950773232, 'max_depth': 3, 'min_child_weight': 10, 'eta': 0.002310569322754625, 'gamma': 1.9461991212516003, 'rate_drop': 1.4292222091622761e-08, 'skip_drop': 1.9386752989761734e-06}. Best is trial 451 with value: -0.9851783303475563.
[I 2025-06-20 12:37:56,277] Trial 482 finished with value: -1.0611010176650084 and parameters: {'booster': 'dart', 'lambda': 2.3617717819409037e-06, 'alpha': 0.3444076180624523, 'subsample': 0.5275132973847567, 'colsample_bytree': 0.7237852224700949, 'max_depth': 3, 'min_child_weight': 10, 'eta': 0.07960947534986657, 'gamma': 1.8046454216208858, 'rate_drop': 2.763493562360723e-08, 'skip_drop': 0.00015069482403444785}. Best is trial 451 with value: -0.9851783303475563.
[I 2025-06-20 12:38:01,107] Trial 483 finished with value: -1.08290304676811 and parameters: {'booster': 'dart', 'lambda': 1.0612952104853679e-05, 'alpha': 0.024315052359279277, 'subsample': 0.508973682025215, 'colsample_bytree': 0.7411148577335468, 'max_depth': 3, 'min_child_weight': 10, 'eta': 0.13162992247360547, 'gamma': 2.2935722888622196, 'rate_drop': 4.524020298906955e-08, 'skip_drop': 1.2913198954678784e-06}. Best is trial 451 with value: -0.9851783303475563.
[I 2025-06-20 12:38:05,509] Trial 484 finished with value: -1.0767525620282528 and parameters: {'booster': 'dart', 'lambda': 5.409577978166366e-08, 'alpha': 0.15180051331306252, 'subsample': 0.5352267906585276, 'colsample_bytree': 0.6969129646480909, 'max_depth': 3, 'min_child_weight': 10, 'eta': 0.1039157979263822, 'gamma': 2.0936607385473995, 'rate_drop': 1.033445089380983e-08, 'skip_drop': 3.39071386810263e-06}. Best is trial 451 with value: -0.9851783303475563.
[I 2025-06-20 12:38:12,477] Trial 485 finished with value: -1.0298909398534934 and parameters: {'booster': 'dart', 'lambda': 4.198239178168244e-06, 'alpha': 0.06336537237815493, 'subsample': 0.520140003192525, 'colsample_bytree': 0.7109484310868327, 'max_depth': 3, 'min_child_weight': 10, 'eta': 0.08745025125490283, 'gamma': 2.3862339049974164, 'rate_drop': 1.9254342508641006e-08, 'skip_drop': 9.253558291412908e-06}. Best is trial 451 with value: -0.9851783303475563.
[I 2025-06-20 12:38:16,640] Trial 486 finished with value: -1.0635123301811962 and parameters: {'booster': 'dart', 'lambda': 9.66328757111433e-07, 'alpha': 0.23081479997538157, 'subsample': 0.5000981410169684, 'colsample_bytree': 0.6901166124158835, 'max_depth': 3, 'min_child_weight': 10, 'eta': 0.11203626161782453, 'gamma': 2.2190305796647176, 'rate_drop': 2.5790704554407093e-08, 'skip_drop': 6.0040120818320436e-06}. Best is trial 451 with value: -0.9851783303475563.
[I 2025-06-20 12:38:25,273] Trial 487 finished with value: -1.1427224736497696 and parameters: {'booster': 'dart', 'lambda': 1.1927857609461738e-07, 'alpha': 0.03441018318573666, 'subsample': 0.5449414556290703, 'colsample_bytree': 0.7047360174731038, 'max_depth': 3, 'min_child_weight': 10, 'eta': 0.029129496684076463, 'gamma': 1.8740450581161645, 'rate_drop': 1.3437597976637468e-08, 'skip_drop': 2.637801699687001e-06}. Best is trial 451 with value: -0.9851783303475563.
[I 2025-06-20 12:38:32,044] Trial 488 finished with value: -0.9848577402229411 and parameters: {'booster': 'dart', 'lambda': 6.052383793093285e-06, 'alpha': 0.12591424880860896, 'subsample': 0.5290935303047666, 'colsample_bytree': 0.6660464844135858, 'max_depth': 3, 'min_child_weight': 10, 'eta': 0.15648999995167437, 'gamma': 2.0001920252230665, 'rate_drop': 3.2378040517659553e-08, 'skip_drop': 1.8046959449348164e-06}. Best is trial 488 with value: -0.9848577402229411.
[I 2025-06-20 12:38:32,613] Trial 489 finished with value: -1.1749485998367353 and parameters: {'booster': 'dart', 'lambda': 1.1587114175608247e-05, 'alpha': 0.12269379314827496, 'subsample': 0.518004204817964, 'colsample_bytree': 0.6441806528819426, 'max_depth': 3, 'min_child_weight': 10, 'eta': 0.20104165313664754, 'gamma': 1.9659044074370233, 'rate_drop': 5.5090091536862186e-08, 'skip_drop': 1.2299378918839053e-06}. Best is trial 488 with value: -0.9848577402229411.
[I 2025-06-20 12:38:41,907] Trial 490 finished with value: -1.0259997274797479 and parameters: {'booster': 'dart', 'lambda': 1.6915428838465745, 'alpha': 0.42096059514854195, 'subsample': 0.5554874703531955, 'colsample_bytree': 0.6580487207080927, 'max_depth': 3, 'min_child_weight': 10, 'eta': 0.17807084584394597, 'gamma': 1.8616912304150575, 'rate_drop': 3.929449002646118e-08, 'skip_drop': 1.7576051704000262e-06}. Best is trial 488 with value: -0.9848577402229411.
[I 2025-06-20 12:38:42,135] Trial 491 finished with value: -1.159701082635468 and parameters: {'booster': 'gbtree', 'lambda': 6.09467076985588e-06, 'alpha': 0.19647300551387983, 'subsample': 0.5351801646826224, 'colsample_bytree': 0.6721668123072297, 'max_depth': 3, 'min_child_weight': 10, 'eta': 0.15477305315441617, 'gamma': 1.7573463039751338}. Best is trial 488 with value: -0.9848577402229411.
[I 2025-06-20 12:38:45,770] Trial 492 finished with value: -1.087924608957338 and parameters: {'booster': 'dart', 'lambda': 1.5722170697456722e-05, 'alpha': 0.13812216549115233, 'subsample': 0.5101190712635486, 'colsample_bytree': 0.6699778565067704, 'max_depth': 3, 'min_child_weight': 10, 'eta': 0.1460636933348909, 'gamma': 1.9943556212362135, 'rate_drop': 3.0155545373689866e-08, 'skip_drop': 1.7923548823675992e-06}. Best is trial 488 with value: -0.9848577402229411.
[I 2025-06-20 12:38:54,949] Trial 493 finished with value: -1.0256441800742933 and parameters: {'booster': 'dart', 'lambda': 7.925746808269742e-06, 'alpha': 0.097995703193277, 'subsample': 0.5237480800283231, 'colsample_bytree': 0.6608162152233259, 'max_depth': 3, 'min_child_weight': 10, 'eta': 0.16361552155903117, 'gamma': 2.5510006039691264, 'rate_drop': 6.025031635803722e-08, 'skip_drop': 1.0984144764457597e-06}. Best is trial 488 with value: -0.9848577402229411.
[I 2025-06-20 12:39:04,393] Trial 494 finished with value: -0.994626032401814 and parameters: {'booster': 'dart', 'lambda': 2.575649760970197e-05, 'alpha': 0.23851761543674796, 'subsample': 0.5407113778898888, 'colsample_bytree': 0.6810894502902797, 'max_depth': 3, 'min_child_weight': 10, 'eta': 0.1340774405091117, 'gamma': 2.418867631060947, 'rate_drop': 3.591878184331623e-08, 'skip_drop': 2.7063969795116674e-06}. Best is trial 488 with value: -0.9848577402229411.
[I 2025-06-20 12:39:09,362] Trial 495 finished with value: -1.0828754368940474 and parameters: {'booster': 'dart', 'lambda': 2.6270906409343203e-05, 'alpha': 0.08938425310965413, 'subsample': 0.5485341650229284, 'colsample_bytree': 0.6612294608168223, 'max_depth': 3, 'min_child_weight': 10, 'eta': 0.1524778425861842, 'gamma': 2.471633766660359, 'rate_drop': 4.3426579750226694e-08, 'skip_drop': 2.3623717223798318e-06}. Best is trial 488 with value: -0.9848577402229411.
[I 2025-06-20 12:39:16,941] Trial 496 finished with value: -1.053485517394487 and parameters: {'booster': 'dart', 'lambda': 1.8925390199890393e-05, 'alpha': 0.3293083778878101, 'subsample': 0.5253916816963154, 'colsample_bytree': 0.6799228056802509, 'max_depth': 3, 'min_child_weight': 10, 'eta': 0.13159569019874126, 'gamma': 2.4221042766889536, 'rate_drop': 7.608145167939173e-08, 'skip_drop': 1.5901267368074865e-06}. Best is trial 488 with value: -0.9848577402229411.
[I 2025-06-20 12:39:18,789] Trial 497 finished with value: -1.119701414286487 and parameters: {'booster': 'dart', 'lambda': 2.6670888441663927e-05, 'alpha': 0.5570278201657011, 'subsample': 0.5423850877438376, 'colsample_bytree': 0.679962360282591, 'max_depth': 3, 'min_child_weight': 10, 'eta': 0.18232772199597783, 'gamma': 1.7845810503068305, 'rate_drop': 3.335104612494106e-08, 'skip_drop': 6.460656397030708e-05}. Best is trial 488 with value: -0.9848577402229411.
[I 2025-06-20 12:39:19,585] Trial 498 finished with value: -1.2012402769516917 and parameters: {'booster': 'dart', 'lambda': 1.2857506865627878e-05, 'alpha': 0.0602908217932002, 'subsample': 0.5162730801078296, 'colsample_bytree': 0.664697132314219, 'max_depth': 3, 'min_child_weight': 10, 'eta': 0.1722785711053949, 'gamma': 2.7449352834047787, 'rate_drop': 5.012043482091279e-08, 'skip_drop': 2.8273167412128573e-06}. Best is trial 488 with value: -0.9848577402229411.
[I 2025-06-20 12:39:27,446] Trial 499 finished with value: -1.0214568768041838 and parameters: {'booster': 'dart', 'lambda': 2.636631742445698e-05, 'alpha': 0.15993316277043465, 'subsample': 0.5329662842267668, 'colsample_bytree': 0.6496071074821678, 'max_depth': 3, 'min_child_weight': 10, 'eta': 0.1375924419615217, 'gamma': 2.5920301739619656, 'rate_drop': 3.2023674491896965e-08, 'skip_drop': 1.1798195267885214e-06}. Best is trial 488 with value: -0.9848577402229411.
Number of finished trials:  500
Best trial:
  Value (RMSE): 0.9849
  MSE: 0.9700
  R²: 0.3918
  Params: 
    booster: dart
    lambda: 6.052383793093285e-06
    alpha: 0.12591424880860896
    subsample: 0.5290935303047666
    colsample_bytree: 0.6660464844135858
    max_depth: 3
    min_child_weight: 10
    eta: 0.15648999995167437
    gamma: 2.0001920252230665
    rate_drop: 3.2378040517659553e-08
    skip_drop: 1.8046959449348164e-06
Model saved to /vol/models/qt_student_score_predictor_optuna_xgb.pkl
Students to predict: 727
/usr/local/lib/python3.13/site-packages/xgboost/core.py:729: UserWarning: [12:43:18] WARNING: /workspace/src/common/error_msg.cc:27: The tree method `gpu_hist` is deprecated since 2.0.0. To use GPU training, set the `device` parameter to CUDA instead.

    E.g. tree_method = "hist", device = "cuda"

  return func(**kwargs)
Predictions saved to /vol/predictions/qt_unscored_predictions.csv