[I 2025-06-20 12:27:36,203] Trial 374 finished with value: -1.0154647126764427 and parameters: {'booster': 'dart', 'lambda': 2.3605895532580228e-06, 'alpha': 0.07104819067175379, 'subsample': 0.5231935747858629, 'colsample_bytree': 0.6971644791141342, 'max_depth': 3, 'min_child_weight': 10, 'eta': 0.10899193644551063, 'gamma': 2.0908905589878217, 'rate_drop': 1.752354100867858e-08, 'skip_drop': 5.774275505979835e-06}. Best is trial 366 with value: -0.989605092644619.
[I 2025-06-20 12:27:42,585] Trial 375 finished with value: -1.0268311093120632 and parameters: {'booster': 'dart', 'lambda': 6.198362251956966e-06, 'alpha': 0.05170127832709351, 'subsample': 0.5221549559477797, 'colsample_bytree': 0.7002734985976118, 'max_depth': 3, 'min_child_weight': 10, 'eta': 0.12615585134985224, 'gamma': 2.027507325752911, 'rate_drop': 1.6952382769817117e-08, 'skip_drop': 8.491102158246639e-06}. Best is trial 366 with value: -0.989605092644619.
[I 2025-06-20 12:27:49,486] Trial 376 finished with value: -1.0572393931188078 and parameters: {'booster': 'dart', 'lambda': 4.416773419518916e-06, 'alpha': 0.17817781338223643, 'subsample': 0.509912903394777, 'colsample_bytree': 0.6952745866218375, 'max_depth': 3, 'min_child_weight': 10, 'eta': 0.1638843353046278, 'gamma': 2.2185694675022614, 'rate_drop': 1.8872794898288198e-08, 'skip_drop': 1.625058870608031e-05}. Best is trial 366 with value: -0.989605092644619.
[I 2025-06-20 12:27:55,913] Trial 377 finished with value: -1.0193995162650726 and parameters: {'booster': 'dart', 'lambda': 2.665315568084463e-06, 'alpha': 0.03525191323212998, 'subsample': 0.5290082774538374, 'colsample_bytree': 0.7158957700644012, 'max_depth': 3, 'min_child_weight': 10, 'eta': 0.11157143071094466, 'gamma': 2.098263501842551, 'rate_drop': 1.0502651860744097e-08, 'skip_drop': 5.3985702704075205e-06}. Best is trial 366 with value: -0.989605092644619.
[I 2025-06-20 12:28:02,930] Trial 378 finished with value: -1.0383287043698954 and parameters: {'booster': 'dart', 'lambda': 3.123906335712388e-06, 'alpha': 0.10000035425148152, 'subsample': 0.5262697091968771, 'colsample_bytree': 0.713387219413701, 'max_depth': 3, 'min_child_weight': 10, 'eta': 0.11461306969381366, 'gamma': 2.1510652322911996, 'rate_drop': 1.0295101191571825e-08, 'skip_drop': 6.679679682407934e-06}. Best is trial 366 with value: -0.989605092644619.
[I 2025-06-20 12:28:08,112] Trial 379 finished with value: -1.062818452671812 and parameters: {'booster': 'dart', 'lambda': 2.6797959568131867e-06, 'alpha': 0.06403789837025353, 'subsample': 0.5007538626340374, 'colsample_bytree': 0.718544909203237, 'max_depth': 3, 'min_child_weight': 10, 'eta': 0.1350353391106, 'gamma': 2.0292295367756386, 'rate_drop': 1.71932651227957e-08, 'skip_drop': 5.175267031197961e-06}. Best is trial 366 with value: -0.989605092644619.
[I 2025-06-20 12:28:16,640] Trial 380 finished with value: -1.2852118275840057 and parameters: {'booster': 'dart', 'lambda': 7.144986617204815e-06, 'alpha': 0.035128767280685806, 'subsample': 0.518988179066014, 'colsample_bytree': 0.7082140562734243, 'max_depth': 3, 'min_child_weight': 10, 'eta': 0.007609398628140596, 'gamma': 2.0959588052649134, 'rate_drop': 2.4202340777259005e-08, 'skip_drop': 4.349912444495758e-06}. Best is trial 366 with value: -0.989605092644619.
[I 2025-06-20 12:28:23,756] Trial 381 finished with value: -1.0129240616461863 and parameters: {'booster': 'dart', 'lambda': 5.099223353464882e-06, 'alpha': 0.0961989955374181, 'subsample': 0.5307892134057524, 'colsample_bytree': 0.6892874857499071, 'max_depth': 3, 'min_child_weight': 10, 'eta': 0.10920564277892793, 'gamma': 1.982829727666914, 'rate_drop': 1.0532305750807008e-08, 'skip_drop': 3.7924497075361544e-06}. Best is trial 366 with value: -0.989605092644619.
[I 2025-06-20 12:28:28,123] Trial 382 finished with value: -1.04157810507157 and parameters: {'booster': 'dart', 'lambda': 1.7675720290611415e-06, 'alpha': 0.11369103728409868, 'subsample': 0.5330350538954044, 'colsample_bytree': 0.6922233045765774, 'max_depth': 3, 'min_child_weight': 10, 'eta': 0.15155799369472545, 'gamma': 2.17910957266134, 'rate_drop': 1.3185328480952516e-08, 'skip_drop': 7.292914557188512e-06}. Best is trial 366 with value: -0.989605092644619.
[I 2025-06-20 12:28:31,580] Trial 383 finished with value: -1.070896311740378 and parameters: {'booster': 'dart', 'lambda': 4.3982446193881264e-06, 'alpha': 0.043721511843348396, 'subsample': 0.5164116911817851, 'colsample_bytree': 0.7060777534120802, 'max_depth': 3, 'min_child_weight': 10, 'eta': 0.11756838285162133, 'gamma': 1.9626581687023033, 'rate_drop': 2.41419209400557e-08, 'skip_drop': 1.0094333795942335e-05}. Best is trial 366 with value: -0.989605092644619.
[I 2025-06-20 12:28:40,133] Trial 384 finished with value: -1.0001039600687187 and parameters: {'booster': 'dart', 'lambda': 6.514438540483905e-06, 'alpha': 0.18386229659104616, 'subsample': 0.5421627667341172, 'colsample_bytree': 0.6968897808646186, 'max_depth': 3, 'min_child_weight': 10, 'eta': 0.1075655959395041, 'gamma': 2.2525105162168693, 'rate_drop': 1.3467455504739184e-08, 'skip_drop': 3.68628310481775e-06}. Best is trial 366 with value: -0.989605092644619.
[I 2025-06-20 12:28:44,146] Trial 385 finished with value: -1.0454338033348696 and parameters: {'booster': 'dart', 'lambda': 5.4627314040425696e-06, 'alpha': 0.4138108629823272, 'subsample': 0.5398278580069954, 'colsample_bytree': 0.7192011288244079, 'max_depth': 3, 'min_child_weight': 10, 'eta': 0.126222628497931, 'gamma': 2.2470639196553743, 'rate_drop': 1.0948714002603924e-08, 'skip_drop': 3.735716940754444e-06}. Best is trial 366 with value: -0.989605092644619.
[I 2025-06-20 12:28:48,825] Trial 386 finished with value: -1.0444687914121367 and parameters: {'booster': 'dart', 'lambda': 2.4535480136218597e-06, 'alpha': 0.20110766264028362, 'subsample': 0.545206225105652, 'colsample_bytree': 0.7028414926309928, 'max_depth': 3, 'min_child_weight': 10, 'eta': 0.10885220339974797, 'gamma': 2.2761379237497974, 'rate_drop': 1.5470558378957586e-08, 'skip_drop': 4.551349123785659e-06}. Best is trial 366 with value: -0.989605092644619.
[I 2025-06-20 12:28:55,842] Trial 387 finished with value: -1.020932471494678 and parameters: {'booster': 'dart', 'lambda': 8.205510479895305e-06, 'alpha': 0.23405756882000867, 'subsample': 0.5277711517026269, 'colsample_bytree': 0.6955261005342954, 'max_depth': 3, 'min_child_weight': 10, 'eta': 0.13530184001913217, 'gamma': 2.07636972336736, 'rate_drop': 1.0160975439347057e-08, 'skip_drop': 6.315034383987727e-06}. Best is trial 366 with value: -0.989605092644619.
[I 2025-06-20 12:29:02,570] Trial 388 finished with value: -1.0403705570664243 and parameters: {'booster': 'dart', 'lambda': 9.032538766678693e-06, 'alpha': 0.1876895592624661, 'subsample': 0.5239719978024996, 'colsample_bytree': 0.6966683623597412, 'max_depth': 3, 'min_child_weight': 10, 'eta': 0.14473004376790385, 'gamma': 2.0963278362912465, 'rate_drop': 1.043536310687861e-08, 'skip_drop': 1.1701910702535862e-05}. Best is trial 366 with value: -0.989605092644619.
[I 2025-06-20 12:29:05,566] Trial 389 finished with value: -1.1422303797534714 and parameters: {'booster': 'dart', 'lambda': 7.152129319273582e-06, 'alpha': 0.27631856425257145, 'subsample': 0.5119829328135221, 'colsample_bytree': 0.7124738088749448, 'max_depth': 3, 'min_child_weight': 10, 'eta': 0.18171462617723352, 'gamma': 2.1224055672594595, 'rate_drop': 1.6741558394866474e-08, 'skip_drop': 7.2529807929100815e-06}. Best is trial 366 with value: -0.989605092644619.
[I 2025-06-20 12:29:08,942] Trial 390 finished with value: -1.058216215841967 and parameters: {'booster': 'dart', 'lambda': 4.96366939392329e-06, 'alpha': 0.13110674863629113, 'subsample': 0.5307226128763206, 'colsample_bytree': 0.7273247010777921, 'max_depth': 3, 'min_child_weight': 10, 'eta': 0.14078731985703155, 'gamma': 2.2449128223562624, 'rate_drop': 2.486746250210775e-08, 'skip_drop': 3.1246456299974642e-06}. Best is trial 366 with value: -0.989605092644619.
[I 2025-06-20 12:29:10,939] Trial 391 finished with value: -1.1047541322851648 and parameters: {'booster': 'dart', 'lambda': 9.458535762833329e-06, 'alpha': 0.10090921509210328, 'subsample': 0.5372709098745854, 'colsample_bytree': 0.7026263194658194, 'max_depth': 3, 'min_child_weight': 10, 'eta': 0.1637470984081258, 'gamma': 1.989915733660001, 'rate_drop': 1.0013097992289201e-08, 'skip_drop': 6.308572763754818e-06}. Best is trial 366 with value: -0.989605092644619.
[I 2025-06-20 12:29:11,318] Trial 392 finished with value: -1.079771980014693 and parameters: {'booster': 'gbtree', 'lambda': 3.0240806803296053e-06, 'alpha': 0.9833642165614875, 'subsample': 0.5217485303807636, 'colsample_bytree': 0.6932072395227237, 'max_depth': 3, 'min_child_weight': 10, 'eta': 0.1279497520502566, 'gamma': 2.1045244133645014}. Best is trial 366 with value: -0.989605092644619.
[I 2025-06-20 12:29:15,700] Trial 393 finished with value: -1.0852128829530474 and parameters: {'booster': 'dart', 'lambda': 1.3749693643187025e-06, 'alpha': 0.6330094763703096, 'subsample': 0.5432494579102306, 'colsample_bytree': 0.6878606248134785, 'max_depth': 3, 'min_child_weight': 10, 'eta': 0.11946332006721547, 'gamma': 2.249486074415141, 'rate_drop': 3.099324407101327e-08, 'skip_drop': 6.109507633581932e-06}. Best is trial 366 with value: -0.989605092644619.
[I 2025-06-20 12:29:24,213] Trial 394 finished with value: -1.4773950024895104 and parameters: {'booster': 'dart', 'lambda': 5.347137190996002e-06, 'alpha': 0.284381903870772, 'subsample': 0.5081300126749593, 'colsample_bytree': 0.7134849571475731, 'max_depth': 3, 'min_child_weight': 10, 'eta': 0.0014368666978808447, 'gamma': 2.346493711592108, 'rate_drop': 1.9996603337732947e-08, 'skip_drop': 1.0794778356713887e-05}. Best is trial 366 with value: -0.989605092644619.
[I 2025-06-20 12:29:32,672] Trial 395 finished with value: -1.0037960503992078 and parameters: {'booster': 'dart', 'lambda': 8.214718857999719e-06, 'alpha': 0.07813241404475336, 'subsample': 0.5278811721595372, 'colsample_bytree': 0.6990547292838588, 'max_depth': 3, 'min_child_weight': 10, 'eta': 0.10872061522949054, 'gamma': 2.016633764324587, 'rate_drop': 3.453671808960001e-08, 'skip_drop': 1.8416787239748668e-05}. Best is trial 366 with value: -0.989605092644619.
[I 2025-06-20 12:29:37,835] Trial 396 finished with value: -1.0273372686396232 and parameters: {'booster': 'dart', 'lambda': 7.244634377569853e-06, 'alpha': 0.08172914265248479, 'subsample': 0.520293860166777, 'colsample_bytree': 0.7037126978546642, 'max_depth': 3, 'min_child_weight': 10, 'eta': 0.10729149434300331, 'gamma': 2.180700869620981, 'rate_drop': 1.5529133633985413e-08, 'skip_drop': 2.4687032959752494e-05}. Best is trial 366 with value: -0.989605092644619.
[I 2025-06-20 12:29:45,033] Trial 397 finished with value: -1.0368968357184707 and parameters: {'booster': 'dart', 'lambda': 3.7476382639729485e-06, 'alpha': 0.06477648841752229, 'subsample': 0.5126531331799902, 'colsample_bytree': 0.69147606761752, 'max_depth': 3, 'min_child_weight': 10, 'eta': 0.10807434983862439, 'gamma': 2.053621895205924, 'rate_drop': 1.4338503027508578e-08, 'skip_drop': 1.6647928264981437e-05}. Best is trial 366 with value: -0.989605092644619.
[I 2025-06-20 12:29:52,072] Trial 398 finished with value: -1.026077244802808 and parameters: {'booster': 'dart', 'lambda': 8.531079596602828e-06, 'alpha': 0.04941826283180637, 'subsample': 0.5298847914058442, 'colsample_bytree': 0.7199933002177206, 'max_depth': 3, 'min_child_weight': 10, 'eta': 0.11436599469696014, 'gamma': 2.3369705835278007, 'rate_drop': 2.892474792835572e-08, 'skip_drop': 3.1892344338083673e-06}. Best is trial 366 with value: -0.989605092644619.
[I 2025-06-20 12:29:58,952] Trial 399 finished with value: -1.0336561587888253 and parameters: {'booster': 'dart', 'lambda': 2.0789309278879423e-06, 'alpha': 0.1540460590305779, 'subsample': 0.5285036387895662, 'colsample_bytree': 0.7016215719579886, 'max_depth': 3, 'min_child_weight': 10, 'eta': 0.10176371789474402, 'gamma': 1.987692729781468, 'rate_drop': 1.920520424141412e-08, 'skip_drop': 1.3461555253755753e-05}. Best is trial 366 with value: -0.989605092644619.
[I 2025-06-20 12:30:08,083] Trial 400 finished with value: -1.041647884731031 and parameters: {'booster': 'dart', 'lambda': 5.188050363054618e-06, 'alpha': 0.09166438459428901, 'subsample': 0.5001613018949862, 'colsample_bytree': 0.6873349576511334, 'max_depth': 3, 'min_child_weight': 10, 'eta': 0.1028482447608153, 'gamma': 2.12725025061226, 'rate_drop': 3.879128752140157e-08, 'skip_drop': 5.188054714356111e-06}. Best is trial 366 with value: -0.989605092644619.
[I 2025-06-20 12:30:16,672] Trial 401 finished with value: -1.0192101905349853 and parameters: {'booster': 'dart', 'lambda': 2.7607962689628388e-06, 'alpha': 0.22290125414609077, 'subsample': 0.53648833166777, 'colsample_bytree': 0.709600290967764, 'max_depth': 3, 'min_child_weight': 10, 'eta': 0.12036040114353347, 'gamma': 2.2769634511630494, 'rate_drop': 1.2781685345529704e-08, 'skip_drop': 9.299058319340119e-06}. Best is trial 366 with value: -0.989605092644619.
[I 2025-06-20 12:30:21,005] Trial 402 finished with value: -1.0995038595952404 and parameters: {'booster': 'dart', 'lambda': 3.1988931545494266e-06, 'alpha': 0.47450493744655065, 'subsample': 0.5176617979771002, 'colsample_bytree': 0.7295565489143588, 'max_depth': 3, 'min_child_weight': 10, 'eta': 0.12355483892414967, 'gamma': 2.2831357728140986, 'rate_drop': 1.0200811069925213e-08, 'skip_drop': 1.1477533750604347e-05}. Best is trial 366 with value: -0.989605092644619.
[I 2025-06-20 12:30:27,364] Trial 403 finished with value: -1.0286337929415121 and parameters: {'booster': 'dart', 'lambda': 1.8907729074655478e-06, 'alpha': 0.22264869963694708, 'subsample': 0.5349577949915326, 'colsample_bytree': 0.7115163718396634, 'max_depth': 3, 'min_child_weight': 10, 'eta': 0.13677928776133835, 'gamma': 2.392414342844479, 'rate_drop': 1.3930960924353739e-08, 'skip_drop': 8.829361291415631e-06}. Best is trial 366 with value: -0.989605092644619.
[I 2025-06-20 12:30:34,155] Trial 404 finished with value: -1.0498340161983777 and parameters: {'booster': 'dart', 'lambda': 1.0042576735743762e-05, 'alpha': 0.1181940693529921, 'subsample': 0.5239857059187804, 'colsample_bytree': 0.7177469422639872, 'max_depth': 3, 'min_child_weight': 10, 'eta': 0.1185201958201042, 'gamma': 2.163567364329464, 'rate_drop': 2.2536361132974204e-08, 'skip_drop': 1.93411852994289e-05}. Best is trial 366 with value: -0.989605092644619.
[I 2025-06-20 12:30:43,013] Trial 405 finished with value: -1.0438021137775986 and parameters: {'booster': 'dart', 'lambda': 4.466300369704868e-06, 'alpha': 0.03498048677082165, 'subsample': 0.5145361771783126, 'colsample_bytree': 0.6846033522669229, 'max_depth': 3, 'min_child_weight': 10, 'eta': 0.1545224164677267, 'gamma': 2.259072292050738, 'rate_drop': 1.4285369534899131e-08, 'skip_drop': 4.864322224848365e-06}. Best is trial 366 with value: -0.989605092644619.
[I 2025-06-20 12:30:47,534] Trial 406 finished with value: -1.0320633054732176 and parameters: {'booster': 'dart', 'lambda': 2.6751870033615948e-06, 'alpha': 0.15574436017530777, 'subsample': 0.534333161860612, 'colsample_bytree': 0.7091067650515168, 'max_depth': 3, 'min_child_weight': 10, 'eta': 0.1263643180028764, 'gamma': 2.0611500309546535, 'rate_drop': 3.1089547052819195e-08, 'skip_drop': 7.732774408362696e-06}. Best is trial 366 with value: -0.989605092644619.
[I 2025-06-20 12:30:51,972] Trial 407 finished with value: -1.0542377916436105 and parameters: {'booster': 'dart', 'lambda': 6.610464184970389e-06, 'alpha': 0.3154243336662639, 'subsample': 0.5271327419216825, 'colsample_bytree': 0.6975423009513253, 'max_depth': 3, 'min_child_weight': 10, 'eta': 0.11180388949815505, 'gamma': 2.420123628233914, 'rate_drop': 1.7427498777649326e-08, 'skip_drop': 4.029727385345665e-05}. Best is trial 366 with value: -0.989605092644619.
[I 2025-06-20 12:31:00,486] Trial 408 finished with value: -1.0151035023616586 and parameters: {'booster': 'dart', 'lambda': 1.3249310784862338e-05, 'alpha': 0.07475763788065058, 'subsample': 0.508366257689614, 'colsample_bytree': 0.7258218591002534, 'max_depth': 3, 'min_child_weight': 10, 'eta': 0.13886283444568484, 'gamma': 2.21060757166602, 'rate_drop': 2.253060481686373e-08, 'skip_drop': 2.4817153611601075e-06}. Best is trial 366 with value: -0.989605092644619.
[I 2025-06-20 12:31:03,987] Trial 409 finished with value: -1.0923380092184236 and parameters: {'booster': 'dart', 'lambda': 1.140413094126917e-05, 'alpha': 0.06092706332482635, 'subsample': 0.5074240841954226, 'colsample_bytree': 0.7303601429743423, 'max_depth': 3, 'min_child_weight': 10, 'eta': 0.18240633308386053, 'gamma': 2.1573829270580185, 'rate_drop': 2.1482659857225422e-08, 'skip_drop': 3.221864074344288e-06}. Best is trial 366 with value: -0.989605092644619.
[I 2025-06-20 12:31:07,677] Trial 410 finished with value: -1.0664712174109372 and parameters: {'booster': 'dart', 'lambda': 1.1173489766718336e-05, 'alpha': 0.08948031613881599, 'subsample': 0.5067496044678245, 'colsample_bytree': 0.7395468891805244, 'max_depth': 3, 'min_child_weight': 10, 'eta': 0.13849040153794182, 'gamma': 1.9838666226919028, 'rate_drop': 3.4332986390787156e-08, 'skip_drop': 2.5642515948818427e-06}. Best is trial 366 with value: -0.989605092644619.
[I 2025-06-20 12:31:12,090] Trial 411 finished with value: -1.0719935881071572 and parameters: {'booster': 'dart', 'lambda': 7.067587521906627e-06, 'alpha': 0.04517017749334266, 'subsample': 0.5395393489393789, 'colsample_bytree': 0.723862348962823, 'max_depth': 3, 'min_child_weight': 10, 'eta': 0.15790707259368375, 'gamma': 2.2308474901239737, 'rate_drop': 1.3200275063828658e-08, 'skip_drop': 5.255164389385226e-06}. Best is trial 366 with value: -0.989605092644619.
[I 2025-06-20 12:31:16,281] Trial 412 finished with value: -1.0724218599126147 and parameters: {'booster': 'dart', 'lambda': 1.2211605174649515e-06, 'alpha': 0.20294641641091526, 'subsample': 0.5142492609521838, 'colsample_bytree': 0.7195281780620975, 'max_depth': 3, 'min_child_weight': 10, 'eta': 0.13866020196065426, 'gamma': 2.0709676497286456, 'rate_drop': 1.0108073709613636e-08, 'skip_drop': 7.664721704881395e-06}. Best is trial 366 with value: -0.989605092644619.
[I 2025-06-20 12:31:24,748] Trial 413 finished with value: -1.3559164490885505 and parameters: {'booster': 'dart', 'lambda': 4.172282906831375e-06, 'alpha': 0.1310852952875897, 'subsample': 0.5241128142952137, 'colsample_bytree': 0.7083249028391776, 'max_depth': 3, 'min_child_weight': 10, 'eta': 0.004590604884124361, 'gamma': 1.9534046425471232, 'rate_drop': 2.398929274349539e-08, 'skip_drop': 4.0334643525702114e-06}. Best is trial 366 with value: -0.989605092644619.
[I 2025-06-20 12:31:28,767] Trial 414 finished with value: -1.0725308091839125 and parameters: {'booster': 'dart', 'lambda': 2.97836258564183e-06, 'alpha': 0.030768680727030824, 'subsample': 0.5397612230342391, 'colsample_bytree': 0.7367735499915542, 'max_depth': 3, 'min_child_weight': 10, 'eta': 0.12676113372681933, 'gamma': 2.3314049789589726, 'rate_drop': 1.7202731478000487e-08, 'skip_drop': 2.5226705638846074e-06}. Best is trial 366 with value: -0.989605092644619.
[I 2025-06-20 12:31:37,721] Trial 415 finished with value: -1.0080735194154278 and parameters: {'booster': 'dart', 'lambda': 6.022564906964191e-07, 'alpha': 0.07328009495044065, 'subsample': 0.5307005611408607, 'colsample_bytree': 0.6960133262195821, 'max_depth': 3, 'min_child_weight': 10, 'eta': 0.11174708611184929, 'gamma': 2.173287562489994, 'rate_drop': 3.008411641427131e-08, 'skip_drop': 3.7533712618386907e-06}. Best is trial 366 with value: -0.989605092644619.
[I 2025-06-20 12:31:38,037] Trial 416 finished with value: -1.1113798100432675 and parameters: {'booster': 'gbtree', 'lambda': 6.519226523842676e-07, 'alpha': 0.07864929013848082, 'subsample': 0.7346190261322757, 'colsample_bytree': 0.7041024571916199, 'max_depth': 3, 'min_child_weight': 10, 'eta': 0.1097443318489041, 'gamma': 2.184472676685971}. Best is trial 366 with value: -0.989605092644619.
[I 2025-06-20 12:31:44,420] Trial 417 finished with value: -1.0822122731174044 and parameters: {'booster': 'dart', 'lambda': 1.6334713532869511e-06, 'alpha': 0.041991823265202226, 'subsample': 0.5007771697157742, 'colsample_bytree': 0.7160609309501079, 'max_depth': 3, 'min_child_weight': 10, 'eta': 0.10003187499119594, 'gamma': 2.0984096490970163, 'rate_drop': 4.064942955395836e-08, 'skip_drop': 3.896803868982347e-06}. Best is trial 366 with value: -0.989605092644619.
[I 2025-06-20 12:31:50,821] Trial 418 finished with value: -1.0468095777661204 and parameters: {'booster': 'dart', 'lambda': 1.297396618956582e-05, 'alpha': 0.061695214777281675, 'subsample': 0.6868278688927714, 'colsample_bytree': 0.6978448202379656, 'max_depth': 3, 'min_child_weight': 10, 'eta': 0.11814357202279506, 'gamma': 2.265322707908267, 'rate_drop': 2.8261705369341742e-08, 'skip_drop': 2.1574418210093617e-06}. Best is trial 366 with value: -0.989605092644619.
[I 2025-06-20 12:31:59,396] Trial 419 finished with value: -1.0276043976492673 and parameters: {'booster': 'dart', 'lambda': 1.0381819406568808e-06, 'alpha': 0.11212341235279147, 'subsample': 0.519674033259287, 'colsample_bytree': 0.6917157330897123, 'max_depth': 3, 'min_child_weight': 10, 'eta': 0.10193732160275863, 'gamma': 2.4197980274911233, 'rate_drop': 2.3103528499303524e-08, 'skip_drop': 1.3091871645779011e-05}. Best is trial 366 with value: -0.989605092644619.
[I 2025-06-20 12:32:06,435] Trial 420 finished with value: -1.0282242758636935 and parameters: {'booster': 'dart', 'lambda': 4.773296905918098e-06, 'alpha': 0.2531382776121788, 'subsample': 0.5317925123305731, 'colsample_bytree': 0.7071728625311516, 'max_depth': 3, 'min_child_weight': 10, 'eta': 0.11387244695155233, 'gamma': 2.0190778623554535, 'rate_drop': 0.005355160562052389, 'skip_drop': 6.4979109908898694e-06}. Best is trial 366 with value: -0.989605092644619.
