[I 2025-06-20 12:00:40,933] Trial 48 finished with value: -1.1105902633649776 and parameters: {'booster': 'dart', 'lambda': 0.018346473597315824, 'alpha': 7.665226954893112e-05, 'subsample': 0.6191835388043637, 'colsample_bytree': 0.6299941012270759, 'max_depth': 5, 'min_child_weight': 9, 'eta': 0.11434965777273011, 'gamma': 0.8641466340246016, 'rate_drop': 0.0004413922489537462, 'skip_drop': 1.1254168743085137e-05}. Best is trial 30 with value: -1.026246217486369.
[I 2025-06-20 12:00:41,984] Trial 49 finished with value: -1.167332157156841 and parameters: {'booster': 'dart', 'lambda': 0.005898550292135314, 'alpha': 0.004399051242002164, 'subsample': 0.681160831490953, 'colsample_bytree': 0.5325546333465664, 'max_depth': 6, 'min_child_weight': 8, 'eta': 0.18711491675885866, 'gamma': 0.5556430250092288, 'rate_drop': 4.142981145630211e-06, 'skip_drop': 5.080858017918781e-07}. Best is trial 30 with value: -1.026246217486369.
[I 2025-06-20 12:00:51,086] Trial 50 finished with value: -1.0748228437102587 and parameters: {'booster': 'dart', 'lambda': 0.06544447680927439, 'alpha': 0.00043547679963921836, 'subsample': 0.654671919833095, 'colsample_bytree': 0.5888891219913929, 'max_depth': 5, 'min_child_weight': 9, 'eta': 0.07674435434724795, 'gamma': 0.006314310281186841, 'rate_drop': 2.408028330573353e-05, 'skip_drop': 1.3732513015724188e-06}. Best is trial 30 with value: -1.026246217486369.
[I 2025-06-20 12:00:57,976] Trial 51 finished with value: -1.0889004369026039 and parameters: {'booster': 'dart', 'lambda': 0.0005639636889772757, 'alpha': 0.00156206679098833, 'subsample': 0.5008788307573602, 'colsample_bytree': 0.5217907796394401, 'max_depth': 4, 'min_child_weight': 9, 'eta': 0.04358030414515549, 'gamma': 1.1613194742339636, 'rate_drop': 8.233275969204091e-05, 'skip_drop': 0.0004158219227492401}. Best is trial 30 with value: -1.026246217486369.
[I 2025-06-20 12:01:02,577] Trial 52 finished with value: -1.086026059185 and parameters: {'booster': 'dart', 'lambda': 0.4192292754567529, 'alpha': 0.0001471839624650186, 'subsample': 0.553439350196507, 'colsample_bytree': 0.5595639256458683, 'max_depth': 3, 'min_child_weight': 10, 'eta': 0.09446336106290544, 'gamma': 0.8751051717848309, 'rate_drop': 0.00017867388319936677, 'skip_drop': 0.00342483993506862}. Best is trial 30 with value: -1.026246217486369.
[I 2025-06-20 12:01:07,603] Trial 53 finished with value: -1.1125817997784262 and parameters: {'booster': 'dart', 'lambda': 0.002540152110554565, 'alpha': 0.019833283923195315, 'subsample': 0.584781654997778, 'colsample_bytree': 0.521508398277934, 'max_depth': 4, 'min_child_weight': 8, 'eta': 0.0434038290621829, 'gamma': 0.34303440210166414, 'rate_drop': 3.7208215978867765e-07, 'skip_drop': 8.349413603968915e-05}. Best is trial 30 with value: -1.026246217486369.
[I 2025-06-20 12:01:16,489] Trial 54 finished with value: -1.0482383485991629 and parameters: {'booster': 'dart', 'lambda': 3.2813943801392043e-06, 'alpha': 2.9629916967216077e-05, 'subsample': 0.549956359924372, 'colsample_bytree': 0.5487832801878254, 'max_depth': 7, 'min_child_weight': 9, 'eta': 0.06884954008981631, 'gamma': 1.214887388420808, 'rate_drop': 5.8422736887905056e-05, 'skip_drop': 0.00014933204096333343}. Best is trial 30 with value: -1.026246217486369.
[I 2025-06-20 12:01:17,306] Trial 55 finished with value: -1.199303185721125 and parameters: {'booster': 'dart', 'lambda': 4.397915276984278e-06, 'alpha': 1.0853286318429815e-05, 'subsample': 0.5250851402480803, 'colsample_bytree': 0.5973856581292188, 'max_depth': 7, 'min_child_weight': 10, 'eta': 0.21588859968919327, 'gamma': 1.2423630723947319, 'rate_drop': 2.098537824070765e-05, 'skip_drop': 0.0001510323945945593}. Best is trial 30 with value: -1.026246217486369.
[I 2025-06-20 12:01:25,974] Trial 56 finished with value: -1.0819765013388731 and parameters: {'booster': 'dart', 'lambda': 0.047463439853946354, 'alpha': 3.445455588710436e-05, 'subsample': 0.6190935903430204, 'colsample_bytree': 0.6459651037018911, 'max_depth': 3, 'min_child_weight': 7, 'eta': 0.06733722987814937, 'gamma': 2.2248595241450393, 'rate_drop': 1.3611866473240294e-06, 'skip_drop': 1.1050500763901985e-07}. Best is trial 30 with value: -1.026246217486369.
[I 2025-06-20 12:01:26,877] Trial 57 finished with value: -1.1743961558370464 and parameters: {'booster': 'dart', 'lambda': 2.6083415402356726e-05, 'alpha': 5.82074701892736e-06, 'subsample': 0.5505482733526983, 'colsample_bytree': 0.5695454468228789, 'max_depth': 6, 'min_child_weight': 8, 'eta': 0.10329268895998149, 'gamma': 1.5206362558140685, 'rate_drop': 0.00031006640780301825, 'skip_drop': 1.297075290637507e-05}. Best is trial 30 with value: -1.026246217486369.
[I 2025-06-20 12:01:31,211] Trial 58 finished with value: -1.1058422926202158 and parameters: {'booster': 'dart', 'lambda': 3.220458397904558, 'alpha': 0.0001144703952146518, 'subsample': 0.6415830941845672, 'colsample_bytree': 0.6209425087093673, 'max_depth': 8, 'min_child_weight': 9, 'eta': 0.052110295716994666, 'gamma': 0.6740745986948014, 'rate_drop': 8.38404662081916e-06, 'skip_drop': 3.641946402364039e-05}. Best is trial 30 with value: -1.026246217486369.
[I 2025-06-20 12:01:40,113] Trial 59 finished with value: -1.2011681915651788 and parameters: {'booster': 'dart', 'lambda': 1.364068097232689e-06, 'alpha': 3.589661010517737e-05, 'subsample': 0.5843842276330671, 'colsample_bytree': 0.9602922451836866, 'max_depth': 5, 'min_child_weight': 1, 'eta': 0.009996090681716668, 'gamma': 1.7796349562286453, 'rate_drop': 0.001045325531904282, 'skip_drop': 0.0005233652513478539}. Best is trial 30 with value: -1.026246217486369.
[I 2025-06-20 12:01:41,222] Trial 60 finished with value: -1.128511799865709 and parameters: {'booster': 'dart', 'lambda': 5.6184691287021674e-05, 'alpha': 0.0004113219429612022, 'subsample': 0.6344748962666352, 'colsample_bytree': 0.5513068781507073, 'max_depth': 7, 'min_child_weight': 10, 'eta': 0.152613950562935, 'gamma': 0.1722752115373607, 'rate_drop': 0.00012558489738856782, 'skip_drop': 2.979395196137656e-06}. Best is trial 30 with value: -1.026246217486369.
[I 2025-06-20 12:01:46,514] Trial 61 finished with value: -1.1194183761969099 and parameters: {'booster': 'dart', 'lambda': 0.0003684723745659562, 'alpha': 0.004916763127940335, 'subsample': 0.5565738990274047, 'colsample_bytree': 0.519199825168871, 'max_depth': 9, 'min_child_weight': 9, 'eta': 0.02918591067498668, 'gamma': 0.8914551587607359, 'rate_drop': 4.845143562127523e-05, 'skip_drop': 0.0007364154226237297}. Best is trial 30 with value: -1.026246217486369.
[I 2025-06-20 12:01:51,558] Trial 62 finished with value: -1.0709598195829548 and parameters: {'booster': 'dart', 'lambda': 0.009991692207450654, 'alpha': 0.0011613541239519397, 'subsample': 0.61551708855303, 'colsample_bytree': 0.5371131737119317, 'max_depth': 10, 'min_child_weight': 9, 'eta': 0.047992640638420604, 'gamma': 0.5048391356800317, 'rate_drop': 8.562894454599906e-05, 'skip_drop': 0.004702096111515626}. Best is trial 30 with value: -1.026246217486369.
[I 2025-06-20 12:01:54,724] Trial 63 finished with value: -1.0902745222394916 and parameters: {'booster': 'dart', 'lambda': 7.764256660654819e-06, 'alpha': 0.0002524089756000295, 'subsample': 0.572847588628951, 'colsample_bytree': 0.5705011290302474, 'max_depth': 9, 'min_child_weight': 8, 'eta': 0.07950890444532357, 'gamma': 1.1403185290295126, 'rate_drop': 1.3698177995491471e-05, 'skip_drop': 0.0009708716792929291}. Best is trial 30 with value: -1.026246217486369.
[I 2025-06-20 12:01:59,523] Trial 64 finished with value: -1.0977359210878397 and parameters: {'booster': 'dart', 'lambda': 7.909658622048736e-05, 'alpha': 0.0016400633243602004, 'subsample': 0.5209462940749379, 'colsample_bytree': 0.6071362092071855, 'max_depth': 10, 'min_child_weight': 9, 'eta': 0.03662532649286669, 'gamma': 1.4004592874449246, 'rate_drop': 3.820074041742269e-06, 'skip_drop': 0.00020764766869885954}. Best is trial 30 with value: -1.026246217486369.
[I 2025-06-20 12:02:08,477] Trial 65 finished with value: -1.1433543428440895 and parameters: {'booster': 'dart', 'lambda': 3.0602269039138857e-06, 'alpha': 2.124873442432474e-06, 'subsample': 0.602356446421723, 'colsample_bytree': 0.5148369727730173, 'max_depth': 4, 'min_child_weight': 10, 'eta': 0.020635143596624196, 'gamma': 0.7936406982738553, 'rate_drop': 3.786099516338308e-05, 'skip_drop': 0.010972801326015205}. Best is trial 30 with value: -1.026246217486369.
[I 2025-06-20 12:02:12,098] Trial 66 finished with value: -1.1015163715260696 and parameters: {'booster': 'dart', 'lambda': 1.5543201168134854e-06, 'alpha': 1.9032566326823934e-05, 'subsample': 0.5597138607007566, 'colsample_bytree': 0.5490381231714477, 'max_depth': 9, 'min_child_weight': 7, 'eta': 0.06868799768710865, 'gamma': 0.6410406786310774, 'rate_drop': 0.007544141149502061, 'skip_drop': 5.716104413130661e-05}. Best is trial 30 with value: -1.026246217486369.
[I 2025-06-20 12:02:12,372] Trial 67 finished with value: -1.1675986837203922 and parameters: {'booster': 'gbtree', 'lambda': 8.897574314726877e-07, 'alpha': 5.5015933026632545e-05, 'subsample': 0.5432666030180068, 'colsample_bytree': 0.6978735570612645, 'max_depth': 10, 'min_child_weight': 8, 'eta': 0.1187572533829163, 'gamma': 1.0083156317690984}. Best is trial 30 with value: -1.026246217486369.
[I 2025-06-20 12:02:15,657] Trial 68 finished with value: -1.1008935639531328 and parameters: {'booster': 'dart', 'lambda': 0.002362660156075421, 'alpha': 0.0005658640545965747, 'subsample': 0.6612881388317073, 'colsample_bytree': 0.5820380285453279, 'max_depth': 8, 'min_child_weight': 9, 'eta': 0.06203445510253582, 'gamma': 1.2880260801310923, 'rate_drop': 0.00012317696286389036, 'skip_drop': 0.002229764370961979}. Best is trial 30 with value: -1.026246217486369.
[I 2025-06-20 12:02:23,564] Trial 69 finished with value: -1.0732202112071967 and parameters: {'booster': 'dart', 'lambda': 1.2587293133459116e-07, 'alpha': 0.00011085205757177073, 'subsample': 0.5813549414722551, 'colsample_bytree': 0.5005746894911145, 'max_depth': 10, 'min_child_weight': 10, 'eta': 0.03824771915719245, 'gamma': 1.9522888589441567, 'rate_drop': 0.0008097238082114162, 'skip_drop': 2.158162962250436e-05}. Best is trial 30 with value: -1.026246217486369.
[I 2025-06-20 12:02:32,056] Trial 70 finished with value: -1.059550855298523 and parameters: {'booster': 'dart', 'lambda': 2.507658456126413e-05, 'alpha': 0.04966058278017873, 'subsample': 0.5976680772615547, 'colsample_bytree': 0.5345021524009917, 'max_depth': 3, 'min_child_weight': 8, 'eta': 0.09293577097994209, 'gamma': 0.2687347067009931, 'rate_drop': 5.566784898431247e-07, 'skip_drop': 0.0002530523485796792}. Best is trial 30 with value: -1.026246217486369.
[I 2025-06-20 12:02:37,023] Trial 71 finished with value: -1.0966756607564088 and parameters: {'booster': 'dart', 'lambda': 1.7529936550024464e-05, 'alpha': 0.032818777165488186, 'subsample': 0.6037616705707158, 'colsample_bytree': 0.5366174367935451, 'max_depth': 3, 'min_child_weight': 8, 'eta': 0.08798137142298601, 'gamma': 0.2892713191734771, 'rate_drop': 3.675623982813924e-07, 'skip_drop': 0.00025472829645335407}. Best is trial 30 with value: -1.026246217486369.
[I 2025-06-20 12:02:41,439] Trial 72 finished with value: -1.0573005680000251 and parameters: {'booster': 'dart', 'lambda': 3.603963037795579e-05, 'alpha': 0.34217127417420484, 'subsample': 0.562760320336826, 'colsample_bytree': 0.556322630013796, 'max_depth': 3, 'min_child_weight': 9, 'eta': 0.13806017906363585, 'gamma': 0.4807746533406607, 'rate_drop': 1.0658702713836072e-07, 'skip_drop': 0.0005093083246352144}. Best is trial 30 with value: -1.026246217486369.
[I 2025-06-20 12:02:46,412] Trial 73 finished with value: -1.0700149967112424 and parameters: {'booster': 'dart', 'lambda': 6.757773125933405e-06, 'alpha': 0.33138594364992613, 'subsample': 0.5696673652495936, 'colsample_bytree': 0.5603080339324497, 'max_depth': 3, 'min_child_weight': 8, 'eta': 0.13862833218058151, 'gamma': 0.11140737258104094, 'rate_drop': 6.085719530610003e-08, 'skip_drop': 0.00040298010094957703}. Best is trial 30 with value: -1.026246217486369.
[I 2025-06-20 12:02:50,284] Trial 74 finished with value: -1.10153103102898 and parameters: {'booster': 'dart', 'lambda': 3.1900434686227595e-05, 'alpha': 1.406418820768301, 'subsample': 0.6230428685762361, 'colsample_bytree': 0.5946590180767941, 'max_depth': 3, 'min_child_weight': 9, 'eta': 0.21800452919644106, 'gamma': 0.4061295869948694, 'rate_drop': 1.9472982576593407e-07, 'skip_drop': 0.00011452561268124319}. Best is trial 30 with value: -1.026246217486369.
[I 2025-06-20 12:02:50,760] Trial 75 finished with value: -1.1526100563001027 and parameters: {'booster': 'dart', 'lambda': 2.8746840592792393e-06, 'alpha': 0.19837790669682218, 'subsample': 0.593720693449513, 'colsample_bytree': 0.571447850391948, 'max_depth': 4, 'min_child_weight': 10, 'eta': 0.2583088030675857, 'gamma': 0.5221830192196052, 'rate_drop': 2.0078599548924673e-08, 'skip_drop': 0.6753725341566471}. Best is trial 30 with value: -1.026246217486369.
[I 2025-06-20 12:02:51,072] Trial 76 finished with value: -1.049903783811186 and parameters: {'booster': 'gbtree', 'lambda': 1.568468415489003e-05, 'alpha': 0.12042274861664365, 'subsample': 0.6692280837723876, 'colsample_bytree': 0.5418995204687549, 'max_depth': 3, 'min_child_weight': 7, 'eta': 0.1046392306904209, 'gamma': 0.2552905771817023}. Best is trial 30 with value: -1.026246217486369.
[I 2025-06-20 12:02:51,263] Trial 77 finished with value: -1.1374502877540196 and parameters: {'booster': 'gbtree', 'lambda': 4.052976073761251e-07, 'alpha': 0.08790434267863712, 'subsample': 0.6674077890984373, 'colsample_bytree': 0.5422030169395745, 'max_depth': 3, 'min_child_weight': 7, 'eta': 0.09834629027459246, 'gamma': 0.24060376601078132}. Best is trial 30 with value: -1.026246217486369.
[I 2025-06-20 12:02:51,586] Trial 78 finished with value: -1.0914972363716249 and parameters: {'booster': 'gbtree', 'lambda': 1.2889065657052457e-05, 'alpha': 1.6560753700156439, 'subsample': 0.6446725822399889, 'colsample_bytree': 0.521155930791984, 'max_depth': 3, 'min_child_weight': 7, 'eta': 0.12594040681065882, 'gamma': 0.655172958199626}. Best is trial 30 with value: -1.026246217486369.
[I 2025-06-20 12:02:51,924] Trial 79 finished with value: -1.0923629472003649 and parameters: {'booster': 'gbtree', 'lambda': 4.1246379060366264e-05, 'alpha': 0.8601749346950567, 'subsample': 0.7130505680061956, 'colsample_bytree': 0.5546295926911555, 'max_depth': 3, 'min_child_weight': 8, 'eta': 0.08308193281702601, 'gamma': 0.002873138881838211}. Best is trial 30 with value: -1.026246217486369.
[I 2025-06-20 12:02:52,220] Trial 80 finished with value: -1.3914680073883752 and parameters: {'booster': 'gbtree', 'lambda': 0.00030609828893242246, 'alpha': 0.16310651528699052, 'subsample': 0.5141562017652545, 'colsample_bytree': 0.6140887638047821, 'max_depth': 3, 'min_child_weight': 8, 'eta': 0.003774651706143239, 'gamma': 0.7954504815727479}. Best is trial 30 with value: -1.026246217486369.
[I 2025-06-20 12:02:52,369] Trial 81 finished with value: -1.0911665743211378 and parameters: {'booster': 'gbtree', 'lambda': 2.045420851991539e-05, 'alpha': 4.088336841374555, 'subsample': 0.6041341754621729, 'colsample_bytree': 0.5801903428455656, 'max_depth': 4, 'min_child_weight': 6, 'eta': 0.1969120273260737, 'gamma': 0.4507852319369638}. Best is trial 30 with value: -1.026246217486369.
[I 2025-06-20 12:02:56,011] Trial 82 finished with value: -1.1258880995619747 and parameters: {'booster': 'dart', 'lambda': 1.010081509214596e-05, 'alpha': 0.07871226809908231, 'subsample': 0.5801908849599713, 'colsample_bytree': 0.5284463304055147, 'max_depth': 4, 'min_child_weight': 9, 'eta': 0.1715287836585995, 'gamma': 0.33719112057424816, 'rate_drop': 6.623152829030093e-07, 'skip_drop': 0.0016777200970964903}. Best is trial 30 with value: -1.026246217486369.
[I 2025-06-20 12:03:01,052] Trial 83 finished with value: -1.0698348902188242 and parameters: {'booster': 'dart', 'lambda': 2.662459710900657e-06, 'alpha': 0.020646340450695924, 'subsample': 0.6299451590277984, 'colsample_bytree': 0.59179905058336, 'max_depth': 3, 'min_child_weight': 9, 'eta': 0.1059617714295649, 'gamma': 0.1537841929533616, 'rate_drop': 1.0907634527323263e-07, 'skip_drop': 2.193756349317676e-05}. Best is trial 30 with value: -1.026246217486369.
[I 2025-06-20 12:03:03,972] Trial 84 finished with value: -1.1106656007972748 and parameters: {'booster': 'dart', 'lambda': 0.04453998571623311, 'alpha': 0.034532265056096585, 'subsample': 0.7014148142667944, 'colsample_bytree': 0.564341794903533, 'max_depth': 5, 'min_child_weight': 8, 'eta': 0.13807925178581676, 'gamma': 0.5911559379091118, 'rate_drop': 1.92886420635469e-06, 'skip_drop': 0.0001851729195820112}. Best is trial 30 with value: -1.026246217486369.
[I 2025-06-20 12:03:04,391] Trial 85 finished with value: -1.085399532438194 and parameters: {'booster': 'gbtree', 'lambda': 9.477337192635324e-07, 'alpha': 0.4948801473645405, 'subsample': 0.5407363266833974, 'colsample_bytree': 0.5472721642854185, 'max_depth': 4, 'min_child_weight': 10, 'eta': 0.0518610707955226, 'gamma': 0.9234076906082864}. Best is trial 30 with value: -1.026246217486369.
[I 2025-06-20 12:03:08,595] Trial 86 finished with value: -1.1285469229649447 and parameters: {'booster': 'dart', 'lambda': 0.00840736200579571, 'alpha': 0.1364280365748838, 'subsample': 0.6796012312599145, 'colsample_bytree': 0.6026825466792698, 'max_depth': 3, 'min_child_weight': 7, 'eta': 0.15557614703620926, 'gamma': 1.1002502334108988, 'rate_drop': 6.247576670577025e-07, 'skip_drop': 0.0006192669476858072}. Best is trial 30 with value: -1.026246217486369.
[I 2025-06-20 12:03:17,260] Trial 87 finished with value: -1.0261485365581584 and parameters: {'booster': 'dart', 'lambda': 7.036939205662085e-05, 'alpha': 0.011652705795809517, 'subsample': 0.5927906746832842, 'colsample_bytree': 0.5125234234713625, 'max_depth': 4, 'min_child_weight': 9, 'eta': 0.07052705420865132, 'gamma': 0.4124561234184446, 'rate_drop': 1.1732618865846323e-05, 'skip_drop': 7.064711439805246e-07}. Best is trial 87 with value: -1.0261485365581584.
[I 2025-06-20 12:03:23,810] Trial 88 finished with value: -1.0767587687116376 and parameters: {'booster': 'dart', 'lambda': 8.665279915944523e-05, 'alpha': 0.04989926662094278, 'subsample': 0.5631121107373589, 'colsample_bytree': 0.5166835243481275, 'max_depth': 5, 'min_child_weight': 9, 'eta': 0.06307850074227207, 'gamma': 0.7288724990373723, 'rate_drop': 5.1579877309493585e-06, 'skip_drop': 3.9484168167840715e-08}. Best is trial 87 with value: -1.0261485365581584.
[I 2025-06-20 12:03:28,296] Trial 89 finished with value: -1.1340326905131035 and parameters: {'booster': 'dart', 'lambda': 0.0001764030358851674, 'alpha': 0.012827300534907136, 'subsample': 0.592223299100776, 'colsample_bytree': 0.536716333749169, 'max_depth': 3, 'min_child_weight': 8, 'eta': 0.06953842720063237, 'gamma': 0.10039763674750854, 'rate_drop': 9.400495158884486e-06, 'skip_drop': 2.690230335220181e-07}. Best is trial 87 with value: -1.0261485365581584.
[I 2025-06-20 12:03:32,681] Trial 90 finished with value: -1.059571258537182 and parameters: {'booster': 'dart', 'lambda': 5.1909850174269776e-06, 'alpha': 0.005656003927054279, 'subsample': 0.6126914970073306, 'colsample_bytree': 0.530233611411936, 'max_depth': 4, 'min_child_weight': 9, 'eta': 0.08120257068605782, 'gamma': 1.6451638034571372, 'rate_drop': 1.997706169925564e-07, 'skip_drop': 5.097418454481696e-07}. Best is trial 87 with value: -1.0261485365581584.
[I 2025-06-20 12:03:41,325] Trial 91 finished with value: -1.0164875258596158 and parameters: {'booster': 'dart', 'lambda': 5.0353160360696685e-06, 'alpha': 0.005857376559349231, 'subsample': 0.6133935646200723, 'colsample_bytree': 0.8985285907850882, 'max_depth': 4, 'min_child_weight': 9, 'eta': 0.07846007895768305, 'gamma': 1.634907429712619, 'rate_drop': 1.3272650556404903e-07, 'skip_drop': 3.466017720961505e-07}. Best is trial 91 with value: -1.0164875258596158.
[I 2025-06-20 12:03:45,191] Trial 92 finished with value: -1.075809133487928 and parameters: {'booster': 'dart', 'lambda': 4.1937055258999155e-06, 'alpha': 0.002764813471069765, 'subsample': 0.6323359917878679, 'colsample_bytree': 0.9990445224053754, 'max_depth': 4, 'min_child_weight': 9, 'eta': 0.07854358029312673, 'gamma': 1.631155245960842, 'rate_drop': 2.7560405982386966e-08, 'skip_drop': 5.0960994988203e-07}. Best is trial 91 with value: -1.0164875258596158.
[I 2025-06-20 12:03:48,745] Trial 93 finished with value: -1.0273983395229485 and parameters: {'booster': 'dart', 'lambda': 5.1481952848281116e-05, 'alpha': 0.015876931638040066, 'subsample': 0.6110744823309101, 'colsample_bytree': 0.8426773881211247, 'max_depth': 4, 'min_child_weight': 9, 'eta': 0.10947107736693594, 'gamma': 1.5218269941281624, 'rate_drop': 1.7609819135827905e-07, 'skip_drop': 9.583646364545521e-08}. Best is trial 91 with value: -1.0164875258596158.
[I 2025-06-20 12:03:52,687] Trial 94 finished with value: -1.070397063116847 and parameters: {'booster': 'dart', 'lambda': 5.288017802343602e-05, 'alpha': 0.012906413860845352, 'subsample': 0.9440342133782245, 'colsample_bytree': 0.915867548725798, 'max_depth': 4, 'min_child_weight': 10, 'eta': 0.10080980847518442, 'gamma': 1.4340305830865785, 'rate_drop': 5.4059034142300164e-08, 'skip_drop': 3.3992186086077113e-08}. Best is trial 91 with value: -1.0164875258596158.
[I 2025-06-20 12:03:55,659] Trial 95 finished with value: -1.1329267099268896 and parameters: {'booster': 'dart', 'lambda': 1.3100926911841803e-05, 'alpha': 0.01918119619633259, 'subsample': 0.6509443088454907, 'colsample_bytree': 0.8356602835187499, 'max_depth': 5, 'min_child_weight': 9, 'eta': 0.10891732034732955, 'gamma': 2.2211125390016973, 'rate_drop': 1.027523678082789e-07, 'skip_drop': 1.0342225319574561e-07}. Best is trial 91 with value: -1.0164875258596158.
