[I 2025-06-20 12:20:04,916] Trial 281 finished with value: -1.0735160826815435 and parameters: {'booster': 'dart', 'lambda': 9.323471898468847e-06, 'alpha': 2.662391365509023e-08, 'subsample': 0.5726458016118336, 'colsample_bytree': 0.8891086301642892, 'max_depth': 4, 'min_child_weight': 10, 'eta': 0.08242551871530573, 'gamma': 1.4316011060776224, 'rate_drop': 8.072542433563699e-07, 'skip_drop': 6.493984413131506e-07}. Best is trial 205 with value: -1.007585085076739.
[I 2025-06-20 12:20:08,954] Trial 282 finished with value: -1.1632914292686627 and parameters: {'booster': 'dart', 'lambda': 4.73680825420733e-05, 'alpha': 0.014300769660965397, 'subsample': 0.5449163335216264, 'colsample_bytree': 0.682038880712625, 'max_depth': 4, 'min_child_weight': 5, 'eta': 0.09341437749243546, 'gamma': 1.5287785652637735, 'rate_drop': 1.0646459433268121e-08, 'skip_drop': 9.781746156046197e-07}. Best is trial 205 with value: -1.007585085076739.
[I 2025-06-20 12:20:11,837] Trial 283 finished with value: -1.264223439634636 and parameters: {'booster': 'dart', 'lambda': 3.343116576232185e-05, 'alpha': 4.9080893660204535e-08, 'subsample': 0.6256009254177197, 'colsample_bytree': 0.7304878218984276, 'max_depth': 4, 'min_child_weight': 1, 'eta': 0.12093676043622323, 'gamma': 1.6484438986867629, 'rate_drop': 9.844957730474235e-08, 'skip_drop': 2.7620466962389668e-08}. Best is trial 205 with value: -1.007585085076739.
[I 2025-06-20 12:20:14,790] Trial 284 finished with value: -1.1132797851935765 and parameters: {'booster': 'dart', 'lambda': 2.2167808444585124e-05, 'alpha': 6.663151440288626e-05, 'subsample': 0.5642545790079082, 'colsample_bytree': 0.9451281982115919, 'max_depth': 4, 'min_child_weight': 9, 'eta': 0.10028888061620708, 'gamma': 4.105849111894832, 'rate_drop': 2.1814748962536517e-07, 'skip_drop': 4.2659356558363336e-07}. Best is trial 205 with value: -1.007585085076739.
[I 2025-06-20 12:20:23,519] Trial 285 finished with value: -1.1229994749873762 and parameters: {'booster': 'dart', 'lambda': 0.000606282314627023, 'alpha': 0.006565556420004629, 'subsample': 0.8009610346497579, 'colsample_bytree': 0.8324381260868143, 'max_depth': 4, 'min_child_weight': 9, 'eta': 0.026234270196299474, 'gamma': 1.8426840391880928, 'rate_drop': 9.31170854120934e-06, 'skip_drop': 9.545689663192312e-08}. Best is trial 205 with value: -1.007585085076739.
[I 2025-06-20 12:20:27,897] Trial 286 finished with value: -1.0711827271041103 and parameters: {'booster': 'dart', 'lambda': 5.099758115440656e-07, 'alpha': 0.004020213463689931, 'subsample': 0.5356648224448064, 'colsample_bytree': 0.6723711940350647, 'max_depth': 4, 'min_child_weight': 8, 'eta': 0.0790585767183985, 'gamma': 1.965384569543216, 'rate_drop': 1.6098261991286472e-07, 'skip_drop': 0.0003003345461616489}. Best is trial 205 with value: -1.007585085076739.
[I 2025-06-20 12:20:32,868] Trial 287 finished with value: -1.0527408934949818 and parameters: {'booster': 'dart', 'lambda': 6.370725026717065e-05, 'alpha': 2.3679153570151568e-05, 'subsample': 0.5507377166461335, 'colsample_bytree': 0.5002844355703113, 'max_depth': 4, 'min_child_weight': 9, 'eta': 0.08881518536989443, 'gamma': 2.4123697652321434, 'rate_drop': 1.5523624907018958e-06, 'skip_drop': 0.0010590512863872955}. Best is trial 205 with value: -1.007585085076739.
[I 2025-06-20 12:20:33,866] Trial 288 finished with value: -1.2245390280899147 and parameters: {'booster': 'dart', 'lambda': 0.00032028227770077077, 'alpha': 8.360442876112693e-08, 'subsample': 0.5098855774443514, 'colsample_bytree': 0.6973926709602051, 'max_depth': 8, 'min_child_weight': 10, 'eta': 0.10997376465872263, 'gamma': 1.7392327327735502, 'rate_drop': 5.003599564684842e-07, 'skip_drop': 7.298732823936697e-07}. Best is trial 205 with value: -1.007585085076739.
[I 2025-06-20 12:20:35,657] Trial 289 finished with value: -1.1083657496404773 and parameters: {'booster': 'dart', 'lambda': 3.5826347376742055e-05, 'alpha': 0.053117208595716746, 'subsample': 0.9651530503780863, 'colsample_bytree': 0.708212121890591, 'max_depth': 5, 'min_child_weight': 9, 'eta': 0.06922450685813272, 'gamma': 2.7171129104747664, 'rate_drop': 6.353503629326563e-08, 'skip_drop': 5.24729489325237e-07}. Best is trial 205 with value: -1.007585085076739.
[I 2025-06-20 12:20:38,441] Trial 290 finished with value: -1.082698273684459 and parameters: {'booster': 'dart', 'lambda': 7.721887134929776e-05, 'alpha': 3.245689507964671e-08, 'subsample': 0.6116192376017638, 'colsample_bytree': 0.7752547551101859, 'max_depth': 4, 'min_child_weight': 9, 'eta': 0.1349092579898568, 'gamma': 2.5325827085086425, 'rate_drop': 1.228140201985581e-06, 'skip_drop': 0.00045337225616153817}. Best is trial 205 with value: -1.007585085076739.
[I 2025-06-20 12:20:39,258] Trial 291 finished with value: -1.20690995507247 and parameters: {'booster': 'dart', 'lambda': 0.00047686042182659645, 'alpha': 0.02428176654421602, 'subsample': 0.5657015552849026, 'colsample_bytree': 0.8701901343008256, 'max_depth': 4, 'min_child_weight': 4, 'eta': 0.08132097629042029, 'gamma': 2.088224292520266, 'rate_drop': 2.7028303424384295e-07, 'skip_drop': 1.049698654480129e-06}. Best is trial 205 with value: -1.007585085076739.
[I 2025-06-20 12:20:39,561] Trial 292 finished with value: -1.132195062113747 and parameters: {'booster': 'gbtree', 'lambda': 1.3741848461829237e-05, 'alpha': 5.463529597371258e-08, 'subsample': 0.5175972677562062, 'colsample_bytree': 0.6893370407784816, 'max_depth': 4, 'min_child_weight': 9, 'eta': 0.09847160124766761, 'gamma': 2.212647347692611}. Best is trial 205 with value: -1.007585085076739.
[I 2025-06-20 12:20:43,719] Trial 293 finished with value: -1.0831683126083471 and parameters: {'booster': 'dart', 'lambda': 6.571946981743817e-06, 'alpha': 1.716157726778072e-08, 'subsample': 0.5339218229952213, 'colsample_bytree': 0.6756023725192462, 'max_depth': 4, 'min_child_weight': 9, 'eta': 0.089936043277664, 'gamma': 1.9003809384955914, 'rate_drop': 6.30002656080527e-07, 'skip_drop': 0.00017586411261984528}. Best is trial 205 with value: -1.007585085076739.
[I 2025-06-20 12:20:47,115] Trial 294 finished with value: -1.0692867681420866 and parameters: {'booster': 'dart', 'lambda': 5.137999233932635e-05, 'alpha': 2.8227899516350375e-08, 'subsample': 0.5489480565648568, 'colsample_bytree': 0.732320708106153, 'max_depth': 4, 'min_child_weight': 8, 'eta': 0.11668676493113372, 'gamma': 1.586497923185157, 'rate_drop': 1.153035091388915e-07, 'skip_drop': 2.664057844954912e-07}. Best is trial 205 with value: -1.007585085076739.
[I 2025-06-20 12:20:51,422] Trial 295 finished with value: -1.0760480179755 and parameters: {'booster': 'dart', 'lambda': 1.4781880261686903e-07, 'alpha': 0.015857216293157506, 'subsample': 0.5225818127445495, 'colsample_bytree': 0.7458147162395068, 'max_depth': 4, 'min_child_weight': 9, 'eta': 0.07557448061973365, 'gamma': 2.372297178948684, 'rate_drop': 3.4884759137385536e-07, 'skip_drop': 1.4552688753565081e-07}. Best is trial 205 with value: -1.007585085076739.
[I 2025-06-20 12:20:59,888] Trial 296 finished with value: -1.0788116147239855 and parameters: {'booster': 'dart', 'lambda': 3.11153506842511e-05, 'alpha': 0.009761889712925697, 'subsample': 0.5855458389399649, 'colsample_bytree': 0.702656072402983, 'max_depth': 3, 'min_child_weight': 9, 'eta': 0.09958412196833044, 'gamma': 2.876381469083279, 'rate_drop': 3.170861319686242e-08, 'skip_drop': 1.8365890850100804e-06}. Best is trial 205 with value: -1.007585085076739.
[I 2025-06-20 12:21:04,299] Trial 297 finished with value: -1.0835014696343734 and parameters: {'booster': 'dart', 'lambda': 0.0002855934435013022, 'alpha': 3.468196393967564e-05, 'subsample': 0.5413925862204326, 'colsample_bytree': 0.71368729732401, 'max_depth': 4, 'min_child_weight': 9, 'eta': 0.0621836350383574, 'gamma': 1.744749882621302, 'rate_drop': 2.123402969244708e-07, 'skip_drop': 9.142542179526191e-07}. Best is trial 205 with value: -1.007585085076739.
[I 2025-06-20 12:21:08,762] Trial 298 finished with value: -1.0859772031199106 and parameters: {'booster': 'dart', 'lambda': 7.615681456331583e-05, 'alpha': 1.204158448267908e-07, 'subsample': 0.5578751549344806, 'colsample_bytree': 0.8134989604601883, 'max_depth': 4, 'min_child_weight': 10, 'eta': 0.08638812010350268, 'gamma': 2.2859091891056944, 'rate_drop': 4.7061312763176924e-08, 'skip_drop': 0.0009324942033283157}. Best is trial 205 with value: -1.007585085076739.
[I 2025-06-20 12:21:13,164] Trial 299 finished with value: -1.0580465675600643 and parameters: {'booster': 'dart', 'lambda': 0.00020528840279147872, 'alpha': 0.00013698566427439954, 'subsample': 0.5313342527270236, 'colsample_bytree': 0.6680976610545342, 'max_depth': 4, 'min_child_weight': 9, 'eta': 0.0717456469419892, 'gamma': 1.3122784317419536, 'rate_drop': 1.5134203106756174e-07, 'skip_drop': 4.474442151860092e-07}. Best is trial 205 with value: -1.007585085076739.
[I 2025-06-20 12:21:16,136] Trial 300 finished with value: -1.0487882031273306 and parameters: {'booster': 'dart', 'lambda': 1.0051114097552269e-05, 'alpha': 0.0009881287617117035, 'subsample': 0.6034650198203535, 'colsample_bytree': 0.6845713919942169, 'max_depth': 4, 'min_child_weight': 9, 'eta': 0.11081521264179954, 'gamma': 1.6369318504525303, 'rate_drop': 0.002759132421854315, 'skip_drop': 0.0006289636090798244}. Best is trial 205 with value: -1.007585085076739.
[I 2025-06-20 12:21:19,652] Trial 301 finished with value: -1.0642127444711755 and parameters: {'booster': 'dart', 'lambda': 2.044329983009212e-05, 'alpha': 3.777212512403399e-08, 'subsample': 0.5060952425161468, 'colsample_bytree': 0.6974604148828584, 'max_depth': 4, 'min_child_weight': 9, 'eta': 0.15242726778490168, 'gamma': 2.018244728321954, 'rate_drop': 8.377040662008512e-07, 'skip_drop': 2.5301561639451175e-06}. Best is trial 205 with value: -1.007585085076739.
[I 2025-06-20 12:21:26,267] Trial 302 finished with value: -1.02246131126315 and parameters: {'booster': 'dart', 'lambda': 0.00011219816629223226, 'alpha': 6.243676405851929e-08, 'subsample': 0.5697580877863451, 'colsample_bytree': 0.678621080377185, 'max_depth': 4, 'min_child_weight': 10, 'eta': 0.12900453316382843, 'gamma': 1.4844137131077892, 'rate_drop': 4.068234753511979e-07, 'skip_drop': 0.00305779610542896}. Best is trial 205 with value: -1.007585085076739.
[I 2025-06-20 12:21:30,773] Trial 303 finished with value: -1.1497611982356555 and parameters: {'booster': 'dart', 'lambda': 0.00010280803807309795, 'alpha': 6.34967374569355e-08, 'subsample': 0.5767307765043241, 'colsample_bytree': 0.6779715964056601, 'max_depth': 4, 'min_child_weight': 9, 'eta': 0.16580917643915694, 'gamma': 2.6306437056615626, 'rate_drop': 4.4723395854546913e-07, 'skip_drop': 0.0035946536666226405}. Best is trial 205 with value: -1.007585085076739.
[I 2025-06-20 12:21:39,577] Trial 304 finished with value: -1.0402869348307282 and parameters: {'booster': 'dart', 'lambda': 8.75680880702284e-08, 'alpha': 9.713483106021339e-08, 'subsample': 0.5885395805884468, 'colsample_bytree': 0.8449392482276232, 'max_depth': 3, 'min_child_weight': 9, 'eta': 0.12987646041751147, 'gamma': 1.4721409246291717, 'rate_drop': 0.0006548051550694897, 'skip_drop': 1.2261657023578072e-06}. Best is trial 205 with value: -1.007585085076739.
[I 2025-06-20 12:21:43,602] Trial 305 finished with value: -1.0559081164904935 and parameters: {'booster': 'dart', 'lambda': 4.272924389879609e-05, 'alpha': 4.091172313438258e-08, 'subsample': 0.5627890677457245, 'colsample_bytree': 0.6888845389057109, 'max_depth': 4, 'min_child_weight': 9, 'eta': 0.1356247032514015, 'gamma': 1.34908367695468, 'rate_drop': 3.951463606305248e-07, 'skip_drop': 0.0027485202131930573}. Best is trial 205 with value: -1.007585085076739.
[I 2025-06-20 12:21:46,245] Trial 306 finished with value: -1.1179824504380014 and parameters: {'booster': 'dart', 'lambda': 6.085996306501098e-05, 'alpha': 1.5530561543822976e-08, 'subsample': 0.5747912238421858, 'colsample_bytree': 0.6656090261428784, 'max_depth': 4, 'min_child_weight': 10, 'eta': 0.12303786558514188, 'gamma': 1.4806467368794942, 'rate_drop': 2.509134567717274e-07, 'skip_drop': 0.006249510415317301}. Best is trial 205 with value: -1.007585085076739.
[I 2025-06-20 12:21:49,549] Trial 307 finished with value: -1.0260544247109435 and parameters: {'booster': 'dart', 'lambda': 0.0001302273713086154, 'alpha': 2.434465237647486e-08, 'subsample': 0.5961495384970669, 'colsample_bytree': 0.6754796540412915, 'max_depth': 4, 'min_child_weight': 8, 'eta': 0.10690388650075516, 'gamma': 1.5807284551868632, 'rate_drop': 6.693633020023552e-07, 'skip_drop': 5.785592523185665e-07}. Best is trial 205 with value: -1.007585085076739.
[I 2025-06-20 12:21:58,700] Trial 308 finished with value: -1.408762861784612 and parameters: {'booster': 'dart', 'lambda': 0.00012511303165744773, 'alpha': 2.4953587512322525e-08, 'subsample': 0.570171619848774, 'colsample_bytree': 0.6769884042282684, 'max_depth': 4, 'min_child_weight': 10, 'eta': 0.002467201434998277, 'gamma': 1.6339741721068881, 'rate_drop': 6.655235197860916e-07, 'skip_drop': 6.072011265126002e-07}. Best is trial 205 with value: -1.007585085076739.
[I 2025-06-20 12:22:03,668] Trial 309 finished with value: -1.0449676689065412 and parameters: {'booster': 'dart', 'lambda': 9.401862615599291e-05, 'alpha': 2.2113732966287648e-08, 'subsample': 0.5558008554624699, 'colsample_bytree': 0.6690158035674495, 'max_depth': 4, 'min_child_weight': 8, 'eta': 0.09848438459759228, 'gamma': 1.5288201901487022, 'rate_drop': 1.0522769462982912e-06, 'skip_drop': 0.002396818331156073}. Best is trial 205 with value: -1.007585085076739.
[I 2025-06-20 12:22:08,978] Trial 310 finished with value: -1.0411487679234976 and parameters: {'booster': 'dart', 'lambda': 7.774735285571738e-05, 'alpha': 7.077674211803361e-08, 'subsample': 0.5188621413839198, 'colsample_bytree': 0.6922036936270185, 'max_depth': 4, 'min_child_weight': 8, 'eta': 0.14789056913895426, 'gamma': 0.9430043984558691, 'rate_drop': 5.470045104249026e-07, 'skip_drop': 9.073580523672201e-07}. Best is trial 205 with value: -1.007585085076739.
[I 2025-06-20 12:22:10,005] Trial 311 finished with value: -1.2014479297064333 and parameters: {'booster': 'dart', 'lambda': 0.00018059263649441241, 'alpha': 4.84423652406503e-08, 'subsample': 0.617928939176841, 'colsample_bytree': 0.6823716276346541, 'max_depth': 5, 'min_child_weight': 6, 'eta': 0.17797308770617584, 'gamma': 1.1889395145706163, 'rate_drop': 3.36907528364585e-07, 'skip_drop': 4.326548051252716e-06}. Best is trial 205 with value: -1.007585085076739.
[I 2025-06-20 12:22:10,177] Trial 312 finished with value: -1.1654979935655183 and parameters: {'booster': 'gbtree', 'lambda': 4.984562850913047e-05, 'alpha': 3.324972516469402e-08, 'subsample': 0.5505445517126865, 'colsample_bytree': 0.6643278888160664, 'max_depth': 4, 'min_child_weight': 9, 'eta': 0.0919257681701203, 'gamma': 1.390753104910609}. Best is trial 205 with value: -1.007585085076739.
[I 2025-06-20 12:22:13,657] Trial 313 finished with value: -1.1272103314791557 and parameters: {'booster': 'dart', 'lambda': 0.00013610294860733453, 'alpha': 1.7096366802182863e-07, 'subsample': 0.5292739296831035, 'colsample_bytree': 0.7056278144229863, 'max_depth': 3, 'min_child_weight': 9, 'eta': 0.12297226057128524, 'gamma': 1.528912066393089, 'rate_drop': 3.1348349580954077e-06, 'skip_drop': 0.006715817674220745}. Best is trial 205 with value: -1.007585085076739.
[I 2025-06-20 12:22:16,989] Trial 314 finished with value: -1.1208001685517759 and parameters: {'booster': 'dart', 'lambda': 9.124554885886673e-05, 'alpha': 2.5263547653963094e-08, 'subsample': 0.5824367976105558, 'colsample_bytree': 0.6937746896438104, 'max_depth': 4, 'min_child_weight': 7, 'eta': 0.10274350900569026, 'gamma': 1.6688168160883985, 'rate_drop': 8.084935858493092e-07, 'skip_drop': 1.7480366115619544e-06}. Best is trial 205 with value: -1.007585085076739.
[I 2025-06-20 12:22:21,219] Trial 315 finished with value: -1.0799436189156606 and parameters: {'booster': 'dart', 'lambda': 0.00016141199735469382, 'alpha': 1.389209682871526e-08, 'subsample': 0.5002935899616734, 'colsample_bytree': 0.9050197187964129, 'max_depth': 4, 'min_child_weight': 9, 'eta': 0.08308442944473274, 'gamma': 1.7274132177656303, 'rate_drop': 1.3580548050021991e-06, 'skip_drop': 7.354274176469003e-07}. Best is trial 205 with value: -1.007585085076739.
[I 2025-06-20 12:22:24,723] Trial 316 finished with value: -1.0931678385426273 and parameters: {'booster': 'dart', 'lambda': 1.8636449346716637e-06, 'alpha': 9.762359338910143e-08, 'subsample': 0.5399804247527827, 'colsample_bytree': 0.9221476426429808, 'max_depth': 4, 'min_child_weight': 8, 'eta': 0.11133015528727637, 'gamma': 1.5329413304387802, 'rate_drop': 5.672510275931928e-07, 'skip_drop': 0.009147484748941176}. Best is trial 205 with value: -1.007585085076739.
[I 2025-06-20 12:22:33,377] Trial 317 finished with value: -1.0621570375944362 and parameters: {'booster': 'dart', 'lambda': 0.00040865395574814163, 'alpha': 5.741364047040486e-08, 'subsample': 0.5187727469771719, 'colsample_bytree': 0.8791827882733757, 'max_depth': 4, 'min_child_weight': 9, 'eta': 0.09158499906416889, 'gamma': 1.8123067133650412, 'rate_drop': 2.870851904129207e-07, 'skip_drop': 0.001861942555995962}. Best is trial 205 with value: -1.007585085076739.
[I 2025-06-20 12:22:37,832] Trial 318 finished with value: -1.049102472323111 and parameters: {'booster': 'dart', 'lambda': 3.885014977193359e-08, 'alpha': 0.00026864364880653513, 'subsample': 0.5452770396689043, 'colsample_bytree': 0.6743964689453233, 'max_depth': 4, 'min_child_weight': 10, 'eta': 0.07808627576642968, 'gamma': 0.7811815979099233, 'rate_drop': 4.2261194770665975e-07, 'skip_drop': 4.211253797225413e-08}. Best is trial 205 with value: -1.007585085076739.
[I 2025-06-20 12:22:42,242] Trial 319 finished with value: -1.085720125567371 and parameters: {'booster': 'dart', 'lambda': 3.175705108848452e-05, 'alpha': 1.7521281775678586e-08, 'subsample': 0.5653736342894674, 'colsample_bytree': 0.6582374401235627, 'max_depth': 4, 'min_child_weight': 9, 'eta': 0.06911202896190137, 'gamma': 2.529376405078856, 'rate_drop': 1.8669141808569149e-07, 'skip_drop': 0.004027102223285359}. Best is trial 205 with value: -1.007585085076739.
[I 2025-06-20 12:22:44,260] Trial 320 finished with value: -1.1107613215827221 and parameters: {'booster': 'dart', 'lambda': 5.6641848034760296e-05, 'alpha': 4.563339194023789e-08, 'subsample': 0.7138642631193532, 'colsample_bytree': 0.6806348958078059, 'max_depth': 9, 'min_child_weight': 9, 'eta': 0.1163321361501878, 'gamma': 1.607725228320522, 'rate_drop': 7.650452538845933e-07, 'skip_drop': 1.3610571426681226e-06}. Best is trial 205 with value: -1.007585085076739.
[I 2025-06-20 12:22:47,100] Trial 321 finished with value: -1.0654518531622752 and parameters: {'booster': 'dart', 'lambda': 0.00024911032143487707, 'alpha': 3.295593949333677e-08, 'subsample': 0.5281924525437518, 'colsample_bytree': 0.6898608771641759, 'max_depth': 5, 'min_child_weight': 9, 'eta': 0.09987874872307849, 'gamma': 1.824691927371139, 'rate_drop': 2.582139601753524e-07, 'skip_drop': 0.1120772424398499}. Best is trial 205 with value: -1.007585085076739.
[I 2025-06-20 12:22:50,522] Trial 322 finished with value: -1.0914593059329554 and parameters: {'booster': 'dart', 'lambda': 0.00011255629805586423, 'alpha': 2.1225289618638185e-07, 'subsample': 0.8865626147039858, 'colsample_bytree': 0.7067897064692295, 'max_depth': 4, 'min_child_weight': 10, 'eta': 0.08718432840886658, 'gamma': 1.4261511262148059, 'rate_drop': 3.8666453076495155e-07, 'skip_drop': 0.0013996262398649213}. Best is trial 205 with value: -1.007585085076739.
[I 2025-06-20 12:22:57,258] Trial 323 finished with value: -1.0583536487087344 and parameters: {'booster': 'dart', 'lambda': 2.6983042825396937e-08, 'alpha': 0.0021077110416918496, 'subsample': 0.8727075075927037, 'colsample_bytree': 0.9712756897339645, 'max_depth': 4, 'min_child_weight': 9, 'eta': 0.13331269823490316, 'gamma': 1.7242576657317006, 'rate_drop': 1.5688322833975807e-07, 'skip_drop': 3.957577799989885e-07}. Best is trial 205 with value: -1.007585085076739.
[I 2025-06-20 12:23:01,955] Trial 324 finished with value: -1.0703931663100612 and parameters: {'booster': 'dart', 'lambda': 4.011681488233296e-07, 'alpha': 8.590060885272855e-08, 'subsample': 0.537521295934711, 'colsample_bytree': 0.6706892930532143, 'max_depth': 4, 'min_child_weight': 9, 'eta': 0.07857225699743817, 'gamma': 1.2647702439234711, 'rate_drop': 1.0581613995653605e-06, 'skip_drop': 6.484457726273609e-07}. Best is trial 205 with value: -1.007585085076739.
[I 2025-06-20 12:23:10,603] Trial 325 finished with value: -1.149519162542271 and parameters: {'booster': 'dart', 'lambda': 7.181836379234133e-05, 'alpha': 1.8642892900717332e-08, 'subsample': 0.6312640083046513, 'colsample_bytree': 0.698318152185483, 'max_depth': 4, 'min_child_weight': 9, 'eta': 0.016672179926671315, 'gamma': 2.7161546005425303, 'rate_drop': 6.42044884757825e-07, 'skip_drop': 2.2714349963427047e-06}. Best is trial 205 with value: -1.007585085076739.
[I 2025-06-20 12:23:15,079] Trial 326 finished with value: -1.0769625970293568 and parameters: {'booster': 'dart', 'lambda': 1.152249878688219e-08, 'alpha': 3.1483622239133545e-08, 'subsample': 0.5559589744079189, 'colsample_bytree': 0.6846949872333042, 'max_depth': 4, 'min_child_weight': 9, 'eta': 0.06109630169584798, 'gamma': 1.6065115429845611, 'rate_drop': 2.0523962422846947e-06, 'skip_drop': 6.560171765726518e-06}. Best is trial 205 with value: -1.007585085076739.
