[I 2025-06-20 12:16:00,605] Trial 235 finished with value: -1.049492168175209 and parameters: {'booster': 'dart', 'lambda': 6.2394303082984e-05, 'alpha': 5.494112719602084e-05, 'subsample': 0.5249623739864777, 'colsample_bytree': 0.732697781156921, 'max_depth': 4, 'min_child_weight': 9, 'eta': 0.08580786825310487, 'gamma': 1.9587434098129453, 'rate_drop': 2.1058940043055098e-07, 'skip_drop': 8.335501112340614e-07}. Best is trial 205 with value: -1.007585085076739.
[I 2025-06-20 12:16:05,996] Trial 236 finished with value: -1.087288810982028 and parameters: {'booster': 'dart', 'lambda': 0.00016560327049428613, 'alpha': 0.00010481996978592649, 'subsample': 0.5370513721807897, 'colsample_bytree': 0.6669888864059391, 'max_depth': 4, 'min_child_weight': 9, 'eta': 0.0684237118527919, 'gamma': 2.591376286471408, 'rate_drop': 3.580141077022384e-07, 'skip_drop': 0.004338545170466069}. Best is trial 205 with value: -1.007585085076739.
[I 2025-06-20 12:16:12,928] Trial 237 finished with value: -1.0226440268189343 and parameters: {'booster': 'dart', 'lambda': 1.2529784156702357e-07, 'alpha': 1.555049481725923e-08, 'subsample': 0.5522755968119443, 'colsample_bytree': 0.6985824771949402, 'max_depth': 4, 'min_child_weight': 9, 'eta': 0.09801511777109673, 'gamma': 1.7086045863062256, 'rate_drop': 1.221951649825926e-07, 'skip_drop': 5.749261337758321e-07}. Best is trial 205 with value: -1.007585085076739.
[I 2025-06-20 12:16:17,851] Trial 238 finished with value: -1.05873039849593 and parameters: {'booster': 'dart', 'lambda': 1.0739855367579942e-08, 'alpha': 1.9345802759024166e-08, 'subsample': 0.5505513858395843, 'colsample_bytree': 0.7013278802715222, 'max_depth': 4, 'min_child_weight': 9, 'eta': 0.1068976821063576, 'gamma': 1.6800772587482709, 'rate_drop': 1.0945216672614407e-06, 'skip_drop': 1.8967812473902461e-06}. Best is trial 205 with value: -1.007585085076739.
[I 2025-06-20 12:16:24,244] Trial 239 finished with value: -1.0597453443602554 and parameters: {'booster': 'dart', 'lambda': 5.251336583010381e-08, 'alpha': 1.4174115128292886e-08, 'subsample': 0.506494737467897, 'colsample_bytree': 0.7143663710738393, 'max_depth': 4, 'min_child_weight': 9, 'eta': 0.09834690130286129, 'gamma': 2.3445824017716057, 'rate_drop': 1.451057312228607e-07, 'skip_drop': 4.6661214329272147e-07}. Best is trial 205 with value: -1.007585085076739.
[I 2025-06-20 12:16:32,162] Trial 240 finished with value: -1.0076688280770323 and parameters: {'booster': 'dart', 'lambda': 1.5702518679814782e-07, 'alpha': 5.477496800123565e-08, 'subsample': 0.5310511797069157, 'colsample_bytree': 0.6942704742641809, 'max_depth': 4, 'min_child_weight': 9, 'eta': 0.1254111187475307, 'gamma': 1.754176483300456, 'rate_drop': 5.154473806465724e-07, 'skip_drop': 1.2992843315787575e-06}. Best is trial 205 with value: -1.007585085076739.
[I 2025-06-20 12:16:39,166] Trial 241 finished with value: -1.0477851786525743 and parameters: {'booster': 'dart', 'lambda': 0.00010400226594969752, 'alpha': 5.531241654901741e-08, 'subsample': 0.5323325565063166, 'colsample_bytree': 0.6951091260983913, 'max_depth': 4, 'min_child_weight': 9, 'eta': 0.12989281219505905, 'gamma': 1.7431079646878813, 'rate_drop': 5.16300626034682e-07, 'skip_drop': 4.912547243260142e-08}. Best is trial 205 with value: -1.007585085076739.
[I 2025-06-20 12:16:43,548] Trial 242 finished with value: -1.057259003425528 and parameters: {'booster': 'dart', 'lambda': 0.00024047618928661104, 'alpha': 3.0920790671363147e-08, 'subsample': 0.5394270741744138, 'colsample_bytree': 0.6867572971218425, 'max_depth': 4, 'min_child_weight': 9, 'eta': 0.11136582060465668, 'gamma': 1.6424971890998474, 'rate_drop': 2.981182229319399e-07, 'skip_drop': 1.248701752985414e-06}. Best is trial 205 with value: -1.007585085076739.
[I 2025-06-20 12:16:51,515] Trial 243 finished with value: -1.1194013181675118 and parameters: {'booster': 'dart', 'lambda': 1.1500330428710554e-06, 'alpha': 1.241189637589779e-07, 'subsample': 0.5216248724682779, 'colsample_bytree': 0.7084251050002262, 'max_depth': 4, 'min_child_weight': 9, 'eta': 0.12049434080319736, 'gamma': 1.5397469963727766, 'rate_drop': 6.656832229255693e-07, 'skip_drop': 2.5129897216478474e-06}. Best is trial 205 with value: -1.007585085076739.
[I 2025-06-20 12:16:54,496] Trial 244 finished with value: -1.0946001186968948 and parameters: {'booster': 'dart', 'lambda': 1.5499222103515806e-07, 'alpha': 2.4051100189774165e-08, 'subsample': 0.5476839933992681, 'colsample_bytree': 0.694344551496272, 'max_depth': 4, 'min_child_weight': 9, 'eta': 0.14478480310453926, 'gamma': 1.7619353932067634, 'rate_drop': 2.284885401768374e-07, 'skip_drop': 1.5735723491258583e-06}. Best is trial 205 with value: -1.007585085076739.
[I 2025-06-20 12:17:02,529] Trial 245 finished with value: -1.0190145240759998 and parameters: {'booster': 'dart', 'lambda': 1.920425080772652e-08, 'alpha': 5.0898572955237066e-08, 'subsample': 0.5126931957193858, 'colsample_bytree': 0.6822408103246251, 'max_depth': 4, 'min_child_weight': 9, 'eta': 0.09609001380561069, 'gamma': 1.861371376395717, 'rate_drop': 4.1301660755290785e-07, 'skip_drop': 8.84919434418749e-07}. Best is trial 205 with value: -1.007585085076739.
[I 2025-06-20 12:17:09,205] Trial 246 finished with value: -1.0258163676868375 and parameters: {'booster': 'dart', 'lambda': 4.066285357107064e-05, 'alpha': 4.738037993850269e-08, 'subsample': 0.5289250771779089, 'colsample_bytree': 0.6769676707720308, 'max_depth': 4, 'min_child_weight': 9, 'eta': 0.10120169777148902, 'gamma': 1.8799107712162875, 'rate_drop': 4.993399266022371e-07, 'skip_drop': 6.334096793643809e-07}. Best is trial 205 with value: -1.007585085076739.
[I 2025-06-20 12:17:17,383] Trial 247 finished with value: -1.046525161067236 and parameters: {'booster': 'dart', 'lambda': 1.5881611772546592e-08, 'alpha': 9.17783143835185e-08, 'subsample': 0.5146891061794052, 'colsample_bytree': 0.6733647412920714, 'max_depth': 4, 'min_child_weight': 9, 'eta': 0.10285762689369049, 'gamma': 1.8903875485654449, 'rate_drop': 9.714017033026987e-07, 'skip_drop': 6.81210538682848e-07}. Best is trial 205 with value: -1.007585085076739.
[I 2025-06-20 12:17:21,776] Trial 248 finished with value: -1.0462100398229073 and parameters: {'booster': 'dart', 'lambda': 1.0793655709192766e-07, 'alpha': 4.783126850976684e-08, 'subsample': 0.5264400289762835, 'colsample_bytree': 0.7253028284536953, 'max_depth': 4, 'min_child_weight': 9, 'eta': 0.12514255496637008, 'gamma': 1.9577426548779977, 'rate_drop': 5.326937016574002e-07, 'skip_drop': 5.486333532025478e-07}. Best is trial 205 with value: -1.007585085076739.
[I 2025-06-20 12:17:24,257] Trial 249 finished with value: -1.0963270422476827 and parameters: {'booster': 'dart', 'lambda': 3.767252099234273e-08, 'alpha': 0.019259647256293522, 'subsample': 0.5540754792754224, 'colsample_bytree': 0.7418131135723772, 'max_depth': 4, 'min_child_weight': 9, 'eta': 0.1050128438597137, 'gamma': 1.8407463716821042, 'rate_drop': 1.603596114808779e-07, 'skip_drop': 3.15168424730712e-07}. Best is trial 205 with value: -1.007585085076739.
[I 2025-06-20 12:17:27,066] Trial 250 finished with value: -1.092941346480893 and parameters: {'booster': 'dart', 'lambda': 3.714524382886179e-08, 'alpha': 7.165169549321314e-08, 'subsample': 0.5187765768689944, 'colsample_bytree': 0.7015266971445517, 'max_depth': 4, 'min_child_weight': 10, 'eta': 0.09624517072968805, 'gamma': 1.9130377691802605, 'rate_drop': 1.0495433655083322e-07, 'skip_drop': 8.43303335433863e-07}. Best is trial 205 with value: -1.007585085076739.
[I 2025-06-20 12:17:30,039] Trial 251 finished with value: -1.0952355616458596 and parameters: {'booster': 'dart', 'lambda': 8.43367725679964e-08, 'alpha': 1.7332447742406425e-07, 'subsample': 0.6013171520036286, 'colsample_bytree': 0.6798296424284376, 'max_depth': 4, 'min_child_weight': 9, 'eta': 0.11450048112602489, 'gamma': 2.1834795583264373, 'rate_drop': 4.439785875864952e-07, 'skip_drop': 0.0016975836636405298}. Best is trial 205 with value: -1.007585085076739.
[I 2025-06-20 12:17:36,985] Trial 252 finished with value: -1.0186772437202447 and parameters: {'booster': 'dart', 'lambda': 1.4392935907506205e-08, 'alpha': 0.006449351786030103, 'subsample': 0.5307911161898928, 'colsample_bytree': 0.7151405283937091, 'max_depth': 4, 'min_child_weight': 9, 'eta': 0.07409251901986677, 'gamma': 1.6342818296583086, 'rate_drop': 7.375875399323215e-07, 'skip_drop': 1.6730253379912135e-05}. Best is trial 205 with value: -1.007585085076739.
[I 2025-06-20 12:17:41,595] Trial 253 finished with value: -1.053857195365846 and parameters: {'booster': 'dart', 'lambda': 1.3709071997778124e-08, 'alpha': 0.005106158934296631, 'subsample': 0.542166834102449, 'colsample_bytree': 0.715125084505612, 'max_depth': 4, 'min_child_weight': 9, 'eta': 0.09137934005589533, 'gamma': 1.6051218420424667, 'rate_drop': 8.045065312441142e-07, 'skip_drop': 2.8856198652291773e-05}. Best is trial 205 with value: -1.007585085076739.
[I 2025-06-20 12:17:46,171] Trial 254 finished with value: -1.0380043107815486 and parameters: {'booster': 'dart', 'lambda': 3.180868491226486e-08, 'alpha': 0.007004900286845361, 'subsample': 0.5315333382466039, 'colsample_bytree': 0.7081896041442105, 'max_depth': 4, 'min_child_weight': 9, 'eta': 0.07640350954773378, 'gamma': 1.7312663773253205, 'rate_drop': 7.241963338101919e-07, 'skip_drop': 1.593430500991967e-05}. Best is trial 205 with value: -1.007585085076739.
[I 2025-06-20 12:17:54,883] Trial 255 finished with value: -1.0425474125352792 and parameters: {'booster': 'dart', 'lambda': 1.0258945099320466e-08, 'alpha': 0.01308017589492089, 'subsample': 0.5457150463863748, 'colsample_bytree': 0.7248844079244084, 'max_depth': 4, 'min_child_weight': 10, 'eta': 0.060318689459212343, 'gamma': 1.5038369260189812, 'rate_drop': 1.660677206549082e-06, 'skip_drop': 4.404387212458561e-05}. Best is trial 205 with value: -1.007585085076739.
[I 2025-06-20 12:17:56,944] Trial 256 finished with value: -1.1023805223099281 and parameters: {'booster': 'dart', 'lambda': 2.096433842695651e-08, 'alpha': 1.0891839869922722e-07, 'subsample': 0.5555307061474444, 'colsample_bytree': 0.8600345758029906, 'max_depth': 4, 'min_child_weight': 8, 'eta': 0.14486532768504648, 'gamma': 1.8368812196340332, 'rate_drop': 2.3753548504437297e-06, 'skip_drop': 1.8590884052387482e-07}. Best is trial 205 with value: -1.007585085076739.
[I 2025-06-20 12:18:01,149] Trial 257 finished with value: -1.0816607805920269 and parameters: {'booster': 'dart', 'lambda': 2.4603500251028685e-08, 'alpha': 4.6688840373532746e-08, 'subsample': 0.5359342853955864, 'colsample_bytree': 0.6859130485115987, 'max_depth': 9, 'min_child_weight': 9, 'eta': 0.09973557901726608, 'gamma': 1.6627168512640154, 'rate_drop': 1.10343989988036e-06, 'skip_drop': 3.4728568175033737e-06}. Best is trial 205 with value: -1.007585085076739.
[I 2025-06-20 12:18:09,667] Trial 258 finished with value: -1.2163417151075933 and parameters: {'booster': 'dart', 'lambda': 7.303189311994208e-07, 'alpha': 3.934168411715422e-07, 'subsample': 0.5135134773601189, 'colsample_bytree': 0.6998273600578351, 'max_depth': 4, 'min_child_weight': 9, 'eta': 0.010003305655078992, 'gamma': 1.5734987681145352, 'rate_drop': 5.329201556165716e-07, 'skip_drop': 7.378669125575766e-05}. Best is trial 205 with value: -1.007585085076739.
[I 2025-06-20 12:18:16,691] Trial 259 finished with value: -1.0322234296216697 and parameters: {'booster': 'dart', 'lambda': 1.4455234762876203e-08, 'alpha': 0.028964734592795756, 'subsample': 0.5255720307843076, 'colsample_bytree': 0.7178573190347495, 'max_depth': 4, 'min_child_weight': 9, 'eta': 0.06823408619812667, 'gamma': 1.9855823310308587, 'rate_drop': 6.269998440772505e-08, 'skip_drop': 1.207290226736346e-05}. Best is trial 205 with value: -1.007585085076739.
[I 2025-06-20 12:18:23,720] Trial 260 finished with value: -1.0579602338000151 and parameters: {'booster': 'dart', 'lambda': 3.1173385735530964e-08, 'alpha': 0.02459155600654316, 'subsample': 0.520686503736057, 'colsample_bytree': 0.7180184947863889, 'max_depth': 4, 'min_child_weight': 9, 'eta': 0.06547461580921617, 'gamma': 2.054008553244462, 'rate_drop': 5.280491176269903e-08, 'skip_drop': 2.3890854001488518e-05}. Best is trial 205 with value: -1.007585085076739.
[I 2025-06-20 12:18:32,322] Trial 261 finished with value: -1.0692054186409936 and parameters: {'booster': 'dart', 'lambda': 2.134101932302917e-08, 'alpha': 0.019080664355912286, 'subsample': 0.6179028226676065, 'colsample_bytree': 0.7367611491952005, 'max_depth': 3, 'min_child_weight': 10, 'eta': 0.0712681576059334, 'gamma': 1.8964968576938797, 'rate_drop': 3.00773985376189e-08, 'skip_drop': 0.0006180669774263158}. Best is trial 205 with value: -1.007585085076739.
[I 2025-06-20 12:18:35,830] Trial 262 finished with value: -1.061044921616157 and parameters: {'booster': 'dart', 'lambda': 1.3819533543463283e-08, 'alpha': 0.03637138900074777, 'subsample': 0.5604419687816107, 'colsample_bytree': 0.7095398995288912, 'max_depth': 4, 'min_child_weight': 9, 'eta': 0.11792380191640031, 'gamma': 2.008821718142115, 'rate_drop': 7.241839929327227e-08, 'skip_drop': 1.0023886723468991e-05}. Best is trial 205 with value: -1.007585085076739.
[I 2025-06-20 12:18:40,666] Trial 263 finished with value: -1.0460353456908373 and parameters: {'booster': 'dart', 'lambda': 1.0087790663877501e-08, 'alpha': 0.03555585728000505, 'subsample': 0.5121595549886371, 'colsample_bytree': 0.7279799188622189, 'max_depth': 4, 'min_child_weight': 8, 'eta': 0.09164727616761119, 'gamma': 1.6970493806473599, 'rate_drop': 7.587651897841622e-08, 'skip_drop': 5.658672126798064e-06}. Best is trial 205 with value: -1.007585085076739.
[I 2025-06-20 12:18:45,343] Trial 264 finished with value: -1.0352626249580246 and parameters: {'booster': 'dart', 'lambda': 2.255388419565401e-08, 'alpha': 3.920173432348409e-08, 'subsample': 0.5413292885298189, 'colsample_bytree': 0.6934071257710507, 'max_depth': 4, 'min_child_weight': 9, 'eta': 0.07697581346994647, 'gamma': 1.4188543379022367, 'rate_drop': 1.2850824138306213e-07, 'skip_drop': 1.59785156317124e-05}. Best is trial 205 with value: -1.007585085076739.
[I 2025-06-20 12:18:53,421] Trial 265 finished with value: -1.0619905506437899 and parameters: {'booster': 'dart', 'lambda': 2.249792364988589e-08, 'alpha': 0.008182563824330677, 'subsample': 0.5269497641044326, 'colsample_bytree': 0.7024126532606625, 'max_depth': 4, 'min_child_weight': 9, 'eta': 0.055367444851257795, 'gamma': 1.8269886981872168, 'rate_drop': 2.01509794484152e-08, 'skip_drop': 0.00010810151542651591}. Best is trial 205 with value: -1.007585085076739.
[I 2025-06-20 12:18:57,912] Trial 266 finished with value: -1.0243553954469342 and parameters: {'booster': 'dart', 'lambda': 2.275347316266893e-05, 'alpha': 0.011673605368486691, 'subsample': 0.5494220813719476, 'colsample_bytree': 0.7501081652395967, 'max_depth': 4, 'min_child_weight': 9, 'eta': 0.13383581802062736, 'gamma': 1.9752545129290475, 'rate_drop': 4.413680060686075e-08, 'skip_drop': 4.3369543185831074e-07}. Best is trial 205 with value: -1.007585085076739.
[I 2025-06-20 12:19:04,662] Trial 267 finished with value: -1.088305250206321 and parameters: {'booster': 'dart', 'lambda': 2.0345821811073493e-05, 'alpha': 0.0108099060098758, 'subsample': 0.5488711375990466, 'colsample_bytree': 0.750060387055961, 'max_depth': 3, 'min_child_weight': 9, 'eta': 0.16106407812390663, 'gamma': 1.9179608442664542, 'rate_drop': 0.03327485112092584, 'skip_drop': 3.6322260211387835e-07}. Best is trial 205 with value: -1.007585085076739.
[I 2025-06-20 12:19:07,064] Trial 268 finished with value: -1.061274147381174 and parameters: {'booster': 'dart', 'lambda': 2.3054834968386177e-07, 'alpha': 0.004360056101858072, 'subsample': 0.7659351438652017, 'colsample_bytree': 0.7212156470243403, 'max_depth': 4, 'min_child_weight': 10, 'eta': 0.13162859666719384, 'gamma': 1.5964856279049973, 'rate_drop': 5.015804137801037e-06, 'skip_drop': 4.283939120434787e-07}. Best is trial 205 with value: -1.007585085076739.
[I 2025-06-20 12:19:11,281] Trial 269 finished with value: -1.107826016076756 and parameters: {'booster': 'dart', 'lambda': 1.5539552945389068e-08, 'alpha': 0.00800677919563886, 'subsample': 0.5599905059733135, 'colsample_bytree': 0.7401763918160353, 'max_depth': 4, 'min_child_weight': 9, 'eta': 0.14040505109083914, 'gamma': 1.7627676614459369, 'rate_drop': 5.2142481615072084e-08, 'skip_drop': 5.518986511909123e-07}. Best is trial 205 with value: -1.007585085076739.
[I 2025-06-20 12:19:15,829] Trial 270 finished with value: -1.0300162242223436 and parameters: {'booster': 'dart', 'lambda': 1.2863108534477436e-05, 'alpha': 0.012613703590540782, 'subsample': 0.5972590011770968, 'colsample_bytree': 0.7916069203129292, 'max_depth': 4, 'min_child_weight': 9, 'eta': 0.10962635550927496, 'gamma': 2.200961419047134, 'rate_drop': 3.6560541578463167e-08, 'skip_drop': 2.742490238965243e-07}. Best is trial 205 with value: -1.007585085076739.
[I 2025-06-20 12:19:20,315] Trial 271 finished with value: -1.0415777897030116 and parameters: {'booster': 'dart', 'lambda': 1.180531025092605e-05, 'alpha': 0.015032946490007708, 'subsample': 0.5978519943740009, 'colsample_bytree': 0.7625212994957321, 'max_depth': 4, 'min_child_weight': 9, 'eta': 0.11123129994147395, 'gamma': 2.248389885377605, 'rate_drop': 1.5169990351450692e-08, 'skip_drop': 3.487550640974318e-07}. Best is trial 205 with value: -1.007585085076739.
[I 2025-06-20 12:19:24,562] Trial 272 finished with value: -1.0743630539451503 and parameters: {'booster': 'dart', 'lambda': 3.335830781488983e-07, 'alpha': 0.01386008737121745, 'subsample': 0.5909165581021787, 'colsample_bytree': 0.8185801783889742, 'max_depth': 4, 'min_child_weight': 8, 'eta': 0.12574403398025757, 'gamma': 2.1483720931759906, 'rate_drop': 3.184204568562855e-08, 'skip_drop': 6.718864967075732e-08}. Best is trial 205 with value: -1.007585085076739.
[I 2025-06-20 12:19:24,875] Trial 273 finished with value: -1.1518131629908974 and parameters: {'booster': 'gbtree', 'lambda': 1.3843646151236831e-05, 'alpha': 0.008996599968797885, 'subsample': 0.6111708365216337, 'colsample_bytree': 0.7959961612581006, 'max_depth': 4, 'min_child_weight': 9, 'eta': 0.10746175029035815, 'gamma': 2.290946328273415}. Best is trial 205 with value: -1.007585085076739.
[I 2025-06-20 12:19:29,847] Trial 274 finished with value: -1.0736111970915256 and parameters: {'booster': 'dart', 'lambda': 3.339169389839107e-05, 'alpha': 0.005510396490701895, 'subsample': 0.5781015609496266, 'colsample_bytree': 0.7858127047404787, 'max_depth': 4, 'min_child_weight': 9, 'eta': 0.13476271573303042, 'gamma': 2.5086752390061138, 'rate_drop': 4.302798834164459e-08, 'skip_drop': 5.22242585704907e-07}. Best is trial 205 with value: -1.007585085076739.
[I 2025-06-20 12:19:32,221] Trial 275 finished with value: -1.090677661582794 and parameters: {'booster': 'dart', 'lambda': 1.6749758554234855e-05, 'alpha': 0.0006136501405674396, 'subsample': 0.9498987959675883, 'colsample_bytree': 0.7583840603648971, 'max_depth': 4, 'min_child_weight': 10, 'eta': 0.10288191368976045, 'gamma': 2.6245826983316713, 'rate_drop': 1.2123543699212679e-07, 'skip_drop': 1.942859038930117e-07}. Best is trial 205 with value: -1.007585085076739.
[I 2025-06-20 12:19:34,504] Trial 276 finished with value: -1.1449966778660952 and parameters: {'booster': 'dart', 'lambda': 1.4805865334945866e-05, 'alpha': 3.5061559872058504e-08, 'subsample': 0.5811291926417493, 'colsample_bytree': 0.7696796795674588, 'max_depth': 5, 'min_child_weight': 9, 'eta': 0.15257311865476428, 'gamma': 2.3233618352429812, 'rate_drop': 2.2195617240844583e-08, 'skip_drop': 2.038786923116219e-07}. Best is trial 205 with value: -1.007585085076739.
[I 2025-06-20 12:19:40,598] Trial 277 finished with value: -1.3187448127007249 and parameters: {'booster': 'dart', 'lambda': 5.958375558488639e-08, 'alpha': 0.002662694393818463, 'subsample': 0.5920341057385202, 'colsample_bytree': 0.6790466072456909, 'max_depth': 4, 'min_child_weight': 9, 'eta': 0.11961712297439646, 'gamma': 2.4345028146045498, 'rate_drop': 0.7718105358746288, 'skip_drop': 2.6457604976619304e-07}. Best is trial 205 with value: -1.007585085076739.
[I 2025-06-20 12:19:49,761] Trial 278 finished with value: -1.188127423175558 and parameters: {'booster': 'dart', 'lambda': 2.3160029683628038e-05, 'alpha': 0.020741759723164464, 'subsample': 0.5551816609802555, 'colsample_bytree': 0.691002825129803, 'max_depth': 3, 'min_child_weight': 9, 'eta': 0.020827411803959948, 'gamma': 1.6896835002214088, 'rate_drop': 3.8852917730882715e-08, 'skip_drop': 1.313510911929883e-07}. Best is trial 205 with value: -1.007585085076739.
[I 2025-06-20 12:19:54,275] Trial 279 finished with value: -1.0533624527419732 and parameters: {'booster': 'dart', 'lambda': 2.328957448456575e-05, 'alpha': 0.010651250286995225, 'subsample': 0.6028920999650926, 'colsample_bytree': 0.7488516740411346, 'max_depth': 4, 'min_child_weight': 9, 'eta': 0.09455439694712367, 'gamma': 2.1767444876339934, 'rate_drop': 8.508155735516751e-08, 'skip_drop': 8.212320601383371e-07}. Best is trial 205 with value: -1.007585085076739.
[I 2025-06-20 12:19:58,337] Trial 280 finished with value: -1.1036661725327783 and parameters: {'booster': 'dart', 'lambda': 6.259438103434167e-06, 'alpha': 6.789317406307442e-08, 'subsample': 0.5396705182674527, 'colsample_bytree': 0.8019523892605966, 'max_depth': 4, 'min_child_weight': 9, 'eta': 0.10686288661543064, 'gamma': 1.8175146647914526, 'rate_drop': 3.624487606807268e-07, 'skip_drop': 2.723288912952187e-07}. Best is trial 205 with value: -1.007585085076739.
