[I 2025-06-20 11:57:55,922] A new study created in memory with name: no-name-a65202fa-211e-4023-a7df-f3cdf3df82e8
[I 2025-06-20 11:57:56,829] Trial 0 finished with value: -1.1309261873687357 and parameters: {'booster': 'gbtree', 'lambda': 2.0411211242383626e-07, 'alpha': 0.00016656085377492788, 'subsample': 0.5596146322417093, 'colsample_bytree': 0.8916855473462167, 'max_depth': 6, 'min_child_weight': 7, 'eta': 0.041781952920238605, 'gamma': 3.1349574016180415}. Best is trial 0 with value: -1.1309261873687357.
[I 2025-06-20 11:57:57,072] Trial 1 finished with value: -1.209788610558787 and parameters: {'booster': 'gbtree', 'lambda': 0.0001727135710652404, 'alpha': 0.0011420493793897898, 'subsample': 0.7549827920505265, 'colsample_bytree': 0.9172036186649333, 'max_depth': 5, 'min_child_weight': 1, 'eta': 0.09728143522862338, 'gamma': 2.768725301702912}. Best is trial 0 with value: -1.1309261873687357.
[I 2025-06-20 11:58:00,732] Trial 2 finished with value: -1.1737572995339733 and parameters: {'booster': 'dart', 'lambda': 1.995354217425099e-06, 'alpha': 0.0021063983667822784, 'subsample': 0.8523808677577731, 'colsample_bytree': 0.711781229548489, 'max_depth': 7, 'min_child_weight': 1, 'eta': 0.019779645730044357, 'gamma': 4.649235688155222, 'rate_drop': 6.412175109140102e-06, 'skip_drop': 1.544124584305201e-06}. Best is trial 0 with value: -1.1309261873687357.
[I 2025-06-20 11:58:00,930] Trial 3 finished with value: -1.139523691287128 and parameters: {'booster': 'gbtree', 'lambda': 1.470000300223747e-06, 'alpha': 4.6288729341961704e-05, 'subsample': 0.9501144419512344, 'colsample_bytree': 0.875707868380407, 'max_depth': 8, 'min_child_weight': 9, 'eta': 0.18947419465899107, 'gamma': 0.6324577732725262}. Best is trial 0 with value: -1.1309261873687357.
[I 2025-06-20 11:58:01,955] Trial 4 finished with value: -1.1595447168633228 and parameters: {'booster': 'dart', 'lambda': 7.999191744647167e-06, 'alpha': 1.189895923470627e-08, 'subsample': 0.8262524692980842, 'colsample_bytree': 0.8818809044619426, 'max_depth': 5, 'min_child_weight': 4, 'eta': 0.2011629362533318, 'gamma': 4.070479676127354, 'rate_drop': 0.8425052803144675, 'skip_drop': 0.33645685684343274}. Best is trial 0 with value: -1.1309261873687357.
[I 2025-06-20 11:58:10,772] Trial 5 finished with value: -1.0954192965017793 and parameters: {'booster': 'dart', 'lambda': 3.4294391152567137e-07, 'alpha': 0.5431010575149847, 'subsample': 0.7572772046635299, 'colsample_bytree': 0.7230818890864346, 'max_depth': 9, 'min_child_weight': 6, 'eta': 0.02313575745002976, 'gamma': 0.12163972770762588, 'rate_drop': 2.4939215814226248e-06, 'skip_drop': 1.6952220647499462e-07}. Best is trial 5 with value: -1.0954192965017793.
[I 2025-06-20 11:58:19,515] Trial 6 finished with value: -1.155549339552892 and parameters: {'booster': 'dart', 'lambda': 0.028802224616813966, 'alpha': 3.6720752346691666e-08, 'subsample': 0.5537838947958, 'colsample_bytree': 0.8750328129977425, 'max_depth': 5, 'min_child_weight': 3, 'eta': 0.013963024255526067, 'gamma': 0.49885436721761933, 'rate_drop': 0.01232939000578594, 'skip_drop': 0.0055189672233611365}. Best is trial 5 with value: -1.0954192965017793.
[I 2025-06-20 11:58:28,421] Trial 7 finished with value: -1.137152991419235 and parameters: {'booster': 'dart', 'lambda': 0.00029717732502995974, 'alpha': 1.2753511697715716, 'subsample': 0.8481740067447588, 'colsample_bytree': 0.928173077435132, 'max_depth': 8, 'min_child_weight': 1, 'eta': 0.012336229950311643, 'gamma': 0.19999576138864772, 'rate_drop': 7.976335117817655e-07, 'skip_drop': 1.314023013178151e-05}. Best is trial 5 with value: -1.0954192965017793.
[I 2025-06-20 11:58:33,243] Trial 8 finished with value: -1.1600005693748958 and parameters: {'booster': 'dart', 'lambda': 3.4446395741569406e-06, 'alpha': 9.387349977165039, 'subsample': 0.5147822883913582, 'colsample_bytree': 0.6160274642519088, 'max_depth': 9, 'min_child_weight': 8, 'eta': 0.0837724462397311, 'gamma': 2.4222458241024585, 'rate_drop': 1.0919910481213268e-07, 'skip_drop': 0.00023907130845664766}. Best is trial 5 with value: -1.0954192965017793.
[I 2025-06-20 11:58:42,159] Trial 9 finished with value: -1.1637655375765454 and parameters: {'booster': 'dart', 'lambda': 0.18720882998502, 'alpha': 3.241243508938443e-08, 'subsample': 0.6066477801998477, 'colsample_bytree': 0.5681264725096191, 'max_depth': 9, 'min_child_weight': 5, 'eta': 0.008880149040819008, 'gamma': 0.7088640444604721, 'rate_drop': 0.00023348415193780067, 'skip_drop': 0.2618253828416616}. Best is trial 5 with value: -1.0954192965017793.
[I 2025-06-20 11:58:42,522] Trial 10 finished with value: -1.4557412597146837 and parameters: {'booster': 'gbtree', 'lambda': 2.284328905172295e-08, 'alpha': 0.08293533832441033, 'subsample': 0.6583128485501187, 'colsample_bytree': 0.7193160982112088, 'max_depth': 3, 'min_child_weight': 10, 'eta': 0.0019236605202562673, 'gamma': 1.838938382377044}. Best is trial 5 with value: -1.0954192965017793.
[I 2025-06-20 11:58:42,833] Trial 11 finished with value: -1.1637048876839697 and parameters: {'booster': 'gbtree', 'lambda': 1.200369476871663e-08, 'alpha': 2.0176419287177438e-05, 'subsample': 0.6987372723884844, 'colsample_bytree': 0.7948710517412688, 'max_depth': 10, 'min_child_weight': 7, 'eta': 0.04355098821633769, 'gamma': 3.411563182542225}. Best is trial 5 with value: -1.0954192965017793.
[I 2025-06-20 11:58:43,264] Trial 12 finished with value: -1.2872944121728727 and parameters: {'booster': 'gbtree', 'lambda': 1.382771023475885e-07, 'alpha': 0.03272077626355894, 'subsample': 0.7496636878955347, 'colsample_bytree': 0.991281773972027, 'max_depth': 6, 'min_child_weight': 7, 'eta': 0.003479638881709454, 'gamma': 2.0562114318652256}. Best is trial 5 with value: -1.0954192965017793.
[I 2025-06-20 11:58:43,517] Trial 13 finished with value: -1.1598977176702634 and parameters: {'booster': 'gbtree', 'lambda': 7.745300034479903, 'alpha': 3.1006563804116012e-06, 'subsample': 0.6289681552340296, 'colsample_bytree': 0.7782296587749431, 'max_depth': 3, 'min_child_weight': 6, 'eta': 0.03368742265522164, 'gamma': 1.40353412655243}. Best is trial 5 with value: -1.0954192965017793.
[I 2025-06-20 11:58:51,946] Trial 14 finished with value: -1.2141925819324568 and parameters: {'booster': 'dart', 'lambda': 2.1625142944591387e-07, 'alpha': 0.008516743751013934, 'subsample': 0.9907011964307896, 'colsample_bytree': 0.6608323583106277, 'max_depth': 7, 'min_child_weight': 6, 'eta': 0.005479352714137194, 'gamma': 3.4907309491291527, 'rate_drop': 0.00011289720879544712, 'skip_drop': 1.0101624152865389e-08}. Best is trial 5 with value: -1.0954192965017793.
[I 2025-06-20 11:58:52,351] Trial 15 finished with value: -1.08928737829641 and parameters: {'booster': 'gbtree', 'lambda': 1.246854925819815e-05, 'alpha': 1.2166662019523971e-06, 'subsample': 0.7259799705019416, 'colsample_bytree': 0.8026304179236705, 'max_depth': 10, 'min_child_weight': 8, 'eta': 0.03347634232310944, 'gamma': 3.144728102187485}. Best is trial 15 with value: -1.08928737829641.
[I 2025-06-20 11:58:52,879] Trial 16 finished with value: -1.44711170687266 and parameters: {'booster': 'gbtree', 'lambda': 4.87914214074531e-05, 'alpha': 8.705761105500828e-07, 'subsample': 0.7678974255004871, 'colsample_bytree': 0.8048695394614228, 'max_depth': 10, 'min_child_weight': 9, 'eta': 0.0010224254908277179, 'gamma': 1.311382604047642}. Best is trial 15 with value: -1.08928737829641.
[I 2025-06-20 11:59:00,209] Trial 17 finished with value: -1.1406541494452036 and parameters: {'booster': 'dart', 'lambda': 0.004637127542524079, 'alpha': 8.795776130123782e-07, 'subsample': 0.6918214708014054, 'colsample_bytree': 0.5299176389498348, 'max_depth': 9, 'min_child_weight': 4, 'eta': 0.02397879615185228, 'gamma': 4.978476704876782, 'rate_drop': 1.0453933608414314e-08, 'skip_drop': 5.328990179113958e-08}. Best is trial 15 with value: -1.08928737829641.
[I 2025-06-20 11:59:01,620] Trial 18 finished with value: -1.1303634721123226 and parameters: {'booster': 'dart', 'lambda': 1.8273497176060364e-05, 'alpha': 0.3132407878193067, 'subsample': 0.8869049258765447, 'colsample_bytree': 0.6789610667257708, 'max_depth': 10, 'min_child_weight': 8, 'eta': 0.08106581066059661, 'gamma': 3.970958685875667, 'rate_drop': 0.002986129258250867, 'skip_drop': 4.278049690296868e-07}. Best is trial 15 with value: -1.08928737829641.
[I 2025-06-20 11:59:02,166] Trial 19 finished with value: -1.191024581908202 and parameters: {'booster': 'gbtree', 'lambda': 0.0014600668361697108, 'alpha': 7.670437533586963e-06, 'subsample': 0.7902500128170293, 'colsample_bytree': 0.8223721560109218, 'max_depth': 8, 'min_child_weight': 10, 'eta': 0.006904519805738437, 'gamma': 1.2890538649016863}. Best is trial 15 with value: -1.08928737829641.
[I 2025-06-20 11:59:03,946] Trial 20 finished with value: -1.1005192711808094 and parameters: {'booster': 'dart', 'lambda': 5.509190057305194e-07, 'alpha': 4.4581068296300735e-07, 'subsample': 0.7255717451859406, 'colsample_bytree': 0.6148156787080541, 'max_depth': 9, 'min_child_weight': 5, 'eta': 0.05256980278704733, 'gamma': 2.556136318157313, 'rate_drop': 9.696689008306803e-06, 'skip_drop': 0.00024671220674899423}. Best is trial 15 with value: -1.08928737829641.
[I 2025-06-20 11:59:06,160] Trial 21 finished with value: -1.0964522583219525 and parameters: {'booster': 'dart', 'lambda': 6.116273249003097e-07, 'alpha': 2.4253844403323786e-07, 'subsample': 0.7255757261167073, 'colsample_bytree': 0.6084383480042604, 'max_depth': 9, 'min_child_weight': 5, 'eta': 0.056579316006099695, 'gamma': 2.5127150264882245, 'rate_drop': 6.334995394990761e-06, 'skip_drop': 0.0007177804185301363}. Best is trial 15 with value: -1.08928737829641.
[I 2025-06-20 11:59:09,418] Trial 22 finished with value: -1.169081872292043 and parameters: {'booster': 'dart', 'lambda': 3.3549153160637005e-05, 'alpha': 2.5064665311318437e-07, 'subsample': 0.7953606347329522, 'colsample_bytree': 0.5014391193820317, 'max_depth': 10, 'min_child_weight': 3, 'eta': 0.02448644783067593, 'gamma': 2.944593379469336, 'rate_drop': 2.8514017990745e-07, 'skip_drop': 0.009581244872513911}. Best is trial 15 with value: -1.08928737829641.
[I 2025-06-20 11:59:10,228] Trial 23 finished with value: -1.1458494332807045 and parameters: {'booster': 'dart', 'lambda': 5.528432092543064e-08, 'alpha': 0.0001843000234770402, 'subsample': 0.6799219514049146, 'colsample_bytree': 0.7457276604583574, 'max_depth': 8, 'min_child_weight': 6, 'eta': 0.11155400411688844, 'gamma': 1.9843995536442955, 'rate_drop': 1.1333447237139914e-05, 'skip_drop': 2.142428554119029e-05}. Best is trial 15 with value: -1.08928737829641.
[I 2025-06-20 11:59:10,660] Trial 24 finished with value: -1.2602906993304632 and parameters: {'booster': 'dart', 'lambda': 6.341577878406197e-07, 'alpha': 7.340681493970282e-08, 'subsample': 0.6288947489837557, 'colsample_bytree': 0.641434495751784, 'max_depth': 9, 'min_child_weight': 8, 'eta': 0.29955138809011483, 'gamma': 3.750087263505336, 'rate_drop': 1.6887320344519848e-06, 'skip_drop': 0.009391492340098659}. Best is trial 15 with value: -1.08928737829641.
[I 2025-06-20 11:59:12,616] Trial 25 finished with value: -1.1428750482409202 and parameters: {'booster': 'dart', 'lambda': 5.192335886233601e-06, 'alpha': 3.5502255965569966e-06, 'subsample': 0.7207661170792495, 'colsample_bytree': 0.584086412605408, 'max_depth': 10, 'min_child_weight': 4, 'eta': 0.05954334358764943, 'gamma': 2.436204824695814, 'rate_drop': 4.9195436734087236e-08, 'skip_drop': 9.81175809392095e-07}. Best is trial 15 with value: -1.08928737829641.
[I 2025-06-20 11:59:13,034] Trial 26 finished with value: -1.124658062413275 and parameters: {'booster': 'gbtree', 'lambda': 9.18970615096008e-05, 'alpha': 6.931708536050109, 'subsample': 0.9007821096552483, 'colsample_bytree': 0.698276217465721, 'max_depth': 9, 'min_child_weight': 5, 'eta': 0.02616331307245847, 'gamma': 1.7112218179287286}. Best is trial 15 with value: -1.08928737829641.
[I 2025-06-20 11:59:21,663] Trial 27 finished with value: -1.0964583378514956 and parameters: {'booster': 'dart', 'lambda': 0.0009120549683504471, 'alpha': 1.9294156896438351e-07, 'subsample': 0.7968866701678803, 'colsample_bytree': 0.7331289780760775, 'max_depth': 7, 'min_child_weight': 7, 'eta': 0.013936589364578452, 'gamma': 0.022481730208249465, 'rate_drop': 0.0008838089062353469, 'skip_drop': 3.6144396664927506e-05}. Best is trial 15 with value: -1.08928737829641.
[I 2025-06-20 11:59:22,003] Trial 28 finished with value: -1.1627250811375147 and parameters: {'booster': 'gbtree', 'lambda': 4.644403208711557e-08, 'alpha': 2.9578164503760894e-05, 'subsample': 0.6551859455714382, 'colsample_bytree': 0.8458748919516828, 'max_depth': 8, 'min_child_weight': 3, 'eta': 0.03157824472180308, 'gamma': 3.1814614223578155}. Best is trial 15 with value: -1.08928737829641.
[I 2025-06-20 11:59:22,213] Trial 29 finished with value: -1.1328684896179873 and parameters: {'booster': 'gbtree', 'lambda': 2.073893787582903e-07, 'alpha': 0.0007766911313604091, 'subsample': 0.7345804732062967, 'colsample_bytree': 0.7690369700220143, 'max_depth': 6, 'min_child_weight': 7, 'eta': 0.1353798880674164, 'gamma': 4.27813202813757}. Best is trial 15 with value: -1.08928737829641.
[I 2025-06-20 11:59:27,227] Trial 30 finished with value: -1.026246217486369 and parameters: {'booster': 'dart', 'lambda': 9.154115068817385e-06, 'alpha': 9.212174708585502e-05, 'subsample': 0.6066021700204091, 'colsample_bytree': 0.5586152562256583, 'max_depth': 10, 'min_child_weight': 9, 'eta': 0.06148186838365089, 'gamma': 1.0056191439039313, 'rate_drop': 2.646415135740626e-05, 'skip_drop': 0.0008632577427682409}. Best is trial 30 with value: -1.026246217486369.
[I 2025-06-20 11:59:31,568] Trial 31 finished with value: -1.1017749389203608 and parameters: {'booster': 'dart', 'lambda': 1.136413233451941e-05, 'alpha': 7.970645290425815e-05, 'subsample': 0.568993130527132, 'colsample_bytree': 0.5755207153161667, 'max_depth': 10, 'min_child_weight': 9, 'eta': 0.05911078112753835, 'gamma': 0.7628532395248799, 'rate_drop': 2.455531757668418e-05, 'skip_drop': 0.0012199680094956593}. Best is trial 30 with value: -1.026246217486369.
[I 2025-06-20 11:59:35,931] Trial 32 finished with value: -1.0625729649945956 and parameters: {'booster': 'dart', 'lambda': 1.2773123039923411e-06, 'alpha': 0.00624536721478014, 'subsample': 0.5774984309521849, 'colsample_bytree': 0.543854970569674, 'max_depth': 10, 'min_child_weight': 8, 'eta': 0.03777561193100402, 'gamma': 0.9532091286380986, 'rate_drop': 2.3595770299385576e-06, 'skip_drop': 0.0008052536760397745}. Best is trial 30 with value: -1.026246217486369.
[I 2025-06-20 11:59:44,936] Trial 33 finished with value: -1.1409792145512423 and parameters: {'booster': 'dart', 'lambda': 1.709436616016375e-06, 'alpha': 0.011781084607411941, 'subsample': 0.509507574041169, 'colsample_bytree': 0.532708795291528, 'max_depth': 10, 'min_child_weight': 8, 'eta': 0.01778416207152542, 'gamma': 1.0640571283508038, 'rate_drop': 9.76094357932604e-07, 'skip_drop': 0.03186706799328205}. Best is trial 30 with value: -1.026246217486369.
[I 2025-06-20 11:59:50,252] Trial 34 finished with value: -1.0892633172653392 and parameters: {'booster': 'dart', 'lambda': 0.00013675269483472073, 'alpha': 0.0007877976958294131, 'subsample': 0.5714501413914024, 'colsample_bytree': 0.5050247268109801, 'max_depth': 10, 'min_child_weight': 9, 'eta': 0.037084734124590006, 'gamma': 0.3707326014223127, 'rate_drop': 6.08969266469924e-05, 'skip_drop': 0.00234039643810638}. Best is trial 30 with value: -1.026246217486369.
[I 2025-06-20 11:59:54,913] Trial 35 finished with value: -1.0695693604068648 and parameters: {'booster': 'dart', 'lambda': 0.000129892412087398, 'alpha': 0.0008895895527631539, 'subsample': 0.5575308279017246, 'colsample_bytree': 0.5064004834588489, 'max_depth': 10, 'min_child_weight': 9, 'eta': 0.041359325718999834, 'gamma': 1.0028474452937899, 'rate_drop': 6.620828693129151e-05, 'skip_drop': 0.0009898181360426975}. Best is trial 30 with value: -1.026246217486369.
[I 2025-06-20 12:00:01,603] Trial 36 finished with value: -1.073657424899854 and parameters: {'booster': 'dart', 'lambda': 0.00018763834523998906, 'alpha': 0.0006763354049559946, 'subsample': 0.5717736073147021, 'colsample_bytree': 0.5034580104822282, 'max_depth': 4, 'min_child_weight': 10, 'eta': 0.12808743307059367, 'gamma': 1.0025740472920486, 'rate_drop': 5.452279747255643e-05, 'skip_drop': 0.001546332482467548}. Best is trial 30 with value: -1.026246217486369.
[I 2025-06-20 12:00:05,618] Trial 37 finished with value: -1.140516845704387 and parameters: {'booster': 'dart', 'lambda': 0.0011509981480920923, 'alpha': 0.002568484541901538, 'subsample': 0.5391399858931293, 'colsample_bytree': 0.544531037514974, 'max_depth': 5, 'min_child_weight': 10, 'eta': 0.16232579509727482, 'gamma': 0.9933418653387696, 'rate_drop': 0.000459273612475343, 'skip_drop': 0.034702668489642555}. Best is trial 30 with value: -1.026246217486369.
[I 2025-06-20 12:00:14,597] Trial 38 finished with value: -1.059053172568734 and parameters: {'booster': 'dart', 'lambda': 0.007936927974359229, 'alpha': 0.0003415344334976055, 'subsample': 0.5998879710132138, 'colsample_bytree': 0.5577463749429246, 'max_depth': 4, 'min_child_weight': 10, 'eta': 0.08064686349067988, 'gamma': 1.0122074314871172, 'rate_drop': 5.206203933553866e-05, 'skip_drop': 0.00012330059964760974}. Best is trial 30 with value: -1.026246217486369.
[I 2025-06-20 12:00:19,420] Trial 39 finished with value: -1.0733489706870116 and parameters: {'booster': 'dart', 'lambda': 0.025966163489986906, 'alpha': 0.002880953051339425, 'subsample': 0.6010053257936964, 'colsample_bytree': 0.5464595027078005, 'max_depth': 4, 'min_child_weight': 9, 'eta': 0.0709660090907538, 'gamma': 1.4539212456767066, 'rate_drop': 0.0023159116098156935, 'skip_drop': 8.479479987054105e-05}. Best is trial 30 with value: -1.026246217486369.
[I 2025-06-20 12:00:20,433] Trial 40 finished with value: -1.0681158068815064 and parameters: {'booster': 'dart', 'lambda': 0.009773639763003971, 'alpha': 0.0002254987048613017, 'subsample': 0.6027561062412765, 'colsample_bytree': 0.5918248285227656, 'max_depth': 4, 'min_child_weight': 9, 'eta': 0.21297834504464475, 'gamma': 0.38671681003478486, 'rate_drop': 4.5709334658915514e-05, 'skip_drop': 4.294594673695089e-06}. Best is trial 30 with value: -1.026246217486369.
[I 2025-06-20 12:00:22,618] Trial 41 finished with value: -1.0525926667071317 and parameters: {'booster': 'dart', 'lambda': 0.031679323844373476, 'alpha': 0.00023009731449158814, 'subsample': 0.5982412024028063, 'colsample_bytree': 0.5882797945470541, 'max_depth': 4, 'min_child_weight': 9, 'eta': 0.2401318322539791, 'gamma': 0.29488867036061217, 'rate_drop': 3.2906824566549134e-05, 'skip_drop': 3.204014604473792e-06}. Best is trial 30 with value: -1.026246217486369.
[I 2025-06-20 12:00:24,301] Trial 42 finished with value: -1.112009106558611 and parameters: {'booster': 'dart', 'lambda': 0.14012288118969907, 'alpha': 0.00022903813545373046, 'subsample': 0.6090341047996579, 'colsample_bytree': 0.6012739467615982, 'max_depth': 4, 'min_child_weight': 10, 'eta': 0.24884451438401953, 'gamma': 0.2877275249038608, 'rate_drop': 1.764373757778286e-05, 'skip_drop': 4.994969569653718e-06}. Best is trial 30 with value: -1.026246217486369.
[I 2025-06-20 12:00:25,973] Trial 43 finished with value: -1.138194075500812 and parameters: {'booster': 'dart', 'lambda': 0.013263315091038726, 'alpha': 7.512859618579134e-05, 'subsample': 0.5929216220667654, 'colsample_bytree': 0.6322759413212965, 'max_depth': 4, 'min_child_weight': 9, 'eta': 0.23048487273946647, 'gamma': 0.562876554989786, 'rate_drop': 0.00017146136662931144, 'skip_drop': 5.712140102243711e-06}. Best is trial 30 with value: -1.026246217486369.
[I 2025-06-20 12:00:27,007] Trial 44 finished with value: -1.1660299458034091 and parameters: {'booster': 'dart', 'lambda': 0.0987212652132516, 'alpha': 1.4389736727038396e-05, 'subsample': 0.5360918658762768, 'colsample_bytree': 0.5662206440867079, 'max_depth': 5, 'min_child_weight': 10, 'eta': 0.17658085169523421, 'gamma': 0.4457894016044798, 'rate_drop': 6.677098951590226e-06, 'skip_drop': 0.00012747150839631706}. Best is trial 30 with value: -1.026246217486369.
[I 2025-06-20 12:00:31,398] Trial 45 finished with value: -1.088271842654552 and parameters: {'booster': 'dart', 'lambda': 0.6978064587645718, 'alpha': 0.008401845121799607, 'subsample': 0.642639605963746, 'colsample_bytree': 0.5853551212286828, 'max_depth': 3, 'min_child_weight': 9, 'eta': 0.09253169987050713, 'gamma': 0.7234324839301863, 'rate_drop': 3.22859573419531e-05, 'skip_drop': 3.2684452160214655e-06}. Best is trial 30 with value: -1.026246217486369.
[I 2025-06-20 12:00:35,027] Trial 46 finished with value: -1.0845897051489892 and parameters: {'booster': 'dart', 'lambda': 0.004238138346513102, 'alpha': 0.00032120709498003236, 'subsample': 0.5305530106994004, 'colsample_bytree': 0.5556152100394168, 'max_depth': 4, 'min_child_weight': 8, 'eta': 0.15441755290010498, 'gamma': 1.6055936957077936, 'rate_drop': 3.068765535837384e-06, 'skip_drop': 4.76414632842258e-05}. Best is trial 30 with value: -1.026246217486369.
[I 2025-06-20 12:00:38,444] Trial 47 finished with value: -1.271157461906365 and parameters: {'booster': 'dart', 'lambda': 0.8432499044000011, 'alpha': 0.06399920809522149, 'subsample': 0.5883814875177096, 'colsample_bytree': 0.665170573514888, 'max_depth': 3, 'min_child_weight': 10, 'eta': 0.27827845620955777, 'gamma': 0.17305674410809332, 'rate_drop': 0.47509731296891866, 'skip_drop': 0.00033703167150863386}. Best is trial 30 with value: -1.026246217486369.
