[I 2025-06-20 12:07:40,326] Trial 143 finished with value: -1.0744721868190972 and parameters: {'booster': 'dart', 'lambda': 0.00026894814779715795, 'alpha': 8.36911693960621e-06, 'subsample': 0.5161028440444846, 'colsample_bytree': 0.7398339122801173, 'max_depth': 4, 'min_child_weight': 10, 'eta': 0.07790371289219819, 'gamma': 1.6305887173777747, 'rate_drop': 4.215301509951818e-08, 'skip_drop': 0.000755962863304224}. Best is trial 118 with value: -1.0144065882993771.
[I 2025-06-20 12:07:46,859] Trial 144 finished with value: -1.0422204762431488 and parameters: {'booster': 'dart', 'lambda': 0.0009657814317773726, 'alpha': 1.5696283615330596e-05, 'subsample': 0.5561411937196231, 'colsample_bytree': 0.6846025326171453, 'max_depth': 4, 'min_child_weight': 9, 'eta': 0.09163502664956835, 'gamma': 2.3124775866706315, 'rate_drop': 7.898924560090192e-08, 'skip_drop': 0.0003294033293009141}. Best is trial 118 with value: -1.0144065882993771.
[I 2025-06-20 12:07:50,928] Trial 145 finished with value: -1.0710428851337712 and parameters: {'booster': 'dart', 'lambda': 0.0005267358594263176, 'alpha': 1.4466275725466227e-05, 'subsample': 0.5590277632851994, 'colsample_bytree': 0.752695150119063, 'max_depth': 4, 'min_child_weight': 9, 'eta': 0.09036306361631828, 'gamma': 2.3915796005111436, 'rate_drop': 2.787852924114849e-07, 'skip_drop': 0.00025600969370098725}. Best is trial 118 with value: -1.0144065882993771.
[I 2025-06-20 12:07:59,189] Trial 146 finished with value: -1.047052233919655 and parameters: {'booster': 'dart', 'lambda': 9.434873439244534, 'alpha': 4.644536974813172e-06, 'subsample': 0.5524373794721242, 'colsample_bytree': 0.7116687161009106, 'max_depth': 5, 'min_child_weight': 9, 'eta': 0.06332151183956014, 'gamma': 1.8052963943718323, 'rate_drop': 1.449348475651954e-07, 'skip_drop': 6.571792105506337e-07}. Best is trial 118 with value: -1.0144065882993771.
[I 2025-06-20 12:08:03,649] Trial 147 finished with value: -1.0477303462041783 and parameters: {'booster': 'dart', 'lambda': 0.0007300996397654681, 'alpha': 2.9644218761291586e-06, 'subsample': 0.5357944252569203, 'colsample_bytree': 0.6785725118938408, 'max_depth': 5, 'min_child_weight': 9, 'eta': 0.06797168717532166, 'gamma': 1.7796853791836795, 'rate_drop': 1.5777862297215557e-07, 'skip_drop': 5.646154293200757e-07}. Best is trial 118 with value: -1.0144065882993771.
[I 2025-06-20 12:08:08,228] Trial 148 finished with value: -1.0615420414646393 and parameters: {'booster': 'dart', 'lambda': 0.0015007766332720501, 'alpha': 2.2053474619978806e-06, 'subsample': 0.536695039675342, 'colsample_bytree': 0.6909818843721508, 'max_depth': 5, 'min_child_weight': 9, 'eta': 0.06641929348010366, 'gamma': 1.8138869645674223, 'rate_drop': 1.640121122273917e-07, 'skip_drop': 0.0003216601168782015}. Best is trial 118 with value: -1.0144065882993771.
[I 2025-06-20 12:08:16,413] Trial 149 finished with value: -1.0856132639463456 and parameters: {'booster': 'dart', 'lambda': 6.452169312371896, 'alpha': 2.4828012930067764e-06, 'subsample': 0.7420247815038884, 'colsample_bytree': 0.6786637702792355, 'max_depth': 6, 'min_child_weight': 8, 'eta': 0.04169115290471968, 'gamma': 2.5789688993432174, 'rate_drop': 7.717044379104461e-08, 'skip_drop': 1.1677575092046857e-06}. Best is trial 118 with value: -1.0144065882993771.
[I 2025-06-20 12:08:16,714] Trial 150 finished with value: -1.133056449952301 and parameters: {'booster': 'gbtree', 'lambda': 1.2133275249758293, 'alpha': 3.8374265852647055e-06, 'subsample': 0.5471242890064582, 'colsample_bytree': 0.6527829870350844, 'max_depth': 5, 'min_child_weight': 9, 'eta': 0.060871343525423775, 'gamma': 2.0243972658467175}. Best is trial 118 with value: -1.0144065882993771.
[I 2025-06-20 12:08:21,388] Trial 151 finished with value: -1.0723792246550148 and parameters: {'booster': 'dart', 'lambda': 0.0010964357164058173, 'alpha': 6.470446910335994e-06, 'subsample': 0.5518838749306413, 'colsample_bytree': 0.7109145873667273, 'max_depth': 6, 'min_child_weight': 9, 'eta': 0.07941434769919807, 'gamma': 2.259565779407286, 'rate_drop': 1.291014426349673e-07, 'skip_drop': 7.976900948410751e-07}. Best is trial 118 with value: -1.0144065882993771.
[I 2025-06-20 12:08:24,840] Trial 152 finished with value: -1.0429257627352677 and parameters: {'booster': 'dart', 'lambda': 0.0009320889981005589, 'alpha': 1.3911586138562885e-06, 'subsample': 0.5376691394019609, 'colsample_bytree': 0.6708588171524108, 'max_depth': 7, 'min_child_weight': 9, 'eta': 0.07185896567676411, 'gamma': 1.703035845816312, 'rate_drop': 2.1484630007643662e-07, 'skip_drop': 5.698457351336106e-07}. Best is trial 118 with value: -1.0144065882993771.
[I 2025-06-20 12:08:29,544] Trial 153 finished with value: -1.0623196715796568 and parameters: {'booster': 'dart', 'lambda': 0.0029671968431421647, 'alpha': 1.2823405263941965e-06, 'subsample': 0.5330661982403416, 'colsample_bytree': 0.6689008718779925, 'max_depth': 7, 'min_child_weight': 9, 'eta': 0.051668538691487124, 'gamma': 1.794711105742427, 'rate_drop': 2.011549903613435e-07, 'skip_drop': 4.807234218774014e-07}. Best is trial 118 with value: -1.0144065882993771.
[I 2025-06-20 12:08:33,424] Trial 154 finished with value: -1.0559183330538073 and parameters: {'booster': 'dart', 'lambda': 0.001072710297785108, 'alpha': 1.7709627354032784e-06, 'subsample': 0.5385539107106034, 'colsample_bytree': 0.6906351330580589, 'max_depth': 7, 'min_child_weight': 9, 'eta': 0.07067830257201985, 'gamma': 1.9022085424567288, 'rate_drop': 3.948295765853447e-07, 'skip_drop': 2.5132111960838375e-06}. Best is trial 118 with value: -1.0144065882993771.
[I 2025-06-20 12:08:37,987] Trial 155 finished with value: -1.0675269040862725 and parameters: {'booster': 'dart', 'lambda': 0.0006909798520064238, 'alpha': 1.0950516256561751e-06, 'subsample': 0.5226561787284055, 'colsample_bytree': 0.7209131062878937, 'max_depth': 7, 'min_child_weight': 9, 'eta': 0.06295140585943393, 'gamma': 1.3344122418784663, 'rate_drop': 8.601720940265244e-08, 'skip_drop': 3.887452065544588e-06}. Best is trial 118 with value: -1.0144065882993771.
[I 2025-06-20 12:08:42,927] Trial 156 finished with value: -1.0573479912836559 and parameters: {'booster': 'dart', 'lambda': 0.0040837430643789994, 'alpha': 7.922875229701178e-07, 'subsample': 0.6131079172269598, 'colsample_bytree': 0.7118011960176682, 'max_depth': 7, 'min_child_weight': 9, 'eta': 0.07384315487238464, 'gamma': 1.7057387106782071, 'rate_drop': 1.395211052111154e-06, 'skip_drop': 6.270652316700498e-07}. Best is trial 118 with value: -1.0144065882993771.
[I 2025-06-20 12:08:46,123] Trial 157 finished with value: -1.1068951894247163 and parameters: {'booster': 'dart', 'lambda': 0.0002830143003000762, 'alpha': 4.498330536637502e-06, 'subsample': 0.6277198108744387, 'colsample_bytree': 0.6779039882846417, 'max_depth': 6, 'min_child_weight': 8, 'eta': 0.08670438153448023, 'gamma': 1.5722089750332964, 'rate_drop': 6.781960845722193e-07, 'skip_drop': 1.8141871683907039e-06}. Best is trial 118 with value: -1.0144065882993771.
[I 2025-06-20 12:08:50,585] Trial 158 finished with value: -1.070353694764963 and parameters: {'booster': 'dart', 'lambda': 0.00037980284536303965, 'alpha': 5.045870687432706e-07, 'subsample': 0.5760582269130228, 'colsample_bytree': 0.6572994605576022, 'max_depth': 8, 'min_child_weight': 9, 'eta': 0.05670961020199443, 'gamma': 2.101828942888386, 'rate_drop': 2.4907393564991083e-07, 'skip_drop': 2.0902878484163438e-07}. Best is trial 118 with value: -1.0144065882993771.
[I 2025-06-20 12:08:55,669] Trial 159 finished with value: -1.1223277323428091 and parameters: {'booster': 'dart', 'lambda': 0.0015575373606786958, 'alpha': 0.00015477670348602282, 'subsample': 0.5517776008466124, 'colsample_bytree': 0.7057937462150841, 'max_depth': 5, 'min_child_weight': 9, 'eta': 0.09395471750649108, 'gamma': 3.285915475970505, 'rate_drop': 5.427610339078827e-08, 'skip_drop': 0.004329821403577424}. Best is trial 118 with value: -1.0144065882993771.
[I 2025-06-20 12:08:58,763] Trial 160 finished with value: -1.1028702686907774 and parameters: {'booster': 'dart', 'lambda': 0.000794299828176541, 'alpha': 2.963267666624146e-06, 'subsample': 0.6412688231734166, 'colsample_bytree': 0.6898648674484504, 'max_depth': 5, 'min_child_weight': 9, 'eta': 0.07046040392791028, 'gamma': 1.4277897603620802, 'rate_drop': 1.6291781901501994e-07, 'skip_drop': 0.00018295703342996618}. Best is trial 118 with value: -1.0144065882993771.
[I 2025-06-20 12:09:07,404] Trial 161 finished with value: -1.0280538088086322 and parameters: {'booster': 'dart', 'lambda': 6.576110850385866e-05, 'alpha': 3.983145160331336e-05, 'subsample': 0.5635677760426151, 'colsample_bytree': 0.6709150912529277, 'max_depth': 4, 'min_child_weight': 9, 'eta': 0.08280251336662008, 'gamma': 1.6828562079997529, 'rate_drop': 1.0112718799533394e-07, 'skip_drop': 7.487302403245254e-07}. Best is trial 118 with value: -1.0144065882993771.
[I 2025-06-20 12:09:16,233] Trial 162 finished with value: -1.0413770386962793 and parameters: {'booster': 'dart', 'lambda': 5.851399467389883e-05, 'alpha': 4.5183215026248595e-05, 'subsample': 0.5669338191583937, 'colsample_bytree': 0.6318369731743532, 'max_depth': 4, 'min_child_weight': 9, 'eta': 0.08252619685043011, 'gamma': 1.8326029073201235, 'rate_drop': 1.0408477597879506e-07, 'skip_drop': 6.746311739986775e-07}. Best is trial 118 with value: -1.0144065882993771.
[I 2025-06-20 12:09:25,461] Trial 163 finished with value: -1.0417180117030727 and parameters: {'booster': 'dart', 'lambda': 4.418669380556939e-05, 'alpha': 1.2657540722610463e-08, 'subsample': 0.569550376587228, 'colsample_bytree': 0.6363653000841053, 'max_depth': 4, 'min_child_weight': 9, 'eta': 0.07736736468768747, 'gamma': 1.8467703818201757, 'rate_drop': 1.0177213450119977e-07, 'skip_drop': 8.108748334045867e-07}. Best is trial 118 with value: -1.0144065882993771.
[I 2025-06-20 12:09:30,636] Trial 164 finished with value: -1.0698938602725985 and parameters: {'booster': 'dart', 'lambda': 6.589620840969205e-05, 'alpha': 1.0078575896886984e-08, 'subsample': 0.5660271355431197, 'colsample_bytree': 0.6369555133943335, 'max_depth': 4, 'min_child_weight': 8, 'eta': 0.08048866434753754, 'gamma': 1.8577427866861176, 'rate_drop': 1.1225631693155492e-07, 'skip_drop': 9.027414822164867e-07}. Best is trial 118 with value: -1.0144065882993771.
[I 2025-06-20 12:09:36,511] Trial 165 finished with value: -1.0581767685215562 and parameters: {'booster': 'dart', 'lambda': 4.28168977661243e-05, 'alpha': 4.812821052780746e-05, 'subsample': 0.5420300188751433, 'colsample_bytree': 0.6677341457855152, 'max_depth': 4, 'min_child_weight': 9, 'eta': 0.06422566494320463, 'gamma': 1.9882713909123306, 'rate_drop': 6.09036043521082e-08, 'skip_drop': 0.1186781804567106}. Best is trial 118 with value: -1.0144065882993771.
[I 2025-06-20 12:09:41,481] Trial 166 finished with value: -1.0425618425982612 and parameters: {'booster': 'dart', 'lambda': 8.5450122338118e-05, 'alpha': 1.6129132253429982e-08, 'subsample': 0.530647900101522, 'colsample_bytree': 0.6500453692105944, 'max_depth': 4, 'min_child_weight': 9, 'eta': 0.07432104676240828, 'gamma': 2.281403735715656, 'rate_drop': 1.2588859101518224e-07, 'skip_drop': 1.4587035495611286e-06}. Best is trial 118 with value: -1.0144065882993771.
[I 2025-06-20 12:09:50,542] Trial 167 finished with value: -1.0713913427620931 and parameters: {'booster': 'dart', 'lambda': 0.00021295374694379706, 'alpha': 6.079445716878083e-08, 'subsample': 0.5308180609307818, 'colsample_bytree': 0.6533637813240567, 'max_depth': 4, 'min_child_weight': 9, 'eta': 0.05078250689866893, 'gamma': 2.2831616216868844, 'rate_drop': 1.1930036086024515e-07, 'skip_drop': 1.0522927769942472e-06}. Best is trial 118 with value: -1.0144065882993771.
[I 2025-06-20 12:09:54,556] Trial 168 finished with value: -1.0888924645235538 and parameters: {'booster': 'dart', 'lambda': 0.00010895404976462118, 'alpha': 3.7286781584278555e-05, 'subsample': 0.517491802980018, 'colsample_bytree': 0.6441843070613842, 'max_depth': 4, 'min_child_weight': 9, 'eta': 0.07444295298920953, 'gamma': 2.5421892132389154, 'rate_drop': 5.47006133151362e-08, 'skip_drop': 4.1147388596519545e-07}. Best is trial 118 with value: -1.0144065882993771.
[I 2025-06-20 12:09:59,340] Trial 169 finished with value: -1.088326473044899 and parameters: {'booster': 'dart', 'lambda': 6.31093623379613e-05, 'alpha': 1.3555704209488688e-07, 'subsample': 0.5536875014288645, 'colsample_bytree': 0.6194312508972528, 'max_depth': 4, 'min_child_weight': 9, 'eta': 0.059274080088011355, 'gamma': 2.1572176453881355, 'rate_drop': 8.227156439099777e-08, 'skip_drop': 7.401505844103742e-07}. Best is trial 118 with value: -1.0144065882993771.
[I 2025-06-20 12:10:03,983] Trial 170 finished with value: -1.1006318846770116 and parameters: {'booster': 'dart', 'lambda': 4.15535686776246e-05, 'alpha': 2.371602364566192e-08, 'subsample': 0.584088638552373, 'colsample_bytree': 0.6309413642009829, 'max_depth': 4, 'min_child_weight': 9, 'eta': 0.08196031208701705, 'gamma': 1.7692207787114422, 'rate_drop': 2.7190342133899842e-08, 'skip_drop': 1.4362103013511762e-06}. Best is trial 118 with value: -1.0144065882993771.
[I 2025-06-20 12:10:12,669] Trial 171 finished with value: -1.02524246569832 and parameters: {'booster': 'dart', 'lambda': 9.212564316401084e-05, 'alpha': 2.5096500631814782e-08, 'subsample': 0.5715960139497542, 'colsample_bytree': 0.6726329166191207, 'max_depth': 4, 'min_child_weight': 9, 'eta': 0.09378678894177522, 'gamma': 1.871583373913639, 'rate_drop': 1.4535746376796465e-07, 'skip_drop': 6.141610421120956e-07}. Best is trial 118 with value: -1.0144065882993771.
[I 2025-06-20 12:10:18,988] Trial 172 finished with value: -1.052143803543131 and parameters: {'booster': 'dart', 'lambda': 8.428998028190246e-05, 'alpha': 1.8247705586586278e-08, 'subsample': 0.5699117059829845, 'colsample_bytree': 0.6638141587876417, 'max_depth': 4, 'min_child_weight': 9, 'eta': 0.09415488261832902, 'gamma': 2.665159578155432, 'rate_drop': 1.4306575932939353e-07, 'skip_drop': 7.132201913022001e-07}. Best is trial 118 with value: -1.0144065882993771.
[I 2025-06-20 12:10:23,371] Trial 173 finished with value: -1.0696165084376104 and parameters: {'booster': 'dart', 'lambda': 0.0004556454497799014, 'alpha': 3.439469604975699e-08, 'subsample': 0.5410466769532529, 'colsample_bytree': 0.6737177360019965, 'max_depth': 4, 'min_child_weight': 9, 'eta': 0.06879121061172329, 'gamma': 1.8891551689649835, 'rate_drop': 2.3123904489680907e-07, 'skip_drop': 6.268334489329063e-07}. Best is trial 118 with value: -1.0144065882993771.
[I 2025-06-20 12:10:31,930] Trial 174 finished with value: -1.2822209544701924 and parameters: {'booster': 'dart', 'lambda': 0.00018029662232564364, 'alpha': 1.46717212991671e-08, 'subsample': 0.5560146205433439, 'colsample_bytree': 0.6936035285727017, 'max_depth': 4, 'min_child_weight': 9, 'eta': 0.006057081599183094, 'gamma': 2.024430351105537, 'rate_drop': 8.723221083822055e-08, 'skip_drop': 4.8624966179796e-07}. Best is trial 118 with value: -1.0144065882993771.
[I 2025-06-20 12:10:36,415] Trial 175 finished with value: -1.0375842046006112 and parameters: {'booster': 'dart', 'lambda': 0.00010752966279598844, 'alpha': 6.010889913477009e-08, 'subsample': 0.5311605513642773, 'colsample_bytree': 0.6532137598196252, 'max_depth': 4, 'min_child_weight': 9, 'eta': 0.08432122452871953, 'gamma': 1.7745065535892155, 'rate_drop': 2.9427761604412247e-07, 'skip_drop': 1.4491038261433302e-06}. Best is trial 118 with value: -1.0144065882993771.
[I 2025-06-20 12:10:40,608] Trial 176 finished with value: -1.0409913848523011 and parameters: {'booster': 'dart', 'lambda': 0.0001127004148653003, 'alpha': 1.9582962727941983e-08, 'subsample': 0.5019462982787481, 'colsample_bytree': 0.6545741295045261, 'max_depth': 4, 'min_child_weight': 9, 'eta': 0.08484344798588953, 'gamma': 1.7444921397202873, 'rate_drop': 3.104740958279697e-07, 'skip_drop': 1.1904320239435431e-06}. Best is trial 118 with value: -1.0144065882993771.
[I 2025-06-20 12:10:44,516] Trial 177 finished with value: -1.067559617014342 and parameters: {'booster': 'dart', 'lambda': 0.00010411573560293195, 'alpha': 4.2738697636305234e-08, 'subsample': 0.5135322172405907, 'colsample_bytree': 0.6454392347967534, 'max_depth': 4, 'min_child_weight': 9, 'eta': 0.08780630600416238, 'gamma': 1.9412432367460335, 'rate_drop': 3.3226886703564655e-07, 'skip_drop': 1.4879083993039203e-06}. Best is trial 118 with value: -1.0144065882993771.
[I 2025-06-20 12:10:48,384] Trial 178 finished with value: -1.0813930081836427 and parameters: {'booster': 'dart', 'lambda': 4.777356143567044e-05, 'alpha': 2.114065955814218e-08, 'subsample': 0.5053194542625019, 'colsample_bytree': 0.6287962037521146, 'max_depth': 4, 'min_child_weight': 8, 'eta': 0.09756154281739642, 'gamma': 1.7179043794742839, 'rate_drop': 2.2323689684941046e-07, 'skip_drop': 2.548196580206851e-06}. Best is trial 118 with value: -1.0144065882993771.
[I 2025-06-20 12:10:56,940] Trial 179 finished with value: -1.022524092196768 and parameters: {'booster': 'dart', 'lambda': 7.548078239969839e-05, 'alpha': 9.520651285970021e-08, 'subsample': 0.5218338100081392, 'colsample_bytree': 0.65904682649995, 'max_depth': 4, 'min_child_weight': 9, 'eta': 0.07791730695878518, 'gamma': 2.320879424651082, 'rate_drop': 5.387425677597653e-07, 'skip_drop': 1.2055400498187698e-06}. Best is trial 118 with value: -1.0144065882993771.
[I 2025-06-20 12:11:05,640] Trial 180 finished with value: -1.166494375418678 and parameters: {'booster': 'dart', 'lambda': 7.784165743689384e-05, 'alpha': 7.749803175661463e-08, 'subsample': 0.503234999369759, 'colsample_bytree': 0.6600733187217943, 'max_depth': 4, 'min_child_weight': 9, 'eta': 0.014505296204461476, 'gamma': 2.44056142492418, 'rate_drop': 5.651877480303745e-07, 'skip_drop': 6.917401155439143e-06}. Best is trial 118 with value: -1.0144065882993771.
[I 2025-06-20 12:11:13,948] Trial 181 finished with value: -1.0524425489823273 and parameters: {'booster': 'dart', 'lambda': 0.00013350126479708384, 'alpha': 8.903575510560524e-08, 'subsample': 0.5291878998926797, 'colsample_bytree': 0.6480228130124377, 'max_depth': 4, 'min_child_weight': 9, 'eta': 0.07710500694282248, 'gamma': 2.2526433442436806, 'rate_drop': 3.1632275026121944e-07, 'skip_drop': 1.0348028659605175e-06}. Best is trial 118 with value: -1.0144065882993771.
[I 2025-06-20 12:11:23,045] Trial 182 finished with value: -1.0264500613089085 and parameters: {'booster': 'dart', 'lambda': 0.0002485235155902803, 'alpha': 3.8922170441862384e-08, 'subsample': 0.5264948663378985, 'colsample_bytree': 0.6620100239595589, 'max_depth': 4, 'min_child_weight': 9, 'eta': 0.08519064729786269, 'gamma': 2.3403043583783942, 'rate_drop': 1.093670122480016e-07, 'skip_drop': 1.8377579459561602e-06}. Best is trial 118 with value: -1.0144065882993771.
[I 2025-06-20 12:11:26,465] Trial 183 finished with value: -1.0779282426180485 and parameters: {'booster': 'dart', 'lambda': 0.0002806478895646256, 'alpha': 4.5060777344792895e-08, 'subsample': 0.5219741459720536, 'colsample_bytree': 0.6618984684547659, 'max_depth': 4, 'min_child_weight': 9, 'eta': 0.08279848883193897, 'gamma': 2.321818282752152, 'rate_drop': 9.154247292846216e-08, 'skip_drop': 1.5043377766473356e-06}. Best is trial 118 with value: -1.0144065882993771.
[I 2025-06-20 12:11:31,182] Trial 184 finished with value: -1.042670266290086 and parameters: {'booster': 'dart', 'lambda': 0.000179816158150496, 'alpha': 2.775864784451374e-08, 'subsample': 0.5166666599342908, 'colsample_bytree': 0.6694768047528045, 'max_depth': 4, 'min_child_weight': 9, 'eta': 0.10556276621885156, 'gamma': 2.093629005133386, 'rate_drop': 4.1826570890441536e-08, 'skip_drop': 1.0621337452013885e-06}. Best is trial 118 with value: -1.0144065882993771.
[I 2025-06-20 12:11:33,701] Trial 185 finished with value: -1.1116581816352447 and parameters: {'booster': 'dart', 'lambda': 0.00019083430645032575, 'alpha': 2.474396292668772e-08, 'subsample': 0.5187709985067487, 'colsample_bytree': 0.6398645227977546, 'max_depth': 4, 'min_child_weight': 9, 'eta': 0.11209015548340016, 'gamma': 2.178280083063059, 'rate_drop': 4.574955205980185e-08, 'skip_drop': 3.0856959692435987e-06}. Best is trial 118 with value: -1.0144065882993771.
[I 2025-06-20 12:11:42,286] Trial 186 finished with value: -1.0535696505087357 and parameters: {'booster': 'dart', 'lambda': 6.2760990607341e-05, 'alpha': 1.2291911603260756e-08, 'subsample': 0.5009759661817471, 'colsample_bytree': 0.6521194559881708, 'max_depth': 4, 'min_child_weight': 9, 'eta': 0.12417978393685593, 'gamma': 2.3090621768631086, 'rate_drop': 7.012199364274607e-08, 'skip_drop': 1.6759751162631067e-06}. Best is trial 118 with value: -1.0144065882993771.
[I 2025-06-20 12:11:45,625] Trial 187 finished with value: -1.1153621485596594 and parameters: {'booster': 'dart', 'lambda': 0.00010349307361316138, 'alpha': 4.982437071572637e-08, 'subsample': 0.5158697333949174, 'colsample_bytree': 0.6821660452423494, 'max_depth': 4, 'min_child_weight': 9, 'eta': 0.09816692821918714, 'gamma': 2.4698339516155667, 'rate_drop': 3.298632631861899e-08, 'skip_drop': 1.1232157355909754e-06}. Best is trial 118 with value: -1.0144065882993771.
[I 2025-06-20 12:11:50,100] Trial 188 finished with value: -1.0350032530032736 and parameters: {'booster': 'dart', 'lambda': 0.00015816214861155684, 'alpha': 1.7253109007799345e-07, 'subsample': 0.5292945107819197, 'colsample_bytree': 0.6399694124866736, 'max_depth': 4, 'min_child_weight': 9, 'eta': 0.08635701274578289, 'gamma': 2.05162225624594, 'rate_drop': 4.775064630851359e-07, 'skip_drop': 2.20655776165118e-06}. Best is trial 118 with value: -1.0144065882993771.
