[I 2025-06-20 12:23:23,205] Trial 327 finished with value: -1.0994821858734791 and parameters: {'booster': 'dart', 'lambda': 3.7098431209801473e-06, 'alpha': 1.3450652363783015e-07, 'subsample': 0.5112789764074015, 'colsample_bytree': 0.7178714534600861, 'max_depth': 4, 'min_child_weight': 9, 'eta': 0.10474997882610633, 'gamma': 1.9183494860836452, 'rate_drop': 1.1625923134188958e-07, 'skip_drop': 1.0634297442396984e-06}. Best is trial 205 with value: -1.007585085076739.
[I 2025-06-20 12:23:28,152] Trial 328 finished with value: -1.073238149999547 and parameters: {'booster': 'dart', 'lambda': 4.301947162366249e-05, 'alpha': 5.6837758959643024e-08, 'subsample': 0.6071835087740904, 'colsample_bytree': 0.656142258894878, 'max_depth': 3, 'min_child_weight': 10, 'eta': 0.0891694583140546, 'gamma': 2.4373081153485465, 'rate_drop': 1.3824559463707373e-05, 'skip_drop': 2.9104395958855237e-06}. Best is trial 205 with value: -1.007585085076739.
[I 2025-06-20 12:23:30,995] Trial 329 finished with value: -1.109616260778544 and parameters: {'booster': 'dart', 'lambda': 2.686061103047205e-05, 'alpha': 2.3594838998106354e-08, 'subsample': 0.5959778204642073, 'colsample_bytree': 0.6720330407859575, 'max_depth': 10, 'min_child_weight': 8, 'eta': 0.12008877076352617, 'gamma': 2.5728955637082738, 'rate_drop': 2.218053663782708e-07, 'skip_drop': 6.958071362744988e-05}. Best is trial 205 with value: -1.007585085076739.
[I 2025-06-20 12:23:35,580] Trial 330 finished with value: -1.0755580983365038 and parameters: {'booster': 'dart', 'lambda': 0.00016847216203393493, 'alpha': 0.006194171996975386, 'subsample': 0.5233189033347618, 'colsample_bytree': 0.6983992052424277, 'max_depth': 4, 'min_child_weight': 9, 'eta': 0.07349270036413039, 'gamma': 1.6928464333817266, 'rate_drop': 0.00013697837079461607, 'skip_drop': 8.037325092006433e-08}. Best is trial 205 with value: -1.007585085076739.
[I 2025-06-20 12:23:35,835] Trial 331 finished with value: -1.152091842310205 and parameters: {'booster': 'gbtree', 'lambda': 0.0006565640064874164, 'alpha': 1.2453629230786898e-08, 'subsample': 0.5479189436563889, 'colsample_bytree': 0.6634773679817795, 'max_depth': 4, 'min_child_weight': 9, 'eta': 0.09662431755527821, 'gamma': 1.485805515462792}. Best is trial 205 with value: -1.007585085076739.
[I 2025-06-20 12:23:38,188] Trial 332 finished with value: -1.1065620379476677 and parameters: {'booster': 'dart', 'lambda': 6.510759003540038e-05, 'alpha': 0.02816194186755566, 'subsample': 0.5359382012038911, 'colsample_bytree': 0.685103637565595, 'max_depth': 6, 'min_child_weight': 9, 'eta': 0.14697233076404784, 'gamma': 1.8424084806344037, 'rate_drop': 4.6614048275048614e-07, 'skip_drop': 3.6138620624591105e-05}. Best is trial 205 with value: -1.007585085076739.
[I 2025-06-20 12:23:44,155] Trial 333 finished with value: -1.078220669046225 and parameters: {'booster': 'dart', 'lambda': 7.193040164153527e-08, 'alpha': 6.813209681283961e-08, 'subsample': 0.9155403636334543, 'colsample_bytree': 0.6786866365412011, 'max_depth': 4, 'min_child_weight': 9, 'eta': 0.057494010528725, 'gamma': 1.7416255004300585, 'rate_drop': 3.3166616857228084e-07, 'skip_drop': 1.5144722100650382e-06}. Best is trial 205 with value: -1.007585085076739.
[I 2025-06-20 12:23:51,136] Trial 334 finished with value: -1.0435092818113256 and parameters: {'booster': 'dart', 'lambda': 1.7181706378119538e-08, 'alpha': 3.952796689509675e-08, 'subsample': 0.512109729001698, 'colsample_bytree': 0.7185209772771385, 'max_depth': 4, 'min_child_weight': 10, 'eta': 0.0821271489092172, 'gamma': 2.4765570821866474, 'rate_drop': 6.340562074943947e-06, 'skip_drop': 8.398776317095708e-07}. Best is trial 205 with value: -1.007585085076739.
[I 2025-06-20 12:23:53,281] Trial 335 finished with value: -1.0804070034204327 and parameters: {'booster': 'dart', 'lambda': 9.18930102758661e-05, 'alpha': 0.018758043502092654, 'subsample': 0.5649235303126887, 'colsample_bytree': 0.7098875884238055, 'max_depth': 5, 'min_child_weight': 9, 'eta': 0.10968467273491854, 'gamma': 2.649753596660222, 'rate_drop': 1.7307185561777846e-07, 'skip_drop': 5.087311012302806e-07}. Best is trial 205 with value: -1.007585085076739.
[I 2025-06-20 12:24:00,704] Trial 336 finished with value: -1.063833915867812 and parameters: {'booster': 'dart', 'lambda': 0.0003408952655958572, 'alpha': 2.2799587063636857e-08, 'subsample': 0.5299073295468749, 'colsample_bytree': 0.6464433830773608, 'max_depth': 8, 'min_child_weight': 9, 'eta': 0.06690338577970004, 'gamma': 1.5882171057510979, 'rate_drop': 7.451309884395505e-08, 'skip_drop': 3.6274096320342913e-07}. Best is trial 205 with value: -1.007585085076739.
[I 2025-06-20 12:24:09,390] Trial 337 finished with value: -1.1150225682731103 and parameters: {'booster': 'dart', 'lambda': 0.00020133004600835858, 'alpha': 6.80726964468637e-07, 'subsample': 0.585514483010154, 'colsample_bytree': 0.692558628181835, 'max_depth': 4, 'min_child_weight': 9, 'eta': 0.032386166040161875, 'gamma': 1.0687914754084182, 'rate_drop': 5.910344385043476e-07, 'skip_drop': 0.02083958420519379}. Best is trial 205 with value: -1.007585085076739.
[I 2025-06-20 12:24:13,775] Trial 338 finished with value: -1.0479971460151893 and parameters: {'booster': 'dart', 'lambda': 0.0001255145076846671, 'alpha': 2.9738789338341706e-07, 'subsample': 0.5432825264788409, 'colsample_bytree': 0.670256474045279, 'max_depth': 4, 'min_child_weight': 8, 'eta': 0.09455172317163711, 'gamma': 2.3557978219306883, 'rate_drop': 2.5834488186100957e-07, 'skip_drop': 3.6192989794766284e-06}. Best is trial 205 with value: -1.007585085076739.
[I 2025-06-20 12:24:22,313] Trial 339 finished with value: -1.0528316566883245 and parameters: {'booster': 'dart', 'lambda': 4.7942726702654184e-05, 'alpha': 0.0033881571471092984, 'subsample': 0.5729919335831188, 'colsample_bytree': 0.7033892127909422, 'max_depth': 4, 'min_child_weight': 9, 'eta': 0.1263377589780102, 'gamma': 2.8127188756177746, 'rate_drop': 9.446041269691438e-08, 'skip_drop': 5.952766602063144e-07}. Best is trial 205 with value: -1.007585085076739.
[I 2025-06-20 12:24:26,992] Trial 340 finished with value: -1.0571802043435052 and parameters: {'booster': 'dart', 'lambda': 2.074944086210451e-05, 'alpha': 4.6912754285423665e-08, 'subsample': 0.521495809776001, 'colsample_bytree': 0.6597843655093178, 'max_depth': 4, 'min_child_weight': 9, 'eta': 0.08734994562969016, 'gamma': 1.9347549513743347, 'rate_drop': 9.571053031100984e-07, 'skip_drop': 1.1324230999837134e-06}. Best is trial 205 with value: -1.007585085076739.
[I 2025-06-20 12:24:31,878] Trial 341 finished with value: -1.0836966132620955 and parameters: {'booster': 'dart', 'lambda': 2.9674181180766768e-05, 'alpha': 1.1337867367540688e-07, 'subsample': 0.6962756992087296, 'colsample_bytree': 0.6792691216616593, 'max_depth': 4, 'min_child_weight': 10, 'eta': 0.07448910035182868, 'gamma': 1.6789812473053307, 'rate_drop': 4.0440195320317645e-07, 'skip_drop': 0.0031190254541841544}. Best is trial 205 with value: -1.007585085076739.
[I 2025-06-20 12:24:38,871] Trial 342 finished with value: -1.0383758369612588 and parameters: {'booster': 'dart', 'lambda': 1.8131703549431723e-07, 'alpha': 0.04390416346046573, 'subsample': 0.5539971637079449, 'colsample_bytree': 0.7241240738281806, 'max_depth': 4, 'min_child_weight': 9, 'eta': 0.10576800661935476, 'gamma': 0.6981828190758477, 'rate_drop': 1.3634362065435467e-07, 'skip_drop': 1.5521930864293507e-06}. Best is trial 205 with value: -1.007585085076739.
[I 2025-06-20 12:24:43,288] Trial 343 finished with value: -1.0518344729466802 and parameters: {'booster': 'dart', 'lambda': 7.685532064001336e-05, 'alpha': 0.0004036287037299294, 'subsample': 0.5331493431540489, 'colsample_bytree': 0.6900823442435531, 'max_depth': 4, 'min_child_weight': 9, 'eta': 0.08174866839539557, 'gamma': 1.377429936033786, 'rate_drop': 3.0365728779051654e-07, 'skip_drop': 0.001263554338708942}. Best is trial 205 with value: -1.007585085076739.
[I 2025-06-20 12:24:47,322] Trial 344 finished with value: -1.0603560446153928 and parameters: {'booster': 'dart', 'lambda': 0.0002568790130106966, 'alpha': 1.4340851435017912e-08, 'subsample': 0.5416968033658224, 'colsample_bytree': 0.6721403786757816, 'max_depth': 4, 'min_child_weight': 9, 'eta': 0.09707224549765257, 'gamma': 1.8039024271261899, 'rate_drop': 2.432752181781146e-05, 'skip_drop': 7.455447042655764e-07}. Best is trial 205 with value: -1.007585085076739.
[I 2025-06-20 12:24:55,788] Trial 345 finished with value: -1.070134936499831 and parameters: {'booster': 'dart', 'lambda': 4.505968779302503e-08, 'alpha': 0.010653592646835327, 'subsample': 0.5115505645231074, 'colsample_bytree': 0.7127318462256587, 'max_depth': 3, 'min_child_weight': 9, 'eta': 0.06633318175742468, 'gamma': 1.5550509220634838, 'rate_drop': 6.285862692812234e-07, 'skip_drop': 5.634564200356328e-08}. Best is trial 205 with value: -1.007585085076739.
[I 2025-06-20 12:24:59,795] Trial 346 finished with value: -1.0556113559246258 and parameters: {'booster': 'dart', 'lambda': 0.0004953752741020629, 'alpha': 1.0139280005743506e-08, 'subsample': 0.5264334866805733, 'colsample_bytree': 0.6934965848241847, 'max_depth': 4, 'min_child_weight': 10, 'eta': 0.11259305890052994, 'gamma': 2.049129985617695, 'rate_drop': 1.5437862401005932e-06, 'skip_drop': 2.131591238874975e-06}. Best is trial 205 with value: -1.007585085076739.
[I 2025-06-20 12:25:02,152] Trial 347 finished with value: -1.0888104095556348 and parameters: {'booster': 'dart', 'lambda': 0.00014782113209096774, 'alpha': 3.010145656599891e-08, 'subsample': 0.5573908696810045, 'colsample_bytree': 0.6611937412062026, 'max_depth': 4, 'min_child_weight': 8, 'eta': 0.13319634907086034, 'gamma': 2.554359370926291, 'rate_drop': 0.0002217688293782548, 'skip_drop': 2.046164221191597e-07}. Best is trial 205 with value: -1.007585085076739.
[I 2025-06-20 12:25:07,134] Trial 348 finished with value: -1.140389156826505 and parameters: {'booster': 'dart', 'lambda': 1.0231058533992338e-08, 'alpha': 6.317198885988191e-08, 'subsample': 0.6071909299023689, 'colsample_bytree': 0.6493529333412628, 'max_depth': 4, 'min_child_weight': 2, 'eta': 0.08943678879792218, 'gamma': 1.7386847884891812, 'rate_drop': 1.8735573564989094e-07, 'skip_drop': 0.002225322746865015}. Best is trial 205 with value: -1.007585085076739.
[I 2025-06-20 12:25:13,610] Trial 349 finished with value: -1.059579480023618 and parameters: {'booster': 'dart', 'lambda': 4.231322193195621e-05, 'alpha': 0.005835869882109787, 'subsample': 0.8117371312484527, 'colsample_bytree': 0.7035494667843553, 'max_depth': 5, 'min_child_weight': 9, 'eta': 0.0728639807016783, 'gamma': 2.352287532529698, 'rate_drop': 4.5422338189718983e-07, 'skip_drop': 4.0069379944219497e-07}. Best is trial 205 with value: -1.007585085076739.
[I 2025-06-20 12:25:13,860] Trial 350 finished with value: -1.170837545602876 and parameters: {'booster': 'gbtree', 'lambda': 0.00011020618786766205, 'alpha': 3.9476281810962786e-08, 'subsample': 0.5445582079848246, 'colsample_bytree': 0.6871571769687073, 'max_depth': 4, 'min_child_weight': 9, 'eta': 0.10022334684130596, 'gamma': 1.4636532502886301}. Best is trial 205 with value: -1.007585085076739.
[I 2025-06-20 12:25:18,683] Trial 351 finished with value: -1.046299796552668 and parameters: {'booster': 'dart', 'lambda': 5.495452249720163e-05, 'alpha': 2.082398499621233e-08, 'subsample': 0.6196419331921672, 'colsample_bytree': 0.6818780439743157, 'max_depth': 4, 'min_child_weight': 9, 'eta': 0.08072982147475241, 'gamma': 1.8956519907992202, 'rate_drop': 9.919958910017614e-08, 'skip_drop': 0.0008532079669989855}. Best is trial 205 with value: -1.007585085076739.
[I 2025-06-20 12:25:22,379] Trial 352 finished with value: -1.0842399183620237 and parameters: {'booster': 'dart', 'lambda': 0.00022759437420822999, 'alpha': 0.01998176385019544, 'subsample': 0.5935885179522945, 'colsample_bytree': 0.5830645318298293, 'max_depth': 3, 'min_child_weight': 8, 'eta': 0.14650670214133435, 'gamma': 1.6633128771587578, 'rate_drop': 8.509386310969363e-05, 'skip_drop': 9.866870773405183e-07}. Best is trial 205 with value: -1.007585085076739.
[I 2025-06-20 12:25:25,154] Trial 353 finished with value: -1.1272274528093844 and parameters: {'booster': 'dart', 'lambda': 1.7841367777334158e-08, 'alpha': 1.0116369859041699e-07, 'subsample': 0.521704832476381, 'colsample_bytree': 0.7243705665994866, 'max_depth': 4, 'min_child_weight': 9, 'eta': 0.16177660136479474, 'gamma': 2.4551847451933932, 'rate_drop': 9.321222246493324e-07, 'skip_drop': 8.486757511424393e-06}. Best is trial 205 with value: -1.007585085076739.
[I 2025-06-20 12:25:27,785] Trial 354 finished with value: -1.0936086321420522 and parameters: {'booster': 'dart', 'lambda': 9.240703134754677e-07, 'alpha': 0.00016611989867907682, 'subsample': 0.5706383306090407, 'colsample_bytree': 0.670130927550525, 'max_depth': 4, 'min_child_weight': 9, 'eta': 0.11823215376939801, 'gamma': 2.9619856563341225, 'rate_drop': 2.4101061316931e-07, 'skip_drop': 6.640340516422309e-07}. Best is trial 205 with value: -1.007585085076739.
[I 2025-06-20 12:25:34,639] Trial 355 finished with value: -1.08346636107674 and parameters: {'booster': 'dart', 'lambda': 3.2708162996463155e-05, 'alpha': 6.845066138277763e-08, 'subsample': 0.5357961567807353, 'colsample_bytree': 0.5218506087928433, 'max_depth': 4, 'min_child_weight': 10, 'eta': 0.050916178153965486, 'gamma': 2.134443492327524, 'rate_drop': 6.504255907128288e-08, 'skip_drop': 3.0931104381012696e-07}. Best is trial 205 with value: -1.007585085076739.
[I 2025-06-20 12:25:40,948] Trial 356 finished with value: -1.0440914443805949 and parameters: {'booster': 'dart', 'lambda': 7.96028946985312e-05, 'alpha': 2.802005506275082e-08, 'subsample': 0.5817700772194867, 'colsample_bytree': 0.679370918400473, 'max_depth': 4, 'min_child_weight': 9, 'eta': 0.08896777884323626, 'gamma': 1.7903021596178794, 'rate_drop': 1.3326117429028744e-07, 'skip_drop': 0.004281859792498147}. Best is trial 205 with value: -1.007585085076739.
[I 2025-06-20 12:25:49,727] Trial 357 finished with value: -1.4765949156237792 and parameters: {'booster': 'dart', 'lambda': 0.0003602025271485413, 'alpha': 0.008805702486176683, 'subsample': 0.5502524171618951, 'colsample_bytree': 0.7330491223290732, 'max_depth': 4, 'min_child_weight': 9, 'eta': 0.0011221057599381033, 'gamma': 2.276157141160666, 'rate_drop': 3.294623027716037e-07, 'skip_drop': 1.5968105810575526e-06}. Best is trial 205 with value: -1.007585085076739.
[I 2025-06-20 12:25:55,580] Trial 358 finished with value: -1.0909637552713871 and parameters: {'booster': 'dart', 'lambda': 1.8004021241881933e-05, 'alpha': 3.4725297858960467, 'subsample': 0.5014890017398898, 'colsample_bytree': 0.8547272625453515, 'max_depth': 4, 'min_child_weight': 5, 'eta': 0.10747160411694825, 'gamma': 0.3763910098374667, 'rate_drop': 5.214510910718573e-07, 'skip_drop': 5.035955447785541e-07}. Best is trial 205 with value: -1.007585085076739.
[I 2025-06-20 12:25:58,952] Trial 359 finished with value: -1.156971348695425 and parameters: {'booster': 'dart', 'lambda': 2.8528012133959696e-08, 'alpha': 4.363357055615869e-08, 'subsample': 0.5185742060231369, 'colsample_bytree': 0.7108701567422692, 'max_depth': 4, 'min_child_weight': 8, 'eta': 0.19939397065779552, 'gamma': 1.595430242342841, 'rate_drop': 1.9263461919772957e-07, 'skip_drop': 1.0459310326231367e-07}. Best is trial 205 with value: -1.007585085076739.
[I 2025-06-20 12:26:05,993] Trial 360 finished with value: -1.0324498566802487 and parameters: {'booster': 'dart', 'lambda': 0.00011251563800072915, 'alpha': 1.5741138575505574e-08, 'subsample': 0.5339770580864516, 'colsample_bytree': 0.698628300617487, 'max_depth': 4, 'min_child_weight': 9, 'eta': 0.07707798771676333, 'gamma': 1.9840134068236592, 'rate_drop': 7.58391617199647e-07, 'skip_drop': 0.0016164725314414602}. Best is trial 205 with value: -1.007585085076739.
[I 2025-06-20 12:26:13,952] Trial 361 finished with value: -1.0417335432037929 and parameters: {'booster': 'dart', 'lambda': 0.00016758629539829803, 'alpha': 1.690559953194444e-07, 'subsample': 0.5623674057089483, 'colsample_bytree': 0.754621052232978, 'max_depth': 4, 'min_child_weight': 9, 'eta': 0.06624257139831921, 'gamma': 2.6210735600685324, 'rate_drop': 1.2416513240640115e-06, 'skip_drop': 2.912116697141287e-06}. Best is trial 205 with value: -1.007585085076739.
[I 2025-06-20 12:26:20,963] Trial 362 finished with value: -1.0194855808048493 and parameters: {'booster': 'dart', 'lambda': 4.171000258509124e-05, 'alpha': 0.03479350745407988, 'subsample': 0.52924302201725, 'colsample_bytree': 0.684871358113515, 'max_depth': 3, 'min_child_weight': 10, 'eta': 0.09630892812201718, 'gamma': 1.8279166461755245, 'rate_drop': 5.8170025711916325e-08, 'skip_drop': 1.162782063024801e-06}. Best is trial 205 with value: -1.007585085076739.
[I 2025-06-20 12:26:25,299] Trial 363 finished with value: -1.0638678554268601 and parameters: {'booster': 'dart', 'lambda': 2.439726266271336e-05, 'alpha': 0.025629513671168676, 'subsample': 0.5152248129564444, 'colsample_bytree': 0.6979891416371833, 'max_depth': 3, 'min_child_weight': 10, 'eta': 0.12595350239662978, 'gamma': 1.9019454362311436, 'rate_drop': 6.717524507749979e-08, 'skip_drop': 1.0867532795972297e-06}. Best is trial 205 with value: -1.007585085076739.
[I 2025-06-20 12:26:32,048] Trial 364 finished with value: -1.0146715945240041 and parameters: {'booster': 'dart', 'lambda': 4.749560835423928e-06, 'alpha': 0.04396958973518401, 'subsample': 0.532495024530732, 'colsample_bytree': 0.6845800804012535, 'max_depth': 3, 'min_child_weight': 10, 'eta': 0.10479022330717652, 'gamma': 2.095195855521291, 'rate_drop': 2.3655676343364614e-08, 'skip_drop': 1.997794182924546e-06}. Best is trial 205 with value: -1.007585085076739.
[I 2025-06-20 12:26:38,970] Trial 365 finished with value: -1.0449631283743337 and parameters: {'booster': 'dart', 'lambda': 2.5890348729135475e-06, 'alpha': 0.0683154296120597, 'subsample': 0.5254254968163583, 'colsample_bytree': 0.6873293655468088, 'max_depth': 3, 'min_child_weight': 10, 'eta': 0.09791642749001561, 'gamma': 2.082840377588336, 'rate_drop': 2.2340700808838437e-08, 'skip_drop': 5.037346082309654e-06}. Best is trial 205 with value: -1.007585085076739.
[I 2025-06-20 12:26:47,899] Trial 366 finished with value: -0.989605092644619 and parameters: {'booster': 'dart', 'lambda': 5.136450256294262e-06, 'alpha': 0.060564440547313365, 'subsample': 0.533283774811648, 'colsample_bytree': 0.6849756931249001, 'max_depth': 3, 'min_child_weight': 10, 'eta': 0.11430071795952929, 'gamma': 2.158973282217595, 'rate_drop': 2.0366435111360138e-08, 'skip_drop': 2.3128315087740603e-06}. Best is trial 366 with value: -0.989605092644619.
[I 2025-06-20 12:26:56,722] Trial 367 finished with value: -1.0198470701604643 and parameters: {'booster': 'dart', 'lambda': 3.4438716511653115e-06, 'alpha': 0.07318678106825428, 'subsample': 0.5353769008992442, 'colsample_bytree': 0.6933134402284403, 'max_depth': 3, 'min_child_weight': 10, 'eta': 0.11867907752158821, 'gamma': 2.129067976546698, 'rate_drop': 2.0400024466517585e-08, 'skip_drop': 4.042885583263813e-06}. Best is trial 366 with value: -0.989605092644619.
[I 2025-06-20 12:27:03,138] Trial 368 finished with value: -1.036083669163572 and parameters: {'booster': 'dart', 'lambda': 3.5694038624556282e-06, 'alpha': 0.06697873338188151, 'subsample': 0.5370369200007901, 'colsample_bytree': 0.6953519826409343, 'max_depth': 3, 'min_child_weight': 10, 'eta': 0.13789833338894403, 'gamma': 2.1200717137601726, 'rate_drop': 1.2892462232086135e-08, 'skip_drop': 3.5495095375541982e-06}. Best is trial 366 with value: -0.989605092644619.
[I 2025-06-20 12:27:07,609] Trial 369 finished with value: -1.0556050056378832 and parameters: {'booster': 'dart', 'lambda': 3.7968150925486706e-06, 'alpha': 0.042933666209996904, 'subsample': 0.5453983723773859, 'colsample_bytree': 0.7033622142824658, 'max_depth': 3, 'min_child_weight': 10, 'eta': 0.11948404719050064, 'gamma': 2.177637365632108, 'rate_drop': 1.9271317656582737e-08, 'skip_drop': 4.814838352475456e-06}. Best is trial 366 with value: -0.989605092644619.
[I 2025-06-20 12:27:14,479] Trial 370 finished with value: -1.0418478539964693 and parameters: {'booster': 'dart', 'lambda': 1.321956198910849e-06, 'alpha': 0.1386425901676872, 'subsample': 0.5304705462768565, 'colsample_bytree': 0.6868770962055785, 'max_depth': 3, 'min_child_weight': 10, 'eta': 0.1146980259086582, 'gamma': 2.000542844260395, 'rate_drop': 1.3053400188231114e-08, 'skip_drop': 2.1951461747033507e-06}. Best is trial 366 with value: -0.989605092644619.
[I 2025-06-20 12:27:14,707] Trial 371 finished with value: -1.1283876397953005 and parameters: {'booster': 'gbtree', 'lambda': 2.026499234812091e-06, 'alpha': 0.06798543385341357, 'subsample': 0.5373343302037848, 'colsample_bytree': 0.7098038246463734, 'max_depth': 3, 'min_child_weight': 10, 'eta': 0.12803812671427964, 'gamma': 2.079103935375625}. Best is trial 366 with value: -0.989605092644619.
[I 2025-06-20 12:27:21,108] Trial 372 finished with value: -1.029519671137949 and parameters: {'booster': 'dart', 'lambda': 5.296887166588037e-06, 'alpha': 0.08646386742869323, 'subsample': 0.511825391817114, 'colsample_bytree': 0.6817961050018574, 'max_depth': 3, 'min_child_weight': 10, 'eta': 0.1420226401963316, 'gamma': 2.203362170135841, 'rate_drop': 2.583093422562732e-08, 'skip_drop': 2.7530764821041783e-06}. Best is trial 366 with value: -0.989605092644619.
[I 2025-06-20 12:27:29,217] Trial 373 finished with value: -1.0031996901143785 and parameters: {'booster': 'dart', 'lambda': 6.0722952590197496e-06, 'alpha': 0.023194957178346243, 'subsample': 0.5265935272552554, 'colsample_bytree': 0.6975423602694063, 'max_depth': 3, 'min_child_weight': 10, 'eta': 0.10799844605323199, 'gamma': 2.0156133001445955, 'rate_drop': 1.8111587864836823e-08, 'skip_drop': 6.673860018007885e-06}. Best is trial 366 with value: -0.989605092644619.
