[I 2025-06-20 12:25:30,608] Trial 329 finished with value: -1.6752691077700932 and parameters: {'booster': 'dart', 'lambda': 3.283325777159789e-06, 'alpha': 1.0016663104576999e-08, 'subsample': 0.5368572854576609, 'colsample_bytree': 0.5844345672736094, 'max_depth': 6, 'min_child_weight': 3, 'eta': 0.022153728758428436, 'gamma': 4.353207012931094, 'rate_drop': 1.5280593289975873e-07, 'skip_drop': 1.8400112553538704e-07}. Best is trial 307 with value: -1.65474938452884.
[I 2025-06-20 12:25:34,650] Trial 330 finished with value: -1.6832438522841258 and parameters: {'booster': 'dart', 'lambda': 1.74117621162083e-05, 'alpha': 2.3514424563333553e-08, 'subsample': 0.5164454232220107, 'colsample_bytree': 0.6075720007634097, 'max_depth': 7, 'min_child_weight': 3, 'eta': 0.022201814403152047, 'gamma': 4.7969547145804405, 'rate_drop': 5.414091010669771e-07, 'skip_drop': 2.580751092741925e-08}. Best is trial 307 with value: -1.65474938452884.
[I 2025-06-20 12:25:41,934] Trial 331 finished with value: -1.6808647609343765 and parameters: {'booster': 'dart', 'lambda': 6.624566542973818e-06, 'alpha': 7.282754334826844e-08, 'subsample': 0.5255637691275613, 'colsample_bytree': 0.5441215547820736, 'max_depth': 6, 'min_child_weight': 3, 'eta': 0.01933413338738909, 'gamma': 4.9098876164163165, 'rate_drop': 2.1473147503040516e-05, 'skip_drop': 7.279549747672957e-08}. Best is trial 307 with value: -1.65474938452884.
[I 2025-06-20 12:25:44,567] Trial 332 finished with value: -1.6701120133585499 and parameters: {'booster': 'dart', 'lambda': 1.9238383057858853e-06, 'alpha': 1.4442163853588303e-08, 'subsample': 0.5406410035694068, 'colsample_bytree': 0.571445060593694, 'max_depth': 6, 'min_child_weight': 3, 'eta': 0.03918737179004728, 'gamma': 4.728729387584985, 'rate_drop': 7.790839106856973e-08, 'skip_drop': 3.9725914852560645e-08}. Best is trial 307 with value: -1.65474938452884.
[I 2025-06-20 12:25:46,993] Trial 333 finished with value: -1.698116539490797 and parameters: {'booster': 'dart', 'lambda': 1.9793290460604773e-06, 'alpha': 4.042680170103016e-08, 'subsample': 0.5658213566985408, 'colsample_bytree': 0.5965427764446201, 'max_depth': 6, 'min_child_weight': 2, 'eta': 0.03647843543979369, 'gamma': 4.578410463746923, 'rate_drop': 4.58554912978926e-08, 'skip_drop': 3.80909325385435e-08}. Best is trial 307 with value: -1.65474938452884.
[I 2025-06-20 12:25:48,066] Trial 334 finished with value: -1.6900611242601815 and parameters: {'booster': 'dart', 'lambda': 4.0900490264138565e-06, 'alpha': 2.2614508334476042e-08, 'subsample': 0.5513040025697157, 'colsample_bytree': 0.5718048290008855, 'max_depth': 6, 'min_child_weight': 3, 'eta': 0.044458496044344646, 'gamma': 4.679064404846049, 'rate_drop': 9.983942185629275e-08, 'skip_drop': 1.8918634554623318e-08}. Best is trial 307 with value: -1.65474938452884.
[I 2025-06-20 12:25:49,410] Trial 335 finished with value: -1.6602798956144473 and parameters: {'booster': 'dart', 'lambda': 1.4929042203832354e-06, 'alpha': 1.8271409783392652e-08, 'subsample': 0.5418251064671523, 'colsample_bytree': 0.5829667164583594, 'max_depth': 9, 'min_child_weight': 3, 'eta': 0.043118585721085685, 'gamma': 4.770674174871775, 'rate_drop': 5.966125486484761e-08, 'skip_drop': 2.8783279831369846e-08}. Best is trial 307 with value: -1.65474938452884.
[I 2025-06-20 12:25:50,838] Trial 336 finished with value: -1.6779033957614837 and parameters: {'booster': 'dart', 'lambda': 2.1220909727005643e-06, 'alpha': 1.6735106350110856e-08, 'subsample': 0.5441376126270431, 'colsample_bytree': 0.5881069421210072, 'max_depth': 9, 'min_child_weight': 3, 'eta': 0.04043293098856083, 'gamma': 4.450011659217767, 'rate_drop': 5.482709157184259e-08, 'skip_drop': 4.3232800582782024e-08}. Best is trial 307 with value: -1.65474938452884.
[I 2025-06-20 12:25:51,562] Trial 337 finished with value: -1.7057195008191894 and parameters: {'booster': 'dart', 'lambda': 2.6498691851021324e-06, 'alpha': 1.4236201072153172e-08, 'subsample': 0.5535293399899124, 'colsample_bytree': 0.6007410883861316, 'max_depth': 9, 'min_child_weight': 2, 'eta': 0.054773668338444534, 'gamma': 4.614797115515457, 'rate_drop': 7.813203906130247e-08, 'skip_drop': 3.006427567741884e-08}. Best is trial 307 with value: -1.65474938452884.
[I 2025-06-20 12:25:52,933] Trial 338 finished with value: -1.7218745909782265 and parameters: {'booster': 'dart', 'lambda': 1.418745493767701e-06, 'alpha': 4.078205736764428e-05, 'subsample': 0.5378378237894507, 'colsample_bytree': 0.6184766900709664, 'max_depth': 9, 'min_child_weight': 8, 'eta': 0.0427916295456068, 'gamma': 4.746090736434151, 'rate_drop': 2.306023871516485e-08, 'skip_drop': 5.8640974363837e-08}. Best is trial 307 with value: -1.65474938452884.
[I 2025-06-20 12:25:54,293] Trial 339 finished with value: -1.6797796171367874 and parameters: {'booster': 'dart', 'lambda': 4.474003533184884e-06, 'alpha': 2.3077415593227812e-08, 'subsample': 0.5619448261163625, 'colsample_bytree': 0.5860065073541143, 'max_depth': 9, 'min_child_weight': 3, 'eta': 0.04813725190891356, 'gamma': 4.687921964065984, 'rate_drop': 3.721617809973285e-08, 'skip_drop': 1.4681095651017415e-08}. Best is trial 307 with value: -1.65474938452884.
[I 2025-06-20 12:25:55,764] Trial 340 finished with value: -1.682056586176933 and parameters: {'booster': 'dart', 'lambda': 1.6577050510567083e-06, 'alpha': 1.5808404467317452e-08, 'subsample': 0.5408240736239699, 'colsample_bytree': 0.5782563064266393, 'max_depth': 6, 'min_child_weight': 3, 'eta': 0.04287043307174291, 'gamma': 4.520378012494648, 'rate_drop': 1.3012576868656464e-07, 'skip_drop': 3.4856565967401546e-08}. Best is trial 307 with value: -1.65474938452884.
[I 2025-06-20 12:25:56,831] Trial 341 finished with value: -1.7636592858871898 and parameters: {'booster': 'dart', 'lambda': 3.145269471814668e-06, 'alpha': 2.9447663939338527e-08, 'subsample': 0.5319492726683474, 'colsample_bytree': 0.9431650300287195, 'max_depth': 6, 'min_child_weight': 3, 'eta': 0.037232644961770686, 'gamma': 4.7827199140205305, 'rate_drop': 1.8583345242207005e-07, 'skip_drop': 1.9829128315768386e-08}. Best is trial 307 with value: -1.65474938452884.
[I 2025-06-20 12:25:59,703] Trial 342 finished with value: -1.6805246169345858 and parameters: {'booster': 'dart', 'lambda': 6.786858356412741e-06, 'alpha': 1.4900027298706296e-08, 'subsample': 0.5493195987525141, 'colsample_bytree': 0.5525273557367176, 'max_depth': 9, 'min_child_weight': 3, 'eta': 0.03318717124221804, 'gamma': 4.628032694886992, 'rate_drop': 6.620953335697294e-08, 'skip_drop': 4.881868137456394e-08}. Best is trial 307 with value: -1.65474938452884.
[I 2025-06-20 12:26:02,341] Trial 343 finished with value: -1.6956127601268935 and parameters: {'booster': 'dart', 'lambda': 1.0912267193065263e-06, 'alpha': 5.576586161313241e-08, 'subsample': 0.5252182007268645, 'colsample_bytree': 0.567827300358061, 'max_depth': 9, 'min_child_weight': 3, 'eta': 0.03735545132847899, 'gamma': 4.799430502514464, 'rate_drop': 1.2237761881316516e-07, 'skip_drop': 7.444630999899987e-08}. Best is trial 307 with value: -1.65474938452884.
[I 2025-06-20 12:26:02,709] Trial 344 finished with value: -1.7088953540875707 and parameters: {'booster': 'gbtree', 'lambda': 1.9561856726269633e-06, 'alpha': 2.180112073897381e-08, 'subsample': 0.5401944674118344, 'colsample_bytree': 0.6288238742226522, 'max_depth': 10, 'min_child_weight': 3, 'eta': 0.025025145004021716, 'gamma': 4.71887494511223}. Best is trial 307 with value: -1.65474938452884.
[I 2025-06-20 12:26:04,696] Trial 345 finished with value: -1.6809899643450734 and parameters: {'booster': 'dart', 'lambda': 3.6774303117423457e-06, 'alpha': 4.01413681015165e-08, 'subsample': 0.5328528066795984, 'colsample_bytree': 0.5801184957254188, 'max_depth': 6, 'min_child_weight': 3, 'eta': 0.030309208061744763, 'gamma': 4.832819994308401, 'rate_drop': 7.161586465114613e-08, 'skip_drop': 2.3301186800896424e-08}. Best is trial 307 with value: -1.65474938452884.
[I 2025-06-20 12:26:08,667] Trial 346 finished with value: -1.7028820767125892 and parameters: {'booster': 'dart', 'lambda': 5.507758218770365e-06, 'alpha': 1.4982274767445863e-08, 'subsample': 0.519040839370877, 'colsample_bytree': 0.5081356081094568, 'max_depth': 7, 'min_child_weight': 3, 'eta': 0.0219781783203821, 'gamma': 4.569355238454674, 'rate_drop': 2.2798817612609908e-07, 'skip_drop': 1.0082232228481854e-08}. Best is trial 307 with value: -1.65474938452884.
[I 2025-06-20 12:26:09,850] Trial 347 finished with value: -1.6878440568108166 and parameters: {'booster': 'dart', 'lambda': 1.4303845346490397e-05, 'alpha': 2.6409586077903443e-08, 'subsample': 0.5584009851578177, 'colsample_bytree': 0.5423862959609106, 'max_depth': 9, 'min_child_weight': 3, 'eta': 0.05348964510382227, 'gamma': 4.721036958223669, 'rate_drop': 4.7889874973000326e-08, 'skip_drop': 2.985112641471723e-08}. Best is trial 307 with value: -1.65474938452884.
[I 2025-06-20 12:26:12,153] Trial 348 finished with value: -1.705636663956516 and parameters: {'booster': 'dart', 'lambda': 2.397801748281055e-06, 'alpha': 0.0002837028046550764, 'subsample': 0.5464009923729233, 'colsample_bytree': 0.5568939164965866, 'max_depth': 6, 'min_child_weight': 2, 'eta': 0.030987365478085643, 'gamma': 4.834304860599339, 'rate_drop': 3.216256387469072e-08, 'skip_drop': 6.391177969254509e-08}. Best is trial 307 with value: -1.65474938452884.
[I 2025-06-20 12:26:14,035] Trial 349 finished with value: -1.7516729684426968 and parameters: {'booster': 'dart', 'lambda': 9.358077242356218e-06, 'alpha': 1.4663485344205392e-08, 'subsample': 0.5201347220680362, 'colsample_bytree': 0.8408368310601347, 'max_depth': 6, 'min_child_weight': 3, 'eta': 0.047556870335761524, 'gamma': 4.665619961000145, 'rate_drop': 1.5458288248139323e-07, 'skip_drop': 3.975562625620999e-08}. Best is trial 307 with value: -1.65474938452884.
[I 2025-06-20 12:26:15,814] Trial 350 finished with value: -1.6992279045712346 and parameters: {'booster': 'dart', 'lambda': 6.513054482703781e-05, 'alpha': 3.275641704417283e-08, 'subsample': 0.5302835567580548, 'colsample_bytree': 0.5919649367878704, 'max_depth': 6, 'min_child_weight': 3, 'eta': 0.03955015283729397, 'gamma': 4.888305159628145, 'rate_drop': 8.150067834488652e-08, 'skip_drop': 1.5255554844798648e-08}. Best is trial 307 with value: -1.65474938452884.
[I 2025-06-20 12:26:22,956] Trial 351 finished with value: -1.6725941430985405 and parameters: {'booster': 'dart', 'lambda': 1.2425323200936277e-06, 'alpha': 1.0082402471484995e-08, 'subsample': 0.5376445760113246, 'colsample_bytree': 0.5692387935337198, 'max_depth': 6, 'min_child_weight': 3, 'eta': 0.02005964607344507, 'gamma': 4.791869300610895, 'rate_drop': 1.8443582141037115e-08, 'skip_drop': 2.5343639275773433e-08}. Best is trial 307 with value: -1.65474938452884.
[I 2025-06-20 12:26:26,875] Trial 352 finished with value: -1.677087516384892 and parameters: {'booster': 'dart', 'lambda': 3.4253324663979855e-06, 'alpha': 2.12821283166699e-08, 'subsample': 0.5157357659208229, 'colsample_bytree': 0.5535435117359335, 'max_depth': 6, 'min_child_weight': 3, 'eta': 0.024422455483194397, 'gamma': 4.457943328018542, 'rate_drop': 2.480531796831708e-07, 'skip_drop': 4.36584617649333e-08}. Best is trial 307 with value: -1.65474938452884.
[I 2025-06-20 12:26:33,775] Trial 353 finished with value: -1.7049896449839606 and parameters: {'booster': 'dart', 'lambda': 9.236892368004466e-07, 'alpha': 4.9058696364368274e-08, 'subsample': 0.5273546320717902, 'colsample_bytree': 0.5777490730062117, 'max_depth': 9, 'min_child_weight': 3, 'eta': 0.016422930551448497, 'gamma': 1.4752901781154593, 'rate_drop': 1.906637132968009e-05, 'skip_drop': 7.238135596031091e-08}. Best is trial 307 with value: -1.65474938452884.
[I 2025-06-20 12:26:40,644] Trial 354 finished with value: -1.71272241625396 and parameters: {'booster': 'dart', 'lambda': 5.0808084148675675e-06, 'alpha': 2.0131167494965443e-08, 'subsample': 0.7648704226281421, 'colsample_bytree': 0.5218174597583842, 'max_depth': 6, 'min_child_weight': 3, 'eta': 0.02206448251263544, 'gamma': 4.917663526854625, 'rate_drop': 9.297172747187219e-08, 'skip_drop': 1.878232550768105e-08}. Best is trial 307 with value: -1.65474938452884.
[I 2025-06-20 12:26:43,318] Trial 355 finished with value: -1.6866009284978134 and parameters: {'booster': 'dart', 'lambda': 1.6525983149163788e-06, 'alpha': 1.0179038349812896e-07, 'subsample': 0.5445178721989554, 'colsample_bytree': 0.6074102878137156, 'max_depth': 6, 'min_child_weight': 3, 'eta': 0.034414860070396874, 'gamma': 4.62486083307344, 'rate_drop': 4.307387156076072e-07, 'skip_drop': 9.983549913308742e-08}. Best is trial 307 with value: -1.65474938452884.
[I 2025-06-20 12:26:46,085] Trial 356 finished with value: -1.7209510324830428 and parameters: {'booster': 'dart', 'lambda': 2.344299824427617e-06, 'alpha': 1.387990907775706e-08, 'subsample': 0.510183213110516, 'colsample_bytree': 0.8711701274686354, 'max_depth': 8, 'min_child_weight': 4, 'eta': 0.028400068479400676, 'gamma': 4.744572248850772, 'rate_drop': 1.4079038659748024e-07, 'skip_drop': 3.271900728453134e-08}. Best is trial 307 with value: -1.65474938452884.
[I 2025-06-20 12:26:53,153] Trial 357 finished with value: -1.6921972381976327 and parameters: {'booster': 'dart', 'lambda': 7.652225142234453e-06, 'alpha': 2.8943988661894518e-08, 'subsample': 0.5251795040096009, 'colsample_bytree': 0.5614333804791334, 'max_depth': 6, 'min_child_weight': 3, 'eta': 0.019283165231221346, 'gamma': 4.920506650079968, 'rate_drop': 5.418989140898745e-08, 'skip_drop': 4.768849710640235e-08}. Best is trial 307 with value: -1.65474938452884.
[I 2025-06-20 12:26:58,538] Trial 358 finished with value: -1.669938916780643 and parameters: {'booster': 'dart', 'lambda': 2.8970440325899754e-06, 'alpha': 4.042357886358648e-08, 'subsample': 0.5536351542416469, 'colsample_bytree': 0.5396518828468441, 'max_depth': 6, 'min_child_weight': 3, 'eta': 0.025491011946735514, 'gamma': 4.536274739099898, 'rate_drop': 6.883924322330235e-07, 'skip_drop': 2.553298883978848e-08}. Best is trial 307 with value: -1.65474938452884.
[I 2025-06-20 12:27:01,213] Trial 359 finished with value: -1.7373420235133774 and parameters: {'booster': 'dart', 'lambda': 3.895697790657019e-05, 'alpha': 6.27494719768617e-08, 'subsample': 0.5660000393654168, 'colsample_bytree': 0.9940074924345392, 'max_depth': 6, 'min_child_weight': 3, 'eta': 0.025362102077794442, 'gamma': 4.519568845684546, 'rate_drop': 2.0188575069514817e-07, 'skip_drop': 3.114437590296769e-08}. Best is trial 307 with value: -1.65474938452884.
[I 2025-06-20 12:27:03,699] Trial 360 finished with value: -1.6744009458108493 and parameters: {'booster': 'dart', 'lambda': 1.0472770397219059e-07, 'alpha': 4.07714377943052e-08, 'subsample': 0.5478431806382749, 'colsample_bytree': 0.5407345472669417, 'max_depth': 6, 'min_child_weight': 3, 'eta': 0.03030179419164518, 'gamma': 4.294885163420521, 'rate_drop': 2.7110662571920354e-08, 'skip_drop': 5.563732102801046e-08}. Best is trial 307 with value: -1.65474938452884.
[I 2025-06-20 12:27:06,943] Trial 361 finished with value: -1.6922957571070152 and parameters: {'booster': 'dart', 'lambda': 4.262407603730212e-06, 'alpha': 1.4651790494295957e-08, 'subsample': 0.5377406808237375, 'colsample_bytree': 0.5708944930281977, 'max_depth': 7, 'min_child_weight': 2, 'eta': 0.0250530685141543, 'gamma': 4.83612257159298, 'rate_drop': 1.0506795783761692e-08, 'skip_drop': 8.826523253816217e-08}. Best is trial 307 with value: -1.65474938452884.
[I 2025-06-20 12:27:16,566] Trial 362 finished with value: -1.842381353596363 and parameters: {'booster': 'dart', 'lambda': 1.450730547397127e-06, 'alpha': 1.0161163303322372e-08, 'subsample': 0.5488179746975439, 'colsample_bytree': 0.5280010095090548, 'max_depth': 6, 'min_child_weight': 4, 'eta': 0.0027254556731104622, 'gamma': 4.412632095654301, 'rate_drop': 7.130728765494833e-07, 'skip_drop': 1.4027822497837541e-08}. Best is trial 307 with value: -1.65474938452884.
[I 2025-06-20 12:27:16,941] Trial 363 finished with value: -1.6979015460191549 and parameters: {'booster': 'gbtree', 'lambda': 7.728299989029541e-07, 'alpha': 2.2077775087374564e-08, 'subsample': 0.5553930154540374, 'colsample_bytree': 0.5820904323407875, 'max_depth': 6, 'min_child_weight': 3, 'eta': 0.02772822486847527, 'gamma': 4.565663975577754}. Best is trial 307 with value: -1.65474938452884.
[I 2025-06-20 12:27:25,088] Trial 364 finished with value: -1.6791010674826872 and parameters: {'booster': 'dart', 'lambda': 1.15001767900929e-05, 'alpha': 7.860545601323905e-08, 'subsample': 0.5375996206613437, 'colsample_bytree': 0.557390177314562, 'max_depth': 6, 'min_child_weight': 3, 'eta': 0.01560034385302685, 'gamma': 4.994855391057824, 'rate_drop': 3.247862602498368e-07, 'skip_drop': 1.3739443366693162e-07}. Best is trial 307 with value: -1.65474938452884.
[I 2025-06-20 12:27:27,146] Trial 365 finished with value: -1.675101630792987 and parameters: {'booster': 'dart', 'lambda': 2.0829332506217363e-06, 'alpha': 4.213167179146948e-08, 'subsample': 0.5312917130195982, 'colsample_bytree': 0.5353452682435885, 'max_depth': 6, 'min_child_weight': 3, 'eta': 0.0332905621478326, 'gamma': 4.838889857334564, 'rate_drop': 9.858029004597077e-08, 'skip_drop': 4.043503462631618e-08}. Best is trial 307 with value: -1.65474938452884.
[I 2025-06-20 12:27:35,043] Trial 366 finished with value: -1.6798819104892826 and parameters: {'booster': 'dart', 'lambda': 3.381106599359353e-06, 'alpha': 2.0490479576735927e-05, 'subsample': 0.5576250259017552, 'colsample_bytree': 0.5974517066499806, 'max_depth': 6, 'min_child_weight': 3, 'eta': 0.018833538198109828, 'gamma': 4.644475472222065, 'rate_drop': 1.189247314959863e-05, 'skip_drop': 2.2738162498881915e-08}. Best is trial 307 with value: -1.65474938452884.
[I 2025-06-20 12:27:37,676] Trial 367 finished with value: -1.6785656497212473 and parameters: {'booster': 'dart', 'lambda': 4.893260184634336e-06, 'alpha': 2.1215645384007332e-08, 'subsample': 0.523479015642258, 'colsample_bytree': 0.5693553325739261, 'max_depth': 6, 'min_child_weight': 4, 'eta': 0.022505188198479145, 'gamma': 4.9161704708022755, 'rate_drop': 4.495211122479782e-08, 'skip_drop': 2.9310165825135808e-08}. Best is trial 307 with value: -1.65474938452884.
[I 2025-06-20 12:27:40,456] Trial 368 finished with value: -1.6705671839720364 and parameters: {'booster': 'dart', 'lambda': 1.104797246476687e-06, 'alpha': 2.939029985857254e-08, 'subsample': 0.5354912056811999, 'colsample_bytree': 0.5477938431700706, 'max_depth': 6, 'min_child_weight': 3, 'eta': 0.039596154615174996, 'gamma': 4.772441629262979, 'rate_drop': 1.5184501071750515e-07, 'skip_drop': 5.999192581482414e-08}. Best is trial 307 with value: -1.65474938452884.
[I 2025-06-20 12:27:48,119] Trial 369 finished with value: -1.6848072394809543 and parameters: {'booster': 'dart', 'lambda': 6.879139463366222e-06, 'alpha': 1.0013057945045777e-08, 'subsample': 0.5420793213591636, 'colsample_bytree': 0.5626447932691938, 'max_depth': 6, 'min_child_weight': 3, 'eta': 0.020301684259859804, 'gamma': 4.694112568726472, 'rate_drop': 6.756363112370391e-08, 'skip_drop': 0.00014747777190877537}. Best is trial 307 with value: -1.65474938452884.
[I 2025-06-20 12:27:55,505] Trial 370 finished with value: -1.6960537117693923 and parameters: {'booster': 'dart', 'lambda': 2.521524129396551e-06, 'alpha': 1.5519415553398486e-08, 'subsample': 0.5296066134246128, 'colsample_bytree': 0.5877995139121873, 'max_depth': 9, 'min_child_weight': 3, 'eta': 0.02626783700347483, 'gamma': 4.998370006105442, 'rate_drop': 4.7205485989236376e-07, 'skip_drop': 1.6228518812913485e-08}. Best is trial 307 with value: -1.65474938452884.
[I 2025-06-20 12:27:59,638] Trial 371 finished with value: -1.6846326046806746 and parameters: {'booster': 'dart', 'lambda': 1.8083806957335774e-06, 'alpha': 2.070711802411072e-08, 'subsample': 0.5155488186154529, 'colsample_bytree': 0.5128813497557958, 'max_depth': 6, 'min_child_weight': 3, 'eta': 0.023447930167515462, 'gamma': 4.832182244337559, 'rate_drop': 2.87300627494389e-07, 'skip_drop': 4.219066044241335e-08}. Best is trial 307 with value: -1.65474938452884.
[I 2025-06-20 12:28:07,394] Trial 372 finished with value: -1.7025075460520414 and parameters: {'booster': 'dart', 'lambda': 5.449218622275595e-07, 'alpha': 5.338641149203411e-08, 'subsample': 0.5692003379455777, 'colsample_bytree': 0.5776574117028765, 'max_depth': 6, 'min_child_weight': 9, 'eta': 0.016711792698231868, 'gamma': 4.557253141185259, 'rate_drop': 2.525803064417847e-05, 'skip_drop': 8.780477574117851e-08}. Best is trial 307 with value: -1.65474938452884.
[I 2025-06-20 12:28:10,142] Trial 373 finished with value: -1.6711874396200732 and parameters: {'booster': 'dart', 'lambda': 2.2534352193073125e-05, 'alpha': 1.7015741659397684e-08, 'subsample': 0.523685317259254, 'colsample_bytree': 0.5507318550487792, 'max_depth': 6, 'min_child_weight': 3, 'eta': 0.030880899230877903, 'gamma': 4.908039901374585, 'rate_drop': 1.2071764410879428e-07, 'skip_drop': 1.0078199380766183e-08}. Best is trial 307 with value: -1.65474938452884.
[I 2025-06-20 12:28:17,445] Trial 374 finished with value: -1.6900292261280918 and parameters: {'booster': 'dart', 'lambda': 3.091224507945211e-06, 'alpha': 3.3637062774754883e-08, 'subsample': 0.5491834864624937, 'colsample_bytree': 0.563781039019152, 'max_depth': 6, 'min_child_weight': 3, 'eta': 0.02049288248728322, 'gamma': 4.747850869855442, 'rate_drop': 2.063467095478311e-07, 'skip_drop': 2.3989161041413944e-08}. Best is trial 307 with value: -1.65474938452884.
