[I 2025-06-20 12:34:45,937] Trial 467 finished with value: -1.7054870963386508 and parameters: {'booster': 'dart', 'lambda': 7.560944651203668e-07, 'alpha': 2.9617301155715572e-08, 'subsample': 0.809997909816255, 'colsample_bytree': 0.5455542227948871, 'max_depth': 6, 'min_child_weight': 4, 'eta': 0.01863826341353794, 'gamma': 4.669281961347233, 'rate_drop': 1.1560149877264429e-07, 'skip_drop': 2.140726644220728e-07}. Best is trial 389 with value: -1.6460117617383008.
[I 2025-06-20 12:34:53,448] Trial 468 finished with value: -1.6678459228737725 and parameters: {'booster': 'dart', 'lambda': 2.6151316994249938e-06, 'alpha': 1.7619561389889005e-08, 'subsample': 0.5393180489674005, 'colsample_bytree': 0.5632764470883754, 'max_depth': 6, 'min_child_weight': 3, 'eta': 0.020154482040786806, 'gamma': 4.743957685511628, 'rate_drop': 2.2956752993830935e-05, 'skip_drop': 7.414490729038764e-08}. Best is trial 389 with value: -1.6460117617383008.
[I 2025-06-20 12:35:03,845] Trial 469 finished with value: -1.7462530858349254 and parameters: {'booster': 'dart', 'lambda': 2.538921850777852e-06, 'alpha': 8.63107908405806, 'subsample': 0.5443818753741206, 'colsample_bytree': 0.5655063497672929, 'max_depth': 6, 'min_child_weight': 3, 'eta': 0.017841557751135242, 'gamma': 4.548646626816158, 'rate_drop': 2.4437561452728764e-05, 'skip_drop': 9.649027168161353e-08}. Best is trial 389 with value: -1.6460117617383008.
[I 2025-06-20 12:35:12,199] Trial 470 finished with value: -1.6957632750099663 and parameters: {'booster': 'dart', 'lambda': 6.226814744249685e-06, 'alpha': 1.3756215520256889e-08, 'subsample': 0.5656010259887425, 'colsample_bytree': 0.5505568403572817, 'max_depth': 6, 'min_child_weight': 3, 'eta': 0.01878997922617679, 'gamma': 4.691877160789645, 'rate_drop': 3.37973524290304e-05, 'skip_drop': 1.477623702750495e-07}. Best is trial 389 with value: -1.6460117617383008.
[I 2025-06-20 12:35:19,684] Trial 471 finished with value: -1.6790489232326535 and parameters: {'booster': 'dart', 'lambda': 3.2956768944228353e-06, 'alpha': 2.00655901121152e-08, 'subsample': 0.5354292222968848, 'colsample_bytree': 0.531359184809646, 'max_depth': 6, 'min_child_weight': 3, 'eta': 0.015559355574065544, 'gamma': 4.434207405426284, 'rate_drop': 6.527016170975756e-08, 'skip_drop': 6.733867416899913e-08}. Best is trial 389 with value: -1.6460117617383008.
[I 2025-06-20 12:35:28,001] Trial 472 finished with value: -1.69806034041558 and parameters: {'booster': 'dart', 'lambda': 2.0600319363252763e-06, 'alpha': 9.924977491643655e-06, 'subsample': 0.6581268099726338, 'colsample_bytree': 0.5672237632248465, 'max_depth': 5, 'min_child_weight': 3, 'eta': 0.020485480014396946, 'gamma': 4.634886504596653, 'rate_drop': 4.553935985893905e-05, 'skip_drop': 8.528426278370868e-08}. Best is trial 389 with value: -1.6460117617383008.
[I 2025-06-20 12:35:32,046] Trial 473 finished with value: -1.7061723219774474 and parameters: {'booster': 'dart', 'lambda': 4.913392611445438e-06, 'alpha': 3.9838125038978364e-08, 'subsample': 0.551345386494775, 'colsample_bytree': 0.55710132631155, 'max_depth': 6, 'min_child_weight': 2, 'eta': 0.02061349359398807, 'gamma': 4.772687919706062, 'rate_drop': 2.8102219316780926e-05, 'skip_drop': 0.004522731728742989}. Best is trial 389 with value: -1.6460117617383008.
[I 2025-06-20 12:35:40,044] Trial 474 finished with value: -1.6735975832815242 and parameters: {'booster': 'dart', 'lambda': 1.85156138178039e-06, 'alpha': 1.3656507842924455e-08, 'subsample': 0.5395063629675325, 'colsample_bytree': 0.5437898103834915, 'max_depth': 6, 'min_child_weight': 3, 'eta': 0.01607030075314434, 'gamma': 4.529914205996353, 'rate_drop': 3.563852724511703e-08, 'skip_drop': 4.9449898426970115e-08}. Best is trial 389 with value: -1.6460117617383008.
[I 2025-06-20 12:35:47,354] Trial 475 finished with value: -1.678350683946096 and parameters: {'booster': 'dart', 'lambda': 3.806411011261139e-06, 'alpha': 1.031608327649996e-08, 'subsample': 0.5294436050235279, 'colsample_bytree': 0.51243969225148, 'max_depth': 6, 'min_child_weight': 3, 'eta': 0.022811696931136112, 'gamma': 4.344513414553781, 'rate_drop': 1.0471364368843733e-07, 'skip_drop': 6.866113227154909e-08}. Best is trial 389 with value: -1.6460117617383008.
[I 2025-06-20 12:35:54,729] Trial 476 finished with value: -1.6861200792801683 and parameters: {'booster': 'dart', 'lambda': 1.2251543098612183e-06, 'alpha': 2.6877966039198124e-08, 'subsample': 0.5407016870441328, 'colsample_bytree': 0.571745030426286, 'max_depth': 6, 'min_child_weight': 3, 'eta': 0.01772931717415095, 'gamma': 4.999835083431766, 'rate_drop': 4.837399486414449e-08, 'skip_drop': 2.93068705548772e-07}. Best is trial 389 with value: -1.6460117617383008.
[I 2025-06-20 12:36:03,216] Trial 477 finished with value: -1.6854622451159096 and parameters: {'booster': 'dart', 'lambda': 8.343320538856098e-06, 'alpha': 4.427530337073773e-08, 'subsample': 0.553657827031116, 'colsample_bytree': 0.5616200238831399, 'max_depth': 6, 'min_child_weight': 3, 'eta': 0.013089443878531127, 'gamma': 4.7481752598052065, 'rate_drop': 2.1531134500459e-08, 'skip_drop': 4.0503200334442297e-08}. Best is trial 389 with value: -1.6460117617383008.
[I 2025-06-20 12:36:04,306] Trial 478 finished with value: -1.6814722133413451 and parameters: {'booster': 'dart', 'lambda': 2.713368552446003e-06, 'alpha': 2.0063206457406853e-08, 'subsample': 0.5293987893512621, 'colsample_bytree': 0.536681565270621, 'max_depth': 6, 'min_child_weight': 3, 'eta': 0.052580351020041244, 'gamma': 4.834470767197094, 'rate_drop': 1.3838927639686596e-08, 'skip_drop': 1.1795940711989946e-07}. Best is trial 389 with value: -1.6460117617383008.
[I 2025-06-20 12:36:11,430] Trial 479 finished with value: -1.6826957893518262 and parameters: {'booster': 'dart', 'lambda': 1.478983464085703e-06, 'alpha': 1.0116772268084749e-08, 'subsample': 0.5459623620340369, 'colsample_bytree': 0.5494136544216303, 'max_depth': 6, 'min_child_weight': 3, 'eta': 0.01990926772130318, 'gamma': 4.6460933831626905, 'rate_drop': 1.4333764046881927e-05, 'skip_drop': 3.338162318985307e-08}. Best is trial 389 with value: -1.6460117617383008.
[I 2025-06-20 12:36:15,150] Trial 480 finished with value: -1.7058799579840982 and parameters: {'booster': 'dart', 'lambda': 5.422470120516561e-08, 'alpha': 2.984586421601651e-08, 'subsample': 0.508513755074091, 'colsample_bytree': 0.5710743725079866, 'max_depth': 6, 'min_child_weight': 2, 'eta': 0.022040006773088053, 'gamma': 4.734308029828982, 'rate_drop': 1.5824980589025483e-07, 'skip_drop': 5.644981155452723e-08}. Best is trial 389 with value: -1.6460117617383008.
[I 2025-06-20 12:36:15,716] Trial 481 finished with value: -1.6976392441415864 and parameters: {'booster': 'gbtree', 'lambda': 1.0569639978506214e-06, 'alpha': 5.9563724153758736e-08, 'subsample': 0.5232866479734151, 'colsample_bytree': 0.5264896918828557, 'max_depth': 6, 'min_child_weight': 4, 'eta': 0.014920723120210878, 'gamma': 4.999870335393268}. Best is trial 389 with value: -1.6460117617383008.
[I 2025-06-20 12:36:19,433] Trial 482 finished with value: -1.6918402688225465 and parameters: {'booster': 'dart', 'lambda': 5.202322287894423e-06, 'alpha': 1.9142036372853847e-08, 'subsample': 0.5608275333660143, 'colsample_bytree': 0.5601749067314971, 'max_depth': 6, 'min_child_weight': 3, 'eta': 0.024116633060852585, 'gamma': 4.83414430714504, 'rate_drop': 7.6424661035388e-08, 'skip_drop': 8.087505847585954e-08}. Best is trial 389 with value: -1.6460117617383008.
[I 2025-06-20 12:36:26,533] Trial 483 finished with value: -1.6787237234782277 and parameters: {'booster': 'dart', 'lambda': 2.5799960504150493e-06, 'alpha': 3.96448918201226e-08, 'subsample': 0.5341607184505097, 'colsample_bytree': 0.5852919399204183, 'max_depth': 6, 'min_child_weight': 3, 'eta': 0.01841649548589788, 'gamma': 4.6960580726496275, 'rate_drop': 6.922284025800287e-05, 'skip_drop': 1.4999068583885808e-07}. Best is trial 389 with value: -1.6460117617383008.
[I 2025-06-20 12:36:33,486] Trial 484 finished with value: -1.6797077211170837 and parameters: {'booster': 'dart', 'lambda': 2.0326809911643416e-06, 'alpha': 1.8350683155594098e-08, 'subsample': 0.5400609236908115, 'colsample_bytree': 0.5467350831838291, 'max_depth': 6, 'min_child_weight': 3, 'eta': 0.02016287002265839, 'gamma': 4.832631787269934, 'rate_drop': 2.0269025058299652e-05, 'skip_drop': 4.0292820057867396e-08}. Best is trial 389 with value: -1.6460117617383008.
[I 2025-06-20 12:36:36,147] Trial 485 finished with value: -1.6738019053990898 and parameters: {'booster': 'dart', 'lambda': 3.8202404422300095e-06, 'alpha': 3.208345664413099e-08, 'subsample': 0.5197675004568578, 'colsample_bytree': 0.5783699990629658, 'max_depth': 6, 'min_child_weight': 4, 'eta': 0.044362113898703176, 'gamma': 4.5063452727023, 'rate_drop': 3.3056998631003436e-08, 'skip_drop': 2.9248343642430427e-08}. Best is trial 389 with value: -1.6460117617383008.
[I 2025-06-20 12:36:38,907] Trial 486 finished with value: -1.6732843124967824 and parameters: {'booster': 'dart', 'lambda': 1.0843886579803431e-07, 'alpha': 1.6912566261761078e-08, 'subsample': 0.5304575565176586, 'colsample_bytree': 0.5643816614652281, 'max_depth': 6, 'min_child_weight': 3, 'eta': 0.03453587930708656, 'gamma': 4.923600066380946, 'rate_drop': 4.984240254758622e-08, 'skip_drop': 5.751135054848283e-08}. Best is trial 389 with value: -1.6460117617383008.
[I 2025-06-20 12:36:41,624] Trial 487 finished with value: -1.6988329293356799 and parameters: {'booster': 'dart', 'lambda': 6.830454721026754e-07, 'alpha': 2.7343289584242204e-08, 'subsample': 0.5489156483977388, 'colsample_bytree': 0.5407846278977548, 'max_depth': 6, 'min_child_weight': 9, 'eta': 0.02667984457998816, 'gamma': 4.746505927019936, 'rate_drop': 1.1717139032258582e-07, 'skip_drop': 2.888061307208486e-08}. Best is trial 389 with value: -1.6460117617383008.
[I 2025-06-20 12:36:45,547] Trial 488 finished with value: -1.6904600598669024 and parameters: {'booster': 'dart', 'lambda': 8.225591046295358e-06, 'alpha': 7.142183265872282e-08, 'subsample': 0.5811529460086055, 'colsample_bytree': 0.5524939812351845, 'max_depth': 5, 'min_child_weight': 3, 'eta': 0.03177411342346357, 'gamma': 4.625752357977354, 'rate_drop': 6.878389783428053e-08, 'skip_drop': 8.592666436568984e-08}. Best is trial 389 with value: -1.6460117617383008.
[I 2025-06-20 12:36:52,550] Trial 489 finished with value: -1.6957031037249113 and parameters: {'booster': 'dart', 'lambda': 1.2346896235222769e-06, 'alpha': 2.7305052733096828e-06, 'subsample': 0.5110883416630142, 'colsample_bytree': 0.5744849044802651, 'max_depth': 6, 'min_child_weight': 3, 'eta': 0.016762744461555467, 'gamma': 4.856283132228159, 'rate_drop': 8.866788005700862e-08, 'skip_drop': 4.5260558700658284e-08}. Best is trial 389 with value: -1.6460117617383008.
[I 2025-06-20 12:36:56,271] Trial 490 finished with value: -1.7014716986258986 and parameters: {'booster': 'dart', 'lambda': 3.1242819418656816e-06, 'alpha': 1.4601119700641081e-08, 'subsample': 0.5248014544482513, 'colsample_bytree': 0.5600917580222345, 'max_depth': 6, 'min_child_weight': 2, 'eta': 0.02309416829543989, 'gamma': 4.893413885428399, 'rate_drop': 1.3945692766423734e-07, 'skip_drop': 2.3216772002450412e-08}. Best is trial 389 with value: -1.6460117617383008.
[I 2025-06-20 12:36:58,285] Trial 491 finished with value: -1.6636487647461145 and parameters: {'booster': 'dart', 'lambda': 1.704915667733502e-06, 'alpha': 4.72037294513073e-08, 'subsample': 0.5374655970141221, 'colsample_bytree': 0.5919545255862775, 'max_depth': 6, 'min_child_weight': 3, 'eta': 0.029483343817296257, 'gamma': 4.78465434091547, 'rate_drop': 2.718713312583853e-08, 'skip_drop': 2.2725328311168177e-07}. Best is trial 389 with value: -1.6460117617383008.
[I 2025-06-20 12:37:00,820] Trial 492 finished with value: -1.6826743137265203 and parameters: {'booster': 'dart', 'lambda': 4.737041896147646e-06, 'alpha': 1.0114189489553611e-07, 'subsample': 0.553249228584692, 'colsample_bytree': 0.5841604899867099, 'max_depth': 6, 'min_child_weight': 3, 'eta': 0.03731994272126593, 'gamma': 4.630928923316896, 'rate_drop': 1.6442908166101577e-08, 'skip_drop': 2.2650922919036093e-07}. Best is trial 389 with value: -1.6460117617383008.
[I 2025-06-20 12:37:07,846] Trial 493 finished with value: -1.6851049380931444 and parameters: {'booster': 'dart', 'lambda': 2.122015986596781e-06, 'alpha': 5.357025813817689e-08, 'subsample': 0.5723006710942314, 'colsample_bytree': 0.5908622065844574, 'max_depth': 6, 'min_child_weight': 3, 'eta': 0.02061960026844703, 'gamma': 4.545239173840705, 'rate_drop': 2.1720786967435767e-08, 'skip_drop': 2.7626842563572907e-07}. Best is trial 389 with value: -1.6460117617383008.
[I 2025-06-20 12:37:14,464] Trial 494 finished with value: -1.6901430315552384 and parameters: {'booster': 'dart', 'lambda': 1.7371856499359405e-07, 'alpha': 4.4745264654532533e-08, 'subsample': 0.5406103533880247, 'colsample_bytree': 0.5249504455799899, 'max_depth': 6, 'min_child_weight': 3, 'eta': 0.024561191022981155, 'gamma': 4.736023864695845, 'rate_drop': 2.9734792685056006e-08, 'skip_drop': 1.6823664120701882e-07}. Best is trial 389 with value: -1.6460117617383008.
[I 2025-06-20 12:37:17,185] Trial 495 finished with value: -1.7250664440222527 and parameters: {'booster': 'dart', 'lambda': 5.946573425459958e-07, 'alpha': 1.006441708523564e-08, 'subsample': 0.8626990946245456, 'colsample_bytree': 0.5357340870224188, 'max_depth': 6, 'min_child_weight': 3, 'eta': 0.030709340079500262, 'gamma': 4.768200047567312, 'rate_drop': 2.6793330792556456e-08, 'skip_drop': 5.12327118026556e-07}. Best is trial 389 with value: -1.6460117617383008.
[I 2025-06-20 12:37:24,375] Trial 496 finished with value: -1.6750688995789635 and parameters: {'booster': 'dart', 'lambda': 1.8214700274862404e-06, 'alpha': 6.967034314329159e-08, 'subsample': 0.5451324222014062, 'colsample_bytree': 0.5660058379742327, 'max_depth': 6, 'min_child_weight': 3, 'eta': 0.017925355703885034, 'gamma': 1.7166010632760644, 'rate_drop': 4.046070320221815e-08, 'skip_drop': 3.6921564209945997e-07}. Best is trial 389 with value: -1.6460117617383008.
[I 2025-06-20 12:37:31,737] Trial 497 finished with value: -1.7114645568796498 and parameters: {'booster': 'dart', 'lambda': 3.475702804995793e-06, 'alpha': 3.636781741297308e-08, 'subsample': 0.53484585213453, 'colsample_bytree': 0.5549690523038288, 'max_depth': 6, 'min_child_weight': 8, 'eta': 0.015590920047207258, 'gamma': 4.645367246203184, 'rate_drop': 1.3359044249441783e-08, 'skip_drop': 1.2597425753502565e-07}. Best is trial 389 with value: -1.6460117617383008.
[I 2025-06-20 12:37:38,792] Trial 498 finished with value: -1.6820816690883558 and parameters: {'booster': 'dart', 'lambda': 3.2121955969399887e-07, 'alpha': 7.045955740053378e-05, 'subsample': 0.5609350829425789, 'colsample_bytree': 0.5930878256606492, 'max_depth': 6, 'min_child_weight': 3, 'eta': 0.02167324063306353, 'gamma': 4.7841477528025775, 'rate_drop': 4.8476467825526235e-08, 'skip_drop': 1.210312391940781e-07}. Best is trial 389 with value: -1.6460117617383008.
[I 2025-06-20 12:37:41,853] Trial 499 finished with value: -1.7202185875812148 and parameters: {'booster': 'dart', 'lambda': 6.244753281727209e-06, 'alpha': 2.1154340009090422e-08, 'subsample': 0.7595564775839131, 'colsample_bytree': 0.5764487962846849, 'max_depth': 6, 'min_child_weight': 3, 'eta': 0.025563414988665677, 'gamma': 4.451809495349535, 'rate_drop': 2.181757774554113e-05, 'skip_drop': 1.852765843030718e-07}. Best is trial 389 with value: -1.6460117617383008.
Number of finished trials:  500
Best trial:
  Value (RMSE): 1.6460
  MSE: 2.7093
  R²: 0.2962
  Params: 
    booster: dart
    lambda: 4.2471638885416484e-07
    alpha: 2.2719324348442875e-08
    subsample: 0.5382057242997333
    colsample_bytree: 0.5733578613028018
    max_depth: 7
    min_child_weight: 3
    eta: 0.032590874812416376
    gamma: 4.819852342205711
    rate_drop: 5.889431725319336e-08
    skip_drop: 1.4734677075888419e-08
Model saved to /vol/models/ck_student_score_predictor_optuna_xgb.pkl

Students to predict: 727
/usr/local/lib/python3.13/site-packages/xgboost/core.py:729: UserWarning: [12:43:31] WARNING: /workspace/src/common/error_msg.cc:27: The tree method `gpu_hist` is deprecated since 2.0.0. To use GPU training, set the `device` parameter to CUDA instead.

    E.g. tree_method = "hist", device = "cuda"

  return func(**kwargs)
Predictions saved to /vol/predictions/ck_unscored_predictions.csv