[I 2025-06-20 11:56:41,832] A new study created in memory with name: no-name-39332053-af3e-4132-8917-363f991778a8
[I 2025-06-20 11:56:52,535] Trial 0 finished with value: -1.9052852817717965 and parameters: {'booster': 'dart', 'lambda': 2.6709483951130702e-08, 'alpha': 0.0025280653443659033, 'subsample': 0.764961544743156, 'colsample_bytree': 0.7225120886733793, 'max_depth': 9, 'min_child_weight': 3, 'eta': 0.001251578695729185, 'gamma': 2.0453998565047553, 'rate_drop': 8.618333570803816e-06, 'skip_drop': 0.12240884287312835}. Best is trial 0 with value: -1.9052852817717965.
[I 2025-06-20 11:56:52,867] Trial 1 finished with value: -1.7546971010679935 and parameters: {'booster': 'gbtree', 'lambda': 0.006744347159394124, 'alpha': 1.6335915261264706e-08, 'subsample': 0.9891457368092411, 'colsample_bytree': 0.8020464803031676, 'max_depth': 8, 'min_child_weight': 7, 'eta': 0.03074299329719653, 'gamma': 1.5489106698930433}. Best is trial 1 with value: -1.7546971010679935.
[I 2025-06-20 11:56:53,424] Trial 2 finished with value: -1.743783412301587 and parameters: {'booster': 'dart', 'lambda': 1.5316861260720254, 'alpha': 0.00011864764414742842, 'subsample': 0.846726014319282, 'colsample_bytree': 0.5344058837899422, 'max_depth': 9, 'min_child_weight': 6, 'eta': 0.12538377008785226, 'gamma': 2.6650197833322293, 'rate_drop': 0.044649605630721755, 'skip_drop': 0.039456107705445324}. Best is trial 2 with value: -1.743783412301587.
[I 2025-06-20 11:57:00,240] Trial 3 finished with value: -2.0182469838410384 and parameters: {'booster': 'dart', 'lambda': 1.3660380521706353e-06, 'alpha': 0.00032434011557651136, 'subsample': 0.7724241063572412, 'colsample_bytree': 0.8097166380091393, 'max_depth': 5, 'min_child_weight': 1, 'eta': 0.0011144769030624678, 'gamma': 0.5010018229923519, 'rate_drop': 0.5118665163680002, 'skip_drop': 6.4897744192901585e-06}. Best is trial 2 with value: -1.743783412301587.
[I 2025-06-20 11:57:00,374] Trial 4 finished with value: -1.7458537620436427 and parameters: {'booster': 'gbtree', 'lambda': 6.464778264297022e-06, 'alpha': 0.1032078776828903, 'subsample': 0.5647513266387234, 'colsample_bytree': 0.8537675353966796, 'max_depth': 5, 'min_child_weight': 3, 'eta': 0.08145831136376093, 'gamma': 4.0194806536789525}. Best is trial 2 with value: -1.743783412301587.
[I 2025-06-20 11:57:00,690] Trial 5 finished with value: -1.7440088536339955 and parameters: {'booster': 'gbtree', 'lambda': 1.3794758221492557e-06, 'alpha': 0.001776890854032436, 'subsample': 0.7238436307076883, 'colsample_bytree': 0.739775053014406, 'max_depth': 3, 'min_child_weight': 4, 'eta': 0.012263930703519771, 'gamma': 0.9685492740098783}. Best is trial 2 with value: -1.743783412301587.
[I 2025-06-20 11:57:00,803] Trial 6 finished with value: -1.7649784065902814 and parameters: {'booster': 'gbtree', 'lambda': 7.498532061359736e-06, 'alpha': 0.29582502993365084, 'subsample': 0.5962943624371075, 'colsample_bytree': 0.7539577319505477, 'max_depth': 4, 'min_child_weight': 3, 'eta': 0.1408689304496992, 'gamma': 1.671794320811328}. Best is trial 2 with value: -1.743783412301587.
[I 2025-06-20 11:57:09,755] Trial 7 finished with value: -1.7717792885556407 and parameters: {'booster': 'dart', 'lambda': 4.904308524164036, 'alpha': 1.341818704251746e-07, 'subsample': 0.6105368476443425, 'colsample_bytree': 0.9278053028766745, 'max_depth': 4, 'min_child_weight': 2, 'eta': 0.007644028289653714, 'gamma': 1.9782123776514164, 'rate_drop': 1.188981481274479e-08, 'skip_drop': 0.16226374253347775}. Best is trial 2 with value: -1.743783412301587.
[I 2025-06-20 11:57:10,133] Trial 8 finished with value: -1.7064393956049189 and parameters: {'booster': 'gbtree', 'lambda': 0.002072458531769867, 'alpha': 4.158740264908868e-06, 'subsample': 0.5414872793556091, 'colsample_bytree': 0.8330299428400488, 'max_depth': 4, 'min_child_weight': 9, 'eta': 0.015758806171906104, 'gamma': 0.8852098051901469}. Best is trial 8 with value: -1.7064393956049189.
[I 2025-06-20 11:57:10,287] Trial 9 finished with value: -1.7578644791966003 and parameters: {'booster': 'gbtree', 'lambda': 0.00033430278826598257, 'alpha': 3.1915109346263723e-06, 'subsample': 0.5267108141805916, 'colsample_bytree': 0.5455272877074744, 'max_depth': 5, 'min_child_weight': 7, 'eta': 0.04770421645629067, 'gamma': 4.3481592658516}. Best is trial 8 with value: -1.7064393956049189.
[I 2025-06-20 11:57:10,733] Trial 10 finished with value: -1.823386053944777 and parameters: {'booster': 'gbtree', 'lambda': 0.04794638831737326, 'alpha': 8.672906713445052, 'subsample': 0.6676335480341326, 'colsample_bytree': 0.9630938589023608, 'max_depth': 7, 'min_child_weight': 10, 'eta': 0.0050410377843865825, 'gamma': 0.0009903721677476662}. Best is trial 8 with value: -1.7064393956049189.
[I 2025-06-20 11:57:16,992] Trial 11 finished with value: -1.782113207986005 and parameters: {'booster': 'dart', 'lambda': 9.169341446615626, 'alpha': 5.209284136338898e-06, 'subsample': 0.9087084361856221, 'colsample_bytree': 0.5246962858707187, 'max_depth': 10, 'min_child_weight': 10, 'eta': 0.24611916232013178, 'gamma': 3.209387962621474, 'rate_drop': 0.6363425623969484, 'skip_drop': 1.1167248981661988e-08}. Best is trial 8 with value: -1.7064393956049189.
[I 2025-06-20 11:57:22,479] Trial 12 finished with value: -1.7142641317946958 and parameters: {'booster': 'dart', 'lambda': 0.13593413352756345, 'alpha': 1.0231510853011098e-05, 'subsample': 0.8563872788291095, 'colsample_bytree': 0.6000592180597057, 'max_depth': 7, 'min_child_weight': 8, 'eta': 0.01846957085946652, 'gamma': 2.9722549446143236, 'rate_drop': 0.0011270823655366272, 'skip_drop': 0.00073212181222049}. Best is trial 8 with value: -1.7064393956049189.
[I 2025-06-20 11:57:25,413] Trial 13 finished with value: -1.7292695007471741 and parameters: {'booster': 'dart', 'lambda': 0.05675300825805415, 'alpha': 3.112270502441875e-06, 'subsample': 0.8658464460681761, 'colsample_bytree': 0.6303727288962863, 'max_depth': 7, 'min_child_weight': 8, 'eta': 0.022283260576659195, 'gamma': 3.1323879461185604, 'rate_drop': 0.000528379330422517, 'skip_drop': 0.0001145049327476057}. Best is trial 8 with value: -1.7064393956049189.
[I 2025-06-20 11:57:26,010] Trial 14 finished with value: -1.822526963300684 and parameters: {'booster': 'gbtree', 'lambda': 0.0006748675057782689, 'alpha': 3.048301646512531e-05, 'subsample': 0.9820204244060677, 'colsample_bytree': 0.6293049161875387, 'max_depth': 6, 'min_child_weight': 9, 'eta': 0.0030400173770400206, 'gamma': 3.586965661369923}. Best is trial 8 with value: -1.7064393956049189.
[I 2025-06-20 11:57:35,392] Trial 15 finished with value: -1.7292312120379016 and parameters: {'booster': 'dart', 'lambda': 0.2626388703534384, 'alpha': 4.37771625205606e-07, 'subsample': 0.685829248902469, 'colsample_bytree': 0.6587668473334558, 'max_depth': 3, 'min_child_weight': 8, 'eta': 0.013978797152246368, 'gamma': 4.713901820940176, 'rate_drop': 0.0001897790330800476, 'skip_drop': 0.000189268493508207}. Best is trial 8 with value: -1.7064393956049189.
[I 2025-06-20 11:57:35,673] Trial 16 finished with value: -1.757498098539782 and parameters: {'booster': 'gbtree', 'lambda': 0.004281042119029206, 'alpha': 2.127799608004729e-08, 'subsample': 0.5096095412762013, 'colsample_bytree': 0.882395633844368, 'max_depth': 6, 'min_child_weight': 5, 'eta': 0.040880439946811946, 'gamma': 2.6908410830678173}. Best is trial 8 with value: -1.7064393956049189.
[I 2025-06-20 11:57:45,900] Trial 17 finished with value: -1.780914838554811 and parameters: {'booster': 'dart', 'lambda': 0.00586133819183752, 'alpha': 4.3349642454869885e-07, 'subsample': 0.8308337020916962, 'colsample_bytree': 0.6894948877486302, 'max_depth': 8, 'min_child_weight': 9, 'eta': 0.0038902529286797857, 'gamma': 0.9771566347241926, 'rate_drop': 1.5339414761658253e-06, 'skip_drop': 5.190368776128041e-07}. Best is trial 8 with value: -1.7064393956049189.
[I 2025-06-20 11:57:55,192] Trial 18 finished with value: -1.7432171962635958 and parameters: {'booster': 'dart', 'lambda': 5.8682741350475994e-05, 'alpha': 2.6419255038134833e-05, 'subsample': 0.9207765222546023, 'colsample_bytree': 0.5818254226052283, 'max_depth': 4, 'min_child_weight': 6, 'eta': 0.00863777774323772, 'gamma': 1.1472848690800506, 'rate_drop': 0.0051071600958405485, 'skip_drop': 0.002787521260126307}. Best is trial 8 with value: -1.7064393956049189.
[I 2025-06-20 11:57:55,474] Trial 19 finished with value: -1.7379065180461464 and parameters: {'booster': 'gbtree', 'lambda': 0.3127637941124107, 'alpha': 0.005257051969342734, 'subsample': 0.8040725386096552, 'colsample_bytree': 0.9880068011515297, 'max_depth': 6, 'min_child_weight': 8, 'eta': 0.02197624304402333, 'gamma': 2.315731672049859}. Best is trial 8 with value: -1.7064393956049189.
[I 2025-06-20 11:57:55,684] Trial 20 finished with value: -1.7643180976969708 and parameters: {'booster': 'gbtree', 'lambda': 5.867881954240994e-05, 'alpha': 0.00023859621869257551, 'subsample': 0.6547378572966361, 'colsample_bytree': 0.7949193846639714, 'max_depth': 8, 'min_child_weight': 9, 'eta': 0.06988837466998235, 'gamma': 0.016383753818480562}. Best is trial 8 with value: -1.7064393956049189.
[I 2025-06-20 11:58:04,946] Trial 21 finished with value: -1.731188364226213 and parameters: {'booster': 'dart', 'lambda': 0.18055342378374656, 'alpha': 3.908644402844987e-07, 'subsample': 0.7131145436474325, 'colsample_bytree': 0.6514538037919964, 'max_depth': 3, 'min_child_weight': 8, 'eta': 0.01391384560264557, 'gamma': 4.902380752160042, 'rate_drop': 0.00010756770358833681, 'skip_drop': 0.0003865915373158382}. Best is trial 8 with value: -1.7064393956049189.
[I 2025-06-20 11:58:14,444] Trial 22 finished with value: -1.7236518723386085 and parameters: {'booster': 'dart', 'lambda': 0.3608042111947865, 'alpha': 2.1101867945129526e-07, 'subsample': 0.6711150321109989, 'colsample_bytree': 0.5877519776632689, 'max_depth': 3, 'min_child_weight': 7, 'eta': 0.014997375643994159, 'gamma': 4.958759132928431, 'rate_drop': 0.001528673148484008, 'skip_drop': 0.002651487801716074}. Best is trial 8 with value: -1.7064393956049189.
[I 2025-06-20 11:58:23,958] Trial 23 finished with value: -1.7462518266558287 and parameters: {'booster': 'dart', 'lambda': 0.029346780060032166, 'alpha': 1.1211245949098042e-05, 'subsample': 0.6009572430776879, 'colsample_bytree': 0.5934263381486612, 'max_depth': 4, 'min_child_weight': 7, 'eta': 0.007522642156439817, 'gamma': 3.758689565773407, 'rate_drop': 0.0037256585454478216, 'skip_drop': 0.0030097767735094184}. Best is trial 8 with value: -1.7064393956049189.
[I 2025-06-20 11:58:33,269] Trial 24 finished with value: -1.930942472887837 and parameters: {'booster': 'dart', 'lambda': 0.0018081111973782449, 'alpha': 1.484365156319993e-07, 'subsample': 0.6406569144265116, 'colsample_bytree': 0.5017903889472524, 'max_depth': 3, 'min_child_weight': 5, 'eta': 0.002238240473681145, 'gamma': 4.404908271267458, 'rate_drop': 0.012278640274169427, 'skip_drop': 6.544499020019808e-06}. Best is trial 8 with value: -1.7064393956049189.
[I 2025-06-20 11:58:42,669] Trial 25 finished with value: -1.6942141789173657 and parameters: {'booster': 'dart', 'lambda': 2.1883985021291754, 'alpha': 1.215582499919266e-06, 'subsample': 0.5481872651347983, 'colsample_bytree': 0.6918693900269294, 'max_depth': 5, 'min_child_weight': 10, 'eta': 0.02239006428887701, 'gamma': 3.5548067105016665, 'rate_drop': 2.218600414817593e-05, 'skip_drop': 0.007481256757410847}. Best is trial 25 with value: -1.6942141789173657.
[I 2025-06-20 11:58:47,052] Trial 26 finished with value: -1.7243513835508901 and parameters: {'booster': 'dart', 'lambda': 1.0549283114079802, 'alpha': 2.326236912415889e-06, 'subsample': 0.5618406359330363, 'colsample_bytree': 0.7017982576813312, 'max_depth': 5, 'min_child_weight': 10, 'eta': 0.02549678427957295, 'gamma': 2.952091844124867, 'rate_drop': 5.95101645877535e-06, 'skip_drop': 0.009761204922436217}. Best is trial 25 with value: -1.6942141789173657.
[I 2025-06-20 11:58:48,291] Trial 27 finished with value: -1.7456433501848403 and parameters: {'booster': 'dart', 'lambda': 0.02747469386859897, 'alpha': 5.932167754784713e-05, 'subsample': 0.5457395474496728, 'colsample_bytree': 0.8516843871530083, 'max_depth': 7, 'min_child_weight': 9, 'eta': 0.040418648407137305, 'gamma': 3.388026869163548, 'rate_drop': 2.735852097468147e-07, 'skip_drop': 1.1026635551008215e-05}. Best is trial 25 with value: -1.6942141789173657.
[I 2025-06-20 11:58:48,590] Trial 28 finished with value: -1.773483756351816 and parameters: {'booster': 'gbtree', 'lambda': 2.3423896028687254, 'alpha': 1.7217912263259973e-06, 'subsample': 0.508375629361011, 'colsample_bytree': 0.764812917388617, 'max_depth': 6, 'min_child_weight': 10, 'eta': 0.056607481547580205, 'gamma': 4.073527993674258}. Best is trial 25 with value: -1.6942141789173657.
[I 2025-06-20 11:58:57,738] Trial 29 finished with value: -1.7293997689938239 and parameters: {'booster': 'dart', 'lambda': 2.1390645148147196e-08, 'alpha': 0.0006149927979204969, 'subsample': 0.7669761289456173, 'colsample_bytree': 0.7165956579851775, 'max_depth': 5, 'min_child_weight': 9, 'eta': 0.010676194197882015, 'gamma': 2.2018055256318156, 'rate_drop': 1.594776873783563e-05, 'skip_drop': 0.9220559022941637}. Best is trial 25 with value: -1.6942141789173657.
[I 2025-06-20 11:59:07,149] Trial 30 finished with value: -1.7817486783373992 and parameters: {'booster': 'dart', 'lambda': 7.42595764553561e-05, 'alpha': 4.669050589609483e-08, 'subsample': 0.8924578705818788, 'colsample_bytree': 0.6778861495378066, 'max_depth': 4, 'min_child_weight': 10, 'eta': 0.005728629145977755, 'gamma': 2.757245533881349, 'rate_drop': 3.3088050908673594e-08, 'skip_drop': 0.0204384732114493}. Best is trial 25 with value: -1.6942141789173657.
[I 2025-06-20 11:59:16,625] Trial 31 finished with value: -1.7131756364002337 and parameters: {'booster': 'dart', 'lambda': 0.7769978215764898, 'alpha': 1.0291114731899436e-06, 'subsample': 0.6149420641483089, 'colsample_bytree': 0.5850818608219756, 'max_depth': 3, 'min_child_weight': 7, 'eta': 0.021715832059809426, 'gamma': 3.735580165115205, 'rate_drop': 0.0007869190263373211, 'skip_drop': 0.0010061049091566576}. Best is trial 25 with value: -1.6942141789173657.
[I 2025-06-20 11:59:18,835] Trial 32 finished with value: -1.7096891851240847 and parameters: {'booster': 'dart', 'lambda': 0.8721497391471884, 'alpha': 1.356254619520301e-05, 'subsample': 0.5865014652630196, 'colsample_bytree': 0.570381841781719, 'max_depth': 4, 'min_child_weight': 8, 'eta': 0.031284976911528976, 'gamma': 3.8506727596909824, 'rate_drop': 4.427856629322902e-05, 'skip_drop': 0.0005992943072743144}. Best is trial 25 with value: -1.6942141789173657.
[I 2025-06-20 11:59:23,523] Trial 33 finished with value: -1.700918600396679 and parameters: {'booster': 'dart', 'lambda': 0.6068229319005242, 'alpha': 1.6534410647118529e-06, 'subsample': 0.5797529457038663, 'colsample_bytree': 0.5491248326950893, 'max_depth': 4, 'min_child_weight': 6, 'eta': 0.03784231719660895, 'gamma': 4.035762481506675, 'rate_drop': 5.705870004346209e-05, 'skip_drop': 3.591781843781047e-05}. Best is trial 25 with value: -1.6942141789173657.
[I 2025-06-20 11:59:28,703] Trial 34 finished with value: -1.6825200771122633 and parameters: {'booster': 'dart', 'lambda': 2.9491959653223057, 'alpha': 1.5048536093101511e-05, 'subsample': 0.5770065965118019, 'colsample_bytree': 0.5489784912454736, 'max_depth': 4, 'min_child_weight': 6, 'eta': 0.03134384269667928, 'gamma': 4.073945086955508, 'rate_drop': 4.300471370614276e-05, 'skip_drop': 2.6584282483287133e-05}. Best is trial 34 with value: -1.6825200771122633.
[I 2025-06-20 11:59:29,664] Trial 35 finished with value: -1.7461480037618247 and parameters: {'booster': 'dart', 'lambda': 9.530799403826277, 'alpha': 7.32759558195318e-05, 'subsample': 0.5428966717289685, 'colsample_bytree': 0.8345273914229729, 'max_depth': 5, 'min_child_weight': 6, 'eta': 0.0985466923121465, 'gamma': 4.170205712696593, 'rate_drop': 1.4446988850223007e-06, 'skip_drop': 3.3867580151503036e-05}. Best is trial 34 with value: -1.6825200771122633.
[I 2025-06-20 11:59:29,867] Trial 36 finished with value: -1.7301728770955012 and parameters: {'booster': 'gbtree', 'lambda': 8.836522430899067e-08, 'alpha': 3.812837540666697e-08, 'subsample': 0.6344871024542118, 'colsample_bytree': 0.8996553411284008, 'max_depth': 4, 'min_child_weight': 4, 'eta': 0.03517552053916575, 'gamma': 4.565470426572102}. Best is trial 34 with value: -1.6825200771122633.
[I 2025-06-20 11:59:35,684] Trial 37 finished with value: -1.7069099435896429 and parameters: {'booster': 'dart', 'lambda': 2.379040990904154, 'alpha': 0.004859236648202948, 'subsample': 0.5808514923247589, 'colsample_bytree': 0.7785617136029218, 'max_depth': 4, 'min_child_weight': 4, 'eta': 0.029392064076960794, 'gamma': 3.412173743848589, 'rate_drop': 6.367176520159059e-05, 'skip_drop': 7.501950559433961e-07}. Best is trial 34 with value: -1.6825200771122633.
[I 2025-06-20 11:59:35,906] Trial 38 finished with value: -1.710268060872243 and parameters: {'booster': 'gbtree', 'lambda': 0.016048770391651722, 'alpha': 6.75185323002714e-07, 'subsample': 0.5016032804356712, 'colsample_bytree': 0.5010884935546038, 'max_depth': 5, 'min_child_weight': 6, 'eta': 0.06245134150611011, 'gamma': 0.6476039976553073}. Best is trial 34 with value: -1.6825200771122633.
[I 2025-06-20 11:59:36,432] Trial 39 finished with value: -1.8005268564535932 and parameters: {'booster': 'dart', 'lambda': 1.9576939556996882, 'alpha': 0.00014567752193860527, 'subsample': 0.5665479790328686, 'colsample_bytree': 0.5486494330664475, 'max_depth': 5, 'min_child_weight': 3, 'eta': 0.15313113056046312, 'gamma': 1.7333135312489771, 'rate_drop': 9.660961409890117e-07, 'skip_drop': 6.006199944987009e-07}. Best is trial 34 with value: -1.6825200771122633.
[I 2025-06-20 11:59:36,594] Trial 40 finished with value: -1.789085455738808 and parameters: {'booster': 'gbtree', 'lambda': 0.011845260271106679, 'alpha': 0.0008414144100427391, 'subsample': 0.5366497818508904, 'colsample_bytree': 0.7341096116877173, 'max_depth': 4, 'min_child_weight': 5, 'eta': 0.09181418201171702, 'gamma': 1.3141637874455445}. Best is trial 34 with value: -1.6825200771122633.
[I 2025-06-20 11:59:43,114] Trial 41 finished with value: -1.696285523135831 and parameters: {'booster': 'dart', 'lambda': 4.021686526235393, 'alpha': 0.009811222338826784, 'subsample': 0.5690002361698061, 'colsample_bytree': 0.7711242587708081, 'max_depth': 4, 'min_child_weight': 4, 'eta': 0.027955924965208667, 'gamma': 4.257766144448993, 'rate_drop': 3.724039298662049e-05, 'skip_drop': 1.0374124002678603e-06}. Best is trial 34 with value: -1.6825200771122633.
[I 2025-06-20 11:59:45,670] Trial 42 finished with value: -1.7032330832415303 and parameters: {'booster': 'dart', 'lambda': 3.9259403217823436, 'alpha': 0.03148994104073103, 'subsample': 0.6270771121272272, 'colsample_bytree': 0.8225309888982812, 'max_depth': 4, 'min_child_weight': 2, 'eta': 0.04745824641883796, 'gamma': 4.262304548672345, 'rate_drop': 2.1329011973480067e-05, 'skip_drop': 1.0083116795759519e-07}. Best is trial 34 with value: -1.6825200771122633.
[I 2025-06-20 11:59:51,628] Trial 43 finished with value: -1.7184092104475732 and parameters: {'booster': 'dart', 'lambda': 3.547510574434023, 'alpha': 0.03200497176685001, 'subsample': 0.6171787342040542, 'colsample_bytree': 0.8127565615286733, 'max_depth': 3, 'min_child_weight': 2, 'eta': 0.0543179186524788, 'gamma': 4.301584445147788, 'rate_drop': 2.2685116176253426e-05, 'skip_drop': 2.5814239003612297e-08}. Best is trial 34 with value: -1.6825200771122633.
[I 2025-06-20 11:59:52,893] Trial 44 finished with value: -1.7370761087720312 and parameters: {'booster': 'dart', 'lambda': 7.346979804105318, 'alpha': 0.433017838220626, 'subsample': 0.5683545577859691, 'colsample_bytree': 0.7521221650335478, 'max_depth': 5, 'min_child_weight': 1, 'eta': 0.04547545683485945, 'gamma': 3.9750424610863386, 'rate_drop': 0.00020866414179801897, 'skip_drop': 1.0230438058432669e-07}. Best is trial 34 with value: -1.6825200771122633.
[I 2025-06-20 11:59:55,020] Trial 45 finished with value: -1.7166789321027507 and parameters: {'booster': 'dart', 'lambda': 0.08971320577835942, 'alpha': 0.02956893340089273, 'subsample': 0.6200234172836516, 'colsample_bytree': 0.6235082537107505, 'max_depth': 4, 'min_child_weight': 2, 'eta': 0.02961213514920249, 'gamma': 4.4278458079926, 'rate_drop': 5.99069840782958e-06, 'skip_drop': 2.7571789239218045e-05}. Best is trial 34 with value: -1.6825200771122633.
[I 2025-06-20 11:59:56,024] Trial 46 finished with value: -1.718897023762389 and parameters: {'booster': 'dart', 'lambda': 0.7571556452378391, 'alpha': 0.9420517334613789, 'subsample': 0.7135229773743533, 'colsample_bytree': 0.5590479537274349, 'max_depth': 3, 'min_child_weight': 3, 'eta': 0.11465395993363914, 'gamma': 4.703008401469192, 'rate_drop': 2.313787870323039e-05, 'skip_drop': 1.8330229518275895e-06}. Best is trial 34 with value: -1.6825200771122633.
[I 2025-06-20 11:59:58,456] Trial 47 finished with value: -1.7522803698116343 and parameters: {'booster': 'dart', 'lambda': 3.8522245259674435, 'alpha': 0.023027600700966815, 'subsample': 0.5885787526480138, 'colsample_bytree': 0.5261390240365704, 'max_depth': 4, 'min_child_weight': 4, 'eta': 0.07795019851078686, 'gamma': 3.441223207298503, 'rate_drop': 5.065153307260248e-06, 'skip_drop': 1.0863997016499563e-07}. Best is trial 34 with value: -1.6825200771122633.
[I 2025-06-20 12:00:07,423] Trial 48 finished with value: -1.7318044695450252 and parameters: {'booster': 'dart', 'lambda': 0.7818027218324697, 'alpha': 2.9959304130962847, 'subsample': 0.5240958227646622, 'colsample_bytree': 0.8791516767121248, 'max_depth': 5, 'min_child_weight': 1, 'eta': 0.019034275089502478, 'gamma': 4.094413276942185, 'rate_drop': 6.232391844705947e-05, 'skip_drop': 3.0783302141569996e-05}. Best is trial 34 with value: -1.6825200771122633.
