[I 2025-06-20 12:18:06,859] Trial 237 finished with value: -1.6998612244914582 and parameters: {'booster': 'dart', 'lambda': 2.40119527010391e-07, 'alpha': 2.0826024203480953e-08, 'subsample': 0.5094283875481933, 'colsample_bytree': 0.5359209268833105, 'max_depth': 6, 'min_child_weight': 3, 'eta': 0.020532618692922385, 'gamma': 4.910504355813338, 'rate_drop': 8.459575757661256e-07, 'skip_drop': 2.5790824146969106e-08}. Best is trial 189 with value: -1.66206808945109.
[I 2025-06-20 12:18:12,258] Trial 238 finished with value: -1.6711675477051329 and parameters: {'booster': 'dart', 'lambda': 1.7292190097879828e-06, 'alpha': 3.169383765774385e-08, 'subsample': 0.518131416250652, 'colsample_bytree': 0.5690768097776451, 'max_depth': 6, 'min_child_weight': 3, 'eta': 0.021405152215716743, 'gamma': 4.736525821445826, 'rate_drop': 3.435167944050667e-07, 'skip_drop': 4.011998768404262e-08}. Best is trial 189 with value: -1.66206808945109.
[I 2025-06-20 12:18:16,253] Trial 239 finished with value: -1.683758661354885 and parameters: {'booster': 'dart', 'lambda': 1.6505490677522232e-06, 'alpha': 1.5091922296413193e-08, 'subsample': 0.5007380746849943, 'colsample_bytree': 0.5250198192311947, 'max_depth': 6, 'min_child_weight': 3, 'eta': 0.027983851933463998, 'gamma': 4.930637682497972, 'rate_drop': 1.8814144243085332e-07, 'skip_drop': 4.912743049291937e-08}. Best is trial 189 with value: -1.66206808945109.
[I 2025-06-20 12:18:21,651] Trial 240 finished with value: -1.691468215682691 and parameters: {'booster': 'dart', 'lambda': 5.598828986656143e-07, 'alpha': 2.4376050119337544e-08, 'subsample': 0.5209543089503683, 'colsample_bytree': 0.5635677740000561, 'max_depth': 6, 'min_child_weight': 2, 'eta': 0.020547613745937297, 'gamma': 4.997681073251735, 'rate_drop': 5.741551142340112e-07, 'skip_drop': 3.812328074449179e-08}. Best is trial 189 with value: -1.66206808945109.
[I 2025-06-20 12:18:28,622] Trial 241 finished with value: -1.6707275148616714 and parameters: {'booster': 'dart', 'lambda': 2.9932306250835996e-06, 'alpha': 3.0336992900523594e-08, 'subsample': 0.5160341498982848, 'colsample_bytree': 0.5458328425686607, 'max_depth': 6, 'min_child_weight': 3, 'eta': 0.021890845288881796, 'gamma': 4.720433996663261, 'rate_drop': 1.0199246217454722e-06, 'skip_drop': 2.218805422856376e-08}. Best is trial 189 with value: -1.66206808945109.
[I 2025-06-20 12:18:32,577] Trial 242 finished with value: -1.6622426388953149 and parameters: {'booster': 'dart', 'lambda': 2.677643958907707e-06, 'alpha': 3.24293559778048e-08, 'subsample': 0.526609721290466, 'colsample_bytree': 0.5688652075153026, 'max_depth': 6, 'min_child_weight': 3, 'eta': 0.025206349258505532, 'gamma': 4.719422167896482, 'rate_drop': 3.684688556045586e-07, 'skip_drop': 2.658578402667169e-08}. Best is trial 189 with value: -1.66206808945109.
[I 2025-06-20 12:18:39,342] Trial 243 finished with value: -1.6696867966980886 and parameters: {'booster': 'dart', 'lambda': 3.3262431442335044e-06, 'alpha': 1.7952383453594386e-08, 'subsample': 0.5296339753000184, 'colsample_bytree': 0.5705040183050593, 'max_depth': 6, 'min_child_weight': 3, 'eta': 0.02129070626489418, 'gamma': 4.701601475857758, 'rate_drop': 3.9800529816029187e-07, 'skip_drop': 2.5434757997646663e-08}. Best is trial 189 with value: -1.66206808945109.
[I 2025-06-20 12:18:45,038] Trial 244 finished with value: -1.6764321546162093 and parameters: {'booster': 'dart', 'lambda': 2.9955242676476206e-06, 'alpha': 1.7427757666767995e-08, 'subsample': 0.5285032697073478, 'colsample_bytree': 0.5713523222565335, 'max_depth': 6, 'min_child_weight': 3, 'eta': 0.020204272282327237, 'gamma': 4.703669701160704, 'rate_drop': 6.922308409077834e-08, 'skip_drop': 2.335689064874897e-08}. Best is trial 189 with value: -1.66206808945109.
[I 2025-06-20 12:18:51,873] Trial 245 finished with value: -1.6650363622052713 and parameters: {'booster': 'dart', 'lambda': 3.628515957054777e-06, 'alpha': 2.8753141254156416e-08, 'subsample': 0.5279694126011986, 'colsample_bytree': 0.5706378415750395, 'max_depth': 6, 'min_child_weight': 3, 'eta': 0.021301037521037566, 'gamma': 4.9113970681003085, 'rate_drop': 2.1899643370677974e-07, 'skip_drop': 3.0228099858379476e-08}. Best is trial 189 with value: -1.66206808945109.
[I 2025-06-20 12:18:58,565] Trial 246 finished with value: -1.6684128027669365 and parameters: {'booster': 'dart', 'lambda': 4.855590946537921e-06, 'alpha': 1.025969027161223e-08, 'subsample': 0.5300546374407774, 'colsample_bytree': 0.5714708633893891, 'max_depth': 6, 'min_child_weight': 3, 'eta': 0.020625935866574786, 'gamma': 4.699491529494874, 'rate_drop': 3.052546711588234e-07, 'skip_drop': 2.518611846491585e-08}. Best is trial 189 with value: -1.66206808945109.
[I 2025-06-20 12:19:05,317] Trial 247 finished with value: -1.6757452430319264 and parameters: {'booster': 'dart', 'lambda': 2.6693360039603895e-06, 'alpha': 1.0048885059823504e-08, 'subsample': 0.5294732110265442, 'colsample_bytree': 0.569660135374161, 'max_depth': 6, 'min_child_weight': 3, 'eta': 0.019323393257355145, 'gamma': 4.584148507798545, 'rate_drop': 3.6491916885172976e-07, 'skip_drop': 6.83409999998839e-08}. Best is trial 189 with value: -1.66206808945109.
[I 2025-06-20 12:19:11,893] Trial 248 finished with value: -1.667732126235821 and parameters: {'booster': 'dart', 'lambda': 5.101313192137672e-06, 'alpha': 1.3698960915076875e-08, 'subsample': 0.5386613456114778, 'colsample_bytree': 0.5708148218678821, 'max_depth': 6, 'min_child_weight': 3, 'eta': 0.022882583135741263, 'gamma': 4.751184311708894, 'rate_drop': 1.374502694025981e-07, 'skip_drop': 2.8772804831570013e-08}. Best is trial 189 with value: -1.66206808945109.
[I 2025-06-20 12:19:17,268] Trial 249 finished with value: -1.6629100685395315 and parameters: {'booster': 'dart', 'lambda': 4.651251244829984e-06, 'alpha': 2.4187152163034793e-08, 'subsample': 0.5414809703657144, 'colsample_bytree': 0.5738569438579244, 'max_depth': 6, 'min_child_weight': 3, 'eta': 0.025356724271983117, 'gamma': 4.695834335393876, 'rate_drop': 9.176101544967907e-08, 'skip_drop': 2.791614266284031e-08}. Best is trial 189 with value: -1.66206808945109.
[I 2025-06-20 12:19:22,621] Trial 250 finished with value: -1.6752913693476232 and parameters: {'booster': 'dart', 'lambda': 6.183494059833594e-06, 'alpha': 1.4902522557999684e-08, 'subsample': 0.5427590412053028, 'colsample_bytree': 0.5743260999213039, 'max_depth': 6, 'min_child_weight': 3, 'eta': 0.022095568934836173, 'gamma': 4.676909749555448, 'rate_drop': 1.347312920013902e-07, 'skip_drop': 2.5765255374930417e-08}. Best is trial 189 with value: -1.66206808945109.
[I 2025-06-20 12:19:25,280] Trial 251 finished with value: -1.6726811024822295 and parameters: {'booster': 'dart', 'lambda': 5.071841485169189e-06, 'alpha': 2.5158927748904796e-08, 'subsample': 0.5428649936065763, 'colsample_bytree': 0.5921932356982945, 'max_depth': 6, 'min_child_weight': 3, 'eta': 0.030109143579711478, 'gamma': 4.540736726923595, 'rate_drop': 9.659528098270504e-08, 'skip_drop': 3.1208295693742955e-08}. Best is trial 189 with value: -1.66206808945109.
[I 2025-06-20 12:19:27,898] Trial 252 finished with value: -1.6904336793320807 and parameters: {'booster': 'dart', 'lambda': 4.943401063563338e-06, 'alpha': 2.4340097174642844e-08, 'subsample': 0.5439108896430448, 'colsample_bytree': 0.5713315587009608, 'max_depth': 6, 'min_child_weight': 3, 'eta': 0.031061897286972583, 'gamma': 4.588885893877158, 'rate_drop': 9.839388012486292e-08, 'skip_drop': 5.9268601057220644e-08}. Best is trial 189 with value: -1.66206808945109.
[I 2025-06-20 12:19:33,302] Trial 253 finished with value: -1.6703548021402803 and parameters: {'booster': 'dart', 'lambda': 1.3134464717807433e-05, 'alpha': 1.4827993585798219e-08, 'subsample': 0.532205266059973, 'colsample_bytree': 0.5924764309115059, 'max_depth': 9, 'min_child_weight': 3, 'eta': 0.029938118845130715, 'gamma': 4.709837726684392, 'rate_drop': 2.714599012595674e-07, 'skip_drop': 3.154090508654945e-08}. Best is trial 189 with value: -1.66206808945109.
[I 2025-06-20 12:19:34,712] Trial 254 finished with value: -1.669904866195845 and parameters: {'booster': 'dart', 'lambda': 1.2723159873809185e-05, 'alpha': 1.048437314470104e-08, 'subsample': 0.5382877517010132, 'colsample_bytree': 0.5924274651328776, 'max_depth': 9, 'min_child_weight': 3, 'eta': 0.03605186386049006, 'gamma': 4.705954518704928, 'rate_drop': 2.5117460503211745e-07, 'skip_drop': 3.174003992114784e-08}. Best is trial 189 with value: -1.66206808945109.
[I 2025-06-20 12:19:36,384] Trial 255 finished with value: -1.6858071022195666 and parameters: {'booster': 'dart', 'lambda': 1.02070344305372e-05, 'alpha': 1.0826251137760971e-08, 'subsample': 0.5347846510095172, 'colsample_bytree': 0.5948234836916879, 'max_depth': 9, 'min_child_weight': 3, 'eta': 0.03621951053349575, 'gamma': 4.677331663427714, 'rate_drop': 4.146684701964964e-08, 'skip_drop': 3.063592908484225e-08}. Best is trial 189 with value: -1.66206808945109.
[I 2025-06-20 12:19:39,127] Trial 256 finished with value: -1.6856884133028434 and parameters: {'booster': 'dart', 'lambda': 5.374667880227417e-06, 'alpha': 2.5882408662230433e-08, 'subsample': 0.5450205636948183, 'colsample_bytree': 0.5922254739940263, 'max_depth': 9, 'min_child_weight': 2, 'eta': 0.035602109109441345, 'gamma': 4.507734179262628, 'rate_drop': 2.931140121249854e-07, 'skip_drop': 3.3330688224532065e-08}. Best is trial 189 with value: -1.66206808945109.
[I 2025-06-20 12:19:41,918] Trial 257 finished with value: -1.720528864965529 and parameters: {'booster': 'dart', 'lambda': 1.6123848620978394e-05, 'alpha': 1.4494980131788131e-08, 'subsample': 0.5373823132285415, 'colsample_bytree': 0.6015583923716994, 'max_depth': 9, 'min_child_weight': 3, 'eta': 0.02983776370620787, 'gamma': 4.5707909322485305, 'rate_drop': 2.52523900972334e-07, 'skip_drop': 5.454408650972786e-08}. Best is trial 189 with value: -1.66206808945109.
[I 2025-06-20 12:19:45,432] Trial 258 finished with value: -1.6822641133425038 and parameters: {'booster': 'dart', 'lambda': 8.21425251157191e-06, 'alpha': 1.0015836039100306e-08, 'subsample': 0.5294048662246517, 'colsample_bytree': 0.5769831251499592, 'max_depth': 6, 'min_child_weight': 3, 'eta': 0.030262346359723136, 'gamma': 4.72968414685991, 'rate_drop': 1.4366953245961856e-07, 'skip_drop': 2.8774527484173326e-08}. Best is trial 189 with value: -1.66206808945109.
[I 2025-06-20 12:19:48,160] Trial 259 finished with value: -1.7180229344295028 and parameters: {'booster': 'dart', 'lambda': 3.048774060142744e-06, 'alpha': 2.950357156859032e-08, 'subsample': 0.5419074011130232, 'colsample_bytree': 0.6162944723004277, 'max_depth': 10, 'min_child_weight': 3, 'eta': 0.02776515812847318, 'gamma': 4.714097218748336, 'rate_drop': 8.631661175373062e-08, 'skip_drop': 2.0868167840345502e-08}. Best is trial 189 with value: -1.66206808945109.
[I 2025-06-20 12:19:50,779] Trial 260 finished with value: -1.6826368623146937 and parameters: {'booster': 'dart', 'lambda': 4.059151741466559e-06, 'alpha': 1.6938721288965016e-08, 'subsample': 0.5517867400823805, 'colsample_bytree': 0.5876097607062761, 'max_depth': 9, 'min_child_weight': 3, 'eta': 0.03246614402583185, 'gamma': 4.618962291154654, 'rate_drop': 1.7179105942701825e-07, 'skip_drop': 6.927004630723758e-08}. Best is trial 189 with value: -1.66206808945109.
[I 2025-06-20 12:19:52,164] Trial 261 finished with value: -1.6974689095879016 and parameters: {'booster': 'dart', 'lambda': 1.2411551148301684e-05, 'alpha': 3.120535396114894e-08, 'subsample': 0.5307102665429013, 'colsample_bytree': 0.5898206374142366, 'max_depth': 9, 'min_child_weight': 3, 'eta': 0.039652969360473654, 'gamma': 4.51489868819659, 'rate_drop': 2.17884536605207e-07, 'skip_drop': 3.327288016090127e-08}. Best is trial 189 with value: -1.66206808945109.
[I 2025-06-20 12:19:56,645] Trial 262 finished with value: -1.7023106002004416 and parameters: {'booster': 'dart', 'lambda': 2.7119430832691726e-06, 'alpha': 1.9896274051898085e-08, 'subsample': 0.5323977432189468, 'colsample_bytree': 0.5700229560363902, 'max_depth': 9, 'min_child_weight': 3, 'eta': 0.025147721545325373, 'gamma': 4.732534066730245, 'rate_drop': 3.4464561156043773e-07, 'skip_drop': 5.0390442128087335e-08}. Best is trial 189 with value: -1.66206808945109.
[I 2025-06-20 12:20:06,594] Trial 263 finished with value: -1.7859127934268648 and parameters: {'booster': 'dart', 'lambda': 6.60970077932963e-06, 'alpha': 1.499519568506812e-08, 'subsample': 0.5398919525248757, 'colsample_bytree': 0.5745291561735468, 'max_depth': 6, 'min_child_weight': 3, 'eta': 0.004077837202460319, 'gamma': 4.732463209574264, 'rate_drop': 6.188912089566298e-08, 'skip_drop': 2.1966580638794754e-08}. Best is trial 189 with value: -1.66206808945109.
[I 2025-06-20 12:20:13,596] Trial 264 finished with value: -1.681337721484204 and parameters: {'booster': 'dart', 'lambda': 5.2534276534921505e-06, 'alpha': 3.1337558790504566e-08, 'subsample': 0.525163777478486, 'colsample_bytree': 0.5690933417169828, 'max_depth': 6, 'min_child_weight': 3, 'eta': 0.01850369482252809, 'gamma': 4.640348861998723, 'rate_drop': 5.23857175523488e-07, 'skip_drop': 3.2112971972086495e-08}. Best is trial 189 with value: -1.66206808945109.
[I 2025-06-20 12:20:17,611] Trial 265 finished with value: -1.6901044171102415 and parameters: {'booster': 'dart', 'lambda': 1.6794771856496778e-06, 'alpha': 1.0532796864000597e-08, 'subsample': 0.5505769215149425, 'colsample_bytree': 0.5866302885373585, 'max_depth': 6, 'min_child_weight': 2, 'eta': 0.022656386138458513, 'gamma': 4.736051167545884, 'rate_drop': 1.027439367885498e-07, 'skip_drop': 4.5178593736851765e-08}. Best is trial 189 with value: -1.66206808945109.
[I 2025-06-20 12:20:19,585] Trial 266 finished with value: -1.6699216575631328 and parameters: {'booster': 'dart', 'lambda': 3.09311065719155e-06, 'alpha': 2.1241973259424186e-08, 'subsample': 0.5284627314602374, 'colsample_bytree': 0.5971748474316847, 'max_depth': 6, 'min_child_weight': 3, 'eta': 0.034171454282985035, 'gamma': 4.583535187163045, 'rate_drop': 1.1987998429153996e-08, 'skip_drop': 1.742346788123015e-08}. Best is trial 189 with value: -1.66206808945109.
[I 2025-06-20 12:20:22,205] Trial 267 finished with value: -1.6842811770570085 and parameters: {'booster': 'dart', 'lambda': 3.960963904559922e-06, 'alpha': 1.996338833034613e-08, 'subsample': 0.530926251782211, 'colsample_bytree': 0.6044215638425062, 'max_depth': 6, 'min_child_weight': 3, 'eta': 0.033705220180603505, 'gamma': 4.372252984533745, 'rate_drop': 2.636935414120453e-08, 'skip_drop': 1.5751250929283903e-08}. Best is trial 189 with value: -1.66206808945109.
[I 2025-06-20 12:20:24,888] Trial 268 finished with value: -1.6722505699289314 and parameters: {'booster': 'dart', 'lambda': 3.5557478658396697e-06, 'alpha': 2.226744635828013e-08, 'subsample': 0.5411101456715499, 'colsample_bytree': 0.588247336551629, 'max_depth': 6, 'min_child_weight': 3, 'eta': 0.035566057815085934, 'gamma': 4.494264839258774, 'rate_drop': 1.3133553840334614e-08, 'skip_drop': 6.562977696169087e-08}. Best is trial 189 with value: -1.66206808945109.
[I 2025-06-20 12:20:26,708] Trial 269 finished with value: -1.6954009528661957 and parameters: {'booster': 'dart', 'lambda': 2.289380438638758e-06, 'alpha': 1.5038434131652053e-08, 'subsample': 0.5277143212319219, 'colsample_bytree': 0.5808400939001115, 'max_depth': 6, 'min_child_weight': 3, 'eta': 0.034288370561295224, 'gamma': 0.6292140627111431, 'rate_drop': 2.9895030569584606e-08, 'skip_drop': 7.224154224699767e-08}. Best is trial 189 with value: -1.66206808945109.
[I 2025-06-20 12:20:28,140] Trial 270 finished with value: -1.6851591133282942 and parameters: {'booster': 'dart', 'lambda': 3.869735303698086e-06, 'alpha': 1.9446566065785313e-08, 'subsample': 0.55569019470522, 'colsample_bytree': 0.5951195936973925, 'max_depth': 6, 'min_child_weight': 3, 'eta': 0.043350292545100935, 'gamma': 4.493289276320791, 'rate_drop': 1.0272032802541444e-08, 'skip_drop': 5.7489520953265444e-08}. Best is trial 189 with value: -1.66206808945109.
[I 2025-06-20 12:20:29,985] Trial 271 finished with value: -1.6733878830901923 and parameters: {'booster': 'dart', 'lambda': 7.675888112726466e-06, 'alpha': 3.0035685941904476e-08, 'subsample': 0.5351089623405065, 'colsample_bytree': 0.5700525958837921, 'max_depth': 6, 'min_child_weight': 3, 'eta': 0.03772092878198702, 'gamma': 4.63297979988789, 'rate_drop': 3.7382427273953524e-07, 'skip_drop': 2.1898288168450347e-08}. Best is trial 189 with value: -1.66206808945109.
[I 2025-06-20 12:20:35,670] Trial 272 finished with value: -1.6801326315007399 and parameters: {'booster': 'dart', 'lambda': 2.1573410300668437e-06, 'alpha': 1.3765641165829457e-08, 'subsample': 0.5247750204057828, 'colsample_bytree': 0.5802708908386011, 'max_depth': 6, 'min_child_weight': 3, 'eta': 0.017982654014027304, 'gamma': 4.7439589688097135, 'rate_drop': 2.3200130017292238e-08, 'skip_drop': 7.661252847403208e-08}. Best is trial 189 with value: -1.66206808945109.
[I 2025-06-20 12:20:41,159] Trial 273 finished with value: -1.6747334404402037 and parameters: {'booster': 'dart', 'lambda': 3.340764680427499e-06, 'alpha': 1.0787864343136058e-08, 'subsample': 0.5406868976117312, 'colsample_bytree': 0.5657548230585797, 'max_depth': 6, 'min_child_weight': 3, 'eta': 0.0263488035719414, 'gamma': 4.868981986383983, 'rate_drop': 1.7004095966656467e-08, 'skip_drop': 4.1914113244766357e-08}. Best is trial 189 with value: -1.66206808945109.
[I 2025-06-20 12:20:45,091] Trial 274 finished with value: -1.7159557225220745 and parameters: {'booster': 'dart', 'lambda': 1.2498550834038861e-05, 'alpha': 2.3381824181871054e-08, 'subsample': 0.5243059587046869, 'colsample_bytree': 0.6000223998679999, 'max_depth': 6, 'min_child_weight': 2, 'eta': 0.019027974007432596, 'gamma': 4.615277915554108, 'rate_drop': 2.7741051872944616e-07, 'skip_drop': 1.9825212173976443e-08}. Best is trial 189 with value: -1.66206808945109.
[I 2025-06-20 12:20:52,400] Trial 275 finished with value: -1.6781665412966393 and parameters: {'booster': 'dart', 'lambda': 1.9185023702059817e-06, 'alpha': 2.9601288288635404e-08, 'subsample': 0.5344406143582487, 'colsample_bytree': 0.6116346310233804, 'max_depth': 6, 'min_child_weight': 3, 'eta': 0.01950041862036066, 'gamma': 4.756071539298805, 'rate_drop': 5.590305307674661e-07, 'skip_drop': 1.5349286593444328e-08}. Best is trial 189 with value: -1.66206808945109.
[I 2025-06-20 12:20:59,339] Trial 276 finished with value: -1.679138066673797 and parameters: {'booster': 'dart', 'lambda': 3.4022142099099467e-06, 'alpha': 1.6538157716394625e-08, 'subsample': 0.5461162991789029, 'colsample_bytree': 0.575552889206227, 'max_depth': 6, 'min_child_weight': 3, 'eta': 0.016899829089662956, 'gamma': 4.431860999667288, 'rate_drop': 1.423544998568813e-08, 'skip_drop': 3.437486115295086e-08}. Best is trial 189 with value: -1.66206808945109.
[I 2025-06-20 12:21:03,078] Trial 277 finished with value: -1.7248814594216169 and parameters: {'booster': 'dart', 'lambda': 3.1274422386316474e-05, 'alpha': 2.0093646564354462e-08, 'subsample': 0.9971708797808225, 'colsample_bytree': 0.5685900005180466, 'max_depth': 6, 'min_child_weight': 3, 'eta': 0.02768140568111875, 'gamma': 4.872577206577664, 'rate_drop': 1.93758071933108e-07, 'skip_drop': 5.225787153573244e-08}. Best is trial 189 with value: -1.66206808945109.
[I 2025-06-20 12:21:06,557] Trial 278 finished with value: -1.6864866822744506 and parameters: {'booster': 'dart', 'lambda': 2.0841260691314824e-07, 'alpha': 3.397442472020282e-08, 'subsample': 0.5211162152077531, 'colsample_bytree': 0.5878889709972782, 'max_depth': 6, 'min_child_weight': 3, 'eta': 0.022182042789863774, 'gamma': 1.0702814386028119, 'rate_drop': 4.643779007407746e-07, 'skip_drop': 7.76362279945979e-08}. Best is trial 189 with value: -1.66206808945109.
[I 2025-06-20 12:21:10,495] Trial 279 finished with value: -1.6720501148761433 and parameters: {'booster': 'dart', 'lambda': 2.0777498321518285e-07, 'alpha': 1.0718586434731513e-08, 'subsample': 0.5578287569338108, 'colsample_bytree': 0.5613879814653595, 'max_depth': 6, 'min_child_weight': 3, 'eta': 0.025060740223706045, 'gamma': 4.6740042185364965, 'rate_drop': 1.45053273233824e-07, 'skip_drop': 3.076419059955345e-08}. Best is trial 189 with value: -1.66206808945109.
[I 2025-06-20 12:21:13,164] Trial 280 finished with value: -1.7439210207914995 and parameters: {'booster': 'dart', 'lambda': 2.2197585057895362e-07, 'alpha': 1.0480914213764145e-08, 'subsample': 0.5513584557709414, 'colsample_bytree': 0.9088160624263875, 'max_depth': 6, 'min_child_weight': 3, 'eta': 0.025476936347059824, 'gamma': 4.584251193630285, 'rate_drop': 1.255369250949634e-07, 'skip_drop': 4.2617741218196096e-08}. Best is trial 189 with value: -1.66206808945109.
[I 2025-06-20 12:21:15,893] Trial 281 finished with value: -1.6741789576306079 and parameters: {'booster': 'dart', 'lambda': 6.161079497005535e-06, 'alpha': 1.4501671660112867e-08, 'subsample': 0.5632478316267056, 'colsample_bytree': 0.5631829805437089, 'max_depth': 6, 'min_child_weight': 3, 'eta': 0.03295224983791426, 'gamma': 4.718326005114449, 'rate_drop': 2.59413798608145e-07, 'skip_drop': 1.7215207682328154e-08}. Best is trial 189 with value: -1.66206808945109.
[I 2025-06-20 12:21:25,661] Trial 282 finished with value: -1.9240031303715832 and parameters: {'booster': 'dart', 'lambda': 1.5920988822007035e-07, 'alpha': 1.0134606382597455e-08, 'subsample': 0.5375750162057762, 'colsample_bytree': 0.579307081311613, 'max_depth': 6, 'min_child_weight': 2, 'eta': 0.001223818704626976, 'gamma': 4.503567864903089, 'rate_drop': 1.8957320635466938e-07, 'skip_drop': 2.9097226513095632e-08}. Best is trial 189 with value: -1.66206808945109.
