[I 2025-06-20 12:31:35,965] Trial 421 finished with value: -1.6845529739644243 and parameters: {'booster': 'dart', 'lambda': 1.4390606447912637e-06, 'alpha': 7.578903391779402e-08, 'subsample': 0.5339402615263594, 'colsample_bytree': 0.5660684301266684, 'max_depth': 6, 'min_child_weight': 3, 'eta': 0.018363384293367025, 'gamma': 4.850292988546378, 'rate_drop': 1.1746348470889421e-07, 'skip_drop': 1.5990099302081223e-07}. Best is trial 389 with value: -1.6460117617383008.
[I 2025-06-20 12:31:36,494] Trial 422 finished with value: -1.7085621330179204 and parameters: {'booster': 'gbtree', 'lambda': 3.938040096058627e-07, 'alpha': 1.8431086715160564e-08, 'subsample': 0.5097893556631271, 'colsample_bytree': 0.550545038283319, 'max_depth': 6, 'min_child_weight': 3, 'eta': 0.020629259891376733, 'gamma': 4.999716138737438}. Best is trial 389 with value: -1.6460117617383008.
[I 2025-06-20 12:31:38,769] Trial 423 finished with value: -1.7011088577485693 and parameters: {'booster': 'dart', 'lambda': 8.123737885056995e-07, 'alpha': 3.2354581508651976e-08, 'subsample': 0.6947022609720113, 'colsample_bytree': 0.542273595775145, 'max_depth': 6, 'min_child_weight': 3, 'eta': 0.02714506293464668, 'gamma': 4.664690063314263, 'rate_drop': 2.928794864830606e-05, 'skip_drop': 2.380730231078035e-08}. Best is trial 389 with value: -1.6460117617383008.
[I 2025-06-20 12:31:42,651] Trial 424 finished with value: -1.6739551594866544 and parameters: {'booster': 'dart', 'lambda': 1.1685175834519687e-07, 'alpha': 5.037262378777637e-08, 'subsample': 0.5488672957811698, 'colsample_bytree': 0.5690184150742321, 'max_depth': 6, 'min_child_weight': 3, 'eta': 0.023907309522114756, 'gamma': 4.895647689020848, 'rate_drop': 7.828159192666492e-08, 'skip_drop': 7.10704756102848e-08}. Best is trial 389 with value: -1.6460117617383008.
[I 2025-06-20 12:31:52,161] Trial 425 finished with value: -1.7023629218660492 and parameters: {'booster': 'dart', 'lambda': 1.550366775137287e-06, 'alpha': 1.4506365658987613e-08, 'subsample': 0.8432343835938823, 'colsample_bytree': 0.5562175933793918, 'max_depth': 6, 'min_child_weight': 4, 'eta': 0.018014455298241798, 'gamma': 4.759855977451636, 'rate_drop': 4.709467708422791e-08, 'skip_drop': 1.614410059979798e-08}. Best is trial 389 with value: -1.6460117617383008.
[I 2025-06-20 12:31:56,076] Trial 426 finished with value: -1.6868190546649877 and parameters: {'booster': 'dart', 'lambda': 2.110840865829827e-07, 'alpha': 2.35567252143754e-08, 'subsample': 0.5193889064295892, 'colsample_bytree': 0.580304975739472, 'max_depth': 6, 'min_child_weight': 3, 'eta': 0.029831330810697606, 'gamma': 4.835836903508455, 'rate_drop': 2.1253399451276433e-08, 'skip_drop': 4.0818372974281206e-08}. Best is trial 389 with value: -1.6460117617383008.
[I 2025-06-20 12:32:03,760] Trial 427 finished with value: -1.7116699551817929 and parameters: {'booster': 'dart', 'lambda': 5.363309783101986e-07, 'alpha': 1.4282135860668954e-08, 'subsample': 0.677967540543021, 'colsample_bytree': 0.5615980940055881, 'max_depth': 6, 'min_child_weight': 3, 'eta': 0.021595153569719427, 'gamma': 4.895080778480091, 'rate_drop': 1.7397748375015708e-07, 'skip_drop': 2.8384416237889503e-08}. Best is trial 389 with value: -1.6460117617383008.
[I 2025-06-20 12:32:08,418] Trial 428 finished with value: -1.6768067473805726 and parameters: {'booster': 'dart', 'lambda': 1.080457603019018e-06, 'alpha': 3.4964510687430246e-08, 'subsample': 0.5386956214895751, 'colsample_bytree': 0.5381356546703816, 'max_depth': 7, 'min_child_weight': 3, 'eta': 0.025003857961303926, 'gamma': 3.3106174153539367, 'rate_drop': 1.118220903001288e-07, 'skip_drop': 1.0105650303015691e-08}. Best is trial 389 with value: -1.6460117617383008.
[I 2025-06-20 12:32:15,551] Trial 429 finished with value: -1.7062313569942968 and parameters: {'booster': 'dart', 'lambda': 2.9753796486381905e-07, 'alpha': 2.470840802032102e-08, 'subsample': 0.52812608861705, 'colsample_bytree': 0.5719617379259732, 'max_depth': 6, 'min_child_weight': 7, 'eta': 0.01586454773036857, 'gamma': 4.716630713590252, 'rate_drop': 6.264947720497017e-08, 'skip_drop': 5.0441258810215156e-08}. Best is trial 389 with value: -1.6460117617383008.
[I 2025-06-20 12:32:19,936] Trial 430 finished with value: -1.691095401435906 and parameters: {'booster': 'dart', 'lambda': 1.6729450837923052e-06, 'alpha': 5.152605455991157e-08, 'subsample': 0.5079502361275459, 'colsample_bytree': 0.5578198047958607, 'max_depth': 6, 'min_child_weight': 2, 'eta': 0.020056887093528285, 'gamma': 1.3313602937060698, 'rate_drop': 3.9930806304929194e-08, 'skip_drop': 1.917097871676668e-08}. Best is trial 389 with value: -1.6460117617383008.
[I 2025-06-20 12:32:26,121] Trial 431 finished with value: -1.7034831061561342 and parameters: {'booster': 'dart', 'lambda': 6.980438839851926e-07, 'alpha': 0.00011544434423099397, 'subsample': 0.5671011466908455, 'colsample_bytree': 0.5820449247560544, 'max_depth': 6, 'min_child_weight': 3, 'eta': 0.028502163977902218, 'gamma': 4.800640478880223, 'rate_drop': 1.5699178220269444e-05, 'skip_drop': 0.34315211441176635}. Best is trial 389 with value: -1.6460117617383008.
[I 2025-06-20 12:32:33,129] Trial 432 finished with value: -1.6856342545052856 and parameters: {'booster': 'dart', 'lambda': 2.1386323585876833e-06, 'alpha': 1.492044231851293e-08, 'subsample': 0.5193796770080247, 'colsample_bytree': 0.5513653441044065, 'max_depth': 5, 'min_child_weight': 3, 'eta': 0.01736410884162528, 'gamma': 4.627825059579367, 'rate_drop': 2.652594554679165e-07, 'skip_drop': 3.344801693671563e-08}. Best is trial 389 with value: -1.6460117617383008.
[I 2025-06-20 12:32:37,159] Trial 433 finished with value: -1.7018183382407597 and parameters: {'booster': 'dart', 'lambda': 1.0472377816238606e-06, 'alpha': 2.0990182170702914e-08, 'subsample': 0.5430667645408865, 'colsample_bytree': 0.566409036127015, 'max_depth': 6, 'min_child_weight': 4, 'eta': 0.022641725172243395, 'gamma': 4.912813093594379, 'rate_drop': 8.873057133393287e-08, 'skip_drop': 1.1545795136313158e-07}. Best is trial 389 with value: -1.6460117617383008.
[I 2025-06-20 12:32:39,953] Trial 434 finished with value: -1.7088110323666381 and parameters: {'booster': 'dart', 'lambda': 3.924768520968563e-06, 'alpha': 8.834457983115033e-08, 'subsample': 0.5344480417851436, 'colsample_bytree': 0.7839334018148089, 'max_depth': 6, 'min_child_weight': 3, 'eta': 0.025553289331829356, 'gamma': 4.739672853914301, 'rate_drop': 3.8421415926247695e-07, 'skip_drop': 1.600901793749874e-08}. Best is trial 389 with value: -1.6460117617383008.
[I 2025-06-20 12:32:44,405] Trial 435 finished with value: -1.736062389081582 and parameters: {'booster': 'dart', 'lambda': 3.54606571783339e-07, 'alpha': 1.0148072377430442e-08, 'subsample': 0.5559956192314175, 'colsample_bytree': 0.5350289051129027, 'max_depth': 6, 'min_child_weight': 3, 'eta': 0.030354013069366727, 'gamma': 4.997492940557783, 'rate_drop': 3.1061231971014245e-08, 'skip_drop': 0.06485280434984016}. Best is trial 389 with value: -1.6460117617383008.
[I 2025-06-20 12:32:50,164] Trial 436 finished with value: -1.6811377348759668 and parameters: {'booster': 'dart', 'lambda': 4.722929913401829e-07, 'alpha': 3.615161168346021e-08, 'subsample': 0.5255646540664954, 'colsample_bytree': 0.5756527749964836, 'max_depth': 6, 'min_child_weight': 3, 'eta': 0.020162058811019325, 'gamma': 4.84407085362622, 'rate_drop': 1.525514614640514e-07, 'skip_drop': 6.313433917334827e-08}. Best is trial 389 with value: -1.6460117617383008.
[I 2025-06-20 12:32:54,287] Trial 437 finished with value: -1.7064389374403968 and parameters: {'booster': 'dart', 'lambda': 1.7807635982564096e-06, 'alpha': 2.0993402580151375e-08, 'subsample': 0.5002586602096295, 'colsample_bytree': 0.5449434839903561, 'max_depth': 7, 'min_child_weight': 2, 'eta': 0.024983437888520803, 'gamma': 4.654959116765934, 'rate_drop': 6.19467538494434e-08, 'skip_drop': 2.569529860825901e-08}. Best is trial 389 with value: -1.6460117617383008.
[I 2025-06-20 12:32:58,102] Trial 438 finished with value: -1.6700225821242607 and parameters: {'booster': 'dart', 'lambda': 8.488027364518964e-07, 'alpha': 1.97477999376318e-07, 'subsample': 0.5157388126660379, 'colsample_bytree': 0.562323603029013, 'max_depth': 6, 'min_child_weight': 3, 'eta': 0.022322760403120395, 'gamma': 4.9140561599466315, 'rate_drop': 9.667714451189122e-06, 'skip_drop': 4.21051349152089e-08}. Best is trial 389 with value: -1.6460117617383008.
[I 2025-06-20 12:33:05,362] Trial 439 finished with value: -1.6974583569621935 and parameters: {'booster': 'dart', 'lambda': 2.420900647210702e-07, 'alpha': 5.0890455667119494e-08, 'subsample': 0.5352574287998022, 'colsample_bytree': 0.5824060487784177, 'max_depth': 8, 'min_child_weight': 3, 'eta': 0.017256256629894304, 'gamma': 4.8004250933695465, 'rate_drop': 2.2490084128825046e-07, 'skip_drop': 2.1485412126927582e-08}. Best is trial 389 with value: -1.6460117617383008.
[I 2025-06-20 12:33:08,241] Trial 440 finished with value: -1.7267506052450186 and parameters: {'booster': 'dart', 'lambda': 1.2168704712183588e-07, 'alpha': 2.913417674035599e-08, 'subsample': 0.54741627774776, 'colsample_bytree': 0.8207140096369028, 'max_depth': 6, 'min_child_weight': 3, 'eta': 0.027813936294976853, 'gamma': 4.998111135502949, 'rate_drop': 9.586946652271355e-08, 'skip_drop': 3.315006310001841e-08}. Best is trial 389 with value: -1.6460117617383008.
[I 2025-06-20 12:33:15,547] Trial 441 finished with value: -1.6735980595416564 and parameters: {'booster': 'dart', 'lambda': 2.607659171291586e-06, 'alpha': 1.4588259028281827e-08, 'subsample': 0.5255917614451593, 'colsample_bytree': 0.5510903246886546, 'max_depth': 6, 'min_child_weight': 3, 'eta': 0.019314641153027452, 'gamma': 4.700272946993837, 'rate_drop': 1.3059243466718543e-07, 'skip_drop': 9.806348781199638e-08}. Best is trial 389 with value: -1.6460117617383008.
[I 2025-06-20 12:33:16,098] Trial 442 finished with value: -1.7135039203029632 and parameters: {'booster': 'gbtree', 'lambda': 4.2678372616246025e-06, 'alpha': 1.8845263124583534e-08, 'subsample': 0.5161201776288198, 'colsample_bytree': 0.5726042939959913, 'max_depth': 6, 'min_child_weight': 1, 'eta': 0.015084882875333869, 'gamma': 4.891287984202583}. Best is trial 389 with value: -1.6460117617383008.
[I 2025-06-20 12:33:22,389] Trial 443 finished with value: -1.6872494051327802 and parameters: {'booster': 'dart', 'lambda': 1.3482558079377455e-06, 'alpha': 3.4002956415922674e-08, 'subsample': 0.5405913015218978, 'colsample_bytree': 0.5619078853523287, 'max_depth': 5, 'min_child_weight': 3, 'eta': 0.02435652776486248, 'gamma': 4.779868872892912, 'rate_drop': 4.244265274121768e-05, 'skip_drop': 1.604277264310701e-08}. Best is trial 389 with value: -1.6460117617383008.
[I 2025-06-20 12:33:26,006] Trial 444 finished with value: -1.6675826510494356 and parameters: {'booster': 'dart', 'lambda': 5.855499499078604e-07, 'alpha': 5.11890401572655e-07, 'subsample': 0.5304520592595234, 'colsample_bytree': 0.5322259824765834, 'max_depth': 6, 'min_child_weight': 3, 'eta': 0.032202849198126667, 'gamma': 4.61612300361898, 'rate_drop': 4.497339287345779e-08, 'skip_drop': 1.8479713265576988e-07}. Best is trial 389 with value: -1.6460117617383008.
[I 2025-06-20 12:33:28,580] Trial 445 finished with value: -1.6789058530107492 and parameters: {'booster': 'dart', 'lambda': 5.058505463901923e-07, 'alpha': 3.1077977703388345e-07, 'subsample': 0.5530647500629746, 'colsample_bytree': 0.5285965363418987, 'max_depth': 6, 'min_child_weight': 3, 'eta': 0.03241113278383824, 'gamma': 4.416382507188452, 'rate_drop': 2.4723675443108527e-08, 'skip_drop': 2.0574491105754645e-07}. Best is trial 389 with value: -1.6460117617383008.
[I 2025-06-20 12:33:31,302] Trial 446 finished with value: -1.689427016753687 and parameters: {'booster': 'dart', 'lambda': 6.429902031835384e-07, 'alpha': 1.2331247101144567e-07, 'subsample': 0.5090149400731404, 'colsample_bytree': 0.5317747209674384, 'max_depth': 6, 'min_child_weight': 3, 'eta': 0.03148113431297721, 'gamma': 4.5818994909514394, 'rate_drop': 4.151237296687522e-08, 'skip_drop': 1.1639395451336597e-07}. Best is trial 389 with value: -1.6460117617383008.
[I 2025-06-20 12:33:32,373] Trial 447 finished with value: -1.6981521865338536 and parameters: {'booster': 'dart', 'lambda': 3.7507606528791075e-07, 'alpha': 5.18322774424446e-07, 'subsample': 0.5329081266659924, 'colsample_bytree': 0.5022818183413023, 'max_depth': 6, 'min_child_weight': 4, 'eta': 0.06835962204276014, 'gamma': 4.9104169571167535, 'rate_drop': 6.062206514493926e-08, 'skip_drop': 1.818402586603457e-07}. Best is trial 389 with value: -1.6460117617383008.
[I 2025-06-20 12:33:34,759] Trial 448 finished with value: -1.6793145603543225 and parameters: {'booster': 'dart', 'lambda': 8.496243371289658e-07, 'alpha': 7.744711290834004e-08, 'subsample': 0.523845971002017, 'colsample_bytree': 0.5194013254682297, 'max_depth': 6, 'min_child_weight': 3, 'eta': 0.028979343821721428, 'gamma': 4.835258262593105, 'rate_drop': 4.160890969525303e-08, 'skip_drop': 7.428352214371222e-08}. Best is trial 389 with value: -1.6460117617383008.
[I 2025-06-20 12:33:36,856] Trial 449 finished with value: -1.6614117901944443 and parameters: {'booster': 'dart', 'lambda': 2.560854011505224e-07, 'alpha': 6.83545752486233e-08, 'subsample': 0.5410590121654316, 'colsample_bytree': 0.5386137414560965, 'max_depth': 10, 'min_child_weight': 2, 'eta': 0.032514475364983156, 'gamma': 4.62713223263944, 'rate_drop': 2.804052528857925e-08, 'skip_drop': 1.205562304039121e-07}. Best is trial 389 with value: -1.6460117617383008.
[I 2025-06-20 12:33:39,551] Trial 450 finished with value: -1.711850813352863 and parameters: {'booster': 'dart', 'lambda': 2.068741572590111e-07, 'alpha': 1.6230460075014884e-07, 'subsample': 0.5563167272928956, 'colsample_bytree': 0.5211906394624573, 'max_depth': 10, 'min_child_weight': 1, 'eta': 0.03483970015497487, 'gamma': 4.474689778548536, 'rate_drop': 1.7312635426765904e-08, 'skip_drop': 1.776827444922794e-07}. Best is trial 389 with value: -1.6460117617383008.
[I 2025-06-20 12:33:42,429] Trial 451 finished with value: -1.6867241733848677 and parameters: {'booster': 'dart', 'lambda': 7.639033789116941e-08, 'alpha': 7.052925494663403e-07, 'subsample': 0.5450620042094464, 'colsample_bytree': 0.5312224921502513, 'max_depth': 10, 'min_child_weight': 2, 'eta': 0.03723466728985447, 'gamma': 4.585734195585901, 'rate_drop': 1.638073097226285e-08, 'skip_drop': 1.1714073007045217e-07}. Best is trial 389 with value: -1.6460117617383008.
[I 2025-06-20 12:33:44,500] Trial 452 finished with value: -1.6886154831794173 and parameters: {'booster': 'dart', 'lambda': 1.538301610118891e-07, 'alpha': 1.099556825613281e-07, 'subsample': 0.5415315030429225, 'colsample_bytree': 0.5410813608739535, 'max_depth': 10, 'min_child_weight': 2, 'eta': 0.03109147500368236, 'gamma': 4.644536134235637, 'rate_drop': 2.4804270175458992e-08, 'skip_drop': 2.5202550964817325e-07}. Best is trial 389 with value: -1.6460117617383008.
[I 2025-06-20 12:33:45,892] Trial 453 finished with value: -1.7205060153049865 and parameters: {'booster': 'dart', 'lambda': 2.493979997070858e-07, 'alpha': 8.031235686446067e-08, 'subsample': 0.5712987369554978, 'colsample_bytree': 0.888218414662873, 'max_depth': 10, 'min_child_weight': 2, 'eta': 0.03322871173028993, 'gamma': 4.7203600670092865, 'rate_drop': 3.326716237611548e-08, 'skip_drop': 9.287615865902309e-08}. Best is trial 389 with value: -1.6460117617383008.
[I 2025-06-20 12:33:48,425] Trial 454 finished with value: -1.7210853998283273 and parameters: {'booster': 'dart', 'lambda': 1.021091481492526e-07, 'alpha': 6.092033820322858e-08, 'subsample': 0.561730184389374, 'colsample_bytree': 0.5387743320749431, 'max_depth': 7, 'min_child_weight': 1, 'eta': 0.02696329156742683, 'gamma': 4.377242424938438, 'rate_drop': 3.300212245305938e-08, 'skip_drop': 1.730888231730849e-07}. Best is trial 389 with value: -1.6460117617383008.
[I 2025-06-20 12:33:52,413] Trial 455 finished with value: -1.7010329661995998 and parameters: {'booster': 'dart', 'lambda': 3.079531285091892e-07, 'alpha': 1.682704428864778e-07, 'subsample': 0.5494732399907517, 'colsample_bytree': 0.5132190672587839, 'max_depth': 8, 'min_child_weight': 2, 'eta': 0.028552449911207606, 'gamma': 4.547045791510604, 'rate_drop': 5.630631609823398e-08, 'skip_drop': 1.4546057521497373e-07}. Best is trial 389 with value: -1.6460117617383008.
[I 2025-06-20 12:33:55,003] Trial 456 finished with value: -1.6822286141856437 and parameters: {'booster': 'dart', 'lambda': 0.001081946731308956, 'alpha': 5.477977404253294e-08, 'subsample': 0.5369594924120286, 'colsample_bytree': 0.5439910677058851, 'max_depth': 6, 'min_child_weight': 2, 'eta': 0.03176851336650707, 'gamma': 4.641913209859073, 'rate_drop': 0.04686166828992682, 'skip_drop': 6.953419499311213e-08}. Best is trial 389 with value: -1.6460117617383008.
[I 2025-06-20 12:33:56,495] Trial 457 finished with value: -1.704221595586276 and parameters: {'booster': 'dart', 'lambda': 4.3983363489773876e-07, 'alpha': 2.3985235171680314e-07, 'subsample': 0.5322363031414661, 'colsample_bytree': 0.5284562183332954, 'max_depth': 10, 'min_child_weight': 4, 'eta': 0.0410576409288509, 'gamma': 0.2905443031540127, 'rate_drop': 2.0892967298289743e-08, 'skip_drop': 1.2478085826687573e-07}. Best is trial 389 with value: -1.6460117617383008.
[I 2025-06-20 12:33:59,092] Trial 458 finished with value: -1.6735125265768394 and parameters: {'booster': 'dart', 'lambda': 1.532087691704765e-07, 'alpha': 4.25543649483132e-08, 'subsample': 0.5449472185875327, 'colsample_bytree': 0.5488034348999832, 'max_depth': 6, 'min_child_weight': 4, 'eta': 0.03746411977154559, 'gamma': 4.785496919961128, 'rate_drop': 7.907936925987327e-08, 'skip_drop': 7.368488246806617e-05}. Best is trial 389 with value: -1.6460117617383008.
[I 2025-06-20 12:34:03,255] Trial 459 finished with value: -1.6985947553023397 and parameters: {'booster': 'dart', 'lambda': 2.8841799378060636e-07, 'alpha': 3.8900013249968893e-07, 'subsample': 0.5280891889445205, 'colsample_bytree': 0.5357358320681265, 'max_depth': 10, 'min_child_weight': 2, 'eta': 0.02306702843499583, 'gamma': 4.745037291895225, 'rate_drop': 5.360759052834733e-08, 'skip_drop': 1.017620603362002e-08}. Best is trial 389 with value: -1.6460117617383008.
[I 2025-06-20 12:34:03,646] Trial 460 finished with value: -1.702581688509292 and parameters: {'booster': 'gbtree', 'lambda': 1.7705971100760194e-07, 'alpha': 1.7221339558821459e-06, 'subsample': 0.5544884706893695, 'colsample_bytree': 0.5593759755408367, 'max_depth': 6, 'min_child_weight': 1, 'eta': 0.025643113170831573, 'gamma': 4.915387181120663}. Best is trial 389 with value: -1.6460117617383008.
[I 2025-06-20 12:34:10,342] Trial 461 finished with value: -1.6637003097102792 and parameters: {'booster': 'dart', 'lambda': 5.9810737700792e-07, 'alpha': 2.6353008266566212e-08, 'subsample': 0.5207723542712226, 'colsample_bytree': 0.5503245800606806, 'max_depth': 6, 'min_child_weight': 3, 'eta': 0.017463742132714708, 'gamma': 4.510852073886348, 'rate_drop': 4.2978069093252354e-08, 'skip_drop': 5.062463788385448e-08}. Best is trial 389 with value: -1.6460117617383008.
[I 2025-06-20 12:34:17,215] Trial 462 finished with value: -1.687672586564724 and parameters: {'booster': 'dart', 'lambda': 1.0348496015863849e-06, 'alpha': 1.0023277225459991e-08, 'subsample': 0.5188053909900759, 'colsample_bytree': 0.5437193381503403, 'max_depth': 5, 'min_child_weight': 3, 'eta': 0.016366898548347084, 'gamma': 4.49647735406688, 'rate_drop': 1.800210959844394e-05, 'skip_drop': 5.94565779647754e-08}. Best is trial 389 with value: -1.6460117617383008.
[I 2025-06-20 12:34:24,322] Trial 463 finished with value: -1.6950995596950869 and parameters: {'booster': 'dart', 'lambda': 1.8290817034906913e-06, 'alpha': 2.4521038279553074e-08, 'subsample': 0.5236629746242041, 'colsample_bytree': 0.5534291980093431, 'max_depth': 6, 'min_child_weight': 3, 'eta': 0.013745342592825366, 'gamma': 4.267731572994602, 'rate_drop': 8.050418527322918e-08, 'skip_drop': 8.007649652656767e-08}. Best is trial 389 with value: -1.6460117617383008.
[I 2025-06-20 12:34:25,575] Trial 464 finished with value: -1.700578866229726 and parameters: {'booster': 'dart', 'lambda': 4.224353494623672e-07, 'alpha': 1.5096744223229436e-08, 'subsample': 0.5159881854904188, 'colsample_bytree': 0.5228570091306035, 'max_depth': 6, 'min_child_weight': 3, 'eta': 0.06127334917700594, 'gamma': 4.565962780856574, 'rate_drop': 2.7496517110629878e-08, 'skip_drop': 5.461216837134644e-08}. Best is trial 389 with value: -1.6460117617383008.
[I 2025-06-20 12:34:32,327] Trial 465 finished with value: -1.6778668438534503 and parameters: {'booster': 'dart', 'lambda': 1.3097510227213442e-06, 'alpha': 2.5495121006977186e-08, 'subsample': 0.5292373964179435, 'colsample_bytree': 0.5364791792484862, 'max_depth': 6, 'min_child_weight': 3, 'eta': 0.017117636747726032, 'gamma': 4.439734849282434, 'rate_drop': 4.9020873688273855e-08, 'skip_drop': 1.0720172086105619e-07}. Best is trial 389 with value: -1.6460117617383008.
[I 2025-06-20 12:34:39,323] Trial 466 finished with value: -1.6850074514981745 and parameters: {'booster': 'dart', 'lambda': 2.6604504730576704e-07, 'alpha': 1.3758423293468682e-08, 'subsample': 0.5201874298692573, 'colsample_bytree': 0.5539451911620868, 'max_depth': 6, 'min_child_weight': 3, 'eta': 0.014656419024235373, 'gamma': 4.613795942273069, 'rate_drop': 7.742832720330499e-08, 'skip_drop': 4.878062684347015e-08}. Best is trial 389 with value: -1.6460117617383008.
