[I 2025-06-20 12:02:14,702] Trial 99 finished with value: -1.7976853024986965 and parameters: {'booster': 'dart', 'lambda': 1.0092594409829228, 'alpha': 0.03479412078683523, 'subsample': 0.5865942541514977, 'colsample_bytree': 0.7250414110556546, 'max_depth': 5, 'min_child_weight': 5, 'eta': 0.13311515214304107, 'gamma': 3.143182054990568, 'rate_drop': 0.003822288486267084, 'skip_drop': 0.5997155541599659}. Best is trial 34 with value: -1.6825200771122633.
[I 2025-06-20 12:02:15,633] Trial 100 finished with value: -1.7826214382880035 and parameters: {'booster': 'dart', 'lambda': 2.9780852751332656, 'alpha': 0.003208543546630112, 'subsample': 0.5567810647121816, 'colsample_bytree': 0.7574090050750348, 'max_depth': 4, 'min_child_weight': 4, 'eta': 0.09975387667026188, 'gamma': 3.666463023796434, 'rate_drop': 0.0010220831518307362, 'skip_drop': 4.4708857111428493e-07}. Best is trial 34 with value: -1.6825200771122633.
[I 2025-06-20 12:02:20,887] Trial 101 finished with value: -1.702901601160334 and parameters: {'booster': 'dart', 'lambda': 0.6231159717576417, 'alpha': 0.006464228028880972, 'subsample': 0.5699715703482578, 'colsample_bytree': 0.6228221644940495, 'max_depth': 4, 'min_child_weight': 6, 'eta': 0.030727747722135046, 'gamma': 3.8639004467065448, 'rate_drop': 3.857152738430404e-05, 'skip_drop': 4.655352291728595e-05}. Best is trial 34 with value: -1.6825200771122633.
[I 2025-06-20 12:02:29,288] Trial 102 finished with value: -1.7076217468106172 and parameters: {'booster': 'dart', 'lambda': 1.8148629599991577, 'alpha': 0.021185438960788772, 'subsample': 0.5802086437517736, 'colsample_bytree': 0.7445288700264946, 'max_depth': 4, 'min_child_weight': 7, 'eta': 0.02029680609227512, 'gamma': 4.086487405801212, 'rate_drop': 0.00011577659885516898, 'skip_drop': 1.4290487186574078e-05}. Best is trial 34 with value: -1.6825200771122633.
[I 2025-06-20 12:02:38,423] Trial 103 finished with value: -1.7057805499406686 and parameters: {'booster': 'dart', 'lambda': 5.847936090713848, 'alpha': 0.05290441211793435, 'subsample': 0.5965301534788174, 'colsample_bytree': 0.6867593577535857, 'max_depth': 4, 'min_child_weight': 5, 'eta': 0.027522439737377023, 'gamma': 3.4501279568616554, 'rate_drop': 0.011094556249195578, 'skip_drop': 3.860431448287873e-06}. Best is trial 34 with value: -1.6825200771122633.
[I 2025-06-20 12:02:40,345] Trial 104 finished with value: -1.7046869708622099 and parameters: {'booster': 'dart', 'lambda': 0.15173292821424836, 'alpha': 4.608986194568794e-07, 'subsample': 0.6270634860890962, 'colsample_bytree': 0.6495028718245299, 'max_depth': 5, 'min_child_weight': 3, 'eta': 0.037339462538680104, 'gamma': 3.949283676479015, 'rate_drop': 0.0065725669981126795, 'skip_drop': 0.00010870012784104814}. Best is trial 34 with value: -1.6825200771122633.
[I 2025-06-20 12:02:43,016] Trial 105 finished with value: -1.7004125846884788 and parameters: {'booster': 'dart', 'lambda': 0.2624055181149493, 'alpha': 0.00015865846482377495, 'subsample': 0.6202747055895672, 'colsample_bytree': 0.5734867057034626, 'max_depth': 3, 'min_child_weight': 6, 'eta': 0.046963796067937054, 'gamma': 2.4623706774173213, 'rate_drop': 5.0085470245803525e-05, 'skip_drop': 2.8842153389288477e-05}. Best is trial 34 with value: -1.6825200771122633.
[I 2025-06-20 12:02:45,896] Trial 106 finished with value: -1.71127156475134 and parameters: {'booster': 'dart', 'lambda': 0.3030173769563052, 'alpha': 0.00018158235273212095, 'subsample': 0.6720993125191697, 'colsample_bytree': 0.5744915022029885, 'max_depth': 3, 'min_child_weight': 4, 'eta': 0.04651764492076531, 'gamma': 2.3100875555977574, 'rate_drop': 0.027689012370479833, 'skip_drop': 3.808935153316997e-07}. Best is trial 34 with value: -1.6825200771122633.
[I 2025-06-20 12:02:47,799] Trial 107 finished with value: -1.7110735772464365 and parameters: {'booster': 'dart', 'lambda': 2.4915849644878345, 'alpha': 0.0015258331140029747, 'subsample': 0.6191764577434435, 'colsample_bytree': 0.5925561461439113, 'max_depth': 3, 'min_child_weight': 9, 'eta': 0.0659892248045077, 'gamma': 2.5066166859333876, 'rate_drop': 1.552419509998791e-05, 'skip_drop': 2.664076037806673e-05}. Best is trial 34 with value: -1.6825200771122633.
[I 2025-06-20 12:02:54,675] Trial 108 finished with value: -1.7237613969152652 and parameters: {'booster': 'dart', 'lambda': 1.0900452538078695, 'alpha': 8.990494883017296e-05, 'subsample': 0.6369877580611116, 'colsample_bytree': 0.7916538026569235, 'max_depth': 3, 'min_child_weight': 5, 'eta': 0.023122221666964603, 'gamma': 2.6016969808669397, 'rate_drop': 0.00019400499094628974, 'skip_drop': 7.094662708695757e-06}. Best is trial 34 with value: -1.6825200771122633.
[I 2025-06-20 12:02:55,896] Trial 109 finished with value: -1.7304364477562224 and parameters: {'booster': 'dart', 'lambda': 1.8082534689711316, 'alpha': 8.46043628930083e-06, 'subsample': 0.6052959456466863, 'colsample_bytree': 0.6297809432731931, 'max_depth': 8, 'min_child_weight': 4, 'eta': 0.05089948443690401, 'gamma': 2.802313266345662, 'rate_drop': 0.002395562066319625, 'skip_drop': 2.516929162474752e-06}. Best is trial 34 with value: -1.6825200771122633.
[I 2025-06-20 12:02:58,968] Trial 110 finished with value: -1.7179766710697075 and parameters: {'booster': 'dart', 'lambda': 3.9898212091366583, 'alpha': 0.008272925295245202, 'subsample': 0.6600366692118433, 'colsample_bytree': 0.7675144375596542, 'max_depth': 4, 'min_child_weight': 8, 'eta': 0.043836518796456864, 'gamma': 4.252539612016958, 'rate_drop': 8.753334062794052e-06, 'skip_drop': 0.00931865052446142}. Best is trial 34 with value: -1.6825200771122633.
[I 2025-06-20 12:03:05,354] Trial 111 finished with value: -1.6977685425638993 and parameters: {'booster': 'dart', 'lambda': 0.5285794542159413, 'alpha': 0.15740924304118517, 'subsample': 0.5317764159378298, 'colsample_bytree': 0.520334934640806, 'max_depth': 4, 'min_child_weight': 6, 'eta': 0.030196979478144457, 'gamma': 2.341034456293396, 'rate_drop': 5.19888929903024e-05, 'skip_drop': 2.5652056434261284e-05}. Best is trial 34 with value: -1.6825200771122633.
[I 2025-06-20 12:03:09,068] Trial 112 finished with value: -1.7022273760547697 and parameters: {'booster': 'dart', 'lambda': 0.10515699643656395, 'alpha': 0.08490238509776017, 'subsample': 0.5275758712213954, 'colsample_bytree': 0.5101456860690935, 'max_depth': 4, 'min_child_weight': 6, 'eta': 0.03106590144603758, 'gamma': 2.01730864841796, 'rate_drop': 3.7615790915668236e-05, 'skip_drop': 1.935430501264517e-05}. Best is trial 34 with value: -1.6825200771122633.
[I 2025-06-20 12:03:16,213] Trial 113 finished with value: -1.704116060665321 and parameters: {'booster': 'dart', 'lambda': 0.7112907585972222, 'alpha': 0.9431476357061966, 'subsample': 0.5530177085390996, 'colsample_bytree': 0.5271312303970072, 'max_depth': 4, 'min_child_weight': 7, 'eta': 0.024187372018428816, 'gamma': 2.152214750822361, 'rate_drop': 8.601912251823508e-05, 'skip_drop': 1.0185302070499924e-05}. Best is trial 34 with value: -1.6825200771122633.
[I 2025-06-20 12:03:22,730] Trial 114 finished with value: -1.7132173208139332 and parameters: {'booster': 'dart', 'lambda': 0.3605138032268015, 'alpha': 0.14923503583519554, 'subsample': 0.5404892176945858, 'colsample_bytree': 0.5443514833330778, 'max_depth': 4, 'min_child_weight': 6, 'eta': 0.027299690817060386, 'gamma': 2.381335987615418, 'rate_drop': 2.1259577286275465e-05, 'skip_drop': 0.00029799742918029914}. Best is trial 34 with value: -1.6825200771122633.
[I 2025-06-20 12:03:31,978] Trial 115 finished with value: -1.6815310973219715 and parameters: {'booster': 'dart', 'lambda': 0.48353194068837385, 'alpha': 0.04065241931939367, 'subsample': 0.5633484149581137, 'colsample_bytree': 0.5611849162843756, 'max_depth': 5, 'min_child_weight': 5, 'eta': 0.015625861471911844, 'gamma': 2.229612224593249, 'rate_drop': 5.705227222301139e-06, 'skip_drop': 1.462152245599102e-06}. Best is trial 115 with value: -1.6815310973219715.
[I 2025-06-20 12:03:41,252] Trial 116 finished with value: -1.7437445172977166 and parameters: {'booster': 'dart', 'lambda': 0.4513796470884101, 'alpha': 0.4739246546843383, 'subsample': 0.5632294445477185, 'colsample_bytree': 0.5137235527833109, 'max_depth': 5, 'min_child_weight': 5, 'eta': 0.006858343150607277, 'gamma': 4.198571066158831, 'rate_drop': 3.611457893726832e-06, 'skip_drop': 8.932087682849151e-07}. Best is trial 115 with value: -1.6815310973219715.
[I 2025-06-20 12:03:41,634] Trial 117 finished with value: -1.8039867857045804 and parameters: {'booster': 'dart', 'lambda': 5.583571673272327, 'alpha': 0.04818726306484205, 'subsample': 0.5395018373896915, 'colsample_bytree': 0.5562843785230244, 'max_depth': 5, 'min_child_weight': 5, 'eta': 0.29794270603536066, 'gamma': 1.7598155906123836, 'rate_drop': 5.790027893500821e-06, 'skip_drop': 1.5269828052315146e-06}. Best is trial 115 with value: -1.6815310973219715.
[I 2025-06-20 12:03:48,082] Trial 118 finished with value: -1.6993831991085442 and parameters: {'booster': 'dart', 'lambda': 0.036377305748407765, 'alpha': 0.16636339325010174, 'subsample': 0.5112682328730268, 'colsample_bytree': 0.6651694244543817, 'max_depth': 5, 'min_child_weight': 4, 'eta': 0.018233744064686426, 'gamma': 1.8528705177332678, 'rate_drop': 0.0003446651259959453, 'skip_drop': 4.973492059510837e-06}. Best is trial 115 with value: -1.6815310973219715.
[I 2025-06-20 12:03:56,721] Trial 119 finished with value: -1.682197710935181 and parameters: {'booster': 'dart', 'lambda': 0.004983042423346966, 'alpha': 0.02367369332572874, 'subsample': 0.5303715935075114, 'colsample_bytree': 0.5655652976600788, 'max_depth': 5, 'min_child_weight': 3, 'eta': 0.014993098932464961, 'gamma': 2.2293371974233396, 'rate_drop': 0.0001611528916859071, 'skip_drop': 2.7189546373930053e-06}. Best is trial 115 with value: -1.6815310973219715.
[I 2025-06-20 12:04:06,233] Trial 120 finished with value: -1.696753230262338 and parameters: {'booster': 'dart', 'lambda': 0.004674634717217295, 'alpha': 0.02876596325742659, 'subsample': 0.7432027840152531, 'colsample_bytree': 0.5372038567818034, 'max_depth': 6, 'min_child_weight': 3, 'eta': 0.012911533222956503, 'gamma': 2.1231437726030657, 'rate_drop': 0.00014888948177081116, 'skip_drop': 2.845227827445473e-06}. Best is trial 115 with value: -1.6815310973219715.
[I 2025-06-20 12:04:15,894] Trial 121 finished with value: -1.7125126177364827 and parameters: {'booster': 'dart', 'lambda': 0.009518555947527887, 'alpha': 0.03538795812218965, 'subsample': 0.8486355993465148, 'colsample_bytree': 0.5662147891287983, 'max_depth': 6, 'min_child_weight': 3, 'eta': 0.009936601564372115, 'gamma': 2.1819583331074557, 'rate_drop': 0.00018313118672496842, 'skip_drop': 3.12473630793254e-06}. Best is trial 115 with value: -1.6815310973219715.
[I 2025-06-20 12:04:22,445] Trial 122 finished with value: -1.7020400876884885 and parameters: {'booster': 'dart', 'lambda': 0.0034774568596134016, 'alpha': 0.07956873777173701, 'subsample': 0.7512262104453274, 'colsample_bytree': 0.5402105808914428, 'max_depth': 6, 'min_child_weight': 3, 'eta': 0.012980358575448001, 'gamma': 2.0748887567806626, 'rate_drop': 3.0863470976744955e-05, 'skip_drop': 3.2540641860478447e-07}. Best is trial 115 with value: -1.6815310973219715.
[I 2025-06-20 12:04:31,501] Trial 123 finished with value: -1.6972641582249128 and parameters: {'booster': 'dart', 'lambda': 0.023361086175514467, 'alpha': 0.024632753288374783, 'subsample': 0.5833793802348757, 'colsample_bytree': 0.5290582246899508, 'max_depth': 5, 'min_child_weight': 2, 'eta': 0.013815621103813236, 'gamma': 2.693410119645418, 'rate_drop': 0.0006816177847330021, 'skip_drop': 1.3601695088083568e-06}. Best is trial 115 with value: -1.6815310973219715.
[I 2025-06-20 12:04:38,409] Trial 124 finished with value: -1.7098770779801347 and parameters: {'booster': 'dart', 'lambda': 0.0037688498996694894, 'alpha': 0.03133301049332253, 'subsample': 0.6967696875031505, 'colsample_bytree': 0.529962559566674, 'max_depth': 7, 'min_child_weight': 2, 'eta': 0.015644347801612495, 'gamma': 2.6763235893234256, 'rate_drop': 0.0005936316432862772, 'skip_drop': 1.2289941406137733e-06}. Best is trial 115 with value: -1.6815310973219715.
[I 2025-06-20 12:04:47,661] Trial 125 finished with value: -1.7003885171721187 and parameters: {'booster': 'dart', 'lambda': 0.0024108042843786915, 'alpha': 0.023540794481618204, 'subsample': 0.8723778257826871, 'colsample_bytree': 0.5839918427484048, 'max_depth': 5, 'min_child_weight': 2, 'eta': 0.011853156106128132, 'gamma': 2.4271266738776345, 'rate_drop': 0.0009857267185480023, 'skip_drop': 6.398896363480221e-07}. Best is trial 115 with value: -1.6815310973219715.
[I 2025-06-20 12:04:57,004] Trial 126 finished with value: -1.7136601837962597 and parameters: {'booster': 'dart', 'lambda': 0.018846831364039838, 'alpha': 0.013856999488197918, 'subsample': 0.817284809219759, 'colsample_bytree': 0.561052798168582, 'max_depth': 5, 'min_child_weight': 2, 'eta': 0.00970662020437239, 'gamma': 2.296675592350321, 'rate_drop': 0.00014749754038595518, 'skip_drop': 2.7210703420830523e-06}. Best is trial 115 with value: -1.6815310973219715.
[I 2025-06-20 12:05:07,203] Trial 127 finished with value: -1.703898692487394 and parameters: {'booster': 'dart', 'lambda': 0.0009731203793547757, 'alpha': 0.0471952846959141, 'subsample': 0.5927402654865418, 'colsample_bytree': 0.5518813529690828, 'max_depth': 5, 'min_child_weight': 1, 'eta': 0.0085009420100098, 'gamma': 1.5352292104607397, 'rate_drop': 0.00028409538338277, 'skip_drop': 2.0630509014538643e-06}. Best is trial 115 with value: -1.6815310973219715.
[I 2025-06-20 12:05:15,230] Trial 128 finished with value: -1.7042630271095638 and parameters: {'booster': 'dart', 'lambda': 0.007265847154528735, 'alpha': 0.010566950663352831, 'subsample': 0.5829558889957731, 'colsample_bytree': 0.7326142556659132, 'max_depth': 6, 'min_child_weight': 3, 'eta': 0.015096227809781086, 'gamma': 3.0405914339957674, 'rate_drop': 0.0005423982247151973, 'skip_drop': 4.694739349575177e-06}. Best is trial 115 with value: -1.6815310973219715.
[I 2025-06-20 12:05:23,527] Trial 129 finished with value: -1.7278865113826343 and parameters: {'booster': 'dart', 'lambda': 0.0001206177623409644, 'alpha': 0.0037793614027774986, 'subsample': 0.9467612396108318, 'colsample_bytree': 0.5951929867294785, 'max_depth': 5, 'min_child_weight': 3, 'eta': 0.013687792076799163, 'gamma': 2.141469509288825, 'rate_drop': 8.045508464656854e-05, 'skip_drop': 0.0017553763712282093}. Best is trial 115 with value: -1.6815310973219715.
[I 2025-06-20 12:05:32,845] Trial 130 finished with value: -1.704101677802022 and parameters: {'booster': 'dart', 'lambda': 0.07159811899281038, 'alpha': 0.0946185445393776, 'subsample': 0.5695424743042623, 'colsample_bytree': 0.6045333008659178, 'max_depth': 5, 'min_child_weight': 3, 'eta': 0.01680475995144048, 'gamma': 1.9255126237923716, 'rate_drop': 2.7046033750483643e-06, 'skip_drop': 1.063888021602068e-06}. Best is trial 115 with value: -1.6815310973219715.
[I 2025-06-20 12:05:40,196] Trial 131 finished with value: -1.6785222754235516 and parameters: {'booster': 'dart', 'lambda': 0.017230050199619963, 'alpha': 0.37838487647424823, 'subsample': 0.5315562056355283, 'colsample_bytree': 0.5032280771280168, 'max_depth': 5, 'min_child_weight': 4, 'eta': 0.020018023824187364, 'gamma': 2.2950361175273515, 'rate_drop': 0.00011117986954421516, 'skip_drop': 8.554596095891616e-06}. Best is trial 131 with value: -1.6785222754235516.
[I 2025-06-20 12:05:47,150] Trial 132 finished with value: -1.705198348967903 and parameters: {'booster': 'dart', 'lambda': 0.023428589433385143, 'alpha': 0.023857120976775694, 'subsample': 0.5735490533857232, 'colsample_bytree': 0.5001949156684203, 'max_depth': 5, 'min_child_weight': 4, 'eta': 0.02061957966286745, 'gamma': 2.58394522366261, 'rate_drop': 0.00010765956629066251, 'skip_drop': 9.582226733468876e-06}. Best is trial 131 with value: -1.6785222754235516.
[I 2025-06-20 12:05:56,529] Trial 133 finished with value: -1.7135816330609281 and parameters: {'booster': 'dart', 'lambda': 0.007926187315006928, 'alpha': 0.4569430116343557, 'subsample': 0.5198241449040601, 'colsample_bytree': 0.508774649485979, 'max_depth': 5, 'min_child_weight': 4, 'eta': 0.01074110596451008, 'gamma': 2.2086938077942615, 'rate_drop': 0.00025175232863938903, 'skip_drop': 6.213215101622087e-06}. Best is trial 131 with value: -1.6785222754235516.
[I 2025-06-20 12:06:03,677] Trial 134 finished with value: -1.6892983044588887 and parameters: {'booster': 'dart', 'lambda': 4.1938835129441706e-05, 'alpha': 0.04093608464000816, 'subsample': 0.5505798846333638, 'colsample_bytree': 0.5370586469713724, 'max_depth': 6, 'min_child_weight': 3, 'eta': 0.018658636765124328, 'gamma': 2.765386720997049, 'rate_drop': 2.6632786846680285e-05, 'skip_drop': 2.5081029934634757e-07}. Best is trial 131 with value: -1.6785222754235516.
[I 2025-06-20 12:06:09,019] Trial 135 finished with value: -1.7080596286854561 and parameters: {'booster': 'dart', 'lambda': 4.3457194209144474e-05, 'alpha': 1.8985656391230907, 'subsample': 0.5530074773647607, 'colsample_bytree': 0.5429722460587884, 'max_depth': 6, 'min_child_weight': 3, 'eta': 0.020184623892416098, 'gamma': 3.814815670813054, 'rate_drop': 1.3290112406112413e-05, 'skip_drop': 6.56735117337289e-07}. Best is trial 131 with value: -1.6785222754235516.
[I 2025-06-20 12:06:18,363] Trial 136 finished with value: -1.7304420920539434 and parameters: {'booster': 'dart', 'lambda': 8.078712396391552e-06, 'alpha': 7.010564492590352, 'subsample': 0.5435289568788024, 'colsample_bytree': 0.7121326034256592, 'max_depth': 6, 'min_child_weight': 3, 'eta': 0.017970148744085784, 'gamma': 2.8557763247887626, 'rate_drop': 2.5167627926474128e-05, 'skip_drop': 2.2175957492345317e-07}. Best is trial 131 with value: -1.6785222754235516.
[I 2025-06-20 12:06:21,787] Trial 137 finished with value: -1.7246609773457824 and parameters: {'booster': 'dart', 'lambda': 0.00029977262581089525, 'alpha': 0.0386125528165034, 'subsample': 0.779866455457711, 'colsample_bytree': 0.5649648027161098, 'max_depth': 7, 'min_child_weight': 4, 'eta': 0.02468565757904681, 'gamma': 2.267137193860514, 'rate_drop': 1.821976538256849e-05, 'skip_drop': 3.879246869575663e-06}. Best is trial 131 with value: -1.6785222754235516.
[I 2025-06-20 12:06:28,608] Trial 138 finished with value: -1.7086348259452322 and parameters: {'booster': 'dart', 'lambda': 0.014124376409971153, 'alpha': 0.07213615937912236, 'subsample': 0.7371923646817593, 'colsample_bytree': 0.5198594125380279, 'max_depth': 6, 'min_child_weight': 3, 'eta': 0.01825483001212783, 'gamma': 2.073985148786312, 'rate_drop': 8.308446794128946e-06, 'skip_drop': 1.0802487210364767e-05}. Best is trial 131 with value: -1.6785222754235516.
[I 2025-06-20 12:06:35,225] Trial 139 finished with value: -1.6899270632684964 and parameters: {'booster': 'dart', 'lambda': 2.2809425639538806e-06, 'alpha': 0.015252067883819208, 'subsample': 0.507696815392989, 'colsample_bytree': 0.5333997675355967, 'max_depth': 6, 'min_child_weight': 4, 'eta': 0.015429719568306792, 'gamma': 4.637451634639806, 'rate_drop': 6.503309878542914e-05, 'skip_drop': 2.0323791439459245e-06}. Best is trial 131 with value: -1.6785222754235516.
[I 2025-06-20 12:06:41,752] Trial 140 finished with value: -1.7225135754348724 and parameters: {'booster': 'dart', 'lambda': 2.1682395007896875e-06, 'alpha': 0.0022673781431578077, 'subsample': 0.5273158556088626, 'colsample_bytree': 0.7538707123139344, 'max_depth': 5, 'min_child_weight': 4, 'eta': 0.021484068690257915, 'gamma': 4.661589196386483, 'rate_drop': 6.699030741370776e-05, 'skip_drop': 3.671031523491068e-08}. Best is trial 131 with value: -1.6785222754235516.
[I 2025-06-20 12:06:48,785] Trial 141 finished with value: -1.6881664693561922 and parameters: {'booster': 'dart', 'lambda': 2.393072162095176e-07, 'alpha': 0.008012881293376337, 'subsample': 0.50406247604638, 'colsample_bytree': 0.5350354917843146, 'max_depth': 6, 'min_child_weight': 4, 'eta': 0.016167592226999792, 'gamma': 4.846872886657975, 'rate_drop': 3.9869676377346696e-05, 'skip_drop': 1.9756249364201686e-06}. Best is trial 131 with value: -1.6785222754235516.
[I 2025-06-20 12:06:56,057] Trial 142 finished with value: -1.6953214144722784 and parameters: {'booster': 'dart', 'lambda': 2.1651146142639657e-07, 'alpha': 2.2849158418108427e-07, 'subsample': 0.5073778721988821, 'colsample_bytree': 0.5495894774251369, 'max_depth': 6, 'min_child_weight': 4, 'eta': 0.014866392581134074, 'gamma': 4.87211909325718, 'rate_drop': 3.7057764179598935e-05, 'skip_drop': 7.253333032808887e-06}. Best is trial 131 with value: -1.6785222754235516.
[I 2025-06-20 12:07:02,564] Trial 143 finished with value: -1.689872343015881 and parameters: {'booster': 'dart', 'lambda': 1.9077285753465974e-07, 'alpha': 1.8083234807618316e-07, 'subsample': 0.5116393049637702, 'colsample_bytree': 0.5541939828817324, 'max_depth': 6, 'min_child_weight': 4, 'eta': 0.015854113350324203, 'gamma': 4.811913670371692, 'rate_drop': 2.9906099630826112e-05, 'skip_drop': 5.7234897002481915e-06}. Best is trial 131 with value: -1.6785222754235516.
[I 2025-06-20 12:07:09,582] Trial 144 finished with value: -1.6976060426795216 and parameters: {'booster': 'dart', 'lambda': 2.4552230993225526e-07, 'alpha': 1.5140404491844436e-07, 'subsample': 0.5051903234302338, 'colsample_bytree': 0.5542450178813157, 'max_depth': 6, 'min_child_weight': 4, 'eta': 0.01565904762184118, 'gamma': 4.849595628535468, 'rate_drop': 2.8757301427719115e-05, 'skip_drop': 1.8793200737553944e-06}. Best is trial 131 with value: -1.6785222754235516.
