[I 2025-06-20 12:21:29,616] Trial 283 finished with value: -1.6810047085453168 and parameters: {'booster': 'dart', 'lambda': 2.7582506801022154e-06, 'alpha': 2.00279347268303e-08, 'subsample': 0.5565782577168513, 'colsample_bytree': 0.5636175652312765, 'max_depth': 6, 'min_child_weight': 3, 'eta': 0.028750569821626246, 'gamma': 4.659002798549194, 'rate_drop': 5.304744961475895e-08, 'skip_drop': 5.439707466888214e-08}. Best is trial 189 with value: -1.66206808945109.
[I 2025-06-20 12:21:31,288] Trial 284 finished with value: -1.674508718841551 and parameters: {'booster': 'dart', 'lambda': 2.738931829519572e-07, 'alpha': 1.498730692467686e-08, 'subsample': 0.5280659278429393, 'colsample_bytree': 0.5749632052342789, 'max_depth': 6, 'min_child_weight': 3, 'eta': 0.03808775733505983, 'gamma': 4.794618167942751, 'rate_drop': 1.483071300658599e-07, 'skip_drop': 1.3595300984291084e-08}. Best is trial 189 with value: -1.66206808945109.
[I 2025-06-20 12:21:38,031] Trial 285 finished with value: -1.6837773199098751 and parameters: {'booster': 'dart', 'lambda': 1.890253980465289e-06, 'alpha': 1.011079807829033e-08, 'subsample': 0.54322025171227, 'colsample_bytree': 0.5589561380135362, 'max_depth': 6, 'min_child_weight': 3, 'eta': 0.023624284307925195, 'gamma': 4.863356603569652, 'rate_drop': 3.357261765613445e-07, 'skip_drop': 8.874290369081799e-08}. Best is trial 189 with value: -1.66206808945109.
[I 2025-06-20 12:21:44,964] Trial 286 finished with value: -1.6847503175551903 and parameters: {'booster': 'dart', 'lambda': 8.718049817053759e-06, 'alpha': 2.3306668874884156e-08, 'subsample': 0.5304460023972887, 'colsample_bytree': 0.5878783103997842, 'max_depth': 10, 'min_child_weight': 3, 'eta': 0.017363093057345343, 'gamma': 4.707983206558118, 'rate_drop': 4.1084652229337276e-07, 'skip_drop': 3.4108095353095555e-08}. Best is trial 189 with value: -1.66206808945109.
[I 2025-06-20 12:21:48,407] Trial 287 finished with value: -1.678285030679976 and parameters: {'booster': 'dart', 'lambda': 4.111247172150881e-06, 'alpha': 8.117149166797057e-08, 'subsample': 0.5218653507220555, 'colsample_bytree': 0.5728319281820216, 'max_depth': 6, 'min_child_weight': 3, 'eta': 0.025571821263256727, 'gamma': 4.592653020560384, 'rate_drop': 6.542937544294522e-07, 'skip_drop': 1.981990517582929e-08}. Best is trial 189 with value: -1.66206808945109.
[I 2025-06-20 12:21:52,315] Trial 288 finished with value: -1.7278707345919027 and parameters: {'booster': 'dart', 'lambda': 2.5529445229699946e-07, 'alpha': 2.0208736836553735e-08, 'subsample': 0.9181966063988842, 'colsample_bytree': 0.5644399658173755, 'max_depth': 8, 'min_child_weight': 3, 'eta': 0.030678506602683963, 'gamma': 4.833871636045763, 'rate_drop': 2.3170951933548408e-07, 'skip_drop': 4.160384466001405e-08}. Best is trial 189 with value: -1.66206808945109.
[I 2025-06-20 12:21:58,897] Trial 289 finished with value: -1.6772171168116539 and parameters: {'booster': 'dart', 'lambda': 1.9272179335400174e-07, 'alpha': 3.5052930392408785e-08, 'subsample': 0.5327603069636846, 'colsample_bytree': 0.5843366490807202, 'max_depth': 6, 'min_child_weight': 3, 'eta': 0.021788360443221785, 'gamma': 4.7663099765603185, 'rate_drop': 1.325325265113032e-07, 'skip_drop': 2.6643182678357897e-08}. Best is trial 189 with value: -1.66206808945109.
[I 2025-06-20 12:22:04,523] Trial 290 finished with value: -1.6759463132558 and parameters: {'booster': 'dart', 'lambda': 6.143064919223067e-06, 'alpha': 1.3950148795204285e-08, 'subsample': 0.5485528212206984, 'colsample_bytree': 0.5973436087552135, 'max_depth': 9, 'min_child_weight': 3, 'eta': 0.019076961418524815, 'gamma': 4.918986011033013, 'rate_drop': 1.5807305998422225e-08, 'skip_drop': 6.129200833575873e-08}. Best is trial 189 with value: -1.66206808945109.
[I 2025-06-20 12:22:11,510] Trial 291 finished with value: -1.6720349627789903 and parameters: {'booster': 'dart', 'lambda': 1.5968774452050836e-06, 'alpha': 2.4434384025883394e-08, 'subsample': 0.521655566105524, 'colsample_bytree': 0.561505399115571, 'max_depth': 6, 'min_child_weight': 3, 'eta': 0.016762255259332826, 'gamma': 4.651949579441442, 'rate_drop': 3.0355893371593606e-07, 'skip_drop': 1.4070459580751534e-08}. Best is trial 189 with value: -1.66206808945109.
[I 2025-06-20 12:22:19,077] Trial 292 finished with value: -1.689067873353032 and parameters: {'booster': 'dart', 'lambda': 1.6398017343758437e-06, 'alpha': 3.345724108655262e-08, 'subsample': 0.5189589278584364, 'colsample_bytree': 0.5563550715376122, 'max_depth': 6, 'min_child_weight': 2, 'eta': 0.017843798717817418, 'gamma': 4.659472664974365, 'rate_drop': 2.994844110721565e-07, 'skip_drop': 1.2085049802515707e-08}. Best is trial 189 with value: -1.66206808945109.
[I 2025-06-20 12:22:26,147] Trial 293 finished with value: -1.6949348486958764 and parameters: {'booster': 'dart', 'lambda': 4.4270562679698917e-07, 'alpha': 1.0129467641810042e-08, 'subsample': 0.5076088389989146, 'colsample_bytree': 0.5627474973524059, 'max_depth': 6, 'min_child_weight': 3, 'eta': 0.01624000864717997, 'gamma': 0.1004409980212917, 'rate_drop': 4.884741770355938e-07, 'skip_drop': 1.0050153384732421e-08}. Best is trial 189 with value: -1.66206808945109.
[I 2025-06-20 12:22:33,170] Trial 294 finished with value: -1.6860106866130522 and parameters: {'booster': 'dart', 'lambda': 2.719740868772218e-07, 'alpha': 1.6291520482324747e-08, 'subsample': 0.5229163876995077, 'colsample_bytree': 0.5485035472740785, 'max_depth': 6, 'min_child_weight': 3, 'eta': 0.019262522984033314, 'gamma': 4.999393030686877, 'rate_drop': 2.2632357875137377e-07, 'skip_drop': 2.294482906710634e-08}. Best is trial 189 with value: -1.66206808945109.
[I 2025-06-20 12:22:37,412] Trial 295 finished with value: -1.680868411174834 and parameters: {'booster': 'dart', 'lambda': 2.4177295675243176e-06, 'alpha': 2.8339220765498142e-08, 'subsample': 0.5102796986805235, 'colsample_bytree': 0.5726933720386899, 'max_depth': 6, 'min_child_weight': 3, 'eta': 0.022657454781985973, 'gamma': 4.830143293748093, 'rate_drop': 1.837440935638745e-07, 'skip_drop': 1.4895828805698282e-08}. Best is trial 189 with value: -1.66206808945109.
[I 2025-06-20 12:22:43,855] Trial 296 finished with value: -1.6852169733141473 and parameters: {'booster': 'dart', 'lambda': 1.3997417693724242e-05, 'alpha': 5.779687812413521e-08, 'subsample': 0.5282154151119379, 'colsample_bytree': 0.556023146782908, 'max_depth': 6, 'min_child_weight': 3, 'eta': 0.01648747123509848, 'gamma': 4.763140386699529, 'rate_drop': 6.499473696721868e-07, 'skip_drop': 3.1357651327266326e-08}. Best is trial 189 with value: -1.66206808945109.
[I 2025-06-20 12:22:48,072] Trial 297 finished with value: -1.6749816529576165 and parameters: {'booster': 'dart', 'lambda': 1.5058774909471114e-07, 'alpha': 1.4988858088578497e-08, 'subsample': 0.516747407993516, 'colsample_bytree': 0.5679563120314013, 'max_depth': 6, 'min_child_weight': 3, 'eta': 0.02491704483363702, 'gamma': 4.884713617599276, 'rate_drop': 3.717895195329361e-07, 'skip_drop': 1.946447742860535e-08}. Best is trial 189 with value: -1.66206808945109.
[I 2025-06-20 12:22:57,652] Trial 298 finished with value: -1.89243232598269 and parameters: {'booster': 'dart', 'lambda': 1.668043861579124e-06, 'alpha': 2.2224995201529084e-08, 'subsample': 0.5357540127950475, 'colsample_bytree': 0.5487540878726942, 'max_depth': 6, 'min_child_weight': 3, 'eta': 0.0016869725302650178, 'gamma': 4.6589454029727335, 'rate_drop': 1.6589235122228514e-05, 'skip_drop': 1.7132745368356676e-08}. Best is trial 189 with value: -1.66206808945109.
[I 2025-06-20 12:23:04,814] Trial 299 finished with value: -1.6858433873992729 and parameters: {'booster': 'dart', 'lambda': 3.2345056904884326e-07, 'alpha': 4.0509853431689534e-08, 'subsample': 0.5000686342526284, 'colsample_bytree': 0.5778904344947879, 'max_depth': 6, 'min_child_weight': 3, 'eta': 0.020895781920393142, 'gamma': 4.906486255872044, 'rate_drop': 3.1971541817199635e-07, 'skip_drop': 3.545064370454681e-08}. Best is trial 189 with value: -1.66206808945109.
[I 2025-06-20 12:23:07,151] Trial 300 finished with value: -1.7038762513432852 and parameters: {'booster': 'dart', 'lambda': 5.533644170793674e-07, 'alpha': 1.56083696543003e-08, 'subsample': 0.5212038874824468, 'colsample_bytree': 0.5608902772469824, 'max_depth': 6, 'min_child_weight': 2, 'eta': 0.02852360331537758, 'gamma': 4.767849969716992, 'rate_drop': 1.6916967370218433e-07, 'skip_drop': 0.18350752010564078}. Best is trial 189 with value: -1.66206808945109.
[I 2025-06-20 12:23:14,326] Trial 301 finished with value: -1.6874846921393498 and parameters: {'booster': 'dart', 'lambda': 8.537997664301857e-06, 'alpha': 8.543571953837448e-08, 'subsample': 0.5111361914576901, 'colsample_bytree': 0.5734110672341377, 'max_depth': 6, 'min_child_weight': 3, 'eta': 0.019273051058254165, 'gamma': 4.5789391808455, 'rate_drop': 1.685732396534159e-06, 'skip_drop': 2.4401326959073045e-08}. Best is trial 189 with value: -1.66206808945109.
[I 2025-06-20 12:23:21,308] Trial 302 finished with value: -1.6664507800421517 and parameters: {'booster': 'dart', 'lambda': 2.565737421047585e-06, 'alpha': 2.690921265255434e-08, 'subsample': 0.5286108831401615, 'colsample_bytree': 0.5573777463728741, 'max_depth': 6, 'min_child_weight': 3, 'eta': 0.022342752917051033, 'gamma': 4.904425938701725, 'rate_drop': 1.1460038754902626e-07, 'skip_drop': 4.511745453982812e-08}. Best is trial 189 with value: -1.66206808945109.
[I 2025-06-20 12:23:28,209] Trial 303 finished with value: -1.670283906973487 and parameters: {'booster': 'dart', 'lambda': 2.409345063417345e-06, 'alpha': 2.8395738367060345e-08, 'subsample': 0.528101124951533, 'colsample_bytree': 0.5296375101336882, 'max_depth': 6, 'min_child_weight': 3, 'eta': 0.01661585127582208, 'gamma': 4.901540390651589, 'rate_drop': 8.358687640427748e-08, 'skip_drop': 4.8636124324419025e-08}. Best is trial 189 with value: -1.66206808945109.
[I 2025-06-20 12:23:34,787] Trial 304 finished with value: -1.6735612229631158 and parameters: {'booster': 'dart', 'lambda': 4.7664072503191625e-06, 'alpha': 5.57941310006517e-08, 'subsample': 0.5315328173038936, 'colsample_bytree': 0.528576232455638, 'max_depth': 6, 'min_child_weight': 3, 'eta': 0.02265895680359024, 'gamma': 4.996809403504036, 'rate_drop': 1.119931738368632e-07, 'skip_drop': 9.802651342453039e-08}. Best is trial 189 with value: -1.66206808945109.
[I 2025-06-20 12:23:35,340] Trial 305 finished with value: -1.7069310196091565 and parameters: {'booster': 'gbtree', 'lambda': 2.70173831798354e-06, 'alpha': 3.613310807507367e-08, 'subsample': 0.5432252481161967, 'colsample_bytree': 0.5150391653754619, 'max_depth': 6, 'min_child_weight': 3, 'eta': 0.01893448914623065, 'gamma': 4.899828422612856}. Best is trial 189 with value: -1.66206808945109.
[I 2025-06-20 12:23:40,447] Trial 306 finished with value: -1.6708489577850842 and parameters: {'booster': 'dart', 'lambda': 2.943313065618531e-06, 'alpha': 2.85430265620722e-08, 'subsample': 0.5265011189679392, 'colsample_bytree': 0.5342981241557978, 'max_depth': 6, 'min_child_weight': 3, 'eta': 0.02103238811296484, 'gamma': 4.897637971800146, 'rate_drop': 4.074380460737175e-08, 'skip_drop': 5.3438356796039234e-08}. Best is trial 189 with value: -1.66206808945109.
[I 2025-06-20 12:23:47,329] Trial 307 finished with value: -1.65474938452884 and parameters: {'booster': 'dart', 'lambda': 3.1424942518256775e-06, 'alpha': 2.828767104187835e-08, 'subsample': 0.5345350362809563, 'colsample_bytree': 0.5261768551942188, 'max_depth': 6, 'min_child_weight': 3, 'eta': 0.021608342769513775, 'gamma': 4.804586231555222, 'rate_drop': 4.0617856330572806e-08, 'skip_drop': 4.920482512334123e-08}. Best is trial 307 with value: -1.65474938452884.
[I 2025-06-20 12:23:53,903] Trial 308 finished with value: -1.671374857811914 and parameters: {'booster': 'dart', 'lambda': 4.773604532277406e-06, 'alpha': 6.327772946865473e-08, 'subsample': 0.5365708724825544, 'colsample_bytree': 0.5168782928237274, 'max_depth': 6, 'min_child_weight': 3, 'eta': 0.026553354125916338, 'gamma': 4.847379632431063, 'rate_drop': 4.431232296398764e-08, 'skip_drop': 5.910393978951767e-08}. Best is trial 307 with value: -1.65474938452884.
[I 2025-06-20 12:24:00,350] Trial 309 finished with value: -1.7192768984533535 and parameters: {'booster': 'dart', 'lambda': 3.0191232463926513e-06, 'alpha': 2.7917987108762834e-08, 'subsample': 0.7963729406303836, 'colsample_bytree': 0.5233378971566046, 'max_depth': 6, 'min_child_weight': 3, 'eta': 0.022991300495477145, 'gamma': 4.8731384837499565, 'rate_drop': 8.205896056118468e-08, 'skip_drop': 8.753328775608636e-08}. Best is trial 307 with value: -1.65474938452884.
[I 2025-06-20 12:24:05,722] Trial 310 finished with value: -1.7012595374199406 and parameters: {'booster': 'dart', 'lambda': 7.597841437768009e-06, 'alpha': 5.025698034889018e-08, 'subsample': 0.7098755795701936, 'colsample_bytree': 0.5411988786414065, 'max_depth': 8, 'min_child_weight': 2, 'eta': 0.020983203208755023, 'gamma': 4.807889170032148, 'rate_drop': 5.951298425826971e-08, 'skip_drop': 1.4084216125023155e-07}. Best is trial 307 with value: -1.65474938452884.
[I 2025-06-20 12:24:07,769] Trial 311 finished with value: -1.7411680935573635 and parameters: {'booster': 'dart', 'lambda': 4.2924766208373855e-06, 'alpha': 2.0771212764102942e-08, 'subsample': 0.8872429426567968, 'colsample_bytree': 0.5288684784721434, 'max_depth': 6, 'min_child_weight': 3, 'eta': 0.028176097445067945, 'gamma': 4.908570948695267, 'rate_drop': 3.442385955148563e-08, 'skip_drop': 5.109428806723538e-08}. Best is trial 307 with value: -1.65474938452884.
[I 2025-06-20 12:24:13,593] Trial 312 finished with value: -1.9349741388355426 and parameters: {'booster': 'dart', 'lambda': 2.438700947211241e-06, 'alpha': 1.0517449328855492e-07, 'subsample': 0.5311304154343364, 'colsample_bytree': 0.5304096300865415, 'max_depth': 9, 'min_child_weight': 3, 'eta': 0.024265664783334272, 'gamma': 4.807987473287958, 'rate_drop': 0.9418488993007672, 'skip_drop': 7.964662946061183e-08}. Best is trial 307 with value: -1.65474938452884.
[I 2025-06-20 12:24:18,973] Trial 313 finished with value: -1.6758206333761634 and parameters: {'booster': 'dart', 'lambda': 2.4584091139062447e-05, 'alpha': 3.5066396229987794e-08, 'subsample': 0.5515795006416558, 'colsample_bytree': 0.5365158342855787, 'max_depth': 6, 'min_child_weight': 3, 'eta': 0.019528004135602333, 'gamma': 4.904466046679503, 'rate_drop': 3.704343067918149e-08, 'skip_drop': 4.231979346223557e-08}. Best is trial 307 with value: -1.65474938452884.
[I 2025-06-20 12:24:27,583] Trial 314 finished with value: -1.7223285096541348 and parameters: {'booster': 'dart', 'lambda': 1.1127048404866658e-05, 'alpha': 1.6016550814849112e-08, 'subsample': 0.9671006995915924, 'colsample_bytree': 0.5430248330228429, 'max_depth': 6, 'min_child_weight': 3, 'eta': 0.01639439574849262, 'gamma': 4.921819657627797, 'rate_drop': 7.364114310084767e-08, 'skip_drop': 1.1879384792151131e-07}. Best is trial 307 with value: -1.65474938452884.
[I 2025-06-20 12:24:34,258] Trial 315 finished with value: -1.6782914954255055 and parameters: {'booster': 'dart', 'lambda': 5.592253975851352e-06, 'alpha': 2.7603520266939726e-08, 'subsample': 0.542371836155536, 'colsample_bytree': 0.5178560844305008, 'max_depth': 6, 'min_child_weight': 3, 'eta': 0.023361299680478665, 'gamma': 4.793552358679687, 'rate_drop': 2.1187178261016796e-08, 'skip_drop': 5.7094806723698194e-08}. Best is trial 307 with value: -1.65474938452884.
[I 2025-06-20 12:24:41,184] Trial 316 finished with value: -1.672437507573709 and parameters: {'booster': 'dart', 'lambda': 2.458173217515518e-06, 'alpha': 4.4755251249407485e-08, 'subsample': 0.5282815144715758, 'colsample_bytree': 0.5352885603094575, 'max_depth': 6, 'min_child_weight': 3, 'eta': 0.020549606015896622, 'gamma': 4.991381825245312, 'rate_drop': 5.3185407941077364e-08, 'skip_drop': 4.571279965855526e-08}. Best is trial 307 with value: -1.65474938452884.
[I 2025-06-20 12:24:45,142] Trial 317 finished with value: -1.6944668926644064 and parameters: {'booster': 'dart', 'lambda': 3.9905726244209484e-06, 'alpha': 1.6767068840570743e-08, 'subsample': 0.5084442471407303, 'colsample_bytree': 0.5465381344902775, 'max_depth': 6, 'min_child_weight': 3, 'eta': 0.030413016241112402, 'gamma': 4.750512893471602, 'rate_drop': 9.500363958127146e-08, 'skip_drop': 7.715088394617982e-08}. Best is trial 307 with value: -1.65474938452884.
[I 2025-06-20 12:24:52,174] Trial 318 finished with value: -1.679699232230511 and parameters: {'booster': 'dart', 'lambda': 1.4020121385046964e-06, 'alpha': 2.3658037944765777e-08, 'subsample': 0.5376854087976983, 'colsample_bytree': 0.5259402197785972, 'max_depth': 6, 'min_child_weight': 3, 'eta': 0.018229915679251547, 'gamma': 4.998658946531197, 'rate_drop': 9.515002192268138e-08, 'skip_drop': 2.448690614168991e-08}. Best is trial 307 with value: -1.65474938452884.
[I 2025-06-20 12:24:56,078] Trial 319 finished with value: -1.6630282940361654 and parameters: {'booster': 'dart', 'lambda': 3.256517384387432e-06, 'alpha': 1.4547974160123934e-08, 'subsample': 0.5252031854535906, 'colsample_bytree': 0.5501381125095558, 'max_depth': 6, 'min_child_weight': 3, 'eta': 0.026219665064001696, 'gamma': 4.863943418024621, 'rate_drop': 6.826970476737731e-08, 'skip_drop': 4.197977456161224e-08}. Best is trial 307 with value: -1.65474938452884.
[I 2025-06-20 12:25:00,028] Trial 320 finished with value: -1.6792750407635781 and parameters: {'booster': 'dart', 'lambda': 3.245879240125834e-06, 'alpha': 1.032621403269547e-08, 'subsample': 0.5474133155302511, 'colsample_bytree': 0.5483296745078147, 'max_depth': 6, 'min_child_weight': 3, 'eta': 0.026258474400481454, 'gamma': 4.72106268379994, 'rate_drop': 6.239231514423041e-08, 'skip_drop': 0.0007228018225903261}. Best is trial 307 with value: -1.65474938452884.
[I 2025-06-20 12:25:02,313] Trial 321 finished with value: -1.6885532345486596 and parameters: {'booster': 'dart', 'lambda': 6.695906664409633e-06, 'alpha': 1.4330388044986292e-08, 'subsample': 0.5279859099601129, 'colsample_bytree': 0.5374227820393879, 'max_depth': 6, 'min_child_weight': 2, 'eta': 0.032821422523464684, 'gamma': 4.832214744435906, 'rate_drop': 7.296991961204526e-08, 'skip_drop': 1.1067432338344686e-07}. Best is trial 307 with value: -1.65474938452884.
[I 2025-06-20 12:25:04,613] Trial 322 finished with value: -1.7261711210929227 and parameters: {'booster': 'dart', 'lambda': 2.12358460450615e-06, 'alpha': 3.729859149365364e-08, 'subsample': 0.8248178596255877, 'colsample_bytree': 0.5455877260747183, 'max_depth': 6, 'min_child_weight': 3, 'eta': 0.02800411183111644, 'gamma': 4.849075606612402, 'rate_drop': 1.2343061712186152e-07, 'skip_drop': 0.02334116454480347}. Best is trial 307 with value: -1.65474938452884.
[I 2025-06-20 12:25:08,821] Trial 323 finished with value: -1.684045411221274 and parameters: {'booster': 'dart', 'lambda': 0.00010133228362965775, 'alpha': 1.518834143720698e-08, 'subsample': 0.5126155450548372, 'colsample_bytree': 0.5307836606740269, 'max_depth': 6, 'min_child_weight': 3, 'eta': 0.024786032428340782, 'gamma': 4.71129092351927, 'rate_drop': 5.6364005315023364e-08, 'skip_drop': 4.591262604160657e-08}. Best is trial 307 with value: -1.65474938452884.
[I 2025-06-20 12:25:15,721] Trial 324 finished with value: -1.6669436758789093 and parameters: {'booster': 'dart', 'lambda': 3.45875103359822e-06, 'alpha': 1.002776689647912e-08, 'subsample': 0.5353425076325443, 'colsample_bytree': 0.5499069348889253, 'max_depth': 6, 'min_child_weight': 3, 'eta': 0.022426786907928636, 'gamma': 4.889176915304574, 'rate_drop': 4.29058175080289e-08, 'skip_drop': 3.7839668171715886e-08}. Best is trial 307 with value: -1.65474938452884.
[I 2025-06-20 12:25:16,104] Trial 325 finished with value: -1.7113920978573094 and parameters: {'booster': 'gbtree', 'lambda': 4.930151372941411e-06, 'alpha': 1.0053750982970975e-08, 'subsample': 0.5587790717637342, 'colsample_bytree': 0.5523404524031521, 'max_depth': 6, 'min_child_weight': 3, 'eta': 0.023758211435028705, 'gamma': 4.578465775484093}. Best is trial 307 with value: -1.65474938452884.
[I 2025-06-20 12:25:18,606] Trial 326 finished with value: -1.6790529904034286 and parameters: {'booster': 'dart', 'lambda': 9.56168321024081e-06, 'alpha': 1.0087844434130548e-08, 'subsample': 0.5358965405639415, 'colsample_bytree': 0.5530276986137007, 'max_depth': 6, 'min_child_weight': 3, 'eta': 0.028407700668122815, 'gamma': 4.787526850616347, 'rate_drop': 2.9620579397957237e-08, 'skip_drop': 0.005927023151641481}. Best is trial 307 with value: -1.65474938452884.
[I 2025-06-20 12:25:21,212] Trial 327 finished with value: -1.6947948624382085 and parameters: {'booster': 'dart', 'lambda': 8.643974572221247e-07, 'alpha': 1.6336069022896373e-08, 'subsample': 0.5460566215038459, 'colsample_bytree': 0.5786201829249608, 'max_depth': 6, 'min_child_weight': 1, 'eta': 0.0325689596158861, 'gamma': 4.894331840933293, 'rate_drop': 2.1627188311047636e-07, 'skip_drop': 1.901580612279974e-08}. Best is trial 307 with value: -1.65474938452884.
[I 2025-06-20 12:25:25,169] Trial 328 finished with value: -1.6911968765674537 and parameters: {'booster': 'dart', 'lambda': 1.3002334572425631e-06, 'alpha': 1.8625095863633145e-08, 'subsample': 0.5078040424895433, 'colsample_bytree': 0.5550804653642606, 'max_depth': 6, 'min_child_weight': 3, 'eta': 0.026743332633138727, 'gamma': 4.679662673762795, 'rate_drop': 1.0131925319089231e-07, 'skip_drop': 3.3656240705626776e-08}. Best is trial 307 with value: -1.65474938452884.
