[I 2025-06-20 12:28:24,612] Trial 375 finished with value: -1.6816743087218462 and parameters: {'booster': 'dart', 'lambda': 1.316460678707364e-07, 'alpha': 1.3605922796071776e-07, 'subsample': 0.5335951334400083, 'colsample_bytree': 0.5368655053924634, 'max_depth': 6, 'min_child_weight': 2, 'eta': 0.01830570789456352, 'gamma': 4.673379394698852, 'rate_drop': 1.4827726359441726e-05, 'skip_drop': 3.385147362351566e-08}. Best is trial 307 with value: -1.65474938452884.
[I 2025-06-20 12:28:27,331] Trial 376 finished with value: -1.6939103499694232 and parameters: {'booster': 'dart', 'lambda': 5.482045957194444e-06, 'alpha': 1.4339227003776799e-08, 'subsample': 0.5086636259095104, 'colsample_bytree': 0.5216431327772054, 'max_depth': 6, 'min_child_weight': 3, 'eta': 0.035272680491331226, 'gamma': 4.837658157320347, 'rate_drop': 3.8803335167393924e-08, 'skip_drop': 5.851188137784434e-08}. Best is trial 307 with value: -1.65474938452884.
[I 2025-06-20 12:28:31,316] Trial 377 finished with value: -1.6685659117879321 and parameters: {'booster': 'dart', 'lambda': 1.308095194031617e-06, 'alpha': 2.5908430600399854e-08, 'subsample': 0.5178921038382563, 'colsample_bytree': 0.5738414435522328, 'max_depth': 6, 'min_child_weight': 3, 'eta': 0.02791584038833689, 'gamma': 4.995163259315395, 'rate_drop': 8.046400634704418e-08, 'skip_drop': 2.0158568475502783e-08}. Best is trial 307 with value: -1.65474938452884.
[I 2025-06-20 12:28:33,509] Trial 378 finished with value: -1.684235324928764 and parameters: {'booster': 'dart', 'lambda': 1.2522700781162035e-06, 'alpha': 4.654625364264698e-08, 'subsample': 0.541296221808393, 'colsample_bytree': 0.5952024899146985, 'max_depth': 6, 'min_child_weight': 3, 'eta': 0.02946572962089196, 'gamma': 4.99553718829284, 'rate_drop': 6.872576458931196e-08, 'skip_drop': 1.75782154394173e-08}. Best is trial 307 with value: -1.65474938452884.
[I 2025-06-20 12:28:37,797] Trial 379 finished with value: -1.6992902554207976 and parameters: {'booster': 'dart', 'lambda': 1.6620584822930521e-06, 'alpha': 2.8272888414874205e-08, 'subsample': 0.5189362245396334, 'colsample_bytree': 0.5799781907380163, 'max_depth': 9, 'min_child_weight': 3, 'eta': 0.02463384488741942, 'gamma': 4.493535321814682, 'rate_drop': 9.518125215096717e-08, 'skip_drop': 1.310650895278866e-08}. Best is trial 307 with value: -1.65474938452884.
[I 2025-06-20 12:28:42,686] Trial 380 finished with value: -1.6673919069413492 and parameters: {'booster': 'dart', 'lambda': 7.689880966832621e-07, 'alpha': 6.896459767602379e-08, 'subsample': 0.5297068246689046, 'colsample_bytree': 0.5726697659664418, 'max_depth': 6, 'min_child_weight': 3, 'eta': 0.02803319353562453, 'gamma': 4.778043151317409, 'rate_drop': 1.301749286901214e-07, 'skip_drop': 2.3872958645709258e-08}. Best is trial 307 with value: -1.65474938452884.
[I 2025-06-20 12:28:46,658] Trial 381 finished with value: -1.6831420326153854 and parameters: {'booster': 'dart', 'lambda': 7.150082177132805e-07, 'alpha': 6.029423553072606e-08, 'subsample': 0.5096485086191189, 'colsample_bytree': 0.57452456454184, 'max_depth': 6, 'min_child_weight': 3, 'eta': 0.02658801181865076, 'gamma': 4.894570388615211, 'rate_drop': 1.1871753961350149e-07, 'skip_drop': 2.035838501093093e-08}. Best is trial 307 with value: -1.65474938452884.
[I 2025-06-20 12:28:50,176] Trial 382 finished with value: -1.679001528924238 and parameters: {'booster': 'dart', 'lambda': 1.0111174840120106e-06, 'alpha': 7.567123311717358e-08, 'subsample': 0.5265623926070246, 'colsample_bytree': 0.5707089459043956, 'max_depth': 6, 'min_child_weight': 2, 'eta': 0.027537256831846157, 'gamma': 4.788344469136871, 'rate_drop': 5.1395805933858496e-08, 'skip_drop': 2.528613662301812e-08}. Best is trial 307 with value: -1.65474938452884.
[I 2025-06-20 12:28:50,546] Trial 383 finished with value: -1.7236394042010383 and parameters: {'booster': 'gbtree', 'lambda': 5.5379853304731e-07, 'alpha': 1.0604684635449846e-07, 'subsample': 0.5000372286511839, 'colsample_bytree': 0.5556607484555208, 'max_depth': 6, 'min_child_weight': 3, 'eta': 0.023845424593427027, 'gamma': 4.891549833409451}. Best is trial 307 with value: -1.65474938452884.
[I 2025-06-20 12:28:51,819] Trial 384 finished with value: -1.7125411240017108 and parameters: {'booster': 'dart', 'lambda': 1.1538254862544836e-06, 'alpha': 0.0010620137441670575, 'subsample': 0.5556716591644085, 'colsample_bytree': 0.5478390038249682, 'max_depth': 6, 'min_child_weight': 4, 'eta': 0.035123570658060835, 'gamma': 4.599897920758028, 'rate_drop': 8.894600100505684e-08, 'skip_drop': 1.4373277834374174e-08}. Best is trial 307 with value: -1.65474938452884.
[I 2025-06-20 12:28:53,672] Trial 385 finished with value: -1.684348092144343 and parameters: {'booster': 'dart', 'lambda': 2.330491685926089e-06, 'alpha': 3.3487042056297443e-08, 'subsample': 0.5428386988189832, 'colsample_bytree': 0.5658094063639659, 'max_depth': 6, 'min_child_weight': 3, 'eta': 0.046434802306367345, 'gamma': 4.763054527099664, 'rate_drop': 1.468752146731985e-07, 'skip_drop': 1.9381110350054076e-08}. Best is trial 307 with value: -1.65474938452884.
[I 2025-06-20 12:28:59,145] Trial 386 finished with value: -1.6716579493217112 and parameters: {'booster': 'dart', 'lambda': 9.015221779476595e-07, 'alpha': 5.828732697551505e-08, 'subsample': 0.5194019752409829, 'colsample_bytree': 0.5851131837926035, 'max_depth': 6, 'min_child_weight': 3, 'eta': 0.023084714801802336, 'gamma': 4.904185060854022, 'rate_drop': 2.7900573819969936e-08, 'skip_drop': 3.656324148286122e-08}. Best is trial 307 with value: -1.65474938452884.
[I 2025-06-20 12:29:01,922] Trial 387 finished with value: -1.6639166416828972 and parameters: {'booster': 'dart', 'lambda': 1.6028163283956172e-06, 'alpha': 2.5432917856360845e-08, 'subsample': 0.533674900699044, 'colsample_bytree': 0.5573463062415437, 'max_depth': 6, 'min_child_weight': 3, 'eta': 0.03194187636371601, 'gamma': 4.996189160130158, 'rate_drop': 6.887019406270112e-08, 'skip_drop': 2.72948877088595e-08}. Best is trial 307 with value: -1.65474938452884.
[I 2025-06-20 12:29:03,565] Trial 388 finished with value: -1.6926410879248726 and parameters: {'booster': 'dart', 'lambda': 6.68089201499878e-07, 'alpha': 4.211286812136852e-08, 'subsample': 0.5515612766266917, 'colsample_bytree': 0.5555310918256917, 'max_depth': 6, 'min_child_weight': 3, 'eta': 0.04083460094041236, 'gamma': 4.9915696010155015, 'rate_drop': 3.988205397850136e-08, 'skip_drop': 2.4145881270536588e-08}. Best is trial 307 with value: -1.65474938452884.
[I 2025-06-20 12:29:06,367] Trial 389 finished with value: -1.6460117617383008 and parameters: {'booster': 'dart', 'lambda': 4.2471638885416484e-07, 'alpha': 2.2719324348442875e-08, 'subsample': 0.5382057242997333, 'colsample_bytree': 0.5733578613028018, 'max_depth': 7, 'min_child_weight': 3, 'eta': 0.032590874812416376, 'gamma': 4.819852342205711, 'rate_drop': 5.889431725319336e-08, 'skip_drop': 1.4734677075888419e-08}. Best is trial 389 with value: -1.6460117617383008.
[I 2025-06-20 12:29:08,079] Trial 390 finished with value: -1.6867293608119633 and parameters: {'booster': 'dart', 'lambda': 3.0907579578409735e-07, 'alpha': 2.449862153259394e-08, 'subsample': 0.5304683122239818, 'colsample_bytree': 0.564182023704877, 'max_depth': 7, 'min_child_weight': 2, 'eta': 0.032298880239009876, 'gamma': 4.994263535757263, 'rate_drop': 1.8907924383999834e-08, 'skip_drop': 1.4356541692936147e-08}. Best is trial 389 with value: -1.6460117617383008.
[I 2025-06-20 12:29:12,038] Trial 391 finished with value: -1.685084861423563 and parameters: {'booster': 'dart', 'lambda': 3.9311093491232416e-07, 'alpha': 4.088155856400118e-08, 'subsample': 0.5104469006631098, 'colsample_bytree': 0.574819209148326, 'max_depth': 6, 'min_child_weight': 3, 'eta': 0.02934283979006139, 'gamma': 4.845933794865645, 'rate_drop': 5.352410225303678e-08, 'skip_drop': 1.2666872839366478e-08}. Best is trial 389 with value: -1.6460117617383008.
[I 2025-06-20 12:29:14,865] Trial 392 finished with value: -1.6890516686884647 and parameters: {'booster': 'dart', 'lambda': 4.6893690007214364e-07, 'alpha': 7.561880927300788e-08, 'subsample': 0.5212553259013906, 'colsample_bytree': 0.5572617308869278, 'max_depth': 10, 'min_child_weight': 4, 'eta': 0.033382556308133575, 'gamma': 4.828071996843383, 'rate_drop': 1.603251143720435e-07, 'skip_drop': 1.0550680873743149e-08}. Best is trial 389 with value: -1.6460117617383008.
[I 2025-06-20 12:29:20,353] Trial 393 finished with value: -1.6693153537586582 and parameters: {'booster': 'dart', 'lambda': 5.746446584232708e-07, 'alpha': 1.6209720107371467e-07, 'subsample': 0.536127656223407, 'colsample_bytree': 0.5808059922647334, 'max_depth': 8, 'min_child_weight': 3, 'eta': 0.028116701142342413, 'gamma': 4.915941394412793, 'rate_drop': 3.8067257874218706e-08, 'skip_drop': 1.8266494055616655e-08}. Best is trial 389 with value: -1.6460117617383008.
[I 2025-06-20 12:29:25,062] Trial 394 finished with value: -1.684713197293866 and parameters: {'booster': 'dart', 'lambda': 5.57420591880409e-07, 'alpha': 1.6256708612138572e-07, 'subsample': 0.5349954843268141, 'colsample_bytree': 0.5853142571177901, 'max_depth': 8, 'min_child_weight': 3, 'eta': 0.028299103150643764, 'gamma': 4.912095885843914, 'rate_drop': 2.7650999504721777e-08, 'skip_drop': 1.7361638432420078e-08}. Best is trial 389 with value: -1.6460117617383008.
[I 2025-06-20 12:29:27,717] Trial 395 finished with value: -1.6958681941254254 and parameters: {'booster': 'dart', 'lambda': 3.2667984842290226e-07, 'alpha': 2.3346503409099054e-08, 'subsample': 0.5130001026089516, 'colsample_bytree': 0.5804024894131511, 'max_depth': 7, 'min_child_weight': 3, 'eta': 0.03189865398276802, 'gamma': 4.911831291230048, 'rate_drop': 5.77853865124337e-08, 'skip_drop': 1.7964898812270612e-08}. Best is trial 389 with value: -1.6460117617383008.
[I 2025-06-20 12:29:30,139] Trial 396 finished with value: -1.6911901314182598 and parameters: {'booster': 'dart', 'lambda': 7.938720040208443e-07, 'alpha': 9.721785628952516e-08, 'subsample': 0.525446798490306, 'colsample_bytree': 0.6001381126481393, 'max_depth': 8, 'min_child_weight': 3, 'eta': 0.027600495030412394, 'gamma': 4.995142041820807, 'rate_drop': 4.581256505786607e-08, 'skip_drop': 0.0013504508169312594}. Best is trial 389 with value: -1.6460117617383008.
[I 2025-06-20 12:29:32,731] Trial 397 finished with value: -1.6819218831456446 and parameters: {'booster': 'dart', 'lambda': 2.6629367781052814e-07, 'alpha': 2.10955741976658e-08, 'subsample': 0.5392542127041733, 'colsample_bytree': 0.5703186942300719, 'max_depth': 7, 'min_child_weight': 3, 'eta': 0.031218865953423366, 'gamma': 4.807154238966774, 'rate_drop': 3.244138451656523e-08, 'skip_drop': 1.4064930125409297e-08}. Best is trial 389 with value: -1.6460117617383008.
[I 2025-06-20 12:29:36,720] Trial 398 finished with value: -1.7209445864535255 and parameters: {'booster': 'dart', 'lambda': 4.2922471013355646e-07, 'alpha': 5.943154128616329e-08, 'subsample': 0.5215583099194645, 'colsample_bytree': 0.5654886758029349, 'max_depth': 8, 'min_child_weight': 3, 'eta': 0.025712778358907427, 'gamma': 4.825315485324463, 'rate_drop': 7.835039004073769e-08, 'skip_drop': 2.687921871156056e-08}. Best is trial 389 with value: -1.6460117617383008.
[I 2025-06-20 12:29:39,520] Trial 399 finished with value: -1.7252889828693576 and parameters: {'booster': 'dart', 'lambda': 8.20443535359279e-07, 'alpha': 1.0098615435226696e-08, 'subsample': 0.5085801353837841, 'colsample_bytree': 0.5869618064611041, 'max_depth': 8, 'min_child_weight': 3, 'eta': 0.0358107277440151, 'gamma': 4.723279516017238, 'rate_drop': 2.2287539086777946e-08, 'skip_drop': 1.8902656311215522e-08}. Best is trial 389 with value: -1.6460117617383008.
[I 2025-06-20 12:29:48,310] Trial 400 finished with value: -1.815328076597954 and parameters: {'booster': 'dart', 'lambda': 2.3492375464949886e-07, 'alpha': 3.0791764467459987e-08, 'subsample': 0.532826824757599, 'colsample_bytree': 0.8060713764797252, 'max_depth': 7, 'min_child_weight': 3, 'eta': 0.022821634883226624, 'gamma': 4.918838643976923, 'rate_drop': 0.2163713589337725, 'skip_drop': 3.008855340412797e-08}. Best is trial 389 with value: -1.6460117617383008.
[I 2025-06-20 12:29:51,747] Trial 401 finished with value: -1.7114536629399537 and parameters: {'booster': 'dart', 'lambda': 0.0005349118770252872, 'alpha': 4.34697783065857e-06, 'subsample': 0.5476248110704739, 'colsample_bytree': 0.5768839619276432, 'max_depth': 7, 'min_child_weight': 2, 'eta': 0.02169562319737131, 'gamma': 4.789558931292174, 'rate_drop': 1.1656917347455214e-07, 'skip_drop': 2.051717698833532e-08}. Best is trial 389 with value: -1.6460117617383008.
[I 2025-06-20 12:29:52,105] Trial 402 finished with value: -1.7207422022335819 and parameters: {'booster': 'gbtree', 'lambda': 5.764094388094253e-07, 'alpha': 1.9410430155899353e-08, 'subsample': 0.5169906834220676, 'colsample_bytree': 0.5897452710184513, 'max_depth': 8, 'min_child_weight': 3, 'eta': 0.029072103123856545, 'gamma': 4.9263270355602735}. Best is trial 389 with value: -1.6460117617383008.
[I 2025-06-20 12:29:56,014] Trial 403 finished with value: -1.6595204791573792 and parameters: {'booster': 'dart', 'lambda': 1.312466647672868e-06, 'alpha': 3.5998704940394264e-08, 'subsample': 0.5338023613756717, 'colsample_bytree': 0.5596486651224658, 'max_depth': 6, 'min_child_weight': 3, 'eta': 0.02653143311256185, 'gamma': 4.638216832856724, 'rate_drop': 3.9162829352538004e-08, 'skip_drop': 1.0515093716051696e-08}. Best is trial 389 with value: -1.6460117617383008.
[I 2025-06-20 12:29:58,585] Trial 404 finished with value: -1.695683259138366 and parameters: {'booster': 'dart', 'lambda': 1.0363756958701065e-06, 'alpha': 0.0005464810700350292, 'subsample': 0.541592233063785, 'colsample_bytree': 0.5579085499951392, 'max_depth': 6, 'min_child_weight': 4, 'eta': 0.025397932674634017, 'gamma': 4.688638546741343, 'rate_drop': 3.844907850913085e-08, 'skip_drop': 1.0013295371822559e-08}. Best is trial 389 with value: -1.6460117617383008.
[I 2025-06-20 12:30:01,443] Trial 405 finished with value: -1.6950575210458292 and parameters: {'booster': 'dart', 'lambda': 6.34091388509327e-07, 'alpha': 1.4868095577159397e-07, 'subsample': 0.7230716891530934, 'colsample_bytree': 0.548568341731052, 'max_depth': 6, 'min_child_weight': 10, 'eta': 0.026953308039272712, 'gamma': 4.994374413782066, 'rate_drop': 5.4456604664610686e-08, 'skip_drop': 1.3024625675028763e-08}. Best is trial 389 with value: -1.6460117617383008.
[I 2025-06-20 12:30:05,573] Trial 406 finished with value: -1.6893116269076862 and parameters: {'booster': 'dart', 'lambda': 0.00021413921331111824, 'alpha': 8.022625633803028e-08, 'subsample': 0.5632634284881667, 'colsample_bytree': 0.5643363516938342, 'max_depth': 6, 'min_child_weight': 3, 'eta': 0.023689554848498665, 'gamma': 4.842327114990321, 'rate_drop': 3.4381111126950745e-08, 'skip_drop': 3.385686317230909e-08}. Best is trial 389 with value: -1.6460117617383008.
[I 2025-06-20 12:30:12,061] Trial 407 finished with value: -1.699146658454393 and parameters: {'booster': 'dart', 'lambda': 1.002374590845662e-06, 'alpha': 4.5612795418277645e-08, 'subsample': 0.5330473190915405, 'colsample_bytree': 0.5542224368757273, 'max_depth': 7, 'min_child_weight': 3, 'eta': 0.020969352432304262, 'gamma': 4.754254300748875, 'rate_drop': 7.691125487015639e-08, 'skip_drop': 2.1476502925257983e-08}. Best is trial 389 with value: -1.6460117617383008.
[I 2025-06-20 12:30:15,965] Trial 408 finished with value: -1.67755710964583 and parameters: {'booster': 'dart', 'lambda': 1.360323219190754e-06, 'alpha': 3.687469324985675e-08, 'subsample': 0.5178191597576468, 'colsample_bytree': 0.5711257241971581, 'max_depth': 6, 'min_child_weight': 3, 'eta': 0.02812666614169104, 'gamma': 4.859600974986646, 'rate_drop': 6.929538342808849e-08, 'skip_drop': 0.00037843434475187454}. Best is trial 389 with value: -1.6460117617383008.
[I 2025-06-20 12:30:19,951] Trial 409 finished with value: -1.6833891203525224 and parameters: {'booster': 'dart', 'lambda': 1.5182390143379958e-06, 'alpha': 2.7654627456060044e-08, 'subsample': 0.5439904561503759, 'colsample_bytree': 0.563490738164969, 'max_depth': 6, 'min_child_weight': 3, 'eta': 0.024055063536337698, 'gamma': 4.996942891956809, 'rate_drop': 3.8915473244902024e-08, 'skip_drop': 1.030039257260498e-08}. Best is trial 389 with value: -1.6460117617383008.
[I 2025-06-20 12:30:27,061] Trial 410 finished with value: -1.676517611865992 and parameters: {'booster': 'dart', 'lambda': 4.0032499788415347e-07, 'alpha': 1.3533500834145404e-08, 'subsample': 0.5269938338398668, 'colsample_bytree': 0.5484645443345684, 'max_depth': 6, 'min_child_weight': 3, 'eta': 0.019858349129396567, 'gamma': 4.647590260046405, 'rate_drop': 1.9046811016696828e-07, 'skip_drop': 4.368635359042256e-08}. Best is trial 389 with value: -1.6460117617383008.
[I 2025-06-20 12:30:34,384] Trial 411 finished with value: -1.6763736385159402 and parameters: {'booster': 'dart', 'lambda': 1.950543501283409e-07, 'alpha': 6.197171440591741e-08, 'subsample': 0.5003685162278879, 'colsample_bytree': 0.5753997572062414, 'max_depth': 6, 'min_child_weight': 3, 'eta': 0.02620091839743732, 'gamma': 4.819468379857567, 'rate_drop': 5.529698738480625e-08, 'skip_drop': 2.6971276996501396e-08}. Best is trial 389 with value: -1.6460117617383008.
[I 2025-06-20 12:30:39,803] Trial 412 finished with value: -1.6561345525087248 and parameters: {'booster': 'dart', 'lambda': 6.558811549326023e-07, 'alpha': 2.1462129278085008e-08, 'subsample': 0.5364062340065578, 'colsample_bytree': 0.5598777672839126, 'max_depth': 6, 'min_child_weight': 3, 'eta': 0.02188867826981587, 'gamma': 4.904970088305471, 'rate_drop': 1.2647654826276333e-07, 'skip_drop': 1.5994379563065985e-08}. Best is trial 389 with value: -1.6460117617383008.
[I 2025-06-20 12:30:46,452] Trial 413 finished with value: -1.6832146848240257 and parameters: {'booster': 'dart', 'lambda': 4.1200027845424284e-07, 'alpha': 4.176664206487644e-08, 'subsample': 0.510076686628873, 'colsample_bytree': 0.557241946491485, 'max_depth': 6, 'min_child_weight': 3, 'eta': 0.021254110056422953, 'gamma': 4.994647223813133, 'rate_drop': 1.1060006151017131e-07, 'skip_drop': 1.3426681103735193e-08}. Best is trial 389 with value: -1.6460117617383008.
[I 2025-06-20 12:30:53,445] Trial 414 finished with value: -1.690670954670877 and parameters: {'booster': 'dart', 'lambda': 7.595688298587107e-07, 'alpha': 2.8894724137895895e-08, 'subsample': 0.5267745251229178, 'colsample_bytree': 0.5450221894260899, 'max_depth': 6, 'min_child_weight': 3, 'eta': 0.019012382399351595, 'gamma': 4.880281341299132, 'rate_drop': 1.0338956218974629e-07, 'skip_drop': 1.6276508850126513e-08}. Best is trial 389 with value: -1.6460117617383008.
[I 2025-06-20 12:30:57,508] Trial 415 finished with value: -1.6884266442832507 and parameters: {'booster': 'dart', 'lambda': 5.56000587114434e-07, 'alpha': 5.5431739347334737e-08, 'subsample': 0.5479478591369028, 'colsample_bytree': 0.5616288441834217, 'max_depth': 6, 'min_child_weight': 2, 'eta': 0.023043108361302893, 'gamma': 4.90565386113378, 'rate_drop': 6.874479402996034e-08, 'skip_drop': 1.4183600750296715e-08}. Best is trial 389 with value: -1.6460117617383008.
[I 2025-06-20 12:31:02,099] Trial 416 finished with value: -1.7552112643529065 and parameters: {'booster': 'dart', 'lambda': 3.1964472254518566e-07, 'alpha': 1.0931116314937741e-07, 'subsample': 0.9445136743595154, 'colsample_bytree': 0.5520361263224752, 'max_depth': 6, 'min_child_weight': 3, 'eta': 0.018518010158683765, 'gamma': 0.8312475525984135, 'rate_drop': 2.0610635552303213e-05, 'skip_drop': 1.0429613894524083e-08}. Best is trial 389 with value: -1.6460117617383008.
[I 2025-06-20 12:31:09,408] Trial 417 finished with value: -1.6923073687113328 and parameters: {'booster': 'dart', 'lambda': 1.2751979529443518e-06, 'alpha': 2.164932371005882e-08, 'subsample': 0.5356922545090996, 'colsample_bytree': 0.5691815672429128, 'max_depth': 6, 'min_child_weight': 4, 'eta': 0.021567587628910763, 'gamma': 4.793503944524392, 'rate_drop': 2.758440788897977e-08, 'skip_drop': 1.9168765657833884e-08}. Best is trial 389 with value: -1.6460117617383008.
[I 2025-06-20 12:31:14,696] Trial 418 finished with value: -1.683788429658632 and parameters: {'booster': 'dart', 'lambda': 8.778524762699787e-07, 'alpha': 2.8316009910352266e-08, 'subsample': 0.5591423095989547, 'colsample_bytree': 0.5427615101492202, 'max_depth': 5, 'min_child_weight': 3, 'eta': 0.022842076431460103, 'gamma': 4.91560894177662, 'rate_drop': 4.722633548601622e-08, 'skip_drop': 2.4593714032189075e-08}. Best is trial 389 with value: -1.6460117617383008.
[I 2025-06-20 12:31:22,691] Trial 419 finished with value: -1.6854833469038122 and parameters: {'booster': 'dart', 'lambda': 1.848686275549666e-07, 'alpha': 3.855153837654706e-08, 'subsample': 0.5248447344435038, 'colsample_bytree': 0.5579534895522051, 'max_depth': 6, 'min_child_weight': 3, 'eta': 0.01482194831620671, 'gamma': 4.9938013675662365, 'rate_drop': 1.665216602712039e-07, 'skip_drop': 5.505988519928896e-08}. Best is trial 389 with value: -1.6460117617383008.
[I 2025-06-20 12:31:26,813] Trial 420 finished with value: -1.6743875698829411 and parameters: {'booster': 'dart', 'lambda': 6.025138554556344e-07, 'alpha': 1.8284077818409227e-08, 'subsample': 0.5163416501948226, 'colsample_bytree': 0.5772947297358665, 'max_depth': 6, 'min_child_weight': 3, 'eta': 0.025050383754112917, 'gamma': 4.764333804150736, 'rate_drop': 9.310779081115809e-06, 'skip_drop': 3.69102240437165e-08}. Best is trial 389 with value: -1.6460117617383008.
