[I 2025-06-20 12:00:09,235] Trial 49 finished with value: -1.722067744361758 and parameters: {'booster': 'dart', 'lambda': 0.4461047636422026, 'alpha': 0.12464351759060761, 'subsample': 0.7458818649688711, 'colsample_bytree': 0.6142956762443113, 'max_depth': 4, 'min_child_weight': 5, 'eta': 0.03873741382002039, 'gamma': 3.679578096310836, 'rate_drop': 0.00028370909985665326, 'skip_drop': 2.9001362587967844e-06}. Best is trial 34 with value: -1.6825200771122633.
[I 2025-06-20 12:00:09,665] Trial 50 finished with value: -1.8338212336695383 and parameters: {'booster': 'dart', 'lambda': 0.12174294112951166, 'alpha': 0.012135377220784227, 'subsample': 0.5602836953670872, 'colsample_bytree': 0.7754377393865999, 'max_depth': 9, 'min_child_weight': 2, 'eta': 0.18403435567758178, 'gamma': 4.61864719670084, 'rate_drop': 1.2155093320506567e-05, 'skip_drop': 1.4232400656912262e-07}. Best is trial 34 with value: -1.6825200771122633.
[I 2025-06-20 12:00:18,182] Trial 51 finished with value: -1.7296388745274587 and parameters: {'booster': 'dart', 'lambda': 4.694431132702815, 'alpha': 2.3503795348266558e-05, 'subsample': 0.5480130113334926, 'colsample_bytree': 0.8247201489569813, 'max_depth': 4, 'min_child_weight': 4, 'eta': 0.017442879917674296, 'gamma': 4.26732870344207, 'rate_drop': 2.8747763331129247e-06, 'skip_drop': 6.55651474217114e-05}. Best is trial 34 with value: -1.6825200771122633.
[I 2025-06-20 12:00:18,824] Trial 52 finished with value: -1.7232693228910119 and parameters: {'booster': 'gbtree', 'lambda': 1.7106639676398856, 'alpha': 6.627440086478239e-06, 'subsample': 0.5295152632081008, 'colsample_bytree': 0.8630764855416657, 'max_depth': 10, 'min_child_weight': 6, 'eta': 0.01121467626688895, 'gamma': 3.9410745345698848}. Best is trial 34 with value: -1.6825200771122633.
[I 2025-06-20 12:00:24,319] Trial 53 finished with value: -1.730148641757117 and parameters: {'booster': 'dart', 'lambda': 9.865044585682535, 'alpha': 1.59339441729789e-06, 'subsample': 0.595898746728245, 'colsample_bytree': 0.9239807285111921, 'max_depth': 5, 'min_child_weight': 5, 'eta': 0.02633411301477351, 'gamma': 3.5558306383969454, 'rate_drop': 5.649381132020026e-07, 'skip_drop': 2.9767724059544626e-08}. Best is trial 34 with value: -1.6825200771122633.
[I 2025-06-20 12:00:24,513] Trial 54 finished with value: -1.7220679418831535 and parameters: {'booster': 'gbtree', 'lambda': 3.2229320433449435e-06, 'alpha': 4.163141932579567e-06, 'subsample': 0.6404941446915652, 'colsample_bytree': 0.7885362641914788, 'max_depth': 3, 'min_child_weight': 7, 'eta': 0.05101357658692156, 'gamma': 3.2404542501430047}. Best is trial 34 with value: -1.6825200771122633.
[I 2025-06-20 12:00:29,252] Trial 55 finished with value: -1.707254497383913 and parameters: {'booster': 'dart', 'lambda': 0.0017902844517079725, 'alpha': 0.001445764971355427, 'subsample': 0.6892470921237446, 'colsample_bytree': 0.8266693394452735, 'max_depth': 4, 'min_child_weight': 6, 'eta': 0.02375562219244255, 'gamma': 1.9250722697430764, 'rate_drop': 3.087790479862755e-05, 'skip_drop': 1.752757751698605e-06}. Best is trial 34 with value: -1.6825200771122633.
[I 2025-06-20 12:00:36,295] Trial 56 finished with value: -1.7182318084915036 and parameters: {'booster': 'dart', 'lambda': 0.4138868240359256, 'alpha': 7.506718116300064e-08, 'subsample': 0.579722558877922, 'colsample_bytree': 0.8043099683977326, 'max_depth': 6, 'min_child_weight': 1, 'eta': 0.016724769242240457, 'gamma': 2.527851266878859, 'rate_drop': 1.812746093825935e-07, 'skip_drop': 1.4104405910067625e-05}. Best is trial 34 with value: -1.6825200771122633.
[I 2025-06-20 12:00:36,711] Trial 57 finished with value: -1.7021908663050234 and parameters: {'booster': 'gbtree', 'lambda': 4.998366655689051, 'alpha': 0.11747263603380098, 'subsample': 0.5187787384831974, 'colsample_bytree': 0.6618585866969129, 'max_depth': 5, 'min_child_weight': 3, 'eta': 0.03368724337500578, 'gamma': 4.489098605008275}. Best is trial 34 with value: -1.6825200771122633.
[I 2025-06-20 12:00:38,940] Trial 58 finished with value: -1.7180722079456061 and parameters: {'booster': 'dart', 'lambda': 4.05829789864737, 'alpha': 0.10736685063570618, 'subsample': 0.5160440674966122, 'colsample_bytree': 0.651413141484668, 'max_depth': 5, 'min_child_weight': 3, 'eta': 0.035864291907764655, 'gamma': 4.789866456098079, 'rate_drop': 9.923543926282483e-05, 'skip_drop': 2.302262035572621e-07}. Best is trial 34 with value: -1.6825200771122633.
[I 2025-06-20 12:00:39,191] Trial 59 finished with value: -1.7131707128265885 and parameters: {'booster': 'gbtree', 'lambda': 1.4994807496697482, 'alpha': 0.3083964114917173, 'subsample': 0.5602697564206257, 'colsample_bytree': 0.6757614872216908, 'max_depth': 6, 'min_child_weight': 3, 'eta': 0.04804457350453383, 'gamma': 4.458614710620013}. Best is trial 34 with value: -1.6825200771122633.
[I 2025-06-20 12:00:40,031] Trial 60 finished with value: -1.717037462134746 and parameters: {'booster': 'dart', 'lambda': 0.24333177994883262, 'alpha': 0.0036016613940353034, 'subsample': 0.6264578795524837, 'colsample_bytree': 0.7239502684892862, 'max_depth': 5, 'min_child_weight': 2, 'eta': 0.06515030615390285, 'gamma': 4.19802499369849, 'rate_drop': 0.0003001420119886113, 'skip_drop': 0.00015400741072727853}. Best is trial 34 with value: -1.6825200771122633.
[I 2025-06-20 12:00:40,416] Trial 61 finished with value: -1.725509043278423 and parameters: {'booster': 'gbtree', 'lambda': 0.06168026918137618, 'alpha': 0.062403299122213464, 'subsample': 0.5254244539964411, 'colsample_bytree': 0.8479574433045831, 'max_depth': 4, 'min_child_weight': 3, 'eta': 0.02037058943232144, 'gamma': 3.847930471499682}. Best is trial 34 with value: -1.6825200771122633.
[I 2025-06-20 12:00:40,761] Trial 62 finished with value: -1.742032535244967 and parameters: {'booster': 'gbtree', 'lambda': 0.00020566532267201268, 'alpha': 0.009680692982622198, 'subsample': 0.5452172625464721, 'colsample_bytree': 0.7100389165572961, 'max_depth': 3, 'min_child_weight': 10, 'eta': 0.013218116258448424, 'gamma': 0.3438774646206688}. Best is trial 34 with value: -1.6825200771122633.
[I 2025-06-20 12:00:41,028] Trial 63 finished with value: -1.7301609540897323 and parameters: {'booster': 'gbtree', 'lambda': 4.699484601977155, 'alpha': 0.8828815717768396, 'subsample': 0.6027794911693009, 'colsample_bytree': 0.761827878254275, 'max_depth': 4, 'min_child_weight': 2, 'eta': 0.034681939168106274, 'gamma': 4.564804940423558}. Best is trial 34 with value: -1.6825200771122633.
[I 2025-06-20 12:00:41,258] Trial 64 finished with value: -1.7013091233224034 and parameters: {'booster': 'gbtree', 'lambda': 2.238150698757846e-05, 'alpha': 8.130666150918937e-07, 'subsample': 0.5743863945032219, 'colsample_bytree': 0.6049346896460586, 'max_depth': 4, 'min_child_weight': 4, 'eta': 0.024670071371537827, 'gamma': 4.948324713917991}. Best is trial 34 with value: -1.6825200771122633.
[I 2025-06-20 12:00:41,472] Trial 65 finished with value: -1.6955375767419556 and parameters: {'booster': 'gbtree', 'lambda': 1.965915665392444e-05, 'alpha': 3.685461852961882e-07, 'subsample': 0.5795751023867526, 'colsample_bytree': 0.6090977870314735, 'max_depth': 5, 'min_child_weight': 4, 'eta': 0.027241320884256067, 'gamma': 4.9624903505482045}. Best is trial 34 with value: -1.6825200771122633.
[I 2025-06-20 12:00:41,735] Trial 66 finished with value: -1.7247524760179829 and parameters: {'booster': 'gbtree', 'lambda': 2.256016241420503e-05, 'alpha': 2.047744297701782e-07, 'subsample': 0.6574914481753673, 'colsample_bytree': 0.6055340722048101, 'max_depth': 6, 'min_child_weight': 4, 'eta': 0.025952485395640604, 'gamma': 4.965177649133254}. Best is trial 34 with value: -1.6825200771122633.
[I 2025-06-20 12:00:41,944] Trial 67 finished with value: -1.691336379562577 and parameters: {'booster': 'gbtree', 'lambda': 2.610283020524372e-07, 'alpha': 8.374098944468493e-07, 'subsample': 0.5754746386809763, 'colsample_bytree': 0.6410686235004883, 'max_depth': 5, 'min_child_weight': 4, 'eta': 0.030294120961737166, 'gamma': 4.809851369432689}. Best is trial 34 with value: -1.6825200771122633.
[I 2025-06-20 12:00:42,161] Trial 68 finished with value: -1.7142653931201983 and parameters: {'booster': 'gbtree', 'lambda': 4.0826394475692557e-07, 'alpha': 1.1397295177431423e-06, 'subsample': 0.579120436259493, 'colsample_bytree': 0.6395704429157614, 'max_depth': 6, 'min_child_weight': 4, 'eta': 0.029060065772455648, 'gamma': 4.780858204419587}. Best is trial 34 with value: -1.6825200771122633.
[I 2025-06-20 12:00:42,541] Trial 69 finished with value: -1.7047760899893813 and parameters: {'booster': 'gbtree', 'lambda': 3.9622720705970913e-07, 'alpha': 1.0749548991348795e-08, 'subsample': 0.6062629809524498, 'colsample_bytree': 0.5651699061745057, 'max_depth': 5, 'min_child_weight': 5, 'eta': 0.015818311381744624, 'gamma': 4.861529376023042}. Best is trial 34 with value: -1.6825200771122633.
[I 2025-06-20 12:00:42,881] Trial 70 finished with value: -1.7282521926816679 and parameters: {'booster': 'gbtree', 'lambda': 2.1617254675675676e-05, 'alpha': 3.1365655311627444e-07, 'subsample': 0.9788595065963719, 'colsample_bytree': 0.534824528377934, 'max_depth': 5, 'min_child_weight': 5, 'eta': 0.009512768529548693, 'gamma': 4.9765425687697356}. Best is trial 34 with value: -1.6825200771122633.
[I 2025-06-20 12:00:43,127] Trial 71 finished with value: -1.7176241879545933 and parameters: {'booster': 'gbtree', 'lambda': 6.909105483739373e-08, 'alpha': 6.039637562019294e-07, 'subsample': 0.553759617457998, 'colsample_bytree': 0.6600004319439912, 'max_depth': 5, 'min_child_weight': 4, 'eta': 0.02195184078701327, 'gamma': 4.500436608824181}. Best is trial 34 with value: -1.6825200771122633.
[I 2025-06-20 12:00:43,295] Trial 72 finished with value: -1.7211526256722898 and parameters: {'booster': 'gbtree', 'lambda': 4.4988425124437615e-06, 'alpha': 2.736978970192971e-06, 'subsample': 0.5170501548850841, 'colsample_bytree': 0.6902932084848351, 'max_depth': 5, 'min_child_weight': 4, 'eta': 0.04179356548431155, 'gamma': 4.7437735538331385}. Best is trial 34 with value: -1.6825200771122633.
[I 2025-06-20 12:00:43,472] Trial 73 finished with value: -1.7215092745759526 and parameters: {'booster': 'gbtree', 'lambda': 0.00043025184957023717, 'alpha': 9.414679566382263e-07, 'subsample': 0.7885612897425119, 'colsample_bytree': 0.6107536590614439, 'max_depth': 4, 'min_child_weight': 3, 'eta': 0.03337098767483969, 'gamma': 4.375631153345641}. Best is trial 34 with value: -1.6825200771122633.
[I 2025-06-20 12:00:43,778] Trial 74 finished with value: -1.9129872175161868 and parameters: {'booster': 'gbtree', 'lambda': 1.2846561764131867e-06, 'alpha': 8.000434892300011e-08, 'subsample': 0.5673472772914429, 'colsample_bytree': 0.636141869259913, 'max_depth': 4, 'min_child_weight': 4, 'eta': 0.0016500388583128949, 'gamma': 4.642264580022557}. Best is trial 34 with value: -1.6825200771122633.
[I 2025-06-20 12:00:44,008] Trial 75 finished with value: -1.7117342058097722 and parameters: {'booster': 'gbtree', 'lambda': 2.011846209032212e-05, 'alpha': 5.599872441698015e-06, 'subsample': 0.5008013341003454, 'colsample_bytree': 0.5785767718153233, 'max_depth': 6, 'min_child_weight': 5, 'eta': 0.025608518792104257, 'gamma': 4.14398498413654}. Best is trial 34 with value: -1.6825200771122633.
[I 2025-06-20 12:00:44,330] Trial 76 finished with value: -1.7038684313253387 and parameters: {'booster': 'gbtree', 'lambda': 1.0279792914894726e-05, 'alpha': 3.2721993159591013e-07, 'subsample': 0.5757666718399462, 'colsample_bytree': 0.6740678513170805, 'max_depth': 7, 'min_child_weight': 4, 'eta': 0.020037002554397856, 'gamma': 4.873330724707713}. Best is trial 34 with value: -1.6825200771122633.
[I 2025-06-20 12:00:44,500] Trial 77 finished with value: -1.7221189151301195 and parameters: {'booster': 'gbtree', 'lambda': 1.3545105793898518e-08, 'alpha': 1.4545368719343282e-05, 'subsample': 0.5376741681676335, 'colsample_bytree': 0.5938376773037916, 'max_depth': 5, 'min_child_weight': 3, 'eta': 0.04036097840573767, 'gamma': 3.960812879839286}. Best is trial 34 with value: -1.6825200771122633.
[I 2025-06-20 12:00:44,671] Trial 78 finished with value: -1.7123866244361934 and parameters: {'booster': 'gbtree', 'lambda': 0.0001451123400973747, 'alpha': 1.20010527324625e-07, 'subsample': 0.5948759651568228, 'colsample_bytree': 0.538460473219524, 'max_depth': 3, 'min_child_weight': 6, 'eta': 0.05607555514176914, 'gamma': 4.528273450686163}. Best is trial 34 with value: -1.6825200771122633.
[I 2025-06-20 12:00:44,857] Trial 79 finished with value: -1.7038975644582057 and parameters: {'booster': 'gbtree', 'lambda': 0.0009499009841721739, 'alpha': 1.4949517638216835e-06, 'subsample': 0.5537395876365898, 'colsample_bytree': 0.5154684605605128, 'max_depth': 5, 'min_child_weight': 5, 'eta': 0.033077889170630786, 'gamma': 4.390056471911885}. Best is trial 34 with value: -1.6825200771122633.
[I 2025-06-20 12:00:52,606] Trial 80 finished with value: -1.8565847884574704 and parameters: {'booster': 'dart', 'lambda': 8.21097738601035e-07, 'alpha': 3.015822157707872e-08, 'subsample': 0.5352199266433909, 'colsample_bytree': 0.6173227526006622, 'max_depth': 4, 'min_child_weight': 7, 'eta': 0.02815483658500223, 'gamma': 4.709595809125313, 'rate_drop': 0.24230262723763948, 'skip_drop': 0.00026311371875188287}. Best is trial 34 with value: -1.6825200771122633.
[I 2025-06-20 12:00:55,081] Trial 81 finished with value: -1.722802491584041 and parameters: {'booster': 'dart', 'lambda': 1.3326602257790798, 'alpha': 7.280122171169054e-07, 'subsample': 0.5908586943586609, 'colsample_bytree': 0.5530420370329845, 'max_depth': 4, 'min_child_weight': 2, 'eta': 0.041162894344576234, 'gamma': 4.3072378593583345, 'rate_drop': 1.1124378941597636e-05, 'skip_drop': 0.07945261408035117}. Best is trial 34 with value: -1.6825200771122633.
[I 2025-06-20 12:00:57,599] Trial 82 finished with value: -1.6909009858410342 and parameters: {'booster': 'dart', 'lambda': 2.5709152601311716, 'alpha': 0.04951807277676209, 'subsample': 0.630078493619757, 'colsample_bytree': 0.7370836825641842, 'max_depth': 4, 'min_child_weight': 3, 'eta': 0.07425216352409662, 'gamma': 4.235831691117114, 'rate_drop': 0.0001225888729178881, 'skip_drop': 3.7589994855226537e-06}. Best is trial 34 with value: -1.6825200771122633.
[I 2025-06-20 12:01:04,197] Trial 83 finished with value: -1.6904348461062944 and parameters: {'booster': 'dart', 'lambda': 2.799477273760406, 'alpha': 0.06530211695266161, 'subsample': 0.6078531846729371, 'colsample_bytree': 0.741838322350516, 'max_depth': 4, 'min_child_weight': 3, 'eta': 0.022690467776441535, 'gamma': 3.833576502957114, 'rate_drop': 0.0019874103663996964, 'skip_drop': 4.4556322856671e-06}. Best is trial 34 with value: -1.6825200771122633.
[I 2025-06-20 12:01:05,358] Trial 84 finished with value: -1.7053370344967107 and parameters: {'booster': 'dart', 'lambda': 2.484787511988464, 'alpha': 2.531167089777464e-06, 'subsample': 0.6127019988272457, 'colsample_bytree': 0.7390649425592788, 'max_depth': 4, 'min_child_weight': 4, 'eta': 0.07456455415098559, 'gamma': 3.5851175124039103, 'rate_drop': 0.00195877184849586, 'skip_drop': 9.170888922863724e-06}. Best is trial 34 with value: -1.6825200771122633.
[I 2025-06-20 12:01:14,426] Trial 85 finished with value: -1.7387684908586016 and parameters: {'booster': 'dart', 'lambda': 1.350494866264617e-07, 'alpha': 0.014494693546124341, 'subsample': 0.6514341568837073, 'colsample_bytree': 0.7051431001222431, 'max_depth': 3, 'min_child_weight': 4, 'eta': 0.012153501625224675, 'gamma': 3.8571790292220025, 'rate_drop': 0.0005817774508470202, 'skip_drop': 3.565351889622252e-06}. Best is trial 34 with value: -1.6825200771122633.
[I 2025-06-20 12:01:23,346] Trial 86 finished with value: -1.7286175984623007 and parameters: {'booster': 'dart', 'lambda': 0.6264176742258484, 'alpha': 4.7374243084374214e-05, 'subsample': 0.6802976433871386, 'colsample_bytree': 0.729670455451008, 'max_depth': 4, 'min_child_weight': 3, 'eta': 0.01851744588435069, 'gamma': 4.156718471313755, 'rate_drop': 0.03098873831557548, 'skip_drop': 8.278878292313069e-05}. Best is trial 34 with value: -1.6825200771122633.
[I 2025-06-20 12:01:24,547] Trial 87 finished with value: -1.6941597457857396 and parameters: {'booster': 'dart', 'lambda': 1.2282815322138976, 'alpha': 0.06159186582818191, 'subsample': 0.6079875119539793, 'colsample_bytree': 0.6905332364370754, 'max_depth': 4, 'min_child_weight': 5, 'eta': 0.09045686185185149, 'gamma': 4.048355052592409, 'rate_drop': 0.00010885598738503246, 'skip_drop': 4.909334506420393e-06}. Best is trial 34 with value: -1.6825200771122633.
[I 2025-06-20 12:01:25,694] Trial 88 finished with value: -1.7139937224594288 and parameters: {'booster': 'dart', 'lambda': 1.1480610591607279, 'alpha': 0.06708626617339374, 'subsample': 0.6308804289372049, 'colsample_bytree': 0.6981051934744056, 'max_depth': 3, 'min_child_weight': 5, 'eta': 0.08477485506305538, 'gamma': 3.747601890092983, 'rate_drop': 0.00013910189035583635, 'skip_drop': 4.301227118425459e-06}. Best is trial 34 with value: -1.6825200771122633.
[I 2025-06-20 12:01:26,433] Trial 89 finished with value: -1.7346376562049473 and parameters: {'booster': 'dart', 'lambda': 2.6118592631264455, 'alpha': 0.2161277300571152, 'subsample': 0.6065402044946698, 'colsample_bytree': 0.7479843714475145, 'max_depth': 4, 'min_child_weight': 6, 'eta': 0.11230575416714644, 'gamma': 4.029275577954306, 'rate_drop': 6.713837362056238e-05, 'skip_drop': 1.2358000158032617e-06}. Best is trial 34 with value: -1.6825200771122633.
[I 2025-06-20 12:01:27,674] Trial 90 finished with value: -1.7262612434394224 and parameters: {'booster': 'dart', 'lambda': 0.1988334514120149, 'alpha': 0.053655405847868126, 'subsample': 0.6458116555827196, 'colsample_bytree': 0.7146248452393711, 'max_depth': 4, 'min_child_weight': 6, 'eta': 0.060459040270289456, 'gamma': 3.2754248947195475, 'rate_drop': 0.00041915349497748014, 'skip_drop': 1.6535724488856528e-05}. Best is trial 34 with value: -1.6825200771122633.
[I 2025-06-20 12:01:36,802] Trial 91 finished with value: -1.6960819545425814 and parameters: {'booster': 'dart', 'lambda': 8.255349350467489, 'alpha': 0.007758360385222425, 'subsample': 0.5759874099805262, 'colsample_bytree': 0.6440380652350267, 'max_depth': 4, 'min_child_weight': 4, 'eta': 0.024955876279315177, 'gamma': 2.9653948787360283, 'rate_drop': 0.006060482785542931, 'skip_drop': 5.136544168819224e-06}. Best is trial 34 with value: -1.6825200771122633.
[I 2025-06-20 12:01:37,479] Trial 92 finished with value: -1.812541333532797 and parameters: {'booster': 'dart', 'lambda': 6.904671620659837, 'alpha': 0.009387131919228141, 'subsample': 0.5882867469252322, 'colsample_bytree': 0.7747224883888196, 'max_depth': 4, 'min_child_weight': 4, 'eta': 0.16173356703205144, 'gamma': 2.949735503237319, 'rate_drop': 0.0036082811733042152, 'skip_drop': 5.935406620795797e-06}. Best is trial 34 with value: -1.6825200771122633.
[I 2025-06-20 12:01:46,664] Trial 93 finished with value: -1.6990633465924843 and parameters: {'booster': 'dart', 'lambda': 0.5460165677422101, 'alpha': 0.018236282697400512, 'subsample': 0.5577406822275731, 'colsample_bytree': 0.647035866320557, 'max_depth': 4, 'min_child_weight': 5, 'eta': 0.022376339973559048, 'gamma': 3.507925669021261, 'rate_drop': 0.00908363942639764, 'skip_drop': 4.9890378611185506e-05}. Best is trial 34 with value: -1.6825200771122633.
[I 2025-06-20 12:01:47,216] Trial 94 finished with value: -1.82286678285217 and parameters: {'booster': 'dart', 'lambda': 6.42434779457974, 'alpha': 0.0017869576456248477, 'subsample': 0.5621943470764384, 'colsample_bytree': 0.6498162504085156, 'max_depth': 3, 'min_child_weight': 5, 'eta': 0.24612270226332922, 'gamma': 3.521165879048839, 'rate_drop': 0.01823142505865191, 'skip_drop': 1.6174766071233892e-05}. Best is trial 34 with value: -1.6825200771122633.
[I 2025-06-20 12:01:55,883] Trial 95 finished with value: -1.877562081298981 and parameters: {'booster': 'dart', 'lambda': 1.4479102924544105, 'alpha': 0.0057396839902319925, 'subsample': 0.6018343896741121, 'colsample_bytree': 0.6820885918809967, 'max_depth': 4, 'min_child_weight': 5, 'eta': 0.014484694274424482, 'gamma': 3.7020432864661825, 'rate_drop': 0.1331154717460074, 'skip_drop': 9.635880654468728e-07}. Best is trial 34 with value: -1.6825200771122633.
[I 2025-06-20 12:02:05,052] Trial 96 finished with value: -1.704638481375388 and parameters: {'booster': 'dart', 'lambda': 2.9939160775447298, 'alpha': 0.23920808347765943, 'subsample': 0.6155092556247292, 'colsample_bytree': 0.6408327175531907, 'max_depth': 4, 'min_child_weight': 4, 'eta': 0.02255161335860284, 'gamma': 3.1120050413957174, 'rate_drop': 0.009935982606977823, 'skip_drop': 2.0295123257385216e-06}. Best is trial 34 with value: -1.6825200771122633.
[I 2025-06-20 12:02:05,402] Trial 97 finished with value: -1.8017515474238117 and parameters: {'booster': 'dart', 'lambda': 0.44670914900624853, 'alpha': 0.0005060500658514165, 'subsample': 0.5473380825405222, 'colsample_bytree': 0.667444993999316, 'max_depth': 5, 'min_child_weight': 3, 'eta': 0.20195097983703508, 'gamma': 2.8600511960951356, 'rate_drop': 0.0015941363155913546, 'skip_drop': 7.207125231381707e-06}. Best is trial 34 with value: -1.6825200771122633.
[I 2025-06-20 12:02:14,247] Trial 98 finished with value: -1.8502253328790084 and parameters: {'booster': 'dart', 'lambda': 9.501633040066201, 'alpha': 0.016726081780760026, 'subsample': 0.5732743257918647, 'colsample_bytree': 0.6935981843001665, 'max_depth': 3, 'min_child_weight': 3, 'eta': 0.01725236563974401, 'gamma': 3.353695494839364, 'rate_drop': 0.06788160315812165, 'skip_drop': 5.981873446290176e-05}. Best is trial 34 with value: -1.6825200771122633.
