[I 2025-06-20 12:13:35,005] Trial 191 finished with value: -1.6800439702127672 and parameters: {'booster': 'dart', 'lambda': 2.9605247884672214e-07, 'alpha': 1.0626516058975575e-08, 'subsample': 0.5218699147978885, 'colsample_bytree': 0.56148138420623, 'max_depth': 6, 'min_child_weight': 3, 'eta': 0.018407576356537683, 'gamma': 4.949447700308299, 'rate_drop': 1.4189730741608981e-05, 'skip_drop': 1.258121342815158e-07}. Best is trial 189 with value: -1.66206808945109.
[I 2025-06-20 12:13:43,508] Trial 192 finished with value: -1.6704289222870519 and parameters: {'booster': 'dart', 'lambda': 1.580171966638782e-07, 'alpha': 1.797264617893398e-08, 'subsample': 0.5199292436785793, 'colsample_bytree': 0.5614325832936997, 'max_depth': 6, 'min_child_weight': 3, 'eta': 0.020249211417565402, 'gamma': 4.966311829486306, 'rate_drop': 1.1575841722960561e-05, 'skip_drop': 8.592756301182843e-08}. Best is trial 189 with value: -1.66206808945109.
[I 2025-06-20 12:13:52,379] Trial 193 finished with value: -1.677547460984934 and parameters: {'booster': 'dart', 'lambda': 3.449726657041334e-07, 'alpha': 1.150318014625929e-08, 'subsample': 0.5239125608854642, 'colsample_bytree': 0.5598450427596378, 'max_depth': 6, 'min_child_weight': 3, 'eta': 0.01925870726611727, 'gamma': 4.938474865071767, 'rate_drop': 7.273626325092968e-06, 'skip_drop': 9.46456127546351e-08}. Best is trial 189 with value: -1.66206808945109.
[I 2025-06-20 12:14:03,472] Trial 194 finished with value: -1.6733872179645803 and parameters: {'booster': 'dart', 'lambda': 3.546508235230121e-07, 'alpha': 1.3908318310952872e-08, 'subsample': 0.5248876549561351, 'colsample_bytree': 0.5564195673884947, 'max_depth': 6, 'min_child_weight': 3, 'eta': 0.020951978760716916, 'gamma': 4.954869918430501, 'rate_drop': 1.2213507548041383e-05, 'skip_drop': 1.0008903018035225e-07}. Best is trial 189 with value: -1.66206808945109.
[I 2025-06-20 12:14:12,636] Trial 195 finished with value: -1.6849081761899996 and parameters: {'booster': 'dart', 'lambda': 3.137772331509227e-07, 'alpha': 1.0378547865672555e-08, 'subsample': 0.5215413198691444, 'colsample_bytree': 0.5570359396477488, 'max_depth': 6, 'min_child_weight': 3, 'eta': 0.020729301515753647, 'gamma': 4.997057097902742, 'rate_drop': 6.544146765103145e-06, 'skip_drop': 1.052805438440246e-07}. Best is trial 189 with value: -1.66206808945109.
[I 2025-06-20 12:14:21,344] Trial 196 finished with value: -1.6911126032592534 and parameters: {'booster': 'dart', 'lambda': 1.9217649619992798e-07, 'alpha': 1.0631298298492554e-08, 'subsample': 0.5223559031286219, 'colsample_bytree': 0.5595999255395973, 'max_depth': 6, 'min_child_weight': 2, 'eta': 0.019166013025973743, 'gamma': 4.98812408512867, 'rate_drop': 1.1688027341574533e-05, 'skip_drop': 7.737016911202014e-08}. Best is trial 189 with value: -1.66206808945109.
[I 2025-06-20 12:14:32,932] Trial 197 finished with value: -1.6813861547714846 and parameters: {'booster': 'dart', 'lambda': 3.455272130964674e-07, 'alpha': 1.778477166906698e-08, 'subsample': 0.524929854288257, 'colsample_bytree': 0.5481507483626195, 'max_depth': 6, 'min_child_weight': 3, 'eta': 0.017610477401001225, 'gamma': 4.908712413536236, 'rate_drop': 7.95580685642701e-06, 'skip_drop': 1.212207365748153e-07}. Best is trial 189 with value: -1.66206808945109.
[I 2025-06-20 12:14:36,944] Trial 198 finished with value: -1.6975883131528369 and parameters: {'booster': 'dart', 'lambda': 8.394339579516866e-07, 'alpha': 1.610708512541236e-08, 'subsample': 0.525858561571611, 'colsample_bytree': 0.5515124552134772, 'max_depth': 6, 'min_child_weight': 3, 'eta': 0.02172186018144453, 'gamma': 4.895554012543008, 'rate_drop': 8.730159681022133e-06, 'skip_drop': 1.404706326694707e-07}. Best is trial 189 with value: -1.66206808945109.
[I 2025-06-20 12:14:44,322] Trial 199 finished with value: -1.6870128731907001 and parameters: {'booster': 'dart', 'lambda': 5.011333231006038e-07, 'alpha': 1.8166794704430845e-08, 'subsample': 0.5265569200237699, 'colsample_bytree': 0.5476114410616306, 'max_depth': 6, 'min_child_weight': 3, 'eta': 0.01782001578415505, 'gamma': 4.891940897450857, 'rate_drop': 1.351027827631772e-05, 'skip_drop': 1.1175643294409477e-07}. Best is trial 189 with value: -1.66206808945109.
[I 2025-06-20 12:14:51,610] Trial 200 finished with value: -1.688251506896467 and parameters: {'booster': 'dart', 'lambda': 3.272595750631913e-07, 'alpha': 1.0782582403812746e-08, 'subsample': 0.5506302409466972, 'colsample_bytree': 0.5618737879305424, 'max_depth': 6, 'min_child_weight': 3, 'eta': 0.019284601336769767, 'gamma': 4.89609018851897, 'rate_drop': 6.273807284428059e-06, 'skip_drop': 8.216169757745251e-08}. Best is trial 189 with value: -1.66206808945109.
[I 2025-06-20 12:14:58,755] Trial 201 finished with value: -1.6744671960979656 and parameters: {'booster': 'dart', 'lambda': 1.5077899810799873e-07, 'alpha': 3.829962239156047e-08, 'subsample': 0.5189677126587963, 'colsample_bytree': 0.564097132616723, 'max_depth': 6, 'min_child_weight': 3, 'eta': 0.017330397154319124, 'gamma': 4.997243525580321, 'rate_drop': 1.3840891648011245e-05, 'skip_drop': 3.920049747597907e-08}. Best is trial 189 with value: -1.66206808945109.
[I 2025-06-20 12:15:06,243] Trial 202 finished with value: -1.6710439898790805 and parameters: {'booster': 'dart', 'lambda': 1.595900929821599e-07, 'alpha': 2.0558259332926576e-08, 'subsample': 0.5220203335676392, 'colsample_bytree': 0.5632459054938684, 'max_depth': 6, 'min_child_weight': 3, 'eta': 0.017515102187066926, 'gamma': 4.992837975612358, 'rate_drop': 1.0788030547955474e-05, 'skip_drop': 3.221712972013229e-08}. Best is trial 189 with value: -1.66206808945109.
[I 2025-06-20 12:15:12,983] Trial 203 finished with value: -1.6799001104114506 and parameters: {'booster': 'dart', 'lambda': 3.8023220158909665e-07, 'alpha': 1.896849494257714e-08, 'subsample': 0.5214064583487834, 'colsample_bytree': 0.5610982302081001, 'max_depth': 6, 'min_child_weight': 3, 'eta': 0.01756238486272717, 'gamma': 4.994015280992364, 'rate_drop': 9.613332152412616e-06, 'skip_drop': 2.9278224742373557e-08}. Best is trial 189 with value: -1.66206808945109.
[I 2025-06-20 12:15:20,072] Trial 204 finished with value: -1.6718927230984013 and parameters: {'booster': 'dart', 'lambda': 3.318273506195454e-07, 'alpha': 1.9669086434912207e-08, 'subsample': 0.5208758307998755, 'colsample_bytree': 0.5610342766450755, 'max_depth': 6, 'min_child_weight': 3, 'eta': 0.017601748100308904, 'gamma': 4.994445619817634, 'rate_drop': 1.4247455305650334e-05, 'skip_drop': 2.8649783640344493e-08}. Best is trial 189 with value: -1.66206808945109.
[I 2025-06-20 12:15:25,561] Trial 205 finished with value: -1.6793198057742567 and parameters: {'booster': 'dart', 'lambda': 3.824214940140043e-07, 'alpha': 4.0901608062514365e-08, 'subsample': 0.5201879670809295, 'colsample_bytree': 0.552220802357448, 'max_depth': 6, 'min_child_weight': 3, 'eta': 0.022913695530424542, 'gamma': 4.997547014504589, 'rate_drop': 6.6608766293775665e-06, 'skip_drop': 3.08744068264051e-08}. Best is trial 189 with value: -1.66206808945109.
[I 2025-06-20 12:15:31,348] Trial 206 finished with value: -1.6777867574735439 and parameters: {'booster': 'dart', 'lambda': 1.1594476798317365e-06, 'alpha': 4.42659106906563e-08, 'subsample': 0.5198505079933867, 'colsample_bytree': 0.5493176736181671, 'max_depth': 6, 'min_child_weight': 3, 'eta': 0.0229555974297745, 'gamma': 4.993823527221887, 'rate_drop': 7.3619618276747936e-06, 'skip_drop': 2.77238510309113e-08}. Best is trial 189 with value: -1.66206808945109.
[I 2025-06-20 12:15:35,051] Trial 207 finished with value: -1.6728210134357568 and parameters: {'booster': 'dart', 'lambda': 1.0678648398177392e-06, 'alpha': 4.280566404769919e-08, 'subsample': 0.5180698512648506, 'colsample_bytree': 0.5559545757128208, 'max_depth': 6, 'min_child_weight': 3, 'eta': 0.023442951336806944, 'gamma': 4.994666593143568, 'rate_drop': 7.022873417765625e-06, 'skip_drop': 2.419444079135046e-08}. Best is trial 189 with value: -1.66206808945109.
[I 2025-06-20 12:15:40,501] Trial 208 finished with value: -1.6670473692078978 and parameters: {'booster': 'dart', 'lambda': 1.056390359641889e-06, 'alpha': 4.812726221209937e-08, 'subsample': 0.5185012740501609, 'colsample_bytree': 0.5466434690080505, 'max_depth': 6, 'min_child_weight': 3, 'eta': 0.02311507969761685, 'gamma': 4.976114883442996, 'rate_drop': 7.034794645760322e-06, 'skip_drop': 2.719422711590555e-08}. Best is trial 189 with value: -1.66206808945109.
[I 2025-06-20 12:15:45,947] Trial 209 finished with value: -1.690608923538112 and parameters: {'booster': 'dart', 'lambda': 9.112523600978331e-07, 'alpha': 3.7942711039839707e-08, 'subsample': 0.5007082529785328, 'colsample_bytree': 0.5501656926654429, 'max_depth': 6, 'min_child_weight': 3, 'eta': 0.024663029740889002, 'gamma': 4.999362364809639, 'rate_drop': 7.537939695956764e-06, 'skip_drop': 3.110565911052618e-08}. Best is trial 189 with value: -1.66206808945109.
[I 2025-06-20 12:15:49,899] Trial 210 finished with value: -1.6850457283955314 and parameters: {'booster': 'dart', 'lambda': 1.4259868786301987e-06, 'alpha': 4.544825703356107e-08, 'subsample': 0.5183639117251215, 'colsample_bytree': 0.5453377864562804, 'max_depth': 6, 'min_child_weight': 2, 'eta': 0.02275721366732555, 'gamma': 4.995649277436735, 'rate_drop': 2.292397488078841e-06, 'skip_drop': 2.457226255672254e-08}. Best is trial 189 with value: -1.66206808945109.
[I 2025-06-20 12:15:55,398] Trial 211 finished with value: -1.6735106129054895 and parameters: {'booster': 'dart', 'lambda': 4.165695006133579e-07, 'alpha': 2.0755958492064614e-08, 'subsample': 0.518275750248671, 'colsample_bytree': 0.555296878239149, 'max_depth': 6, 'min_child_weight': 3, 'eta': 0.02106834261611623, 'gamma': 4.985625318805249, 'rate_drop': 5.44816714570399e-06, 'skip_drop': 2.0391483204325876e-08}. Best is trial 189 with value: -1.66206808945109.
[I 2025-06-20 12:16:02,398] Trial 212 finished with value: -1.6689130841600075 and parameters: {'booster': 'dart', 'lambda': 4.116253480628345e-07, 'alpha': 2.0860071605895908e-08, 'subsample': 0.5182535369339591, 'colsample_bytree': 0.5561291199934272, 'max_depth': 6, 'min_child_weight': 3, 'eta': 0.0218891368642436, 'gamma': 4.83835469112303, 'rate_drop': 9.532341669001645e-06, 'skip_drop': 1.6805459437041176e-08}. Best is trial 189 with value: -1.66206808945109.
[I 2025-06-20 12:16:09,356] Trial 213 finished with value: -1.6972005360685887 and parameters: {'booster': 'dart', 'lambda': 5.353074840157258e-07, 'alpha': 2.1142398778536122e-08, 'subsample': 0.5019960487850083, 'colsample_bytree': 0.5572317404486336, 'max_depth': 6, 'min_child_weight': 3, 'eta': 0.02116426601284688, 'gamma': 4.995515322833824, 'rate_drop': 5.556492881973903e-06, 'skip_drop': 1.8146485990693452e-08}. Best is trial 189 with value: -1.66206808945109.
[I 2025-06-20 12:16:13,445] Trial 214 finished with value: -1.6741699809423907 and parameters: {'booster': 'dart', 'lambda': 1.1434328910981223e-06, 'alpha': 4.816681831424513e-08, 'subsample': 0.5172157329474293, 'colsample_bytree': 0.5584760227466761, 'max_depth': 6, 'min_child_weight': 3, 'eta': 0.024095219412234185, 'gamma': 4.822866712439343, 'rate_drop': 1.211551987988053e-05, 'skip_drop': 1.0925093747684473e-08}. Best is trial 189 with value: -1.66206808945109.
[I 2025-06-20 12:16:20,515] Trial 215 finished with value: -1.6759792293037106 and parameters: {'booster': 'dart', 'lambda': 1.079375179474449e-06, 'alpha': 4.816974285599544e-08, 'subsample': 0.5134749443935372, 'colsample_bytree': 0.5460062622754968, 'max_depth': 6, 'min_child_weight': 3, 'eta': 0.02284976181894292, 'gamma': 4.80533473904013, 'rate_drop': 9.989618502105326e-06, 'skip_drop': 1.2360669168687498e-08}. Best is trial 189 with value: -1.66206808945109.
[I 2025-06-20 12:16:24,608] Trial 216 finished with value: -1.6741627409626139 and parameters: {'booster': 'dart', 'lambda': 1.167360923240997e-06, 'alpha': 4.672878313416254e-08, 'subsample': 0.5114950930411041, 'colsample_bytree': 0.5424997429004333, 'max_depth': 6, 'min_child_weight': 3, 'eta': 0.02556893974503141, 'gamma': 4.816201723389709, 'rate_drop': 3.399912266940813e-06, 'skip_drop': 1.3406822635008482e-08}. Best is trial 189 with value: -1.66206808945109.
[I 2025-06-20 12:16:28,864] Trial 217 finished with value: -1.6909728056751814 and parameters: {'booster': 'dart', 'lambda': 1.2670500898545559e-06, 'alpha': 4.387353557682804e-08, 'subsample': 0.5064636763459357, 'colsample_bytree': 0.5430489286211688, 'max_depth': 6, 'min_child_weight': 3, 'eta': 0.025341674999564412, 'gamma': 4.805254180885818, 'rate_drop': 3.093664066742445e-06, 'skip_drop': 1.1986976540446277e-08}. Best is trial 189 with value: -1.66206808945109.
[I 2025-06-20 12:16:36,209] Trial 218 finished with value: -1.6763676719371317 and parameters: {'booster': 'dart', 'lambda': 7.95956748785972e-07, 'alpha': 4.946954799569837e-08, 'subsample': 0.513218805012829, 'colsample_bytree': 0.5502519633472877, 'max_depth': 6, 'min_child_weight': 3, 'eta': 0.023727553403011734, 'gamma': 4.810439275526115, 'rate_drop': 4.67031758922781e-06, 'skip_drop': 1.5437126613565122e-08}. Best is trial 189 with value: -1.66206808945109.
[I 2025-06-20 12:16:42,959] Trial 219 finished with value: -1.6872905876701023 and parameters: {'booster': 'dart', 'lambda': 1.0765383235679567e-06, 'alpha': 4.9345732749998214e-08, 'subsample': 0.5116207155392941, 'colsample_bytree': 0.5408764498413834, 'max_depth': 6, 'min_child_weight': 3, 'eta': 0.021254498092395775, 'gamma': 4.812449914116721, 'rate_drop': 4.198180120025348e-06, 'skip_drop': 1.0423431355617656e-08}. Best is trial 189 with value: -1.66206808945109.
[I 2025-06-20 12:16:47,136] Trial 220 finished with value: -1.675868001477436 and parameters: {'booster': 'dart', 'lambda': 6.908233946081567e-07, 'alpha': 6.198669878775216e-08, 'subsample': 0.5008018994461438, 'colsample_bytree': 0.5506470499374431, 'max_depth': 6, 'min_child_weight': 3, 'eta': 0.026726296246591907, 'gamma': 4.813379001097471, 'rate_drop': 9.454829021943959e-07, 'skip_drop': 1.731074370154407e-08}. Best is trial 189 with value: -1.66206808945109.
[I 2025-06-20 12:16:51,136] Trial 221 finished with value: -1.6885779492470836 and parameters: {'booster': 'dart', 'lambda': 1.861629695086072e-06, 'alpha': 5.8516077759890854e-08, 'subsample': 0.5011928647906982, 'colsample_bytree': 0.5438952106672331, 'max_depth': 6, 'min_child_weight': 3, 'eta': 0.02739429160917154, 'gamma': 4.826788756757996, 'rate_drop': 6.522959541756195e-07, 'skip_drop': 1.697945740078319e-08}. Best is trial 189 with value: -1.66206808945109.
[I 2025-06-20 12:16:55,296] Trial 222 finished with value: -1.6759468510198516 and parameters: {'booster': 'dart', 'lambda': 7.770719783696146e-07, 'alpha': 3.536757564663281e-08, 'subsample': 0.5101584811961097, 'colsample_bytree': 0.5535048399215357, 'max_depth': 6, 'min_child_weight': 3, 'eta': 0.02484152238011991, 'gamma': 4.823560251959163, 'rate_drop': 1.1857792212030938e-06, 'skip_drop': 4.230734409959076e-08}. Best is trial 189 with value: -1.66206808945109.
[I 2025-06-20 12:16:59,268] Trial 223 finished with value: -1.669619977834444 and parameters: {'booster': 'dart', 'lambda': 7.587958185993887e-07, 'alpha': 3.525494054224358e-08, 'subsample': 0.5103538957342098, 'colsample_bytree': 0.5528414815388021, 'max_depth': 6, 'min_child_weight': 3, 'eta': 0.026187636303874374, 'gamma': 4.870307105109409, 'rate_drop': 7.844993542426957e-07, 'skip_drop': 3.8314012918694084e-08}. Best is trial 189 with value: -1.66206808945109.
[I 2025-06-20 12:17:02,842] Trial 224 finished with value: -1.6803672344471894 and parameters: {'booster': 'dart', 'lambda': 6.738529633196209e-07, 'alpha': 3.8630940876819176e-08, 'subsample': 0.5108182989544311, 'colsample_bytree': 0.5548786027285588, 'max_depth': 6, 'min_child_weight': 3, 'eta': 0.026274509506254085, 'gamma': 4.865653710325565, 'rate_drop': 8.02220352332048e-07, 'skip_drop': 4.1717792101699835e-08}. Best is trial 189 with value: -1.66206808945109.
[I 2025-06-20 12:17:08,270] Trial 225 finished with value: -1.6845931669171466 and parameters: {'booster': 'dart', 'lambda': 7.356532288245678e-07, 'alpha': 1.0381687979213512e-07, 'subsample': 0.5122662546241203, 'colsample_bytree': 0.5475184717331838, 'max_depth': 6, 'min_child_weight': 3, 'eta': 0.023967553911255022, 'gamma': 4.782456463105178, 'rate_drop': 1.2534231736953406e-06, 'skip_drop': 2.0652606579418105e-08}. Best is trial 189 with value: -1.66206808945109.
[I 2025-06-20 12:17:12,383] Trial 226 finished with value: -1.6983602255058374 and parameters: {'booster': 'dart', 'lambda': 1.3758771328179108e-06, 'alpha': 7.560573138952296e-08, 'subsample': 0.5018540955717246, 'colsample_bytree': 0.5535060388097579, 'max_depth': 6, 'min_child_weight': 3, 'eta': 0.029773428833845737, 'gamma': 4.89362373242329, 'rate_drop': 1.960570727734714e-06, 'skip_drop': 1.6284105800007917e-08}. Best is trial 189 with value: -1.66206808945109.
[I 2025-06-20 12:17:16,472] Trial 227 finished with value: -1.680110520382926 and parameters: {'booster': 'dart', 'lambda': 3.730057980721761e-06, 'alpha': 5.559985839650823e-08, 'subsample': 0.5152441790169837, 'colsample_bytree': 0.5370112123375707, 'max_depth': 6, 'min_child_weight': 3, 'eta': 0.02359027873549198, 'gamma': 4.76070352352411, 'rate_drop': 2.565677574357941e-07, 'skip_drop': 3.7559664388709414e-08}. Best is trial 189 with value: -1.66206808945109.
[I 2025-06-20 12:17:20,534] Trial 228 finished with value: -1.6708029220944254 and parameters: {'booster': 'dart', 'lambda': 7.084493912204665e-07, 'alpha': 3.2502656539686115e-08, 'subsample': 0.5002414532334362, 'colsample_bytree': 0.5687736714698597, 'max_depth': 6, 'min_child_weight': 3, 'eta': 0.02687950448598961, 'gamma': 4.895275715091227, 'rate_drop': 9.939125205871196e-07, 'skip_drop': 2.4286189986696683e-08}. Best is trial 189 with value: -1.66206808945109.
[I 2025-06-20 12:17:23,182] Trial 229 finished with value: -1.7427581803387016 and parameters: {'booster': 'dart', 'lambda': 5.511477039708411e-07, 'alpha': 3.2024415356960224e-08, 'subsample': 0.5022855793695251, 'colsample_bytree': 0.9710706215475297, 'max_depth': 6, 'min_child_weight': 3, 'eta': 0.027602252405254855, 'gamma': 4.874739662063981, 'rate_drop': 4.0240219149872173e-07, 'skip_drop': 1.0088262436063523e-08}. Best is trial 189 with value: -1.66206808945109.
[I 2025-06-20 12:17:25,866] Trial 230 finished with value: -1.6823540062507196 and parameters: {'booster': 'dart', 'lambda': 6.391833989270985e-07, 'alpha': 2.668700616853915e-08, 'subsample': 0.5128208317535722, 'colsample_bytree': 0.5669230332900408, 'max_depth': 6, 'min_child_weight': 3, 'eta': 0.03257411767789618, 'gamma': 4.78659821910069, 'rate_drop': 4.6044061307203286e-07, 'skip_drop': 1.524215723050149e-08}. Best is trial 189 with value: -1.66206808945109.
[I 2025-06-20 12:17:32,495] Trial 231 finished with value: -1.6726400618317963 and parameters: {'booster': 'dart', 'lambda': 1.167879716788638e-06, 'alpha': 3.570185807324869e-08, 'subsample': 0.5158799470752804, 'colsample_bytree': 0.554851554718216, 'max_depth': 6, 'min_child_weight': 3, 'eta': 0.02056888078119429, 'gamma': 4.912212203944988, 'rate_drop': 9.860010101238434e-07, 'skip_drop': 2.4626614377255854e-08}. Best is trial 189 with value: -1.66206808945109.
[I 2025-06-20 12:17:37,978] Trial 232 finished with value: -1.689650484742156 and parameters: {'booster': 'dart', 'lambda': 8.120997283276615e-07, 'alpha': 2.176324591393534e-08, 'subsample': 0.5090962019404155, 'colsample_bytree': 0.5558707198691064, 'max_depth': 6, 'min_child_weight': 3, 'eta': 0.020708513402044777, 'gamma': 4.890750725376796, 'rate_drop': 1.2870548643714249e-06, 'skip_drop': 2.187674429491008e-08}. Best is trial 189 with value: -1.66206808945109.
[I 2025-06-20 12:17:42,133] Trial 233 finished with value: -1.681811717352573 and parameters: {'booster': 'dart', 'lambda': 2.1258051663801763e-06, 'alpha': 3.4235416593732994e-08, 'subsample': 0.500695013956846, 'colsample_bytree': 0.5667540517226513, 'max_depth': 6, 'min_child_weight': 3, 'eta': 0.026708051206568682, 'gamma': 4.756725609132666, 'rate_drop': 1.2927764356392444e-06, 'skip_drop': 5.8390053507225566e-08}. Best is trial 189 with value: -1.66206808945109.
[I 2025-06-20 12:17:49,010] Trial 234 finished with value: -1.6743671026927225 and parameters: {'booster': 'dart', 'lambda': 4.215147419003651e-07, 'alpha': 1.452139156613229e-08, 'subsample': 0.5156807174701593, 'colsample_bytree': 0.5383924675608358, 'max_depth': 6, 'min_child_weight': 3, 'eta': 0.020467667888167288, 'gamma': 4.883708784773901, 'rate_drop': 1.0512568931064807e-06, 'skip_drop': 4.189823972908991e-08}. Best is trial 189 with value: -1.66206808945109.
[I 2025-06-20 12:17:52,832] Trial 235 finished with value: -1.677807718857616 and parameters: {'booster': 'dart', 'lambda': 4.7368760883388796e-07, 'alpha': 6.088824880731938e-08, 'subsample': 0.5153843721305349, 'colsample_bytree': 0.5400398973230506, 'max_depth': 6, 'min_child_weight': 3, 'eta': 0.02374193042587796, 'gamma': 4.8356299365614985, 'rate_drop': 9.408657635069291e-07, 'skip_drop': 4.080917792390202e-08}. Best is trial 189 with value: -1.66206808945109.
[I 2025-06-20 12:17:59,736] Trial 236 finished with value: -1.6744306274488725 and parameters: {'booster': 'dart', 'lambda': 9.607830738223863e-07, 'alpha': 2.137734549235095e-08, 'subsample': 0.5118715373089073, 'colsample_bytree': 0.5443023223783809, 'max_depth': 6, 'min_child_weight': 3, 'eta': 0.021405409720612313, 'gamma': 4.90563635662105, 'rate_drop': 8.072474087987474e-07, 'skip_drop': 2.398442345434689e-08}. Best is trial 189 with value: -1.66206808945109.
