[I 2025-06-20 12:07:16,247] Trial 145 finished with value: -1.684074755691359 and parameters: {'booster': 'dart', 'lambda': 1.025984550949538e-07, 'alpha': 2.679304712491094e-07, 'subsample': 0.5118764223117813, 'colsample_bytree': 0.5810472157531359, 'max_depth': 6, 'min_child_weight': 4, 'eta': 0.01579519577263445, 'gamma': 4.9971800644639774, 'rate_drop': 4.582315556007547e-05, 'skip_drop': 7.692402505174825e-06}. Best is trial 131 with value: -1.6785222754235516.
[I 2025-06-20 12:07:23,782] Trial 146 finished with value: -1.7046944637518975 and parameters: {'booster': 'dart', 'lambda': 9.441659320085639e-08, 'alpha': 1.9614957390864256e-07, 'subsample': 0.5095003222734379, 'colsample_bytree': 0.578206328720819, 'max_depth': 6, 'min_child_weight': 4, 'eta': 0.012033720439937492, 'gamma': 4.850125020892552, 'rate_drop': 4.687514698181822e-05, 'skip_drop': 6.6149479365834365e-06}. Best is trial 131 with value: -1.6785222754235516.
[I 2025-06-20 12:07:31,202] Trial 147 finished with value: -1.699655204422814 and parameters: {'booster': 'dart', 'lambda': 2.211203761655565e-07, 'alpha': 2.840775132652649e-07, 'subsample': 0.5010176949049552, 'colsample_bytree': 0.5496254709392033, 'max_depth': 6, 'min_child_weight': 4, 'eta': 0.015628786171076103, 'gamma': 4.603440344105144, 'rate_drop': 8.858502977904839e-06, 'skip_drop': 1.2086850653516833e-05}. Best is trial 131 with value: -1.6785222754235516.
[I 2025-06-20 12:07:38,414] Trial 148 finished with value: -1.6849604873916255 and parameters: {'booster': 'dart', 'lambda': 4.48244788921767e-08, 'alpha': 7.102587189218053e-08, 'subsample': 0.516228426152955, 'colsample_bytree': 0.5400139138216298, 'max_depth': 7, 'min_child_weight': 4, 'eta': 0.014268711526397462, 'gamma': 4.688025749038764, 'rate_drop': 9.23548544618335e-05, 'skip_drop': 5.288135265391263e-08}. Best is trial 131 with value: -1.6785222754235516.
[I 2025-06-20 12:07:43,926] Trial 149 finished with value: -1.6941782895751463 and parameters: {'booster': 'dart', 'lambda': 3.416015610868178e-08, 'alpha': 5.2832125309792516e-08, 'subsample': 0.5197794057414663, 'colsample_bytree': 0.5253711092040689, 'max_depth': 7, 'min_child_weight': 4, 'eta': 0.0166852118295219, 'gamma': 4.75389523251222, 'rate_drop': 9.698721215346912e-05, 'skip_drop': 5.2284303767663426e-08}. Best is trial 131 with value: -1.6785222754235516.
[I 2025-06-20 12:07:53,513] Trial 150 finished with value: -1.6937665088105176 and parameters: {'booster': 'dart', 'lambda': 4.6395880376295084e-08, 'alpha': 6.921439066176784e-08, 'subsample': 0.5134601318842059, 'colsample_bytree': 0.5321316752266422, 'max_depth': 7, 'min_child_weight': 4, 'eta': 0.011420456224809642, 'gamma': 4.7592308851151905, 'rate_drop': 8.866540846310853e-05, 'skip_drop': 6.741631486544092e-08}. Best is trial 131 with value: -1.6785222754235516.
[I 2025-06-20 12:08:02,237] Trial 151 finished with value: -1.7069771275214702 and parameters: {'booster': 'dart', 'lambda': 2.995402176658104e-08, 'alpha': 2.7961996611223615e-08, 'subsample': 0.5191317980757792, 'colsample_bytree': 0.5335115528335511, 'max_depth': 7, 'min_child_weight': 4, 'eta': 0.010809467670669643, 'gamma': 4.76050108460278, 'rate_drop': 9.101007470567703e-05, 'skip_drop': 4.4625022549035247e-08}. Best is trial 131 with value: -1.6785222754235516.
[I 2025-06-20 12:08:09,427] Trial 152 finished with value: -1.6942208233731322 and parameters: {'booster': 'dart', 'lambda': 2.651084017506607e-08, 'alpha': 9.673191666024598e-08, 'subsample': 0.5186012448869088, 'colsample_bytree': 0.5203668630878755, 'max_depth': 7, 'min_child_weight': 4, 'eta': 0.013907377964744113, 'gamma': 4.558774870739367, 'rate_drop': 7.023156151063371e-05, 'skip_drop': 1.1827959823621182e-08}. Best is trial 131 with value: -1.6785222754235516.
[I 2025-06-20 12:08:19,086] Trial 153 finished with value: -1.7146984670410261 and parameters: {'booster': 'dart', 'lambda': 4.2152469991959987e-08, 'alpha': 4.294821441835245e-08, 'subsample': 0.5320861644203356, 'colsample_bytree': 0.5076705137252167, 'max_depth': 7, 'min_child_weight': 4, 'eta': 0.00853363258263863, 'gamma': 4.9996232059001136, 'rate_drop': 0.0001538611939104798, 'skip_drop': 6.419919894625671e-08}. Best is trial 131 with value: -1.6785222754235516.
[I 2025-06-20 12:08:26,287] Trial 154 finished with value: -1.7021103421980692 and parameters: {'booster': 'dart', 'lambda': 5.5102905513833856e-08, 'alpha': 5.340115500609112e-08, 'subsample': 0.5002891316285729, 'colsample_bytree': 0.5275993767794003, 'max_depth': 7, 'min_child_weight': 4, 'eta': 0.016972783939591896, 'gamma': 4.703813798569302, 'rate_drop': 0.00010954808228410575, 'skip_drop': 1.5917503268916544e-08}. Best is trial 131 with value: -1.6785222754235516.
[I 2025-06-20 12:08:34,711] Trial 155 finished with value: -1.703847808969436 and parameters: {'booster': 'dart', 'lambda': 1.0536950503666059e-08, 'alpha': 6.456947911782848e-08, 'subsample': 0.5147499513718967, 'colsample_bytree': 0.5355383191900298, 'max_depth': 7, 'min_child_weight': 5, 'eta': 0.011831070075833948, 'gamma': 4.400165621682507, 'rate_drop': 5.143906363108021e-05, 'skip_drop': 5.615348697632681e-08}. Best is trial 131 with value: -1.6785222754235516.
[I 2025-06-20 12:08:41,840] Trial 156 finished with value: -1.6796931142386051 and parameters: {'booster': 'dart', 'lambda': 1.1674514951213976e-07, 'alpha': 2.5316643696114238e-08, 'subsample': 0.527018625603429, 'colsample_bytree': 0.5623537639156686, 'max_depth': 7, 'min_child_weight': 3, 'eta': 0.01826427089643062, 'gamma': 4.628106758403055, 'rate_drop': 0.00022174538393663642, 'skip_drop': 1.0751234024711066e-07}. Best is trial 131 with value: -1.6785222754235516.
[I 2025-06-20 12:08:49,110] Trial 157 finished with value: -1.6952629386046876 and parameters: {'booster': 'dart', 'lambda': 5.116196021244875e-07, 'alpha': 1.0339264471385408e-08, 'subsample': 0.5407212609049374, 'colsample_bytree': 0.568571659659582, 'max_depth': 8, 'min_child_weight': 3, 'eta': 0.018651040569367287, 'gamma': 4.648196211261844, 'rate_drop': 0.00039963106916024937, 'skip_drop': 1.4211461454993826e-07}. Best is trial 131 with value: -1.6785222754235516.
[I 2025-06-20 12:08:57,586] Trial 158 finished with value: -1.699482726341823 and parameters: {'booster': 'dart', 'lambda': 1.3900947874539615e-07, 'alpha': 1.817358318010739e-08, 'subsample': 0.5304653618542956, 'colsample_bytree': 0.5585703496952215, 'max_depth': 7, 'min_child_weight': 3, 'eta': 0.013172625887786232, 'gamma': 4.463091793552886, 'rate_drop': 7.393404952651988e-05, 'skip_drop': 2.0020772763603393e-08}. Best is trial 131 with value: -1.6785222754235516.
[I 2025-06-20 12:09:04,585] Trial 159 finished with value: -1.6945196164511955 and parameters: {'booster': 'dart', 'lambda': 1.444804449222116e-07, 'alpha': 3.893367660968668e-08, 'subsample': 0.5260728976169972, 'colsample_bytree': 0.5435070352696119, 'max_depth': 7, 'min_child_weight': 3, 'eta': 0.0192209285191269, 'gamma': 4.910176584842589, 'rate_drop': 0.0002174724758742893, 'skip_drop': 8.459029076990505e-08}. Best is trial 131 with value: -1.6785222754235516.
[I 2025-06-20 12:09:11,581] Trial 160 finished with value: -1.6861457358202407 and parameters: {'booster': 'dart', 'lambda': 1.8980799015791677e-08, 'alpha': 1.2138765033684325e-07, 'subsample': 0.512303348099715, 'colsample_bytree': 0.5683538057269142, 'max_depth': 6, 'min_child_weight': 3, 'eta': 0.015229973440092687, 'gamma': 4.8072284643261876, 'rate_drop': 1.859073290056136e-05, 'skip_drop': 2.5560587301240237e-07}. Best is trial 131 with value: -1.6785222754235516.
[I 2025-06-20 12:09:18,247] Trial 161 finished with value: -1.6881992352711332 and parameters: {'booster': 'dart', 'lambda': 7.714680589269497e-08, 'alpha': 2.456720818725699e-08, 'subsample': 0.5110500322261152, 'colsample_bytree': 0.581107918362769, 'max_depth': 6, 'min_child_weight': 3, 'eta': 0.014916229701817885, 'gamma': 4.822423274305855, 'rate_drop': 2.0257490133043265e-05, 'skip_drop': 2.2283060243215275e-07}. Best is trial 131 with value: -1.6785222754235516.
[I 2025-06-20 12:09:26,696] Trial 162 finished with value: -1.6990443857156812 and parameters: {'booster': 'dart', 'lambda': 2.05536270856653e-08, 'alpha': 1.165821827472905e-07, 'subsample': 0.5131963389318754, 'colsample_bytree': 0.5735184079555854, 'max_depth': 6, 'min_child_weight': 3, 'eta': 0.014395267049843181, 'gamma': 4.814033314856481, 'rate_drop': 1.4771620142004671e-05, 'skip_drop': 2.7904044975839585e-07}. Best is trial 131 with value: -1.6785222754235516.
[I 2025-06-20 12:09:33,727] Trial 163 finished with value: -1.699050961332707 and parameters: {'booster': 'dart', 'lambda': 5.211377650300396e-08, 'alpha': 2.1114207350585547e-08, 'subsample': 0.5088123708261911, 'colsample_bytree': 0.5612216031236332, 'max_depth': 6, 'min_child_weight': 3, 'eta': 0.016086173068672823, 'gamma': 4.572090909610727, 'rate_drop': 2.0974889917394122e-05, 'skip_drop': 1.1829609160447851e-07}. Best is trial 131 with value: -1.6785222754235516.
[I 2025-06-20 12:09:43,209] Trial 164 finished with value: -1.6890871534448337 and parameters: {'booster': 'dart', 'lambda': 8.129215838636205e-08, 'alpha': 8.26852401679903e-08, 'subsample': 0.5352545611699894, 'colsample_bytree': 0.5792655115606954, 'max_depth': 6, 'min_child_weight': 3, 'eta': 0.012154651685038976, 'gamma': 4.77240065661943, 'rate_drop': 3.826378126661009e-05, 'skip_drop': 5.17121708288384e-07}. Best is trial 131 with value: -1.6785222754235516.
[I 2025-06-20 12:09:51,449] Trial 165 finished with value: -1.6816804523192923 and parameters: {'booster': 'dart', 'lambda': 7.076870898481923e-08, 'alpha': 1.5249777991776514e-08, 'subsample': 0.5309380938618586, 'colsample_bytree': 0.583921596595194, 'max_depth': 6, 'min_child_weight': 3, 'eta': 0.014273199986273485, 'gamma': 4.918963054812053, 'rate_drop': 2.629689558870593e-05, 'skip_drop': 2.450391888838989e-07}. Best is trial 131 with value: -1.6785222754235516.
[I 2025-06-20 12:10:00,882] Trial 166 finished with value: -1.6883112719333968 and parameters: {'booster': 'dart', 'lambda': 1.0251908063644086e-07, 'alpha': 1.4917988626867572e-08, 'subsample': 0.5358649414326813, 'colsample_bytree': 0.585423634050633, 'max_depth': 6, 'min_child_weight': 3, 'eta': 0.012503633926412277, 'gamma': 4.92105753344588, 'rate_drop': 3.154880752269928e-05, 'skip_drop': 1.7175529173746758e-07}. Best is trial 131 with value: -1.6785222754235516.
[I 2025-06-20 12:10:10,396] Trial 167 finished with value: -1.696281330172054 and parameters: {'booster': 'dart', 'lambda': 8.753839285556472e-08, 'alpha': 1.6864259133767623e-08, 'subsample': 0.5323274909185498, 'colsample_bytree': 0.5868988442502516, 'max_depth': 6, 'min_child_weight': 3, 'eta': 0.00987486370693895, 'gamma': 4.969067978643357, 'rate_drop': 3.7236897017884654e-05, 'skip_drop': 1.79454978210504e-07}. Best is trial 131 with value: -1.6785222754235516.
[I 2025-06-20 12:10:19,754] Trial 168 finished with value: -1.6835059009518945 and parameters: {'booster': 'dart', 'lambda': 7.744101020945678e-08, 'alpha': 2.8971820082918773e-08, 'subsample': 0.5435280793000072, 'colsample_bytree': 0.5824682876434932, 'max_depth': 6, 'min_child_weight': 3, 'eta': 0.012757280485444434, 'gamma': 4.872687502686194, 'rate_drop': 1.0184603988394324e-05, 'skip_drop': 4.6132193354911275e-07}. Best is trial 131 with value: -1.6785222754235516.
[I 2025-06-20 12:10:28,010] Trial 169 finished with value: -1.6962260580568411 and parameters: {'booster': 'dart', 'lambda': 9.114294082649766e-08, 'alpha': 2.8134489046965875e-08, 'subsample': 0.5462698357747718, 'colsample_bytree': 0.5841228695825553, 'max_depth': 6, 'min_child_weight': 3, 'eta': 0.012594099391869272, 'gamma': 4.88979288462062, 'rate_drop': 1.1307430622834324e-05, 'skip_drop': 4.80456368948042e-07}. Best is trial 131 with value: -1.6785222754235516.
[I 2025-06-20 12:10:37,520] Trial 170 finished with value: -1.7134954318353426 and parameters: {'booster': 'dart', 'lambda': 6.413443963132496e-07, 'alpha': 1.1234432812078029e-08, 'subsample': 0.5233311067411401, 'colsample_bytree': 0.5973601449477213, 'max_depth': 6, 'min_child_weight': 3, 'eta': 0.007577467547795887, 'gamma': 4.994455101658202, 'rate_drop': 2.0738253632157618e-05, 'skip_drop': 1.7928734377731569e-07}. Best is trial 131 with value: -1.6785222754235516.
[I 2025-06-20 12:10:44,477] Trial 171 finished with value: -1.6840062047284645 and parameters: {'booster': 'dart', 'lambda': 1.4296976041143494e-07, 'alpha': 2.855798318285675e-08, 'subsample': 0.5340158268843205, 'colsample_bytree': 0.5768504661335089, 'max_depth': 6, 'min_child_weight': 3, 'eta': 0.014763972356089465, 'gamma': 4.666045677071542, 'rate_drop': 2.973545968769109e-05, 'skip_drop': 2.8209096884009244e-07}. Best is trial 131 with value: -1.6785222754235516.
[I 2025-06-20 12:10:52,837] Trial 172 finished with value: -1.6860063552904705 and parameters: {'booster': 'dart', 'lambda': 1.6806404630640323e-08, 'alpha': 2.499410112753644e-08, 'subsample': 0.5347920844821583, 'colsample_bytree': 0.574010886402549, 'max_depth': 6, 'min_child_weight': 3, 'eta': 0.0142425584066515, 'gamma': 4.6681156733609095, 'rate_drop': 2.744069696907974e-05, 'skip_drop': 3.414089698914908e-07}. Best is trial 131 with value: -1.6785222754235516.
[I 2025-06-20 12:11:02,350] Trial 173 finished with value: -1.6891758392149698 and parameters: {'booster': 'dart', 'lambda': 1.7671893593758456e-08, 'alpha': 3.0387762444486155e-08, 'subsample': 0.53675829064826, 'colsample_bytree': 0.5744710815532187, 'max_depth': 6, 'min_child_weight': 3, 'eta': 0.01378964080263833, 'gamma': 4.718531752676901, 'rate_drop': 4.203328135646422e-06, 'skip_drop': 2.854490000342709e-07}. Best is trial 131 with value: -1.6785222754235516.
[I 2025-06-20 12:11:12,324] Trial 174 finished with value: -1.6874385860901917 and parameters: {'booster': 'dart', 'lambda': 1.3056831653604053e-08, 'alpha': 1.4326485559210263e-08, 'subsample': 0.5371296954106931, 'colsample_bytree': 0.5770238621571786, 'max_depth': 6, 'min_child_weight': 3, 'eta': 0.010641125179852344, 'gamma': 4.694920583745217, 'rate_drop': 4.908612079440089e-06, 'skip_drop': 3.9782404064683463e-07}. Best is trial 131 with value: -1.6785222754235516.
[I 2025-06-20 12:11:21,764] Trial 175 finished with value: -1.6944412769647952 and parameters: {'booster': 'dart', 'lambda': 1.676851381849257e-08, 'alpha': 2.6010077203003315e-08, 'subsample': 0.5350234214101296, 'colsample_bytree': 0.5810582745241177, 'max_depth': 6, 'min_child_weight': 3, 'eta': 0.010631947856288187, 'gamma': 4.673244162372617, 'rate_drop': 3.829425539930772e-06, 'skip_drop': 3.9553326509388506e-07}. Best is trial 131 with value: -1.6785222754235516.
[I 2025-06-20 12:11:31,151] Trial 176 finished with value: -1.694654764110598 and parameters: {'booster': 'dart', 'lambda': 1.3149890830101764e-08, 'alpha': 1.506111628785278e-08, 'subsample': 0.5385015860457149, 'colsample_bytree': 0.5713922802109557, 'max_depth': 6, 'min_child_weight': 3, 'eta': 0.00921033344868317, 'gamma': 4.527605253239774, 'rate_drop': 6.272186033497027e-06, 'skip_drop': 3.2699522082103113e-07}. Best is trial 131 with value: -1.6785222754235516.
[I 2025-06-20 12:11:39,911] Trial 177 finished with value: -1.693004820929725 and parameters: {'booster': 'dart', 'lambda': 6.693104126981865e-08, 'alpha': 3.6255313678995395e-08, 'subsample': 0.5250894585399827, 'colsample_bytree': 0.5888804776654998, 'max_depth': 6, 'min_child_weight': 3, 'eta': 0.013371500977394537, 'gamma': 4.739086625324567, 'rate_drop': 7.970123526762063e-06, 'skip_drop': 5.595435635370125e-07}. Best is trial 131 with value: -1.6785222754235516.
[I 2025-06-20 12:11:49,327] Trial 178 finished with value: -1.6960150078582188 and parameters: {'booster': 'dart', 'lambda': 2.570776491981071e-08, 'alpha': 1.709873258643153e-08, 'subsample': 0.5390889606090238, 'colsample_bytree': 0.5744559338303571, 'max_depth': 6, 'min_child_weight': 2, 'eta': 0.011793419452590319, 'gamma': 4.88188659993193, 'rate_drop': 2.3810940831154525e-06, 'skip_drop': 1.7457378577549982e-07}. Best is trial 131 with value: -1.6785222754235516.
[I 2025-06-20 12:11:58,884] Trial 179 finished with value: -1.7275057072091629 and parameters: {'booster': 'dart', 'lambda': 1.0039178613408499e-08, 'alpha': 2.3412915482861622e-08, 'subsample': 0.5482220394610188, 'colsample_bytree': 0.5941023131897217, 'max_depth': 6, 'min_child_weight': 3, 'eta': 0.006508448202320205, 'gamma': 4.692883873343539, 'rate_drop': 3.869863323262577e-06, 'skip_drop': 8.317603528843153e-07}. Best is trial 131 with value: -1.6785222754235516.
[I 2025-06-20 12:12:05,828] Trial 180 finished with value: -1.7018100651128085 and parameters: {'booster': 'dart', 'lambda': 1.0928220669948427e-07, 'alpha': 1.3287787958728837e-08, 'subsample': 0.5271966032684569, 'colsample_bytree': 0.6040675520303667, 'max_depth': 6, 'min_child_weight': 2, 'eta': 0.014071156950962498, 'gamma': 4.7898910668135635, 'rate_drop': 1.6433057795224829e-06, 'skip_drop': 9.685715602541894e-08}. Best is trial 131 with value: -1.6785222754235516.
[I 2025-06-20 12:12:14,205] Trial 181 finished with value: -1.69028030920895 and parameters: {'booster': 'dart', 'lambda': 3.8180453986497727e-08, 'alpha': 4.442223777897212e-08, 'subsample': 0.5521051025425383, 'colsample_bytree': 0.5814703377181705, 'max_depth': 6, 'min_child_weight': 3, 'eta': 0.012520889636115926, 'gamma': 4.916314364853107, 'rate_drop': 1.5023405980636172e-05, 'skip_drop': 2.558713880829511e-07}. Best is trial 131 with value: -1.6785222754235516.
[I 2025-06-20 12:12:23,805] Trial 182 finished with value: -1.6924121641115357 and parameters: {'booster': 'dart', 'lambda': 1.951984866329542e-08, 'alpha': 6.984772449223372e-08, 'subsample': 0.5446957393063907, 'colsample_bytree': 0.5799187254635012, 'max_depth': 6, 'min_child_weight': 3, 'eta': 0.010345555441071616, 'gamma': 4.606379713542961, 'rate_drop': 1.0511831376455077e-05, 'skip_drop': 2.4997626540547777e-07}. Best is trial 131 with value: -1.6785222754235516.
[I 2025-06-20 12:12:32,044] Trial 183 finished with value: -1.695596969626809 and parameters: {'booster': 'dart', 'lambda': 6.322147787391234e-08, 'alpha': 2.7943641366665637e-08, 'subsample': 0.5595371185877088, 'colsample_bytree': 0.5661863400878988, 'max_depth': 6, 'min_child_weight': 3, 'eta': 0.01471466092362972, 'gamma': 4.455850064417077, 'rate_drop': 4.315126181158271e-05, 'skip_drop': 3.745953870886478e-07}. Best is trial 131 with value: -1.6785222754235516.
[I 2025-06-20 12:12:39,072] Trial 184 finished with value: -1.6677384169420928 and parameters: {'booster': 'dart', 'lambda': 3.0294972946558957e-07, 'alpha': 2.0336811855713428e-08, 'subsample': 0.5325341498321123, 'colsample_bytree': 0.5622268205169649, 'max_depth': 6, 'min_child_weight': 3, 'eta': 0.017769703050766365, 'gamma': 4.800311182134795, 'rate_drop': 2.620375271728876e-05, 'skip_drop': 1.4010235428743196e-07}. Best is trial 184 with value: -1.6677384169420928.
[I 2025-06-20 12:12:46,069] Trial 185 finished with value: -1.6792365810850531 and parameters: {'booster': 'dart', 'lambda': 1.447094307729153e-07, 'alpha': 2.023948376319995e-08, 'subsample': 0.5340328558781126, 'colsample_bytree': 0.5644186802073891, 'max_depth': 6, 'min_child_weight': 3, 'eta': 0.016923909079971305, 'gamma': 4.812244551581846, 'rate_drop': 1.9285422089499805e-05, 'skip_drop': 1.5076927520193349e-07}. Best is trial 184 with value: -1.6677384169420928.
[I 2025-06-20 12:12:53,074] Trial 186 finished with value: -1.682729023529896 and parameters: {'booster': 'dart', 'lambda': 1.487024737416157e-07, 'alpha': 1.622492023000603e-08, 'subsample': 0.5214566727554704, 'colsample_bytree': 0.5657691953993018, 'max_depth': 6, 'min_child_weight': 3, 'eta': 0.017010661420884664, 'gamma': 4.892394207270594, 'rate_drop': 1.4650832308809422e-05, 'skip_drop': 1.5727266238793844e-07}. Best is trial 184 with value: -1.6677384169420928.
[I 2025-06-20 12:13:00,200] Trial 187 finished with value: -1.6674236221533323 and parameters: {'booster': 'dart', 'lambda': 1.6331968303674733e-07, 'alpha': 1.7493730576419663e-08, 'subsample': 0.5207395356566991, 'colsample_bytree': 0.5615980716532487, 'max_depth': 6, 'min_child_weight': 3, 'eta': 0.01725848319048248, 'gamma': 4.997983880444326, 'rate_drop': 1.668646252504323e-05, 'skip_drop': 1.4909041335786492e-07}. Best is trial 187 with value: -1.6674236221533323.
[I 2025-06-20 12:13:07,238] Trial 188 finished with value: -1.6656077964639489 and parameters: {'booster': 'dart', 'lambda': 2.1443862861104984e-07, 'alpha': 1.4643477803640128e-08, 'subsample': 0.5200974500370995, 'colsample_bytree': 0.5617418159812706, 'max_depth': 6, 'min_child_weight': 3, 'eta': 0.01690130251526275, 'gamma': 4.995287832224954, 'rate_drop': 1.6956094631834475e-05, 'skip_drop': 8.466189107474757e-08}. Best is trial 188 with value: -1.6656077964639489.
[I 2025-06-20 12:13:15,495] Trial 189 finished with value: -1.66206808945109 and parameters: {'booster': 'dart', 'lambda': 1.6052510323350302e-07, 'alpha': 1.803336324803064e-08, 'subsample': 0.5201199103521131, 'colsample_bytree': 0.561647212839382, 'max_depth': 6, 'min_child_weight': 3, 'eta': 0.017755447195231717, 'gamma': 4.973933824734209, 'rate_drop': 1.303908789302676e-05, 'skip_drop': 8.707504285167029e-08}. Best is trial 189 with value: -1.66206808945109.
[I 2025-06-20 12:13:22,439] Trial 190 finished with value: -1.6708450988382828 and parameters: {'booster': 'dart', 'lambda': 4.627353392332913e-07, 'alpha': 1.0286659850489757e-08, 'subsample': 0.5290407928078651, 'colsample_bytree': 0.5610965655658077, 'max_depth': 6, 'min_child_weight': 3, 'eta': 0.01779486547826928, 'gamma': 4.994619233709994, 'rate_drop': 6.441098824531347e-06, 'skip_drop': 1.1716602602782083e-07}. Best is trial 189 with value: -1.66206808945109.
