PS D:\machile_nearning\wecode_score_prediction\dataset-hard-problem-fixed\XGBoost-CK_Threshold_50> python .\train.py                       
[I 2025-06-29 22:02:44,047] A new study created in memory with name: no-name-736af7ec-e576-4e3e-ad57-4ac57d34919c
[I 2025-06-29 22:02:44,449] Trial 0 finished with value: -1.6942520980141467 and parameters: {'booster': 'gbtree', 'lambda': 3.2373274047624454e-05, 'alpha': 0.01689637724982257, 'subsample': 0.6732053631709257, 'colsample_bytree': 0.5283231920012087, 'max_depth': 6, 'min_child_weight': 1, 'eta': 0.0020994692135666475, 'gamma': 4.1705707547273425}. Best is trial 0 with value: -1.6942520980141467.
[I 2025-06-29 22:02:44,718] Trial 1 finished with value: -1.6615199713226305 and parameters: {'booster': 'gbtree', 'lambda': 2.555079414111246, 'alpha': 0.004916966468031171, 'subsample': 0.6345049498844154, 'colsample_bytree': 0.9543284929750326, 'max_depth': 5, 'min_child_weight': 2, 'eta': 0.002652919929071514, 'gamma': 1.3246970148784891}. Best is trial 1 with value: -1.6615199713226305.
[I 2025-06-29 22:02:44,887] Trial 2 finished with value: -1.6021022088442778 and parameters: {'booster': 'gbtree', 'lambda': 0.00023720597306954079, 'alpha': 0.008401600512016253, 'subsample': 0.517442795488428, 'colsample_bytree': 0.8550691299103921, 'max_depth': 3, 'min_child_weight': 4, 'eta': 0.005650992349406789, 'gamma': 3.458385945181032}. Best is trial 2 with value: -1.6021022088442778.
[I 2025-06-29 22:02:45,090] Trial 3 finished with value: -1.657570391056841 and parameters: {'booster': 'gbtree', 'lambda': 0.0005054776399271357, 'alpha': 6.698966658874221e-07, 'subsample': 0.9586235212606165, 'colsample_bytree': 0.8856254842315253, 'max_depth': 6, 'min_child_weight': 9, 'eta': 0.00623800935865922, 'gamma': 3.7027403079974333}. Best is trial 2 with value: -1.6021022088442778.
[I 2025-06-29 22:02:45,378] Trial 4 finished with value: -1.6500462596807357 and parameters: {'booster': 'dart', 'lambda': 5.051599732527486e-07, 'alpha': 2.4409388597607584e-08, 'subsample': 0.7520183519117227, 'colsample_bytree': 0.5819362335127921, 'max_depth': 8, 'min_child_weight': 3, 'eta': 0.07238055497458301, 'gamma': 3.415646649710286, 'rate_drop': 3.3278414979046476e-07, 'skip_drop': 1.9902293553638946e-07}. Best is trial 2 with value: -1.6021022088442778.
[I 2025-06-29 22:02:45,436] Trial 5 finished with value: -1.6856357100724557 and parameters: {'booster': 'gbtree', 'lambda': 0.0024787544248114812, 'alpha': 5.158438788871813e-08, 'subsample': 0.7418916902514066, 'colsample_bytree': 0.6376057340770884, 'max_depth': 6, 'min_child_weight': 2, 'eta': 0.05243977945281907, 'gamma': 0.2370358324834665}. Best is trial 2 with value: -1.6021022088442778.
[I 2025-06-29 22:02:45,492] Trial 6 finished with value: -1.6911681043661073 and parameters: {'booster': 'gbtree', 'lambda': 3.4500141957080225e-06, 'alpha': 0.00011612812040536946, 'subsample': 0.5685003770489196, 'colsample_bytree': 0.989940265750451, 'max_depth': 6, 'min_child_weight': 10, 'eta': 0.10466835058743477, 'gamma': 0.2628254368457589}. Best is trial 2 with value: -1.6021022088442778.
[I 2025-06-29 22:02:45,865] Trial 7 finished with value: -1.6146056977034218 and parameters: {'booster': 'dart', 'lambda': 6.562467100183289e-08, 'alpha': 5.307594557082468e-06, 'subsample': 0.612233805338861, 'colsample_bytree': 0.6864889970307233, 'max_depth': 4, 'min_child_weight': 4, 'eta': 0.10298433918565078, 'gamma': 0.11782579780254376, 'rate_drop': 0.090053200931456, 'skip_drop': 0.00016122299163239033}. Best is trial 2 with value: -1.6021022088442778.
[I 2025-06-29 22:02:49,884] Trial 8 finished with value: -1.6043093975000877 and parameters: {'booster': 'dart', 'lambda': 2.9522010041453248e-08, 'alpha': 2.2806876554546713, 'subsample': 0.791627162278452, 'colsample_bytree': 0.585303292872749, 'max_depth': 5, 'min_child_weight': 4, 'eta': 0.009916886905889618, 'gamma': 4.499425870600228, 'rate_drop': 0.0005452601035588822, 'skip_drop': 0.00067012953050104}. Best is trial 2 with value: -1.6021022088442778.
[I 2025-06-29 22:02:50,539] Trial 9 finished with value: -1.6965106519869146 and parameters: {'booster': 'gbtree', 'lambda': 0.1566497555413458, 'alpha': 0.2929126420817669, 'subsample': 0.8922126340199921, 'colsample_bytree': 0.989367118247175, 'max_depth': 10, 'min_child_weight': 2, 'eta': 0.0015592086442395635, 'gamma': 2.0627895456810337}. Best is trial 2 with value: -1.6021022088442778.
[I 2025-06-29 22:02:52,342] Trial 10 finished with value: -1.5911545645523923 and parameters: {'booster': 'dart', 'lambda': 0.11622188140385269, 'alpha': 0.00011562689104209332, 'subsample': 0.5195554231827669, 'colsample_bytree': 0.8060384744629897, 'max_depth': 3, 'min_child_weight': 7, 'eta': 0.022189576554165813, 'gamma': 2.852087398014738, 'rate_drop': 1.077968417363787e-08, 'skip_drop': 0.24504887139169435}. Best is trial 10 with value: -1.5911545645523923.
[I 2025-06-29 22:02:53,517] Trial 11 finished with value: -1.5944442310892157 and parameters: {'booster': 'dart', 'lambda': 0.02171754964182458, 'alpha': 0.0001874535602625468, 'subsample': 0.5227633748822557, 'colsample_bytree': 0.8132063497033448, 'max_depth': 3, 'min_child_weight': 7, 'eta': 0.024146823267646812, 'gamma': 2.989920057751915, 'rate_drop': 3.156849150198134e-08, 'skip_drop': 0.04883784053591566}. Best is trial 10 with value: -1.5911545645523923.
[I 2025-06-29 22:02:54,513] Trial 12 finished with value: -1.593380210974819 and parameters: {'booster': 'dart', 'lambda': 0.028583092934458182, 'alpha': 4.7264140097944097e-05, 'subsample': 0.5001741275526869, 'colsample_bytree': 0.7804295378686943, 'max_depth': 3, 'min_child_weight': 7, 'eta': 0.025897940793448766, 'gamma': 2.5506999747051027, 'rate_drop': 1.0694798491422773e-08, 'skip_drop': 0.8120471610536554}. Best is trial 10 with value: -1.5911545645523923.
[I 2025-06-29 22:02:54,714] Trial 13 finished with value: -1.7037962631701933 and parameters: {'booster': 'dart', 'lambda': 6.472024032008471, 'alpha': 5.316667860996357e-06, 'subsample': 0.5286282601984347, 'colsample_bytree': 0.7478906591075348, 'max_depth': 3, 'min_child_weight': 7, 'eta': 0.29632330266668655, 'gamma': 2.4013391142288096, 'rate_drop': 1.804895709312927e-08, 'skip_drop': 0.43531330181163475}. Best is trial 10 with value: -1.5911545645523923.
[I 2025-06-29 22:02:55,447] Trial 14 finished with value: -1.614000010588686 and parameters: {'booster': 'dart', 'lambda': 0.10164176713785084, 'alpha': 2.732314639311411e-05, 'subsample': 0.6804697707370366, 'colsample_bytree': 0.7643804085493553, 'max_depth': 4, 'min_child_weight': 7, 'eta': 0.026093701755479017, 'gamma': 1.557347549472623, 'rate_drop': 8.760777723748802e-06, 'skip_drop': 0.601779290291181}. Best is trial 10 with value: -1.5911545645523923.
[I 2025-06-29 22:02:56,571] Trial 15 finished with value: -1.640823323222903 and parameters: {'booster': 'dart', 'lambda': 0.009217474219436268, 'alpha': 0.0012622441314507934, 'subsample': 0.601759038484545, 'colsample_bytree': 0.7151518478127563, 'max_depth': 9, 'min_child_weight': 6, 'eta': 0.015421632664046253, 'gamma': 2.819653312202604, 'rate_drop': 2.212436256896195e-06, 'skip_drop': 0.01287971795945601}. Best is trial 10 with value: -1.5911545645523923.
[I 2025-06-29 22:02:57,450] Trial 16 finished with value: -1.6386047142267663 and parameters: {'booster': 'dart', 'lambda': 0.5176986513898838, 'alpha': 8.393300036516808e-07, 'subsample': 0.5020676335724947, 'colsample_bytree': 0.8121135975432634, 'max_depth': 4, 'min_child_weight': 9, 'eta': 0.038005489940856375, 'gamma': 1.6650053618073473, 'rate_drop': 1.2229151506479971e-08, 'skip_drop': 1.4154342858298153e-06}. Best is trial 10 with value: -1.5911545645523923.
[I 2025-06-29 22:02:58,976] Trial 17 finished with value: -1.6473468576992012 and parameters: {'booster': 'dart', 'lambda': 0.01728893313723905, 'alpha': 0.11551428907861937, 'subsample': 0.8647510131559559, 'colsample_bytree': 0.9055330436593089, 'max_depth': 7, 'min_child_weight': 8, 'eta': 0.01242594171724055, 'gamma': 4.960235922194876, 'rate_drop': 0.00012739441781257297, 'skip_drop': 0.006502268816879762}. Best is trial 10 with value: -1.5911545645523923.
[I 2025-06-29 22:02:59,151] Trial 18 finished with value: -1.9582834659779078 and parameters: {'booster': 'dart', 'lambda': 0.6634410611865605, 'alpha': 0.000803462560975278, 'subsample': 0.5669064197846352, 'colsample_bytree': 0.8288795137257271, 'max_depth': 5, 'min_child_weight': 6, 'eta': 0.287395534794712, 'gamma': 1.0232894438169735, 'rate_drop': 4.626480053347248e-07, 'skip_drop': 0.9885141986968793}. Best is trial 10 with value: -1.5911545645523923.
[I 2025-06-29 22:03:06,669] Trial 19 finished with value: -1.841885084122862 and parameters: {'booster': 'dart', 'lambda': 0.0006823309368793128, 'alpha': 2.9375768661965555e-05, 'subsample': 0.6715289503970235, 'colsample_bytree': 0.665251368273281, 'max_depth': 3, 'min_child_weight': 5, 'eta': 0.004458381512236396, 'gamma': 2.272669434276207, 'rate_drop': 0.04733130143812566, 'skip_drop': 1.6761861657433126e-05}. Best is trial 10 with value: -1.5911545645523923.
[I 2025-06-29 22:03:14,661] Trial 20 finished with value: -1.7967444623496431 and parameters: {'booster': 'dart', 'lambda': 2.8770937730659796e-05, 'alpha': 1.811207297239435e-07, 'subsample': 0.5696187981951124, 'colsample_bytree': 0.7722323212443047, 'max_depth': 4, 'min_child_weight': 8, 'eta': 0.001023228413039427, 'gamma': 2.7669620784178806, 'rate_drop': 0.0019176337977974195, 'skip_drop': 0.05088438946156399}. Best is trial 10 with value: -1.5911545645523923.
[I 2025-06-29 22:03:16,230] Trial 21 finished with value: -1.6200916008930282 and parameters: {'booster': 'dart', 'lambda': 0.026597821319563276, 'alpha': 0.00013719490494949987, 'subsample': 0.54259996757753, 'colsample_bytree': 0.814323493842991, 'max_depth': 3, 'min_child_weight': 7, 'eta': 0.023139748935812762, 'gamma': 3.0057719839433523, 'rate_drop': 6.292292513057784e-08, 'skip_drop': 0.03426793366564018}. Best is trial 10 with value: -1.5911545645523923.
[I 2025-06-29 22:03:17,083] Trial 22 finished with value: -1.6087484935597651 and parameters: {'booster': 'dart', 'lambda': 0.003926062300852862, 'alpha': 2.2566429518224224e-05, 'subsample': 0.5037062979272279, 'colsample_bytree': 0.9036160454816896, 'max_depth': 3, 'min_child_weight': 8, 'eta': 0.024852784839404778, 'gamma': 3.1224974635945606, 'rate_drop': 1.1081177677102943e-07, 'skip_drop': 0.09881696270931335}. Best is trial 10 with value: -1.5911545645523923.
[I 2025-06-29 22:03:18,053] Trial 23 finished with value: -1.6155368338918135 and parameters: {'booster': 'dart', 'lambda': 0.34947300416006616, 'alpha': 0.0003908333392294301, 'subsample': 0.6295014506822147, 'colsample_bytree': 0.7898576895596863, 'max_depth': 4, 'min_child_weight': 6, 'eta': 0.0362215844853424, 'gamma': 3.8778161892886462, 'rate_drop': 1.1984046868999299e-08, 'skip_drop': 0.0016782598656311229}. Best is trial 10 with value: -1.5911545645523923.
[I 2025-06-29 22:03:26,125] Trial 24 finished with value: -1.5953453205514754 and parameters: {'booster': 'dart', 'lambda': 0.055609176541160904, 'alpha': 2.7263414532561326e-06, 'subsample': 0.5621018794597763, 'colsample_bytree': 0.734185283069837, 'max_depth': 3, 'min_child_weight': 5, 'eta': 0.009453414068793539, 'gamma': 1.9327521665582668, 'rate_drop': 8.386714793324384e-06, 'skip_drop': 0.12159231787146474}. Best is trial 10 with value: -1.5911545645523923.
[I 2025-06-29 22:03:26,658] Trial 25 finished with value: -1.6449997121801232 and parameters: {'booster': 'dart', 'lambda': 1.459019538373929, 'alpha': 0.0021346155008301823, 'subsample': 0.5858977784837794, 'colsample_bytree': 0.8621334682226316, 'max_depth': 5, 'min_child_weight': 7, 'eta': 0.0565768643862731, 'gamma': 2.6001274068673985, 'rate_drop': 7.563915717287534e-07, 'skip_drop': 0.0034946900240576855}. Best is trial 10 with value: -1.5911545645523923.
[I 2025-06-29 22:03:28,287] Trial 26 finished with value: -1.6186622916938445 and parameters: {'booster': 'dart', 'lambda': 0.0025984808610957162, 'alpha': 9.486325681369125e-05, 'subsample': 0.5424056640840633, 'colsample_bytree': 0.9368136802661391, 'max_depth': 4, 'min_child_weight': 9, 'eta': 0.01869984515797233, 'gamma': 3.18198012909009, 'rate_drop': 6.64297117856948e-08, 'skip_drop': 0.18984347651593753}. Best is trial 10 with value: -1.5911545645523923.
[I 2025-06-29 22:03:28,555] Trial 27 finished with value: -1.8023641805699837 and parameters: {'booster': 'dart', 'lambda': 0.05294558140356824, 'alpha': 0.02177988365336168, 'subsample': 0.6349388951334098, 'colsample_bytree': 0.8431540705460766, 'max_depth': 7, 'min_child_weight': 10, 'eta': 0.1518034062923135, 'gamma': 0.8830686889719805, 'rate_drop': 6.16475607392748e-08, 'skip_drop': 1.382862592246838e-08}. Best is trial 10 with value: -1.5911545645523923.
[I 2025-06-29 22:03:31,892] Trial 28 finished with value: -1.8083398170633729 and parameters: {'booster': 'dart', 'lambda': 0.00011836335454592744, 'alpha': 0.00041694099125977975, 'subsample': 0.5017091983044912, 'colsample_bytree': 0.7061612410149091, 'max_depth': 3, 'min_child_weight': 8, 'eta': 0.036577470634315844, 'gamma': 2.4406334599560795, 'rate_drop': 0.9347525562495513, 'skip_drop': 0.020116407367157103}. Best is trial 10 with value: -1.5911545645523923.
[I 2025-06-29 22:03:35,102] Trial 29 finished with value: -1.6211324474511246 and parameters: {'booster': 'dart', 'lambda': 9.401589327939204, 'alpha': 0.045016340306193475, 'subsample': 0.682586620159807, 'colsample_bytree': 0.7881434965794692, 'max_depth': 5, 'min_child_weight': 5, 'eta': 0.014268637684439676, 'gamma': 4.123157219558683, 'rate_drop': 3.84596386937779e-06, 'skip_drop': 0.00031497765130861476}. Best is trial 10 with value: -1.5911545645523923.
[I 2025-06-29 22:03:39,087] Trial 30 finished with value: -1.6195532645740358 and parameters: {'booster': 'dart', 'lambda': 0.007240379025552038, 'alpha': 1.2697672292067232e-05, 'subsample': 0.9997848468099757, 'colsample_bytree': 0.6212537763886725, 'max_depth': 4, 'min_child_weight': 6, 'eta': 0.008799716980940162, 'gamma': 2.0101573207784647, 'rate_drop': 4.198033887201724e-05, 'skip_drop': 3.377703957304317e-05}. Best is trial 10 with value: -1.5911545645523923.
[I 2025-06-29 22:03:47,321] Trial 31 finished with value: -1.5940553944207763 and parameters: {'booster': 'dart', 'lambda': 0.08292420426201497, 'alpha': 1.1560529363553176e-06, 'subsample': 0.5460891781866447, 'colsample_bytree': 0.733907912832509, 'max_depth': 3, 'min_child_weight': 5, 'eta': 0.008592566834400529, 'gamma': 2.080373117131986, 'rate_drop': 2.1652564160760128e-07, 'skip_drop': 0.13319149397781707}. Best is trial 10 with value: -1.5911545645523923.
[I 2025-06-29 22:03:54,870] Trial 32 finished with value: -1.6207552382475174 and parameters: {'booster': 'dart', 'lambda': 0.15438678664732952, 'alpha': 8.438642654299677e-07, 'subsample': 0.5502200518088634, 'colsample_bytree': 0.7347381376112232, 'max_depth': 3, 'min_child_weight': 7, 'eta': 0.004260205802729651, 'gamma': 2.7805858688015648, 'rate_drop': 1.780665949406998e-07, 'skip_drop': 0.21850686560899338}. Best is trial 10 with value: -1.5911545645523923.
[I 2025-06-29 22:03:57,709] Trial 33 finished with value: -1.5907113515202906 and parameters: {'booster': 'dart', 'lambda': 1.6228520680844931, 'alpha': 0.004906588399645127, 'subsample': 0.5326266670447979, 'colsample_bytree': 0.800352978655534, 'max_depth': 3, 'min_child_weight': 5, 'eta': 0.019995072061096342, 'gamma': 3.4164253813527146, 'rate_drop': 1.0529997848672383e-08, 'skip_drop': 0.9455613912090297}. Best is trial 33 with value: -1.5907113515202906.
[I 2025-06-29 22:03:58,024] Trial 34 finished with value: -1.6065474920809502 and parameters: {'booster': 'gbtree', 'lambda': 2.64652619574915, 'alpha': 0.0026589518299551178, 'subsample': 0.657541528031357, 'colsample_bytree': 0.879066364701325, 'max_depth': 4, 'min_child_weight': 5, 'eta': 0.006369849233883566, 'gamma': 3.4882910931510276}. Best is trial 33 with value: -1.5907113515202906.
[I 2025-06-29 22:04:01,974] Trial 35 finished with value: -1.6000232217129169 and parameters: {'booster': 'dart', 'lambda': 2.646451426119326, 'alpha': 1.730440508670416e-07, 'subsample': 0.5923833517532696, 'colsample_bytree': 0.7860508625153634, 'max_depth': 3, 'min_child_weight': 3, 'eta': 0.01828106044588275, 'gamma': 3.8936415536033366, 'rate_drop': 1.0671584107285098e-08, 'skip_drop': 0.9851717503589128}. Best is trial 33 with value: -1.5907113515202906.
[I 2025-06-29 22:04:02,250] Trial 36 finished with value: -1.622997875134457 and parameters: {'booster': 'gbtree', 'lambda': 0.9312504844693961, 'alpha': 6.908033822054786e-05, 'subsample': 0.7205490703603403, 'colsample_bytree': 0.6725917600823075, 'max_depth': 5, 'min_child_weight': 3, 'eta': 0.003687365592190506, 'gamma': 3.422978495947655}. Best is trial 33 with value: -1.5907113515202906.
[I 2025-06-29 22:04:05,110] Trial 37 finished with value: -1.629929249454314 and parameters: {'booster': 'dart', 'lambda': 0.2712705244685157, 'alpha': 0.009052573654164424, 'subsample': 0.5312222444130914, 'colsample_bytree': 0.7567916484915147, 'max_depth': 8, 'min_child_weight': 4, 'eta': 0.007253249909380978, 'gamma': 1.7010718637106832, 'rate_drop': 1.108568297811557e-06, 'skip_drop': 0.2225497852268643}. Best is trial 33 with value: -1.5907113515202906.
[I 2025-06-29 22:04:05,258] Trial 38 finished with value: -1.6099312390694303 and parameters: {'booster': 'gbtree', 'lambda': 0.0013432410424417613, 'alpha': 1.5394339530902832e-08, 'subsample': 0.8107832815187596, 'colsample_bytree': 0.7205888172204068, 'max_depth': 4, 'min_child_weight': 6, 'eta': 0.011568116332629823, 'gamma': 1.2593188628676653}. Best is trial 33 with value: -1.5907113515202906.
[I 2025-06-29 22:04:12,892] Trial 39 finished with value: -1.671129694052253 and parameters: {'booster': 'dart', 'lambda': 0.05209315252900528, 'alpha': 0.004636605905325598, 'subsample': 0.6207636763870968, 'colsample_bytree': 0.8522264591244835, 'max_depth': 3, 'min_child_weight': 4, 'eta': 0.002685776599372514, 'gamma': 2.225523594890927, 'rate_drop': 2.122276454171342e-07, 'skip_drop': 0.01732788188196034}. Best is trial 33 with value: -1.5907113515202906.
[I 2025-06-29 22:04:12,982] Trial 40 finished with value: -1.6238503058343012 and parameters: {'booster': 'gbtree', 'lambda': 5.476777064789716e-05, 'alpha': 2.7302370713995205e-06, 'subsample': 0.5801083983568369, 'colsample_bytree': 0.506456183861421, 'max_depth': 6, 'min_child_weight': 5, 'eta': 0.05934941416639042, 'gamma': 4.462296369929198}. Best is trial 33 with value: -1.5907113515202906.
[I 2025-06-29 22:04:13,886] Trial 41 finished with value: -1.5853593904630081 and parameters: {'booster': 'dart', 'lambda': 0.02147614989470659, 'alpha': 0.0002256880389332682, 'subsample': 0.5274953718393712, 'colsample_bytree': 0.8075763521108805, 'max_depth': 3, 'min_child_weight': 7, 'eta': 0.03024079289024352, 'gamma': 3.163679477029045, 'rate_drop': 3.4436257061362876e-08, 'skip_drop': 0.08688921797788982}. Best is trial 41 with value: -1.5853593904630081.
[I 2025-06-29 22:04:14,770] Trial 42 finished with value: -1.6143889898572659 and parameters: {'booster': 'dart', 'lambda': 0.011055184209278729, 'alpha': 0.0006859788571299531, 'subsample': 0.5294688875205126, 'colsample_bytree': 0.8022574534315272, 'max_depth': 3, 'min_child_weight': 1, 'eta': 0.0425219831425366, 'gamma': 3.2867490041797867, 'rate_drop': 3.494108385461416e-08, 'skip_drop': 0.3346125313306052}. Best is trial 41 with value: -1.5853593904630081.
[I 2025-06-29 22:04:15,272] Trial 43 finished with value: -1.6042541257330154 and parameters: {'booster': 'dart', 'lambda': 0.0716786659658732, 'alpha': 5.292259155257574e-05, 'subsample': 0.5540203086432555, 'colsample_bytree': 0.8287952221493382, 'max_depth': 3, 'min_child_weight': 6, 'eta': 0.08282870846983935, 'gamma': 3.6342672148389847, 'rate_drop': 3.036340168800064e-07, 'skip_drop': 0.08400767780894686}. Best is trial 41 with value: -1.5853593904630081.
[I 2025-06-29 22:04:15,995] Trial 44 finished with value: -1.597114383015529 and parameters: {'booster': 'dart', 'lambda': 0.22335987955641573, 'alpha': 0.00025183263729191283, 'subsample': 0.5186770696484572, 'colsample_bytree': 0.692083199649089, 'max_depth': 4, 'min_child_weight': 8, 'eta': 0.031109233862404207, 'gamma': 2.5187364314461353, 'rate_drop': 3.1547989713900907e-08, 'skip_drop': 0.42217561553179117}. Best is trial 41 with value: -1.5853593904630081.
[I 2025-06-29 22:04:20,282] Trial 45 finished with value: -1.6191029482806736 and parameters: {'booster': 'dart', 'lambda': 1.8856972733279471, 'alpha': 8.187756249326755, 'subsample': 0.5184457306440644, 'colsample_bytree': 0.768256836637986, 'max_depth': 3, 'min_child_weight': 7, 'eta': 0.016525033272522034, 'gamma': 2.6767890485565147, 'rate_drop': 1.3817054805548384e-07, 'skip_drop': 0.9187620571910012}. Best is trial 41 with value: -1.5853593904630081.
[I 2025-06-29 22:04:21,218] Trial 46 finished with value: -1.5861394261118855 and parameters: {'booster': 'dart', 'lambda': 0.025652816636116377, 'alpha': 9.281829954505295e-06, 'subsample': 0.5976429910508647, 'colsample_bytree': 0.7469892712518913, 'max_depth': 4, 'min_child_weight': 6, 'eta': 0.022359795102242314, 'gamma': 2.941604599670551, 'rate_drop': 3.024548595368862e-08, 'skip_drop': 0.08022242327255762}. Best is trial 41 with value: -1.5853593904630081.
[I 2025-06-29 22:04:22,644] Trial 47 finished with value: -1.616333120163337 and parameters: {'booster': 'dart', 'lambda': 0.00027179923985691144, 'alpha': 1.2724437233675473e-05, 'subsample': 0.6009209835443746, 'colsample_bytree': 0.8801176851272938, 'max_depth': 4, 'min_child_weight': 7, 'eta': 0.02084820941985647, 'gamma': 2.970471242732506, 'rate_drop': 2.602669492202025e-08, 'skip_drop': 0.005304251635703051}. Best is trial 41 with value: -1.5853593904630081.
