[I 2025-06-29 22:04:23,228] Trial 48 finished with value: -1.6009682855749077 and parameters: {'booster': 'dart', 'lambda': 0.0010372379688522513, 'alpha': 5.715288887933053e-06, 'subsample': 0.7142346306406425, 'colsample_bytree': 0.837163322795357, 'max_depth': 4, 'min_child_weight': 6, 'eta': 0.030108792471916397, 'gamma': 3.762954263384114, 'rate_drop': 1.0924294103819497e-08, 'skip_drop': 0.038322459390477424}. Best is trial 41 with value: -1.5853593904630081.
[I 2025-06-29 22:04:23,318] Trial 49 finished with value: -1.6486896689858588 and parameters: {'booster': 'gbtree', 'lambda': 9.179268342680168e-06, 'alpha': 4.819931120014509e-05, 'subsample': 0.5002866156280583, 'colsample_bytree': 0.7465782954933011, 'max_depth': 5, 'min_child_weight': 9, 'eta': 0.04952528916888425, 'gamma': 3.3624320666749847}. Best is trial 41 with value: -1.5853593904630081.
Number of finished trials:  50
Best trial:
  Value (RMSE): 1.5854
  MSE: 2.5134
  R²: 0.3799
Model saved to ck_student_score_predictor_optuna_xgb.pkl
PS D:\machile_nearning\wecode_score_prediction\dataset-hard-problem-fixed\XGBoost-CK_Threshold_50> python .\predict.py                     
Found 733 students without CK scores
Predictions saved to ck_score_predictions.csv
Sample predictions:
                                  student_id  predicted_ck_score
3   0134f9f410c65ad0e8c2254a7e9288670e02a183            6.901465
20  035f97702f2c01d26ab1fae8f39ea2f98a0caa3c            7.176936
40  06024da8147b5cf6105beb4c403f67cf1ff0aea1            8.679712
68  0aaebc88f6106684d6993c156104c1ef36cf94e0            6.710392
80  0bf111a9caedf02804f6991792490e63bc21058a            8.593201