[I 2025-06-29 22:49:07,172] Trial 47 finished with value: -1.6229175986139805 and parameters: {'booster': 'dart', 'lambda': 7.632270807736008e-07, 'alpha': 0.0009473969755054838, 'subsample': 0.8842213644855764, 'colsample_bytree': 0.7504810783592755, 'max_depth': 7, 'min_child_weight': 4, 'eta': 0.015891056423260944, 'gamma': 1.841655078023785, 'rate_drop': 1.827910067468036e-05, 'skip_drop': 1.3925025866314092e-05}. Best is trial 43 with value: -1.6140456574984703.     
[I 2025-06-29 22:49:15,559] Trial 48 finished with value: -1.9284356900524606 and parameters: {'booster': 'dart', 'lambda': 0.4426255263666611, 'alpha': 0.00010818683907386594, 'subsample': 0.6278293463235489, 'colsample_bytree': 0.940141760978421, 'max_depth': 8, 'min_child_weight': 5, 'eta': 0.0011547049001988286, 'gamma': 0.2656551197834102, 'rate_drop': 0.01991734201759988, 'skip_drop': 4.670339785101337e-06}. Best is trial 43 with value: -1.6140456574984703.
[I 2025-06-29 22:49:21,996] Trial 49 finished with value: -1.615655035872981 and parameters: {'booster': 'dart', 'lambda': 0.0020868062204600062, 'alpha': 0.047222884732880666, 'subsample': 0.7059356662482072, 'colsample_bytree': 0.9101081599189113, 'max_depth': 10, 'min_child_weight': 8, 'eta': 0.008404317340982816, 'gamma': 3.0581060056663905, 'rate_drop': 0.0020173031821224792, 'skip_drop': 1.7318056857282886e-07}. Best is trial 43 with value: -1.6140456574984703.     
Number of finished trials:  50
Best trial:
  Value (RMSE): 1.6140
  MSE: 2.6051
  R²: 0.3593
Model saved to ck_student_score_predictor_optuna_xgb.pkl
PS D:\machile_nearning\wecode_score_prediction\dataset-practice-separation\XGBoost-CK-No-Practice> python .\predict.py
Found 718 students without CK scores
Predictions saved to ck_score_predictions.csv
Sample predictions:
                                  student_id  predicted_ck_score
3   0134f9f410c65ad0e8c2254a7e9288670e02a183            7.863423
20  035f97702f2c01d26ab1fae8f39ea2f98a0caa3c            7.199055
40  06024da8147b5cf6105beb4c403f67cf1ff0aea1            7.280367
68  0aaebc88f6106684d6993c156104c1ef36cf94e0            7.174342
80  0bf111a9caedf02804f6991792490e63bc21058a            8.053349