PS D:\machile_nearning\wecode_score_prediction\dataset-practice-separation\XGBoost-CK-No-Practice> python .\train.py   
[I 2025-06-29 22:46:30,405] A new study created in memory with name: no-name-9dcea5cf-9a41-4432-816f-74ce550155f0      
[I 2025-06-29 22:46:39,894] Trial 0 finished with value: -1.9623578447923484 and parameters: {'booster': 'dart', 'lambda': 2.803508737388402e-08, 'alpha': 0.002288096509275133, 'subsample': 0.9350240785482578, 'colsample_bytree': 0.8392011557645566, 'max_depth': 10, 'min_child_weight': 2, 'eta': 0.002067419554411405, 'gamma': 4.906637527151162, 'rate_drop': 0.0817492304114089, 'skip_drop': 4.723212058157034e-05}. Best is trial 0 with value: -1.9623578447923484.
[I 2025-06-29 22:46:40,606] Trial 1 finished with value: -1.6316866436509796 and parameters: {'booster': 'dart', 'lambda': 7.134241179877639e-05, 'alpha': 9.998183993303469e-08, 'subsample': 0.5675056221368862, 'colsample_bytree': 0.6288040191513117, 'max_depth': 10, 'min_child_weight': 5, 'eta': 0.02810058234824091, 'gamma': 0.7162706395048474, 'rate_drop': 0.000986718458641641, 'skip_drop': 2.815437187008326e-07}. Best is trial 1 with value: -1.6316866436509796.
[I 2025-06-29 22:46:40,709] Trial 2 finished with value: -1.6469010344322472 and parameters: {'booster': 'gbtree', 'lambda': 0.0004912745477341228, 'alpha': 2.040069112467536, 'subsample': 0.6452497522406162, 'colsample_bytree': 0.5832930951812081, 'max_depth': 6, 'min_child_weight': 7, 'eta': 0.03941080205081169, 'gamma': 2.863103496897433}. Best is trial 1 with value: -1.6316866436509796.
[I 2025-06-29 22:46:40,864] Trial 3 finished with value: -1.6738209061515574 and parameters: {'booster': 'dart', 'lambda': 1.3170196058580912e-08, 'alpha': 1.3256116008647234e-06, 'subsample': 0.9150220101093927, 'colsample_bytree': 0.9547952243604578, 'max_depth': 5, 'min_child_weight': 2, 'eta': 0.2154980427917229, 'gamma': 2.8375432771570797, 'rate_drop': 0.0008522389939581505, 'skip_drop': 0.0016076995443923706}. Best is trial 1 with value: -1.6316866436509796.       
[I 2025-06-29 22:46:40,897] Trial 4 finished with value: -1.8580510912381965 and parameters: {'booster': 'gbtree', 'lambda': 0.00489895445727817, 'alpha': 0.002440665450195674, 'subsample': 0.5532108449052917, 'colsample_bytree': 0.8357647412028466, 'max_depth': 5, 'min_child_weight': 2, 'eta': 0.23743610740574345, 'gamma': 2.970045455753036}. Best is trial 1 with value: -1.6316866436509796.
[I 2025-06-29 22:46:41,166] Trial 5 finished with value: -1.7053970683532569 and parameters: {'booster': 'gbtree', 'lambda': 5.64708557395226, 'alpha': 1.0909180898374649e-07, 'subsample': 0.6711900961890109, 'colsample_bytree': 0.6068876785758309, 'max_depth': 10, 'min_child_weight': 7, 'eta': 0.003565853796946926, 'gamma': 4.050522413961106}. Best is trial 1 with value: -1.6316866436509796.
[I 2025-06-29 22:46:43,789] Trial 6 finished with value: -1.6177612006099706 and parameters: {'booster': 'dart', 'lambda': 1.5413598077429372e-08, 'alpha': 9.69500938155036e-08, 'subsample': 0.5545242222064257, 'colsample_bytree': 0.9614658252197356, 'max_depth': 9, 'min_child_weight': 3, 'eta': 0.017959622737213705, 'gamma': 0.8445739563696614, 'rate_drop': 0.02881915974101614, 'skip_drop': 2.147565225006346e-07}. Best is trial 6 with value: -1.6177612006099706.
[I 2025-06-29 22:46:43,997] Trial 7 finished with value: -1.7419575020379212 and parameters: {'booster': 'dart', 'lambda': 0.0017099160107563827, 'alpha': 0.15983819223375914, 'subsample': 0.5382166429126303, 'colsample_bytree': 0.6014104548650363, 'max_depth': 4, 'min_child_weight': 4, 'eta': 0.29863962246207004, 'gamma': 4.06745183463561, 'rate_drop': 0.028073764307460163, 'skip_drop': 9.359760000573936e-06}. Best is trial 6 with value: -1.6177612006099706.
[I 2025-06-29 22:46:50,524] Trial 8 finished with value: -1.6162761483547237 and parameters: {'booster': 'dart', 'lambda': 0.21553989523474404, 'alpha': 0.0015923369764178513, 'subsample': 0.8182417554357668, 'colsample_bytree': 0.795966227857556, 'max_depth': 7, 'min_child_weight': 6, 'eta': 0.01016414504102676, 'gamma': 4.784020232655052, 'rate_drop': 0.00019409248338675604, 'skip_drop': 3.930378244411524e-08}. Best is trial 8 with value: -1.6162761483547237.
[I 2025-06-29 22:46:50,875] Trial 9 finished with value: -1.6546457601278384 and parameters: {'booster': 'dart', 'lambda': 0.027399963076853592, 'alpha': 0.0013307069137339117, 'subsample': 0.7993358510066434, 'colsample_bytree': 0.9388835350494644, 'max_depth': 4, 'min_child_weight': 8, 'eta': 0.05700834198169937, 'gamma': 1.854931523505185, 'rate_drop': 3.173337781775609e-05, 'skip_drop': 4.7318178059106314e-08}. Best is trial 8 with value: -1.6162761483547237.
[I 2025-06-29 22:46:51,187] Trial 10 finished with value: -1.6466833220701889 and parameters: {'booster': 'gbtree', 'lambda': 8.150340896943202, 'alpha': 1.760648493572964e-05, 'subsample': 0.8159146957248483, 'colsample_bytree': 0.7339494224528634, 'max_depth': 8, 'min_child_weight': 10, 'eta': 0.006329778304752896, 'gamma': 4.963563700880531}. Best is trial 8 with value: -1.6162761483547237.
[I 2025-06-29 22:46:54,435] Trial 11 finished with value: -1.6329453436952959 and parameters: {'booster': 'dart', 'lambda': 1.249773069380841e-06, 'alpha': 2.66076967117787e-05, 'subsample': 0.6902648874823283, 'colsample_bytree': 0.8385930359591669, 'max_depth': 8, 'min_child_weight': 4, 'eta': 0.010521716376048464, 'gamma': 0.16308371822317203, 'rate_drop': 1.8271340880975918e-07, 'skip_drop': 1.1600626844556634e-08}. Best is trial 8 with value: -1.6162761483547237.    
[I 2025-06-29 22:46:56,949] Trial 12 finished with value: -1.6151127621482453 and parameters: {'booster': 'dart', 'lambda': 0.09803266589671795, 'alpha': 0.04986144337853261, 'subsample': 0.8411836475721269, 'colsample_bytree': 0.9981065147337618, 'max_depth': 8, 'min_child_weight': 4, 'eta': 0.01558587149493711, 'gamma': 1.1125419929526608, 'rate_drop': 0.8424758528309566, 'skip_drop': 0.6490881924088702}. Best is trial 12 with value: -1.6151127621482453.
[I 2025-06-29 22:46:57,319] Trial 13 finished with value: -1.6482403334598579 and parameters: {'booster': 'dart', 'lambda': 0.16434258473165853, 'alpha': 0.08155961313831107, 'subsample': 0.8622933399450042, 'colsample_bytree': 0.7300075797710267, 'max_depth': 7, 'min_child_weight': 6, 'eta': 0.07838356692063649, 'gamma': 1.750093045211393, 'rate_drop': 4.660165439516352e-06, 'skip_drop': 0.33341181119901075}. Best is trial 12 with value: -1.6151127621482453.
[I 2025-06-29 22:47:05,506] Trial 14 finished with value: -1.7817283798735448 and parameters: {'booster': 'dart', 'lambda': 0.4239400248357398, 'alpha': 0.026716258261773228, 'subsample': 0.7338636845207189, 'colsample_bytree': 0.8798940520556093, 'max_depth': 7, 'min_child_weight': 9, 'eta': 0.0011913122373728854, 'gamma': 1.6468771431110434, 'rate_drop': 3.665716362956454e-08, 'skip_drop': 0.96982424608808}. Best is trial 12 with value: -1.6151127621482453.
[I 2025-06-29 22:47:12,214] Trial 15 finished with value: -1.9737506790526858 and parameters: {'booster': 'dart', 'lambda': 1.7635863001271017e-05, 'alpha': 8.448945660026464, 'subsample': 0.8664934823873033, 'colsample_bytree': 0.6803472980111768, 'max_depth': 8, 'min_child_weight': 5, 'eta': 0.0078254043536276, 'gamma': 2.2842706764370106, 'rate_drop': 0.25472672678302427, 'skip_drop': 0.006069709209047865}. Best is trial 12 with value: -1.6151127621482453.
[I 2025-06-29 22:47:15,362] Trial 16 finished with value: -1.629624659708614 and parameters: {'booster': 'dart', 'lambda': 0.252493301598148, 'alpha': 9.214341262493262e-05, 'subsample': 0.9735582744589488, 'colsample_bytree': 0.5255313518484162, 'max_depth': 6, 'min_child_weight': 6, 'eta': 0.013344033260979458, 'gamma': 4.167880927326975, 'rate_drop': 1.5822040037830804e-06, 'skip_drop': 0.012221147106930706}. Best is trial 12 with value: -1.6151127621482453.
[I 2025-06-29 22:47:22,914] Trial 17 finished with value: -1.6894830263080194 and parameters: {'booster': 'dart', 'lambda': 0.029370285065713427, 'alpha': 0.019508373003613442, 'subsample': 0.762146427233234, 'colsample_bytree': 0.9947077044208568, 'max_depth': 3, 'min_child_weight': 1, 'eta': 0.003285628947394981, 'gamma': 3.3925995204077997, 'rate_drop': 0.0002862323202902592, 'skip_drop': 3.7400668282337433e-06}. Best is trial 12 with value: -1.6151127621482453.       
[I 2025-06-29 22:47:23,003] Trial 18 finished with value: -1.648726895685784 and parameters: {'booster': 'gbtree', 'lambda': 1.2743317997448511, 'alpha': 0.3831303861818867, 'subsample': 0.86142814586098, 'colsample_bytree': 0.8929782606326863, 'max_depth': 9, 'min_child_weight': 4, 'eta': 0.1053511150169798, 'gamma': 1.079155734072177}. Best is trial 12 with value: -1.6151127621482453.
[I 2025-06-29 22:47:26,738] Trial 19 finished with value: -1.9638160683970014 and parameters: {'booster': 'dart', 'lambda': 0.021717386197710634, 'alpha': 0.00038786574513504523, 'subsample': 0.8017898269088601, 'colsample_bytree': 0.7814093154640491, 'max_depth': 7, 'min_child_weight': 7, 'eta': 0.01777291936024331, 'gamma': 0.17767033816419442, 'rate_drop': 0.859427840143945, 'skip_drop': 0.00040304025215120195}. Best is trial 12 with value: -1.6151127621482453.        
[I 2025-06-29 22:47:34,946] Trial 20 finished with value: -1.6712751931814658 and parameters: {'booster': 'dart', 'lambda': 0.005143133271886543, 'alpha': 0.013792126116890997, 'subsample': 0.9966655085912022, 'colsample_bytree': 0.7826467162167421, 'max_depth': 9, 'min_child_weight': 8, 'eta': 0.004832609608654159, 'gamma': 3.5091419484832516, 'rate_drop': 0.009049224248392098, 'skip_drop': 0.01883548813960096}. Best is trial 12 with value: -1.6151127621482453.
[I 2025-06-29 22:47:35,977] Trial 21 finished with value: -1.6417741814550217 and parameters: {'booster': 'dart', 'lambda': 3.3840350514635657e-07, 'alpha': 1.8446068847853476e-06, 'subsample': 0.6056589094195703, 'colsample_bytree': 0.9673780067097651, 'max_depth': 9, 'min_child_weight': 3, 'eta': 0.019908260078817352, 'gamma': 0.9449147305078773, 'rate_drop': 0.01120167341995533, 'skip_drop': 4.920599910084294e-07}. Best is trial 12 with value: -1.6151127621482453.     
[I 2025-06-29 22:47:40,030] Trial 22 finished with value: -1.893311176754187 and parameters: {'booster': 'dart', 'lambda': 9.027296940208518e-06, 'alpha': 2.5391867912374346e-06, 'subsample': 0.7399975399305105, 'colsample_bytree': 0.9051731385793249, 'max_depth': 8, 'min_child_weight': 3, 'eta': 0.030120091525875595, 'gamma': 1.3559948533979314, 'rate_drop': 0.8352567788851246, 'skip_drop': 1.542422081541672e-07}. Best is trial 12 with value: -1.6151127621482453.        
[I 2025-06-29 22:47:42,677] Trial 23 finished with value: -1.6172638399874948 and parameters: {'booster': 'dart', 'lambda': 0.00032628841718972595, 'alpha': 3.930723539189783e-08, 'subsample': 0.8903658547721777, 'colsample_bytree': 0.989867656936474, 'max_depth': 9, 'min_child_weight': 3, 'eta': 0.009939506521226198, 'gamma': 0.4895579123261551, 'rate_drop': 0.0033057877348376266, 'skip_drop': 1.6784281388824452e-06}. Best is trial 12 with value: -1.6151127621482453.    
[I 2025-06-29 22:47:46,081] Trial 24 finished with value: -1.6163080637382876 and parameters: {'booster': 'dart', 'lambda': 0.0009041947060539259, 'alpha': 2.406651084450431e-08, 'subsample': 0.9015424909405291, 'colsample_bytree': 0.9200176188023015, 'max_depth': 7, 'min_child_weight': 5, 'eta': 0.00886701744438963, 'gamma': 0.5863671454957156, 'rate_drop': 3.8521732035754076e-05, 'skip_drop': 2.9729354599079295e-06}. Best is trial 12 with value: -1.6151127621482453.    
[I 2025-06-29 22:47:54,012] Trial 25 finished with value: -1.6289360977442753 and parameters: {'booster': 'dart', 'lambda': 1.8593206045946657, 'alpha': 0.00023224807551314844, 'subsample': 0.9400604868982089, 'colsample_bytree': 0.9289746448385816, 'max_depth': 6, 'min_child_weight': 5, 'eta': 0.005411468980299183, 'gamma': 2.0231116375561404, 'rate_drop': 2.7859884341566965e-05, 'skip_drop': 2.583613467006429e-05}. Best is trial 12 with value: -1.6151127621482453.      
[I 2025-06-29 22:47:54,325] Trial 26 finished with value: -1.6509279348357397 and parameters: {'booster': 'gbtree', 'lambda': 0.06753449872095221, 'alpha': 0.6931965499264388, 'subsample': 0.8292866678894347, 'colsample_bytree': 0.7993325014698015, 'max_depth': 7, 'min_child_weight': 6, 'eta': 0.012036813756143658, 'gamma': 0.001981103512501692}. Best is trial 12 with value: -1.6151127621482453.
[I 2025-06-29 22:48:02,302] Trial 27 finished with value: -1.7021046198585406 and parameters: {'booster': 'dart', 'lambda': 0.0034710501506658013, 'alpha': 0.007085852319946733, 'subsample': 0.9024166798385125, 'colsample_bytree': 0.8679414377662192, 'max_depth': 5, 'min_child_weight': 5, 'eta': 0.002109216970447408, 'gamma': 0.5030842684762226, 'rate_drop': 2.578124257675645e-06, 'skip_drop': 1.053979478641691e-08}. Best is trial 12 with value: -1.6151127621482453.      
[I 2025-06-29 22:48:04,304] Trial 28 finished with value: -1.64300294244549 and parameters: {'booster': 'dart', 'lambda': 8.364656786261539e-05, 'alpha': 1.4979498885416108e-08, 'subsample': 0.7664161678840663, 'colsample_bytree': 0.6652586539723702, 'max_depth': 8, 'min_child_weight': 4, 'eta': 0.026264719241387444, 'gamma': 1.4784505306131814, 'rate_drop': 6.903825723199991e-05, 'skip_drop': 0.07939825131852317}. Best is trial 12 with value: -1.6151127621482453.        
[I 2025-06-29 22:48:12,851] Trial 29 finished with value: -1.659587952320008 and parameters: {'booster': 'dart', 'lambda': 0.0008189674989011328, 'alpha': 0.0016025702174246562, 'subsample': 0.9425727458841311, 'colsample_bytree': 0.9174137065995658, 'max_depth': 6, 'min_child_weight': 6, 'eta': 0.002419390388820148, 'gamma': 1.241855030803111, 'rate_drop': 2.7584639170795115e-07, 'skip_drop': 0.00021434524498102606}. Best is trial 12 with value: -1.6151127621482453.     
[I 2025-06-29 22:48:19,627] Trial 30 finished with value: -1.6335489238749143 and parameters: {'booster': 'dart', 'lambda': 0.8795483474554984, 'alpha': 1.1357766514402626e-05, 'subsample': 0.8390187050705478, 'colsample_bytree': 0.8577169657996335, 'max_depth': 7, 'min_child_weight': 1, 'eta': 0.008399513625436126, 'gamma': 2.5480780274636086, 'rate_drop': 0.00022508668023940963, 'skip_drop': 1.6825852791782982e-06}. Best is trial 12 with value: -1.6151127621482453.     
[I 2025-06-29 22:48:21,894] Trial 31 finished with value: -1.6314338777328679 and parameters: {'booster': 'dart', 'lambda': 0.00015218034140924175, 'alpha': 1.4492337549799578e-08, 'subsample': 0.906774698097034, 'colsample_bytree': 0.992702394377463, 'max_depth': 9, 'min_child_weight': 2, 'eta': 0.010939302484865125, 'gamma': 0.38632164597881635, 'rate_drop': 0.001907357143811292, 'skip_drop': 3.222018939364139e-06}. Best is trial 12 with value: -1.6151127621482453.     
[I 2025-06-29 22:48:24,674] Trial 32 finished with value: -1.6295747281500204 and parameters: {'booster': 'dart', 'lambda': 4.667145937718804e-06, 'alpha': 2.423912534986748e-07, 'subsample': 0.8848346864669063, 'colsample_bytree': 0.9921461126142881, 'max_depth': 10, 'min_child_weight': 3, 'eta': 0.007708641574574959, 'gamma': 0.5894147074616393, 'rate_drop': 1.232820185796039e-05, 'skip_drop': 1.259424933271822e-06}. Best is trial 12 with value: -1.6151127621482453.    
[I 2025-06-29 22:48:25,409] Trial 33 finished with value: -1.677715283456155 and parameters: {'booster': 'dart', 'lambda': 0.00039834856636389223, 'alpha': 6.350903918954015e-07, 'subsample': 0.9581429651682234, 'colsample_bytree': 0.965257580390803, 'max_depth': 8, 'min_child_weight': 5, 'eta': 0.039041793771383296, 'gamma': 0.6878854146510558, 'rate_drop': 0.003630291483160465, 'skip_drop': 6.182406282272986e-08}. Best is trial 12 with value: -1.6151127621482453.       
[I 2025-06-29 22:48:33,774] Trial 34 finished with value: -1.620689520148953 and parameters: {'booster': 'dart', 'lambda': 2.88889002126972e-05, 'alpha': 1.9117054896800397e-08, 'subsample': 0.7868632104389846, 'colsample_bytree': 0.9233892948431063, 'max_depth': 7, 'min_child_weight': 4, 'eta': 0.004192604379315495, 'gamma': 4.586231545099621, 'rate_drop': 0.0003230335031916259, 'skip_drop': 1.1844572327160196e-05}. Best is trial 12 with value: -1.6151127621482453.      
[I 2025-06-29 22:48:35,767] Trial 35 finished with value: -1.654013343261438 and parameters: {'booster': 'dart', 'lambda': 0.0066464076688711096, 'alpha': 4.1206486913615515e-08, 'subsample': 0.5053892047648636, 'colsample_bytree': 0.8237986889179951, 'max_depth': 9, 'min_child_weight': 3, 'eta': 0.013805821593422217, 'gamma': 1.0290965352430128, 'rate_drop': 6.802122665257758e-05, 'skip_drop': 7.174075937573765e-05}. Best is trial 12 with value: -1.6151127621482453.     
[I 2025-06-29 22:48:35,940] Trial 36 finished with value: -1.657992715462195 and parameters: {'booster': 'gbtree', 'lambda': 0.07026460412652165, 'alpha': 0.004335634127983766, 'subsample': 0.8384628261407818, 'colsample_bytree': 0.9995128191240572, 'max_depth': 8, 'min_child_weight': 7, 'eta': 0.02681614472277187, 'gamma': 0.42672143543594854}. Best is trial 12 with value: -1.6151127621482453.
[I 2025-06-29 22:48:43,379] Trial 37 finished with value: -1.9544982961712836 and parameters: {'booster': 'dart', 'lambda': 8.396870301775866e-08, 'alpha': 4.606775417748694e-07, 'subsample': 0.920957784718654, 'colsample_bytree': 0.9508687631424259, 'max_depth': 10, 'min_child_weight': 2, 'eta': 0.006142759504813325, 'gamma': 3.4263679534902343, 'rate_drop': 0.27573579792571035, 'skip_drop': 7.642864243028526e-07}. Best is trial 12 with value: -1.6151127621482453.       
[I 2025-06-29 22:48:43,711] Trial 38 finished with value: -1.669479353905126 and parameters: {'booster': 'gbtree', 'lambda': 0.001147513139626371, 'alpha': 0.06660088904073296, 'subsample': 0.8815978841072136, 'colsample_bytree': 0.7025846417090651, 'max_depth': 6, 'min_child_weight': 4, 'eta': 0.0029895786596238864, 'gamma': 0.7160286730004264}. Best is trial 12 with value: -1.6151127621482453.
[I 2025-06-29 22:48:44,814] Trial 39 finished with value: -1.6176970779090776 and parameters: {'booster': 'dart', 'lambda': 0.00017237737017029007, 'alpha': 5.432437149993178e-06, 'subsample': 0.7152992050981799, 'colsample_bytree': 0.8993657902764175, 'max_depth': 7, 'min_child_weight': 6, 'eta': 0.023233280103732507, 'gamma': 2.1441525624956146, 'rate_drop': 0.004745706101604465, 'skip_drop': 5.865436315648696e-08}. Best is trial 12 with value: -1.6151127621482453.     
[I 2025-06-29 22:48:50,508] Trial 40 finished with value: -1.6310678109002257 and parameters: {'booster': 'dart', 'lambda': 0.09917301078511749, 'alpha': 0.0005132906191772976, 'subsample': 0.7753096390015897, 'colsample_bytree': 0.9562655710274878, 'max_depth': 5, 'min_child_weight': 5, 'eta': 0.04522755701320988, 'gamma': 4.6060554341459, 'rate_drop': 0.07205981979636035, 'skip_drop': 0.0008877663856757061}. Best is trial 12 with value: -1.6151127621482453.
[I 2025-06-29 22:48:51,739] Trial 41 finished with value: -1.6249403889899243 and parameters: {'booster': 'dart', 'lambda': 9.466909093384728e-05, 'alpha': 1.2126635979834303e-07, 'subsample': 0.6850602267727494, 'colsample_bytree': 0.8592456945836352, 'max_depth': 7, 'min_child_weight': 6, 'eta': 0.0221723793587985, 'gamma': 3.0739264135136057, 'rate_drop': 0.0007862083187301696, 'skip_drop': 5.1375270763507454e-08}. Best is trial 12 with value: -1.6151127621482453.     
[I 2025-06-29 22:48:53,434] Trial 42 finished with value: -1.6216367870018342 and parameters: {'booster': 'dart', 'lambda': 0.0003623583742994348, 'alpha': 3.813762718116951e-06, 'subsample': 0.7345834077755984, 'colsample_bytree': 0.8138539940378472, 'max_depth': 8, 'min_child_weight': 7, 'eta': 0.015619249284679088, 'gamma': 2.3462207019923826, 'rate_drop': 0.004416138050180526, 'skip_drop': 2.988603456999405e-08}. Best is trial 12 with value: -1.6151127621482453.      
[I 2025-06-29 22:48:56,511] Trial 43 finished with value: -1.6140456574984703 and parameters: {'booster': 'dart', 'lambda': 4.1291436030893244e-05, 'alpha': 5.800421913919733e-05, 'subsample': 0.7031450716187588, 'colsample_bytree': 0.9007819922684056, 'max_depth': 7, 'min_child_weight': 4, 'eta': 0.00945232617103373, 'gamma': 2.1277013156285847, 'rate_drop': 0.000754824648695353, 'skip_drop': 1.8505925772666368e-07}. Best is trial 43 with value: -1.6140456574984703.     
[I 2025-06-29 22:49:00,793] Trial 44 finished with value: -1.6239299039278117 and parameters: {'booster': 'dart', 'lambda': 3.845979882956419e-05, 'alpha': 6.66526085931595e-08, 'subsample': 0.6396695477163139, 'colsample_bytree': 0.9759780441016911, 'max_depth': 9, 'min_child_weight': 4, 'eta': 0.009537087363198195, 'gamma': 1.2175646458742813, 'rate_drop': 0.0005750320673042494, 'skip_drop': 1.2610803373227133e-07}. Best is trial 43 with value: -1.6140456574984703.     
[I 2025-06-29 22:49:05,297] Trial 45 finished with value: -1.6303353308365234 and parameters: {'booster': 'dart', 'lambda': 0.014794577851785269, 'alpha': 6.712875583393885e-05, 'subsample': 0.8154744910054736, 'colsample_bytree': 0.9385448277384131, 'max_depth': 6, 'min_child_weight': 2, 'eta': 0.00686736128391717, 'gamma': 1.5690776520551988, 'rate_drop': 0.00011475713609987345, 'skip_drop': 3.724037891059567e-07}. Best is trial 43 with value: -1.6140456574984703.      
[I 2025-06-29 22:49:05,577] Trial 46 finished with value: -1.6188593160323514 and parameters: {'booster': 'gbtree', 'lambda': 2.7587754849628916e-06, 'alpha': 1.4654660305969895, 'subsample': 0.8516734014541328, 'colsample_bytree': 0.8840858299309204, 'max_depth': 8, 'min_child_weight': 3, 'eta': 0.010555579208905649, 'gamma': 2.769090647580051}. Best is trial 43 with value: -1.6140456574984703.
