PS D:\machile_nearning\wecode_score_prediction\dataset-core-extracted\XGBoost-TH> python .\train_hard_solved_unscaled.py
[I 2025-06-23 10:42:58,766] A new study created in memory with name: no-name-60aeeaad-3772-49d3-9688-0ed2a71300b2
[I 2025-06-23 10:43:06,012] Trial 0 finished with value: -1.529332971224056 and parameters: {'booster': 'dart', 'lambda': 3.897210319932045, 'alpha': 2.553677560443822e-08, 'subsample': 0.9003219758686228, 'colsample_bytree': 0.8174248545825291, 'max_depth': 6, 'min_child_weight': 1, 'eta': 0.016076599173320567, 'gamma': 3.686606351397365, 'rate_drop': 4.2264838201511265e-07, 'skip_drop': 0.0022617300138871527}. Best is trial 0 with value: -1.529332971224056.
[I 2025-06-23 10:43:07,255] Trial 1 finished with value: -1.5415884199086287 and parameters: {'booster': 'dart', 'lambda': 0.01882663368922882, 'alpha': 1.3051926658358657, 'subsample': 0.8794689877716597, 'colsample_bytree': 0.7349692188751837, 'max_depth': 7, 'min_child_weight': 4, 'eta': 0.03116884592495206, 'gamma': 1.7045503342389838, 'rate_drop': 3.127437224291214e-08, 'skip_drop': 2.7470330509933776e-08}. Best is trial 0 with value: -1.529332971224056.
[I 2025-06-23 10:43:08,035] Trial 2 finished with value: -1.5498279704697242 and parameters: {'booster': 'dart', 'lambda': 1.2731387223392293e-07, 'alpha': 9.72836162600334e-07, 'subsample': 0.9199659697060594, 'colsample_bytree': 0.7719895112446986, 'max_depth': 3, 'min_child_weight': 3, 'eta': 0.205898152455163, 'gamma': 4.245501519865367, 'rate_drop': 1.6704515431305865e-06, 'skip_drop': 1.6162908004301942e-07}. Best is trial 0 with value: -1.529332971224056.
[I 2025-06-23 10:43:08,091] Trial 3 finished with value: -1.4810449525628466 and parameters: {'booster': 'gbtree', 'lambda': 0.0003074184782031959, 'alpha': 5.948492300676634e-06, 'subsample': 0.570191216874882, 'colsample_bytree': 0.9777277686034624, 'max_depth': 6, 'min_child_weight': 6, 'eta': 0.09895882921491467, 'gamma': 4.794758985900249}. Best is trial 3 with value: -1.4810449525628466.
[I 2025-06-23 10:43:15,484] Trial 4 finished with value: -1.6286237468780733 and parameters: {'booster': 'dart', 'lambda': 0.0008372149901924133, 'alpha': 1.1277321228191374e-07, 'subsample': 0.863786534693994, 'colsample_bytree': 0.7896049885381644, 'max_depth': 6, 'min_child_weight': 2, 'eta': 0.003378170082613042, 'gamma': 2.8480139829222955, 'rate_drop': 2.442416013773875e-06, 'skip_drop': 0.004911860195411906}. Best is trial 3 with value: -1.4810449525628466.
[I 2025-06-23 10:43:16,658] Trial 5 finished with value: -1.6633332455595085 and parameters: {'booster': 'dart', 'lambda': 0.0007971192688007962, 'alpha': 1.1875977890220824e-05, 'subsample': 0.7764039097378606, 'colsample_bytree': 0.840938579888221, 'max_depth': 5, 'min_child_weight': 3, 'eta': 0.22470235292554278, 'gamma': 3.8442991535101454, 'rate_drop': 0.005589763345376348, 'skip_drop': 1.83483516180988e-05}. Best is trial 3 with value: -1.4810449525628466.
[I 2025-06-23 10:43:21,454] Trial 6 finished with value: -1.7116182077304984 and parameters: {'booster': 'dart', 'lambda': 8.66884601731899, 'alpha': 0.0008522678319953029, 'subsample': 0.857162932353597, 'colsample_bytree': 0.6602891369576768, 'max_depth': 3, 'min_child_weight': 7, 'eta': 0.1661258205531266, 'gamma': 2.892477835393461, 'rate_drop': 0.4666216608365186, 'skip_drop': 0.0015968859070868938}. Best is trial 3 with value: -1.4810449525628466.
[I 2025-06-23 10:43:22,532] Trial 7 finished with value: -1.5847762025288712 and parameters: {'booster': 'dart', 'lambda': 0.0004134387221091013, 'alpha': 0.20136903335383552, 'subsample': 0.9057936474132732, 'colsample_bytree': 0.7290479216317507, 'max_depth': 9, 'min_child_weight': 6, 'eta': 0.15995828896221678, 'gamma': 2.1439150095315114, 'rate_drop': 4.589330591026624e-06, 'skip_drop': 1.431437689117167e-05}. Best is trial 3 with value: -1.4810449525628466.
[I 2025-06-23 10:43:22,726] Trial 8 finished with value: -1.490291715354437 and parameters: {'booster': 'gbtree', 'lambda': 0.43056818091532834, 'alpha': 4.6345296086254517e-07, 'subsample': 0.5605874685757362, 'colsample_bytree': 0.7218164580826116, 'max_depth': 7, 'min_child_weight': 2, 'eta': 0.01196086656749579, 'gamma': 4.85008168691286}. Best is trial 3 with value: -1.4810449525628466.
[I 2025-06-23 10:43:29,688] Trial 9 finished with value: -2.025423094123256 and parameters: {'booster': 'dart', 'lambda': 7.113313776202062e-05, 'alpha': 2.261253034572197e-06, 'subsample': 0.5665003669824953, 'colsample_bytree': 0.864816118084239, 'max_depth': 7, 'min_child_weight': 1, 'eta': 0.003950134718556476, 'gamma': 4.261040309123477, 'rate_drop': 0.07882816034498796, 'skip_drop': 1.4237696705686203e-06}. Best is trial 3 with value: -1.4810449525628466.
[I 2025-06-23 10:43:29,803] Trial 10 finished with value: -1.4824595959960256 and parameters: {'booster': 'gbtree', 'lambda': 1.943335122364851e-06, 'alpha': 0.0010806471197839231, 'subsample': 0.6564145724559599, 'colsample_bytree': 0.9876360195279791, 'max_depth': 10, 'min_child_weight': 10, 'eta': 0.05427862459612296, 'gamma': 0.11381071241162655}. Best is trial 3 with value: -1.4810449525628466.
[I 2025-06-23 10:43:29,914] Trial 11 finished with value: -1.4812442658263516 and parameters: {'booster': 'gbtree', 'lambda': 9.188893845446373e-07, 'alpha': 0.001232959579517578, 'subsample': 0.6527902298061745, 'colsample_bytree': 0.9964238007960947, 'max_depth': 10, 'min_child_weight': 10, 'eta': 0.05080710170700675, 'gamma': 0.06301148857710095}. Best is trial 3 with value: -1.4810449525628466.
[I 2025-06-23 10:43:30,014] Trial 12 finished with value: -1.5006808408896477 and parameters: {'booster': 'gbtree', 'lambda': 4.979592027878681e-06, 'alpha': 8.649570916551124e-05, 'subsample': 0.6637399272614009, 'colsample_bytree': 0.9938030389692044, 'max_depth': 9, 'min_child_weight': 9, 'eta': 0.05462970147346308, 'gamma': 0.22207197638413723}. Best is trial 3 with value: -1.4810449525628466.
[I 2025-06-23 10:43:30,104] Trial 13 finished with value: -1.4581865313792366 and parameters: {'booster': 'gbtree', 'lambda': 1.0432538713324412e-08, 'alpha': 0.01922901240465999, 'subsample': 0.5066361366190819, 'colsample_bytree': 0.9157979765853724, 'max_depth': 5, 'min_child_weight': 9, 'eta': 0.07513556490653522, 'gamma': 1.033516039601481}. Best is trial 13 with value: -1.4581865313792366.
[I 2025-06-23 10:43:30,346] Trial 14 finished with value: -1.95235024790548 and parameters: {'booster': 'gbtree', 'lambda': 2.064913081167865e-08, 'alpha': 0.029136061042120832, 'subsample': 0.501998540659789, 'colsample_bytree': 0.5091102626666943, 'max_depth': 5, 'min_child_weight': 8, 'eta': 0.0010763642914967209, 'gamma': 1.0941926021938846}. Best is trial 13 with value: -1.4581865313792366.
[I 2025-06-23 10:43:30,466] Trial 15 finished with value: -1.4578759320219465 and parameters: {'booster': 'gbtree', 'lambda': 1.0272837638548155e-08, 'alpha': 9.422959549150399, 'subsample': 0.5100700230960928, 'colsample_bytree': 0.8999306296363409, 'max_depth': 4, 'min_child_weight': 5, 'eta': 0.10372730902694227, 'gamma': 1.250691273318719}. Best is trial 15 with value: -1.4578759320219465.
[I 2025-06-23 10:43:30,593] Trial 16 finished with value: -1.442276183322883 and parameters: {'booster': 'gbtree', 'lambda': 1.4083410729322993e-08, 'alpha': 9.918209009122853, 'subsample': 0.5213718697021048, 'colsample_bytree': 0.905785462179657, 'max_depth': 4, 'min_child_weight': 5, 'eta': 0.09567588188119154, 'gamma': 1.010402584274459}. Best is trial 16 with value: -1.442276183322883.
[I 2025-06-23 10:43:30,760] Trial 17 finished with value: -1.5017084434037984 and parameters: {'booster': 'gbtree', 'lambda': 1.7988812251447283e-07, 'alpha': 9.650626581810032, 'subsample': 0.9928925898009137, 'colsample_bytree': 0.9139714681792075, 'max_depth': 4, 'min_child_weight': 5, 'eta': 0.027149340315567018, 'gamma': 0.973072685882928}. Best is trial 16 with value: -1.442276183322883.
[I 2025-06-23 10:43:30,820] Trial 18 finished with value: -1.5072659831730235 and parameters: {'booster': 'gbtree', 'lambda': 1.480238356117117e-05, 'alpha': 3.028478469059095, 'subsample': 0.7437727133684465, 'colsample_bytree': 0.9191364042907143, 'max_depth': 4, 'min_child_weight': 5, 'eta': 0.29893681037086256, 'gamma': 1.6318768312632652}. Best is trial 16 with value: -1.442276183322883.
[I 2025-06-23 10:43:31,026] Trial 19 finished with value: -1.5188438675693958 and parameters: {'booster': 'gbtree', 'lambda': 9.414734660264357e-08, 'alpha': 0.2791617660804612, 'subsample': 0.6097658012912955, 'colsample_bytree': 0.6475669734190701, 'max_depth': 4, 'min_child_weight': 4, 'eta': 0.0073643593665093255, 'gamma': 0.703253066464596}. Best is trial 16 with value: -1.442276183322883.
[I 2025-06-23 10:43:31,091] Trial 20 finished with value: -1.5817498447657496 and parameters: {'booster': 'gbtree', 'lambda': 4.6234245973783846e-07, 'alpha': 0.016251240660077694, 'subsample': 0.7345629584569885, 'colsample_bytree': 0.8795094907306281, 'max_depth': 3, 'min_child_weight': 7, 'eta': 0.12339420665797622, 'gamma': 1.9469796181307386}. Best is trial 16 with value: -1.442276183322883.
[I 2025-06-23 10:43:31,166] Trial 21 finished with value: -1.5049481567282386 and parameters: {'booster': 'gbtree', 'lambda': 4.5156110866485264e-08, 'alpha': 0.021819573033538497, 'subsample': 0.5012354642856407, 'colsample_bytree': 0.9244589639195314, 'max_depth': 5, 'min_child_weight': 7, 'eta': 0.08232512788037417, 'gamma': 1.277181470970405}. Best is trial 16 with value: -1.442276183322883.
[I 2025-06-23 10:43:31,263] Trial 22 finished with value: -1.4863365242126136 and parameters: {'booster': 'gbtree', 'lambda': 1.0474371025432959e-08, 'alpha': 0.3890230258845131, 'subsample': 0.5232388053091673, 'colsample_bytree': 0.9423726973564106, 'max_depth': 4, 'min_child_weight': 4, 'eta': 0.03283527071824467, 'gamma': 0.6016378045662445}. Best is trial 16 with value: -1.442276183322883.
[I 2025-06-23 10:43:31,358] Trial 23 finished with value: -1.4596859321043105 and parameters: {'booster': 'gbtree', 'lambda': 1.0589682785607515e-08, 'alpha': 6.821199742862811, 'subsample': 0.621655664353213, 'colsample_bytree': 0.8830262501110293, 'max_depth': 5, 'min_child_weight': 8, 'eta': 0.08514811787038049, 'gamma': 2.4411509384553765}. Best is trial 16 with value: -1.442276183322883.
[I 2025-06-23 10:43:31,437] Trial 24 finished with value: -1.4997490397050777 and parameters: {'booster': 'gbtree', 'lambda': 3.6164150269099216e-07, 'alpha': 0.07302515735711644, 'subsample': 0.5543556633806804, 'colsample_bytree': 0.9446196315512043, 'max_depth': 4, 'min_child_weight': 5, 'eta': 0.06734352111296962, 'gamma': 0.6584630007180103}. Best is trial 16 with value: -1.442276183322883.
[I 2025-06-23 10:43:31,564] Trial 25 finished with value: -1.4802478256388407 and parameters: {'booster': 'gbtree', 'lambda': 4.914411632875186e-08, 'alpha': 1.3014435408572578, 'subsample': 0.6129631249196555, 'colsample_bytree': 0.8257831810692383, 'max_depth': 5, 'min_child_weight': 6, 'eta': 0.037576184454975965, 'gamma': 1.4256453091584316}. Best is trial 16 with value: -1.442276183322883.
[I 2025-06-23 10:43:31,637] Trial 26 finished with value: -1.4981733654961338 and parameters: {'booster': 'gbtree', 'lambda': 1.0567907113174781e-05, 'alpha': 0.004381224854089782, 'subsample': 0.6901500272105076, 'colsample_bytree': 0.8893969573563125, 'max_depth': 3, 'min_child_weight': 8, 'eta': 0.1329075381906772, 'gamma': 0.9382016608903406}. Best is trial 16 with value: -1.442276183322883.
[I 2025-06-23 10:43:31,785] Trial 27 finished with value: -1.4517808610759568 and parameters: {'booster': 'gbtree', 'lambda': 0.011718502357381451, 'alpha': 7.130225810275697e-05, 'subsample': 0.535927740315283, 'colsample_bytree': 0.8499531797384344, 'max_depth': 4, 'min_child_weight': 9, 'eta': 0.02254199400280132, 'gamma': 2.140083086910581}. Best is trial 16 with value: -1.442276183322883.
[I 2025-06-23 10:43:31,932] Trial 28 finished with value: -1.5095117884357412 and parameters: {'booster': 'gbtree', 'lambda': 0.014893084424225026, 'alpha': 5.3709900294054974e-05, 'subsample': 0.5954702662793827, 'colsample_bytree': 0.8444734764650863, 'max_depth': 4, 'min_child_weight': 3, 'eta': 0.021134664802641954, 'gamma': 2.377061187532531}. Best is trial 16 with value: -1.442276183322883.
[I 2025-06-23 10:43:32,145] Trial 29 finished with value: -1.4554811557736578 and parameters: {'booster': 'gbtree', 'lambda': 0.5792555471099082, 'alpha': 0.00012467427946883782, 'subsample': 0.5414660761374899, 'colsample_bytree': 0.7816257711893131, 'max_depth': 6, 'min_child_weight': 5, 'eta': 0.012705018232424656, 'gamma': 2.976626445174009}. Best is trial 16 with value: -1.442276183322883.
[I 2025-06-23 10:43:32,418] Trial 30 finished with value: -1.477194976754394 and parameters: {'booster': 'gbtree', 'lambda': 0.5786654190728163, 'alpha': 0.00011725303139433227, 'subsample': 0.5417730856997357, 'colsample_bytree': 0.7903779694434874, 'max_depth': 8, 'min_child_weight': 4, 'eta': 0.010208656065067183, 'gamma': 2.9454476780119223}. Best is trial 16 with value: -1.442276183322883.
[I 2025-06-23 10:43:32,669] Trial 31 finished with value: -1.5191104603095376 and parameters: {'booster': 'gbtree', 'lambda': 0.05841649377454172, 'alpha': 1.032365858716416e-05, 'subsample': 0.5344542831210952, 'colsample_bytree': 0.686968454319796, 'max_depth': 6, 'min_child_weight': 5, 'eta': 0.005460489505545822, 'gamma': 3.198024236525766}. Best is trial 16 with value: -1.442276183322883.
[I 2025-06-23 10:43:32,853] Trial 32 finished with value: -1.470468911551574 and parameters: {'booster': 'gbtree', 'lambda': 0.008532602302804533, 'alpha': 0.00022701917697902742, 'subsample': 0.5910545280209412, 'colsample_bytree': 0.8013381074512795, 'max_depth': 3, 'min_child_weight': 6, 'eta': 0.016246726031571096, 'gamma': 2.002822421686829}. Best is trial 16 with value: -1.442276183322883.
[I 2025-06-23 10:43:33,020] Trial 33 finished with value: -1.4568122997426918 and parameters: {'booster': 'gbtree', 'lambda': 1.301721572593404, 'alpha': 1.1970438829664052e-08, 'subsample': 0.5328370461051924, 'colsample_bytree': 0.7672257364964732, 'max_depth': 6, 'min_child_weight': 5, 'eta': 0.0207998367186266, 'gamma': 3.4260725887640144}. Best is trial 16 with value: -1.442276183322883.
[I 2025-06-23 10:43:33,254] Trial 34 finished with value: -1.4593357447411448 and parameters: {'booster': 'gbtree', 'lambda': 1.0285867181614856, 'alpha': 1.0163681711197397e-08, 'subsample': 0.5778535760994274, 'colsample_bytree': 0.7544494693788031, 'max_depth': 7, 'min_child_weight': 4, 'eta': 0.012381736913377241, 'gamma': 3.4342056626763227}. Best is trial 16 with value: -1.442276183322883.
[I 2025-06-23 10:43:33,393] Trial 35 finished with value: -1.5101727405168768 and parameters: {'booster': 'gbtree', 'lambda': 0.06240969768251637, 'alpha': 2.4186917110045365e-07, 'subsample': 0.5371551756910629, 'colsample_bytree': 0.7644023022551568, 'max_depth': 8, 'min_child_weight': 3, 'eta': 0.022092084578006023, 'gamma': 4.017333051686044}. Best is trial 16 with value: -1.442276183322883.
[I 2025-06-23 10:43:40,949] Trial 36 finished with value: -1.6938651600722772 and parameters: {'booster': 'dart', 'lambda': 0.003934226179250891, 'alpha': 5.525149556850782e-08, 'subsample': 0.8246269275171163, 'colsample_bytree': 0.6026737766334413, 'max_depth': 6, 'min_child_weight': 6, 'eta': 0.0023103914609746722, 'gamma': 3.487574321228673, 'rate_drop': 0.000315757124423303, 'skip_drop': 0.7960521400714331}. Best is trial 16 with value: -1.442276183322883.
[I 2025-06-23 10:43:41,156] Trial 37 finished with value: -1.4457276088694049 and parameters: {'booster': 'gbtree', 'lambda': 1.6372713993861832, 'alpha': 2.178057992917031e-05, 'subsample': 0.631857685997148, 'colsample_bytree': 0.8162452376562956, 'max_depth': 6, 'min_child_weight': 7, 'eta': 0.019056316518591392, 'gamma': 2.756282816725287}. Best is trial 16 with value: -1.442276183322883.
[I 2025-06-23 10:43:48,945] Trial 38 finished with value: -1.4607944170646154 and parameters: {'booster': 'dart', 'lambda': 0.1302928761232637, 'alpha': 3.1605729361587226e-05, 'subsample': 0.6997111553087092, 'colsample_bytree': 0.8208989641324953, 'max_depth': 8, 'min_child_weight': 9, 'eta': 0.00866102570152599, 'gamma': 2.674133107877342, 'rate_drop': 0.0010297645981902197, 'skip_drop': 0.9185796272784832}. Best is trial 16 with value: -1.442276183322883.
[I 2025-06-23 10:43:49,199] Trial 39 finished with value: -1.4628757883841457 and parameters: {'booster': 'gbtree', 'lambda': 2.8688892044462717, 'alpha': 3.751424011678167e-06, 'subsample': 0.6428186199189015, 'colsample_bytree': 0.853477262130689, 'max_depth': 7, 'min_child_weight': 7, 'eta': 0.014125506384874425, 'gamma': 2.2521043584472946}. Best is trial 16 with value: -1.442276183322883.
[I 2025-06-23 10:43:56,648] Trial 40 finished with value: -1.5390796678169603 and parameters: {'booster': 'dart', 'lambda': 0.002073041346397991, 'alpha': 2.130850610558537e-05, 'subsample': 0.5778746456182634, 'colsample_bytree': 0.7004537551547243, 'max_depth': 5, 'min_child_weight': 8, 'eta': 0.004934521879665879, 'gamma': 2.6945312059943114, 'rate_drop': 1.0006636201637716e-08, 'skip_drop': 0.06990537653830582}. Best is trial 16 with value: -1.442276183322883.
[I 2025-06-23 10:43:56,892] Trial 41 finished with value: -1.455756371976019 and parameters: {'booster': 'gbtree', 'lambda': 8.225675505618714, 'alpha': 0.00026347563883466463, 'subsample': 0.5489560461852151, 'colsample_bytree': 0.7826627968569313, 'max_depth': 6, 'min_child_weight': 6, 'eta': 0.02019718264656706, 'gamma': 3.1382135016688375}. Best is trial 16 with value: -1.442276183322883.
[I 2025-06-23 10:43:57,020] Trial 42 finished with value: -1.4774264394259768 and parameters: {'booster': 'gbtree', 'lambda': 3.912051316982353, 'alpha': 0.0002715254463055322, 'subsample': 0.6224856399049256, 'colsample_bytree': 0.8038349794942331, 'max_depth': 6, 'min_child_weight': 7, 'eta': 0.03958378927341997, 'gamma': 3.179081671553381}. Best is trial 16 with value: -1.442276183322883.
[I 2025-06-23 10:43:57,225] Trial 43 finished with value: -1.465273007593195 and parameters: {'booster': 'gbtree', 'lambda': 0.2740777301131264, 'alpha': 0.0025829223193951758, 'subsample': 0.5693272008630831, 'colsample_bytree': 0.7388354139708844, 'max_depth': 6, 'min_child_weight': 6, 'eta': 0.026736842296760245, 'gamma': 1.699848712195084}. Best is trial 16 with value: -1.442276183322883.
[I 2025-06-23 10:43:57,569] Trial 44 finished with value: -1.5065190287829255 and parameters: {'booster': 'gbtree', 'lambda': 7.9685228490182585, 'alpha': 0.000506974236286274, 'subsample': 0.7843171732610223, 'colsample_bytree': 0.8352410852834257, 'max_depth': 7, 'min_child_weight': 6, 'eta': 0.006701806352554398, 'gamma': 3.0451984268997743}. Best is trial 16 with value: -1.442276183322883.
[I 2025-06-23 10:43:57,746] Trial 45 finished with value: -1.4394774297457305 and parameters: {'booster': 'gbtree', 'lambda': 0.1416262721878584, 'alpha': 2.6734768260781637e-06, 'subsample': 0.5543840601933538, 'colsample_bytree': 0.7817480127787945, 'max_depth': 5, 'min_child_weight': 10, 'eta': 0.017033190894532712, 'gamma': 2.6129193428126287}. Best is trial 45 with value: -1.4394774297457305.
[I 2025-06-23 10:43:57,975] Trial 46 finished with value: -1.4467733175518562 and parameters: {'booster': 'gbtree', 'lambda': 0.04201749207549218, 'alpha': 1.114400419313118e-06, 'subsample': 0.5912700825961421, 'colsample_bytree': 0.9576916937210614, 'max_depth': 5, 'min_child_weight': 10, 'eta': 0.009751669298250231, 'gamma': 2.6158250689671756}. Best is trial 45 with value: -1.4394774297457305.
[I 2025-06-23 10:44:05,643] Trial 47 finished with value: -1.4664009236007498 and parameters: {'booster': 'dart', 'lambda': 0.00011426805060098024, 'alpha': 1.849462413432041e-06, 'subsample': 0.6809621086755313, 'colsample_bytree': 0.9549182512000222, 'max_depth': 5, 'min_child_weight': 10, 'eta': 0.00970096899287598, 'gamma': 2.5508072950090033, 'rate_drop': 3.7328827774142755e-05, 'skip_drop': 0.00010463746750022027}. Best is trial 45 with value: -1.4394774297457305.
[I 2025-06-23 10:44:05,757] Trial 48 finished with value: -1.4711852772743208 and parameters: {'booster': 'gbtree', 'lambda': 0.03231802452758282, 'alpha': 6.173572636618078e-07, 'subsample': 0.6397063389797755, 'colsample_bytree': 0.9716645773550692, 'max_depth': 5, 'min_child_weight': 9, 'eta': 0.044806981728555954, 'gamma': 2.0627635971320366}. Best is trial 45 with value: -1.4394774297457305.
