[I 2025-06-23 10:44:05,977] Trial 49 finished with value: -1.6903390137606906 and parameters: {'booster': 'gbtree', 'lambda': 0.16223127105864316, 'alpha': 1.3436823507759092e-06, 'subsample': 0.5923003227992729, 'colsample_bytree': 0.8650783423231188, 'max_depth': 4, 'min_child_weight': 10, 'eta': 0.0023016131758717326, 'gamma': 1.8234387371244474}. Best is trial 45 with value: -1.4394774297457305.
Number of finished trials:  50
Best trial:
  Value (RMSE): 1.4395
  MSE: 2.0721
  R²: 0.5918
Model saved to th_student_score_predictor_optuna_xgb_unscaled.pkl
PS D:\machile_nearning\wecode_score_prediction\dataset-core-extracted\XGBoost-TH> python .\predict_unscaled.py
Found 735 students without TH scores
C:\Users\ASUS\AppData\Local\Packages\PythonSoftwareFoundation.Python.3.13_qbz5n2kfra8p0\LocalCache\local-packages\Python313\site-packages\xgboost\core.py:729: UserWarning: [10:45:51] WARNING: C:\actions-runner\_work\xgboost\xgboost\src\common\error_msg.cc:27: The tree method `gpu_hist` is deprecated since 2.0.0. To use GPU training, set the `device` parameter to CUDA instead.

    E.g. tree_method = "hist", device = "cuda"

  return func(**kwargs)
Predictions saved to th_score_predictions.csv
Sample predictions:
                                  student_id  predicted_th_score
3   0134f9f410c65ad0e8c2254a7e9288670e02a183            7.380652
20  035f97702f2c01d26ab1fae8f39ea2f98a0caa3c            7.414898
40  06024da8147b5cf6105beb4c403f67cf1ff0aea1            9.930064
68  0aaebc88f6106684d6993c156104c1ef36cf94e0            7.323292
80  0bf111a9caedf02804f6991792490e63bc21058a            9.589968