PS D:\machile_nearning\wecode_score_prediction\dataset-practice-separation\XGBoost-CK-Threshold-15>python .\train.py   
[I 2025-06-29 22:54:33,434] A new study created in memory with name: no-name-c12f1b48-e92e-4b4a-868a-275f9395a4b9
[I 2025-06-29 22:54:33,888] Trial 0 finished with value: -1.7384060052991388 and parameters: {'booster': 'gbtree', 'lambda': 0.5551902341663538, 'alpha': 0.3273253650403616, 'subsample': 0.6977643155615811, 'colsample_bytree': 0.7191566120935164, 'max_depth': 8, 'min_child_weight': 9, 'eta': 0.0019564985920522966, 'gamma': 0.03268471548191987}. Best is trial 0 with value: -1.7384060052991388.
[I 2025-06-29 22:54:42,584] Trial 1 finished with value: -1.813103119074228 and parameters: {'booster': 'dart', 'lambda': 0.0002739534064203462, 'alpha': 6.720338495839279e-05, 'subsample': 0.7165360085051025, 'colsample_bytree': 0.8341856930499222, 'max_depth': 5, 'min_child_weight': 1, 'eta': 0.0017801412062172814, 'gamma': 4.246917897016052, 'rate_drop': 0.007731905444927235, 'skip_drop': 2.847464353965696e-06}. Best is trial 0 with value: -1.7384060052991388.
[I 2025-06-29 22:54:42,918] Trial 2 finished with value: -1.758272930114897 and parameters: {'booster': 'dart', 'lambda': 0.21713788900338604, 'alpha': 0.03872648215403819, 'subsample': 0.504665582671032, 'colsample_bytree': 0.6610050547473698, 'max_depth': 9, 'min_child_weight': 7, 'eta': 0.11751850575332928, 'gamma': 2.302796540127798, 'rate_drop': 6.132265842333222e-08, 'skip_drop': 0.25348586022528274}. Best is trial 0 with value: -1.7384060052991388.
[I 2025-06-29 22:54:42,959] Trial 3 finished with value: -1.8181905358681578 and parameters: {'booster': 'gbtree', 'lambda': 1.7242014738906746e-05, 'alpha': 0.004964019953347623, 'subsample': 0.6039105964344915, 'colsample_bytree': 0.7717219576143595, 'max_depth': 9, 'min_child_weight': 10, 'eta': 0.2408683825105057, 'gamma': 2.9107148392405833}. Best is trial 0 with value: -1.7384060052991388.
[I 2025-06-29 22:54:43,333] Trial 4 finished with value: -1.7201611639704446 and parameters: {'booster': 'dart', 'lambda': 9.661859375362995e-06, 'alpha': 4.909420319554864e-05, 'subsample': 0.7646292248145873, 'colsample_bytree': 0.5738344787260632, 'max_depth': 10, 'min_child_weight': 9, 'eta': 0.09324821938298218, 'gamma': 0.7151882199699527, 'rate_drop': 0.0059138841395265, 'skip_drop': 3.0958511552016056e-05}. Best is trial 4 with value: -1.7201611639704446.
[I 2025-06-29 22:54:43,571] Trial 5 finished with value: -1.6973720952535427 and parameters: {'booster': 'gbtree', 'lambda': 0.003175258343175502, 'alpha': 7.846040942790393, 'subsample': 0.6381388126136893, 'colsample_bytree': 0.5373016755981299, 'max_depth': 10, 'min_child_weight': 3, 'eta': 0.017415086091313477, 'gamma': 2.3757303440629842}. Best is trial 5 with value: -1.6973720952535427.
[I 2025-06-29 22:54:53,349] Trial 6 finished with value: -1.671990924341051 and parameters: {'booster': 'dart', 'lambda': 1.1118870939683647e-06, 'alpha': 0.0002089641290917771, 'subsample': 0.9690470566091707, 'colsample_bytree': 0.7135398261264863, 'max_depth': 6, 'min_child_weight': 7, 'eta': 0.007458519117299943, 'gamma': 0.7755109831601215, 'rate_drop': 0.016647179464983383, 'skip_drop': 0.21913500004013642}. Best is trial 6 with value: -1.671990924341051.
[I 2025-06-29 22:55:02,591] Trial 7 finished with value: -1.9095982138362821 and parameters: {'booster': 'dart', 'lambda': 7.2377458760443085, 'alpha': 1.2601536803260283, 'subsample': 0.5812755672939487, 'colsample_bytree': 0.8615191238364616, 'max_depth': 10, 'min_child_weight': 1, 'eta': 0.0010717196495280631, 'gamma': 3.4546517503357825, 'rate_drop': 0.005495200930747137, 'skip_drop': 0.01019875928593171}. Best is trial 6 with value: -1.671990924341051.
[I 2025-06-29 22:55:03,934] Trial 8 finished with value: -1.7052577994361722 and parameters: {'booster': 'dart', 'lambda': 4.053105621278032e-06, 'alpha': 1.2164438293546709e-08, 'subsample': 0.8281871922644035, 'colsample_bytree': 0.6704312771722909, 'max_depth': 10, 'min_child_weight': 3, 'eta': 0.016410057158319127, 'gamma': 0.7274361467788498, 'rate_drop': 1.4124133629918796e-07, 'skip_drop': 1.5674687346693321e-06}. Best is trial 6 with value: -1.671990924341051.    
[I 2025-06-29 22:55:04,008] Trial 9 finished with value: -1.6556804549439093 and parameters: {'booster': 'gbtree', 'lambda': 2.3315403439178886e-07, 'alpha': 5.163741899249487e-07, 'subsample': 0.9998236311711698, 'colsample_bytree': 0.5487395396650071, 'max_depth': 6, 'min_child_weight': 9, 'eta': 0.0925379008266649, 'gamma': 0.25263183291236224}. Best is trial 9 with value: -1.6556804549439093.
[I 2025-06-29 22:55:04,119] Trial 10 finished with value: -1.6338357765316962 and parameters: {'booster': 'gbtree', 'lambda': 1.1830501859567888e-08, 'alpha': 1.6083021972199767e-07, 'subsample': 0.994051579523973, 'colsample_bytree': 0.9809819485327846, 'max_depth': 3, 'min_child_weight': 6, 'eta': 0.05483863289773163, 'gamma': 1.6529638240379783}. Best is trial 10 with value: -1.6338357765316962.
[I 2025-06-29 22:55:04,234] Trial 11 finished with value: -1.6471961238387243 and parameters: {'booster': 'gbtree', 'lambda': 1.2474645103676854e-08, 'alpha': 7.576675330978137e-08, 'subsample': 0.9937016841752034, 'colsample_bytree': 0.9610811505196166, 'max_depth': 3, 'min_child_weight': 6, 'eta': 0.04194739971558926, 'gamma': 1.566204457239748}. Best is trial 10 with value: -1.6338357765316962.
[I 2025-06-29 22:55:04,399] Trial 12 finished with value: -1.6188458242740114 and parameters: {'booster': 'gbtree', 'lambda': 1.1309102180884061e-08, 'alpha': 5.295360325026554e-07, 'subsample': 0.895170629689124, 'colsample_bytree': 0.9783906642886007, 'max_depth': 3, 'min_child_weight': 5, 'eta': 0.03183534292495776, 'gamma': 1.643812988150641}. Best is trial 12 with value: -1.6188458242740114.
[I 2025-06-29 22:55:04,511] Trial 13 finished with value: -1.625557904301674 and parameters: {'booster': 'gbtree', 'lambda': 1.690096043194276e-08, 'alpha': 2.445860030584176e-06, 'subsample': 0.885651194977392, 'colsample_bytree': 0.9798621243197644, 'max_depth': 3, 'min_child_weight': 4, 'eta': 0.031653978428800474, 'gamma': 1.704848211817096}. Best is trial 12 with value: -1.6188458242740114.
[I 2025-06-29 22:55:04,691] Trial 14 finished with value: -1.6388438426687935 and parameters: {'booster': 'gbtree', 'lambda': 1.863855008683143e-07, 'alpha': 1.1506673363224713e-05, 'subsample': 0.8747105234443211, 'colsample_bytree': 0.906407629841076, 'max_depth': 4, 'min_child_weight': 4, 'eta': 0.017765800854299626, 'gamma': 1.68469156422608}. Best is trial 12 with value: -1.6188458242740114.
[I 2025-06-29 22:55:04,951] Trial 15 finished with value: -1.6543058405462754 and parameters: {'booster': 'gbtree', 'lambda': 0.0002371220911382265, 'alpha': 2.9862097653038164e-06, 'subsample': 0.8969822998151468, 'colsample_bytree': 0.9252048808164413, 'max_depth': 4, 'min_child_weight': 4, 'eta': 0.006060206866846032, 'gamma': 3.1251911224581006}. Best is trial 12 with value: -1.6188458242740114.
[I 2025-06-29 22:55:05,059] Trial 16 finished with value: -1.6643480599095093 and parameters: {'booster': 'gbtree', 'lambda': 8.860787554208866e-08, 'alpha': 2.1597149249099944e-06, 'subsample': 0.8132703262396714, 'colsample_bytree': 0.9951259847846338, 'max_depth': 4, 'min_child_weight': 4, 'eta': 0.030780196400580044, 'gamma': 4.96122344535846}. Best is trial 12 with value: -1.6188458242740114.
[I 2025-06-29 22:55:05,360] Trial 17 finished with value: -1.6503300094467668 and parameters: {'booster': 'gbtree', 'lambda': 1.0745865091883066e-08, 'alpha': 1.7637304165287857e-08, 'subsample': 0.9187373233126822, 'colsample_bytree': 0.8413968120242832, 'max_depth': 5, 'min_child_weight': 5, 'eta': 0.006716502750503571, 'gamma': 1.2649537780724858}. Best is trial 12 with value: -1.6188458242740114.
[I 2025-06-29 22:55:05,432] Trial 18 finished with value: -1.7547357244124493 and parameters: {'booster': 'gbtree', 'lambda': 0.004337423265371822, 'alpha': 0.000822538044804732, 'subsample': 0.8321515238741135, 'colsample_bytree': 0.9132232655333047, 'max_depth': 3, 'min_child_weight': 2, 'eta': 0.20671710868556484, 'gamma': 1.9870940751585988}. Best is trial 12 with value: -1.6188458242740114.
[I 2025-06-29 22:55:05,598] Trial 19 finished with value: -1.6604440090585657 and parameters: {'booster': 'gbtree', 'lambda': 5.780763561226778e-07, 'alpha': 8.070368061192119e-07, 'subsample': 0.9212474155832245, 'colsample_bytree': 0.7976303225214689, 'max_depth': 7, 'min_child_weight': 5, 'eta': 0.02875589908718961, 'gamma': 3.7461394708612055}. Best is trial 12 with value: -1.6188458242740114.
[I 2025-06-29 22:55:05,805] Trial 20 finished with value: -1.65009007680167 and parameters: {'booster': 'gbtree', 'lambda': 5.153183437565378e-05, 'alpha': 9.961402760018455e-06, 'subsample': 0.7855901707342963, 'colsample_bytree': 0.8761009419247019, 'max_depth': 5, 'min_child_weight': 7, 'eta': 0.012062737930963949, 'gamma': 2.7219529438468317}. Best is trial 12 with value: -1.6188458242740114.
[I 2025-06-29 22:55:05,909] Trial 21 finished with value: -1.644341968706909 and parameters: {'booster': 'gbtree', 'lambda': 5.0315804398092914e-08, 'alpha': 1.0193800749707163e-07, 'subsample': 0.9455134214557764, 'colsample_bytree': 0.9962471065160545, 'max_depth': 3, 'min_child_weight': 6, 'eta': 0.05558434004245474, 'gamma': 1.2817566028463605}. Best is trial 12 with value: -1.6188458242740114.
[I 2025-06-29 22:55:06,001] Trial 22 finished with value: -1.6440461245695994 and parameters: {'booster': 'gbtree', 'lambda': 3.3282183460627834e-08, 'alpha': 1.6319742214853154e-07, 'subsample': 0.8580678065341086, 'colsample_bytree': 0.9468081080967762, 'max_depth': 3, 'min_child_weight': 5, 'eta': 0.07401255929943304, 'gamma': 1.9744895645035827}. Best is trial 12 with value: -1.6188458242740114.
[I 2025-06-29 22:55:06,124] Trial 23 finished with value: -1.6616447588410692 and parameters: {'booster': 'gbtree', 'lambda': 1.1113471606500658e-06, 'alpha': 4.7519843716684756e-07, 'subsample': 0.9430135081597877, 'colsample_bytree': 0.9685841567731929, 'max_depth': 4, 'min_child_weight': 6, 'eta': 0.03529557488434806, 'gamma': 1.173089456024165}. Best is trial 12 with value: -1.6188458242740114.
[I 2025-06-29 22:55:06,201] Trial 24 finished with value: -1.6771675985983432 and parameters: {'booster': 'gbtree', 'lambda': 1.1965937963161734e-08, 'alpha': 1.089582716269067e-05, 'subsample': 0.8797243807020946, 'colsample_bytree': 0.8873204657513528, 'max_depth': 3, 'min_child_weight': 3, 'eta': 0.13106463047232014, 'gamma': 2.062187116491842}. Best is trial 12 with value: -1.6188458242740114.
[I 2025-06-29 22:55:06,308] Trial 25 finished with value: -1.6257754015971237 and parameters: {'booster': 'gbtree', 'lambda': 1.1443921708352404e-07, 'alpha': 6.631229814901385e-08, 'subsample': 0.9594514777555994, 'colsample_bytree': 0.9438375286345683, 'max_depth': 4, 'min_child_weight': 8, 'eta': 0.05525331051350988, 'gamma': 1.6363013536982538}. Best is trial 12 with value: -1.6188458242740114.
[I 2025-06-29 22:55:06,502] Trial 26 finished with value: -1.6451836783646103 and parameters: {'booster': 'gbtree', 'lambda': 2.6613679797187e-06, 'alpha': 4.528846330402812e-08, 'subsample': 0.9053507949478136, 'colsample_bytree': 0.9368101657407575, 'max_depth': 4, 'min_child_weight': 8, 'eta': 0.023315090834535555, 'gamma': 0.9663796488684031}. Best is trial 12 with value: -1.6188458242740114.
[I 2025-06-29 22:55:06,787] Trial 27 finished with value: -1.638997610601842 and parameters: {'booster': 'gbtree', 'lambda': 2.8989707975913646e-07, 'alpha': 2.6330896115833062e-06, 'subsample': 0.8489515175633612, 'colsample_bytree': 0.8114592025036713, 'max_depth': 5, 'min_child_weight': 8, 'eta': 0.010086845166049352, 'gamma': 2.3910630516472677}. Best is trial 12 with value: -1.6188458242740114.
[I 2025-06-29 22:55:07,058] Trial 28 finished with value: -1.6774859891971832 and parameters: {'booster': 'gbtree', 'lambda': 6.24175914904651e-08, 'alpha': 0.001482459660392447, 'subsample': 0.7916193131741612, 'colsample_bytree': 0.9508377189213063, 'max_depth': 4, 'min_child_weight': 4, 'eta': 0.0036481603215264033, 'gamma': 0.4059097706799899}. Best is trial 12 with value: -1.6188458242740114.
[I 2025-06-29 22:55:07,172] Trial 29 finished with value: -1.6997395151902606 and parameters: {'booster': 'gbtree', 'lambda': 0.003643517710828106, 'alpha': 1.014742148827602e-08, 'subsample': 0.7091613286986039, 'colsample_bytree': 0.8968098288326245, 'max_depth': 7, 'min_child_weight': 10, 'eta': 0.041845606010529696, 'gamma': 1.4497623399561574}. Best is trial 12 with value: -1.6188458242740114.
[I 2025-06-29 22:55:07,242] Trial 30 finished with value: -1.6966223495011266 and parameters: {'booster': 'gbtree', 'lambda': 0.1403336983248088, 'alpha': 4.7647881961175045e-05, 'subsample': 0.9569076056232413, 'colsample_bytree': 0.9985155534045317, 'max_depth': 6, 'min_child_weight': 8, 'eta': 0.17746686020312394, 'gamma': 1.8566715831164884}. Best is trial 12 with value: -1.6188458242740114.
[I 2025-06-29 22:55:07,348] Trial 31 finished with value: -1.6259611708916881 and parameters: {'booster': 'gbtree', 'lambda': 3.924337011311471e-08, 'alpha': 3.2922911916463607e-07, 'subsample': 0.9729892993672727, 'colsample_bytree': 0.9710294018040009, 'max_depth': 3, 'min_child_weight': 5, 'eta': 0.061745028663731605, 'gamma': 1.6083772332970074}. Best is trial 12 with value: -1.6188458242740114.
[I 2025-06-29 22:55:07,455] Trial 32 finished with value: -1.6248133068404507 and parameters: {'booster': 'gbtree', 'lambda': 7.291786342410819e-08, 'alpha': 4.615163396097599e-07, 'subsample': 0.927105238932899, 'colsample_bytree': 0.9283963684641059, 'max_depth': 3, 'min_child_weight': 5, 'eta': 0.06136480760297718, 'gamma': 1.0067316583275978}. Best is trial 12 with value: -1.6188458242740114.
[I 2025-06-29 22:55:07,640] Trial 33 finished with value: -1.6445479540550958 and parameters: {'booster': 'gbtree', 'lambda': 1.3209233622833395e-07, 'alpha': 1.4250567720504516e-06, 'subsample': 0.9286015321081614, 'colsample_bytree': 0.853106292864457, 'max_depth': 4, 'min_child_weight': 2, 'eta': 0.02360629741924558, 'gamma': 1.0154126971302517}. Best is trial 12 with value: -1.6188458242740114.
[I 2025-06-29 22:55:08,849] Trial 34 finished with value: -1.6490302627263902 and parameters: {'booster': 'dart', 'lambda': 4.7056734920629337e-07, 'alpha': 3.84828562436737e-08, 'subsample': 0.8840548740279579, 'colsample_bytree': 0.9315415335470663, 'max_depth': 5, 'min_child_weight': 7, 'eta': 0.04348953689381077, 'gamma': 0.13253132373681553, 'rate_drop': 7.363423171522716e-06, 'skip_drop': 1.0707467868794229e-08}. Best is trial 12 with value: -1.6188458242740114.    
[I 2025-06-29 22:55:08,945] Trial 35 finished with value: -1.6650533771176086 and parameters: {'booster': 'gbtree', 'lambda': 3.256185824422786e-05, 'alpha': 0.02824162466804286, 'subsample': 0.6794392263008325, 'colsample_bytree': 0.7571541156815133, 'max_depth': 3, 'min_child_weight': 4, 'eta': 0.12437261507615993, 'gamma': 0.45300971828864633}. Best is trial 12 with value: -1.6188458242740114.
[I 2025-06-29 22:55:12,819] Trial 36 finished with value: -1.8193153338718633 and parameters: {'booster': 'dart', 'lambda': 2.4048874544707005e-06, 'alpha': 8.294931082969829e-06, 'subsample': 0.7590903293822752, 'colsample_bytree': 0.6066975477829686, 'max_depth': 4, 'min_child_weight': 5, 'eta': 0.08992568362072512, 'gamma': 2.2670850310089867, 'rate_drop': 0.8570721468126135, 'skip_drop': 0.0007558434183909714}. Best is trial 12 with value: -1.6188458242740114.        
[I 2025-06-29 22:55:12,899] Trial 37 finished with value: -1.727052661458495 and parameters: {'booster': 'gbtree', 'lambda': 4.4183513100291355e-08, 'alpha': 7.280073386815538e-05, 'subsample': 0.8611035245221934, 'colsample_bytree': 0.8805852865955163, 'max_depth': 3, 'min_child_weight': 3, 'eta': 0.28080459340884345, 'gamma': 0.9577648802963249}. Best is trial 12 with value: -1.6188458242740114.
[I 2025-06-29 22:55:13,018] Trial 38 finished with value: -1.6250828564983517 and parameters: {'booster': 'gbtree', 'lambda': 6.95154632617631e-06, 'alpha': 2.879933214432805e-07, 'subsample': 0.9072277253006412, 'colsample_bytree': 0.8012170005304773, 'max_depth': 3, 'min_child_weight': 9, 'eta': 0.0655427704070388, 'gamma': 2.1890938029757905}. Best is trial 12 with value: -1.6188458242740114.
[I 2025-06-29 22:55:14,261] Trial 39 finished with value: -1.7068945551167913 and parameters: {'booster': 'dart', 'lambda': 1.39597750566111e-05, 'alpha': 3.781922539046274e-05, 'subsample': 0.798062405231689, 'colsample_bytree': 0.8084539553512964, 'max_depth': 8, 'min_child_weight': 10, 'eta': 0.1576037775691225, 'gamma': 2.8394753663955887, 'rate_drop': 1.563894882256669e-05, 'skip_drop': 1.4123257133050318e-08}. Best is trial 12 with value: -1.6188458242740114.       
[I 2025-06-29 22:55:14,376] Trial 40 finished with value: -1.6831576175937033 and parameters: {'booster': 'gbtree', 'lambda': 0.001114550408297637, 'alpha': 0.00017016371568431737, 'subsample': 0.504442794351291, 'colsample_bytree': 0.7164336081712018, 'max_depth': 9, 'min_child_weight': 2, 'eta': 0.07955238216336193, 'gamma': 2.585526247974581}. Best is trial 12 with value: -1.6188458242740114.
[I 2025-06-29 22:55:14,488] Trial 41 finished with value: -1.626146274473039 and parameters: {'booster': 'gbtree', 'lambda': 6.086393657044166e-06, 'alpha': 2.5337317532381495e-07, 'subsample': 0.9026685388209987, 'colsample_bytree': 0.922752586968184, 'max_depth': 3, 'min_child_weight': 9, 'eta': 0.05887961839466757, 'gamma': 2.2896553242284963}. Best is trial 12 with value: -1.6188458242740114.
[I 2025-06-29 22:55:14,694] Trial 42 finished with value: -1.5992545911121556 and parameters: {'booster': 'gbtree', 'lambda': 8.201915855855859e-07, 'alpha': 3.235074911149845e-08, 'subsample': 0.9672235391880522, 'colsample_bytree': 0.6800753091891073, 'max_depth': 3, 'min_child_weight': 9, 'eta': 0.02302969589446501, 'gamma': 1.384107274644502}. Best is trial 42 with value: -1.5992545911121556.
[I 2025-06-29 22:55:14,910] Trial 43 finished with value: -1.607621136324616 and parameters: {'booster': 'gbtree', 'lambda': 1.0121429182748498e-06, 'alpha': 7.78235722154866e-07, 'subsample': 0.9736004695497368, 'colsample_bytree': 0.6772829877882409, 'max_depth': 3, 'min_child_weight': 10, 'eta': 0.021675561601257, 'gamma': 0.597537147667741}. Best is trial 42 with value: -1.5992545911121556.
[I 2025-06-29 22:55:15,131] Trial 44 finished with value: -1.6129916933004556 and parameters: {'booster': 'gbtree', 'lambda': 1.0384208152127847e-06, 'alpha': 2.4585203602564856e-08, 'subsample': 0.9745111970421517, 'colsample_bytree': 0.6885083149953019, 'max_depth': 3, 'min_child_weight': 9, 'eta': 0.014227344344823697, 'gamma': 0.6241204297081702}. Best is trial 42 with value: -1.5992545911121556.
[I 2025-06-29 22:55:24,885] Trial 45 finished with value: -1.6328576434177664 and parameters: {'booster': 'dart', 'lambda': 1.3289450643916133e-06, 'alpha': 2.557972379023737e-08, 'subsample': 0.9759443591622409, 'colsample_bytree': 0.6845700116029435, 'max_depth': 5, 'min_child_weight': 10, 'eta': 0.011596492915347013, 'gamma': 0.5948508571668264, 'rate_drop': 1.0330749068531083e-08, 'skip_drop': 0.002908928822443123}. Best is trial 42 with value: -1.5992545911121556.   
[I 2025-06-29 22:55:25,221] Trial 46 finished with value: -1.6235320507960458 and parameters: {'booster': 'gbtree', 'lambda': 8.22773243404385e-07, 'alpha': 9.924273023136755e-07, 'subsample': 0.9998077179104573, 'colsample_bytree': 0.6308205885669725, 'max_depth': 3, 'min_child_weight': 10, 'eta': 0.01624287084215922, 'gamma': 0.7542235323565135}. Best is trial 42 with value: -1.5992545911121556.
[I 2025-06-29 22:55:25,525] Trial 47 finished with value: -1.6341904724596692 and parameters: {'booster': 'gbtree', 'lambda': 3.999034334972333e-05, 'alpha': 1.0159802685243777e-07, 'subsample': 0.9973092920912451, 'colsample_bytree': 0.6260407028136832, 'max_depth': 4, 'min_child_weight': 9, 'eta': 0.01506232422700063, 'gamma': 0.030749737091075313}. Best is trial 42 with value: -1.5992545911121556.
[I 2025-06-29 22:55:25,878] Trial 48 finished with value: -1.604884311619387 and parameters: {'booster': 'gbtree', 'lambda': 8.304993960174519e-07, 'alpha': 1.1039793997664097e-06, 'subsample': 0.976461301936568, 'colsample_bytree': 0.6342428405341698, 'max_depth': 3, 'min_child_weight': 10, 'eta': 0.02270896815538216, 'gamma': 0.34545903009327583}. Best is trial 42 with value: -1.5992545911121556.
[I 2025-06-29 22:55:30,804] Trial 49 finished with value: -1.96626479716983 and parameters: {'booster': 'dart', 'lambda': 9.395419894995376e-05, 'alpha': 2.379146899042664e-08, 'subsample': 0.9684651176688257, 'colsample_bytree': 0.6987430990083306, 'max_depth': 4, 'min_child_weight': 9, 'eta': 0.02038512857265808, 'gamma': 0.3821028644260871, 'rate_drop': 0.7790144778822444, 'skip_drop': 1.1664896617376002e-06}. Best is trial 42 with value: -1.5992545911121556.
Number of finished trials:  50
Best trial:
  Value (RMSE): 1.5993
  MSE: 2.5576
  R²: 0.3710
Model saved to ck_student_score_predictor_optuna_xgb.pkl
PS D:\machile_nearning\wecode_score_prediction\dataset-practice-separation\XGBoost-CK-Threshold-15> python .\predict.py

Found 718 students without CK scores
Predictions saved to ck_score_predictions.csv
Sample predictions:
                                  student_id  predicted_ck_score
3   0134f9f410c65ad0e8c2254a7e9288670e02a183            7.349360
20  035f97702f2c01d26ab1fae8f39ea2f98a0caa3c            7.134047
40  06024da8147b5cf6105beb4c403f67cf1ff0aea1            7.887171
68  0aaebc88f6106684d6993c156104c1ef36cf94e0            7.353024
80  0bf111a9caedf02804f6991792490e63bc21058a            8.504037