PS D:\machile_nearning\wecode_score_prediction\dataset-student-performance\XGBoost-CK> python .\train.py
[I 2025-06-27 21:43:49,110] A new study created in memory with name: no-name-760f4bbe-b68d-4ed2-a677-acb6bc1a2a9d
[I 2025-06-27 21:43:57,664] Trial 0 finished with value: -1.9750585207037243 and parameters: {'booster': 'dart', 'lambda': 0.23227621311527458, 'alpha': 1.5711713738942583e-08, 'subsample': 0.7372219692266964, 'colsample_bytree': 0.5562743865123035, 'max_depth': 6, 'min_child_weight': 9, 'eta': 0.0021584456657062095, 'gamma': 0.07483865975590143, 'rate_drop': 0.1497466915683884, 'skip_drop': 0.0007797836554984415}. Best is trial 0 with value: -1.9750585207037243.
[I 2025-06-27 21:44:05,647] Trial 1 finished with value: -1.8699871602283253 and parameters: {'booster': 'dart', 'lambda': 0.03204506228374003, 'alpha': 1.9809583856654868e-07, 'subsample': 0.7939180399472694, 'colsample_bytree': 0.566194565145226, 'max_depth': 8, 'min_child_weight': 1, 'eta': 0.015007772562675027, 'gamma': 2.1630842722895656, 'rate_drop': 0.3358397378285412, 'skip_drop': 3.6647802094457795e-07}. Best is trial 1 with value: -1.8699871602283253.
[I 2025-06-27 21:44:12,972] Trial 2 finished with value: -1.694910897108372 and parameters: {'booster': 'dart', 'lambda': 6.189050425517139, 'alpha': 5.568343690325388, 'subsample': 0.7388172663436796, 'colsample_bytree': 0.9480218315175077, 'max_depth': 7, 'min_child_weight': 8, 'eta': 0.06549772146048635, 'gamma': 1.503986823964334, 'rate_drop': 0.36866745869956175, 'skip_drop': 0.0005182448398954399}. Best is trial 2 with value: -1.694910897108372.
[I 2025-06-27 21:44:13,155] Trial 3 finished with value: -1.579834444176033 and parameters: {'booster': 'gbtree', 'lambda': 1.2228869886855182e-08, 'alpha': 9.906283645445667e-06, 'subsample': 0.611165315067756, 'colsample_bytree': 0.5137130722560483, 'max_depth': 3, 'min_child_weight': 9, 'eta': 0.012500221627596647, 'gamma': 4.216485384025835}. Best is trial 3 with value: -1.579834444176033.
[I 2025-06-27 21:44:13,513] Trial 4 finished with value: -1.6787375653418295 and parameters: {'booster': 'gbtree', 'lambda': 2.1902676880262715e-08, 'alpha': 1.9933715604798546e-05, 'subsample': 0.7156578634950208, 'colsample_bytree': 0.7051987252249594, 'max_depth': 6, 'min_child_weight': 3, 'eta': 0.0017841579545398655, 'gamma': 0.7417366710530726}. Best is trial 3 with value: -1.579834444176033.
[I 2025-06-27 21:44:21,980] Trial 5 finished with value: -1.6925342430606354 and parameters: {'booster': 'dart', 'lambda': 5.735466844073761, 'alpha': 2.020664020319557e-05, 'subsample': 0.6936847662597119, 'colsample_bytree': 0.6908526597527069, 'max_depth': 3, 'min_child_weight': 2, 'eta': 0.0027098726780030212, 'gamma': 0.062238417555922076, 'rate_drop': 0.000880913915555461, 'skip_drop': 1.1954231902735837e-08}. Best is trial 3 with value: -1.579834444176033.
[I 2025-06-27 21:44:22,018] Trial 6 finished with value: -1.7077431639521305 and parameters: {'booster': 'gbtree', 'lambda': 1.3715983274834768e-08, 'alpha': 1.8209350303100238e-06, 'subsample': 0.6197054420697243, 'colsample_bytree': 0.98148787638879, 'max_depth': 9, 'min_child_weight': 2, 'eta': 0.19968435391626083, 'gamma': 4.7492708572557}. Best is trial 3 with value: -1.579834444176033.
[I 2025-06-27 21:44:25,673] Trial 7 finished with value: -1.5864469365095624 and parameters: {'booster': 'dart', 'lambda': 0.00010928685190192644, 'alpha': 0.0012712095537429635, 'subsample': 0.7152647092786, 'colsample_bytree': 0.6482588097783684, 'max_depth': 10, 'min_child_weight': 9, 'eta': 0.008861258863664834, 'gamma': 3.2665810637299577, 'rate_drop': 4.3129383815986006e-05, 'skip_drop': 9.950577026815201e-08}. Best is trial 3 with value: -1.579834444176033.
[I 2025-06-27 21:44:25,966] Trial 8 finished with value: -1.5936157091423149 and parameters: {'booster': 'gbtree', 'lambda': 1.7255667909549415e-07, 'alpha': 9.508531000735e-06, 'subsample': 0.7287888115977462, 'colsample_bytree': 0.7022265658344389, 'max_depth': 5, 'min_child_weight': 8, 'eta': 0.0035094850454787364, 'gamma': 0.12762759333188378}. Best is trial 3 with value: -1.579834444176033.
[I 2025-06-27 21:44:26,285] Trial 9 finished with value: -1.6046306255150795 and parameters: {'booster': 'gbtree', 'lambda': 0.06844843609440353, 'alpha': 0.013396411555663821, 'subsample': 0.690153474868832, 'colsample_bytree': 0.5002271051869183, 'max_depth': 6, 'min_child_weight': 1, 'eta': 0.006515338592483583, 'gamma': 3.731569950254917}. Best is trial 3 with value: -1.579834444176033.
[I 2025-06-27 21:44:26,387] Trial 10 finished with value: -1.5949399199894014 and parameters: {'booster': 'gbtree', 'lambda': 1.3134271536295661e-05, 'alpha': 0.018929567874123667, 'subsample': 0.5064853802128183, 'colsample_bytree': 0.9072170250577741, 'max_depth': 3, 'min_child_weight': 6, 'eta': 0.05245853929614157, 'gamma': 4.995648314095508}. Best is trial 3 with value: -1.579834444176033.
[I 2025-06-27 21:44:30,148] Trial 11 finished with value: -1.586764893229229 and parameters: {'booster': 'dart', 'lambda': 3.793288660763943e-05, 'alpha': 0.0016169924146087734, 'subsample': 0.92324222242515, 'colsample_bytree': 0.5983285590919233, 'max_depth': 10, 'min_child_weight': 10, 'eta': 0.012709130577071126, 'gamma': 3.4742159904724366, 'rate_drop': 1.9678037179321988e-08, 'skip_drop': 0.5167402312032173}. Best is trial 3 with value: -1.579834444176033.
[I 2025-06-27 21:44:30,258] Trial 12 finished with value: -1.5637897959137967 and parameters: {'booster': 'gbtree', 'lambda': 0.0006382405721189336, 'alpha': 0.0006587773822900408, 'subsample': 0.5752932295706992, 'colsample_bytree': 0.8200336156864174, 'max_depth': 4, 'min_child_weight': 5, 'eta': 0.03581154459747264, 'gamma': 3.430103770058425}. Best is trial 12 with value: -1.5637897959137967.
[I 2025-06-27 21:44:30,372] Trial 13 finished with value: -1.5736360208729971 and parameters: {'booster': 'gbtree', 'lambda': 0.00276194839262934, 'alpha': 1.8056159631031468, 'subsample': 0.5395413282572079, 'colsample_bytree': 0.8083650193529599, 'max_depth': 4, 'min_child_weight': 5, 'eta': 0.036954969253594275, 'gamma': 4.16535397510554}. Best is trial 12 with value: -1.5637897959137967.
[I 2025-06-27 21:44:30,514] Trial 14 finished with value: -1.612464760086179 and parameters: {'booster': 'gbtree', 'lambda': 0.002670264864632178, 'alpha': 8.186281701138501, 'subsample': 0.5022744350665375, 'colsample_bytree': 0.8383171913846534, 'max_depth': 4, 'min_child_weight': 5, 'eta': 0.040357678326722914, 'gamma': 2.606622043025483}. Best is trial 12 with value: -1.5637897959137967.
[I 2025-06-27 21:44:30,588] Trial 15 finished with value: -1.6954561659140455 and parameters: {'booster': 'gbtree', 'lambda': 0.0009687010895531088, 'alpha': 0.1570763631780861, 'subsample': 0.579429390678955, 'colsample_bytree': 0.8035160648857315, 'max_depth': 4, 'min_child_weight': 5, 'eta': 0.14192878925176214, 'gamma': 2.7587706938343075}. Best is trial 12 with value: -1.5637897959137967.
[I 2025-06-27 21:44:30,706] Trial 16 finished with value: -1.5768611170094673 and parameters: {'booster': 'gbtree', 'lambda': 3.5991256323562267e-06, 'alpha': 0.567658962721892, 'subsample': 0.5717943854974272, 'colsample_bytree': 0.7975590515843155, 'max_depth': 5, 'min_child_weight': 6, 'eta': 0.029494356700631583, 'gamma': 4.134821361627761}. Best is trial 12 with value: -1.5637897959137967.
[I 2025-06-27 21:44:30,784] Trial 17 finished with value: -1.607066521306226 and parameters: {'booster': 'gbtree', 'lambda': 0.006613068085347535, 'alpha': 0.00030429349639354494, 'subsample': 0.8319492049568036, 'colsample_bytree': 0.8688079049723264, 'max_depth': 4, 'min_child_weight': 4, 'eta': 0.1042456898165109, 'gamma': 4.205006428072514}. Best is trial 12 with value: -1.5637897959137967.
[I 2025-06-27 21:44:30,871] Trial 18 finished with value: -1.6171551674727438 and parameters: {'booster': 'gbtree', 'lambda': 2.1193635333637233e-06, 'alpha': 0.47581084348368957, 'subsample': 0.6478928618529927, 'colsample_bytree': 0.7642710888427925, 'max_depth': 5, 'min_child_weight': 7, 'eta': 0.07726744485426291, 'gamma': 3.099010218423403}. Best is trial 12 with value: -1.5637897959137967.
[I 2025-06-27 21:44:31,017] Trial 19 finished with value: -1.6216572356033918 and parameters: {'booster': 'gbtree', 'lambda': 0.00022147281466431323, 'alpha': 0.02987551720322986, 'subsample': 0.5469746347350128, 'colsample_bytree': 0.8878448674760757, 'max_depth': 7, 'min_child_weight': 4, 'eta': 0.026089369613015775, 'gamma': 2.0947157072970266}. Best is trial 12 with value: -1.5637897959137967.
[I 2025-06-27 21:44:31,146] Trial 20 finished with value: -1.5942349379018488 and parameters: {'booster': 'gbtree', 'lambda': 0.4107565432069406, 'alpha': 8.460587529168929e-05, 'subsample': 0.9163149659427412, 'colsample_bytree': 0.7392706897276159, 'max_depth': 4, 'min_child_weight': 4, 'eta': 0.024947090876006255, 'gamma': 3.977181038775096}. Best is trial 12 with value: -1.5637897959137967.
[I 2025-06-27 21:44:31,270] Trial 21 finished with value: -1.590359692090167 and parameters: {'booster': 'gbtree', 'lambda': 1.2319374123908176e-06, 'alpha': 0.8997533082922128, 'subsample': 0.563228047596876, 'colsample_bytree': 0.798170058547332, 'max_depth': 5, 'min_child_weight': 6, 'eta': 0.03050148238217048, 'gamma': 4.582257286840499}. Best is trial 12 with value: -1.5637897959137967.
[I 2025-06-27 21:44:31,371] Trial 22 finished with value: -1.5896417081326966 and parameters: {'booster': 'gbtree', 'lambda': 7.971900476940423e-06, 'alpha': 1.484041174570072, 'subsample': 0.6562574370246825, 'colsample_bytree': 0.8349481142258438, 'max_depth': 5, 'min_child_weight': 7, 'eta': 0.042707044156094554, 'gamma': 3.7502456980289494}. Best is trial 12 with value: -1.5637897959137967.
[I 2025-06-27 21:44:31,509] Trial 23 finished with value: -1.576398955155332 and parameters: {'booster': 'gbtree', 'lambda': 0.0004614672656638215, 'alpha': 0.09210086161863772, 'subsample': 0.5276048612912169, 'colsample_bytree': 0.7741094860751587, 'max_depth': 4, 'min_child_weight': 5, 'eta': 0.02056726892738277, 'gamma': 4.402318278690901}. Best is trial 12 with value: -1.5637897959137967.
[I 2025-06-27 21:44:31,755] Trial 24 finished with value: -1.6081988940539411 and parameters: {'booster': 'gbtree', 'lambda': 0.0009450005137092249, 'alpha': 0.07634082877946341, 'subsample': 0.9967450356375732, 'colsample_bytree': 0.7518236129374047, 'max_depth': 3, 'min_child_weight': 5, 'eta': 0.005733481042573545, 'gamma': 4.528112662746037}. Best is trial 12 with value: -1.5637897959137967.
[I 2025-06-27 21:44:32,085] Trial 25 finished with value: -1.7381659316069167 and parameters: {'booster': 'gbtree', 'lambda': 0.009539402682841775, 'alpha': 0.007820800381159884, 'subsample': 0.5327151324405774, 'colsample_bytree': 0.9198010224724913, 'max_depth': 4, 'min_child_weight': 3, 'eta': 0.0012133222683882322, 'gamma': 3.4675172536238925}. Best is trial 12 with value: -1.5637897959137967.
[I 2025-06-27 21:44:32,266] Trial 26 finished with value: -1.5811103516542337 and parameters: {'booster': 'gbtree', 'lambda': 9.883193760608047e-05, 'alpha': 0.0024920923921173898, 'subsample': 0.611876267962, 'colsample_bytree': 0.849937371613907, 'max_depth': 4, 'min_child_weight': 7, 'eta': 0.020279540012889372, 'gamma': 3.019925070127197}. Best is trial 12 with value: -1.5637897959137967.
[I 2025-06-27 21:44:32,332] Trial 27 finished with value: -1.7858468693540634 and parameters: {'booster': 'gbtree', 'lambda': 0.0006942942363285711, 'alpha': 0.12144667952827264, 'subsample': 0.5283048821131, 'colsample_bytree': 0.6527786481880679, 'max_depth': 3, 'min_child_weight': 4, 'eta': 0.287633212091216, 'gamma': 4.402486700460448}. Best is trial 12 with value: -1.5637897959137967.
[I 2025-06-27 21:44:32,414] Trial 28 finished with value: -1.6336230054892817 and parameters: {'booster': 'gbtree', 'lambda': 0.014816814845995728, 'alpha': 0.00021969004456335163, 'subsample': 0.5913162573948069, 'colsample_bytree': 0.7765071735996768, 'max_depth': 6, 'min_child_weight': 3, 'eta': 0.09211344703302154, 'gamma': 3.795571229036141}. Best is trial 12 with value: -1.5637897959137967.
[I 2025-06-27 21:44:39,951] Trial 29 finished with value: -1.5806865429749473 and parameters: {'booster': 'dart', 'lambda': 0.21045241194215225, 'alpha': 2.458320384667905, 'subsample': 0.6448291333599765, 'colsample_bytree': 0.728692100558137, 'max_depth': 7, 'min_child_weight': 5, 'eta': 0.00912486273907428, 'gamma': 4.9974694102098365, 'rate_drop': 1.3482857542097567e-08, 'skip_drop': 0.6311859341091857}. Best is trial 12 with value: -1.5637897959137967.
[I 2025-06-27 21:44:40,111] Trial 30 finished with value: -1.5958487685227605 and parameters: {'booster': 'gbtree', 'lambda': 0.0019520127803159676, 'alpha': 6.453317456398489e-08, 'subsample': 0.7804297358349152, 'colsample_bytree': 0.8187728090317681, 'max_depth': 5, 'min_child_weight': 6, 'eta': 0.019075877381834874, 'gamma': 3.5375149940438857}. Best is trial 12 with value: -1.5637897959137967.
[I 2025-06-27 21:44:40,221] Trial 31 finished with value: -1.588620503186667 and parameters: {'booster': 'gbtree', 'lambda': 3.631086707238255e-05, 'alpha': 0.3940551189248437, 'subsample': 0.5649148391109453, 'colsample_bytree': 0.7660847320960835, 'max_depth': 5, 'min_child_weight': 6, 'eta': 0.03215649628158045, 'gamma': 4.033520554174965}. Best is trial 12 with value: -1.5637897959137967.
[I 2025-06-27 21:44:40,324] Trial 32 finished with value: -1.5915714474061589 and parameters: {'booster': 'gbtree', 'lambda': 1.0673369058456852e-06, 'alpha': 0.063834447695233, 'subsample': 0.5236518157107362, 'colsample_bytree': 0.7893691227085967, 'max_depth': 4, 'min_child_weight': 5, 'eta': 0.0570506518438401, 'gamma': 4.25652611917381}. Best is trial 12 with value: -1.5637897959137967.
[I 2025-06-27 21:44:40,530] Trial 33 finished with value: -1.5925406892070033 and parameters: {'booster': 'gbtree', 'lambda': 0.0003373619684419703, 'alpha': 3.294224627056325, 'subsample': 0.5810240931830547, 'colsample_bytree': 0.8848110443750814, 'max_depth': 6, 'min_child_weight': 7, 'eta': 0.016710295938678496, 'gamma': 2.0833291216132936}. Best is trial 12 with value: -1.5637897959137967.
[I 2025-06-27 21:44:41,127] Trial 34 finished with value: -1.5979523580387527 and parameters: {'booster': 'dart', 'lambda': 0.04901191231074083, 'alpha': 0.27540878894559234, 'subsample': 0.6075043292596408, 'colsample_bytree': 0.818066982007158, 'max_depth': 5, 'min_child_weight': 6, 'eta': 0.03954093665229021, 'gamma': 4.749698235904579, 'rate_drop': 5.201804939806625e-06, 'skip_drop': 3.5906672349305522e-06}. Best is trial 12 with value: -1.5637897959137967.
[I 2025-06-27 21:44:41,222] Trial 35 finished with value: -1.5841194185206628 and parameters: {'booster': 'gbtree', 'lambda': 2.910814726634307e-07, 'alpha': 9.932529077939293, 'subsample': 0.5588985966409467, 'colsample_bytree': 0.9339595685128681, 'max_depth': 3, 'min_child_weight': 4, 'eta': 0.06543697619331959, 'gamma': 4.0062683813655395}. Best is trial 12 with value: -1.5637897959137967.
[I 2025-06-27 21:44:41,407] Trial 36 finished with value: -1.5800027672667099 and parameters: {'booster': 'gbtree', 'lambda': 7.533662973940509e-06, 'alpha': 1.2308206265182593, 'subsample': 0.6772273558597792, 'colsample_bytree': 0.8590258541412356, 'max_depth': 4, 'min_child_weight': 8, 'eta': 0.010939987744861721, 'gamma': 2.9343119348758053}. Best is trial 12 with value: -1.5637897959137967.
[I 2025-06-27 21:44:42,580] Trial 37 finished with value: -1.57914269538638 and parameters: {'booster': 'dart', 'lambda': 2.9048721075275902e-05, 'alpha': 0.003436098058596523, 'subsample': 0.5007180339676598, 'colsample_bytree': 0.7311647544275145, 'max_depth': 3, 'min_child_weight': 5, 'eta': 0.023163132538148595, 'gamma': 2.3227794140472247, 'rate_drop': 0.002229174160510967, 'skip_drop': 0.011831585785764645}. Best is trial 12 with value: -1.5637897959137967.
[I 2025-06-27 21:44:42,782] Trial 38 finished with value: -1.5975672219582175 and parameters: {'booster': 'gbtree', 'lambda': 0.003673522859483914, 'alpha': 0.042014494720339586, 'subsample': 0.6314433132326255, 'colsample_bytree': 0.6630742069045166, 'max_depth': 8, 'min_child_weight': 3, 'eta': 0.015145622174991219, 'gamma': 3.2446768912437687}. Best is trial 12 with value: -1.5637897959137967.
[I 2025-06-27 21:44:42,948] Trial 39 finished with value: -1.615564946742914 and parameters: {'booster': 'gbtree', 'lambda': 0.00019675857354662735, 'alpha': 3.0620877252179784e-07, 'subsample': 0.5434307636452099, 'colsample_bytree': 0.9693187798663341, 'max_depth': 6, 'min_child_weight': 8, 'eta': 0.033666980324144904, 'gamma': 1.8205465795827633}. Best is trial 12 with value: -1.5637897959137967.
[I 2025-06-27 21:44:43,651] Trial 40 finished with value: -1.6168839864680364 and parameters: {'booster': 'dart', 'lambda': 2.1251458124410556, 'alpha': 0.000800186975992741, 'subsample': 0.594837517467363, 'colsample_bytree': 0.6033898260256919, 'max_depth': 5, 'min_child_weight': 6, 'eta': 0.04936397635588003, 'gamma': 1.3749950731585319, 'rate_drop': 8.139842528058284e-07, 'skip_drop': 1.1713566369751648e-05}. Best is trial 12 with value: -1.5637897959137967.
[I 2025-06-27 21:44:45,335] Trial 41 finished with value: -1.5780516214810292 and parameters: {'booster': 'dart', 'lambda': 6.0106177865073185e-05, 'alpha': 0.008048490054699415, 'subsample': 0.5023654064836497, 'colsample_bytree': 0.7138742998012666, 'max_depth': 3, 'min_child_weight': 5, 'eta': 0.02664209297590608, 'gamma': 2.360863924522155, 'rate_drop': 0.002943160866741956, 'skip_drop': 0.011955184670809142}. Best is trial 12 with value: -1.5637897959137967.
[I 2025-06-27 21:44:46,822] Trial 42 finished with value: -1.5774958920378916 and parameters: {'booster': 'dart', 'lambda': 0.00010975758103049596, 'alpha': 0.006676829998072115, 'subsample': 0.5216117781484966, 'colsample_bytree': 0.6843813613013344, 'max_depth': 3, 'min_child_weight': 5, 'eta': 0.028804180329515913, 'gamma': 1.6538242063537716, 'rate_drop': 0.006705937119766184, 'skip_drop': 0.016425728797031396}. Best is trial 12 with value: -1.5637897959137967.
[I 2025-06-27 21:44:55,264] Trial 43 finished with value: -1.5788905116229648 and parameters: {'booster': 'dart', 'lambda': 0.0004281875863214634, 'alpha': 7.607198130049912e-05, 'subsample': 0.568974024338018, 'colsample_bytree': 0.6812431067104163, 'max_depth': 4, 'min_child_weight': 4, 'eta': 0.018844871299610263, 'gamma': 1.327840274159094, 'rate_drop': 0.04590743893257079, 'skip_drop': 0.019866213273058462}. Best is trial 12 with value: -1.5637897959137967.
[I 2025-06-27 21:44:55,777] Trial 44 finished with value: -1.5786675375375079 and parameters: {'booster': 'dart', 'lambda': 6.043974139887338e-08, 'alpha': 0.006104436509807399, 'subsample': 0.5312883995577918, 'colsample_bytree': 0.615498973050666, 'max_depth': 3, 'min_child_weight': 6, 'eta': 0.12530466820045022, 'gamma': 0.6912869308478258, 'rate_drop': 0.018785837939943973, 'skip_drop': 3.389133828460861e-05}. Best is trial 12 with value: -1.5637897959137967.
[I 2025-06-27 21:45:00,666] Trial 45 finished with value: -1.5690090041985654 and parameters: {'booster': 'dart', 'lambda': 3.2636747816741655e-06, 'alpha': 0.022321028183223884, 'subsample': 0.5479351367144217, 'colsample_bytree': 0.5475074207605215, 'max_depth': 4, 'min_child_weight': 7, 'eta': 0.012040440675924005, 'gamma': 0.9154188957832369, 'rate_drop': 0.00015526196229287905, 'skip_drop': 0.0010310480706392968}. Best is trial 12 with value: -1.5637897959137967.
[I 2025-06-27 21:45:09,074] Trial 46 finished with value: -1.5689312725508253 and parameters: {'booster': 'dart', 'lambda': 2.866792598546118e-06, 'alpha': 0.20347948188453122, 'subsample': 0.6193360387559401, 'colsample_bytree': 0.566173794489639, 'max_depth': 4, 'min_child_weight': 9, 'eta': 0.008285477697383676, 'gamma': 0.5471030951664725, 'rate_drop': 0.00011663435123868222, 'skip_drop': 0.0006577079339185579}. Best is trial 12 with value: -1.5637897959137967.
[I 2025-06-27 21:45:17,816] Trial 47 finished with value: -1.578796579603265 and parameters: {'booster': 'dart', 'lambda': 1.9920448899376793e-05, 'alpha': 0.14772382897173886, 'subsample': 0.6276390630151091, 'colsample_bytree': 0.523655510664287, 'max_depth': 4, 'min_child_weight': 10, 'eta': 0.005151978596346175, 'gamma': 0.7184661405950019, 'rate_drop': 0.00015301931267805633, 'skip_drop': 0.00039060478305423036}. Best is trial 12 with value: -1.5637897959137967.
[I 2025-06-27 21:45:27,372] Trial 48 finished with value: -1.6074486311147593 and parameters: {'booster': 'dart', 'lambda': 2.0119068413494655e-07, 'alpha': 0.0007069260828726862, 'subsample': 0.6684863191062264, 'colsample_bytree': 0.5550962883818888, 'max_depth': 9, 'min_child_weight': 9, 'eta': 0.003535542372119925, 'gamma': 0.4152316745675816, 'rate_drop': 5.320803786306844e-06, 'skip_drop': 0.0020933679456110296}. Best is trial 12 with value: -1.5637897959137967.
[I 2025-06-27 21:45:32,140] Trial 49 finished with value: -1.5681755444258167 and parameters: {'booster': 'dart', 'lambda': 5.227577457632727e-07, 'alpha': 0.01682679108164358, 'subsample': 0.6004224748972903, 'colsample_bytree': 0.5633666898246373, 'max_depth': 4, 'min_child_weight': 9, 'eta': 0.0112873112434254, 'gamma': 1.0139357253434378, 'rate_drop': 0.00011468638021504422, 'skip_drop': 0.00017505742519444438}. Best is trial 12 with value: -1.5637897959137967.
Number of finished trials:  50
Best trial:
  Value (RMSE): 1.5638
  MSE: 2.4454
  R²: 0.3966
Model saved to ck_student_score_predictor_optuna_xgb.pkl