[I 2025-06-29 23:10:57,491] Trial 49 finished with value: -1.4346856159835253 and parameters: {'booster': 'gbtree', 'lambda': 1.086037998916558e-06, 'alpha': 0.0009761149542881086, 'subsample': 0.8999698959145617, 'colsample_bytree': 0.870109696787727, 'max_depth': 9, 'min_child_weight': 10, 'eta': 0.09043391824354848, 'gamma': 3.603642105418908}. Best is trial 37 with value: -1.4085538948170737. 
Number of finished trials:  50
Best trial:
  Value (RMSE): 1.4086
  MSE: 1.9840
  R²: 0.6091
Model saved to th_student_score_predictor_optuna_xgb.pkl
PS D:\machile_nearning\wecode_score_prediction\dataset-hard-problem-fixed\XGBoost-TH-Threshold_35_No_N_Problem> python .\predict.py
Found 735 students without TH scores
C:\Users\ASUS\AppData\Local\Packages\PythonSoftwareFoundation.Python.3.13_qbz5n2kfra8p0\LocalCache\local-packages\Python313\site-packages\xgboost\core.py:729: UserWarning: [23:11:48] WARNING: C:\actions-runner\_work\xgboost\xgboost\src\common\error_msg.cc:27: The tree method `gpu_hist` is deprecated since 2.0.0. To use GPU training, set the `device` parameter to CUDA instead.

    E.g. tree_method = "hist", device = "cuda"

  return func(**kwargs)
Predictions saved to th_score_predictions.csv
Sample predictions:
                                  student_id  predicted_th_score
3   0134f9f410c65ad0e8c2254a7e9288670e02a183            7.662834
20  035f97702f2c01d26ab1fae8f39ea2f98a0caa3c            7.392614
40  06024da8147b5cf6105beb4c403f67cf1ff0aea1            9.818073
68  0aaebc88f6106684d6993c156104c1ef36cf94e0            7.412702
80  0bf111a9caedf02804f6991792490e63bc21058a            9.346752