PS D:\machile_nearning\wecode_score_prediction\dataset-hard-problem-fixed\XGBoost-TH-Threshold_35_No_N_Problem> python .\train.py
[I 2025-06-29 23:09:59,661] A new study created in memory with name: no-name-2716ac64-1d2b-4e9e-a43f-4c1bd825900c
[I 2025-06-29 23:10:08,293] Trial 0 finished with value: -1.5797471698285015 and parameters: {'booster': 'dart', 'lambda': 0.029508326991159788, 'alpha': 9.855119265993238e-06, 'subsample': 0.8555800691896704, 'colsample_bytree': 0.7280940146584921, 'max_depth': 9, 'min_child_weight': 4, 'eta': 0.0023501322103333363, 'gamma': 4.698986081385467, 'rate_drop': 3.4334030920342926e-05, 'skip_drop': 1.4943468565761452e-06}. Best is trial 0 with value: -1.5797471698285015.
[I 2025-06-29 23:10:08,334] Trial 1 finished with value: -1.43891843190111 and parameters: {'booster': 'gbtree', 'lambda': 0.004882441568694015, 'alpha': 0.8374947869587088, 'subsample': 0.8240104885732051, 'colsample_bytree': 0.7501759789795442, 'max_depth': 4, 'min_child_weight': 9, 'eta': 0.20943627548812582, 'gamma': 3.290883722381737}. Best is trial 1 with value: -1.43891843190111.
[I 2025-06-29 23:10:17,179] Trial 2 finished with value: -1.5953008428666833 and parameters: {'booster': 'dart', 'lambda': 3.216555420216277e-07, 'alpha': 4.319462467744451e-05, 'subsample': 0.7964741383100966, 'colsample_bytree': 0.9617903433750392, 'max_depth': 10, 'min_child_weight': 10, 'eta': 0.002112584539105498, 'gamma': 4.829361022010506, 'rate_drop': 4.3212689847501665e-05, 'skip_drop': 2.2511226472985017e-05}. Best is trial 1 with value: -1.43891843190111.
[I 2025-06-29 23:10:17,235] Trial 3 finished with value: -1.4730520624137908 and parameters: {'booster': 'gbtree', 'lambda': 4.624817652666724, 'alpha': 0.010644985647050931, 'subsample': 0.7619891190138971, 'colsample_bytree': 0.8341639396164098, 'max_depth': 5, 'min_child_weight': 2, 'eta': 0.0947362152081522, 'gamma': 1.625237507067678}. Best is trial 1 with value: -1.43891843190111.
[I 2025-06-29 23:10:18,591] Trial 4 finished with value: -1.4970795387552942 and parameters: {'booster': 'dart', 'lambda': 2.756013416963661e-05, 'alpha': 7.064594989513663e-08, 'subsample': 0.9138860888315803, 'colsample_bytree': 0.9919333082754676, 'max_depth': 4, 'min_child_weight': 1, 'eta': 0.05330199133179836, 'gamma': 4.5386646682446194, 'rate_drop': 0.0026840178431445857, 'skip_drop': 0.00730396121715056}. Best is trial 1 with value: -1.43891843190111.
[I 2025-06-29 23:10:19,046] Trial 5 finished with value: -1.5074994549398424 and parameters: {'booster': 'dart', 'lambda': 9.639756827839775e-06, 'alpha': 2.0561385026893563e-06, 'subsample': 0.6947429484782616, 'colsample_bytree': 0.7534959799492285, 'max_depth': 5, 'min_child_weight': 4, 'eta': 0.048038907583598335, 'gamma': 2.0350788066205965, 'rate_drop': 5.286139741133014e-05, 'skip_drop': 5.9193249536182956e-08}. Best is trial 1 with value: -1.43891843190111.
[I 2025-06-29 23:10:19,490] Trial 6 finished with value: -1.5200161710041393 and parameters: {'booster': 'dart', 'lambda': 3.659063551833896e-05, 'alpha': 0.00010979085384416469, 'subsample': 0.8465373981965593, 'colsample_bytree': 0.7685792430665218, 'max_depth': 3, 'min_child_weight': 5, 'eta': 0.09585257481247718, 'gamma': 4.32346614173028, 'rate_drop': 0.0019833216770928177, 'skip_drop': 2.2724419342749335e-05}. Best is trial 1 with value: -1.43891843190111.
[I 2025-06-29 23:10:19,956] Trial 7 finished with value: -1.9223385756447684 and parameters: {'booster': 'gbtree', 'lambda': 0.000499608299337367, 'alpha': 9.05125209092696, 'subsample': 0.974924610011839, 'colsample_bytree': 0.6261293163815459, 'max_depth': 9, 'min_child_weight': 1, 'eta': 0.0011457259381732825, 'gamma': 1.8227088383874994}. Best is trial 1 with value: -1.43891843190111.
[I 2025-06-29 23:10:20,162] Trial 8 finished with value: -1.4615113282219412 and parameters: {'booster': 'dart', 'lambda': 0.0023083332676818408, 'alpha': 0.9802188562799274, 'subsample': 0.8348039216624688, 'colsample_bytree': 0.7726099345282316, 'max_depth': 9, 'min_child_weight': 10, 'eta': 0.17282010406628587, 'gamma': 2.511760902860081, 'rate_drop': 0.00020977831443521504, 'skip_drop': 0.47615021007715075}. Best is trial 1 with value: -1.43891843190111.
[I 2025-06-29 23:10:28,716] Trial 9 finished with value: -1.5155905341404945 and parameters: {'booster': 'dart', 'lambda': 5.6416022226288033e-05, 'alpha': 0.020150175651651114, 'subsample': 0.5074266589030754, 'colsample_bytree': 0.9881477052906078, 'max_depth': 9, 'min_child_weight': 6, 'eta': 0.0030122369475360355, 'gamma': 4.2549942747169025, 'rate_drop': 1.707596678626958e-05, 'skip_drop': 1.4608925515158796e-05}. Best is trial 1 with value: -1.43891843190111.
[I 2025-06-29 23:10:29,015] Trial 10 finished with value: -1.4804740538389725 and parameters: {'booster': 'gbtree', 'lambda': 0.2860536700204992, 'alpha': 0.02142514814657383, 'subsample': 0.6287802431894005, 'colsample_bytree': 0.5279371788643643, 'max_depth': 7, 'min_child_weight': 8, 'eta': 0.012183677518286242, 'gamma': 0.20827849186121483}. Best is trial 1 with value: -1.43891843190111.      
[I 2025-06-29 23:10:29,083] Trial 11 finished with value: -1.4202427463979368 and parameters: {'booster': 'gbtree', 'lambda': 0.016491391188577325, 'alpha': 7.425995236979822, 'subsample': 0.6884277825969264, 'colsample_bytree': 0.8542940566603808, 'max_depth': 7, 'min_child_weight': 10, 'eta': 0.26664141864380897, 'gamma': 3.174620931502759}. Best is trial 11 with value: -1.4202427463979368.     
[I 2025-06-29 23:10:29,146] Trial 12 finished with value: -1.546326705507248 and parameters: {'booster': 'gbtree', 'lambda': 0.01684762279731687, 'alpha': 0.5723702610387532, 'subsample': 0.6626839374722229, 'colsample_bytree': 0.8776074851041378, 'max_depth': 7, 'min_child_weight': 8, 'eta': 0.24792158226220667, 'gamma': 3.346472030505563}. Best is trial 11 with value: -1.4202427463979368.       
[I 2025-06-29 23:10:29,363] Trial 13 finished with value: -1.4697373988041593 and parameters: {'booster': 'gbtree', 'lambda': 0.3610347624518828, 'alpha': 8.1139484060534, 'subsample': 0.5776023841895086, 'colsample_bytree': 0.6537682519857165, 'max_depth': 6, 'min_child_weight': 8, 'eta': 0.016610168619755575, 'gamma': 3.428648868786851}. Best is trial 11 with value: -1.4202427463979368.
[I 2025-06-29 23:10:29,428] Trial 14 finished with value: -1.4755716990844254 and parameters: {'booster': 'gbtree', 'lambda': 0.006712733561056644, 'alpha': 0.0023714634281744268, 'subsample': 0.7568707884692549, 'colsample_bytree': 0.8679260411345378, 'max_depth': 3, 'min_child_weight': 9, 'eta': 0.26186432787968406, 'gamma': 3.26120051855513}. Best is trial 11 with value: -1.4202427463979368.   
[I 2025-06-29 23:10:29,555] Trial 15 finished with value: -1.4397602270070162 and parameters: {'booster': 'gbtree', 'lambda': 6.765127549516743e-08, 'alpha': 0.4471772773061962, 'subsample': 0.6976720211803493, 'colsample_bytree': 0.6764215502568688, 'max_depth': 6, 'min_child_weight': 7, 'eta': 0.030318777000640423, 'gamma': 2.6868218933659684}. Best is trial 11 with value: -1.4202427463979368.  
[I 2025-06-29 23:10:29,636] Trial 16 finished with value: -1.4464367759300507 and parameters: {'booster': 'gbtree', 'lambda': 0.3448988135693372, 'alpha': 0.13568747178052756, 'subsample': 0.9111608488453218, 'colsample_bytree': 0.9093753748671951, 'max_depth': 8, 'min_child_weight': 10, 'eta': 0.11016497445140534, 'gamma': 3.795511225642115}. Best is trial 11 with value: -1.4202427463979368.     
[I 2025-06-29 23:10:29,911] Trial 17 finished with value: -1.456430902523755 and parameters: {'booster': 'gbtree', 'lambda': 5.590072855203744, 'alpha': 0.0005520519247058598, 'subsample': 0.5930961105313934, 'colsample_bytree': 0.8053557407750468, 'max_depth': 5, 'min_child_weight': 9, 'eta': 0.008341540061330905, 'gamma': 1.0898557418501014}. Best is trial 11 with value: -1.4202427463979368.    
[I 2025-06-29 23:10:30,074] Trial 18 finished with value: -1.433788622409619 and parameters: {'booster': 'gbtree', 'lambda': 0.00038805329698364386, 'alpha': 2.5594212889337036, 'subsample': 0.7182277281004441, 'colsample_bytree': 0.5875514470417491, 'max_depth': 4, 'min_child_weight': 7, 'eta': 0.0344028235367191, 'gamma': 2.8790487078921876}. Best is trial 11 with value: -1.4202427463979368.    
[I 2025-06-29 23:10:30,275] Trial 19 finished with value: -1.4699716221728403 and parameters: {'booster': 'gbtree', 'lambda': 1.7191104798122457e-06, 'alpha': 2.9163780407163565e-08, 'subsample': 0.7071317989634033, 'colsample_bytree': 0.5047251133519155, 'max_depth': 7, 'min_child_weight': 6, 'eta': 0.029936188174828033, 'gamma': 2.6926756596686627}. Best is trial 11 with value: -1.4202427463979368.
[I 2025-06-29 23:10:30,519] Trial 20 finished with value: -1.5748490975754454 and parameters: {'booster': 'gbtree', 'lambda': 0.0003959379607741367, 'alpha': 8.767794362661395, 'subsample': 0.5442212978709049, 'colsample_bytree': 0.5712081941414798, 'max_depth': 4, 'min_child_weight': 7, 'eta': 0.00616446931052838, 'gamma': 0.834523389584062}. Best is trial 11 with value: -1.4202427463979368.     
[I 2025-06-29 23:10:30,609] Trial 21 finished with value: -1.4512042302078543 and parameters: {'booster': 'gbtree', 'lambda': 0.0011729667499961879, 'alpha': 0.10798462771238893, 'subsample': 0.794683436032345, 'colsample_bytree': 0.7088399414319628, 'max_depth': 4, 'min_child_weight': 9, 'eta': 0.15352005332023552, 'gamma': 3.04643857027632}. Best is trial 11 with value: -1.4202427463979368.     
[I 2025-06-29 23:10:30,724] Trial 22 finished with value: -1.4545850394458724 and parameters: {'booster': 'gbtree', 'lambda': 0.031810190881923044, 'alpha': 1.801065957590746, 'subsample': 0.7285732650885376, 'colsample_bytree': 0.5935143439797197, 'max_depth': 6, 'min_child_weight': 7, 'eta': 0.057690186335872716, 'gamma': 3.7830787244845854}. Best is trial 11 with value: -1.4202427463979368.    
[I 2025-06-29 23:10:30,811] Trial 23 finished with value: -1.463227356411115 and parameters: {'booster': 'gbtree', 'lambda': 0.00018191845003105427, 'alpha': 0.083660605543615, 'subsample': 0.6543733410108735, 'colsample_bytree': 0.8083297831933981, 'max_depth': 3, 'min_child_weight': 9, 'eta': 0.1576429846580664, 'gamma': 2.2170500278689826}. Best is trial 11 with value: -1.4202427463979368.     
[I 2025-06-29 23:10:30,891] Trial 24 finished with value: -1.4935430966544814 and parameters: {'booster': 'gbtree', 'lambda': 0.004446802463092652, 'alpha': 1.153366581967052, 'subsample': 0.8000177974151956, 'colsample_bytree': 0.6894410047207399, 'max_depth': 4, 'min_child_weight': 8, 'eta': 0.2919925833049817, 'gamma': 3.8364418533150024}. Best is trial 11 with value: -1.4202427463979368.      
[I 2025-06-29 23:10:31,144] Trial 25 finished with value: -1.421636412690966 and parameters: {'booster': 'gbtree', 'lambda': 0.09656899197681693, 'alpha': 0.0022621681138914615, 'subsample': 0.8869491250873591, 'colsample_bytree': 0.8873173965594228, 'max_depth': 8, 'min_child_weight': 10, 'eta': 0.028538845513022333, 'gamma': 2.968223890859209}. Best is trial 11 with value: -1.4202427463979368.  
[I 2025-06-29 23:10:31,352] Trial 26 finished with value: -1.4426164637509495 and parameters: {'booster': 'gbtree', 'lambda': 0.18121768272499894, 'alpha': 0.0029012894344403817, 'subsample': 0.9932917299430981, 'colsample_bytree': 0.9193832395663861, 'max_depth': 8, 'min_child_weight': 10, 'eta': 0.02655041201588642, 'gamma': 2.8857804882343787}. Best is trial 11 with value: -1.4202427463979368. 
[I 2025-06-29 23:10:31,535] Trial 27 finished with value: -1.494245064617114 and parameters: {'booster': 'gbtree', 'lambda': 0.08292631353711068, 'alpha': 0.0004646330037767867, 'subsample': 0.8748578897809605, 'colsample_bytree': 0.9275947788010979, 'max_depth': 7, 'min_child_weight': 3, 'eta': 0.018267105702558493, 'gamma': 2.2934531305176664}. Best is trial 11 with value: -1.4202427463979368.  
[I 2025-06-29 23:10:31,952] Trial 28 finished with value: -1.4560552959846529 and parameters: {'booster': 'gbtree', 'lambda': 1.5014353173770936, 'alpha': 0.003045982278387186, 'subsample': 0.951083077056547, 'colsample_bytree': 0.8473910840690737, 'max_depth': 8, 'min_child_weight': 5, 'eta': 0.005741524913580884, 'gamma': 1.3712646223271485}. Best is trial 11 with value: -1.4202427463979368.    
[I 2025-06-29 23:10:32,041] Trial 29 finished with value: -1.4654626976980583 and parameters: {'booster': 'gbtree', 'lambda': 0.029582262079994207, 'alpha': 8.454392042474902e-06, 'subsample': 0.653699869408517, 'colsample_bytree': 0.893009003857413, 'max_depth': 10, 'min_child_weight': 4, 'eta': 0.07294213572702499, 'gamma': 3.6385061267968077}. Best is trial 11 with value: -1.4202427463979368.  
[I 2025-06-29 23:10:32,211] Trial 30 finished with value: -1.4369437220388483 and parameters: {'booster': 'gbtree', 'lambda': 1.1913825789104402, 'alpha': 3.175078178230745, 'subsample': 0.8777290478027315, 'colsample_bytree': 0.9451301897000388, 'max_depth': 8, 'min_child_weight': 10, 'eta': 0.03905385997168132, 'gamma': 2.9679870245341853}. Best is trial 11 with value: -1.4202427463979368.      
[I 2025-06-29 23:10:32,401] Trial 31 finished with value: -1.4365783156500596 and parameters: {'booster': 'gbtree', 'lambda': 0.9095167944702554, 'alpha': 3.841682203585115, 'subsample': 0.9162747061906542, 'colsample_bytree': 0.9441289667317245, 'max_depth': 8, 'min_child_weight': 10, 'eta': 0.02172880400990931, 'gamma': 2.9967205150889153}. Best is trial 11 with value: -1.4202427463979368.      
[I 2025-06-29 23:10:32,619] Trial 32 finished with value: -1.446795033029066 and parameters: {'booster': 'gbtree', 'lambda': 0.07147345897596252, 'alpha': 0.19636366973693914, 'subsample': 0.9103356831221712, 'colsample_bytree': 0.9553605646101045, 'max_depth': 8, 'min_child_weight': 9, 'eta': 0.019224121517182082, 'gamma': 2.5333209963337273}. Best is trial 11 with value: -1.4202427463979368.    
[I 2025-06-29 23:10:32,861] Trial 33 finished with value: -1.4456672495245073 and parameters: {'booster': 'gbtree', 'lambda': 0.008412500966280028, 'alpha': 3.4023123801448047, 'subsample': 0.9558447887573583, 'colsample_bytree': 0.8200785149382694, 'max_depth': 7, 'min_child_weight': 10, 'eta': 0.012166731775178937, 'gamma': 3.168357325643266}. Best is trial 11 with value: -1.4202427463979368.   
[I 2025-06-29 23:10:33,172] Trial 34 finished with value: -1.429420460505986 and parameters: {'booster': 'gbtree', 'lambda': 1.2685018204391312, 'alpha': 6.784882111238747e-07, 'subsample': 0.7718842297694346, 'colsample_bytree': 0.8536989832596684, 'max_depth': 8, 'min_child_weight': 9, 'eta': 0.010896369521430445, 'gamma': 4.145219268609851}. Best is trial 11 with value: -1.4202427463979368.    
[I 2025-06-29 23:10:33,532] Trial 35 finished with value: -1.548448130405948 and parameters: {'booster': 'gbtree', 'lambda': 7.614694716655571, 'alpha': 9.633512955617696e-07, 'subsample': 0.7763772891386553, 'colsample_bytree': 0.854357681027078, 'max_depth': 9, 'min_child_weight': 8, 'eta': 0.004187007405712193, 'gamma': 4.188446151717029}. Best is trial 11 with value: -1.4202427463979368.      
[I 2025-06-29 23:10:40,280] Trial 36 finished with value: -1.448598741164966 and parameters: {'booster': 'dart', 'lambda': 0.0015160043383356642, 'alpha': 2.5999932731791613e-07, 'subsample': 0.7254689146915922, 'colsample_bytree': 0.7301967189940674, 'max_depth': 5, 'min_child_weight': 7, 'eta': 0.010468619294994578, 'gamma': 4.8297233212734145, 'rate_drop': 1.0873954059776861e-08, 'skip_drop': 1.0977996270345197e-08}. Best is trial 11 with value: -1.4202427463979368.
[I 2025-06-29 23:10:40,427] Trial 37 finished with value: -1.4085538948170737 and parameters: {'booster': 'gbtree', 'lambda': 6.629306458456309e-06, 'alpha': 2.4856592758263288e-05, 'subsample': 0.8127556155175815, 'colsample_bytree': 0.7932468912463128, 'max_depth': 6, 'min_child_weight': 9, 'eta': 0.038267694705840925, 'gamma': 4.038523445744098}. Best is trial 37 with value: -1.4085538948170737.
[I 2025-06-29 23:10:47,571] Trial 38 finished with value: -1.4663493740366345 and parameters: {'booster': 'dart', 'lambda': 4.217066591275221e-06, 'alpha': 2.380325595157097e-05, 'subsample': 0.8126426301576103, 'colsample_bytree': 0.7908207333446856, 'max_depth': 6, 'min_child_weight': 9, 'eta': 0.0715119004681398, 'gamma': 4.605531141044446, 'rate_drop': 0.17474675262336237, 'skip_drop': 0.003553395330785456}. Best is trial 37 with value: -1.4085538948170737.
[I 2025-06-29 23:10:47,888] Trial 39 finished with value: -1.7174855003939868 and parameters: {'booster': 'gbtree', 'lambda': 6.061176902066683e-07, 'alpha': 6.521776292577797e-06, 'subsample': 0.7724578407621816, 'colsample_bytree': 0.8263817887219123, 'max_depth': 7, 'min_child_weight': 10, 'eta': 0.0015252351067756298, 'gamma': 4.022963069745869}. Best is trial 37 with value: -1.4085538948170737.
[I 2025-06-29 23:10:51,993] Trial 40 finished with value: -1.4390788461470227 and parameters: {'booster': 'dart', 'lambda': 1.8874626338502313e-08, 'alpha': 3.07081365724659e-07, 'subsample': 0.8587803360736368, 'colsample_bytree': 0.8904366121206614, 'max_depth': 10, 'min_child_weight': 9, 'eta': 0.04693494221416598, 'gamma': 4.43973838980657, 'rate_drop': 7.103569373573843e-08, 'skip_drop': 0.749000380435084}. Best is trial 37 with value: -1.4085538948170737.
[I 2025-06-29 23:10:52,111] Trial 41 finished with value: -1.4599623318105943 and parameters: {'booster': 'gbtree', 'lambda': 0.00019140376215461889, 'alpha': 0.000144669495602835, 'subsample': 0.7359343760042756, 'colsample_bytree': 0.7857016912822727, 'max_depth': 5, 'min_child_weight': 8, 'eta': 0.03688413057340983, 'gamma': 3.4669583646115516}. Best is trial 37 with value: -1.4085538948170737.
[I 2025-06-29 23:10:52,336] Trial 42 finished with value: -1.4312031704202635 and parameters: {'booster': 'gbtree', 'lambda': 2.0177706261888352e-05, 'alpha': 2.2086366524127167e-06, 'subsample': 0.8407712549913378, 'colsample_bytree': 0.7477151299860346, 'max_depth': 9, 'min_child_weight': 9, 'eta': 0.013987693665327691, 'gamma': 4.988336970287423}. Best is trial 37 with value: -1.4085538948170737.
[I 2025-06-29 23:10:52,641] Trial 43 finished with value: -1.4412992545237835 and parameters: {'booster': 'gbtree', 'lambda': 1.2563840799744927e-05, 'alpha': 3.0325309833943316e-06, 'subsample': 0.8288718313621175, 'colsample_bytree': 0.7378878703986462, 'max_depth': 9, 'min_child_weight': 9, 'eta': 0.007475289990672763, 'gamma': 4.071496977129518}. Best is trial 37 with value: -1.4085538948170737.
[I 2025-06-29 23:10:52,867] Trial 44 finished with value: -1.4278417809694535 and parameters: {'booster': 'gbtree', 'lambda': 7.136835008707937e-05, 'alpha': 3.229024474801902e-05, 'subsample': 0.8509697315058457, 'colsample_bytree': 0.7592137840282224, 'max_depth': 9, 'min_child_weight': 10, 'eta': 0.014796319218617031, 'gamma': 4.965745463686185}. Best is trial 37 with value: -1.4085538948170737.
[I 2025-06-29 23:10:53,059] Trial 45 finished with value: -1.4173069905226836 and parameters: {'booster': 'gbtree', 'lambda': 4.899884163233508e-06, 'alpha': 2.991824892231023e-05, 'subsample': 0.8939938998942195, 'colsample_bytree': 0.8422212973149996, 'max_depth': 10, 'min_child_weight': 10, 'eta': 0.02413997439040364, 'gamma': 4.637851791001734}. Best is trial 37 with value: -1.4085538948170737.
[I 2025-06-29 23:10:56,959] Trial 46 finished with value: -2.085019169947391 and parameters: {'booster': 'dart', 'lambda': 7.16634906175806e-05, 'alpha': 2.3248058533496353e-05, 'subsample': 0.8830033276625606, 'colsample_bytree': 0.7693333026181137, 'max_depth': 10, 'min_child_weight': 10, 'eta': 0.015559826976607844, 'gamma': 4.677526681874388, 'rate_drop': 0.8502396972719692, 'skip_drop': 0.004976525359881189}. Best is trial 37 with value: -1.4085538948170737.
[I 2025-06-29 23:10:57,163] Trial 47 finished with value: -1.4223748896256316 and parameters: {'booster': 'gbtree', 'lambda': 4.649482851735644e-06, 'alpha': 7.770621440242803e-05, 'subsample': 0.9384180990738195, 'colsample_bytree': 0.8391388294679593, 'max_depth': 9, 'min_child_weight': 10, 'eta': 0.024343813929447383, 'gamma': 4.443148573101807}. Best is trial 37 with value: -1.4085538948170737.
[I 2025-06-29 23:10:57,355] Trial 48 finished with value: -1.424683898452268 and parameters: {'booster': 'gbtree', 'lambda': 3.899791865369332e-07, 'alpha': 0.00011340631190994815, 'subsample': 0.9326596346029091, 'colsample_bytree': 0.8410614222321003, 'max_depth': 10, 'min_child_weight': 10, 'eta': 0.02316945998800232, 'gamma': 4.431226068139814}. Best is trial 37 with value: -1.4085538948170737.
