PS D:\machile_nearning\wecode_score_prediction\dataset-hard-problem-fixed\XGBoost-CK> python .\train.py
[I 2025-06-29 21:43:28,629] A new study created in memory with name: no-name-a51b5686-efe9-4277-bc14-37494b7fa1a4
[I 2025-06-29 21:43:29,019] Trial 0 finished with value: -1.8212095900280745 and parameters: {'booster': 'gbtree', 'lambda': 1.7313529226179848e-06, 'alpha': 0.16837826116810117, 'subsample': 0.9679026808552778, 'colsample_bytree': 0.827490738812982, 'max_depth': 3, 'min_child_weight': 5, 'eta': 0.0010734640965218663, 'gamma': 3.0490798981623026}. Best is trial 0 with value: -1.8212095900280745.
[I 2025-06-29 21:43:29,151] Trial 1 finished with value: -1.806545918637735 and parameters: {'booster': 'dart', 'lambda': 1.7630243404806092, 'alpha': 2.7549765484209277e-05, 'subsample': 0.6016023093583612, 'colsample_bytree': 0.784127449109328, 'max_depth': 4, 'min_child_weight': 1, 'eta': 0.2996915680486437, 'gamma': 3.7798716834060104, 'rate_drop': 1.2153757018277167e-07, 'skip_drop': 0.3593648261938533}. Best is trial 1 with value: -1.806545918637735.
[I 2025-06-29 21:43:29,346] Trial 2 finished with value: -1.6699155533991759 and parameters: {'booster': 'gbtree', 'lambda': 2.1131901504051833, 'alpha': 0.10873084355623662, 'subsample': 0.5985937578928622, 'colsample_bytree': 0.794483514237315, 'max_depth': 4, 'min_child_weight': 4, 'eta': 0.002749181668267797, 'gamma': 1.3640552045749117}. Best is trial 2 with value: -1.6699155533991759.
[I 2025-06-29 21:43:29,598] Trial 3 finished with value: -1.6363282176553986 and parameters: {'booster': 'gbtree', 'lambda': 0.04418019028779062, 'alpha': 0.004322153481322873, 'subsample': 0.7661835752315751, 'colsample_bytree': 0.8509264471669715, 'max_depth': 6, 'min_child_weight': 8, 'eta': 0.0035194028859473945, 'gamma': 2.518420522061514}. Best is trial 3 with value: -1.6363282176553986.
[I 2025-06-29 21:43:29,650] Trial 4 finished with value: -1.6487818012480853 and parameters: {'booster': 'gbtree', 'lambda': 0.06908787853323381, 'alpha': 0.024498424670244573, 'subsample': 0.7313496867246922, 'colsample_bytree': 0.9821012508064729, 'max_depth': 4, 'min_child_weight': 1, 'eta': 0.03763902340439942, 'gamma': 4.612705398004884}. Best is trial 3 with value: -1.6363282176553986.
[I 2025-06-29 21:43:29,913] Trial 5 finished with value: -1.6628676211372553 and parameters: {'booster': 'gbtree', 'lambda': 0.4528861495521568, 'alpha': 1.1806694444701662e-05, 'subsample': 0.9258156349886907, 'colsample_bytree': 0.6069740871973539, 'max_depth': 6, 'min_child_weight': 3, 'eta': 0.00528846433083524, 'gamma': 0.09249388307010664}. Best is trial 3 with value: -1.6363282176553986.
[I 2025-06-29 21:43:30,078] Trial 6 finished with value: -1.775404385558781 and parameters: {'booster': 'dart', 'lambda': 5.323042686904764e-07, 'alpha': 0.002130334857002984, 'subsample': 0.868729247408593, 'colsample_bytree': 0.6254937554073208, 'max_depth': 5, 'min_child_weight': 2, 'eta': 0.10243087315017685, 'gamma': 0.22189540739429747, 'rate_drop': 4.993004373025036e-06, 'skip_drop': 3.763116971480237e-05}. Best is trial 3 with value: -1.6363282176553986.     
[I 2025-06-29 21:43:30,106] Trial 7 finished with value: -1.697096504391979 and parameters: {'booster': 'gbtree', 'lambda': 6.595509243412598e-06, 'alpha': 0.050531895103169175, 'subsample': 0.8978049373605299, 'colsample_bytree': 0.887054481424096, 'max_depth': 9, 'min_child_weight': 2, 'eta': 0.1513411202151955, 'gamma': 4.124006755560203}. Best is trial 3 with value: -1.6363282176553986.
[I 2025-06-29 21:43:30,303] Trial 8 finished with value: -1.627585650984612 and parameters: {'booster': 'gbtree', 'lambda': 0.5397267012011289, 'alpha': 5.507324349574033e-08, 'subsample': 0.7109058339225369, 'colsample_bytree': 0.9256099122153357, 'max_depth': 5, 'min_child_weight': 6, 'eta': 0.006713376710693977, 'gamma': 3.932090255494574}. Best is trial 8 with value: -1.627585650984612.
[I 2025-06-29 21:43:30,672] Trial 9 finished with value: -1.6631196157643227 and parameters: {'booster': 'dart', 'lambda': 0.000459474128899597, 'alpha': 5.646744493309755e-07, 'subsample': 0.8917116755401097, 'colsample_bytree': 0.8179484865238774, 'max_depth': 4, 'min_child_weight': 6, 'eta': 0.04451382250770516, 'gamma': 3.093577056875436, 'rate_drop': 8.31809391588374e-05, 'skip_drop': 0.2707631854125644}. Best is trial 8 with value: -1.627585650984612.
[I 2025-06-29 21:43:35,255] Trial 10 finished with value: -1.948499471337953 and parameters: {'booster': 'dart', 'lambda': 0.0010071952287500525, 'alpha': 2.0305429103290688e-08, 'subsample': 0.5026054210246376, 'colsample_bytree': 0.990700649646348, 'max_depth': 8, 'min_child_weight': 10, 'eta': 0.01156766823827815, 'gamma': 4.894935412869773, 'rate_drop': 0.7622887221622926, 'skip_drop': 4.086268826634481e-08}. Best is trial 8 with value: -1.627585650984612.       
[I 2025-06-29 21:43:35,592] Trial 11 finished with value: -1.6592231756849247 and parameters: {'booster': 'gbtree', 'lambda': 0.012653337044347198, 'alpha': 5.094710783520677, 'subsample': 0.7619679015088798, 'colsample_bytree': 0.904495644514996, 'max_depth': 7, 'min_child_weight': 8, 'eta': 0.006468276503928174, 'gamma': 1.9119694399347502}. Best is trial 8 with value: -1.627585650984612.
[I 2025-06-29 21:43:35,988] Trial 12 finished with value: -1.702789653057525 and parameters: {'booster': 'gbtree', 'lambda': 0.010546742802148285, 'alpha': 0.0009869887730379195, 'subsample': 0.7520489751136195, 'colsample_bytree': 0.6979483822758683, 'max_depth': 6, 'min_child_weight': 7, 'eta': 0.0017872328086777454, 'gamma': 2.2743712552329036}. Best is trial 8 with value: -1.627585650984612.
[I 2025-06-29 21:43:36,194] Trial 13 finished with value: -1.6645435860641247 and parameters: {'booster': 'gbtree', 'lambda': 0.09173940134980964, 'alpha': 1.022420197664758e-07, 'subsample': 0.662978048405067, 'colsample_bytree': 0.9089021149215997, 'max_depth': 10, 'min_child_weight': 9, 'eta': 0.016300472757224977, 'gamma': 3.224175980489205}. Best is trial 8 with value: -1.627585650984612.
[I 2025-06-29 21:43:36,547] Trial 14 finished with value: -1.6498400259219745 and parameters: {'booster': 'gbtree', 'lambda': 1.3744318320230726e-08, 'alpha': 3.962560177312123e-05, 'subsample': 0.8124176481614113, 'colsample_bytree': 0.7106126535707942, 'max_depth': 7, 'min_child_weight': 7, 'eta': 0.003982492163373259, 'gamma': 1.0489497806175718}. Best is trial 8 with value: -1.627585650984612.
[I 2025-06-29 21:43:36,814] Trial 15 finished with value: -1.632448563516659 and parameters: {'booster': 'gbtree', 'lambda': 8.902502971105779, 'alpha': 1.6495854394853396e-06, 'subsample': 0.6832626385013529, 'colsample_bytree': 0.8741311397044217, 'max_depth': 5, 'min_child_weight': 6, 'eta': 0.00746388818417286, 'gamma': 3.7764979061635784}. Best is trial 8 with value: -1.627585650984612.
[I 2025-06-29 21:43:37,154] Trial 16 finished with value: -1.6411596289681487 and parameters: {'booster': 'gbtree', 'lambda': 9.747297943600971, 'alpha': 1.6395100906455982e-06, 'subsample': 0.6713793622746611, 'colsample_bytree': 0.940583128008253, 'max_depth': 5, 'min_child_weight': 5, 'eta': 0.008293838769079213, 'gamma': 4.0073931566971535}. Best is trial 8 with value: -1.627585650984612.
[I 2025-06-29 21:43:37,295] Trial 17 finished with value: -1.6219111543289595 and parameters: {'booster': 'gbtree', 'lambda': 5.990067502366932, 'alpha': 1.237678199732831e-08, 'subsample': 0.6765024805138484, 'colsample_bytree': 0.5011273664747804, 'max_depth': 3, 'min_child_weight': 6, 'eta': 0.02623742842525085, 'gamma': 3.545197286620371}. Best is trial 17 with value: -1.6219111543289595.
[I 2025-06-29 21:43:43,105] Trial 18 finished with value: -1.8403899654819056 and parameters: {'booster': 'dart', 'lambda': 2.866660334204089e-05, 'alpha': 1.0376712431408169e-08, 'subsample': 0.5973768100843642, 'colsample_bytree': 0.5009845677941096, 'max_depth': 3, 'min_child_weight': 4, 'eta': 0.03209994969403963, 'gamma': 4.424649329342752, 'rate_drop': 0.43169921005009054, 'skip_drop': 1.1446215183027329e-08}. Best is trial 17 with value: -1.6219111543289595.  
[I 2025-06-29 21:43:43,242] Trial 19 finished with value: -1.599588574954905 and parameters: {'booster': 'gbtree', 'lambda': 0.0028589020244403677, 'alpha': 1.4986422027912483e-07, 'subsample': 0.5176911516670515, 'colsample_bytree': 0.535814576719547, 'max_depth': 3, 'min_child_weight': 7, 'eta': 0.022290525991396935, 'gamma': 3.2844188577045275}. Best is trial 19 with value: -1.599588574954905.
[I 2025-06-29 21:43:43,357] Trial 20 finished with value: -1.6275141583223387 and parameters: {'booster': 'gbtree', 'lambda': 0.0019454527872579952, 'alpha': 2.9827345125185795e-07, 'subsample': 0.5096732498924935, 'colsample_bytree': 0.5339719341930723, 'max_depth': 3, 'min_child_weight': 8, 'eta': 0.07063613577629958, 'gamma': 3.3723882816133575}. Best is trial 19 with value: -1.599588574954905.
[I 2025-06-29 21:43:43,470] Trial 21 finished with value: -1.6458044741662958 and parameters: {'booster': 'gbtree', 'lambda': 0.002150968805784732, 'alpha': 2.5086085452903675e-07, 'subsample': 0.5061030139994814, 'colsample_bytree': 0.5085643807556223, 'max_depth': 3, 'min_child_weight': 8, 'eta': 0.07504330260024791, 'gamma': 3.4004425367664286}. Best is trial 19 with value: -1.599588574954905.
[I 2025-06-29 21:43:43,602] Trial 22 finished with value: -1.6136083188024546 and parameters: {'booster': 'gbtree', 'lambda': 5.500626610112742e-05, 'alpha': 3.967991156352438e-06, 'subsample': 0.5612782563549941, 'colsample_bytree': 0.5701555255362937, 'max_depth': 3, 'min_child_weight': 10, 'eta': 0.01828593599616369, 'gamma': 2.6214235239748502}. Best is trial 19 with value: -1.599588574954905.
[I 2025-06-29 21:43:43,707] Trial 23 finished with value: -1.6090704870070955 and parameters: {'booster': 'gbtree', 'lambda': 5.457870316937663e-05, 'alpha': 6.581196055360903e-06, 'subsample': 0.5691999173677917, 'colsample_bytree': 0.5700230724362142, 'max_depth': 3, 'min_child_weight': 10, 'eta': 0.023492041380946446, 'gamma': 2.6193497926095075}. Best is trial 19 with value: -1.599588574954905.
[I 2025-06-29 21:43:43,838] Trial 24 finished with value: -1.6201020542802107 and parameters: {'booster': 'gbtree', 'lambda': 6.097097294523971e-05, 'alpha': 5.580607489875846e-06, 'subsample': 0.5801534276376874, 'colsample_bytree': 0.5747110311359134, 'max_depth': 4, 'min_child_weight': 10, 'eta': 0.019878122615346855, 'gamma': 2.623901956834762}. Best is trial 19 with value: -1.599588574954905.
[I 2025-06-29 21:43:44,000] Trial 25 finished with value: -1.610914573666389 and parameters: {'booster': 'gbtree', 'lambda': 0.0001767664295726214, 'alpha': 0.00015372439835308497, 'subsample': 0.5529642957869542, 'colsample_bytree': 0.6518221529281294, 'max_depth': 3, 'min_child_weight': 9, 'eta': 0.013780169065811977, 'gamma': 2.0010760181366685}. Best is trial 19 with value: -1.599588574954905.
[I 2025-06-29 21:43:47,259] Trial 26 finished with value: -1.619501673891721 and parameters: {'booster': 'dart', 'lambda': 0.00024559433384560466, 'alpha': 0.00015930546321272422, 'subsample': 0.5472223010368933, 'colsample_bytree': 0.6575792667079002, 'max_depth': 4, 'min_child_weight': 9, 'eta': 0.01232799378053244, 'gamma': 1.832846777612487, 'rate_drop': 1.2385316400534324e-08, 'skip_drop': 0.00020443064366863043}. Best is trial 19 with value: -1.599588574954905.
[I 2025-06-29 21:43:47,361] Trial 27 finished with value: -1.6278452621598296 and parameters: {'booster': 'gbtree', 'lambda': 1.0437913802478829e-05, 'alpha': 8.137116792937455e-05, 'subsample': 0.6416425998476378, 'colsample_bytree': 0.6476332219958093, 'max_depth': 3, 'min_child_weight': 9, 'eta': 0.04745338341940715, 'gamma': 1.144122823647048}. Best is trial 19 with value: -1.599588574954905.
[I 2025-06-29 21:43:47,562] Trial 28 finished with value: -1.6063950136468228 and parameters: {'booster': 'gbtree', 'lambda': 1.6729244909520137e-07, 'alpha': 0.00026450115823989454, 'subsample': 0.5416404834099806, 'colsample_bytree': 0.5579990900461482, 'max_depth': 5, 'min_child_weight': 9, 'eta': 0.012451497238783802, 'gamma': 2.0617399759166184}. Best is trial 19 with value: -1.599588574954905.
[I 2025-06-29 21:43:47,875] Trial 29 finished with value: -1.801926875785318 and parameters: {'booster': 'gbtree', 'lambda': 3.1439099453148983e-07, 'alpha': 0.0004359391931711309, 'subsample': 0.6158551174210232, 'colsample_bytree': 0.5522826601296946, 'max_depth': 5, 'min_child_weight': 7, 'eta': 0.001083170656331539, 'gamma': 2.9458678657335877}. Best is trial 19 with value: -1.599588574954905.
[I 2025-06-29 21:43:48,095] Trial 30 finished with value: -1.61194946632173 and parameters: {'booster': 'gbtree', 'lambda': 1.8252525399227406e-08, 'alpha': 1.089951269018022, 'subsample': 0.5380062572213571, 'colsample_bytree': 0.5973477945061809, 'max_depth': 4, 'min_child_weight': 10, 'eta': 0.00958925965916778, 'gamma': 1.5174823177912016}. Best is trial 19 with value: -1.599588574954905.
[I 2025-06-29 21:43:48,217] Trial 31 finished with value: -1.616543142379956 and parameters: {'booster': 'gbtree', 'lambda': 1.3124195243490686e-07, 'alpha': 0.00026968550798171374, 'subsample': 0.5437258416468379, 'colsample_bytree': 0.6996028447996482, 'max_depth': 3, 'min_child_weight': 9, 'eta': 0.025794430994413187, 'gamma': 2.168292845671248}. Best is trial 19 with value: -1.599588574954905.
[I 2025-06-29 21:43:48,381] Trial 32 finished with value: -1.6129603156356085 and parameters: {'booster': 'gbtree', 'lambda': 2.385642239595173e-06, 'alpha': 1.3620438718475299e-05, 'subsample': 0.6180456287707916, 'colsample_bytree': 0.5319740634716728, 'max_depth': 4, 'min_child_weight': 9, 'eta': 0.015016036440276772, 'gamma': 2.846706151569979}. Best is trial 19 with value: -1.599588574954905.
[I 2025-06-29 21:43:48,523] Trial 33 finished with value: -1.6458034940940203 and parameters: {'booster': 'gbtree', 'lambda': 0.0002047492938675559, 'alpha': 0.00803250391107847, 'subsample': 0.9982557639993711, 'colsample_bytree': 0.6586981734295442, 'max_depth': 3, 'min_child_weight': 10, 'eta': 0.0292932490870839, 'gamma': 2.045408608895663}. Best is trial 19 with value: -1.599588574954905.
[I 2025-06-29 21:43:48,695] Trial 34 finished with value: -1.6226830698034331 and parameters: {'booster': 'gbtree', 'lambda': 0.004646421888081797, 'alpha': 5.0692545847572405e-05, 'subsample': 0.5729360764338934, 'colsample_bytree': 0.7465631612251881, 'max_depth': 4, 'min_child_weight': 8, 'eta': 0.011773019065990634, 'gamma': 1.4549192101543196}. Best is trial 19 with value: -1.599588574954905.
[I 2025-06-29 21:43:48,830] Trial 35 finished with value: -1.5999178273222818 and parameters: {'booster': 'gbtree', 'lambda': 5.3478113307983764e-08, 'alpha': 0.0008727587996472182, 'subsample': 0.5317732093140013, 'colsample_bytree': 0.5984235904530429, 'max_depth': 3, 'min_child_weight': 7, 'eta': 0.022172002490394173, 'gamma': 0.7579472578151014}. Best is trial 19 with value: -1.599588574954905.
[I 2025-06-29 21:43:49,285] Trial 36 finished with value: -1.6596823784503376 and parameters: {'booster': 'dart', 'lambda': 5.324792621731139e-08, 'alpha': 0.0009427794174647359, 'subsample': 0.5265717201350031, 'colsample_bytree': 0.586674606031764, 'max_depth': 5, 'min_child_weight': 7, 'eta': 0.055812732830734936, 'gamma': 0.46132706067476104, 'rate_drop': 0.005613179949670766, 'skip_drop': 0.000198289560486873}. Best is trial 19 with value: -1.599588574954905.   
[I 2025-06-29 21:43:49,442] Trial 37 finished with value: -1.6437492465695878 and parameters: {'booster': 'gbtree', 'lambda': 1.099866878215548e-06, 'alpha': 0.00868887289039973, 'subsample': 0.6385322021964018, 'colsample_bytree': 0.6173334858390465, 'max_depth': 6, 'min_child_weight': 4, 'eta': 0.021043573745694637, 'gamma': 0.9527401569353844}. Best is trial 19 with value: -1.599588574954905.
[I 2025-06-29 21:43:49,515] Trial 38 finished with value: -1.773945016988815 and parameters: {'booster': 'gbtree', 'lambda': 4.231310343817971e-06, 'alpha': 0.34909303793069946, 'subsample': 0.588139241111131, 'colsample_bytree': 0.5518633090634778, 'max_depth': 4, 'min_child_weight': 7, 'eta': 0.21148126251888782, 'gamma': 0.4500987847791983}. Best is trial 19 with value: -1.599588574954905.
[I 2025-06-29 21:43:49,853] Trial 39 finished with value: -1.6369213502871474 and parameters: {'booster': 'gbtree', 'lambda': 6.222223154213749e-08, 'alpha': 0.0022376819452428953, 'subsample': 0.8020697999363198, 'colsample_bytree': 0.5321340483364153, 'max_depth': 7, 'min_child_weight': 8, 'eta': 0.004754423073417221, 'gamma': 2.3710081628702095}. Best is trial 19 with value: -1.599588574954905.
[I 2025-06-29 21:43:50,261] Trial 40 finished with value: -1.667895483340744 and parameters: {'booster': 'dart', 'lambda': 3.78130424344661e-07, 'alpha': 1.0726169021201375e-06, 'subsample': 0.5281047611803205, 'colsample_bytree': 0.6249646209447756, 'max_depth': 8, 'min_child_weight': 5, 'eta': 0.038424968491666434, 'gamma': 2.8389439928960454, 'rate_drop': 0.003976725972499463, 'skip_drop': 2.2272570232062105e-06}. Best is trial 19 with value: -1.599588574954905.  
[I 2025-06-29 21:43:50,435] Trial 41 finished with value: -1.601176678093243 and parameters: {'booster': 'gbtree', 'lambda': 1.4890568206389229e-05, 'alpha': 1.862192336776153e-05, 'subsample': 0.5609187340429651, 'colsample_bytree': 0.565436443176523, 'max_depth': 3, 'min_child_weight': 9, 'eta': 0.014623771257088088, 'gamma': 1.6352392924755828}. Best is trial 19 with value: -1.599588574954905.
[I 2025-06-29 21:43:50,547] Trial 42 finished with value: -1.6097981778431876 and parameters: {'booster': 'gbtree', 'lambda': 1.461263411544303e-05, 'alpha': 1.3600817049109608e-05, 'subsample': 0.5697048203070835, 'colsample_bytree': 0.5622803305024664, 'max_depth': 3, 'min_child_weight': 8, 'eta': 0.024993512735722815, 'gamma': 1.741742875150209}. Best is trial 19 with value: -1.599588574954905.
[I 2025-06-29 21:43:50,786] Trial 43 finished with value: -1.615310007451066 and parameters: {'booster': 'gbtree', 'lambda': 1.19656438364718e-06, 'alpha': 4.120351517025191e-06, 'subsample': 0.6121245932237822, 'colsample_bytree': 0.5870027353523781, 'max_depth': 4, 'min_child_weight': 9, 'eta': 0.009851580284354887, 'gamma': 0.8207964056258908}. Best is trial 19 with value: -1.599588574954905.
[I 2025-06-29 21:43:50,917] Trial 44 finished with value: -1.6094019755383309 and parameters: {'booster': 'gbtree', 'lambda': 7.601366129202539e-08, 'alpha': 1.8494024254382346e-05, 'subsample': 0.5227909265807764, 'colsample_bytree': 0.5309264186640898, 'max_depth': 3, 'min_child_weight': 10, 'eta': 0.02028660368424631, 'gamma': 1.6011847963357146}. Best is trial 19 with value: -1.599588574954905.
[I 2025-06-29 21:43:51,014] Trial 45 finished with value: -1.6273251460563716 and parameters: {'booster': 'gbtree', 'lambda': 0.0007594073279718317, 'alpha': 0.0006308749998702617, 'subsample': 0.7129715198276445, 'colsample_bytree': 0.6035240015169752, 'max_depth': 4, 'min_child_weight': 5, 'eta': 0.0374712511948063, 'gamma': 1.2427903751894935}. Best is trial 19 with value: -1.599588574954905.
[I 2025-06-29 21:43:51,155] Trial 46 finished with value: -1.6265367965241961 and parameters: {'booster': 'gbtree', 'lambda': 8.520143210387539e-05, 'alpha': 8.927075610269557e-08, 'subsample': 0.6345536762885806, 'colsample_bytree': 0.6326827053738731, 'max_depth': 5, 'min_child_weight': 8, 'eta': 0.014821134972941987, 'gamma': 2.420283445083596}. Best is trial 19 with value: -1.599588574954905.
[I 2025-06-29 21:43:51,245] Trial 47 finished with value: -1.6295704852773125 and parameters: {'booster': 'gbtree', 'lambda': 0.026266968595652605, 'alpha': 7.656351775241161e-05, 'subsample': 0.5039015305579427, 'colsample_bytree': 0.6775432278468903, 'max_depth': 3, 'min_child_weight': 6, 'eta': 0.05628507573006695, 'gamma': 0.6915207659729102}. Best is trial 19 with value: -1.599588574954905.
[I 2025-06-29 21:44:00,361] Trial 48 finished with value: -1.6474161571662578 and parameters: {'booster': 'dart', 'lambda': 1.9445096142218633e-07, 'alpha': 0.0025291498713767083, 'subsample': 0.5891014587460671, 'colsample_bytree': 0.7606288202913764, 'max_depth': 6, 'min_child_weight': 7, 'eta': 0.0027867054363788363, 'gamma': 0.09716786057047178, 'rate_drop': 3.2388575917473236e-06, 'skip_drop': 0.010930374255284795}. Best is trial 19 with value: -1.599588574954905.
[I 2025-06-29 21:44:00,631] Trial 49 finished with value: -1.6077973210208383 and parameters: {'booster': 'gbtree', 'lambda': 2.983727211076446e-08, 'alpha': 0.01950875258653306, 'subsample': 0.5601726165997019, 'colsample_bytree': 0.548926225272846, 'max_depth': 4, 'min_child_weight': 9, 'eta': 0.005808722950502096, 'gamma': 3.1244354097204665}. Best is trial 19 with value: -1.599588574954905.
Number of finished trials:  50
Best trial:
  Value (RMSE): 1.5996
  MSE: 2.5587
  R²: 0.3687
Model saved to ck_student_score_predictor_optuna_xgb.pkl
PS D:\machile_nearning\wecode_score_prediction\dataset-hard-problem-fixed\XGBoost-CK> python .\predict.py
Found 733 students without CK scores
Predictions saved to ck_score_predictions.csv
Sample predictions:
                                  student_id  predicted_ck_score
3   0134f9f410c65ad0e8c2254a7e9288670e02a183            7.365103
20  035f97702f2c01d26ab1fae8f39ea2f98a0caa3c            7.414067
40  06024da8147b5cf6105beb4c403f67cf1ff0aea1            8.877767
68  0aaebc88f6106684d6993c156104c1ef36cf94e0            7.126537
80  0bf111a9caedf02804f6991792490e63bc21058a            9.037332