[I 2025-06-29 23:06:52,679] Trial 48 finished with value: -1.0855273093048663 and parameters: {'booster': 'dart', 'lambda': 0.0899836795626716, 'alpha': 1.1361166675182736e-06, 'subsample': 0.5018639272820284, 'colsample_bytree': 0.994435218374768, 'max_depth': 9, 'min_child_weight': 9, 'eta': 0.21253711116031804, 'gamma': 4.156747440896526, 'rate_drop': 5.8264082071043703e-05, 'skip_drop': 0.012178645915087171}. Best is trial 27 with value: -1.0717369095175353.
[I 2025-06-29 23:06:52,759] Trial 49 finished with value: -1.1187945355621813 and parameters: {'booster': 'gbtree', 'lambda': 0.0006755602989341164, 'alpha': 2.5278740642204632e-08, 'subsample': 0.551025487257208, 'colsample_bytree': 0.9306302102363474, 'max_depth': 6, 'min_child_weight': 3, 'eta': 0.05653782128286768, 'gamma': 4.382415924436947}. Best is trial 27 with value: -1.0717369095175353. 
Number of finished trials:  50
Best trial:
  Value (RMSE): 1.0717
  MSE: 1.1486
  R²: 0.5148
Model saved to qt_student_score_predictor_optuna_xgb_cuda.pkl
PS D:\machile_nearning\wecode_score_prediction\dataset-hard-problem-fixed\XGBoost-QT_Threshold_35_No_N_Problem> python .\predict.py
Found 734 students without QT scores
Predictions saved to qt_score_predictions.csv
Sample predictions:
                                  student_id  predicted_qt_score
3   0134f9f410c65ad0e8c2254a7e9288670e02a183            9.642785
20  035f97702f2c01d26ab1fae8f39ea2f98a0caa3c            9.658031
40  06024da8147b5cf6105beb4c403f67cf1ff0aea1            8.756427
68  0aaebc88f6106684d6993c156104c1ef36cf94e0            9.658031
80  0bf111a9caedf02804f6991792490e63bc21058a           10.026312