PS D:\machile_nearning\wecode_score_prediction\dataset-hard-problem-fixed\XGBoost-QT_Threshold_35_No_N_Problem> python .\train.py  
[I 2025-06-29 23:05:55,697] A new study created in memory with name: no-name-96f7e819-b206-4062-9baa-03a1ab7d2a9e
[I 2025-06-29 23:05:55,895] Trial 0 finished with value: -1.1324102327293029 and parameters: {'booster': 'gbtree', 'lambda': 9.18957199749455e-07, 'alpha': 3.754978506128757e-07, 'subsample': 0.8850210754328456, 'colsample_bytree': 0.5654419247866929, 'max_depth': 10, 'min_child_weight': 8, 'eta': 0.025010211665897283, 'gamma': 4.086422095844766}. Best is trial 0 with value: -1.1324102327293029.
[I 2025-06-29 23:06:03,689] Trial 1 finished with value: -1.1651467993242501 and parameters: {'booster': 'dart', 'lambda': 1.8400180653245684, 'alpha': 0.0001213100264742045, 'subsample': 0.9592787746154225, 'colsample_bytree': 0.5129683407125752, 'max_depth': 4, 'min_child_weight': 2, 'eta': 0.007581311521792128, 'gamma': 3.7886695826104995, 'rate_drop': 3.478574441391585e-08, 'skip_drop': 0.03963587635514307}. Best is trial 0 with value: -1.1324102327293029.
[I 2025-06-29 23:06:03,945] Trial 2 finished with value: -1.1214456734800289 and parameters: {'booster': 'gbtree', 'lambda': 6.578784990071787e-07, 'alpha': 2.7659928282609804e-08, 'subsample': 0.6292310543820094, 'colsample_bytree': 0.8014252987919144, 'max_depth': 8, 'min_child_weight': 4, 'eta': 0.0052459125937902, 'gamma': 0.6926995508885886}. Best is trial 2 with value: -1.1214456734800289.
[I 2025-06-29 23:06:04,101] Trial 3 finished with value: -1.097642477531459 and parameters: {'booster': 'gbtree', 'lambda': 4.032274110887298e-08, 'alpha': 3.2644628533275774e-06, 'subsample': 0.8316448486627245, 'colsample_bytree': 0.8067008844213241, 'max_depth': 6, 'min_child_weight': 10, 'eta': 0.013103471366387188, 'gamma': 0.5289949193395255}. Best is trial 3 with value: -1.097642477531459. 
[I 2025-06-29 23:06:04,137] Trial 4 finished with value: -1.1512203942787573 and parameters: {'booster': 'gbtree', 'lambda': 5.674739194604956e-07, 'alpha': 3.493877344501326e-06, 'subsample': 0.5852169127502377, 'colsample_bytree': 0.5039429620884629, 'max_depth': 5, 'min_child_weight': 6, 'eta': 0.09622041648126012, 'gamma': 3.901355442345824}. Best is trial 3 with value: -1.097642477531459.    
[I 2025-06-29 23:06:04,185] Trial 5 finished with value: -1.146874399315159 and parameters: {'booster': 'gbtree', 'lambda': 1.9730050452773565e-07, 'alpha': 6.077605985739683e-05, 'subsample': 0.6462588503555988, 'colsample_bytree': 0.6524942769751607, 'max_depth': 10, 'min_child_weight': 6, 'eta': 0.06700102478349793, 'gamma': 4.423220281528414}. Best is trial 3 with value: -1.097642477531459.   
[I 2025-06-29 23:06:04,330] Trial 6 finished with value: -1.2307445310805278 and parameters: {'booster': 'gbtree', 'lambda': 2.740986107725589e-07, 'alpha': 1.87327115245126e-06, 'subsample': 0.8678452788657534, 'colsample_bytree': 0.5659135543490038, 'max_depth': 3, 'min_child_weight': 6, 'eta': 0.0038072653368689804, 'gamma': 1.9182800070792334}. Best is trial 3 with value: -1.097642477531459.  
[I 2025-06-29 23:06:07,844] Trial 7 finished with value: -1.091800137277617 and parameters: {'booster': 'dart', 'lambda': 4.3205006883067003e-08, 'alpha': 3.566028520164937e-05, 'subsample': 0.9044212305041202, 'colsample_bytree': 0.7476765645795778, 'max_depth': 3, 'min_child_weight': 7, 'eta': 0.016223734644715, 'gamma': 2.4167206478325065, 'rate_drop': 0.00037262334225918886, 'skip_drop': 2.9362859526245754e-06}. Best is trial 7 with value: -1.091800137277617.
[I 2025-06-29 23:06:10,626] Trial 8 finished with value: -1.1943978374263295 and parameters: {'booster': 'dart', 'lambda': 0.00015748251389214473, 'alpha': 1.851340153277529e-08, 'subsample': 0.8304555234351509, 'colsample_bytree': 0.5944941189410389, 'max_depth': 8, 'min_child_weight': 8, 'eta': 0.020684500472634607, 'gamma': 0.9863934110276124, 'rate_drop': 9.301173460534031e-05, 'skip_drop': 5.695123183501795e-06}. Best is trial 7 with value: -1.091800137277617.
[I 2025-06-29 23:06:18,491] Trial 9 finished with value: -1.3419189435716754 and parameters: {'booster': 'dart', 'lambda': 1.813870332017479e-08, 'alpha': 2.139224702393884e-08, 'subsample': 0.8961813706587647, 'colsample_bytree': 0.917840071328258, 'max_depth': 10, 'min_child_weight': 5, 'eta': 0.0058339762977377375, 'gamma': 3.6279294068378154, 'rate_drop': 0.13108315333378606, 'skip_drop': 0.08701307200928311}. Best is trial 7 with value: -1.091800137277617.
[I 2025-06-29 23:06:26,140] Trial 10 finished with value: -1.3343665520749755 and parameters: {'booster': 'dart', 'lambda': 0.0009249679857090402, 'alpha': 2.186558099413602, 'subsample': 0.712397721473447, 'colsample_bytree': 0.9964602867425721, 'max_depth': 3, 'min_child_weight': 2, 'eta': 0.0010605547116928464, 'gamma': 2.5770785375564396, 'rate_drop': 0.0002359733514835906, 'skip_drop': 2.6177435252129074e-08}. Best is trial 7 with value: -1.091800137277617.
[I 2025-06-29 23:06:26,345] Trial 11 finished with value: -1.119670907089885 and parameters: {'booster': 'dart', 'lambda': 0.0001844269955431635, 'alpha': 0.011053832205591594, 'subsample': 0.7741373867892305, 'colsample_bytree': 0.7633096493234663, 'max_depth': 6, 'min_child_weight': 10, 'eta': 0.2539575772836477, 'gamma': 0.05614407322397358, 'rate_drop': 0.00023206467402489856, 'skip_drop': 2.4264107345654545e-05}. Best is trial 7 with value: -1.091800137277617.
[I 2025-06-29 23:06:26,440] Trial 12 finished with value: -1.1021190015399216 and parameters: {'booster': 'gbtree', 'lambda': 1.7554004555977125e-08, 'alpha': 0.006246698470331286, 'subsample': 0.9801459472508021, 'colsample_bytree': 0.8420319018408258, 'max_depth': 7, 'min_child_weight': 10, 'eta': 0.03128592554408954, 'gamma': 2.283424709818123}. Best is trial 7 with value: -1.091800137277617.  
[I 2025-06-29 23:06:33,763] Trial 13 finished with value: -1.315071210025989 and parameters: {'booster': 'dart', 'lambda': 1.6519776340980192e-05, 'alpha': 0.0014192331656958435, 'subsample': 0.5021971558609614, 'colsample_bytree': 0.6983222254463637, 'max_depth': 5, 'min_child_weight': 8, 'eta': 0.011330552445795089, 'gamma': 1.5052999094203403, 'rate_drop': 0.1166757887480463, 'skip_drop': 1.8727210734392918e-08}. Best is trial 7 with value: -1.091800137277617.
[I 2025-06-29 23:06:33,995] Trial 14 finished with value: -1.1739215169529718 and parameters: {'booster': 'gbtree', 'lambda': 0.014165428053374582, 'alpha': 1.781447652074387e-05, 'subsample': 0.7824962375527706, 'colsample_bytree': 0.8646191275217765, 'max_depth': 5, 'min_child_weight': 9, 'eta': 0.0024307610360010186, 'gamma': 2.965030024759413}. Best is trial 7 with value: -1.091800137277617.  
[I 2025-06-29 23:06:34,343] Trial 15 finished with value: -1.1412243250843606 and parameters: {'booster': 'dart', 'lambda': 1.6601666779202614e-05, 'alpha': 0.1926432845499482, 'subsample': 0.925584385716336, 'colsample_bytree': 0.6915330688095471, 'max_depth': 7, 'min_child_weight': 4, 'eta': 0.05741374306113162, 'gamma': 0.1402578005892937, 'rate_drop': 8.336115170788958e-07, 'skip_drop': 0.0005249641190902043}. Best is trial 7 with value: -1.091800137277617.
[I 2025-06-29 23:06:34,479] Trial 16 finished with value: -1.0921244777691597 and parameters: {'booster': 'gbtree', 'lambda': 1.2588703350385183e-08, 'alpha': 2.740779169358109e-07, 'subsample': 0.722336642844139, 'colsample_bytree': 0.7539113569139613, 'max_depth': 4, 'min_child_weight': 7, 'eta': 0.01346681614940128, 'gamma': 1.3210385512571021}. Best is trial 7 with value: -1.091800137277617.  
[I 2025-06-29 23:06:35,009] Trial 17 finished with value: -1.0857903367459854 and parameters: {'booster': 'dart', 'lambda': 8.446958009241045e-06, 'alpha': 1.5680606147801078e-07, 'subsample': 0.7083555305027518, 'colsample_bytree': 0.7163086306492422, 'max_depth': 4, 'min_child_weight': 7, 'eta': 0.04160323221819333, 'gamma': 1.3858122701915476, 'rate_drop': 0.004902517400003094, 'skip_drop': 1.0072623629920375e-06}. Best is trial 17 with value: -1.0857903367459854.
[I 2025-06-29 23:06:35,492] Trial 18 finished with value: -1.1325916068253723 and parameters: {'booster': 'dart', 'lambda': 7.573194595910011e-06, 'alpha': 0.0005978201974822155, 'subsample': 0.6779287130886154, 'colsample_bytree': 0.6587727696933411, 'max_depth': 3, 'min_child_weight': 4, 'eta': 0.17089633084037756, 'gamma': 4.987291223281943, 'rate_drop': 0.003706397206036807, 'skip_drop': 9.680026680660241e-07}. Best is trial 17 with value: -1.0857903367459854.
[I 2025-06-29 23:06:36,024] Trial 19 finished with value: -1.0857132408475825 and parameters: {'booster': 'dart', 'lambda': 0.011544787832367977, 'alpha': 3.4895683558251073e-07, 'subsample': 0.8247248181173567, 'colsample_bytree': 0.7152733508432775, 'max_depth': 4, 'min_child_weight': 7, 'eta': 0.04135754951925986, 'gamma': 3.0731913879380093, 'rate_drop': 0.00508660389538749, 'skip_drop': 9.109747739483028e-07}. Best is trial 19 with value: -1.0857132408475825.
[I 2025-06-29 23:06:38,876] Trial 20 finished with value: -1.1346777901257938 and parameters: {'booster': 'dart', 'lambda': 0.06358576182052346, 'alpha': 2.1737556618936696e-07, 'subsample': 0.8114890742831722, 'colsample_bytree': 0.6175403957402353, 'max_depth': 4, 'min_child_weight': 7, 'eta': 0.038608069464103764, 'gamma': 3.096077217019496, 'rate_drop': 0.004832771790105886, 'skip_drop': 0.0005483224020121116}. Best is trial 19 with value: -1.0857132408475825.
[I 2025-06-29 23:06:39,398] Trial 21 finished with value: -1.0975167306439744 and parameters: {'booster': 'dart', 'lambda': 0.01241361414157207, 'alpha': 1.2545007877908152e-05, 'subsample': 0.7364180026184202, 'colsample_bytree': 0.7160202091081159, 'max_depth': 4, 'min_child_weight': 7, 'eta': 0.09157987773493181, 'gamma': 1.9782000465930019, 'rate_drop': 0.005541578450249364, 'skip_drop': 5.368991922806503e-07}. Best is trial 19 with value: -1.0857132408475825.
[I 2025-06-29 23:06:41,196] Trial 22 finished with value: -1.09321626660442 and parameters: {'booster': 'dart', 'lambda': 0.5085605798479389, 'alpha': 1.7128455816394823e-07, 'subsample': 0.9351866553808741, 'colsample_bytree': 0.7345232979265474, 'max_depth': 3, 'min_child_weight': 5, 'eta': 0.04373999565530097, 'gamma': 3.085259001824088, 'rate_drop': 1.507405873714601e-05, 'skip_drop': 4.67530323899304e-07}. Best is trial 19 with value: -1.0857132408475825.
[I 2025-06-29 23:06:41,404] Trial 23 finished with value: -1.103043935906786 and parameters: {'booster': 'dart', 'lambda': 0.0027759561732098232, 'alpha': 1.6072072794163138e-06, 'subsample': 0.8550186081365831, 'colsample_bytree': 0.7782639840216357, 'max_depth': 5, 'min_child_weight': 9, 'eta': 0.13544731683791233, 'gamma': 2.6442568235687913, 'rate_drop': 0.00906218170252573, 'skip_drop': 4.685085212418542e-06}. Best is trial 19 with value: -1.0857132408475825.
[I 2025-06-29 23:06:44,343] Trial 24 finished with value: -1.1469239451402349 and parameters: {'booster': 'dart', 'lambda': 0.08838134796751906, 'alpha': 1.9286754934954907e-05, 'subsample': 0.7749553910917173, 'colsample_bytree': 0.6469202754166476, 'max_depth': 4, 'min_child_weight': 7, 'eta': 0.020501084412652, 'gamma': 1.633815296887461, 'rate_drop': 0.0008372157776761189, 'skip_drop': 1.0407693070658108e-07}. Best is trial 19 with value: -1.0857132408475825.
[I 2025-06-29 23:06:44,859] Trial 25 finished with value: -1.091033642578259 and parameters: {'booster': 'dart', 'lambda': 3.7535035328484545e-06, 'alpha': 7.311420175805014e-08, 'subsample': 0.684470492700682, 'colsample_bytree': 0.8447470045822654, 'max_depth': 3, 'min_child_weight': 8, 'eta': 0.05051937599430626, 'gamma': 3.4143517894977182, 'rate_drop': 3.083083415856653e-05, 'skip_drop': 0.00013924810010054248}. Best is trial 19 with value: -1.0857132408475825.
[I 2025-06-29 23:06:45,350] Trial 26 finished with value: -1.0853269887351449 and parameters: {'booster': 'dart', 'lambda': 3.537187454037393e-06, 'alpha': 6.033995575733228e-08, 'subsample': 0.5809089347457842, 'colsample_bytree': 0.8994010696935446, 'max_depth': 4, 'min_child_weight': 9, 'eta': 0.06394306048129736, 'gamma': 3.3986249823353476, 'rate_drop': 8.246655301832476e-06, 'skip_drop': 0.0001468694204648714}. Best is trial 26 with value: -1.0853269887351449.
[I 2025-06-29 23:06:45,766] Trial 27 finished with value: -1.0717369095175353 and parameters: {'booster': 'dart', 'lambda': 5.862002598150985e-05, 'alpha': 1.0155184666582404e-06, 'subsample': 0.5221770607001112, 'colsample_bytree': 0.958107712127878, 'max_depth': 5, 'min_child_weight': 9, 'eta': 0.0792398843531993, 'gamma': 4.280977428318034, 'rate_drop': 3.5411146612510775e-06, 'skip_drop': 0.005256010502747158}. Best is trial 27 with value: -1.0717369095175353.
[I 2025-06-29 23:06:46,174] Trial 28 finished with value: -1.0755766390887627 and parameters: {'booster': 'dart', 'lambda': 8.221085419363996e-05, 'alpha': 1.0760089477071495e-08, 'subsample': 0.509342142005593, 'colsample_bytree': 0.9703403261184054, 'max_depth': 6, 'min_child_weight': 9, 'eta': 0.09585100577005161, 'gamma': 4.447293690198669, 'rate_drop': 1.7708099616382206e-06, 'skip_drop': 0.004561420716708368}. Best is trial 27 with value: -1.0717369095175353.
[I 2025-06-29 23:06:46,406] Trial 29 finished with value: -1.0938071298708758 and parameters: {'booster': 'dart', 'lambda': 5.6284610184701986e-05, 'alpha': 1.2733956557151585e-08, 'subsample': 0.5047857525506179, 'colsample_bytree': 0.9691097952991667, 'max_depth': 6, 'min_child_weight': 9, 'eta': 0.26223632896083443, 'gamma': 4.317329583632348, 'rate_drop': 2.359471193824413e-06, 'skip_drop': 0.0046151273239695405}. Best is trial 27 with value: -1.0717369095175353.
[I 2025-06-29 23:06:46,774] Trial 30 finished with value: -1.0907042265937 and parameters: {'booster': 'dart', 'lambda': 6.647210565109442e-05, 'alpha': 9.42318393024839e-07, 'subsample': 0.5663978787388539, 'colsample_bytree': 0.9278507328204894, 'max_depth': 7, 'min_child_weight': 9, 'eta': 0.13930768325455772, 'gamma': 4.904353522604098, 'rate_drop': 2.555241236863913e-07, 'skip_drop': 0.008391767599281225}. Best is trial 27 with value: -1.0717369095175353.
[I 2025-06-29 23:06:47,144] Trial 31 finished with value: -1.1167710238052064 and parameters: {'booster': 'dart', 'lambda': 0.0012761520435650804, 'alpha': 4.9318631260606195e-08, 'subsample': 0.5456149344083285, 'colsample_bytree': 0.926022521040058, 'max_depth': 5, 'min_child_weight': 8, 'eta': 0.07977461811156632, 'gamma': 4.238202377210842, 'rate_drop': 5.203258679949548e-06, 'skip_drop': 0.003923432370429391}. Best is trial 27 with value: -1.0717369095175353.
[I 2025-06-29 23:06:48,113] Trial 32 finished with value: -1.090689267448478 and parameters: {'booster': 'dart', 'lambda': 1.7017422963157752e-06, 'alpha': 4.973876401662928e-07, 'subsample': 0.5365764038144953, 'colsample_bytree': 0.8896076871549186, 'max_depth': 6, 'min_child_weight': 9, 'eta': 0.02802077317352728, 'gamma': 3.42427901386292, 'rate_drop': 2.681763731367357e-07, 'skip_drop': 0.0008446034415452923}. Best is trial 27 with value: -1.0717369095175353.
[I 2025-06-29 23:06:48,438] Trial 33 finished with value: -1.0757314078097417 and parameters: {'booster': 'dart', 'lambda': 7.225020944365952, 'alpha': 8.233490511308791e-08, 'subsample': 0.5971041314817012, 'colsample_bytree': 0.9599490643896074, 'max_depth': 9, 'min_child_weight': 10, 'eta': 0.10416003767564783, 'gamma': 4.675482196546599, 'rate_drop': 6.072282748061538e-06, 'skip_drop': 0.9197297995373943}. Best is trial 27 with value: -1.0717369095175353.
[I 2025-06-29 23:06:48,772] Trial 34 finished with value: -1.0718932637703393 and parameters: {'booster': 'dart', 'lambda': 9.890589015547514, 'alpha': 6.462848479989434e-08, 'subsample': 0.615383640865843, 'colsample_bytree': 0.958918121285287, 'max_depth': 9, 'min_child_weight': 10, 'eta': 0.11931820246935444, 'gamma': 4.528279876294988, 'rate_drop': 6.217998939273039e-06, 'skip_drop': 0.5523258912112134}. Best is trial 27 with value: -1.0717369095175353.
[I 2025-06-29 23:06:48,998] Trial 35 finished with value: -1.095039499109242 and parameters: {'booster': 'dart', 'lambda': 5.124160857765837, 'alpha': 1.0121943593851082e-08, 'subsample': 0.612592458337472, 'colsample_bytree': 0.9638856019843598, 'max_depth': 9, 'min_child_weight': 10, 'eta': 0.17519280925258426, 'gamma': 4.642328127630881, 'rate_drop': 1.0508104092532511e-06, 'skip_drop': 0.5783064877837641}. Best is trial 27 with value: -1.0717369095175353.
[I 2025-06-29 23:06:49,301] Trial 36 finished with value: -1.084968837387784 and parameters: {'booster': 'dart', 'lambda': 9.265509077262402, 'alpha': 4.832596214363101e-06, 'subsample': 0.6093078214017242, 'colsample_bytree': 0.9559233119990388, 'max_depth': 9, 'min_child_weight': 10, 'eta': 0.11293555441300124, 'gamma': 3.9912044432131024, 'rate_drop': 4.097422071018049e-08, 'skip_drop': 0.7888873863159128}. Best is trial 27 with value: -1.0717369095175353.
[I 2025-06-29 23:06:49,794] Trial 37 finished with value: -1.1086932168116677 and parameters: {'booster': 'dart', 'lambda': 1.0413832593548085, 'alpha': 7.496541843089331e-08, 'subsample': 0.5335383029013478, 'colsample_bytree': 0.9949247886242348, 'max_depth': 8, 'min_child_weight': 10, 'eta': 0.17628054917061445, 'gamma': 4.653610525290878, 'rate_drop': 3.931105834486005e-05, 'skip_drop': 0.13847850925411714}. Best is trial 27 with value: -1.0717369095175353.
[I 2025-06-29 23:06:50,031] Trial 38 finished with value: -1.226606629072913 and parameters: {'booster': 'dart', 'lambda': 0.22176664959207368, 'alpha': 7.512397134794359e-07, 'subsample': 0.6423723260236744, 'colsample_bytree': 0.9440289984661621, 'max_depth': 9, 'min_child_weight': 1, 'eta': 0.08061386768657043, 'gamma': 4.611957916127203, 'rate_drop': 2.3919748458261065e-07, 'skip_drop': 0.03349996562815641}. Best is trial 27 with value: -1.0717369095175353.
[I 2025-06-29 23:06:50,089] Trial 39 finished with value: -1.1602472179303887 and parameters: {'booster': 'gbtree', 'lambda': 2.2516797791259067, 'alpha': 0.00015531486163298212, 'subsample': 0.5568308987765935, 'colsample_bytree': 0.8829895892481262, 'max_depth': 9, 'min_child_weight': 10, 'eta': 0.2993391874180614, 'gamma': 3.8683756641488207}. Best is trial 27 with value: -1.0717369095175353.  
[I 2025-06-29 23:06:50,297] Trial 40 finished with value: -1.1022725323412734 and parameters: {'booster': 'dart', 'lambda': 0.00037558965325153236, 'alpha': 4.287535739019178e-06, 'subsample': 0.6052237695296893, 'colsample_bytree': 0.9846320195584891, 'max_depth': 10, 'min_child_weight': 8, 'eta': 0.1154398804278343, 'gamma': 4.139252336526738, 'rate_drop': 2.7761063884943055e-08, 'skip_drop': 0.22148990849718347}. Best is trial 27 with value: -1.0717369095175353.
[I 2025-06-29 23:06:50,936] Trial 41 finished with value: -1.0911940616274354 and parameters: {'booster': 'dart', 'lambda': 3.9692389906787295, 'alpha': 3.7728715522210354e-06, 'subsample': 0.6001605046771706, 'colsample_bytree': 0.9531383206753705, 'max_depth': 9, 'min_child_weight': 10, 'eta': 0.10610130134214504, 'gamma': 4.462643932957457, 'rate_drop': 5.646625829100147e-08, 'skip_drop': 0.916081610560459}. Best is trial 27 with value: -1.0717369095175353.
[I 2025-06-29 23:06:51,258] Trial 42 finished with value: -1.083904279849415 and parameters: {'booster': 'dart', 'lambda': 7.505907023495714, 'alpha': 5.966669576040036e-08, 'subsample': 0.6687847970516118, 'colsample_bytree': 0.9474759139624276, 'max_depth': 8, 'min_child_weight': 10, 'eta': 0.19160542139370695, 'gamma': 3.9758726643251103, 'rate_drop': 1.0587671784310136e-08, 'skip_drop': 0.024757857650070443}. Best is trial 27 with value: -1.0717369095175353.
[I 2025-06-29 23:06:51,454] Trial 43 finished with value: -1.1226799109563081 and parameters: {'booster': 'dart', 'lambda': 1.1364835752472149, 'alpha': 2.7185973392320747e-08, 'subsample': 0.6703230184107407, 'colsample_bytree': 0.9105766224535583, 'max_depth': 8, 'min_child_weight': 9, 'eta': 0.17829827710442608, 'gamma': 3.675160502145613, 'rate_drop': 2.8960039431629424e-06, 'skip_drop': 0.027271397279027408}. Best is trial 27 with value: -1.0717369095175353.
[I 2025-06-29 23:06:51,684] Trial 44 finished with value: -1.07549843015527 and parameters: {'booster': 'dart', 'lambda': 8.557006743296757, 'alpha': 3.2235702254771234e-08, 'subsample': 0.5215631490277979, 'colsample_bytree': 0.9347731477840056, 'max_depth': 8, 'min_child_weight': 10, 'eta': 0.2230937445985607, 'gamma': 4.797198652188479, 'rate_drop': 1.0046884287313966e-08, 'skip_drop': 0.01337566276944975}. Best is trial 27 with value: -1.0717369095175353.
[I 2025-06-29 23:06:52,168] Trial 45 finished with value: -1.0913528436261268 and parameters: {'booster': 'dart', 'lambda': 0.4299992316671706, 'alpha': 3.245567508822047e-08, 'subsample': 0.5230540659864846, 'colsample_bytree': 0.8178943332344611, 'max_depth': 7, 'min_child_weight': 9, 'eta': 0.07583091230078255, 'gamma': 4.863109458513379, 'rate_drop': 8.507666894731631e-07, 'skip_drop': 0.0023853790889549775}. Best is trial 27 with value: -1.0717369095175353.
[I 2025-06-29 23:06:52,227] Trial 46 finished with value: -1.1468554321564202 and parameters: {'booster': 'gbtree', 'lambda': 5.159769470482141e-05, 'alpha': 1.4226803724071661e-07, 'subsample': 0.5765588156401927, 'colsample_bytree': 0.8695675103898555, 'max_depth': 10, 'min_child_weight': 8, 'eta': 0.23440719207551022, 'gamma': 4.40279811758505}. Best is trial 27 with value: -1.0717369095175353.
[I 2025-06-29 23:06:52,478] Trial 47 finished with value: -1.0867812448817122 and parameters: {'booster': 'dart', 'lambda': 2.4026758884730612, 'alpha': 1.0788353619832294e-08, 'subsample': 0.520187048407226, 'colsample_bytree': 0.980593349040799, 'max_depth': 8, 'min_child_weight': 10, 'eta': 0.13528962672609351, 'gamma': 4.720198317457568, 'rate_drop': 9.873375457412165e-06, 'skip_drop': 0.29319231483824487}. Best is trial 27 with value: -1.0717369095175353.
