PS D:\machile_nearning\wecode_score_prediction\dataset-practice-separation\XGBoost-CK> python .\train.py                                                                                                
[I 2025-06-29 22:42:23,427] A new study created in memory with name: no-name-403d4b49-6e76-401a-a99a-c327ed82b18c                                                                                       
[I 2025-06-29 22:42:23,621] Trial 0 finished with value: -1.6751322287465458 and parameters: {'booster': 'gbtree', 'lambda': 0.36021191631675564, 'alpha': 0.0009955651408901612, 'subsample': 0.6001967675357864, 'colsample_bytree': 0.8821610878804608, 'max_depth': 8, 'min_child_weight': 8, 'eta': 0.08068696261543289, 'gamma': 3.3811027415242374}. Best is trial 0 with value: -1.6751322287465458.
[I 2025-06-29 22:42:26,439] Trial 1 finished with value: -1.630086431556498 and parameters: {'booster': 'dart', 'lambda': 0.28323114068397376, 'alpha': 0.027497427556447334, 'subsample': 0.8595059613639634, 'colsample_bytree': 0.5812364324351822, 'max_depth': 7, 'min_child_weight': 7, 'eta': 0.025673301383832097, 'gamma': 3.089787650036899, 'rate_drop': 3.49347525081138e-08, 'skip_drop': 0.000511085660193377}. Best is trial 1 with value: -1.630086431556498.
[I 2025-06-29 22:42:36,603] Trial 2 finished with value: -1.6409655445867999 and parameters: {'booster': 'dart', 'lambda': 0.00014913095292381543, 'alpha': 1.868183944992056e-07, 'subsample': 0.9228699424500629, 'colsample_bytree': 0.5946250273952646, 'max_depth': 8, 'min_child_weight': 6, 'eta': 0.008163704575939438, 'gamma': 3.8027632489769205, 'rate_drop': 0.010325414576908406, 'skip_drop': 0.14022281528246186}. Best is trial 1 with value: -1.630086431556498.
[I 2025-06-29 22:42:45,605] Trial 3 finished with value: -1.703941988365537 and parameters: {'booster': 'dart', 'lambda': 1.2442368529955754e-07, 'alpha': 7.7312114097117615, 'subsample': 0.5612671689754569, 'colsample_bytree': 0.5808180035841956, 'max_depth': 8, 'min_child_weight': 5, 'eta': 0.005289439124352359, 'gamma': 3.648270411925814, 'rate_drop': 1.615603799142001e-08, 'skip_drop': 6.330964112024081e-07}. Best is trial 1 with value: -1.630086431556498.
[I 2025-06-29 22:42:46,280] Trial 4 finished with value: -1.6450645722967292 and parameters: {'booster': 'gbtree', 'lambda': 0.000237806044397844, 'alpha': 0.00027248286490027645, 'subsample': 0.6532240460449861, 'colsample_bytree': 0.8569274125113133, 'max_depth': 9, 'min_child_weight': 1, 'eta': 0.0043935884691185196, 'gamma': 0.16053706539427448}. Best is trial 1 with value: -1.630086431556498.
[I 2025-06-29 22:42:46,521] Trial 5 finished with value: -1.6240038207021448 and parameters: {'booster': 'gbtree', 'lambda': 0.00034553922297766385, 'alpha': 2.6391264132575637e-08, 'subsample': 0.9702085585406112, 'colsample_bytree': 0.7560658614815039, 'max_depth': 8, 'min_child_weight': 6, 'eta': 0.010422832101215111, 'gamma': 4.675379930650544}. Best is trial 5 with value: -1.6240038207021448.
[I 2025-06-29 22:42:55,161] Trial 6 finished with value: -1.7200530807730214 and parameters: {'booster': 'dart', 'lambda': 9.612109226453795e-08, 'alpha': 0.0002600244985756088, 'subsample': 0.6674832161239446, 'colsample_bytree': 0.7520443708753082, 'max_depth': 3, 'min_child_weight': 1, 'eta': 0.0028266696481709457, 'gamma': 3.077040342944124, 'rate_drop': 0.0009518298564717914, 'skip_drop': 0.709986643599123}. Best is trial 5 with value: -1.6240038207021448.
[I 2025-06-29 22:42:55,945] Trial 7 finished with value: -1.6894235434255176 and parameters: {'booster': 'dart', 'lambda': 0.056589939060780574, 'alpha': 3.001062560020951e-07, 'subsample': 0.5314248586127472, 'colsample_bytree': 0.5304918220197219, 'max_depth': 6, 'min_child_weight': 10, 'eta': 0.1695455114443631, 'gamma': 1.0881737993085017, 'rate_drop': 0.049238776931216546, 'skip_drop': 0.0006251840474880987}. Best is trial 5 with value: -1.6240038207021448.
[I 2025-06-29 22:42:56,110] Trial 8 finished with value: -1.6373128913397035 and parameters: {'booster': 'gbtree', 'lambda': 1.1218557913692821e-05, 'alpha': 3.297979442776907e-07, 'subsample': 0.8517361788641644, 'colsample_bytree': 0.7063098289779524, 'max_depth': 9, 'min_child_weight': 10, 'eta': 0.021025724610798265, 'gamma': 4.135896045064475}. Best is trial 5 with value: -1.6240038207021448.
[I 2025-06-29 22:43:05,617] Trial 9 finished with value: -1.845743829279097 and parameters: {'booster': 'dart', 'lambda': 8.047713298582446, 'alpha': 7.377272271665704e-07, 'subsample': 0.7392302052021884, 'colsample_bytree': 0.806834462756723, 'max_depth': 6, 'min_child_weight': 7, 'eta': 0.0012766742368774768, 'gamma': 2.877496814779657, 'rate_drop': 0.0002103901354376281, 'skip_drop': 3.2589960654835497e-07}. Best is trial 5 with value: -1.6240038207021448.
[I 2025-06-29 22:43:05,742] Trial 10 finished with value: -1.6343965635599664 and parameters: {'booster': 'gbtree', 'lambda': 0.0055688304758533015, 'alpha': 1.814816555809091e-08, 'subsample': 0.9901240992465716, 'colsample_bytree': 0.9931695434799408, 'max_depth': 4, 'min_child_weight': 4, 'eta': 0.04371960280677252, 'gamma': 4.679515142624394}. Best is trial 5 with value: -1.6240038207021448.  
[I 2025-06-29 22:43:06,010] Trial 11 finished with value: -1.6446629757615348 and parameters: {'booster': 'gbtree', 'lambda': 9.960837584883079, 'alpha': 0.07165396121456172, 'subsample': 0.8440057981835702, 'colsample_bytree': 0.6641037883209848, 'max_depth': 10, 'min_child_weight': 8, 'eta': 0.018010816458883312, 'gamma': 1.9788316981922895}. Best is trial 5 with value: -1.6240038207021448.     
[I 2025-06-29 22:43:06,140] Trial 12 finished with value: -1.6431693141686712 and parameters: {'booster': 'gbtree', 'lambda': 4.404140760739109e-06, 'alpha': 0.048153077530823006, 'subsample': 0.9746496137681843, 'colsample_bytree': 0.6335886601472756, 'max_depth': 7, 'min_child_weight': 4, 'eta': 0.038997007283845926, 'gamma': 4.920957909932367}. Best is trial 5 with value: -1.6240038207021448.  
[I 2025-06-29 22:43:09,659] Trial 13 finished with value: -1.6439038930480228 and parameters: {'booster': 'dart', 'lambda': 0.013365834786250462, 'alpha': 1.1561809199505771e-05, 'subsample': 0.8549275277433023, 'colsample_bytree': 0.5036575925820437, 'max_depth': 6, 'min_child_weight': 6, 'eta': 0.01588556221038018, 'gamma': 2.148291022440921, 'rate_drop': 3.017137917860725e-08, 'skip_drop': 0.000276021475566452}. Best is trial 5 with value: -1.6240038207021448.
[I 2025-06-29 22:43:09,863] Trial 14 finished with value: -1.6855450512792218 and parameters: {'booster': 'dart', 'lambda': 0.001693922722192722, 'alpha': 0.045080842313398144, 'subsample': 0.9041266633605795, 'colsample_bytree': 0.7563309791977096, 'max_depth': 7, 'min_child_weight': 3, 'eta': 0.274974154919103, 'gamma': 1.4245960894475211, 'rate_drop': 2.643988579289358e-06, 'skip_drop': 0.004846345602973744}. Best is trial 5 with value: -1.6240038207021448.
[I 2025-06-29 22:43:10,116] Trial 15 finished with value: -1.6483978491737485 and parameters: {'booster': 'gbtree', 'lambda': 0.43291073045994644, 'alpha': 3.7350314519680046, 'subsample': 0.7909414522242132, 'colsample_bytree': 0.6883815609172128, 'max_depth': 5, 'min_child_weight': 8, 'eta': 0.009819319449507867, 'gamma': 4.28851309977079}. Best is trial 5 with value: -1.6240038207021448.       
[I 2025-06-29 22:43:10,708] Trial 16 finished with value: -1.6402008286815721 and parameters: {'booster': 'dart', 'lambda': 1.1199643657934175e-05, 'alpha': 0.0031529038761693717, 'subsample': 0.9297286019587542, 'colsample_bytree': 0.927561276499995, 'max_depth': 10, 'min_child_weight': 7, 'eta': 0.0426336181708767, 'gamma': 2.6388812950906173, 'rate_drop': 5.643861131404909e-06, 'skip_drop': 1.6166523844260566e-05}. Best is trial 5 with value: -1.6240038207021448.
[I 2025-06-29 22:43:11,009] Trial 17 finished with value: -1.7366086516033843 and parameters: {'booster': 'gbtree', 'lambda': 0.233990074454197, 'alpha': 2.1320302740378975e-05, 'subsample': 0.7523365264697005, 'colsample_bytree': 0.824271668514031, 'max_depth': 5, 'min_child_weight': 9, 'eta': 0.0018151081448750876, 'gamma': 4.388521731523665}. Best is trial 5 with value: -1.6240038207021448.    
[I 2025-06-29 22:43:13,645] Trial 18 finished with value: -1.649370337973598 and parameters: {'booster': 'dart', 'lambda': 0.0012618260370974657, 'alpha': 0.5317285154623694, 'subsample': 0.9986005715832449, 'colsample_bytree': 0.5927202303023431, 'max_depth': 9, 'min_child_weight': 5, 'eta': 0.079202349811515, 'gamma': 3.334581553964759, 'rate_drop': 2.4242658045918997e-06, 'skip_drop': 1.3097707481403797e-08}. Best is trial 5 with value: -1.6240038207021448.
[I 2025-06-29 22:43:13,929] Trial 19 finished with value: -1.636601892674161 and parameters: {'booster': 'gbtree', 'lambda': 1.2980552773684412e-08, 'alpha': 1.3052440247407185e-05, 'subsample': 0.8868026889083586, 'colsample_bytree': 0.784265718866653, 'max_depth': 7, 'min_child_weight': 3, 'eta': 0.011164521596560032, 'gamma': 2.304429751654981}. Best is trial 5 with value: -1.6240038207021448. 
[I 2025-06-29 22:43:17,666] Trial 20 finished with value: -1.8630195754261278 and parameters: {'booster': 'dart', 'lambda': 4.761491298719388e-05, 'alpha': 0.006368049312752338, 'subsample': 0.814081299661006, 'colsample_bytree': 0.7259613505734722, 'max_depth': 5, 'min_child_weight': 7, 'eta': 0.02356085977688737, 'gamma': 0.5026106664432466, 'rate_drop': 0.9101044433265059, 'skip_drop': 0.013457393691528506}. Best is trial 5 with value: -1.6240038207021448.
[I 2025-06-29 22:43:17,783] Trial 21 finished with value: -1.6294429185216237 and parameters: {'booster': 'gbtree', 'lambda': 0.00978256314661285, 'alpha': 1.77926058330635e-08, 'subsample': 0.954955494657305, 'colsample_bytree': 0.9474401530191124, 'max_depth': 3, 'min_child_weight': 4, 'eta': 0.042017909100022816, 'gamma': 4.992058705760367}. Best is trial 5 with value: -1.6240038207021448.     
[I 2025-06-29 22:43:17,869] Trial 22 finished with value: -1.6108838591438999 and parameters: {'booster': 'gbtree', 'lambda': 0.05754946880522563, 'alpha': 1.2097486898593428e-08, 'subsample': 0.9355898757090065, 'colsample_bytree': 0.9997289976853884, 'max_depth': 3, 'min_child_weight': 4, 'eta': 0.07665766355459533, 'gamma': 4.924629442728118}. Best is trial 22 with value: -1.6108838591438999.  
[I 2025-06-29 22:43:17,979] Trial 23 finished with value: -1.6181631357486157 and parameters: {'booster': 'gbtree', 'lambda': 0.02644618772791806, 'alpha': 1.0254634928046425e-08, 'subsample': 0.9501483199343262, 'colsample_bytree': 0.9766795148742542, 'max_depth': 3, 'min_child_weight': 3, 'eta': 0.08232733683435103, 'gamma': 4.889895758287278}. Best is trial 22 with value: -1.6108838591438999.  
[I 2025-06-29 22:43:18,061] Trial 24 finished with value: -1.6274625588176508 and parameters: {'booster': 'gbtree', 'lambda': 0.06559724306494678, 'alpha': 6.020983437014304e-08, 'subsample': 0.9364524339114159, 'colsample_bytree': 0.990337458183292, 'max_depth': 4, 'min_child_weight': 2, 'eta': 0.0989488192402673, 'gamma': 4.573136912346756}. Best is trial 22 with value: -1.6108838591438999.     
[I 2025-06-29 22:43:18,148] Trial 25 finished with value: -1.634581670324564 and parameters: {'booster': 'gbtree', 'lambda': 1.776516590511699, 'alpha': 1.8879634666175633e-06, 'subsample': 0.8936729325783253, 'colsample_bytree': 0.9364379530458113, 'max_depth': 4, 'min_child_weight': 3, 'eta': 0.1505148896654439, 'gamma': 3.918153511549124}. Best is trial 22 with value: -1.6108838591438999.      
[I 2025-06-29 22:43:18,238] Trial 26 finished with value: -1.631856165874724 and parameters: {'booster': 'gbtree', 'lambda': 0.0020033027373224286, 'alpha': 1.0353348071324568e-08, 'subsample': 0.9601230402519016, 'colsample_bytree': 0.9040632249099771, 'max_depth': 3, 'min_child_weight': 5, 'eta': 0.13343825887338753, 'gamma': 4.700294365536093}. Best is trial 22 with value: -1.6108838591438999. 
[I 2025-06-29 22:43:18,318] Trial 27 finished with value: -1.6448011540926974 and parameters: {'booster': 'gbtree', 'lambda': 0.031209436278250933, 'alpha': 6.413042337044088e-08, 'subsample': 0.789309470949349, 'colsample_bytree': 0.9665863890604782, 'max_depth': 4, 'min_child_weight': 2, 'eta': 0.2355390816129903, 'gamma': 4.10196190879083}. Best is trial 22 with value: -1.6108838591438999.     
[I 2025-06-29 22:43:18,416] Trial 28 finished with value: -1.6331792541175312 and parameters: {'booster': 'gbtree', 'lambda': 0.0007229912282089349, 'alpha': 2.048982982059404e-06, 'subsample': 0.9521813678782125, 'colsample_bytree': 0.8562785267176356, 'max_depth': 3, 'min_child_weight': 2, 'eta': 0.08269586425003826, 'gamma': 4.607300534017821}. Best is trial 22 with value: -1.6108838591438999. 
[I 2025-06-29 22:43:18,578] Trial 29 finished with value: -1.6267077771784586 and parameters: {'booster': 'gbtree', 'lambda': 1.3597748667922616, 'alpha': 6.433833079767771e-08, 'subsample': 0.8893986394957234, 'colsample_bytree': 0.8768142133908842, 'max_depth': 5, 'min_child_weight': 4, 'eta': 0.06370830589904503, 'gamma': 4.945550666822795}. Best is trial 22 with value: -1.6108838591438999.    
[I 2025-06-29 22:43:18,669] Trial 30 finished with value: -1.6578809261900915 and parameters: {'booster': 'gbtree', 'lambda': 0.0038732515115612364, 'alpha': 5.371687677625711e-05, 'subsample': 0.7002639625431887, 'colsample_bytree': 0.9992554406380374, 'max_depth': 8, 'min_child_weight': 6, 'eta': 0.06036376031587305, 'gamma': 3.5263416399646035}. Best is trial 22 with value: -1.6108838591438999.
[I 2025-06-29 22:43:18,753] Trial 31 finished with value: -1.6533332618193117 and parameters: {'booster': 'gbtree', 'lambda': 1.5353824995299203, 'alpha': 5.053999083342332e-08, 'subsample': 0.890577406652031, 'colsample_bytree': 0.8945693972162805, 'max_depth': 4, 'min_child_weight': 4, 'eta': 0.06435530925132052, 'gamma': 4.965005349510374}. Best is trial 22 with value: -1.6108838591438999.     
[I 2025-06-29 22:43:18,933] Trial 32 finished with value: -1.650503769729949 and parameters: {'booster': 'gbtree', 'lambda': 1.2144711689262275, 'alpha': 9.558279853908056e-08, 'subsample': 0.9985732642270712, 'colsample_bytree': 0.8596284806771489, 'max_depth': 5, 'min_child_weight': 3, 'eta': 0.03165640675818378, 'gamma': 4.4827238984863795}. Best is trial 22 with value: -1.6108838591438999.    
[I 2025-06-29 22:43:19,008] Trial 33 finished with value: -1.651925066786694 and parameters: {'booster': 'gbtree', 'lambda': 0.09460488678460191, 'alpha': 1.099397166480289e-08, 'subsample': 0.9154280824499583, 'colsample_bytree': 0.964455028829815, 'max_depth': 3, 'min_child_weight': 5, 'eta': 0.11072140350426783, 'gamma': 3.979281866981644}. Best is trial 22 with value: -1.6108838591438999.     
[I 2025-06-29 22:43:19,272] Trial 34 finished with value: -1.6314149319727218 and parameters: {'booster': 'gbtree', 'lambda': 0.37232653382092956, 'alpha': 2.7370097458523645e-06, 'subsample': 0.8697931057504709, 'colsample_bytree': 0.9124751393661388, 'max_depth': 4, 'min_child_weight': 4, 'eta': 0.006054665192771767, 'gamma': 4.799542408370228}. Best is trial 22 with value: -1.6108838591438999. 
[I 2025-06-29 22:43:19,493] Trial 35 finished with value: -1.6013948498154513 and parameters: {'booster': 'gbtree', 'lambda': 0.00011300743237660317, 'alpha': 5.239491510239921e-07, 'subsample': 0.921498933956614, 'colsample_bytree': 0.8398002532449136, 'max_depth': 3, 'min_child_weight': 6, 'eta': 0.01242957801873632, 'gamma': 4.319355380003355}. Best is trial 35 with value: -1.6013948498154513. 
[I 2025-06-29 22:43:19,713] Trial 36 finished with value: -1.604104998216313 and parameters: {'booster': 'gbtree', 'lambda': 7.637153950693337e-05, 'alpha': 3.748837231300398e-07, 'subsample': 0.9354648548802232, 'colsample_bytree': 0.7872457940829549, 'max_depth': 3, 'min_child_weight': 6, 'eta': 0.012498477674308383, 'gamma': 3.7685582749126434}. Best is trial 35 with value: -1.6013948498154513.
[I 2025-06-29 22:43:19,897] Trial 37 finished with value: -1.6270842145003617 and parameters: {'booster': 'gbtree', 'lambda': 8.377071802875258e-05, 'alpha': 2.4286016061869445e-07, 'subsample': 0.6011995481958718, 'colsample_bytree': 0.7908019899202843, 'max_depth': 3, 'min_child_weight': 6, 'eta': 0.013960087002246413, 'gamma': 3.729235424602596}. Best is trial 35 with value: -1.6013948498154513.
[I 2025-06-29 22:43:20,128] Trial 38 finished with value: -1.6343476182576515 and parameters: {'booster': 'gbtree', 'lambda': 3.5796589209456003e-06, 'alpha': 7.360335467742481e-07, 'subsample': 0.9292891192502599, 'colsample_bytree': 0.8360374313365417, 'max_depth': 3, 'min_child_weight': 5, 'eta': 0.006471081238692014, 'gamma': 3.246799969180584}. Best is trial 35 with value: -1.6013948498154513.
[I 2025-06-29 22:43:20,358] Trial 39 finished with value: -1.697451188199385 and parameters: {'booster': 'gbtree', 'lambda': 0.00037447119451401316, 'alpha': 1.6350563425521797e-07, 'subsample': 0.8064252911248685, 'colsample_bytree': 0.9576880081899308, 'max_depth': 3, 'min_child_weight': 7, 'eta': 0.003315614802359596, 'gamma': 4.238729361820476}. Best is trial 35 with value: -1.6013948498154513.
[I 2025-06-29 22:43:20,504] Trial 40 finished with value: -1.6335556086734313 and parameters: {'booster': 'gbtree', 'lambda': 2.7201346031867032e-05, 'alpha': 9.325701446237133e-07, 'subsample': 0.8227539533087811, 'colsample_bytree': 0.7801030624537652, 'max_depth': 4, 'min_child_weight': 6, 'eta': 0.02508905472273886, 'gamma': 3.645592239249769}. Best is trial 35 with value: -1.6013948498154513.
[I 2025-06-29 22:43:20,730] Trial 41 finished with value: -1.6123964022580293 and parameters: {'booster': 'gbtree', 'lambda': 7.908435733657285e-07, 'alpha': 2.802627985605343e-08, 'subsample': 0.9652856879478721, 'colsample_bytree': 0.7391959256675821, 'max_depth': 3, 'min_child_weight': 6, 'eta': 0.00898278519107186, 'gamma': 4.311114768365878}. Best is trial 35 with value: -1.6013948498154513. 
[I 2025-06-29 22:43:20,961] Trial 42 finished with value: -1.6789285039762336 and parameters: {'booster': 'gbtree', 'lambda': 3.9715514215946893e-07, 'alpha': 3.711226609778656e-08, 'subsample': 0.9696609907935347, 'colsample_bytree': 0.7350259295790748, 'max_depth': 3, 'min_child_weight': 8, 'eta': 0.004195146002040279, 'gamma': 4.248800502463773}. Best is trial 35 with value: -1.6013948498154513.
[I 2025-06-29 22:43:21,181] Trial 43 finished with value: -1.605088159686459 and parameters: {'booster': 'gbtree', 'lambda': 5.84274142689303e-07, 'alpha': 4.0676076907235933e-07, 'subsample': 0.9399870462508289, 'colsample_bytree': 0.8123955426991674, 'max_depth': 3, 'min_child_weight': 6, 'eta': 0.012152666014932745, 'gamma': 3.853495989363647}. Best is trial 35 with value: -1.6013948498154513. 
[I 2025-06-29 22:43:21,443] Trial 44 finished with value: -1.6101627453338119 and parameters: {'booster': 'gbtree', 'lambda': 7.145907640071555e-07, 'alpha': 4.435229459723052e-06, 'subsample': 0.9183655372795649, 'colsample_bytree': 0.8230875649893289, 'max_depth': 4, 'min_child_weight': 7, 'eta': 0.008267979919767496, 'gamma': 3.803523802791082}. Best is trial 35 with value: -1.6013948498154513.
[I 2025-06-29 22:43:21,682] Trial 45 finished with value: -1.6107546708123948 and parameters: {'booster': 'gbtree', 'lambda': 1.492241444874616e-07, 'alpha': 5.831358899036953e-06, 'subsample': 0.9138521815041053, 'colsample_bytree': 0.818359534897025, 'max_depth': 4, 'min_child_weight': 7, 'eta': 0.012968578328576511, 'gamma': 2.9593294266268253}. Best is trial 35 with value: -1.6013948498154513.
[I 2025-06-29 22:43:21,896] Trial 46 finished with value: -1.6180538317971334 and parameters: {'booster': 'gbtree', 'lambda': 5.21824510416989e-08, 'alpha': 8.642735734531435e-05, 'subsample': 0.8351602148718301, 'colsample_bytree': 0.8085281196904828, 'max_depth': 4, 'min_child_weight': 7, 'eta': 0.01336472866068847, 'gamma': 3.0470992644545016}. Best is trial 35 with value: -1.6013948498154513. 
[I 2025-06-29 22:43:22,154] Trial 47 finished with value: -1.6205803101416938 and parameters: {'booster': 'gbtree', 'lambda': 7.75337495764519e-07, 'alpha': 6.472519294500984e-06, 'subsample': 0.9098666072493238, 'colsample_bytree': 0.8339603223170678, 'max_depth': 4, 'min_child_weight': 8, 'eta': 0.007568519801186594, 'gamma': 2.7455805463379894}. Best is trial 35 with value: -1.6013948498154513.
[I 2025-06-29 22:43:22,407] Trial 48 finished with value: -1.6171836665163823 and parameters: {'booster': 'gbtree', 'lambda': 2.1674995514343272e-07, 'alpha': 4.447110884399085e-07, 'subsample': 0.8680188244105801, 'colsample_bytree': 0.7625667572790301, 'max_depth': 4, 'min_child_weight': 9, 'eta': 0.017532287998075536, 'gamma': 3.497120864775924}. Best is trial 35 with value: -1.6013948498154513.
