[I 2025-06-29 22:43:22,669] Trial 49 finished with value: -1.6229066097748228 and parameters: {'booster': 'gbtree', 'lambda': 3.391275862682223e-08, 'alpha': 4.361920192099736e-06, 'subsample': 0.8635668745507568, 'colsample_bytree': 0.8069627960600831, 'max_depth': 5, 'min_child_weight': 7, 'eta': 0.012821173001824537, 'gamma': 3.8449091568899476}. Best is trial 35 with value: -1.6013948498154513.
Number of finished trials:  50
Best trial:
  Value (RMSE): 1.6014
  MSE: 2.5645
  R²: 0.3693
Model saved to ck_student_score_predictor_optuna_xgb.pkl
PS D:\machile_nearning\wecode_score_prediction\dataset-practice-separation\XGBoost-CK> python .\predict.py                                                                                              
Found 718 students without CK scores                                                                
Predictions saved to ck_score_predictions.csv                                                       
Sample predictions:                                                                                 
                                  student_id  predicted_ck_score                                    
3   0134f9f410c65ad0e8c2254a7e9288670e02a183            7.465055                                    
20  035f97702f2c01d26ab1fae8f39ea2f98a0caa3c            6.970810
40  06024da8147b5cf6105beb4c403f67cf1ff0aea1            7.693570
68  0aaebc88f6106684d6993c156104c1ef36cf94e0            6.811234
80  0bf111a9caedf02804f6991792490e63bc21058a            8.169560