PS D:\machile_nearning\wecode_score_prediction\dataset-hard-problem-fixed\XGBoost-CK-Counts> python .\train.py
[I 2025-06-29 21:50:07,501] A new study created in memory with name: no-name-b77cb52f-85d3-4b6c-b97c-25707de8dc9d
[I 2025-06-29 21:50:07,793] Trial 0 finished with value: -2.0075926834490248 and parameters: {'booster': 'dart', 'lambda': 0.6443975622985872, 'alpha': 0.14785227253377126, 'subsample': 0.5255230020659823, 'colsample_bytree': 0.8422614099236653, 'max_depth': 5, 'min_child_weight': 2, 'eta': 0.26514611679771644, 'gamma': 0.5101079145576742, 'rate_drop': 0.01409109839725426, 'skip_drop': 2.901582407146928e-07}. Best is trial 0 with value: -2.0075926834490248.
[I 2025-06-29 21:50:08,078] Trial 1 finished with value: -1.647039946599799 and parameters: {'booster': 'gbtree', 'lambda': 5.709796765102394e-08, 'alpha': 4.4700141317718285e-05, 'subsample': 0.5561162682600371, 'colsample_bytree': 0.6362756140740726, 'max_depth': 9, 'min_child_weight': 7, 'eta': 0.004038078581556347, 'gamma': 4.982051754311166}. Best is trial 1 with value: -1.647039946599799.
[I 2025-06-29 21:50:08,108] Trial 2 finished with value: -1.6853325009629445 and parameters: {'booster': 'gbtree', 'lambda': 0.019871327684178135, 'alpha': 0.0001583555732834925, 'subsample': 0.855396877655109, 'colsample_bytree': 0.5609493160027664, 'max_depth': 3, 'min_child_weight': 9, 'eta': 0.1588211481427304, 'gamma': 4.984682876070221}. Best is trial 1 with value: -1.647039946599799.
[I 2025-06-29 21:50:13,668] Trial 3 finished with value: -2.0021559895533723 and parameters: {'booster': 'dart', 'lambda': 4.014113958416244, 'alpha': 1.7574050069750243e-06, 'subsample': 0.966297978094733, 'colsample_bytree': 0.7519385604022675, 'max_depth': 6, 'min_child_weight': 5, 'eta': 0.0029749196869543605, 'gamma': 4.587873973453756, 'rate_drop': 0.47762840131112944, 'skip_drop': 1.2964644423509886e-06}. Best is trial 1 with value: -1.647039946599799.
[I 2025-06-29 21:50:13,730] Trial 4 finished with value: -1.6971260359436093 and parameters: {'booster': 'gbtree', 'lambda': 0.04741580497208969, 'alpha': 1.1756718779941784e-06, 'subsample': 0.9497390429277224, 'colsample_bytree': 0.9185453335717774, 'max_depth': 3, 'min_child_weight': 5, 'eta': 0.035991187013754054, 'gamma': 2.1407713478118517}. Best is trial 1 with value: -1.647039946599799.
[I 2025-06-29 21:50:13,816] Trial 5 finished with value: -1.7320048638139773 and parameters: {'booster': 'gbtree', 'lambda': 0.6262121244357152, 'alpha': 2.572604397540898, 'subsample': 0.8502725969920657, 'colsample_bytree': 0.6894889606937346, 'max_depth': 7, 'min_child_weight': 4, 'eta': 0.05231021387039888, 'gamma': 0.5881911246106231}. Best is trial 1 with value: -1.647039946599799.
[I 2025-06-29 21:50:21,985] Trial 6 finished with value: -1.6881100072521797 and parameters: {'booster': 'dart', 'lambda': 0.007130027293346786, 'alpha': 0.12740291482942392, 'subsample': 0.8435100611109263, 'colsample_bytree': 0.6592162491294722, 'max_depth': 5, 'min_child_weight': 8, 'eta': 0.0032304959043894786, 'gamma': 1.2254779640388347, 'rate_drop': 1.679712096108191e-07, 'skip_drop': 1.5457136757090788e-05}. Best is trial 1 with value: -1.647039946599799.
[I 2025-06-29 21:50:29,540] Trial 7 finished with value: -1.6648840423027125 and parameters: {'booster': 'dart', 'lambda': 3.407355378835686e-06, 'alpha': 0.6800655504389286, 'subsample': 0.5540809977661798, 'colsample_bytree': 0.9739978096960884, 'max_depth': 6, 'min_child_weight': 8, 'eta': 0.005552467095526918, 'gamma': 4.835734439832174, 'rate_drop': 0.0005126419032681707, 'skip_drop': 4.486251661905728e-05}. Best is trial 1 with value: -1.647039946599799.
[I 2025-06-29 21:50:29,689] Trial 8 finished with value: -1.8007323497586665 and parameters: {'booster': 'dart', 'lambda': 0.07932167337081059, 'alpha': 0.00019864691019965978, 'subsample': 0.9418097027768197, 'colsample_bytree': 0.7497931664957034, 'max_depth': 9, 'min_child_weight': 3, 'eta': 0.17267674185071144, 'gamma': 1.762873351586992, 'rate_drop': 1.6825257772569294e-05, 'skip_drop': 0.6492943203976881}. Best is trial 1 with value: -1.647039946599799.
[I 2025-06-29 21:50:30,015] Trial 9 finished with value: -1.6664105226730488 and parameters: {'booster': 'gbtree', 'lambda': 1.3288321339238965e-07, 'alpha': 6.4540577426576e-08, 'subsample': 0.5180834698611387, 'colsample_bytree': 0.6042950682043069, 'max_depth': 8, 'min_child_weight': 1, 'eta': 0.003699056134995222, 'gamma': 2.952967166370257}. Best is trial 1 with value: -1.647039946599799.
[I 2025-06-29 21:50:30,384] Trial 10 finished with value: -1.801082422746985 and parameters: {'booster': 'gbtree', 'lambda': 1.1753159984160443e-08, 'alpha': 0.006343724813169772, 'subsample': 0.6581140661475169, 'colsample_bytree': 0.5165039877509824, 'max_depth': 10, 'min_child_weight': 7, 'eta': 0.0010780234585725183, 'gamma': 3.5104161582879354}. Best is trial 1 with value: -1.647039946599799.
[I 2025-06-29 21:50:32,116] Trial 11 finished with value: -1.669678465373275 and parameters: {'booster': 'dart', 'lambda': 3.867668176479513e-06, 'alpha': 0.0013151584163054798, 'subsample': 0.6330605807018261, 'colsample_bytree': 0.9130110888119687, 'max_depth': 8, 'min_child_weight': 10, 'eta': 0.009705690643858032, 'gamma': 3.950938499252061, 'rate_drop': 0.00026556834750325527, 'skip_drop': 0.007570943538716897}. Best is trial 1 with value: -1.647039946599799.
[I 2025-06-29 21:50:33,778] Trial 12 finished with value: -1.6797010989232515 and parameters: {'booster': 'dart', 'lambda': 1.861257510941201e-05, 'alpha': 2.0391700831103395e-05, 'subsample': 0.6221265400137879, 'colsample_bytree': 0.9831006551812302, 'max_depth': 6, 'min_child_weight': 7, 'eta': 0.011484281325079093, 'gamma': 4.246508265641964, 'rate_drop': 5.687425580615132e-05, 'skip_drop': 0.0006425787091189858}. Best is trial 1 with value: -1.647039946599799.
[I 2025-06-29 21:50:34,172] Trial 13 finished with value: -1.7991157379581557 and parameters: {'booster': 'gbtree', 'lambda': 1.9080830705725263e-06, 'alpha': 1.7684028109861856, 'subsample': 0.7454458597351398, 'colsample_bytree': 0.8046088914435878, 'max_depth': 10, 'min_child_weight': 7, 'eta': 0.0010392304951804539, 'gamma': 3.049012222505235}. Best is trial 1 with value: -1.647039946599799.
[I 2025-06-29 21:50:34,423] Trial 14 finished with value: -1.6632828090079421 and parameters: {'booster': 'gbtree', 'lambda': 0.00020533762557378599, 'alpha': 0.020655307101068283, 'subsample': 0.5758957743150996, 'colsample_bytree': 0.9998677189188981, 'max_depth': 8, 'min_child_weight': 10, 'eta': 0.005541762259128882, 'gamma': 4.984455725848456}. Best is trial 1 with value: -1.647039946599799.
[I 2025-06-29 21:50:34,547] Trial 15 finished with value: -1.6662771891440398 and parameters: {'booster': 'gbtree', 'lambda': 0.0014501710583715672, 'alpha': 0.011234129095107424, 'subsample': 0.6971510889358062, 'colsample_bytree': 0.6711918311734967, 'max_depth': 8, 'min_child_weight': 10, 'eta': 0.02394920646725118, 'gamma': 3.7971392002060957}. Best is trial 1 with value: -1.647039946599799.
[I 2025-06-29 21:50:34,864] Trial 16 finished with value: -1.7101791177550705 and parameters: {'booster': 'gbtree', 'lambda': 7.015450202953413e-05, 'alpha': 1.391000998846655e-05, 'subsample': 0.5987480806143938, 'colsample_bytree': 0.6094681204502578, 'max_depth': 9, 'min_child_weight': 9, 'eta': 0.0020796434842694895, 'gamma': 4.3277577590264125}. Best is trial 1 with value: -1.647039946599799.
[I 2025-06-29 21:50:35,122] Trial 17 finished with value: -1.67422984471784 and parameters: {'booster': 'gbtree', 'lambda': 0.000474636806979225, 'alpha': 0.010766759591574603, 'subsample': 0.5884235303928985, 'colsample_bytree': 0.8377962767812375, 'max_depth': 9, 'min_child_weight': 6, 'eta': 0.006846814849741256, 'gamma': 3.0692300848847105}. Best is trial 1 with value: -1.647039946599799.
[I 2025-06-29 21:50:35,249] Trial 18 finished with value: -1.6714519832039159 and parameters: {'booster': 'gbtree', 'lambda': 1.6181104309015267e-07, 'alpha': 6.188905936111138e-08, 'subsample': 0.7090597043850227, 'colsample_bytree': 0.7360832237288166, 'max_depth': 7, 'min_child_weight': 9, 'eta': 0.01659952411014854, 'gamma': 3.5959336455173494}. Best is trial 1 with value: -1.647039946599799.
[I 2025-06-29 21:50:35,651] Trial 19 finished with value: -1.7016138263774736 and parameters: {'booster': 'gbtree', 'lambda': 3.5906173121897514e-08, 'alpha': 0.0012474155827341675, 'subsample': 0.5627420446360656, 'colsample_bytree': 0.8982213161469463, 'max_depth': 10, 'min_child_weight': 6, 'eta': 0.0020999267770871275, 'gamma': 2.4840744584791783}. Best is trial 1 with value: -1.647039946599799.
[I 2025-06-29 21:50:35,925] Trial 20 finished with value: -1.6403793964806601 and parameters: {'booster': 'gbtree', 'lambda': 4.2483592971227966e-05, 'alpha': 1.717519431947727e-05, 'subsample': 0.5032477930278574, 'colsample_bytree': 0.5024593879372352, 'max_depth': 8, 'min_child_weight': 10, 'eta': 0.005973504591144946, 'gamma': 4.4275446599129245}. Best is trial 20 with value: -1.6403793964806601.
[I 2025-06-29 21:50:36,128] Trial 21 finished with value: -1.6436713806827197 and parameters: {'booster': 'gbtree', 'lambda': 7.955920272036632e-05, 'alpha': 1.0550274308965325e-05, 'subsample': 0.5061886114410686, 'colsample_bytree': 0.5034978509360681, 'max_depth': 8, 'min_child_weight': 10, 'eta': 0.0074553526180731215, 'gamma': 4.94410067892181}. Best is trial 20 with value: -1.6403793964806601.
[I 2025-06-29 21:50:36,316] Trial 22 finished with value: -1.645110723486027 and parameters: {'booster': 'gbtree', 'lambda': 5.020200290069267e-07, 'alpha': 1.2831481569884975e-05, 'subsample': 0.5026943732405085, 'colsample_bytree': 0.5001323045942332, 'max_depth': 9, 'min_child_weight': 8, 'eta': 0.009585461270521692, 'gamma': 4.378599518818362}. Best is trial 20 with value: -1.6403793964806601.
[I 2025-06-29 21:50:36,489] Trial 23 finished with value: -1.6357150780303318 and parameters: {'booster': 'gbtree', 'lambda': 7.563010253996255e-07, 'alpha': 1.6081823165399042e-06, 'subsample': 0.5222331435617918, 'colsample_bytree': 0.5067245484167376, 'max_depth': 7, 'min_child_weight': 9, 'eta': 0.012326962488407348, 'gamma': 4.153527182677221}. Best is trial 23 with value: -1.6357150780303318.
[I 2025-06-29 21:50:36,622] Trial 24 finished with value: -1.6298742833880906 and parameters: {'booster': 'gbtree', 'lambda': 4.239113326870797e-05, 'alpha': 9.972533621079956e-07, 'subsample': 0.5001084493379893, 'colsample_bytree': 0.5467471449100734, 'max_depth': 7, 'min_child_weight': 10, 'eta': 0.020049105610407486, 'gamma': 4.053656439219583}. Best is trial 24 with value: -1.6298742833880906.
[I 2025-06-29 21:50:36,701] Trial 25 finished with value: -1.7188138530648438 and parameters: {'booster': 'gbtree', 'lambda': 1.64574105132258e-05, 'alpha': 6.791169624210619e-07, 'subsample': 0.666920038827779, 'colsample_bytree': 0.5563632588323244, 'max_depth': 7, 'min_child_weight': 9, 'eta': 0.06700232202494566, 'gamma': 3.9965923211063403}. Best is trial 24 with value: -1.6298742833880906.
[I 2025-06-29 21:50:36,839] Trial 26 finished with value: -1.6474704421355284 and parameters: {'booster': 'gbtree', 'lambda': 0.0015031828068655065, 'alpha': 2.945177716576879e-07, 'subsample': 0.5404013101061357, 'colsample_bytree': 0.5591689556920384, 'max_depth': 5, 'min_child_weight': 10, 'eta': 0.018373851862055018, 'gamma': 3.552601262450211}. Best is trial 24 with value: -1.6298742833880906.
[I 2025-06-29 21:50:36,955] Trial 27 finished with value: -1.6563604398029845 and parameters: {'booster': 'gbtree', 'lambda': 1.2215087730782868e-05, 'alpha': 1.4106934937426046e-08, 'subsample': 0.7775604774136922, 'colsample_bytree': 0.5878552058311779, 'max_depth': 7, 'min_child_weight': 9, 'eta': 0.0295271889780717, 'gamma': 4.4694352702818305}. Best is trial 24 with value: -1.6298742833880906.
[I 2025-06-29 21:50:37,097] Trial 28 finished with value: -1.6494377318129976 and parameters: {'booster': 'gbtree', 'lambda': 9.43303175204619e-07, 'alpha': 4.264163626831665e-06, 'subsample': 0.6065617114684854, 'colsample_bytree': 0.5323956335289712, 'max_depth': 4, 'min_child_weight': 8, 'eta': 0.013103721825401414, 'gamma': 3.1989145216713526}. Best is trial 24 with value: -1.6298742833880906.
[I 2025-06-29 21:50:37,180] Trial 29 finished with value: -1.707970433460598 and parameters: {'booster': 'gbtree', 'lambda': 4.127638352405629e-05, 'alpha': 1.546519056850244e-07, 'subsample': 0.5260098450030668, 'colsample_bytree': 0.536501620101105, 'max_depth': 6, 'min_child_weight': 10, 'eta': 0.06534788099439118, 'gamma': 2.7645907055506838}. Best is trial 24 with value: -1.6298742833880906.
[I 2025-06-29 21:50:37,265] Trial 30 finished with value: -1.6628182471636643 and parameters: {'booster': 'gbtree', 'lambda': 0.0003647256715451935, 'alpha': 0.00010834167929749053, 'subsample': 0.5026669259873515, 'colsample_bytree': 0.5801766146225211, 'max_depth': 7, 'min_child_weight': 9, 'eta': 0.04528824987904844, 'gamma': 4.054383731504249}. Best is trial 24 with value: -1.6298742833880906.
[I 2025-06-29 21:50:37,482] Trial 31 finished with value: -1.639492702223556 and parameters: {'booster': 'gbtree', 'lambda': 0.00015039661413373244, 'alpha': 5.4059951418302545e-06, 'subsample': 0.5351236765870077, 'colsample_bytree': 0.5019349731658266, 'max_depth': 8, 'min_child_weight': 10, 'eta': 0.007956946711281847, 'gamma': 4.636887493742652}. Best is trial 24 with value: -1.6298742833880906.
[I 2025-06-29 21:50:37,608] Trial 32 finished with value: -1.6370592823108698 and parameters: {'booster': 'gbtree', 'lambda': 0.0018386674709295428, 'alpha': 2.7160236853224254e-06, 'subsample': 0.5423595537491005, 'colsample_bytree': 0.6196818415413986, 'max_depth': 8, 'min_child_weight': 10, 'eta': 0.02003483353733851, 'gamma': 4.5809043002777186}. Best is trial 24 with value: -1.6298742833880906.
[I 2025-06-29 21:50:37,740] Trial 33 finished with value: -1.6579836558843972 and parameters: {'booster': 'gbtree', 'lambda': 0.0024945618897935585, 'alpha': 3.2175919306354014e-06, 'subsample': 0.5524973297286243, 'colsample_bytree': 0.6352414482117075, 'max_depth': 7, 'min_child_weight': 9, 'eta': 0.019967718361916003, 'gamma': 4.673346220215888}. Best is trial 24 with value: -1.6298742833880906.
[I 2025-06-29 21:50:37,902] Trial 34 finished with value: -1.6492275686172024 and parameters: {'booster': 'gbtree', 'lambda': 0.004421004332216689, 'alpha': 4.048641861976048e-07, 'subsample': 0.5778381158088723, 'colsample_bytree': 0.5484651441336142, 'max_depth': 8, 'min_child_weight': 8, 'eta': 0.014277390559116126, 'gamma': 3.379572216391967}. Best is trial 24 with value: -1.6298742833880906.
[I 2025-06-29 21:50:38,012] Trial 35 finished with value: -1.648545288065368 and parameters: {'booster': 'gbtree', 'lambda': 0.013899827484567797, 'alpha': 6.731538105159258e-05, 'subsample': 0.536609352899664, 'colsample_bytree': 0.630138189556981, 'max_depth': 6, 'min_child_weight': 10, 'eta': 0.030723482335084377, 'gamma': 4.604213272562945}. Best is trial 24 with value: -1.6298742833880906.
[I 2025-06-29 21:50:38,089] Trial 36 finished with value: -1.7051085339686447 and parameters: {'booster': 'gbtree', 'lambda': 0.2267336273732912, 'alpha': 1.029244131571416e-08, 'subsample': 0.6281801681463012, 'colsample_bytree': 0.7043467898930253, 'max_depth': 7, 'min_child_weight': 9, 'eta': 0.08991920502983008, 'gamma': 4.094683164553593}. Best is trial 24 with value: -1.6298742833880906.
[I 2025-06-29 21:50:38,744] Trial 37 finished with value: -1.6976325749650498 and parameters: {'booster': 'dart', 'lambda': 0.00021065664001731612, 'alpha': 1.5388474889464465e-06, 'subsample': 0.5456047506645981, 'colsample_bytree': 0.5805544422139735, 'max_depth': 9, 'min_child_weight': 4, 'eta': 0.02533024057347773, 'gamma': 0.21097138857256104, 'rate_drop': 4.57311863375888e-08, 'skip_drop': 1.0277904421135746e-08}. Best is trial 24 with value: -1.6298742833880906.
[I 2025-06-29 21:50:38,970] Trial 38 finished with value: -1.6480140689178988 and parameters: {'booster': 'gbtree', 'lambda': 3.311749389668838, 'alpha': 9.579391695875818e-08, 'subsample': 0.6584549904457685, 'colsample_bytree': 0.5303308513694582, 'max_depth': 4, 'min_child_weight': 9, 'eta': 0.009069880670427358, 'gamma': 3.7468984626917186}. Best is trial 24 with value: -1.6298742833880906.
[I 2025-06-29 21:50:39,069] Trial 39 finished with value: -1.6560975146146633 and parameters: {'booster': 'gbtree', 'lambda': 0.0007555813033918458, 'alpha': 0.0006725309887355194, 'subsample': 0.5689329353050734, 'colsample_bytree': 0.6150674760314199, 'max_depth': 5, 'min_child_weight': 8, 'eta': 0.038156152819455606, 'gamma': 1.7668600165862838}. Best is trial 24 with value: -1.6298742833880906.
[I 2025-06-29 21:50:47,229] Trial 40 finished with value: -1.6608964417846157 and parameters: {'booster': 'dart', 'lambda': 6.166301064901625e-06, 'alpha': 4.691112855811537e-06, 'subsample': 0.7979574340462073, 'colsample_bytree': 0.5806243656782696, 'max_depth': 6, 'min_child_weight': 10, 'eta': 0.0048010412122957554, 'gamma': 4.79890585808931, 'rate_drop': 1.9538141715537953e-06, 'skip_drop': 0.7274096370424935}. Best is trial 24 with value: -1.6298742833880906.
[I 2025-06-29 21:50:47,457] Trial 41 finished with value: -1.635195879148732 and parameters: {'booster': 'gbtree', 'lambda': 0.00012179721364467125, 'alpha': 1.2027585923329097e-06, 'subsample': 0.5262444324954317, 'colsample_bytree': 0.5215687050437465, 'max_depth': 8, 'min_child_weight': 10, 'eta': 0.007865711539611344, 'gamma': 4.607206487954829}. Best is trial 24 with value: -1.6298742833880906.
[I 2025-06-29 21:50:47,640] Trial 42 finished with value: -1.633386188831988 and parameters: {'booster': 'gbtree', 'lambda': 0.00013828914505733132, 'alpha': 1.028843388814424e-06, 'subsample': 0.5317237399386596, 'colsample_bytree': 0.5402230726337724, 'max_depth': 8, 'min_child_weight': 10, 'eta': 0.012547264197808118, 'gamma': 4.71597174312002}. Best is trial 24 with value: -1.6298742833880906.
[I 2025-06-29 21:50:47,797] Trial 43 finished with value: -1.670351316011777 and parameters: {'booster': 'gbtree', 'lambda': 0.016301580404408204, 'alpha': 7.534027074754381e-07, 'subsample': 0.877906916642268, 'colsample_bytree': 0.5343903597341457, 'max_depth': 9, 'min_child_weight': 9, 'eta': 0.01303516400624521, 'gamma': 4.185932219513656}. Best is trial 24 with value: -1.6298742833880906.
[I 2025-06-29 21:50:47,922] Trial 44 finished with value: -1.649491701886272 and parameters: {'booster': 'gbtree', 'lambda': 0.054284755152634055, 'alpha': 3.161390782044445e-08, 'subsample': 0.5278167091360937, 'colsample_bytree': 0.6561974035345544, 'max_depth': 8, 'min_child_weight': 10, 'eta': 0.018871003818959602, 'gamma': 4.730535735185387}. Best is trial 24 with value: -1.6298742833880906.
[I 2025-06-29 21:50:48,106] Trial 45 finished with value: -1.7082288272183688 and parameters: {'booster': 'gbtree', 'lambda': 4.494054364690282e-07, 'alpha': 2.3388529564881182e-07, 'subsample': 0.9898330954798809, 'colsample_bytree': 0.5629132555048328, 'max_depth': 7, 'min_child_weight': 2, 'eta': 0.01128163440119167, 'gamma': 3.8057074943756106}. Best is trial 24 with value: -1.6298742833880906.
[I 2025-06-29 21:50:56,443] Trial 46 finished with value: -1.6697224528664059 and parameters: {'booster': 'dart', 'lambda': 0.0008611607844718183, 'alpha': 3.310282222506336e-05, 'subsample': 0.6081139698639287, 'colsample_bytree': 0.5974566179209635, 'max_depth': 8, 'min_child_weight': 8, 'eta': 0.023025559545328946, 'gamma': 4.225833168753008, 'rate_drop': 0.09184128954235996, 'skip_drop': 0.005733235863204335}. Best is trial 24 with value: -1.6298742833880906.
[I 2025-06-29 21:50:56,590] Trial 47 finished with value: -1.6494009851154483 and parameters: {'booster': 'gbtree', 'lambda': 8.544778336795751e-06, 'alpha': 2.008796169751399e-06, 'subsample': 0.5674941875835883, 'colsample_bytree': 0.5249530109782543, 'max_depth': 7, 'min_child_weight': 7, 'eta': 0.015599086059183817, 'gamma': 1.123109421902873}. Best is trial 24 with value: -1.6298742833880906.
[I 2025-06-29 21:50:56,662] Trial 48 finished with value: -1.8687029267266626 and parameters: {'booster': 'gbtree', 'lambda': 2.311593517869153e-06, 'alpha': 1.1531560101889084e-06, 'subsample': 0.5218632136985755, 'colsample_bytree': 0.5595307176313358, 'max_depth': 9, 'min_child_weight': 10, 'eta': 0.2578675628917674, 'gamma': 4.54091833379388}. Best is trial 24 with value: -1.6298742833880906.
[I 2025-06-29 21:50:56,989] Trial 49 finished with value: -1.6546357413794235 and parameters: {'booster': 'gbtree', 'lambda': 9.080975511291037e-05, 'alpha': 5.373743542057488e-07, 'subsample': 0.5843262072369584, 'colsample_bytree': 0.700510352708462, 'max_depth': 8, 'min_child_weight': 9, 'eta': 0.003980250216867948, 'gamma': 3.859400179757553}. Best is trial 24 with value: -1.6298742833880906.
Number of finished trials:  50
Best trial:
  Value (RMSE): 1.6299
  MSE: 2.6565
  R²: 0.3446
Model saved to ck_student_score_predictor_optuna_xgb.pkl
PS D:\machile_nearning\wecode_score_prediction\dataset-hard-problem-fixed\XGBoost-CK-Counts> python .\predict.py
Found 733 students without CK scores
Predictions saved to ck_score_predictions.csv
Sample predictions:
                                  student_id  predicted_ck_score
3   0134f9f410c65ad0e8c2254a7e9288670e02a183            7.471369
20  035f97702f2c01d26ab1fae8f39ea2f98a0caa3c            7.199128
40  06024da8147b5cf6105beb4c403f67cf1ff0aea1            8.225104
68  0aaebc88f6106684d6993c156104c1ef36cf94e0            7.436461
80  0bf111a9caedf02804f6991792490e63bc21058a            8.673044