PS D:\machile_nearning\wecode_score_prediction\dataset-hard-problem-fixed\XGBoost-CK_Threshold_35> python .\train.py                       
[I 2025-06-29 21:57:31,878] A new study created in memory with name: no-name-fc1d8248-c397-4310-bd98-bfdaa14a1007
[I 2025-06-29 21:57:32,304] Trial 0 finished with value: -1.6573914453516159 and parameters: {'booster': 'dart', 'lambda': 4.1764357029384046e-06, 'alpha': 3.6550778358388257e-06, 'subsample': 0.9549942323134186, 'colsample_bytree': 0.9774817279280363, 'max_depth': 3, 'min_child_weight': 9, 'eta': 0.07906564565894647, 'gamma': 3.541445309878679, 'rate_drop': 0.0031754977697797727, 'skip_drop': 1.09899731131772e-05}. Best is trial 0 with value: -1.6573914453516159.
[I 2025-06-29 21:57:32,437] Trial 1 finished with value: -1.6234388781308575 and parameters: {'booster': 'gbtree', 'lambda': 9.069171383210201e-06, 'alpha': 0.004838015161562496, 'subsample': 0.9766373910546169, 'colsample_bytree': 0.7134541083819248, 'max_depth': 10, 'min_child_weight': 6, 'eta': 0.01335912633918987, 'gamma': 2.216181750845891}. Best is trial 1 with value: -1.6234388781308575.
e-06, 'alpha': 0.00037852370126586853, 'subsample': 0.6618735510669478, 'colsample_bytree': 0.6813176824561932, 'max_depth': 5, 'min_child_weight': 4, 'eta': 0.22882360142442743, 'gamma': 3.5006373889168407, 'rate_drop': 2.262710633627294e-07, 'skip_drop': 4.984995648131271e-07}. Best is trial 1 with value: -1.6234388781308575.
[I 2025-06-29 21:57:32,715] Trial 3 finished with value: -1.7232325594812612 and parameters: {'booster': 'dart', 'lambda': 0.06160898463348323, 'alpha': 2.5639528535815596e-06, 'subsample': 0.9958736918020186, 'colsample_bytree': 0.9289372042950207, 'max_depth': 6, 'min_child_weight': 7, 'eta': 0.11535444108527025, 'gamma': 0.6904032713509656, 'rate_drop': 2.2928506734856236e-05, 'skip_drop': 0.000219116976214493}. Best is trial 1 with value: -1.6234388781308575.    
[I 2025-06-29 21:57:41,147] Trial 4 finished with value: -1.5992800636960092 and parameters: {'booster': 'dart', 'lambda': 1.6324056509070258e-08, 'alpha': 4.038241703239734e-05, 'subsample': 0.511374121021277, 'colsample_bytree': 0.9975382312108136, 'max_depth': 5, 'min_child_weight': 8, 'eta': 0.004955328038292069, 'gamma': 1.7116759647110835, 'rate_drop': 0.0007168860154802153, 'skip_drop': 0.02951680753828361}. Best is trial 4 with value: -1.5992800636960092.    
[I 2025-06-29 21:57:41,176] Trial 5 finished with value: -1.672407926478317 and parameters: {'booster': 'gbtree', 'lambda': 0.00010457457614776467, 'alpha': 0.0001452588567595545, 'subsample': 0.8983256388466387, 'colsample_bytree': 0.9399901300262632, 'max_depth': 10, 'min_child_weight': 9, 'eta': 0.22960345285051, 'gamma': 3.427513839161285}. Best is trial 4 with value: -1.5992800636960092.
[I 2025-06-29 21:57:49,798] Trial 6 finished with value: -1.5978201032570443 and parameters: {'booster': 'dart', 'lambda': 1.2038864936351854e-05, 'alpha': 4.253633366412659e-08, 'subsample': 0.6310850879192133, 'colsample_bytree': 0.7663457751545522, 'max_depth': 6, 'min_child_weight': 6, 'eta': 0.0044035370554195985, 'gamma': 4.923908076037724, 'rate_drop': 9.81901420844482e-07, 'skip_drop': 0.002561890344266133}. Best is trial 6 with value: -1.5978201032570443.   
[I 2025-06-29 21:57:53,628] Trial 7 finished with value: -1.6196843123688882 and parameters: {'booster': 'dart', 'lambda': 0.05198522251930097, 'alpha': 0.0005672152169002857, 'subsample': 0.7168822367209905, 'colsample_bytree': 0.5209931711133369, 'max_depth': 9, 'min_child_weight': 6, 'eta': 0.00738817954861385, 'gamma': 2.0438739888741297, 'rate_drop': 8.415649317324351e-05, 'skip_drop': 2.0165122815264892e-08}. Best is trial 6 with value: -1.5978201032570443.    
[I 2025-06-29 21:57:56,041] Trial 8 finished with value: -1.6138120095830932 and parameters: {'booster': 'dart', 'lambda': 0.06324056873771532, 'alpha': 0.0019387256072472242, 'subsample': 0.9084670325316635, 'colsample_bytree': 0.8719848542365973, 'max_depth': 4, 'min_child_weight': 1, 'eta': 0.01625992446950485, 'gamma': 1.076039315018949, 'rate_drop': 2.6145219907232605e-08, 'skip_drop': 2.338864874419718e-08}. Best is trial 6 with value: -1.5978201032570443.
[I 2025-06-29 21:58:05,111] Trial 9 finished with value: -1.6447652707226113 and parameters: {'booster': 'dart', 'lambda': 9.05014099945689e-05, 'alpha': 0.00016836036097904464, 'subsample': 0.7578711377833154, 'colsample_bytree': 0.7289927139424128, 'max_depth': 10, 'min_child_weight': 7, 'eta': 0.002490994418654363, 'gamma': 3.754819525545402, 'rate_drop': 5.2995311742299887e-08, 'skip_drop': 0.009993411767024889}. Best is trial 6 with value: -1.5978201032570443.  
[I 2025-06-29 21:58:05,446] Trial 10 finished with value: -1.7537026432441498 and parameters: {'booster': 'gbtree', 'lambda': 1.9239138202361345e-08, 'alpha': 2.915698574870125, 'subsample': 0.5336037329941746, 'colsample_bytree': 0.8124223390453207, 'max_depth': 7, 'min_child_weight': 3, 'eta': 0.0012742948323829805, 'gamma': 4.956990445131147}. Best is trial 6 with value: -1.5978201032570443.
[I 2025-06-29 21:58:13,514] Trial 11 finished with value: -1.6112468661629087 and parameters: {'booster': 'dart', 'lambda': 3.145049548976238e-08, 'alpha': 1.8703470085821156e-08, 'subsample': 0.5041816481092749, 'colsample_bytree': 0.5435160041301282, 'max_depth': 7, 'min_child_weight': 10, 'eta': 0.004511629958625216, 'gamma': 4.916312937956078, 'rate_drop': 0.0742431638332892, 'skip_drop': 0.8467127579381757}. Best is trial 6 with value: -1.5978201032570443.      
[I 2025-06-29 21:58:14,411] Trial 12 finished with value: -1.6176901663074683 and parameters: {'booster': 'dart', 'lambda': 7.122183176771073, 'alpha': 1.0227382215698906e-08, 'subsample': 0.6118466903318633, 'colsample_bytree': 0.6302846048822153, 'max_depth': 5, 'min_child_weight': 8, 'eta': 0.040807844064909435, 'gamma': 1.4809800051076303, 'rate_drop': 4.79518269644858e-06, 'skip_drop': 0.009968821115706494}. Best is trial 6 with value: -1.5978201032570443.      
[I 2025-06-29 21:58:23,265] Trial 13 finished with value: -1.617460896578803 and parameters: {'booster': 'dart', 'lambda': 2.53872143812584e-07, 'alpha': 1.7301113281576906e-06, 'subsample': 0.5883252298798349, 'colsample_bytree': 0.8151333599586865, 'max_depth': 8, 'min_child_weight': 4, 'eta': 0.003763876077233718, 'gamma': 0.3207225379941314, 'rate_drop': 0.0028016777844658285, 'skip_drop': 0.019543939881945166}. Best is trial 6 with value: -1.5978201032570443.   
[I 2025-06-29 21:58:23,604] Trial 14 finished with value: -1.7668999801855256 and parameters: {'booster': 'gbtree', 'lambda': 4.0433525081360565e-07, 'alpha': 0.28902158588047, 'subsample': 0.7685779804232662, 'colsample_bytree': 0.8161849703220406, 'max_depth': 5, 'min_child_weight': 5, 'eta': 0.0010395967083317863, 'gamma': 2.600668997397551}. Best is trial 6 with value: -1.5978201032570443.
[I 2025-06-29 21:58:28,929] Trial 15 finished with value: -1.6156701598290029 and parameters: {'booster': 'dart', 'lambda': 0.004730033039688983, 'alpha': 1.916390738618805e-07, 'subsample': 0.5679018772286699, 'colsample_bytree': 0.9981206008491108, 'max_depth': 6, 'min_child_weight': 8, 'eta': 0.007755685791375356, 'gamma': 2.7969598442017904, 'rate_drop': 1.6451217152128814e-06, 'skip_drop': 0.0004099943936339676}. Best is trial 6 with value: -1.5978201032570443. 
[I 2025-06-29 21:58:36,905] Trial 16 finished with value: -1.7197601712155837 and parameters: {'booster': 'dart', 'lambda': 2.1431694476857044e-07, 'alpha': 0.024648921161357477, 'subsample': 0.6550442118572729, 'colsample_bytree': 0.6114823035385377, 'max_depth': 3, 'min_child_weight': 10, 'eta': 0.002269739341614311, 'gamma': 1.75848230257025, 'rate_drop': 0.002188764376619319, 'skip_drop': 0.7311555054933223}. Best is trial 6 with value: -1.5978201032570443.      
[I 2025-06-29 21:58:44,887] Trial 17 finished with value: -1.6092133696389639 and parameters: {'booster': 'dart', 'lambda': 0.0014549331543118927, 'alpha': 1.360331741259079e-05, 'subsample': 0.8185499214655492, 'colsample_bytree': 0.885351436250332, 'max_depth': 4, 'min_child_weight': 2, 'eta': 0.03314133196834394, 'gamma': 4.196426463492504, 'rate_drop': 0.09111035916761455, 'skip_drop': 0.002005436504567655}. Best is trial 6 with value: -1.5978201032570443.       
[I 2025-06-29 21:58:45,151] Trial 18 finished with value: -1.6091055352264725 and parameters: {'booster': 'gbtree', 'lambda': 2.1161078886560628e-06, 'alpha': 2.2482910675691817e-07, 'subsample': 0.6635279968158407, 'colsample_bytree': 0.8667367746540023, 'max_depth': 6, 'min_child_weight': 5, 'eta': 0.0077659555870128304, 'gamma': 2.9179165092263086}. Best is trial 6 with value: -1.5978201032570443.
[I 2025-06-29 21:58:46,025] Trial 19 finished with value: -1.617367469550953 and parameters: {'booster': 'dart', 'lambda': 6.70160238921831e-05, 'alpha': 2.925306476228789e-05, 'subsample': 0.5398670144903717, 'colsample_bytree': 0.7791577053218363, 'max_depth': 8, 'min_child_weight': 7, 'eta': 0.025123916016388602, 'gamma': 4.272615008270164, 'rate_drop': 0.000299457207182041, 'skip_drop': 1.1797133790006391e-05}. Best is trial 6 with value: -1.5978201032570443.    
[I 2025-06-29 21:58:54,441] Trial 20 finished with value: -1.668357568704259 and parameters: {'booster': 'dart', 'lambda': 1.4356434334806624e-08, 'alpha': 1.1284322622755957e-07, 'subsample': 0.6246093594737188, 'colsample_bytree': 0.6471421842017757, 'max_depth': 4, 'min_child_weight': 8, 'eta': 0.0022516372636462605, 'gamma': 1.4134680122140906, 'rate_drop': 9.119600284544222e-07, 'skip_drop': 0.07037014408227267}. Best is trial 6 with value: -1.5978201032570443. 
[I 2025-06-29 21:58:54,640] Trial 21 finished with value: -1.6081799479655554 and parameters: {'booster': 'gbtree', 'lambda': 1.8309734805848418e-06, 'alpha': 2.6068629203881913e-07, 'subsample': 0.7081056142109086, 'colsample_bytree': 0.8633039900978237, 'max_depth': 6, 'min_child_weight': 5, 'eta': 0.008246258598005252, 'gamma': 2.9256799414057535}. Best is trial 6 with value: -1.5978201032570443.
[I 2025-06-29 21:58:54,988] Trial 22 finished with value: -1.6117730977389542 and parameters: {'booster': 'gbtree', 'lambda': 1.103070916788412e-06, 'alpha': 5.499212694958924e-07, 'subsample': 0.7116673202757118, 'colsample_bytree': 0.9301711319302484, 'max_depth': 7, 'min_child_weight': 4, 'eta': 0.004290700609760198, 'gamma': 4.381042446005086}. Best is trial 6 with value: -1.5978201032570443.
[I 2025-06-29 21:58:55,123] Trial 23 finished with value: -1.6202234105004298 and parameters: {'booster': 'gbtree', 'lambda': 9.146565923665479e-08, 'alpha': 1.9721543588477236e-05, 'subsample': 0.7969211678568128, 'colsample_bytree': 0.779767158082427, 'max_depth': 5, 'min_child_weight': 6, 'eta': 0.013206905955469528, 'gamma': 2.2068364138798673}. Best is trial 6 with value: -1.5978201032570443.
[I 2025-06-29 21:58:55,355] Trial 24 finished with value: -1.6137064701973896 and parameters: {'booster': 'gbtree', 'lambda': 3.120487248855767e-05, 'alpha': 4.3850326335937175e-08, 'subsample': 0.704105801766833, 'colsample_bytree': 0.8655924744647289, 'max_depth': 6, 'min_child_weight': 5, 'eta': 0.006546950601717801, 'gamma': 0.9774626119785517}. Best is trial 6 with value: -1.5978201032570443.
[I 2025-06-29 21:58:55,527] Trial 25 finished with value: -1.6186404415119418 and parameters: {'booster': 'gbtree', 'lambda': 0.0008088958744879928, 'alpha': 8.555311924813153e-07, 'subsample': 0.5706362241192329, 'colsample_bytree': 0.9601486470434947, 'max_depth': 8, 'min_child_weight': 7, 'eta': 0.011191949334030948, 'gamma': 3.064159235652316}. Best is trial 6 with value: -1.5978201032570443.
[I 2025-06-29 21:58:55,802] Trial 26 finished with value: -1.60732832863757 and parameters: {'booster': 'gbtree', 'lambda': 1.0872917944044437e-06, 'alpha': 5.077387161665265e-08, 'subsample': 0.5023639751547462, 'colsample_bytree': 0.9015568977714781, 'max_depth': 5, 'min_child_weight': 3, 'eta': 0.003287760852910579, 'gamma': 1.764896485708612}. Best is trial 6 with value: -1.5978201032570443.
[I 2025-06-29 21:59:03,652] Trial 27 finished with value: -1.7189149177211116 and parameters: {'booster': 'dart', 'lambda': 6.616696222412679e-08, 'alpha': 0.0759670338740829, 'subsample': 0.5029608687071314, 'colsample_bytree': 0.9070756026182957, 'max_depth': 4, 'min_child_weight': 3, 'eta': 0.0014562009983873426, 'gamma': 0.1538528432046573, 'rate_drop': 8.763653330190211e-06, 'skip_drop': 2.515474467923444e-05}. Best is trial 6 with value: -1.5978201032570443.   
[I 2025-06-29 21:59:03,961] Trial 28 finished with value: -1.6135587435885048 and parameters: {'booster': 'gbtree', 'lambda': 2.1366087946593406e-05, 'alpha': 4.333206484641683e-08, 'subsample': 0.5390686224071415, 'colsample_bytree': 0.9993865850412664, 'max_depth': 5, 'min_child_weight': 1, 'eta': 0.002975798645710555, 'gamma': 1.766007388834479}. Best is trial 6 with value: -1.5978201032570443.
[I 2025-06-29 21:59:11,710] Trial 29 finished with value: -1.7332755102758002 and parameters: {'booster': 'dart', 'lambda': 9.607832057286124e-07, 'alpha': 1.5188098908761353e-05, 'subsample': 0.6141841043680962, 'colsample_bytree': 0.9588483659946764, 'max_depth': 3, 'min_child_weight': 9, 'eta': 0.0016233904167571246, 'gamma': 2.4524195039741468, 'rate_drop': 0.0002558447922342914, 'skip_drop': 0.09987583906895675}. Best is trial 6 with value: -1.5978201032570443. 
[I 2025-06-29 21:59:16,730] Trial 30 finished with value: -1.9942674467459727 and parameters: {'booster': 'dart', 'lambda': 7.4174952445991155e-06, 'alpha': 7.974936985897105e-06, 'subsample': 0.5614137919797132, 'colsample_bytree': 0.9027448361999593, 'max_depth': 4, 'min_child_weight': 3, 'eta': 0.003703660725879554, 'gamma': 1.2824591285889535, 'rate_drop': 0.5637756759179918, 'skip_drop': 0.0011923303608163804}. Best is trial 6 with value: -1.5978201032570443.   
[I 2025-06-29 21:59:17,057] Trial 31 finished with value: -1.615954283857723 and parameters: {'booster': 'gbtree', 'lambda': 2.4601624318179238e-06, 'alpha': 6.074383788235365e-08, 'subsample': 0.6928399363324067, 'colsample_bytree': 0.8470094155921886, 'max_depth': 6, 'min_child_weight': 2, 'eta': 0.0056851784859316586, 'gamma': 1.8867319858076241}. Best is trial 6 with value: -1.5978201032570443.
[I 2025-06-29 21:59:17,234] Trial 32 finished with value: -1.59475806262806 and parameters: {'booster': 'gbtree', 'lambda': 4.5608398697157e-07, 'alpha': 5.112914747547894e-07, 'subsample': 0.635910338245355, 'colsample_bytree': 0.7767027545610946, 'max_depth': 5, 'min_child_weight': 6, 'eta': 0.010108638945119878, 'gamma': 3.217329625092087}. Best is trial 32 with value: -1.59475806262806.
[I 2025-06-29 21:59:17,420] Trial 33 finished with value: -1.5910474765280356 and parameters: {'booster': 'gbtree', 'lambda': 1.1528856453980617e-07, 'alpha': 1.4524540824033198e-06, 'subsample': 0.5000911666940111, 'colsample_bytree': 0.7403622333816814, 'max_depth': 5, 'min_child_weight': 6, 'eta': 0.010883594621278945, 'gamma': 4.6415840936257355}. Best is trial 33 with value: -1.5910474765280356.
[I 2025-06-29 21:59:17,573] Trial 34 finished with value: -1.5950924671615996 and parameters: {'booster': 'gbtree', 'lambda': 8.604734139426646e-08, 'alpha': 2.9738602274024574e-06, 'subsample': 0.6440939779834156, 'colsample_bytree': 0.6917225558560198, 'max_depth': 5, 'min_child_weight': 6, 'eta': 0.013125867663439032, 'gamma': 4.639783814955682}. Best is trial 33 with value: -1.5910474765280356.
[I 2025-06-29 21:59:17,721] Trial 35 finished with value: -1.6182326114635777 and parameters: {'booster': 'gbtree', 'lambda': 1.1203926688288851e-07, 'alpha': 5.561259715114524e-06, 'subsample': 0.6647632620065237, 'colsample_bytree': 0.6931252212568644, 'max_depth': 7, 'min_child_weight': 6, 'eta': 0.023469061035872468, 'gamma': 4.574173867517643}. Best is trial 33 with value: -1.5910474765280356.
[I 2025-06-29 21:59:17,889] Trial 36 finished with value: -1.5902744256068428 and parameters: {'booster': 'gbtree', 'lambda': 4.7806129029512e-07, 'alpha': 1.8274022072108055e-06, 'subsample': 0.6378175845366805, 'colsample_bytree': 0.7521540095489955, 'max_depth': 5, 'min_child_weight': 6, 'eta': 0.01089289793464805, 'gamma': 3.826626663857018}. Best is trial 36 with value: -1.5902744256068428.
[I 2025-06-29 21:59:17,976] Trial 37 finished with value: -1.6130503806803462 and parameters: {'booster': 'gbtree', 'lambda': 4.5745995195518524e-07, 'alpha': 1.5279783926242648e-06, 'subsample': 0.8474798452515873, 'colsample_bytree': 0.7351274052911113, 'max_depth': 3, 'min_child_weight': 6, 'eta': 0.05234742271573368, 'gamma': 3.8665752951281998}. Best is trial 36 with value: -1.5902744256068428.
[I 2025-06-29 21:59:18,109] Trial 38 finished with value: -1.5805104858434784 and parameters: {'booster': 'gbtree', 'lambda': 4.167536876399081e-08, 'alpha': 8.662119432028731e-05, 'subsample': 0.6393660750187304, 'colsample_bytree': 0.6909213152101008, 'max_depth': 4, 'min_child_weight': 7, 'eta': 0.019955604391547314, 'gamma': 3.4070708650635693}. Best is trial 38 with value: -1.5805104858434784.
[I 2025-06-29 21:59:18,186] Trial 39 finished with value: -1.6470442054598167 and parameters: {'booster': 'gbtree', 'lambda': 2.864753834311273e-08, 'alpha': 0.00010501795809011677, 'subsample': 0.5935614675000602, 'colsample_bytree': 0.6704097863452252, 'max_depth': 4, 'min_child_weight': 7, 'eta': 0.12634750683697582, 'gamma': 3.3120114410548296}. Best is trial 38 with value: -1.5805104858434784.
[I 2025-06-29 21:59:18,331] Trial 40 finished with value: -1.591824109893768 and parameters: {'booster': 'gbtree', 'lambda': 1.0736080218781996e-08, 'alpha': 0.001412812377504644, 'subsample': 0.7314242525917595, 'colsample_bytree': 0.7457739406597821, 'max_depth': 3, 'min_child_weight': 7, 'eta': 0.020034175335936023, 'gamma': 3.8743163228604707}. Best is trial 38 with value: -1.5805104858434784.
[I 2025-06-29 21:59:18,534] Trial 41 finished with value: -1.588325950379066 and parameters: {'booster': 'gbtree', 'lambda': 4.392910404139801e-08, 'alpha': 0.00098936619072146, 'subsample': 0.7409741711753379, 'colsample_bytree': 0.7558295498830573, 'max_depth': 3, 'min_child_weight': 7, 'eta': 0.010048605311142376, 'gamma': 3.8960595739310806}. Best is trial 38 with value: -1.5805104858434784.
[I 2025-06-29 21:59:18,691] Trial 42 finished with value: -1.5951742640936832 and parameters: {'booster': 'gbtree', 'lambda': 2.0025642450657648e-08, 'alpha': 0.0019712600784173515, 'subsample': 0.7818332896481657, 'colsample_bytree': 0.7550095581602815, 'max_depth': 3, 'min_child_weight': 8, 'eta': 0.01786566226329914, 'gamma': 3.9007062734729847}. Best is trial 38 with value: -1.5805104858434784.
[I 2025-06-29 21:59:18,843] Trial 43 finished with value: -1.5890317746891964 and parameters: {'booster': 'gbtree', 'lambda': 5.203428296859592e-08, 'alpha': 0.0005748897082784153, 'subsample': 0.7418343776477714, 'colsample_bytree': 0.7139375924443234, 'max_depth': 3, 'min_child_weight': 7, 'eta': 0.01846245566263462, 'gamma': 3.6078772483229478}. Best is trial 38 with value: -1.5805104858434784.
[I 2025-06-29 21:59:18,947] Trial 44 finished with value: -1.6007091478580135 and parameters: {'booster': 'gbtree', 'lambda': 5.105021235751305e-08, 'alpha': 0.010728077228806178, 'subsample': 0.7467575295184596, 'colsample_bytree': 0.7159269622450706, 'max_depth': 4, 'min_child_weight': 7, 'eta': 0.03367368173164374, 'gamma': 3.5643507754118278}. Best is trial 38 with value: -1.5805104858434784.
[I 2025-06-29 21:59:19,131] Trial 45 finished with value: -1.6036494302502573 and parameters: {'booster': 'gbtree', 'lambda': 1.9232927344745864e-07, 'alpha': 7.416057078894811e-05, 'subsample': 0.8675733878029993, 'colsample_bytree': 0.6673408066899544, 'max_depth': 3, 'min_child_weight': 9, 'eta': 0.01549454957913129, 'gamma': 3.645364893101761}. Best is trial 38 with value: -1.5805104858434784.
[I 2025-06-29 21:59:19,212] Trial 46 finished with value: -1.6157744442601385 and parameters: {'booster': 'gbtree', 'lambda': 4.620079518246711e-06, 'alpha': 0.0007386173507631268, 'subsample': 0.6818753101450692, 'colsample_bytree': 0.5998741383523489, 'max_depth': 3, 'min_child_weight': 7, 'eta': 0.06349078984243442, 'gamma': 4.2153364800603415}. Best is trial 38 with value: -1.5805104858434784.
[I 2025-06-29 21:59:19,382] Trial 47 finished with value: -1.6034017990620058 and parameters: {'booster': 'gbtree', 'lambda': 4.406593114431531e-08, 'alpha': 0.00025136148563944074, 'subsample': 0.9252674523198794, 'colsample_bytree': 0.714663439758404, 'max_depth': 4, 'min_child_weight': 5, 'eta': 0.009804995611179071, 'gamma': 4.005195334104974}. Best is trial 38 with value: -1.5805104858434784.
[I 2025-06-29 21:59:19,488] Trial 48 finished with value: -1.5884909413352608 and parameters: {'booster': 'gbtree', 'lambda': 1.6762765732277675e-07, 'alpha': 5.935288637130121e-05, 'subsample': 0.7350655749655588, 'colsample_bytree': 0.7942193697908502, 'max_depth': 4, 'min_child_weight': 8, 'eta': 0.029853857528857844, 'gamma': 4.670471309133097}. Best is trial 38 with value: -1.5805104858434784.
