[I 2025-06-29 21:59:19,607] Trial 49 finished with value: -1.6002301337331208 and parameters: {'booster': 'gbtree', 'lambda': 5.454225835195438e-07, 'alpha': 0.005469915085519946, 'subsample': 0.7351286222501031, 'colsample_bytree': 0.7933335097209294, 'max_depth': 4, 'min_child_weight': 8, 'eta': 0.024873520582133397, 'gamma': 3.451502339911899}. Best is trial 38 with value: -1.5805104858434784.
Number of finished trials:  50
Best trial:
  Value (RMSE): 1.5805
  MSE: 2.4980
  R²: 0.3837
Model saved to ck_student_score_predictor_optuna_xgb.pkl
PS D:\machile_nearning\wecode_score_prediction\dataset-hard-problem-fixed\XGBoost-CK_Threshold_35> python .\predict.py
Found 733 students without CK scores
Predictions saved to ck_score_predictions.csv
Sample predictions:
                                  student_id  predicted_ck_score
3   0134f9f410c65ad0e8c2254a7e9288670e02a183            6.901666
20  035f97702f2c01d26ab1fae8f39ea2f98a0caa3c            7.181077
40  06024da8147b5cf6105beb4c403f67cf1ff0aea1            8.301628
68  0aaebc88f6106684d6993c156104c1ef36cf94e0            6.553368
80  0bf111a9caedf02804f6991792490e63bc21058a            8.648192