PS D:\machile_nearning\wecode_score_prediction\dataset-hard-problem-fixed\XGBoost-QT_Threshold_35> python .\train.py  
[I 2025-06-29 23:03:02,840] A new study created in memory with name: no-name-774943e3-d1cd-4402-85a6-61420da6ad6f
[I 2025-06-29 23:03:03,001] Trial 0 finished with value: -1.1410072623776444 and parameters: {'booster': 'gbtree', 'lambda': 4.097614501276175, 'alpha': 4.252734709317268e-06, 'subsample': 0.9384717865763257, 'colsample_bytree': 0.9645887978704558, 'max_depth': 9, 'min_child_weight': 1, 'eta': 0.03135352237727627, 'gamma': 4.773026568847146}. Best is trial 0 with value: -1.1410072623776444.
[I 2025-06-29 23:03:11,109] Trial 1 finished with value: -1.1544854128859037 and parameters: {'booster': 'dart', 'lambda': 2.4876259233708624, 'alpha': 9.615428290701212e-05, 'subsample': 0.5548906642919216, 'colsample_bytree': 0.6279652231537214, 'max_depth': 10, 'min_child_weight': 3, 'eta': 0.00275716627059893, 'gamma': 0.16076536363462124, 'rate_drop': 2.5503996335145874e-08, 'skip_drop': 5.297621136938512e-06}. Best is trial 0 with value: -1.1410072623776444.
[I 2025-06-29 23:03:11,175] Trial 2 finished with value: -1.192109950740901 and parameters: {'booster': 'gbtree', 'lambda': 0.004954627203223755, 'alpha': 0.35148732345595834, 'subsample': 0.6731363930222187, 'colsample_bytree': 0.825517975428222, 'max_depth': 7, 'min_child_weight': 2, 'eta': 0.025800764678623814, 'gamma': 1.5887095889436327}. Best is trial 0 with value: -1.1410072623776444.      
[I 2025-06-29 23:03:20,010] Trial 3 finished with value: -1.308788152709754 and parameters: {'booster': 'dart', 'lambda': 2.1936757056864624, 'alpha': 1.1404990355370375, 'subsample': 0.5068431650627092, 'colsample_bytree': 0.7791575257674294, 'max_depth': 3, 'min_child_weight': 2, 'eta': 0.0050961350700038785, 'gamma': 2.403653159458, 'rate_drop': 0.049765934791411365, 'skip_drop': 4.3964351863684563e-07}. Best is trial 0 with value: -1.1410072623776444.
[I 2025-06-29 23:03:28,565] Trial 4 finished with value: -1.146498009179848 and parameters: {'booster': 'dart', 'lambda': 1.4362183381926249e-07, 'alpha': 0.0022991434216476595, 'subsample': 0.9470622078713146, 'colsample_bytree': 0.5580400967570822, 'max_depth': 10, 'min_child_weight': 6, 'eta': 0.0028535287084450046, 'gamma': 1.188766378836198, 'rate_drop': 4.243119333818869e-08, 'skip_drop': 0.012462866287799973}. Best is trial 0 with value: -1.1410072623776444.
[I 2025-06-29 23:03:28,819] Trial 5 finished with value: -1.219495295447161 and parameters: {'booster': 'gbtree', 'lambda': 0.4464152248014755, 'alpha': 0.13413410566332543, 'subsample': 0.8229176221493488, 'colsample_bytree': 0.7513465863941954, 'max_depth': 10, 'min_child_weight': 5, 'eta': 0.0012934163994986123, 'gamma': 3.3241487586215275}. Best is trial 0 with value: -1.1410072623776444.     
[I 2025-06-29 23:03:34,932] Trial 6 finished with value: -1.1004810555318585 and parameters: {'booster': 'dart', 'lambda': 6.657792516089489e-06, 'alpha': 0.0022576721149097294, 'subsample': 0.9395312247365828, 'colsample_bytree': 0.9802528883218471, 'max_depth': 10, 'min_child_weight': 6, 'eta': 0.007806816691148743, 'gamma': 4.6916723590190115, 'rate_drop': 4.977477321155568e-07, 'skip_drop': 0.16754807352154164}. Best is trial 6 with value: -1.1004810555318585.
[I 2025-06-29 23:03:35,185] Trial 7 finished with value: -1.2014418622188794 and parameters: {'booster': 'dart', 'lambda': 0.0852094409873477, 'alpha': 0.15719542003933015, 'subsample': 0.6807438911178877, 'colsample_bytree': 0.990902979097902, 'max_depth': 10, 'min_child_weight': 2, 'eta': 0.1008505429094296, 'gamma': 4.806434575856202, 'rate_drop': 2.943544271205919e-06, 'skip_drop': 0.20660672257941975}. Best is trial 6 with value: -1.1004810555318585.
[I 2025-06-29 23:03:35,468] Trial 8 finished with value: -1.074320021577015 and parameters: {'booster': 'gbtree', 'lambda': 0.013078950193590382, 'alpha': 1.4989046501638574e-07, 'subsample': 0.6828912478967832, 'colsample_bytree': 0.96529233002534, 'max_depth': 8, 'min_child_weight': 9, 'eta': 0.005252474384075634, 'gamma': 2.20947182353884}. Best is trial 8 with value: -1.074320021577015.       
[I 2025-06-29 23:03:35,616] Trial 9 finished with value: -1.1865410321532264 and parameters: {'booster': 'dart', 'lambda': 0.017887067959285533, 'alpha': 0.031795825222986254, 'subsample': 0.976256037758178, 'colsample_bytree': 0.6659787519097854, 'max_depth': 3, 'min_child_weight': 5, 'eta': 0.27790414697402654, 'gamma': 0.3011322443944914, 'rate_drop': 7.740360022153452e-06, 'skip_drop': 0.8741111299844885}. Best is trial 8 with value: -1.074320021577015.
[I 2025-06-29 23:03:35,779] Trial 10 finished with value: -1.083271205005124 and parameters: {'booster': 'gbtree', 'lambda': 7.153258232316043e-05, 'alpha': 3.157760882203665e-08, 'subsample': 0.8237440045754778, 'colsample_bytree': 0.8700718235648316, 'max_depth': 6, 'min_child_weight': 10, 'eta': 0.011156797617304114, 'gamma': 3.403920395216729}. Best is trial 8 with value: -1.074320021577015.  
[I 2025-06-29 23:03:35,914] Trial 11 finished with value: -1.0837051464818723 and parameters: {'booster': 'gbtree', 'lambda': 0.0001054077354447031, 'alpha': 4.2731496727881544e-08, 'subsample': 0.8023436414002291, 'colsample_bytree': 0.8764088547790958, 'max_depth': 6, 'min_child_weight': 10, 'eta': 0.01220950704366575, 'gamma': 3.015261514059392}. Best is trial 8 with value: -1.074320021577015. 
[I 2025-06-29 23:03:35,999] Trial 12 finished with value: -1.081505040799473 and parameters: {'booster': 'gbtree', 'lambda': 0.00026958748342231, 'alpha': 2.3019221599431072e-08, 'subsample': 0.7106956771365558, 'colsample_bytree': 0.8873135466677841, 'max_depth': 7, 'min_child_weight': 10, 'eta': 0.040679466946235684, 'gamma': 3.5774445196085303}. Best is trial 8 with value: -1.074320021577015.  
[I 2025-06-29 23:03:36,076] Trial 13 finished with value: -1.086368604162966 and parameters: {'booster': 'gbtree', 'lambda': 0.0019222110311375928, 'alpha': 2.2173108373930366e-06, 'subsample': 0.6520762360605187, 'colsample_bytree': 0.907264559983485, 'max_depth': 8, 'min_child_weight': 8, 'eta': 0.05500654269721418, 'gamma': 3.9188152704194317}. Best is trial 8 with value: -1.074320021577015.   
[I 2025-06-29 23:03:36,144] Trial 14 finished with value: -1.118357576981808 and parameters: {'booster': 'gbtree', 'lambda': 2.5862008883769247e-06, 'alpha': 6.249105852577342e-07, 'subsample': 0.746886096909046, 'colsample_bytree': 0.9175470128482398, 'max_depth': 5, 'min_child_weight': 8, 'eta': 0.09517517133212297, 'gamma': 2.1811677860120233}. Best is trial 8 with value: -1.074320021577015.   
[I 2025-06-29 23:03:36,450] Trial 15 finished with value: -1.2510593405009578 and parameters: {'booster': 'gbtree', 'lambda': 0.0021608806808793807, 'alpha': 1.2610561504333935e-08, 'subsample': 0.6118695972346284, 'colsample_bytree': 0.8146629010304084, 'max_depth': 8, 'min_child_weight': 8, 'eta': 0.001045839370283405, 'gamma': 1.5916437030690114}. Best is trial 8 with value: -1.074320021577015.
[I 2025-06-29 23:03:36,554] Trial 16 finished with value: -1.0832242581679243 and parameters: {'booster': 'gbtree', 'lambda': 1.887408396650527e-08, 'alpha': 4.548994319881403e-05, 'subsample': 0.7371343537059142, 'colsample_bytree': 0.9262785180788123, 'max_depth': 8, 'min_child_weight': 9, 'eta': 0.02377479292810344, 'gamma': 4.196654718217549}. Best is trial 8 with value: -1.074320021577015.   
[I 2025-06-29 23:03:36,781] Trial 17 finished with value: -1.0791912890878206 and parameters: {'booster': 'gbtree', 'lambda': 9.24900022820076e-06, 'alpha': 2.787311712227369e-07, 'subsample': 0.5985631538366285, 'colsample_bytree': 0.8360311491909492, 'max_depth': 5, 'min_child_weight': 7, 'eta': 0.0039049637169165426, 'gamma': 3.1082994959414703}. Best is trial 8 with value: -1.074320021577015. 
[I 2025-06-29 23:03:36,975] Trial 18 finished with value: -1.1026589518584764 and parameters: {'booster': 'gbtree', 'lambda': 3.438225488935266e-06, 'alpha': 3.514350206107441e-07, 'subsample': 0.6008340725889831, 'colsample_bytree': 0.6880632775790263, 'max_depth': 4, 'min_child_weight': 7, 'eta': 0.003674502247302554, 'gamma': 2.862986103900302}. Best is trial 8 with value: -1.074320021577015.  
[I 2025-06-29 23:03:37,204] Trial 19 finished with value: -1.1496058744412494 and parameters: {'booster': 'gbtree', 'lambda': 2.4508454983636168e-05, 'alpha': 2.260490250227081e-05, 'subsample': 0.5051605131127292, 'colsample_bytree': 0.8300043815486094, 'max_depth': 5, 'min_child_weight': 4, 'eta': 0.0018832747216981033, 'gamma': 2.0742916512437986}. Best is trial 8 with value: -1.074320021577015.
[I 2025-06-29 23:03:37,409] Trial 20 finished with value: -1.0786889599167937 and parameters: {'booster': 'gbtree', 'lambda': 5.614956758602871e-07, 'alpha': 2.1014539444289212e-07, 'subsample': 0.5955236306983281, 'colsample_bytree': 0.702606692014361, 'max_depth': 5, 'min_child_weight': 7, 'eta': 0.0070049894578796896, 'gamma': 0.8350587808309051}. Best is trial 8 with value: -1.074320021577015.
[I 2025-06-29 23:03:37,660] Trial 21 finished with value: -1.0784411958665425 and parameters: {'booster': 'gbtree', 'lambda': 4.164360934932246e-07, 'alpha': 3.194211490780517e-07, 'subsample': 0.602997648164815, 'colsample_bytree': 0.7021567045146635, 'max_depth': 5, 'min_child_weight': 7, 'eta': 0.005235783347677818, 'gamma': 0.5897723682155576}. Best is trial 8 with value: -1.074320021577015.  
[I 2025-06-29 23:03:37,918] Trial 22 finished with value: -1.0742353389137915 and parameters: {'booster': 'gbtree', 'lambda': 2.265192954708588e-07, 'alpha': 5.809352034164978e-06, 'subsample': 0.5571685666106679, 'colsample_bytree': 0.6976975751456165, 'max_depth': 4, 'min_child_weight': 7, 'eta': 0.005607767731221428, 'gamma': 0.6743412545268916}. Best is trial 22 with value: -1.0742353389137915.
[I 2025-06-29 23:03:38,061] Trial 23 finished with value: -1.0666407585542612 and parameters: {'booster': 'gbtree', 'lambda': 3.72534581600428e-08, 'alpha': 6.677249565378732e-06, 'subsample': 0.5612678174321305, 'colsample_bytree': 0.5953843204478108, 'max_depth': 4, 'min_child_weight': 9, 'eta': 0.012655634879518296, 'gamma': 0.7567274131489343}. Best is trial 23 with value: -1.0666407585542612.
[I 2025-06-29 23:03:38,199] Trial 24 finished with value: -1.069104815650095 and parameters: {'booster': 'gbtree', 'lambda': 1.2741325210898238e-08, 'alpha': 6.967652239738013e-06, 'subsample': 0.550360815878876, 'colsample_bytree': 0.5034144232279962, 'max_depth': 4, 'min_child_weight': 9, 'eta': 0.014724133947548236, 'gamma': 1.1548630788328782}. Best is trial 23 with value: -1.0666407585542612.
[I 2025-06-29 23:03:38,340] Trial 25 finished with value: -1.0678740219777798 and parameters: {'booster': 'gbtree', 'lambda': 1.1798077313856828e-08, 'alpha': 7.385583712893798e-06, 'subsample': 0.5512749101472797, 'colsample_bytree': 0.5062269749110457, 'max_depth': 4, 'min_child_weight': 9, 'eta': 0.012634685883667321, 'gamma': 1.0436953981928192}. Best is trial 23 with value: -1.0666407585542612.
[I 2025-06-29 23:03:38,510] Trial 26 finished with value: -1.071380031361324 and parameters: {'booster': 'gbtree', 'lambda': 1.1949750811219647e-08, 'alpha': 0.0005120210592842187, 'subsample': 0.5472267515657987, 'colsample_bytree': 0.5031274640871627, 'max_depth': 4, 'min_child_weight': 9, 'eta': 0.015421624302387643, 'gamma': 1.2412771166916263}. Best is trial 23 with value: -1.0666407585542612.
[I 2025-06-29 23:03:38,668] Trial 27 finished with value: -1.0788264815404394 and parameters: {'booster': 'gbtree', 'lambda': 4.255408475991596e-08, 'alpha': 1.2682529557055341e-05, 'subsample': 0.6416929202523183, 'colsample_bytree': 0.5069583183588889, 'max_depth': 3, 'min_child_weight': 9, 'eta': 0.018780215775559075, 'gamma': 1.6889640243784205}. Best is trial 23 with value: -1.0666407585542612.
[I 2025-06-29 23:03:38,908] Trial 28 finished with value: -1.0642513335516093 and parameters: {'booster': 'gbtree', 'lambda': 7.260098775834587e-08, 'alpha': 9.137742318239923e-05, 'subsample': 0.5296033326074754, 'colsample_bytree': 0.5756087964135056, 'max_depth': 4, 'min_child_weight': 8, 'eta': 0.008387777522699136, 'gamma': 1.0721782174115537}. Best is trial 28 with value: -1.0642513335516093.
[I 2025-06-29 23:03:39,082] Trial 29 finished with value: -1.0867979249762643 and parameters: {'booster': 'gbtree', 'lambda': 4.793091011104316e-08, 'alpha': 0.00026634897527882094, 'subsample': 0.870522152263612, 'colsample_bytree': 0.5911696360178956, 'max_depth': 3, 'min_child_weight': 8, 'eta': 0.009841785776888424, 'gamma': 0.4172728486762649}. Best is trial 28 with value: -1.0642513335516093.
[I 2025-06-29 23:03:39,175] Trial 30 finished with value: -1.0685583381003805 and parameters: {'booster': 'gbtree', 'lambda': 1.2669860535612885e-06, 'alpha': 1.3847592056805357e-06, 'subsample': 0.5252534412539943, 'colsample_bytree': 0.5622942825982077, 'max_depth': 4, 'min_child_weight': 10, 'eta': 0.05247743718419479, 'gamma': 0.9821138123404576}. Best is trial 28 with value: -1.0642513335516093.
[I 2025-06-29 23:03:39,294] Trial 31 finished with value: -1.0670677119151744 and parameters: {'booster': 'gbtree', 'lambda': 1.0877288773094497e-06, 'alpha': 9.791887800418102e-07, 'subsample': 0.52353079064245043, 'colsample_bytree': 0.6150646377666069, 'max_depth': 4, 'min_child_weight': 10, 'eta': 0.034556454807735594, 'gamma': 0.036785886358675766}. Best is trial 28 with value: -1.0642513335516093.
[I 2025-06-29 23:03:39,560] Trial 33 finished with value: -1.069877213836979 and parameters: {'booster': 'gbtree', 'lambda': 5.380523640594632e-08, 'alpha': 1.7255260362693053e-06, 'subsample': 0.5353527336969137, 'colsample_bytree': 0.5452680187787976, 'max_depth': 6, 'min_child_weight': 9, 'eta': 0.02015883336106377, 'gamma': 0.0663054441387469}. Best is trial 28 with value: -1.0642513335516093.
[I 2025-06-29 23:03:44,816] Trial 34 finished with value: -1.4875317805486041 and parameters: {'booster': 'dart', 'lambda': 8.034682700043769e-07, 'alpha': 5.054074676018618e-05, 'subsample': 0.5735247402220625, 'colsample_bytree': 0.637845505406676, 'max_depth': 3, 'min_child_weight': 8, 'eta': 0.009174043262904857, 'gamma': 0.4782587278002578, 'rate_drop': 0.5323436140572895, 'skip_drop': 1.010280607234316e-08}. Best is trial 28 with value: -1.0642513335516093.
[I 2025-06-29 23:03:44,989] Trial 35 finished with value: -1.0735357139749933 and parameters: {'booster': 'gbtree', 'lambda': 1.110328103099929e-07, 'alpha': 6.301044023675881, 'subsample': 0.5007288597185937, 'colsample_bytree': 0.5828084291846043, 'max_depth': 4, 'min_child_weight': 10, 'eta': 0.02509203653291107, 'gamma': 1.444826382647536}. Best is trial 28 with value: -1.0642513335516093.
[I 2025-06-29 23:03:45,075] Trial 36 finished with value: -1.093925918874989 and parameters: {'booster': 'gbtree', 'lambda': 3.3702365157883474e-08, 'alpha': 0.0011160657421043537, 'subsample': 0.6367493790783764, 'colsample_bytree': 0.5340054240910247, 'max_depth': 3, 'min_child_weight': 9, 'eta': 0.07852597571622635, 'gamma': 0.8180822007527682}. Best is trial 28 with value: -1.0642513335516093.
[I 2025-06-29 23:03:45,281] Trial 37 finished with value: -1.0960738403241497 and parameters: {'booster': 'dart', 'lambda': 2.2487471953710626e-07, 'alpha': 0.00018091553834290522, 'subsample': 0.5287702377787582, 'colsample_bytree': 0.6079872784701068, 'max_depth': 5, 'min_child_weight': 8, 'eta': 0.15052901174612018, 'gamma': 1.8975598553520554, 'rate_drop': 0.0009268550262649694, 'skip_drop': 0.0008398724830327272}. Best is trial 28 with value: -1.0642513335516093.
[I 2025-06-29 23:03:45,376] Trial 38 finished with value: -1.089673531123869 and parameters: {'booster': 'gbtree', 'lambda': 1.0300086084421452e-08, 'alpha': 2.0010434393915698e-05, 'subsample': 0.574662665586438, 'colsample_bytree': 0.6519097382407082, 'max_depth': 4, 'min_child_weight': 6, 'eta': 0.03083885142779479, 'gamma': 2.6068712757345867}. Best is trial 28 with value: -1.0642513335516093.
[I 2025-06-29 23:03:47,617] Trial 39 finished with value: -1.1376110917665192 and parameters: {'booster': 'dart', 'lambda': 1.119336910331111e-05, 'alpha': 0.01683440976341793, 'subsample': 0.5225592995632927, 'colsample_bytree': 0.5335522398919882, 'max_depth': 6, 'min_child_weight': 1, 'eta': 0.0074946459583190425, 'gamma': 0.33652953870826835, 'rate_drop': 0.001087396170664371, 'skip_drop': 4.329650417154159e-05}. Best is trial 28 with value: -1.0642513335516093.
[I 2025-06-29 23:03:47,837] Trial 40 finished with value: -1.1962644882611149 and parameters: {'booster': 'gbtree', 'lambda': 8.903368130292819, 'alpha': 0.006333114840346961, 'subsample': 0.6261320487734124, 'colsample_bytree': 0.5741843478974573, 'max_depth': 9, 'min_child_weight': 10, 'eta': 0.002268875545434421, 'gamma': 1.0762869377880384}. Best is trial 28 with value: -1.0642513335516093.   
[I 2025-06-29 23:03:47,921] Trial 41 finished with value: -1.0632246785306183 and parameters: {'booster': 'gbtree', 'lambda': 1.5111537805765631e-06, 'alpha': 1.6368531752385925e-06, 'subsample': 0.5179553086736949, 'colsample_bytree': 0.5631976782295057, 'max_depth': 4, 'min_child_weight': 10, 'eta': 0.053713911573916286, 'gamma': 0.9535992734964266}. Best is trial 41 with value: -1.0632246785306183.
[I 2025-06-29 23:03:48,004] Trial 42 finished with value: -1.0822839873233767 and parameters: {'booster': 'gbtree', 'lambda': 1.8102619865392172e-06, 'alpha': 9.61206862146373e-07, 'subsample': 0.5787183311841395, 'colsample_bytree': 0.6003308728927602, 'max_depth': 3, 'min_child_weight': 9, 'eta': 0.045321899940108226, 'gamma': 1.4093176888874892}. Best is trial 41 with value: -1.0632246785306183.
[I 2025-06-29 23:03:48,088] Trial 43 finished with value: -1.0702152804555802 and parameters: {'booster': 'gbtree', 'lambda': 7.855108144422361e-08, 'alpha': 3.771103713088422e-06, 'subsample': 0.5182740576770801, 'colsample_bytree': 0.5265189233958596, 'max_depth': 4, 'min_child_weight': 10, 'eta': 0.07802209286033451, 'gamma': 0.7347470352718011}. Best is trial 41 with value: -1.0632246785306183.
[I 2025-06-29 23:03:48,232] Trial 44 finished with value: -1.065846705384094 and parameters: {'booster': 'gbtree', 'lambda': 2.898336742048519e-07, 'alpha': 1.0631751800501843e-05, 'subsample': 0.5433347290011038, 'colsample_bytree': 0.5536131184314835, 'max_depth': 5, 'min_child_weight': 9, 'eta': 0.012937807619967547, 'gamma': 0.22947002538973704}. Best is trial 41 with value: -1.0632246785306183.
[I 2025-06-29 23:03:49,347] Trial 45 finished with value: -1.073331165914104 and parameters: {'booster': 'dart', 'lambda': 3.429109693343637e-07, 'alpha': 8.350152854076867e-08, 'subsample': 0.5009442569946174, 'colsample_bytree': 0.563480225677432, 'max_depth': 5, 'min_child_weight': 10, 'eta': 0.029373321500951517, 'gamma': 0.1972222939539248, 'rate_drop': 8.94174742659058e-05, 'skip_drop': 3.697919405301349e-08}. Best is trial 41 with value: -1.0632246785306183.
[I 2025-06-29 23:03:49,441] Trial 46 finished with value: -1.1646159986290079 and parameters: {'booster': 'gbtree', 'lambda': 4.729792060088606e-06, 'alpha': 3.7805104229819276e-05, 'subsample': 0.6660338031481763, 'colsample_bytree': 0.6289840994691399, 'max_depth': 5, 'min_child_weight': 8, 'eta': 0.17697113150198707, 'gamma': 0.28238081162415185}. Best is trial 41 with value: -1.0632246785306183.
[I 2025-06-29 23:03:49,530] Trial 47 finished with value: -1.0919160113003417 and parameters: {'booster': 'gbtree', 'lambda': 3.221094575852761e-05, 'alpha': 3.91926469752601e-06, 'subsample': 0.7054280293669898, 'colsample_bytree': 0.544095612383553, 'max_depth': 3, 'min_child_weight': 9, 'eta': 0.06654258431598174, 'gamma': 0.5448540827417494}. Best is trial 41 with value: -1.0632246785306183.  
[I 2025-06-29 23:03:49,668] Trial 48 finished with value: -1.1050934796387744 and parameters: {'booster': 'gbtree', 'lambda': 1.0187003883319247e-06, 'alpha': 8.024330316775023e-08, 'subsample': 0.9063072763242186, 'colsample_bytree': 0.7434868893787426, 'max_depth': 7, 'min_child_weight': 10, 'eta': 0.019595850740055126, 'gamma': 0.8793636971873793}. Best is trial 41 with value: -1.0632246785306183.
[I 2025-06-29 23:03:49,762] Trial 49 finished with value: -1.1030640137157566 and parameters: {'booster': 'gbtree', 'lambda': 1.8901419127378054e-07, 'alpha': 7.180006130360828e-07, 'subsample': 0.5437638362285792, 'colsample_bytree': 0.6571557803855537, 'max_depth': 6, 'min_child_weight': 6, 'eta': 0.03950045010793748, 'gamma': 0.02064534724400082}. Best is trial 41 with value: -1.0632246785306183.
Number of finished trials:  50
Best trial:
  Value (RMSE): 1.0632
  MSE: 1.1304
  R²: 0.5225
Model saved to qt_student_score_predictor_optuna_xgb_cuda.pkl
PS D:\machile_nearning\wecode_score_prediction\dataset-hard-problem-fixed\XGBoost-QT_Threshold_35> python .\predict.py
Found 734 students without QT scores
Predictions saved to qt_score_predictions.csv
Sample predictions:
                                  student_id  predicted_qt_score
3   0134f9f410c65ad0e8c2254a7e9288670e02a183            8.818629
20  035f97702f2c01d26ab1fae8f39ea2f98a0caa3c            8.941438
40  06024da8147b5cf6105beb4c403f67cf1ff0aea1            8.366469
68  0aaebc88f6106684d6993c156104c1ef36cf94e0            8.941438
80  0bf111a9caedf02804f6991792490e63bc21058a           10.384501