PS D:\machile_nearning\wecode_score_prediction\dataset-core-extracted\XGBoost-QT> python .\train.py
[I 2025-06-22 22:27:59,555] A new study created in memory with name: no-name-2d04d73c-e1fc-4f16-adc1-89c4da659cbf
[I 2025-06-22 22:28:00,745] Trial 0 finished with value: -1.1034033322262442 and parameters: {'booster': 'gbtree', 'lambda': 1.1706848935381398e-08, 'alpha': 2.4155439089860497e-06, 'subsample': 0.8690654665250088, 'colsample_bytree': 0.8218134368733105, 'max_depth': 5, 'min_child_weight': 7, 'eta': 0.009268608174062344, 'gamma': 3.9120403505623216}. Best is trial 0 with value: -1.1034033322262442.
[I 2025-06-22 22:28:01,084] Trial 1 finished with value: -1.1296351774537674 and parameters: {'booster': 'gbtree', 'lambda': 0.0448619562551996, 'alpha': 0.027531818169750265, 'subsample': 0.7920019572517761, 'colsample_bytree': 0.8575415831460889, 'max_depth': 4, 'min_child_weight': 2, 'eta': 0.037513902656827997, 'gamma': 3.0595802615073007}. Best is trial 0 with value: -1.1034033322262442.
[I 2025-06-22 22:28:02,201] Trial 2 finished with value: -1.1880434561836124 and parameters: {'booster': 'gbtree', 'lambda': 0.0010037188575450775, 'alpha': 1.6679708496856778, 'subsample': 0.7285010113918029, 'colsample_bytree': 0.5906836851183974, 'max_depth': 8, 'min_child_weight': 8, 'eta': 0.006250765920394859, 'gamma': 3.8766613317335903}. Best is trial 0 with value: -1.1034033322262442.
[I 2025-06-22 22:30:00,047] Trial 3 finished with value: -1.3064900524897913 and parameters: {'booster': 'dart', 'lambda': 2.1273367649850052, 'alpha': 1.858385325366765e-05, 'subsample': 0.7987651924034843, 'colsample_bytree': 0.8529000754815177, 'max_depth': 9, 'min_child_weight': 6, 'eta': 0.0012400558081685383, 'gamma': 2.0586004435979053, 'rate_drop': 1.4663433674508543e-08, 'skip_drop': 0.0014140442329952149}. Best is trial 0 with value: -1.1034033322262442.
[I 2025-06-22 22:31:31,221] Trial 4 finished with value: -1.3950186818803205 and parameters: {'booster': 'dart', 'lambda': 0.0033430851667340085, 'alpha': 1.5755806252519677e-06, 'subsample': 0.8918787971609324, 'colsample_bytree': 0.5935382105961661, 'max_depth': 10, 'min_child_weight': 5, 'eta': 0.004712729402691779, 'gamma': 4.719466708639625, 'rate_drop': 0.02056085808715226, 'skip_drop': 1.0045237277379655e-07}. Best is trial 0 with value: -1.1034033322262442.
[I 2025-06-22 22:31:32,383] Trial 5 finished with value: -1.1749338604786452 and parameters: {'booster': 'gbtree', 'lambda': 5.3139505219100956e-08, 'alpha': 1.3624410706852128e-08, 'subsample': 0.5583761043382547, 'colsample_bytree': 0.8383906288450365, 'max_depth': 4, 'min_child_weight': 8, 'eta': 0.002320672635223493, 'gamma': 3.3424576640639483}. Best is trial 0 with value: -1.1034033322262442.
[I 2025-06-22 22:31:32,961] Trial 6 finished with value: -1.2617133880919893 and parameters: {'booster': 'gbtree', 'lambda': 0.007629403323886864, 'alpha': 0.0359068536397438, 'subsample': 0.8817471852416188, 'colsample_bytree': 0.5512790784709369, 'max_depth': 10, 'min_child_weight': 3, 'eta': 0.03190272729445366, 'gamma': 1.5816017854370172}. Best is trial 0 with value: -1.1034033322262442.
[I 2025-06-22 22:31:34,502] Trial 7 finished with value: -1.0939003331864403 and parameters: {'booster': 'dart', 'lambda': 2.644375093877569, 'alpha': 9.613934944143326, 'subsample': 0.6618127567434577, 'colsample_bytree': 0.6949721633697734, 'max_depth': 9, 'min_child_weight': 8, 'eta': 0.21550987761459559, 'gamma': 2.5648020209618294, 'rate_drop': 3.4796369712898495e-08, 'skip_drop': 0.0168512817622634}. Best is trial 7 with value: -1.0939003331864403.
[I 2025-06-22 22:33:06,587] Trial 8 finished with value: -1.156281068465822 and parameters: {'booster': 'dart', 'lambda': 2.6389802690562154e-07, 'alpha': 4.354517862740172e-05, 'subsample': 0.6572597393642231, 'colsample_bytree': 0.5997902005899571, 'max_depth': 8, 'min_child_weight': 7, 'eta': 0.017959367599812946, 'gamma': 3.640274463838731, 'rate_drop': 0.0001688834565533118, 'skip_drop': 4.400727078124395e-07}. Best is trial 7 with value: -1.0939003331864403.
[I 2025-06-22 22:33:06,758] Trial 9 finished with value: -1.1077132695175946 and parameters: {'booster': 'gbtree', 'lambda': 0.12652001229496118, 'alpha': 6.036700543693781, 'subsample': 0.894889705505599, 'colsample_bytree': 0.9463520654462088, 'max_depth': 6, 'min_child_weight': 7, 'eta': 0.22214929961140195, 'gamma': 4.644247343317808}. Best is trial 7 with value: -1.0939003331864403.
[I 2025-06-22 22:33:08,609] Trial 10 finished with value: -1.183885171609926 and parameters: {'booster': 'dart', 'lambda': 1.390297193367758e-05, 'alpha': 0.004858222120685684, 'subsample': 0.5024974534230684, 'colsample_bytree': 0.6990874250857595, 'max_depth': 7, 'min_child_weight': 10, 'eta': 0.2799547586359833, 'gamma': 0.5181911972521318, 'rate_drop': 1.4907235113980854e-08, 'skip_drop': 0.4689424470061591}. Best is trial 7 with value: -1.0939003331864403.
[I 2025-06-22 22:33:12,136] Trial 11 finished with value: -1.1364682796892562 and parameters: {'booster': 'dart', 'lambda': 1.3316121314613853e-05, 'alpha': 2.3054978126387232e-07, 'subsample': 0.9839464529047269, 'colsample_bytree': 0.7094989468033911, 'max_depth': 6, 'min_child_weight': 10, 'eta': 0.08283693269663317, 'gamma': 2.4473545125941474, 'rate_drop': 6.228043380083542e-06, 'skip_drop': 0.012395520261316682}. Best is trial 7 with value: -1.0939003331864403.
[I 2025-06-22 22:33:13,137] Trial 12 finished with value: -1.098203393160341 and parameters: {'booster': 'gbtree', 'lambda': 3.6069417715887315, 'alpha': 0.0005086382198166033, 'subsample': 0.6287551467872523, 'colsample_bytree': 0.7538092155563013, 'max_depth': 3, 'min_child_weight': 4, 'eta': 0.00844374463947118, 'gamma': 1.2238461147414528}. Best is trial 7 with value: -1.0939003331864403.
[I 2025-06-22 22:33:15,170] Trial 13 finished with value: -1.1315257960036589 and parameters: {'booster': 'dart', 'lambda': 6.0395866924080766, 'alpha': 0.0007638859980427213, 'subsample': 0.6379305177608385, 'colsample_bytree': 0.7543246284890825, 'max_depth': 3, 'min_child_weight': 4, 'eta': 0.12767165720319226, 'gamma': 0.8790181781142636, 'rate_drop': 6.9345461506335605e-06, 'skip_drop': 2.9454446375377802e-05}. Best is trial 7 with value: -1.0939003331864403.
[I 2025-06-22 22:33:15,711] Trial 14 finished with value: -1.1143305156371062 and parameters: {'booster': 'gbtree', 'lambda': 0.4870716110320895, 'alpha': 0.3145783263681256, 'subsample': 0.6430163678053081, 'colsample_bytree': 0.674953321172739, 'max_depth': 3, 'min_child_weight': 4, 'eta': 0.015167913212579615, 'gamma': 1.366006817392754}. Best is trial 7 with value: -1.0939003331864403.
[I 2025-06-22 22:33:20,612] Trial 15 finished with value: -1.1276164255239862 and parameters: {'booster': 'dart', 'lambda': 9.837783435046997, 'alpha': 0.0002377109523686837, 'subsample': 0.7020996183624837, 'colsample_bytree': 0.7608679504351882, 'max_depth': 8, 'min_child_weight': 1, 'eta': 0.06488049577310467, 'gamma': 0.059405569312269924, 'rate_drop': 0.4190838554720269, 'skip_drop': 0.8706632339157698}. Best is trial 7 with value: -1.0939003331864403.
[I 2025-06-22 22:33:21,978] Trial 16 finished with value: -1.1116073637320139 and parameters: {'booster': 'gbtree', 'lambda': 9.599419367902826e-05, 'alpha': 0.16979301167573674, 'subsample': 0.5929304535502609, 'colsample_bytree': 0.9517453100759776, 'max_depth': 7, 'min_child_weight': 9, 'eta': 0.003897472057870285, 'gamma': 2.737779268693673}. Best is trial 7 with value: -1.0939003331864403.
[I 2025-06-22 22:34:54,806] Trial 17 finished with value: -1.1800827835929812 and parameters: {'booster': 'dart', 'lambda': 0.3011036260601161, 'alpha': 0.0036155244242687175, 'subsample': 0.561079157197327, 'colsample_bytree': 0.6497598691657234, 'max_depth': 5, 'min_child_weight': 5, 'eta': 0.01470710189416037, 'gamma': 1.820082000888711, 'rate_drop': 9.48436624966937e-07, 'skip_drop': 4.1713128304929864e-05}. Best is trial 7 with value: -1.0939003331864403.
[I 2025-06-22 22:34:56,718] Trial 18 finished with value: -1.3132238711224111 and parameters: {'booster': 'gbtree', 'lambda': 0.029134257347449267, 'alpha': 4.283875431706134, 'subsample': 0.6923819959125703, 'colsample_bytree': 0.7882966317653824, 'max_depth': 9, 'min_child_weight': 3, 'eta': 0.0011636392366649378, 'gamma': 1.075475291035406}. Best is trial 7 with value: -1.0939003331864403.
[I 2025-06-22 22:35:06,589] Trial 19 finished with value: -1.106905320992771 and parameters: {'booster': 'dart', 'lambda': 1.511423379609315, 'alpha': 0.3773943880934471, 'subsample': 0.5007116462926144, 'colsample_bytree': 0.8965875717177625, 'max_depth': 9, 'min_child_weight': 6, 'eta': 0.036531159773605236, 'gamma': 2.19712900834403, 'rate_drop': 0.0007469590615192797, 'skip_drop': 0.009703500692080418}. Best is trial 7 with value: -1.0939003331864403.
[I 2025-06-22 22:35:08,223] Trial 20 finished with value: -1.1807977096918854 and parameters: {'booster': 'gbtree', 'lambda': 0.0005134094200965608, 'alpha': 1.0734495570932287e-08, 'subsample': 0.772808044004753, 'colsample_bytree': 0.6460580196815786, 'max_depth': 5, 'min_child_weight': 9, 'eta': 0.009533632662145653, 'gamma': 0.5785898372458461}. Best is trial 7 with value: -1.0939003331864403.
[I 2025-06-22 22:35:09,383] Trial 21 finished with value: -1.113947417450795 and parameters: {'booster': 'gbtree', 'lambda': 6.237625126880903e-07, 'alpha': 2.507382689537436e-06, 'subsample': 0.9889423536644227, 'colsample_bytree': 0.7952683367353243, 'max_depth': 4, 'min_child_weight': 7, 'eta': 0.006804768813508298, 'gamma': 4.420690569026345}. Best is trial 7 with value: -1.0939003331864403.
[I 2025-06-22 22:35:10,687] Trial 22 finished with value: -1.1714967135484027 and parameters: {'booster': 'gbtree', 'lambda': 2.3130592659886516e-05, 'alpha': 2.0323604115294868e-07, 'subsample': 0.8427512752821537, 'colsample_bytree': 0.7180746999399574, 'max_depth': 5, 'min_child_weight': 8, 'eta': 0.002425729181822368, 'gamma': 4.134817365383263}. Best is trial 7 with value: -1.0939003331864403.
[I 2025-06-22 22:35:11,325] Trial 23 finished with value: -1.1055175577532124 and parameters: {'booster': 'gbtree', 'lambda': 1.721463489793859e-06, 'alpha': 2.3425436887367223e-05, 'subsample': 0.6036779907331413, 'colsample_bytree': 0.9973058752676268, 'max_depth': 3, 'min_child_weight': 6, 'eta': 0.009727330011277558, 'gamma': 2.907377633034165}. Best is trial 7 with value: -1.0939003331864403.
[I 2025-06-22 22:35:11,764] Trial 24 finished with value: -1.1018713751719071 and parameters: {'booster': 'gbtree', 'lambda': 1.3967974224565095e-08, 'alpha': 0.00022280368326982043, 'subsample': 0.7267768653659001, 'colsample_bytree': 0.7988730458416051, 'max_depth': 6, 'min_child_weight': 4, 'eta': 0.020966531856099202, 'gamma': 3.4223209212958308}. Best is trial 7 with value: -1.0939003331864403.
[I 2025-06-22 22:35:12,003] Trial 25 finished with value: -1.1144912323844398 and parameters: {'booster': 'gbtree', 'lambda': 0.9957222362834033, 'alpha': 0.0001744142198497223, 'subsample': 0.6773440457644816, 'colsample_bytree': 0.7417983496301155, 'max_depth': 7, 'min_child_weight': 4, 'eta': 0.13682536335791123, 'gamma': 3.368875745683478}. Best is trial 7 with value: -1.0939003331864403.
[I 2025-06-22 22:35:20,202] Trial 26 finished with value: -1.1148022187787807 and parameters: {'booster': 'dart', 'lambda': 0.02121686262585719, 'alpha': 0.001222968538485775, 'subsample': 0.7183547055776597, 'colsample_bytree': 0.7836928415302128, 'max_depth': 6, 'min_child_weight': 3, 'eta': 0.02082753381459746, 'gamma': 2.478026163082359, 'rate_drop': 2.7866965987293037e-07, 'skip_drop': 0.0006740542555690353}. Best is trial 7 with value: -1.0939003331864403.
[I 2025-06-22 22:35:20,755] Trial 27 finished with value: -1.2059555729888518 and parameters: {'booster': 'gbtree', 'lambda': 0.1359067693982786, 'alpha': 0.014423507668702883, 'subsample': 0.6136810770683158, 'colsample_bytree': 0.5143974187581948, 'max_depth': 8, 'min_child_weight': 2, 'eta': 0.052855637472918555, 'gamma': 3.1564333272358946}. Best is trial 7 with value: -1.0939003331864403.
[I 2025-06-22 22:35:24,369] Trial 28 finished with value: -1.2029702361421286 and parameters: {'booster': 'dart', 'lambda': 9.309349105012993e-05, 'alpha': 9.898660326879255e-05, 'subsample': 0.751642845309875, 'colsample_bytree': 0.6635894134313344, 'max_depth': 10, 'min_child_weight': 5, 'eta': 0.1161981751696751, 'gamma': 2.0260452336868453, 'rate_drop': 0.0019471733535975171, 'skip_drop': 2.6622107661365608e-06}. Best is trial 7 with value: -1.0939003331864403.
[I 2025-06-22 22:35:24,813] Trial 29 finished with value: -1.1013879591734985 and parameters: {'booster': 'gbtree', 'lambda': 2.0531523297378106e-08, 'alpha': 2.5275319738013383e-06, 'subsample': 0.5557384579240391, 'colsample_bytree': 0.8082904585679269, 'max_depth': 4, 'min_child_weight': 4, 'eta': 0.023786568412338685, 'gamma': 2.6207219637589922}. Best is trial 7 with value: -1.0939003331864403.
[I 2025-06-22 22:35:24,999] Trial 30 finished with value: -1.1718232219393303 and parameters: {'booster': 'gbtree', 'lambda': 0.0015854651187971315, 'alpha': 5.696040974542956e-06, 'subsample': 0.5794027077098579, 'colsample_bytree': 0.8983166441622602, 'max_depth': 4, 'min_child_weight': 2, 'eta': 0.1823857654838584, 'gamma': 1.6860778160922325}. Best is trial 7 with value: -1.0939003331864403.
[I 2025-06-22 22:35:25,345] Trial 31 finished with value: -1.112121776567682 and parameters: {'booster': 'gbtree', 'lambda': 3.9876901381525535e-08, 'alpha': 4.201351967234705e-07, 'subsample': 0.5350187277968219, 'colsample_bytree': 0.737383735679468, 'max_depth': 3, 'min_child_weight': 4, 'eta': 0.024641701173757306, 'gamma': 2.4224755945713055}. Best is trial 7 with value: -1.0939003331864403.
[I 2025-06-22 22:35:25,963] Trial 32 finished with value: -1.1114611756882313 and parameters: {'booster': 'gbtree', 'lambda': 1.0991547979118575e-08, 'alpha': 0.0007878786759582321, 'subsample': 0.6599969061752677, 'colsample_bytree': 0.817366323086614, 'max_depth': 4, 'min_child_weight': 3, 'eta': 0.0118441253155138, 'gamma': 2.7877497095062473}. Best is trial 7 with value: -1.0939003331864403.
[I 2025-06-22 22:35:26,220] Trial 33 finished with value: -1.119189399903378 and parameters: {'booster': 'gbtree', 'lambda': 4.8385270170268227e-08, 'alpha': 0.0653142181689743, 'subsample': 0.6165521845110793, 'colsample_bytree': 0.8154322042752552, 'max_depth': 4, 'min_child_weight': 5, 'eta': 0.04865851580706715, 'gamma': 3.7054395160285276}. Best is trial 7 with value: -1.0939003331864403.
[I 2025-06-22 22:35:26,604] Trial 34 finished with value: -1.1249819652148125 and parameters: {'booster': 'gbtree', 'lambda': 1.6373781821913434e-07, 'alpha': 9.4e-07, 'alpha': 9.247058137438773e-06, 'subsample': 0.7536581809432986, 'colsample_bytree': 0.8541762778801003, 'max_depth': 5, 'min_child_weight': 4, 'eta': 0.029652521134885562, 'gamma': 3.1623758724349913}. Best is trial 7 with value: -1.0939003331864403.
[I 2025-06-22 22:35:27,382] Trial 35 finished with value: -1.118625510267451 and parameters: {'booster': 'gbtree', 'lambda': 4.851528461158462e-06, 'alpha': 5.540596993265507e-08, 'subsample': 0.5406368920127554, 'colsample_bytree': 0.8984707921784799, 'max_depth': 3, 'min_child_weight': 1, 'eta': 0.006414834584923075, 'gamma': 2.714689438353928}. Best is trial 7 with value: -1.0939003331864403.
[I 2025-06-22 22:35:28,623] Trial 36 finished with value: -1.1566949385172218 and parameters: {'booster': 'gbtree', 'lambda': 4.281256739302915, 'alpha': 0.8117112614248636, 'subsample': 0.8053525868672183, 'colsample_bytree': 0.7735389749977846, 'max_depth': 6, 'min_child_weight': 2, 'eta': 0.0030401924587984876, 'gamma': 2.2432778833547964}. Best is trial 7 with value: -1.0939003331864403.
[I 2025-06-22 22:35:29,735] Trial 37 finished with value: -1.215088253702719 and parameters: {'booster': 'gbtree', 'lambda': 2.1933789682397938e-08, 'alpha': 1.6241755988475624e-06, 'subsample': 0.7262863898140697, 'colsample_bytree': 0.6808189825110935, 'max_depth': 5, 'min_child_weight': 6, 'eta': 0.001766065686650414, 'gamma': 3.9732632753651487}. Best is trial 7 with value: -1.0939003331864403.
[I 2025-06-22 22:36:56,716] Trial 38 finished with value: -1.2527106980840679 and parameters: {'booster': 'dart', 'lambda': 1.3169696098475482e-07, 'alpha': 0.006535035440824585, 'subsample': 0.6780044722056597, 'colsample_bytree': 0.6157596852952533, 'max_depth': 4, 'min_child_weight': 5, 'eta': 0.004633982725412577, 'gamma': 3.516073409730119, 'rate_drop': 1.3884999025067217e-07, 'skip_drop': 0.05992249687882191}. Best is trial 7 with value: -1.0939003331864403.
[I 2025-06-22 22:36:57,060] Trial 39 finished with value: -1.1902778642484706 and parameters: {'booster': 'gbtree', 'lambda': 8.19161938878483e-07, 'alpha': 6.45646831655467e-05, 'subsample': 0.6339159273352003, 'colsample_bytree': 0.8282307199766867, 'max_depth': 7, 'min_child_weight': 3, 'eta': 0.08214779639710486, 'gamma': 1.3255214361915437}. Best is trial 7 with value: -1.0939003331864403.
[I 2025-06-22 22:38:19,978] Trial 40 finished with value: -1.0975943866888673 and parameters: {'booster': 'dart', 'lambda': 0.007460548758810375, 'alpha': 1.91122588674651, 'subsample': 0.5418047762263157, 'colsample_bytree': 0.8719318744079496, 'max_depth': 9, 'min_child_weight': 4, 'eta': 0.007509299649199092, 'gamma': 1.895023366930843, 'rate_drop': 1.1051204606061241e-05, 'skip_drop': 2.2118512503657723e-08}. Best is trial 7 with value: -1.0939003331864403.
[I 2025-06-22 22:40:12,175] Trial 41 finished with value: -1.095569412950269 and parameters: {'booster': 'dart', 'lambda': 0.008104494677057816, 'alpha': 1.8944012392681704, 'subsample': 0.5765776917412577, 'colsample_bytree': 0.8675077752958849, 'max_depth': 9, 'min_child_weight': 4, 'eta': 0.0077988319610766835, 'gamma': 1.920944161463422, 'rate_drop': 8.97314010315081e-06, 'skip_drop': 3.443621719537423e-06}. Best is trial 7 with value: -1.0939003331864403.
[I 2025-06-22 22:41:21,355] Trial 42 finished with value: -1.0953833730382985 and parameters: {'booster': 'dart', 'lambda': 0.007579155120727467, 'alpha': 2.1779827904148905, 'subsample': 0.5325482093535837, 'colsample_bytree': 0.8760280645617674, 'max_depth': 9, 'min_child_weight': 5, 'eta': 0.008258286952080827, 'gamma': 1.916416889978663, 'rate_drop': 1.4262915077945433e-05, 'skip_drop': 1.0161495573380026e-08}. Best is trial 7 with value: -1.0939003331864403.
[I 2025-06-22 22:42:39,211] Trial 43 finished with value: -1.0948349416570795 and parameters: {'booster': 'dart', 'lambda': 0.008186496931663335, 'alpha': 2.2664274911747557, 'subsample': 0.5371525706759815, 'colsample_bytree': 0.8802390369264774, 'max_depth': 9, 'min_child_weight': 6, 'eta': 0.007520999901703833, 'gamma': 1.9123586502363408, 'rate_drop': 2.5199567759590434e-05, 'skip_drop': 1.731242173230169e-08}. Best is trial 7 with value: -1.0939003331864403.
[I 2025-06-22 22:44:08,217] Trial 44 finished with value: -1.1134860567287486 and parameters: {'booster': 'dart', 'lambda': 0.006796849702130035, 'alpha': 9.988311881379794, 'subsample': 0.5205297584978825, 'colsample_bytree': 0.9474569261297934, 'max_depth': 9, 'min_child_weight': 8, 'eta': 0.005203347860608246, 'gamma': 1.931442314446355, 'rate_drop': 1.325786015669503e-05, 'skip_drop': 1.4624351517145903e-08}. Best is trial 7 with value: -1.0939003331864403.
[I 2025-06-22 22:45:32,343] Trial 45 finished with value: -1.0989112107848389 and parameters: {'booster': 'dart', 'lambda': 0.0032520543422950346, 'alpha': 1.7329622687853892, 'subsample': 0.5718912044719463, 'colsample_bytree': 0.8732069371914113, 'max_depth': 9, 'min_child_weight': 6, 'eta': 0.00790380607826992, 'gamma': 1.5771700381680713, 'rate_drop': 3.5197244756162056e-05, 'skip_drop': 1.3771740052189244e-08}. Best is trial 7 with value: -1.0939003331864403.
[I 2025-06-22 22:46:20,175] Trial 46 finished with value: -1.0883567455406316 and parameters: {'booster': 'dart', 'lambda': 0.052410171845159725, 'alpha': 2.1859528235484516, 'subsample': 0.5228034289222238, 'colsample_bytree': 0.8828496345560961, 'max_depth': 10, 'min_child_weight': 7, 'eta': 0.011378233509754998, 'gamma': 2.2623960179860685, 'rate_drop': 1.815329693391232e-06, 'skip_drop': 9.508209321483367e-08}. Best is trial 46 with value: -1.0883567455406316.
[I 2025-06-22 22:47:03,856] Trial 47 finished with value: -1.095732282510547 and parameters: {'booster': 'dart', 'lambda': 0.05381062761102143, 'alpha': 3.291146655024689, 'subsample': 0.5868043327648416, 'colsample_bytree': 0.9339106351297489, 'max_depth': 10, 'min_child_weight': 7, 'eta': 0.0126683053290634, 'gamma': 2.299708594979679, 'rate_drop': 1.1006629247519932e-06, 'skip_drop': 4.285444982819507e-07}. Best is trial 46 with value: -1.0883567455406316.
[I 2025-06-22 22:48:31,501] Trial 48 finished with value: -1.1245565163266977 and parameters: {'booster': 'dart', 'lambda': 0.07093383242463619, 'alpha': 0.7758942828756714, 'subsample': 0.5141600887711565, 'colsample_bytree': 0.9199119154438619, 'max_depth': 10, 'min_child_weight': 9, 'eta': 0.003348950239717025, 'gamma': 1.4915579795361942, 'rate_drop': 0.00012586066577333183, 'skip_drop': 1.3699973579019986e-07}. Best is trial 46 with value: -1.0883567455406316.
[I 2025-06-22 22:49:06,610] Trial 49 finished with value: -1.109479464586769 and parameters: {'booster': 'dart', 'lambda': 0.013989193491875534, 'alpha': 0.09949485517669442, 'subsample': 0.5578454992432959, 'colsample_bytree': 0.9824032577772424, 'max_depth': 8, 'min_child_weight': 7, 'eta': 0.011268767733439926, 'gamma': 1.7295588812585405, 'rate_drop': 1.494962716857055e-06, 'skip_drop': 4.612192945798541e-06}. Best is trial 46 with value: -1.0883567455406316.
Number of finished trials:  50
Best trial:
  Value (RMSE): 1.0884
  MSE: 1.1845
  R²: 0.4997
Model saved to qt_student_score_predictor_optuna_xgb_cuda.pkl