PS D:\machile_nearning\wecode_score_prediction\dataset-core-extracted\XGBoost-CK-Without-Class-Size> python .\train.py        
[I 2025-06-27 20:14:59,341] A new study created in memory with name: no-name-3e47c6c6-7908-4f8e-b05b-180bedc96004
[I 2025-06-27 20:14:59,611] Trial 0 finished with value: -1.6489715569649857 and parameters: {'booster': 'dart', 'lambda': 0.07036419574650114, 'alpha': 4.877774176591544, 'subsample': 0.819903116599606, 'colsample_bytree': 0.8266025814901485, 'max_depth': 3, 'min_child_weight': 5, 'eta': 0.18775082934406415, 'gamma': 1.5450568949384373, 'rate_drop': 0.03956825085310019, 'skip_drop': 9.117660550560143e-06}. Best is trial 0 with value: -1.6489715569649857.
[I 2025-06-27 20:14:59,742] Trial 1 finished with value: -1.620949087073675 and parameters: {'booster': 'gbtree', 'lambda': 0.0013644851173792783, 'alpha': 4.942058639307532e-07, 'subsample': 0.9733902948909372, 'colsample_bytree': 0.5658985892561296, 'max_depth': 4, 'min_child_weight': 9, 'eta': 0.011496791029093768, 'gamma': 2.7979541434067667}. Best is trial 1 with value: -1.620949087073675.
[I 2025-06-27 20:15:02,789] Trial 2 finished with value: -1.6349941608778629 and parameters: {'booster': 'dart', 'lambda': 0.024535614250753658, 'alpha': 0.009325159892562355, 'subsample': 0.7429086664360991, 'colsample_bytree': 0.9771959418133863, 'max_depth': 6, 'min_child_weight': 7, 'eta': 0.0064828657962907104, 'gamma': 1.3521847687957584, 'rate_drop': 1.6315436215505204e-08, 'skip_drop': 2.419045103409529e-07}. Best is trial 1 with value: -1.620949087073675.
[I 2025-06-27 20:15:02,985] Trial 3 finished with value: -1.6405504324444453 and parameters: {'booster': 'gbtree', 'lambda': 8.4268320501668e-07, 'alpha': 9.47028689600985e-06, 'subsample': 0.8037611561951037, 'colsample_bytree': 0.637993872188558, 'max_depth': 10, 'min_child_weight': 9, 'eta': 0.011998149684640953, 'gamma': 2.7981932348922083}. Best is trial 1 with value: -1.620949087073675.
[I 2025-06-27 20:15:03,136] Trial 4 finished with value: -1.6338953095658795 and parameters: {'booster': 'gbtree', 'lambda': 0.02973181862318309, 'alpha': 6.073219200645133e-08, 'subsample': 0.9650813262760514, 'colsample_bytree': 0.6640918868883231, 'max_depth': 9, 'min_child_weight': 7, 'eta': 0.02081210247824416, 'gamma': 1.0382070024070889}. Best is trial 1 with value: -1.620949087073675.
[I 2025-06-27 20:15:03,231] Trial 5 finished with value: -1.6272578908949202 and parameters: {'booster': 'gbtree', 'lambda': 1.6585466199314927, 'alpha': 0.35828918359001755, 'subsample': 0.8788258535850255, 'colsample_bytree': 0.5286455119761089, 'max_depth': 3, 'min_child_weight': 7, 'eta': 0.04382716389453567, 'gamma': 2.5774810536075012}. Best is trial 1 with value: -1.620949087073675.
[I 2025-06-27 20:15:04,389] Trial 6 finished with value: -1.6464151842132344 and parameters: {'booster': 'dart', 'lambda': 0.03553775588506569, 'alpha': 0.5942120628755998, 'subsample': 0.8171842410237822, 'colsample_bytree': 0.7257861478126582, 'max_depth': 10, 'min_child_weight': 3, 'eta': 0.020438853628356932, 'gamma': 3.262516580497661, 'rate_drop': 2.433023990373346e-06, 'skip_drop': 4.289393365468391e-06}. Best is trial 1 with value: -1.620949087073675.
[I 2025-06-27 20:15:04,512] Trial 7 finished with value: -1.6767570688771398 and parameters: {'booster': 'gbtree', 'lambda': 3.0283296029255373, 'alpha': 2.8352449180925123e-07, 'subsample': 0.8339581764860572, 'colsample_bytree': 0.685019179108759, 'max_depth': 9, 'min_child_weight': 4, 'eta': 0.027381793623131975, 'gamma': 0.7082570899736862}. Best is trial 1 with value: -1.620949087073675.
[I 2025-06-27 20:15:04,551] Trial 8 finished with value: -1.7984563073685302 and parameters: {'booster': 'gbtree', 'lambda': 9.421003385042953e-06, 'alpha': 1.2358939786495775e-07, 'subsample': 0.5162735202715966, 'colsample_bytree': 0.5975084100517727, 'max_depth': 7, 'min_child_weight': 2, 'eta': 0.185573792221512, 'gamma': 3.172214650970928}. Best is trial 1 with value: -1.620949087073675.
[I 2025-06-27 20:15:04,584] Trial 9 finished with value: -1.7256771830769175 and parameters: {'booster': 'gbtree', 'lambda': 1.3666985421466273e-06, 'alpha': 3.938035298992828e-05, 'subsample': 0.851852546195548, 'colsample_bytree': 0.5133951208252396, 'max_depth': 8, 'min_child_weight': 10, 'eta': 0.2847160648649734, 'gamma': 2.831420831280926}. Best is trial 1 with value: -1.620949087073675.
[I 2025-06-27 20:15:13,618] Trial 10 finished with value: -1.7623899225106492 and parameters: {'booster': 'dart', 'lambda': 0.00040445914704927025, 'alpha': 0.0013416503278400897, 'subsample': 0.6378521236383125, 'colsample_bytree': 0.8314352074229043, 'max_depth': 5, 'min_child_weight': 9, 'eta': 0.001178336260628587, 'gamma': 4.752943509882752, 'rate_drop': 0.43373208318929785, 'skip_drop': 0.9654719574657246}. Best is trial 1 with value: -1.620949087073675.
[I 2025-06-27 20:15:13,779] Trial 11 finished with value: -1.6258049258433074 and parameters: {'booster': 'gbtree', 'lambda': 1.2221746985987485e-08, 'alpha': 0.027556330314132745, 'subsample': 0.9884306172626354, 'colsample_bytree': 0.5181664715364384, 'max_depth': 3, 'min_child_weight': 7, 'eta': 0.04516546021282769, 'gamma': 4.09722406723785}. Best is trial 1 with value: -1.620949087073675.
[I 2025-06-27 20:15:14,095] Trial 12 finished with value: -1.6424503799883956 and parameters: {'booster': 'gbtree', 'lambda': 3.646950731616985e-08, 'alpha': 0.021856930709705454, 'subsample': 0.9939385450234138, 'colsample_bytree': 0.504991671970279, 'max_depth': 4, 'min_child_weight': 8, 'eta': 0.0038606840377182075, 'gamma': 4.217235061327479}. Best is trial 1 with value: -1.620949087073675.
[I 2025-06-27 20:15:14,175] Trial 13 finished with value: -1.6443242955050346 and parameters: {'booster': 'gbtree', 'lambda': 7.69792805222855e-05, 'alpha': 5.594106659605409e-06, 'subsample': 0.9307111164509997, 'colsample_bytree': 0.5829562555833283, 'max_depth': 5, 'min_child_weight': 6, 'eta': 0.06803151762692716, 'gamma': 3.8778521021919503}. Best is trial 1 with value: -1.620949087073675.
[I 2025-06-27 20:15:14,254] Trial 14 finished with value: -1.6615268463054529 and parameters: {'booster': 'gbtree', 'lambda': 1.1194874988249292e-08, 'alpha': 0.0007795170736795477, 'subsample': 0.923007453783512, 'colsample_bytree': 0.5772954989493225, 'max_depth': 4, 'min_child_weight': 10, 'eta': 0.07874454095169785, 'gamma': 1.9649272361858066}. Best is trial 1 with value: -1.620949087073675.
[I 2025-06-27 20:15:14,553] Trial 15 finished with value: -1.6025869573017344 and parameters: {'booster': 'gbtree', 'lambda': 0.0005903070232922025, 'alpha': 1.182480765376261e-06, 'subsample': 0.6861519114706628, 'colsample_bytree': 0.7865325180877818, 'max_depth': 4, 'min_child_weight': 5, 'eta': 0.0050051845400406044, 'gamma': 3.927997529414632}. Best is trial 15 with value: -1.6025869573017344.
[I 2025-06-27 20:15:14,945] Trial 16 finished with value: -1.6809384218299175 and parameters: {'booster': 'gbtree', 'lambda': 0.001056700188124214, 'alpha': 1.1376195116673305e-06, 'subsample': 0.6967627910492411, 'colsample_bytree': 0.8079005619994793, 'max_depth': 6, 'min_child_weight': 1, 'eta': 0.002543491980181086, 'gamma': 0.014228990278537967}. Best is trial 15 with value: -1.6025869573017344.
[I 2025-06-27 20:15:15,123] Trial 17 finished with value: -1.6181437635916986 and parameters: {'booster': 'gbtree', 'lambda': 0.002521762383782449, 'alpha': 1.4241288470971055e-08, 'subsample': 0.6130565982043584, 'colsample_bytree': 0.9083122221933949, 'max_depth': 5, 'min_child_weight': 5, 'eta': 0.009504362383948445, 'gamma': 4.914598884554796}. Best is trial 15 with value: -1.6025869573017344.
[I 2025-06-27 20:15:26,783] Trial 18 finished with value: -1.6240210074522008 and parameters: {'booster': 'dart', 'lambda': 4.344989195235058e-05, 'alpha': 1.2459572071911631e-08, 'subsample': 0.5899170657052513, 'colsample_bytree': 0.9455709391833572, 'max_depth': 7, 'min_child_weight': 5, 'eta': 0.004405230610185781, 'gamma': 4.963294723849604, 'rate_drop': 0.0005563698022031567, 'skip_drop': 0.03230641677703663}. Best is trial 15 with value: -1.6025869573017344.
[I 2025-06-27 20:15:27,280] Trial 19 finished with value: -1.6960413076379781 and parameters: {'booster': 'gbtree', 'lambda': 0.005392063811387637, 'alpha': 1.3451404930493376e-08, 'subsample': 0.6357227563217949, 'colsample_bytree': 0.8853125540756668, 'max_depth': 5, 'min_child_weight': 4, 'eta': 0.0015826500485546823, 'gamma': 4.49854801258759}. Best is trial 15 with value: -1.6025869573017344.
[I 2025-06-27 20:15:27,640] Trial 20 finished with value: -1.6315836651002307 and parameters: {'booster': 'gbtree', 'lambda': 0.4047186436201068, 'alpha': 3.127439702176451e-05, 'subsample': 0.5178963825093521, 'colsample_bytree': 0.9091893349272386, 'max_depth': 6, 'min_child_weight': 3, 'eta': 0.006806362987346121, 'gamma': 3.7380193813381233}. Best is trial 15 with value: -1.6025869573017344.
[I 2025-06-27 20:15:27,912] Trial 21 finished with value: -1.607198558343566 and parameters: {'booster': 'gbtree', 'lambda': 0.002882216119651898, 'alpha': 1.5989077793157046e-06, 'subsample': 0.7407919688065877, 'colsample_bytree': 0.7691268305472724, 'max_depth': 4, 'min_child_weight': 6, 'eta': 0.01054531936565685, 'gamma': 3.4624079602435147}. Best is trial 15 with value: -1.6025869573017344.
[I 2025-06-27 20:15:28,092] Trial 22 finished with value: -1.6081683810680372 and parameters: {'booster': 'gbtree', 'lambda': 0.004104288816319693, 'alpha': 2.2481085922398725e-06, 'subsample': 0.7090185714953177, 'colsample_bytree': 0.759215057886343, 'max_depth': 4, 'min_child_weight': 6, 'eta': 0.009919257212149929, 'gamma': 3.7312105533961724}. Best is trial 15 with value: -1.6025869573017344.
[I 2025-06-27 20:15:28,361] Trial 23 finished with value: -1.6463575018562886 and parameters: {'booster': 'gbtree', 'lambda': 0.0001354642620200351, 'alpha': 0.0001469493545099832, 'subsample': 0.7074205720162603, 'colsample_bytree': 0.7680095729662039, 'max_depth': 4, 'min_child_weight': 6, 'eta': 0.0026758982916173764, 'gamma': 3.555633262889766}. Best is trial 15 with value: -1.6025869573017344.
[I 2025-06-27 20:15:28,624] Trial 24 finished with value: -1.6293892431048143 and parameters: {'booster': 'gbtree', 'lambda': 0.006965884430215402, 'alpha': 1.5215525508546207e-06, 'subsample': 0.7483511701739203, 'colsample_bytree': 0.7534004566191013, 'max_depth': 3, 'min_child_weight': 4, 'eta': 0.005703568412471262, 'gamma': 3.3519205884311}. Best is trial 15 with value: -1.6025869573017344.
[I 2025-06-27 20:15:28,796] Trial 25 finished with value: -1.6131672705251021 and parameters: {'booster': 'gbtree', 'lambda': 0.26808193545543885, 'alpha': 3.574630970797641e-06, 'subsample': 0.6908099479772958, 'colsample_bytree': 0.7179792869486905, 'max_depth': 4, 'min_child_weight': 6, 'eta': 0.012670339556442284, 'gamma': 2.173755469855082}. Best is trial 15 with value: -1.6025869573017344.
[I 2025-06-27 20:15:38,763] Trial 26 finished with value: -1.6261448072853386 and parameters: {'booster': 'dart', 'lambda': 1.025523132906195e-05, 'alpha': 2.1500473042236815e-05, 'subsample': 0.7866860572388626, 'colsample_bytree': 0.7856217488439802, 'max_depth': 5, 'min_child_weight': 8, 'eta': 0.0032149707692467546, 'gamma': 4.327398248235776, 'rate_drop': 2.123481582707802e-08, 'skip_drop': 0.0015373320535688394}. Best is trial 15 with value: -1.6025869573017344.
[I 2025-06-27 20:15:39,064] Trial 27 finished with value: -1.6139214083039242 and parameters: {'booster': 'gbtree', 'lambda': 0.00040058433025772557, 'alpha': 0.00011393909144653304, 'subsample': 0.6661431985766386, 'colsample_bytree': 0.8508945235691658, 'max_depth': 4, 'min_child_weight': 6, 'eta': 0.008425496567376015, 'gamma': 3.8381556668221055}. Best is trial 15 with value: -1.6025869573017344.
[I 2025-06-27 20:15:39,224] Trial 28 finished with value: -1.6157423171125467 and parameters: {'booster': 'gbtree', 'lambda': 0.010032558937561505, 'alpha': 7.432781451330796e-08, 'subsample': 0.5754338466789872, 'colsample_bytree': 0.7134219186175738, 'max_depth': 3, 'min_child_weight': 5, 'eta': 0.015705502691635707, 'gamma': 3.1483739992104742}. Best is trial 15 with value: -1.6025869573017344.
[I 2025-06-27 20:15:48,199] Trial 29 finished with value: -1.744204161647654 and parameters: {'booster': 'dart', 'lambda': 0.1706853019779126, 'alpha': 1.5143025688277573e-06, 'subsample': 0.7786790207957607, 'colsample_bytree': 0.79636958283863, 'max_depth': 3, 'min_child_weight': 3, 'eta': 0.001797919524440842, 'gamma': 2.292497480522444, 'rate_drop': 3.882515629593294e-05, 'skip_drop': 1.2770553067564095e-08}. Best is trial 15 with value: -1.6025869573017344.
[I 2025-06-27 20:15:48,311] Trial 30 finished with value: -1.6550906345039107 and parameters: {'booster': 'gbtree', 'lambda': 0.0008014643201422063, 'alpha': 2.810684176403748e-07, 'subsample': 0.7304717049409375, 'colsample_bytree': 0.8343379322579982, 'max_depth': 6, 'min_child_weight': 4, 'eta': 0.03133610579669469, 'gamma': 4.526535615452528}. Best is trial 15 with value: -1.6025869573017344.
[I 2025-06-27 20:15:48,454] Trial 31 finished with value: -1.6128522956185707 and parameters: {'booster': 'gbtree', 'lambda': 0.22630804818763575, 'alpha': 5.267856452368437e-06, 'subsample': 0.6898081807509859, 'colsample_bytree': 0.7184418961281571, 'max_depth': 4, 'min_child_weight': 6, 'eta': 0.013809137382574737, 'gamma': 3.573871819856719}. Best is trial 15 with value: -1.6025869573017344.
[I 2025-06-27 20:15:48,693] Trial 32 finished with value: -1.637845038023244 and parameters: {'booster': 'gbtree', 'lambda': 8.124683047349393, 'alpha': 6.596310082205309e-06, 'subsample': 0.6687569679768299, 'colsample_bytree': 0.743163733189534, 'max_depth': 4, 'min_child_weight': 5, 'eta': 0.005443997684293374, 'gamma': 3.649036643199403}. Best is trial 15 with value: -1.6025869573017344.
[I 2025-06-27 20:15:48,913] Trial 33 finished with value: -1.6127957472792998 and parameters: {'booster': 'gbtree', 'lambda': 0.07163440769259728, 'alpha': 8.564954601441957e-07, 'subsample': 0.719202571059548, 'colsample_bytree': 0.6875728832968078, 'max_depth': 5, 'min_child_weight': 8, 'eta': 0.008409121309593813, 'gamma': 4.0297671812342095}. Best is trial 15 with value: -1.6025869573017344.
[I 2025-06-27 20:15:49,102] Trial 34 finished with value: -1.6151715403055698 and parameters: {'booster': 'gbtree', 'lambda': 0.07543117819019236, 'alpha': 7.53403093972356e-07, 'subsample': 0.7663140445087966, 'colsample_bytree': 0.6490196362299031, 'max_depth': 5, 'min_child_weight': 8, 'eta': 0.01028869463262154, 'gamma': 4.0452695186343846}. Best is trial 15 with value: -1.6025869573017344.
[I 2025-06-27 20:15:49,430] Trial 35 finished with value: -1.6196680880900993 and parameters: {'booster': 'gbtree', 'lambda': 0.011637151159892976, 'alpha': 2.2934653801021507e-07, 'subsample': 0.7254847453176176, 'colsample_bytree': 0.6884748631513896, 'max_depth': 5, 'min_child_weight': 8, 'eta': 0.0069673039670682824, 'gamma': 2.9629934722574927}. Best is trial 15 with value: -1.6025869573017344.
[I 2025-06-27 20:15:49,586] Trial 36 finished with value: -1.6140577966852112 and parameters: {'booster': 'gbtree', 'lambda': 0.0021711877775432956, 'alpha': 6.061878119694028e-08, 'subsample': 0.755908393761412, 'colsample_bytree': 0.6183617215334787, 'max_depth': 3, 'min_child_weight': 7, 'eta': 0.018172205288793687, 'gamma': 4.405057953235476}. Best is trial 15 with value: -1.6025869573017344.
[I 2025-06-27 20:15:58,885] Trial 37 finished with value: -1.6190195268227738 and parameters: {'booster': 'dart', 'lambda': 0.041478282054006436, 'alpha': 1.8170773396303486e-06, 'subsample': 0.6584848596340303, 'colsample_bytree': 0.8635395167864603, 'max_depth': 6, 'min_child_weight': 7, 'eta': 0.004590683445835091, 'gamma': 2.5392371278759014, 'rate_drop': 0.00265631535693895, 'skip_drop': 0.001282863745805846}. Best is trial 15 with value: -1.6025869573017344.
[I 2025-06-27 20:15:59,253] Trial 38 finished with value: -1.6071966011948433 and parameters: {'booster': 'gbtree', 'lambda': 0.7181667823977612, 'alpha': 4.847569075790048e-07, 'subsample': 0.7217864207639635, 'colsample_bytree': 0.6816118706543296, 'max_depth': 4, 'min_child_weight': 9, 'eta': 0.008441627035756056, 'gamma': 4.048768252646885}. Best is trial 15 with value: -1.6025869573017344.
[I 2025-06-27 20:15:59,413] Trial 39 finished with value: -1.6248055024650145 and parameters: {'booster': 'gbtree', 'lambda': 0.8335361496424483, 'alpha': 4.517980498112861, 'subsample': 0.7903397163051278, 'colsample_bytree': 0.7720485928035812, 'max_depth': 3, 'min_child_weight': 9, 'eta': 0.024912261812046366, 'gamma': 3.4391697995408674}. Best is trial 15 with value: -1.6025869573017344.
[I 2025-06-27 20:15:59,524] Trial 40 finished with value: -1.6159055481008824 and parameters: {'booster': 'gbtree', 'lambda': 2.438439140317619e-05, 'alpha': 2.184241817318964e-05, 'subsample': 0.8151471085342882, 'colsample_bytree': 0.8055597444424158, 'max_depth': 4, 'min_child_weight': 5, 'eta': 0.0359350848765461, 'gamma': 4.616961259447463}. Best is trial 15 with value: -1.6025869573017344.
[I 2025-06-27 20:15:59,782] Trial 41 finished with value: -1.6049206227284014 and parameters: {'booster': 'gbtree', 'lambda': 0.07516243021400976, 'alpha': 4.421951078112401e-08, 'subsample': 0.717300423705126, 'colsample_bytree': 0.6814715441938232, 'max_depth': 4, 'min_child_weight': 10, 'eta': 0.008278082914947518, 'gamma': 3.983172071123262}. Best is trial 15 with value: -1.6025869573017344.
[I 2025-06-27 20:16:00,020] Trial 42 finished with value: -1.606228978631662 and parameters: {'booster': 'gbtree', 'lambda': 0.017590052702905177, 'alpha': 3.911559169767036e-08, 'subsample': 0.7454936812310169, 'colsample_bytree': 0.6572363309233962, 'max_depth': 4, 'min_child_weight': 10, 'eta': 0.0075415565276600776, 'gamma': 3.8766904896496484}. Best is trial 15 with value: -1.6025869573017344.
[I 2025-06-27 20:16:00,276] Trial 43 finished with value: -1.609881273885509 and parameters: {'booster': 'gbtree', 'lambda': 0.016223295164098976, 'alpha': 3.552955221324662e-08, 'subsample': 0.7475852964703384, 'colsample_bytree': 0.6229965286608288, 'max_depth': 4, 'min_child_weight': 10, 'eta': 0.007231306150075949, 'gamma': 3.089258969293332}. Best is trial 15 with value: -1.6025869573017344.
[I 2025-06-27 20:16:00,509] Trial 44 finished with value: -1.621261063893845 and parameters: {'booster': 'gbtree', 'lambda': 1.8963877315687039, 'alpha': 1.6215565189500483e-07, 'subsample': 0.8569969915097597, 'colsample_bytree': 0.6667794831050442, 'max_depth': 3, 'min_child_weight': 9, 'eta': 0.012343201876615391, 'gamma': 4.232889063037421}. Best is trial 15 with value: -1.6025869573017344.
[I 2025-06-27 20:16:00,764] Trial 45 finished with value: -1.6383957125996471 and parameters: {'booster': 'gbtree', 'lambda': 0.8487788432597703, 'alpha': 3.3887735423996626e-08, 'subsample': 0.6795793284072522, 'colsample_bytree': 0.5508774102612003, 'max_depth': 4, 'min_child_weight': 10, 'eta': 0.0037547821425197823, 'gamma': 4.001094469088037}. Best is trial 15 with value: -1.6025869573017344.
[I 2025-06-27 20:16:09,116] Trial 46 finished with value: -1.6220121045678235 and parameters: {'booster': 'dart', 'lambda': 0.00019960093177399807, 'alpha': 5.128135070942062e-07, 'subsample': 0.6434809524150089, 'colsample_bytree': 0.6673955813136655, 'max_depth': 3, 'min_child_weight': 9, 'eta': 0.004972621299126752, 'gamma': 3.3338124571443823, 'rate_drop': 1.4331293411444116e-06, 'skip_drop': 0.4295075947796162}. Best is trial 15 with value: -1.6025869573017344.
[I 2025-06-27 20:16:09,300] Trial 47 finished with value: -1.6386509499863533 and parameters: {'booster': 'gbtree', 'lambda': 0.08313827381359477, 'alpha': 3.806548550113631e-08, 'subsample': 0.7346884806353012, 'colsample_bytree': 0.7037176174079341, 'max_depth': 7, 'min_child_weight': 10, 'eta': 0.020699611325653785, 'gamma': 2.838446802418917}. Best is trial 15 with value: -1.6025869573017344.
[I 2025-06-27 20:16:09,990] Trial 48 finished with value: -1.6431379399825337 and parameters: {'booster': 'gbtree', 'lambda': 0.025380606469325603, 'alpha': 8.728742255280878e-08, 'subsample': 0.7984474840946935, 'colsample_bytree': 0.6414875627272498, 'max_depth': 8, 'min_child_weight': 9, 'eta': 0.002826613015065722, 'gamma': 4.725156261674135}. Best is trial 15 with value: -1.6025869573017344.
[I 2025-06-27 20:16:10,476] Trial 49 finished with value: -1.6920412347946987 and parameters: {'booster': 'gbtree', 'lambda': 0.000969334463958168, 'alpha': 4.085626566636693e-07, 'subsample': 0.8361758730803779, 'colsample_bytree': 0.736318770145722, 'max_depth': 5, 'min_child_weight': 10, 'eta': 0.0019485682314064137, 'gamma': 4.229157034052575}. Best is trial 15 with value: -1.6025869573017344.
Number of finished trials:  50
Best trial:
  Value (RMSE): 1.6026
  MSE: 2.5683
  R²: 0.3663
Model saved to ck_student_score_predictor_optuna_xgb.pkl