PS D:\machile_nearning\wecode_score_prediction\dataset-hard-problem-fixed\XGBoost-CK-No-Rates> python .\train.py  
[I 2025-06-29 21:46:49,318] A new study created in memory with name: no-name-7aa7026e-df16-454f-8753-6cb197451c0a
[I 2025-06-29 21:46:49,471] Trial 0 finished with value: -1.7394446992706276 and parameters: {'booster': 'gbtree', 'lambda': 1.0228190381352014e-07, 'alpha': 1.845840680255898e-07, 'subsample': 0.9906829224216358, 'colsample_bytree': 0.5569473774516533, 'max_depth': 6, 'min_child_weight': 5, 'eta': 0.07377377825608361, 'gamma': 0.15479971177484897}. Best is trial 0 with value: -1.7394446992706276.
[I 2025-06-29 21:46:49,534] Trial 1 finished with value: -1.7549981751093968 and parameters: {'booster': 'gbtree', 'lambda': 0.5008477642304916, 'alpha': 1.1697385520334573e-06, 'subsample': 0.8597558195135664, 'colsample_bytree': 0.5854405263845325, 'max_depth': 7, 'min_child_weight': 6, 'eta': 0.1318208701670051, 'gamma': 3.2778814467051114}. Best is trial 0 with value: -1.7394446992706276.
[I 2025-06-29 21:46:49,570] Trial 2 finished with value: -1.7537786861231337 and parameters: {'booster': 'gbtree', 'lambda': 0.26240273209603937, 'alpha': 0.00017150560981014318, 'subsample': 0.5675506710046607, 'colsample_bytree': 0.9725058145822362, 'max_depth': 4, 'min_child_weight': 6, 'eta': 0.1392569872653571, 'gamma': 4.353971912784848}. Best is trial 0 with value: -1.7394446992706276.
[I 2025-06-29 21:46:49,599] Trial 3 finished with value: -1.7704982074769935 and parameters: {'booster': 'gbtree', 'lambda': 1.0604433059240552, 'alpha': 9.201515221895157e-08, 'subsample': 0.9536087989211934, 'colsample_bytree': 0.6760096840252817, 'max_depth': 8, 'min_child_weight': 4, 'eta': 0.15304640372549594, 'gamma': 3.556900415276405}. Best is trial 0 with value: -1.7394446992706276.
[I 2025-06-29 21:46:57,410] Trial 4 finished with value: -1.772552835407418 and parameters: {'booster': 'dart', 'lambda': 0.00011160469771727794, 'alpha': 4.0929969111807954e-05, 'subsample': 0.5659854751597964, 'colsample_bytree': 0.6948183853472842, 'max_depth': 6, 'min_child_weight': 8, 'eta': 0.0013997663122635212, 'gamma': 1.9940856014427244, 'rate_drop': 8.840035694254252e-06, 'skip_drop': 0.09609336568369771}. Best is trial 0 with value: -1.7394446992706276.
[I 2025-06-29 21:46:57,452] Trial 5 finished with value: -1.7265935204167635 and parameters: {'booster': 'gbtree', 'lambda': 6.942677763094252e-05, 'alpha': 0.5817948249143915, 'subsample': 0.860615467118071, 'colsample_bytree': 0.9996477157446466, 'max_depth': 4, 'min_child_weight': 7, 'eta': 0.056880740546155106, 'gamma': 3.3549264168111477}. Best is trial 5 with value: -1.7265935204167635.
[I 2025-06-29 21:46:57,661] Trial 6 finished with value: -1.7188581008964814 and parameters: {'booster': 'dart', 'lambda': 0.8223425074221106, 'alpha': 3.5734353200768566e-05, 'subsample': 0.8504026877946987, 'colsample_bytree': 0.9331134439299407, 'max_depth': 5, 'min_child_weight': 10, 'eta': 0.07104259371434912, 'gamma': 4.89852623130079, 'rate_drop': 0.022329185615982468, 'skip_drop': 0.03993322253592556}. Best is trial 6 with value: -1.7188581008964814.
[I 2025-06-29 21:47:06,130] Trial 7 finished with value: -1.7685380238324027 and parameters: {'booster': 'dart', 'lambda': 8.46137313188396, 'alpha': 1.8497529854429215e-05, 'subsample': 0.6786887672014624, 'colsample_bytree': 0.9890570728450083, 'max_depth': 6, 'min_child_weight': 5, 'eta': 0.0018620331371134013, 'gamma': 3.9450954704709713, 'rate_drop': 0.00018099050231216377, 'skip_drop': 0.030870560209917384}. Best is trial 6 with value: -1.7188581008964814.
[I 2025-06-29 21:47:12,791] Trial 8 finished with value: -1.828085437689131 and parameters: {'booster': 'dart', 'lambda': 0.00014782082318040267, 'alpha': 0.0006450868385819719, 'subsample': 0.942498826800023, 'colsample_bytree': 0.5047170598358254, 'max_depth': 7, 'min_child_weight': 1, 'eta': 0.0382752937327408, 'gamma': 1.760033626299996, 'rate_drop': 0.3860203791865774, 'skip_drop': 0.00011450440130292875}. Best is trial 6 with value: -1.7188581008964814.
[I 2025-06-29 21:47:21,058] Trial 9 finished with value: -1.8410650958366677 and parameters: {'booster': 'dart', 'lambda': 0.00027648114780651033, 'alpha': 9.523743521207049e-07, 'subsample': 0.7385738409927671, 'colsample_bytree': 0.7479523862382145, 'max_depth': 3, 'min_child_weight': 3, 'eta': 0.0012118968079964938, 'gamma': 4.526375119599307, 'rate_drop': 1.1998067468048449e-05, 'skip_drop': 0.041980954785606324}. Best is trial 6 with value: -1.7188581008964814.
[I 2025-06-29 21:47:28,950] Trial 10 finished with value: -1.8213326434711468 and parameters: {'booster': 'dart', 'lambda': 0.007246038928963397, 'alpha': 0.020938918362031853, 'subsample': 0.8257627641998209, 'colsample_bytree': 0.8785646126006803, 'max_depth': 10, 'min_child_weight': 10, 'eta': 0.008414025424634784, 'gamma': 4.870448865872225, 'rate_drop': 0.1173693760540202, 'skip_drop': 1.410420318863719e-08}. Best is trial 6 with value: -1.7188581008964814.
[I 2025-06-29 21:47:29,063] Trial 11 finished with value: -1.6995640630619235 and parameters: {'booster': 'gbtree', 'lambda': 4.911721696013009e-07, 'alpha': 6.2352539017637865, 'subsample': 0.831851957235616, 'colsample_bytree': 0.8678515000632281, 'max_depth': 4, 'min_child_weight': 10, 'eta': 0.02105396730134962, 'gamma': 2.8169900639027925}. Best is trial 11 with value: -1.6995640630619235.
[I 2025-06-29 21:47:31,129] Trial 12 finished with value: -1.7064851157980185 and parameters: {'booster': 'dart', 'lambda': 1.5119389388556054e-07, 'alpha': 5.445116911783935, 'subsample': 0.7669781438710229, 'colsample_bytree': 0.864453859294849, 'max_depth': 4, 'min_child_weight': 10, 'eta': 0.014050004139676026, 'gamma': 0.924619291431662, 'rate_drop': 2.836874433509703e-08, 'skip_drop': 0.00011501454277031777}. Best is trial 11 with value: -1.6995640630619235.
[I 2025-06-29 21:47:31,305] Trial 13 finished with value: -1.6928838510643178 and parameters: {'booster': 'gbtree', 'lambda': 1.0664835535939951e-07, 'alpha': 6.428042443987858, 'subsample': 0.6933517732644422, 'colsample_bytree': 0.8407413216408879, 'max_depth': 3, 'min_child_weight': 9, 'eta': 0.011113762183570035, 'gamma': 0.6270013268267465}. Best is trial 13 with value: -1.6928838510643178.
[I 2025-06-29 21:47:31,496] Trial 14 finished with value: -1.6877654273239697 and parameters: {'booster': 'gbtree', 'lambda': 8.976013127501032e-07, 'alpha': 0.08140352590181929, 'subsample': 0.6589965004222631, 'colsample_bytree': 0.8440807856560852, 'max_depth': 3, 'min_child_weight': 8, 'eta': 0.004235311361036535, 'gamma': 2.4957333216703903}. Best is trial 14 with value: -1.6877654273239697.
[I 2025-06-29 21:47:31,691] Trial 15 finished with value: -1.6852127443589613 and parameters: {'booster': 'gbtree', 'lambda': 3.1529564067598044e-06, 'alpha': 0.0680989829772456, 'subsample': 0.6558890845114904, 'colsample_bytree': 0.798833460886241, 'max_depth': 3, 'min_child_weight': 8, 'eta': 0.0043686856810834784, 'gamma': 1.0053774565717086}. Best is trial 15 with value: -1.6852127443589613.
[I 2025-06-29 21:47:31,884] Trial 16 finished with value: -1.6959531981289238 and parameters: {'booster': 'gbtree', 'lambda': 3.4970071664093567e-06, 'alpha': 0.021913485737744917, 'subsample': 0.5013887930933076, 'colsample_bytree': 0.7942227506531196, 'max_depth': 3, 'min_child_weight': 8, 'eta': 0.003413010774794843, 'gamma': 1.516298475692469}. Best is trial 15 with value: -1.6852127443589613.
[I 2025-06-29 21:47:32,194] Trial 17 finished with value: -1.6994041877501946 and parameters: {'booster': 'gbtree', 'lambda': 3.3615509438024152e-06, 'alpha': 0.03147988720687118, 'subsample': 0.6116315269534618, 'colsample_bytree': 0.7745406848945371, 'max_depth': 9, 'min_child_weight': 8, 'eta': 0.0040955264816737915, 'gamma': 2.417323363072504}. Best is trial 15 with value: -1.6852127443589613.
[I 2025-06-29 21:47:32,430] Trial 18 finished with value: -1.6885704573447597 and parameters: {'booster': 'gbtree', 'lambda': 1.0138714283684478e-08, 'alpha': 0.0026926129996106616, 'subsample': 0.6416164801642095, 'colsample_bytree': 0.6967160262855525, 'max_depth': 5, 'min_child_weight': 7, 'eta': 0.004509315871449788, 'gamma': 1.1278454674159377}. Best is trial 15 with value: -1.6852127443589613.
[I 2025-06-29 21:47:32,639] Trial 19 finished with value: -1.6903059770221547 and parameters: {'booster': 'gbtree', 'lambda': 8.286783060520228e-06, 'alpha': 0.26002887100233013, 'subsample': 0.7456281514968857, 'colsample_bytree': 0.8093394585469667, 'max_depth': 5, 'min_child_weight': 7, 'eta': 0.006360497703590557, 'gamma': 2.4789780841225757}. Best is trial 15 with value: -1.6852127443589613.
[I 2025-06-29 21:47:32,834] Trial 20 finished with value: -1.7324122709772063 and parameters: {'booster': 'gbtree', 'lambda': 0.011915732275559393, 'alpha': 0.1792008351347747, 'subsample': 0.6114270437424029, 'colsample_bytree': 0.734413173355483, 'max_depth': 3, 'min_child_weight': 9, 'eta': 0.0025441089407883424, 'gamma': 0.4959720061146904}. Best is trial 15 with value: -1.6852127443589613.
[I 2025-06-29 21:47:33,066] Trial 21 finished with value: -1.6888645969518532 and parameters: {'booster': 'gbtree', 'lambda': 1.377752129445089e-08, 'alpha': 0.0025233770627953694, 'subsample': 0.6457046670328157, 'colsample_bytree': 0.6540439052060432, 'max_depth': 5, 'min_child_weight': 7, 'eta': 0.005461643344640591, 'gamma': 1.0299199968821366}. Best is trial 15 with value: -1.6852127443589613.
[I 2025-06-29 21:47:33,170] Trial 22 finished with value: -1.7012523446607826 and parameters: {'booster': 'gbtree', 'lambda': 1.5588323508221496e-08, 'alpha': 0.004313525658095983, 'subsample': 0.7002205594501948, 'colsample_bytree': 0.7148202156254068, 'max_depth': 4, 'min_child_weight': 8, 'eta': 0.022144338422466932, 'gamma': 1.3547119327313943}. Best is trial 15 with value: -1.6852127443589613.
[I 2025-06-29 21:47:33,407] Trial 23 finished with value: -1.7251026975303314 and parameters: {'booster': 'gbtree', 'lambda': 8.37597979474171e-07, 'alpha': 0.0023290678761661954, 'subsample': 0.6365452232540313, 'colsample_bytree': 0.6216076728476285, 'max_depth': 5, 'min_child_weight': 9, 'eta': 0.0025786610009337985, 'gamma': 2.050028502419236}. Best is trial 15 with value: -1.6852127443589613.
[I 2025-06-29 21:47:33,600] Trial 24 finished with value: -1.6727820575529426 and parameters: {'booster': 'gbtree', 'lambda': 2.1671671145608892e-05, 'alpha': 0.05441147286527723, 'subsample': 0.5578352455017316, 'colsample_bytree': 0.9205105536076617, 'max_depth': 3, 'min_child_weight': 7, 'eta': 0.005855846245012497, 'gamma': 1.220290137744747}. Best is trial 24 with value: -1.6727820575529426.
[I 2025-06-29 21:47:33,774] Trial 25 finished with value: -1.6747224294046352 and parameters: {'booster': 'gbtree', 'lambda': 1.177202041807278e-05, 'alpha': 1.0462063907086794, 'subsample': 0.5121751824493324, 'colsample_bytree': 0.917947764882393, 'max_depth': 3, 'min_child_weight': 6, 'eta': 0.00765624170663352, 'gamma': 9.911120552308361e-05}. Best is trial 24 with value: -1.6727820575529426.
[I 2025-06-29 21:47:33,925] Trial 26 finished with value: -1.6749931322862708 and parameters: {'booster': 'gbtree', 'lambda': 1.6722352440174633e-05, 'alpha': 0.8503941351001381, 'subsample': 0.5166310951264231, 'colsample_bytree': 0.9227774688794604, 'max_depth': 3, 'min_child_weight': 6, 'eta': 0.009200633728335074, 'gamma': 0.04815120924505911}. Best is trial 24 with value: -1.6727820575529426.
[I 2025-06-29 21:47:34,070] Trial 27 finished with value: -1.6867736086533816 and parameters: {'booster': 'gbtree', 'lambda': 0.0019041184346260441, 'alpha': 0.6706489702652686, 'subsample': 0.5282470592478595, 'colsample_bytree': 0.9195257234516873, 'max_depth': 4, 'min_child_weight': 4, 'eta': 0.007718414086254621, 'gamma': 0.19493083060046265}. Best is trial 24 with value: -1.6727820575529426.
[I 2025-06-29 21:47:34,153] Trial 28 finished with value: -1.692965697115632 and parameters: {'booster': 'gbtree', 'lambda': 2.2689774657391997e-05, 'alpha': 1.3605305057896337, 'subsample': 0.5538261258338021, 'colsample_bytree': 0.926923827617361, 'max_depth': 3, 'min_child_weight': 6, 'eta': 0.03233875738419866, 'gamma': 0.5261851120250294}. Best is trial 24 with value: -1.6727820575529426.
[I 2025-06-29 21:47:34,290] Trial 29 finished with value: -1.6876657338682728 and parameters: {'booster': 'gbtree', 'lambda': 0.001842198708587849, 'alpha': 1.7544151048691001, 'subsample': 0.5012182298111766, 'colsample_bytree': 0.9562155365932603, 'max_depth': 4, 'min_child_weight': 4, 'eta': 0.010735124208933335, 'gamma': 0.06204685378899538}. Best is trial 24 with value: -1.6727820575529426.
[I 2025-06-29 21:47:34,417] Trial 30 finished with value: -1.7172627459571754 and parameters: {'booster': 'gbtree', 'lambda': 2.6160413928985787e-05, 'alpha': 0.011034681256599933, 'subsample': 0.5423945939793342, 'colsample_bytree': 0.9238065952907311, 'max_depth': 8, 'min_child_weight': 5, 'eta': 0.016641388479210564, 'gamma': 0.047987911017989}. Best is trial 24 with value: -1.6727820575529426.
[I 2025-06-29 21:47:34,586] Trial 31 finished with value: -1.6791472405919796 and parameters: {'booster': 'gbtree', 'lambda': 1.030452377616504e-05, 'alpha': 0.1047044309785708, 'subsample': 0.5937934543249794, 'colsample_bytree': 0.8931479661174719, 'max_depth': 3, 'min_child_weight': 6, 'eta': 0.007922997662872959, 'gamma': 0.6014884904472961}. Best is trial 24 with value: -1.6727820575529426.
[I 2025-06-29 21:47:34,720] Trial 32 finished with value: -1.679648244106934 and parameters: {'booster': 'gbtree', 'lambda': 1.3618791865787091e-05, 'alpha': 0.30545616866926906, 'subsample': 0.5791869843462285, 'colsample_bytree': 0.8953136972753808, 'max_depth': 3, 'min_child_weight': 6, 'eta': 0.009917801419476019, 'gamma': 0.41668453007506795}. Best is trial 24 with value: -1.6727820575529426.
[I 2025-06-29 21:47:34,849] Trial 33 finished with value: -1.6774447454732424 and parameters: {'booster': 'gbtree', 'lambda': 0.0005932281851978281, 'alpha': 2.070140924864681, 'subsample': 0.5257419656389939, 'colsample_bytree': 0.9584754948531291, 'max_depth': 3, 'min_child_weight': 5, 'eta': 0.01337200094896657, 'gamma': 0.7885748977021702}. Best is trial 24 with value: -1.6727820575529426.
[I 2025-06-29 21:47:34,976] Trial 34 finished with value: -1.6917488623126886 and parameters: {'booster': 'gbtree', 'lambda': 0.0008145453145354076, 'alpha': 1.8582466590946438, 'subsample': 0.5284165079200787, 'colsample_bytree': 0.9548952012172054, 'max_depth': 4, 'min_child_weight': 5, 'eta': 0.014238013233832211, 'gamma': 0.7822597238011206}. Best is trial 24 with value: -1.6727820575529426.
[I 2025-06-29 21:47:35,055] Trial 35 finished with value: -1.721592146741732 and parameters: {'booster': 'gbtree', 'lambda': 0.04432391064392082, 'alpha': 1.4921682980853883e-08, 'subsample': 0.5005529145560053, 'colsample_bytree': 0.954103788834855, 'max_depth': 4, 'min_child_weight': 3, 'eta': 0.03184991211988379, 'gamma': 0.32093990908103276}. Best is trial 24 with value: -1.6727820575529426.
[I 2025-06-29 21:47:35,315] Trial 36 finished with value: -1.7039828183914494 and parameters: {'booster': 'gbtree', 'lambda': 5.736386877817793e-05, 'alpha': 9.279368918094564, 'subsample': 0.5452059692523081, 'colsample_bytree': 0.9767190637602593, 'max_depth': 7, 'min_child_weight': 5, 'eta': 0.006550298288645642, 'gamma': 1.4611180545289446}. Best is trial 24 with value: -1.6727820575529426.
[I 2025-06-29 21:47:35,418] Trial 37 finished with value: -1.7019624227812944 and parameters: {'booster': 'gbtree', 'lambda': 0.0005689266241713629, 'alpha': 0.7592884134024891, 'subsample': 0.5897418437434215, 'colsample_bytree': 0.9034270108203379, 'max_depth': 3, 'min_child_weight': 3, 'eta': 0.022399540608646133, 'gamma': 0.0007822242966503785}. Best is trial 24 with value: -1.6727820575529426.
[I 2025-06-29 21:47:35,490] Trial 38 finished with value: -1.8017418443808455 and parameters: {'booster': 'gbtree', 'lambda': 4.133853552782125e-05, 'alpha': 2.774575649224157, 'subsample': 0.5286585141144811, 'colsample_bytree': 0.8425659014734772, 'max_depth': 6, 'min_child_weight': 7, 'eta': 0.1109494763322569, 'gamma': 0.7768410477260745}. Best is trial 24 with value: -1.6727820575529426.
[I 2025-06-29 21:47:35,553] Trial 39 finished with value: -1.9044515569992573 and parameters: {'booster': 'gbtree', 'lambda': 0.0002238795908893731, 'alpha': 0.0002811023918941362, 'subsample': 0.5682131591043749, 'colsample_bytree': 0.943221080903136, 'max_depth': 4, 'min_child_weight': 4, 'eta': 0.2268373337104999, 'gamma': 1.2965848764582697}. Best is trial 24 with value: -1.6727820575529426.
[I 2025-06-29 21:47:44,200] Trial 40 finished with value: -1.765142970690516 and parameters: {'booster': 'dart', 'lambda': 7.917418046693793e-05, 'alpha': 0.4343963951164406, 'subsample': 0.61660412769776, 'colsample_bytree': 0.9985470577608332, 'max_depth': 3, 'min_child_weight': 6, 'eta': 0.0018044841768427569, 'gamma': 0.32088860420138365, 'rate_drop': 2.2715532019764517e-08, 'skip_drop': 1.3759647100812171e-08}. Best is trial 24 with value: -1.6727820575529426.
[I 2025-06-29 21:47:44,362] Trial 41 finished with value: -1.67612213805022 and parameters: {'booster': 'gbtree', 'lambda': 9.317862463171807e-06, 'alpha': 0.09877544120557918, 'subsample': 0.5917592782055705, 'colsample_bytree': 0.8987560533213376, 'max_depth': 3, 'min_child_weight': 6, 'eta': 0.012505895359674396, 'gamma': 0.6872349824597579}. Best is trial 24 with value: -1.6727820575529426.
[I 2025-06-29 21:47:44,508] Trial 42 finished with value: -1.6727352942879392 and parameters: {'booster': 'gbtree', 'lambda': 1.4927878501505248e-06, 'alpha': 0.1447855451235, 'subsample': 0.5192833308649926, 'colsample_bytree': 0.9683611653972615, 'max_depth': 3, 'min_child_weight': 6, 'eta': 0.012611608680715721, 'gamma': 0.7555283783072018}. Best is trial 42 with value: -1.6727352942879392.
[I 2025-06-29 21:47:44,728] Trial 43 finished with value: -1.672863801019551 and parameters: {'booster': 'gbtree', 'lambda': 1.8037378687939144e-06, 'alpha': 0.00785087442473328, 'subsample': 0.5589730842517766, 'colsample_bytree': 0.9095191566792766, 'max_depth': 3, 'min_child_weight': 7, 'eta': 0.006067798323228306, 'gamma': 1.6710738969811039}. Best is trial 42 with value: -1.6727352942879392.
[I 2025-06-29 21:47:44,997] Trial 44 finished with value: -1.692008506311538 and parameters: {'booster': 'gbtree', 'lambda': 3.3103214771801074e-07, 'alpha': 0.0007328283218881577, 'subsample': 0.5613848629060166, 'colsample_bytree': 0.9832398721110186, 'max_depth': 5, 'min_child_weight': 7, 'eta': 0.0029507850476547404, 'gamma': 1.8055615133344975}. Best is trial 42 with value: -1.6727352942879392.
[I 2025-06-29 21:47:52,555] Trial 45 finished with value: -1.6793546843019518 and parameters: {'booster': 'dart', 'lambda': 1.5692515431296477e-06, 'alpha': 0.008985364210105484, 'subsample': 0.5203649576655678, 'colsample_bytree': 0.915865190656257, 'max_depth': 4, 'min_child_weight': 7, 'eta': 0.005703878463980967, 'gamma': 1.951625422392503, 'rate_drop': 0.0013464335332564453, 'skip_drop': 1.6717645147812363e-06}. Best is trial 42 with value: -1.6727352942879392.
[I 2025-06-29 21:47:52,771] Trial 46 finished with value: -1.6680867919190938 and parameters: {'booster': 'gbtree', 'lambda': 5.911767420267381e-08, 'alpha': 0.04934144336594704, 'subsample': 0.5483883722645955, 'colsample_bytree': 0.869190224614502, 'max_depth': 3, 'min_child_weight': 1, 'eta': 0.00876676339939104, 'gamma': 2.8288572079061254}. Best is trial 46 with value: -1.6680867919190938.
[I 2025-06-29 21:47:52,863] Trial 47 finished with value: -1.7697027752694838 and parameters: {'booster': 'gbtree', 'lambda': 3.5856503502619205e-08, 'alpha': 0.045609166229555874, 'subsample': 0.9123428012577199, 'colsample_bytree': 0.8671036789594496, 'max_depth': 4, 'min_child_weight': 1, 'eta': 0.04591030214356469, 'gamma': 2.952253844257128}. Best is trial 46 with value: -1.6680867919190938.
[I 2025-06-29 21:47:54,573] Trial 48 finished with value: -1.709731113371698 and parameters: {'booster': 'dart', 'lambda': 2.1573892115937192e-07, 'alpha': 0.008734543530504187, 'subsample': 0.7854188398165344, 'colsample_bytree': 0.8314985620880592, 'max_depth': 3, 'min_child_weight': 2, 'eta': 0.018296208329018196, 'gamma': 3.693368788968451, 'rate_drop': 1.1342846285737964e-06, 'skip_drop': 1.9619270462580455e-06}. Best is trial 46 with value: -1.6680867919190938.
[I 2025-06-29 21:47:54,833] Trial 49 finished with value: -1.7283168749803197 and parameters: {'booster': 'gbtree', 'lambda': 5.231061284812079e-08, 'alpha': 7.907493132112083e-05, 'subsample': 0.5537444973869813, 'colsample_bytree': 0.8688013734502514, 'max_depth': 10, 'min_child_weight': 2, 'eta': 0.006548369911022494, 'gamma': 2.8093170195349395}. Best is trial 46 with value: -1.6680867919190938.
Number of finished trials:  50
Best trial:
  Value (RMSE): 1.6681
  MSE: 2.7825
  R²: 0.3135
Model saved to ck_student_score_predictor_optuna_xgb.pkl
PS D:\machile_nearning\wecode_score_prediction\dataset-hard-problem-fixed\XGBoost-CK-No-Rates> python .\predict.py
Found 733 students without CK scores
Predictions saved to ck_score_predictions.csv
Sample predictions:
                                  student_id  predicted_ck_score
3   0134f9f410c65ad0e8c2254a7e9288670e02a183            8.033614
20  035f97702f2c01d26ab1fae8f39ea2f98a0caa3c            7.937679
40  06024da8147b5cf6105beb4c403f67cf1ff0aea1            7.575612
68  0aaebc88f6106684d6993c156104c1ef36cf94e0            8.108714
80  0bf111a9caedf02804f6991792490e63bc21058a            8.562036