[I 2025-06-22 08:28:19,024] Trial 284 finished with value: -1.2067954330260495 and parameters: {'booster': 'dart', 'lambda': 5.842561969412322, 'alpha': 0.1705135070507833, 'subsample': 0.9867125654152463, 'colsample_bytree': 0.8288005290788357, 'max_depth': 3, 'min_child_weight': 7, 'eta': 0.10976672520966436, 'gamma': 1.0784781730138684, 'rate_drop': 5.2764396650851485e-05, 'skip_drop': 9.13461743056605e-07}. Best is trial 137 with value: -1.165362986830467.
[I 2025-06-22 08:28:21,098] Trial 285 finished with value: -1.2508387713516416 and parameters: {'booster': 'dart', 'lambda': 2.8586052696825255, 'alpha': 2.280874950002952, 'subsample': 0.8930026652648585, 'colsample_bytree': 0.6642537949116315, 'max_depth': 4, 'min_child_weight': 7, 'eta': 0.18440673957744605, 'gamma': 2.0634935475222673, 'rate_drop': 3.327839595043693e-07, 'skip_drop': 1.054954512491707e-07}. Best is trial 137 with value: -1.165362986830467.
[I 2025-06-22 08:28:22,234] Trial 286 finished with value: -1.2553120038180616 and parameters: {'booster': 'dart', 'lambda': 1.6203613574890912, 'alpha': 0.0012056996080310938, 'subsample': 0.9265103572886112, 'colsample_bytree': 0.7876737438580642, 'max_depth': 3, 'min_child_weight': 4, 'eta': 0.13971970767483602, 'gamma': 2.744582467001828, 'rate_drop': 4.4020817896669116e-08, 'skip_drop': 2.489326819250464e-07}. Best is trial 137 with value: -1.165362986830467.
[I 2025-06-22 08:28:23,132] Trial 287 finished with value: -1.2207243776027106 and parameters: {'booster': 'dart', 'lambda': 4.422056693633188, 'alpha': 6.317596050545916e-05, 'subsample': 0.9991989751670705, 'colsample_bytree': 0.8003567725861185, 'max_depth': 3, 'min_child_weight': 7, 'eta': 0.21421260780666204, 'gamma': 2.349478788843482, 'rate_drop': 1.9570843364990512e-07, 'skip_drop': 2.1102669518114315e-08}. Best is trial 137 with value: -1.165362986830467.
[I 2025-06-22 08:28:23,613] Trial 288 finished with value: -1.3054140278955582 and parameters: {'booster': 'dart', 'lambda': 7.647787258164016, 'alpha': 0.4160329178205154, 'subsample': 0.9629947033508879, 'colsample_bytree': 0.7743938270660923, 'max_depth': 8, 'min_child_weight': 6, 'eta': 0.25057230704708444, 'gamma': 0.21182905131262664, 'rate_drop': 3.223825161573144e-08, 'skip_drop': 1.7333094825970528e-07}. Best is trial 137 with value: -1.165362986830467.
[I 2025-06-22 08:28:23,777] Trial 289 finished with value: -1.227953854151204 and parameters: {'booster': 'gbtree', 'lambda': 0.15232117672890444, 'alpha': 0.00041386914487560417, 'subsample': 0.9793014306256064, 'colsample_bytree': 0.7624790401042592, 'max_depth': 3, 'min_child_weight': 2, 'eta': 0.16286839697564734, 'gamma': 0.8912979533605339}. Best is trial 137 with value: -1.165362986830467.
[I 2025-06-22 08:28:25,309] Trial 290 finished with value: -1.224579490722052 and parameters: {'booster': 'dart', 'lambda': 0.07212125545996007, 'alpha': 0.011748379312950339, 'subsample': 0.9014896359264861, 'colsample_bytree': 0.813228780631151, 'max_depth': 3, 'min_child_weight': 7, 'eta': 0.12306148232099198, 'gamma': 1.5268796253080612, 'rate_drop': 6.299295482116348e-08, 'skip_drop': 3.5556837018011576e-08}. Best is trial 137 with value: -1.165362986830467.
[I 2025-06-22 08:28:27,682] Trial 291 finished with value: -1.195019785592581 and parameters: {'booster': 'dart', 'lambda': 2.032359937035413, 'alpha': 1.1119520543831654, 'subsample': 0.9697023757288175, 'colsample_bytree': 0.675803166650195, 'max_depth': 3, 'min_child_weight': 7, 'eta': 0.18174040630121888, 'gamma': 1.1995194316099416, 'rate_drop': 3.018648926281225e-06, 'skip_drop': 5.51555458701967e-07}. Best is trial 137 with value: -1.165362986830467.
[I 2025-06-22 08:28:28,687] Trial 292 finished with value: -1.200072992849166 and parameters: {'booster': 'dart', 'lambda': 2.2005755933068905, 'alpha': 1.0005566437485922, 'subsample': 0.9157550411516711, 'colsample_bytree': 0.6851137168068449, 'max_depth': 3, 'min_child_weight': 7, 'eta': 0.18797443451697182, 'gamma': 1.0232346411479876, 'rate_drop': 5.11622212994973e-08, 'skip_drop': 5.858660283339388e-07}. Best is trial 137 with value: -1.165362986830467.
[I 2025-06-22 08:28:32,010] Trial 293 finished with value: -1.2208917075621537 and parameters: {'booster': 'dart', 'lambda': 3.551687220364883, 'alpha': 1.3124190743724318, 'subsample': 0.8371363184517764, 'colsample_bytree': 0.6931270241696034, 'max_depth': 3, 'min_child_weight': 6, 'eta': 0.20867209440162807, 'gamma': 2.650118435050078, 'rate_drop': 5.469931156957001e-06, 'skip_drop': 2.6593436890195212e-06}. Best is trial 137 with value: -1.165362986830467.
[I 2025-06-22 08:28:32,580] Trial 294 finished with value: -1.2177225040567485 and parameters: {'booster': 'dart', 'lambda': 2.015340553904427, 'alpha': 0.01332223681191498, 'subsample': 0.6860303540743913, 'colsample_bytree': 0.6663852591104839, 'max_depth': 7, 'min_child_weight': 7, 'eta': 0.1764887547633822, 'gamma': 2.1600603571632417, 'rate_drop': 2.2698998015985377e-08, 'skip_drop': 4.2912467983738847e-07}. Best is trial 137 with value: -1.165362986830467.
[I 2025-06-22 08:28:33,118] Trial 295 finished with value: -1.2161823811011203 and parameters: {'booster': 'dart', 'lambda': 2.9475067757913997, 'alpha': 0.03223265447124164, 'subsample': 0.9368048969920353, 'colsample_bytree': 0.670518235620038, 'max_depth': 3, 'min_child_weight': 7, 'eta': 0.24198506663812833, 'gamma': 1.3192488711242218, 'rate_drop': 3.3820808600268368e-06, 'skip_drop': 1.6621697529530083e-06}. Best is trial 137 with value: -1.165362986830467.
[I 2025-06-22 08:28:34,150] Trial 296 finished with value: -1.2169591409273894 and parameters: {'booster': 'dart', 'lambda': 4.831461080423783, 'alpha': 0.6065072451026612, 'subsample': 0.9677700665248256, 'colsample_bytree': 0.6750893191286633, 'max_depth': 3, 'min_child_weight': 5, 'eta': 0.1526943076936656, 'gamma': 1.210267335252739, 'rate_drop': 1.3071860325497426e-07, 'skip_drop': 7.351765843786278e-07}. Best is trial 137 with value: -1.165362986830467.
[I 2025-06-22 08:28:34,991] Trial 297 finished with value: -1.2728485710289972 and parameters: {'booster': 'dart', 'lambda': 1.631093214386772, 'alpha': 0.06476133363625199, 'subsample': 0.9469751987661947, 'colsample_bytree': 0.6582233773583801, 'max_depth': 3, 'min_child_weight': 9, 'eta': 0.26552585146655444, 'gamma': 3.0893094758155226, 'rate_drop': 2.0048171594372438e-05, 'skip_drop': 1.0156764869271433e-06}. Best is trial 137 with value: -1.165362986830467.
[I 2025-06-22 08:28:35,940] Trial 298 finished with value: -1.2324452679633957 and parameters: {'booster': 'dart', 'lambda': 1.1429060430504092, 'alpha': 0.00013585316322967827, 'subsample': 0.9269532012294769, 'colsample_bytree': 0.7822153347997335, 'max_depth': 3, 'min_child_weight': 8, 'eta': 0.19552770295561478, 'gamma': 2.8885782984633073, 'rate_drop': 8.29753236011666e-06, 'skip_drop': 1.0020776955449208e-08}. Best is trial 137 with value: -1.165362986830467.
[I 2025-06-22 08:28:37,135] Trial 299 finished with value: -1.2423888091572801 and parameters: {'booster': 'dart', 'lambda': 0.001740361627690662, 'alpha': 1.5867938116160658, 'subsample': 0.9815244152810327, 'colsample_bytree': 0.793394356461785, 'max_depth': 3, 'min_child_weight': 7, 'eta': 0.22693017430058615, 'gamma': 1.443004535550403, 'rate_drop': 3.2823200399105685e-08, 'skip_drop': 3.775414422509234e-05}. Best is trial 137 with value: -1.165362986830467.
[I 2025-06-22 08:28:38,303] Trial 300 finished with value: -1.196986726232158 and parameters: {'booster': 'dart', 'lambda': 8.454166163586683, 'alpha': 2.729286529205495, 'subsample': 0.8847077074667103, 'colsample_bytree': 0.7435350737128209, 'max_depth': 3, 'min_child_weight': 6, 'eta': 0.1709198173008671, 'gamma': 0.9401805313582124, 'rate_drop': 5.01399603892685e-07, 'skip_drop': 0.00017880759369407235}. Best is trial 137 with value: -1.165362986830467.
[I 2025-06-22 08:28:39,846] Trial 301 finished with value: -1.223744674147516 and parameters: {'booster': 'dart', 'lambda': 9.924004090305955, 'alpha': 0.11530573834423768, 'subsample': 0.8633487492883866, 'colsample_bytree': 0.7411745148497354, 'max_depth': 3, 'min_child_weight': 6, 'eta': 0.1744251575597898, 'gamma': 0.8781857842581935, 'rate_drop': 4.4639824491913034e-07, 'skip_drop': 0.0003365024691328626}. Best is trial 137 with value: -1.165362986830467.
[I 2025-06-22 08:28:41,307] Trial 302 finished with value: -1.1997733204043284 and parameters: {'booster': 'dart', 'lambda': 7.280568294819079, 'alpha': 0.30293422664922975, 'subsample': 0.8774871501191139, 'colsample_bytree': 0.7568995821896205, 'max_depth': 3, 'min_child_weight': 6, 'eta': 0.2074704535718186, 'gamma': 1.7450990285402348, 'rate_drop': 2.3713605831383935e-07, 'skip_drop': 5.439724031703189e-08}. Best is trial 137 with value: -1.165362986830467.
[I 2025-06-22 08:28:42,297] Trial 303 finished with value: -1.2169774937331514 and parameters: {'booster': 'dart', 'lambda': 5.751929196804742, 'alpha': 6.329671611837909e-08, 'subsample': 0.9580855103809177, 'colsample_bytree': 0.7460413132338087, 'max_depth': 3, 'min_child_weight': 6, 'eta': 0.16265932323170348, 'gamma': 0.9364729627282428, 'rate_drop': 4.0384905633528626e-07, 'skip_drop': 0.00023758492027972677}. Best is trial 137 with value: -1.165362986830467.
[I 2025-06-22 08:28:43,653] Trial 304 finished with value: -1.2075370734218747 and parameters: {'booster': 'dart', 'lambda': 4.506849417622791, 'alpha': 3.162764686739064, 'subsample': 0.8685073930236491, 'colsample_bytree': 0.7713573547472585, 'max_depth': 3, 'min_child_weight': 6, 'eta': 0.18301718083344062, 'gamma': 2.403454770272736, 'rate_drop': 6.622636409394335e-07, 'skip_drop': 0.000304341611287666}. Best is trial 137 with value: -1.165362986830467.
[I 2025-06-22 08:28:45,045] Trial 305 finished with value: -1.2637279381625324 and parameters: {'booster': 'dart', 'lambda': 3.6282806318514056, 'alpha': 0.82684908956688, 'subsample': 0.9730375837843956, 'colsample_bytree': 0.7530650987764569, 'max_depth': 4, 'min_child_weight': 10, 'eta': 0.23108607669375925, 'gamma': 3.467974877825811, 'rate_drop': 6.850116396230588e-07, 'skip_drop': 0.0001352744861761182}. Best is trial 137 with value: -1.165362986830467.
[I 2025-06-22 08:28:46,517] Trial 306 finished with value: -1.2488965545632507 and parameters: {'booster': 'dart', 'lambda': 2.5661787297234637, 'alpha': 5.512969286454407, 'subsample': 0.9906429831063034, 'colsample_bytree': 0.8054832487221876, 'max_depth': 3, 'min_child_weight': 6, 'eta': 0.20080110848539934, 'gamma': 2.9551739852122467, 'rate_drop': 9.140957119431027e-08, 'skip_drop': 0.000519562691378896}. Best is trial 137 with value: -1.165362986830467.
[I 2025-06-22 08:28:46,720] Trial 307 finished with value: -1.2156579890405845 and parameters: {'booster': 'gbtree', 'lambda': 9.203149186046886, 'alpha': 5.273035301215128e-06, 'subsample': 0.8820722033719961, 'colsample_bytree': 0.7637005603508497, 'max_depth': 3, 'min_child_weight': 5, 'eta': 0.14422356451777102, 'gamma': 2.5596223146044026}. Best is trial 137 with value: -1.165362986830467.
[I 2025-06-22 08:28:47,185] Trial 308 finished with value: -1.2607762314103332 and parameters: {'booster': 'dart', 'lambda': 1.9707342380695763, 'alpha': 2.4831539005762706, 'subsample': 0.9585468462782085, 'colsample_bytree': 0.7291914101763366, 'max_depth': 3, 'min_child_weight': 6, 'eta': 0.2986267681959463, 'gamma': 0.7407640634255439, 'rate_drop': 1.0495877110632225e-08, 'skip_drop': 1.539044280508557e-08}. Best is trial 137 with value: -1.165362986830467.
[I 2025-06-22 08:28:48,292] Trial 309 finished with value: -1.2181089080856724 and parameters: {'booster': 'dart', 'lambda': 4.977116519971547, 'alpha': 2.4524125901716995e-07, 'subsample': 0.8923247893162797, 'colsample_bytree': 0.5175866428957812, 'max_depth': 3, 'min_child_weight': 7, 'eta': 0.16148715907089514, 'gamma': 1.8698837481673507, 'rate_drop': 2.3631161414535516e-08, 'skip_drop': 7.226227246224596e-05}. Best is trial 137 with value: -1.165362986830467.
[I 2025-06-22 08:28:49,268] Trial 310 finished with value: -1.205357866774092 and parameters: {'booster': 'dart', 'lambda': 0.02548802420297849, 'alpha': 0.017809522090317144, 'subsample': 0.9478155832830908, 'colsample_bytree': 0.9836329591430171, 'max_depth': 3, 'min_child_weight': 8, 'eta': 0.2544388422943862, 'gamma': 2.7529231240523555, 'rate_drop': 9.047799457241286e-07, 'skip_drop': 3.214372504759801e-08}. Best is trial 137 with value: -1.165362986830467.
[I 2025-06-22 08:28:50,537] Trial 311 finished with value: -1.2009884574876406 and parameters: {'booster': 'dart', 'lambda': 1.3818843749854521, 'alpha': 8.767834342110579, 'subsample': 0.9680366056235438, 'colsample_bytree': 0.6803452430684831, 'max_depth': 3, 'min_child_weight': 7, 'eta': 0.1833505966619282, 'gamma': 2.236473151083813, 'rate_drop': 2.753649830348944e-07, 'skip_drop': 7.858772601848586e-08}. Best is trial 137 with value: -1.165362986830467.
[I 2025-06-22 08:28:51,019] Trial 312 finished with value: -1.2462217857096372 and parameters: {'booster': 'dart', 'lambda': 2.7606869622177226, 'alpha': 1.0389792361395887e-06, 'subsample': 0.9375365714029893, 'colsample_bytree': 0.7371050419870362, 'max_depth': 3, 'min_child_weight': 7, 'eta': 0.22760468605076906, 'gamma': 1.1373291301504431, 'rate_drop': 5.700757414072642e-08, 'skip_drop': 2.3406669691205212e-08}. Best is trial 137 with value: -1.165362986830467.
[I 2025-06-22 08:28:52,489] Trial 313 finished with value: -1.2371712648049045 and parameters: {'booster': 'dart', 'lambda': 6.6579135139100325, 'alpha': 1.072652111581992, 'subsample': 0.9805492292793035, 'colsample_bytree': 0.7975268141741553, 'max_depth': 3, 'min_child_weight': 6, 'eta': 0.13765069371702662, 'gamma': 4.970167566695274, 'rate_drop': 4.009649109826529e-08, 'skip_drop': 0.00018665623062839382}. Best is trial 137 with value: -1.165362986830467.
[I 2025-06-22 08:28:53,486] Trial 314 finished with value: -1.2033892001921787 and parameters: {'booster': 'dart', 'lambda': 3.4039835539851233, 'alpha': 3.0330195161849254, 'subsample': 0.8558625174337554, 'colsample_bytree': 0.8219740623042738, 'max_depth': 3, 'min_child_weight': 7, 'eta': 0.20607626657056155, 'gamma': 0.9820018376007642, 'rate_drop': 1.509793453609888e-07, 'skip_drop': 3.999318448265729e-08}. Best is trial 137 with value: -1.165362986830467.
[I 2025-06-22 08:28:54,566] Trial 315 finished with value: -1.243607971895476 and parameters: {'booster': 'dart', 'lambda': 1.7749935236004672, 'alpha': 0.46315559605039813, 'subsample': 0.6526119683609728, 'colsample_bytree': 0.7798089674911756, 'max_depth': 3, 'min_child_weight': 7, 'eta': 0.1549294713262991, 'gamma': 2.8336624792662426, 'rate_drop': 1.4448510397425028e-08, 'skip_drop': 5.4346376999344244e-08}. Best is trial 137 with value: -1.165362986830467.
[I 2025-06-22 08:28:55,158] Trial 316 finished with value: -1.2685412846872344 and parameters: {'booster': 'dart', 'lambda': 0.9607841484120838, 'alpha': 0.0009557373624055744, 'subsample': 0.9518943575254125, 'colsample_bytree': 0.7021657976645793, 'max_depth': 3, 'min_child_weight': 6, 'eta': 0.2641495690482948, 'gamma': 3.156824038108891, 'rate_drop': 0.001127153994579967, 'skip_drop': 9.289461193788418e-08}. Best is trial 137 with value: -1.165362986830467.
[I 2025-06-22 08:28:56,565] Trial 317 finished with value: -1.1892244971458907 and parameters: {'booster': 'dart', 'lambda': 4.4283600395271385, 'alpha': 1.726708814313813, 'subsample': 0.966633331178943, 'colsample_bytree': 0.7696035668376764, 'max_depth': 3, 'min_child_weight': 7, 'eta': 0.1773289792923256, 'gamma': 2.491767402508632, 'rate_drop': 0.03817179830780872, 'skip_drop': 1.8061061243733716e-08}. Best is trial 137 with value: -1.165362986830467.
[I 2025-06-22 08:28:57,527] Trial 318 finished with value: -1.2168951378411248 and parameters: {'booster': 'dart', 'lambda': 5.043952567879216, 'alpha': 1.5574161447090784, 'subsample': 0.9870996496927087, 'colsample_bytree': 0.7509764305829235, 'max_depth': 3, 'min_child_weight': 7, 'eta': 0.18933894726247877, 'gamma': 2.51652132287563, 'rate_drop': 0.005224833475680107, 'skip_drop': 2.407752821181676e-08}. Best is trial 137 with value: -1.165362986830467.
[I 2025-06-22 08:29:02,691] Trial 319 finished with value: -1.4129770478362735 and parameters: {'booster': 'dart', 'lambda': 2.8069471374143616e-07, 'alpha': 1.8625216708100625, 'subsample': 0.5664872616398509, 'colsample_bytree': 0.7658025905412088, 'max_depth': 4, 'min_child_weight': 6, 'eta': 0.22154314222575322, 'gamma': 2.67009228286615, 'rate_drop': 0.8895415712941537, 'skip_drop': 2.821914694944003e-07}. Best is trial 137 with value: -1.165362986830467.
[I 2025-06-22 08:29:04,085] Trial 320 finished with value: -1.2409939153993963 and parameters: {'booster': 'dart', 'lambda': 9.390730448622373, 'alpha': 4.641439475896012, 'subsample': 0.9725770631955593, 'colsample_bytree': 0.7441354428951535, 'max_depth': 3, 'min_child_weight': 7, 'eta': 0.1700212333797048, 'gamma': 2.600515692024496, 'rate_drop': 0.036101990421201574, 'skip_drop': 6.154218666014145e-08}. Best is trial 137 with value: -1.165362986830467.
[I 2025-06-22 08:29:06,092] Trial 321 finished with value: -1.2216584657109122 and parameters: {'booster': 'dart', 'lambda': 4.303161741108536, 'alpha': 0.8038550360238761, 'subsample': 0.9640157041445262, 'colsample_bytree': 0.838208282184977, 'max_depth': 3, 'min_child_weight': 7, 'eta': 0.13021379854289525, 'gamma': 2.452186163723316, 'rate_drop': 0.06216192944825113, 'skip_drop': 1.3830312374888434e-07}. Best is trial 137 with value: -1.165362986830467.
[I 2025-06-22 08:29:08,998] Trial 322 finished with value: -1.2810042500725716 and parameters: {'booster': 'dart', 'lambda': 2.6124548571814086, 'alpha': 1.2141505034887072, 'subsample': 0.9012114689167898, 'colsample_bytree': 0.7583131055703709, 'max_depth': 3, 'min_child_weight': 7, 'eta': 0.2405232971897529, 'gamma': 1.0378413616223099, 'rate_drop': 0.20765897231334848, 'skip_drop': 0.0001330315363277238}. Best is trial 137 with value: -1.165362986830467.
[I 2025-06-22 08:29:11,202] Trial 323 finished with value: -1.232886626169466 and parameters: {'booster': 'dart', 'lambda': 5.936380820984662, 'alpha': 2.6206464626757824, 'subsample': 0.9994191871382693, 'colsample_bytree': 0.7313242032143499, 'max_depth': 3, 'min_child_weight': 8, 'eta': 0.07808964458262953, 'gamma': 3.011015994490088, 'rate_drop': 1.4381040086204247e-06, 'skip_drop': 0.002766414526032021}. Best is trial 137 with value: -1.165362986830467.
[I 2025-06-22 08:29:12,734] Trial 324 finished with value: -1.241924406997983 and parameters: {'booster': 'dart', 'lambda': 1.2989520400417733, 'alpha': 4.2687789963899247e-07, 'subsample': 0.8757743323371335, 'colsample_bytree': 0.7728644220031804, 'max_depth': 3, 'min_child_weight': 7, 'eta': 0.2047129273496665, 'gamma': 0.7928012979420729, 'rate_drop': 0.010710698055407643, 'skip_drop': 1.8036720636972318e-08}. Best is trial 137 with value: -1.165362986830467.
[I 2025-06-22 08:29:21,349] Trial 325 finished with value: -1.3152741340313565 and parameters: {'booster': 'dart', 'lambda': 1.9276805306545652, 'alpha': 4.145253291760504, 'subsample': 0.8864705869013193, 'colsample_bytree': 0.7137109206259925, 'max_depth': 3, 'min_child_weight': 7, 'eta': 0.014056507833601465, 'gamma': 3.2581732915339217, 'rate_drop': 0.002519835704840463, 'skip_drop': 3.2818700523836814e-08}. Best is trial 137 with value: -1.165362986830467.
[I 2025-06-22 08:29:23,038] Trial 326 finished with value: -1.2074042909202787 and parameters: {'booster': 'dart', 'lambda': 3.5617371390674113, 'alpha': 1.8406103971140388, 'subsample': 0.9282750913901548, 'colsample_bytree': 0.6869002523086561, 'max_depth': 3, 'min_child_weight': 6, 'eta': 0.14691521556897655, 'gamma': 1.2623704189516218, 'rate_drop': 0.00044460000227355105, 'skip_drop': 4.3052568162490145e-08}. Best is trial 137 with value: -1.165362986830467.
[I 2025-06-22 08:29:23,221] Trial 327 finished with value: -1.2993059548591954 and parameters: {'booster': 'gbtree', 'lambda': 0.3672754945629825, 'alpha': 0.0032537768738107584, 'subsample': 0.9752661191497136, 'colsample_bytree': 0.7546654542408205, 'max_depth': 6, 'min_child_weight': 7, 'eta': 0.27944175273905264, 'gamma': 2.7828008595819216}. Best is trial 137 with value: -1.165362986830467.
[I 2025-06-22 08:29:25,555] Trial 328 finished with value: -1.2194209150213895 and parameters: {'booster': 'dart', 'lambda': 1.0670121792832592, 'alpha': 0.6444263826250716, 'subsample': 0.9418774112991125, 'colsample_bytree': 0.7404732104173134, 'max_depth': 3, 'min_child_weight': 7, 'eta': 0.09671101978564674, 'gamma': 2.907611101557131, 'rate_drop': 9.18230948741228e-08, 'skip_drop': 7.754675312366607e-08}. Best is trial 137 with value: -1.165362986830467.
[I 2025-06-22 08:29:27,289] Trial 329 finished with value: -1.244766961699827 and parameters: {'booster': 'dart', 'lambda': 3.674929228871157e-05, 'alpha': 1.2938867198371446, 'subsample': 0.7936592951642466, 'colsample_bytree': 0.7695018656707554, 'max_depth': 3, 'min_child_weight': 7, 'eta': 0.18453619788461725, 'gamma': 1.4065836890664025, 'rate_drop': 2.6726545962883287e-08, 'skip_drop': 3.703525496788937e-07}. Best is trial 137 with value: -1.165362986830467.
[I 2025-06-22 08:29:29,132] Trial 330 finished with value: -1.2388094645043033 and parameters: {'booster': 'dart', 'lambda': 6.655160807204931, 'alpha': 7.437422227483313, 'subsample': 0.9108067484344575, 'colsample_bytree': 0.7824643897893055, 'max_depth': 3, 'min_child_weight': 8, 'eta': 0.1191284100197694, 'gamma': 2.338316785648833, 'rate_drop': 6.79600146079525e-08, 'skip_drop': 2.960335187262224e-08}. Best is trial 137 with value: -1.165362986830467.
