[I 2025-06-22 08:33:05,701] Trial 425 finished with value: -1.639219262270866 and parameters: {'booster': 'dart', 'lambda': 4.368468654244529, 'alpha': 4.554833416548031, 'subsample': 0.9726810360321636, 'colsample_bytree': 0.7718211127628558, 'max_depth': 3, 'min_child_weight': 7, 'eta': 0.001228592414413881, 'gamma': 3.955291916996358, 'rate_drop': 4.49185488385001e-08, 'skip_drop': 2.6345967605305708e-08}. Best is trial 137 with value: -1.165362986830467.
[I 2025-06-22 08:33:06,367] Trial 426 finished with value: -1.2228671736186956 and parameters: {'booster': 'dart', 'lambda': 0.0031109564069332673, 'alpha': 2.9611862193337815, 'subsample': 0.9607226007629749, 'colsample_bytree': 0.8036552158783139, 'max_depth': 3, 'min_child_weight': 7, 'eta': 0.21924900123825675, 'gamma': 2.928020591879218, 'rate_drop': 0.0015446616834859873, 'skip_drop': 1.7235003297838173e-07}. Best is trial 137 with value: -1.165362986830467.
[I 2025-06-22 08:33:06,884] Trial 427 finished with value: -1.2128640963145523 and parameters: {'booster': 'dart', 'lambda': 2.0078563630817365, 'alpha': 2.064657814110021, 'subsample': 0.944364639585196, 'colsample_bytree': 0.7171933890013811, 'max_depth': 4, 'min_child_weight': 7, 'eta': 0.2454500655875091, 'gamma': 2.2610761178835497, 'rate_drop': 1.9717518277928848e-08, 'skip_drop': 9.447136752792752e-08}. Best is trial 137 with value: -1.165362986830467.
[I 2025-06-22 08:33:07,957] Trial 428 finished with value: -1.1998460915843039 and parameters: {'booster': 'dart', 'lambda': 0.015311109982866961, 'alpha': 6.596814149629975, 'subsample': 0.9138822877608919, 'colsample_bytree': 0.8161839642554166, 'max_depth': 3, 'min_child_weight': 6, 'eta': 0.1976931475782959, 'gamma': 3.2172060618122087, 'rate_drop': 0.00034247950103599153, 'skip_drop': 5.5097036983756895e-08}. Best is trial 137 with value: -1.165362986830467.
[I 2025-06-22 08:33:15,445] Trial 429 finished with value: -1.3519807550452831 and parameters: {'booster': 'dart', 'lambda': 0.1583993680087226, 'alpha': 1.303889360082439, 'subsample': 0.98367915450902, 'colsample_bytree': 0.7359347691161389, 'max_depth': 3, 'min_child_weight': 7, 'eta': 0.13552423481947168, 'gamma': 1.7937231882840892, 'rate_drop': 0.28549930122948913, 'skip_drop': 3.9250506587279084e-08}. Best is trial 137 with value: -1.165362986830467.
[I 2025-06-22 08:33:22,123] Trial 430 finished with value: -1.252107056266295 and parameters: {'booster': 'dart', 'lambda': 0.5306847510883207, 'alpha': 0.7814478760732477, 'subsample': 0.9694231846692477, 'colsample_bytree': 0.7584186899609595, 'max_depth': 3, 'min_child_weight': 8, 'eta': 0.06654784506461957, 'gamma': 2.745747184117635, 'rate_drop': 3.3058071286186225e-08, 'skip_drop': 1.3867174692722703e-07}. Best is trial 137 with value: -1.165362986830467.
[I 2025-06-22 08:33:23,016] Trial 431 finished with value: -1.2061364565386203 and parameters: {'booster': 'dart', 'lambda': 3.300675618884851, 'alpha': 1.3434444392761157e-06, 'subsample': 0.9546844514490495, 'colsample_bytree': 0.9222788562362167, 'max_depth': 3, 'min_child_weight': 7, 'eta': 0.1611493669106515, 'gamma': 2.6135826730105065, 'rate_drop': 1.034451142382135e-06, 'skip_drop': 2.521997532540672e-07}. Best is trial 137 with value: -1.165362986830467.
[I 2025-06-22 08:33:23,922] Trial 432 finished with value: -1.206958754730659 and parameters: {'booster': 'dart', 'lambda': 1.3731653656551976, 'alpha': 3.3869125792937017e-08, 'subsample': 0.9385685649715005, 'colsample_bytree': 0.6988605782472065, 'max_depth': 3, 'min_child_weight': 6, 'eta': 0.1806528712999769, 'gamma': 2.0429850133994476, 'rate_drop': 2.482533844362881e-06, 'skip_drop': 2.361502309372893e-08}. Best is trial 137 with value: -1.165362986830467.
[I 2025-06-22 08:33:25,345] Trial 433 finished with value: -1.213447958865103 and parameters: {'booster': 'dart', 'lambda': 2.256121968840959, 'alpha': 0.006769941833643861, 'subsample': 0.9625766902149688, 'colsample_bytree': 0.7511586211279063, 'max_depth': 3, 'min_child_weight': 7, 'eta': 0.29715321280965995, 'gamma': 1.2470406906495861, 'rate_drop': 1.4371783174805958e-08, 'skip_drop': 7.127669280849649e-08}. Best is trial 137 with value: -1.165362986830467.
[I 2025-06-22 08:33:26,577] Trial 434 finished with value: -1.2520822138069407 and parameters: {'booster': 'dart', 'lambda': 1.1033019358415677, 'alpha': 0.0006109516348714511, 'subsample': 0.9901278867420564, 'colsample_bytree': 0.7887189141069142, 'max_depth': 3, 'min_child_weight': 7, 'eta': 0.2085240464166158, 'gamma': 0.5078456777798698, 'rate_drop': 1.0387202026444521e-08, 'skip_drop': 0.41963547231157045}. Best is trial 137 with value: -1.165362986830467.
[I 2025-06-22 08:33:29,254] Trial 435 finished with value: -1.2028392498260232 and parameters: {'booster': 'dart', 'lambda': 6.241820621772568, 'alpha': 3.9332575727992483, 'subsample': 0.9731985773885541, 'colsample_bytree': 0.6903360541939543, 'max_depth': 3, 'min_child_weight': 7, 'eta': 0.2389154099285438, 'gamma': 2.4764478951213906, 'rate_drop': 2.699067566458859e-08, 'skip_drop': 3.232976837565563e-07}. Best is trial 137 with value: -1.165362986830467.
[I 2025-06-22 08:33:30,406] Trial 436 finished with value: -1.257970700995337 and parameters: {'booster': 'dart', 'lambda': 3.8836178398738617, 'alpha': 2.003099396093937, 'subsample': 0.7845400588215458, 'colsample_bytree': 0.7748409906541147, 'max_depth': 6, 'min_child_weight': 7, 'eta': 0.12823956241600326, 'gamma': 2.7847941981418165, 'rate_drop': 1.6169129620414158e-06, 'skip_drop': 4.0297291610877564e-08}. Best is trial 137 with value: -1.165362986830467.
[I 2025-06-22 08:33:38,946] Trial 437 finished with value: -1.2129184930164445 and parameters: {'booster': 'dart', 'lambda': 1.79344712620447e-08, 'alpha': 5.222664361630161, 'subsample': 0.9488419690868238, 'colsample_bytree': 0.7409530572835635, 'max_depth': 3, 'min_child_weight': 6, 'eta': 0.04524446989571708, 'gamma': 3.1303063937085778, 'rate_drop': 4.57367352908415e-08, 'skip_drop': 1.1329686637066146e-07}. Best is trial 137 with value: -1.165362986830467.
[I 2025-06-22 08:33:39,480] Trial 438 finished with value: -1.2628686725490377 and parameters: {'booster': 'dart', 'lambda': 0.25327253916907394, 'alpha': 3.918379550345003e-06, 'subsample': 0.9296502806242148, 'colsample_bytree': 0.7976493850370031, 'max_depth': 3, 'min_child_weight': 7, 'eta': 0.262100254114699, 'gamma': 1.1219860560160915, 'rate_drop': 8.824272678594789e-06, 'skip_drop': 0.01264278308347895}. Best is trial 137 with value: -1.165362986830467.
[I 2025-06-22 08:33:43,401] Trial 439 finished with value: -1.2566481797633562 and parameters: {'booster': 'dart', 'lambda': 0.423065380692085, 'alpha': 9.99399954264606, 'subsample': 0.980109966725066, 'colsample_bytree': 0.7265210553847643, 'max_depth': 3, 'min_child_weight': 2, 'eta': 0.14992359099712332, 'gamma': 2.6982301670238025, 'rate_drop': 5.554828938836306e-08, 'skip_drop': 6.232850377710218e-07}. Best is trial 137 with value: -1.165362986830467.
[I 2025-06-22 08:33:44,287] Trial 440 finished with value: -1.244904412710003 and parameters: {'booster': 'dart', 'lambda': 0.8169249475616001, 'alpha': 0.05416615070510841, 'subsample': 0.9627250234839433, 'colsample_bytree': 0.7129365575236487, 'max_depth': 3, 'min_child_weight': 7, 'eta': 0.16915836895836744, 'gamma': 2.9551644956287775, 'rate_drop': 2.340950906721583e-08, 'skip_drop': 1.8804872060326886e-07}. Best is trial 137 with value: -1.165362986830467.
[I 2025-06-22 08:33:46,180] Trial 441 finished with value: -1.241813821391561 and parameters: {'booster': 'dart', 'lambda': 1.8306626354653879, 'alpha': 0.022375284343001435, 'subsample': 0.8133084682578321, 'colsample_bytree': 0.7677966803777797, 'max_depth': 4, 'min_child_weight': 5, 'eta': 0.07747723975297459, 'gamma': 1.3386597522274477, 'rate_drop': 3.211933900628039e-08, 'skip_drop': 7.706514582517064e-08}. Best is trial 137 with value: -1.165362986830467.
[I 2025-06-22 08:33:47,673] Trial 442 finished with value: -1.2317167247553067 and parameters: {'booster': 'dart', 'lambda': 2.6886229060891615, 'alpha': 0.0014962287688871953, 'subsample': 0.9201474716999398, 'colsample_bytree': 0.6823241784354397, 'max_depth': 3, 'min_child_weight': 8, 'eta': 0.23037472586852564, 'gamma': 2.5223154390953195, 'rate_drop': 5.998545265995524e-06, 'skip_drop': 2.6753666968952853e-08}. Best is trial 137 with value: -1.165362986830467.
[I 2025-06-22 08:33:47,858] Trial 443 finished with value: -1.236798771522112 and parameters: {'booster': 'gbtree', 'lambda': 4.1770707381158285, 'alpha': 2.9273888476694485, 'subsample': 0.997551260175886, 'colsample_bytree': 0.8095608579013966, 'max_depth': 3, 'min_child_weight': 7, 'eta': 0.09359772029393908, 'gamma': 2.840888949453673}. Best is trial 137 with value: -1.165362986830467.
[I 2025-06-22 08:33:49,303] Trial 444 finished with value: -1.2003637068456225 and parameters: {'booster': 'dart', 'lambda': 1.122408617054597, 'alpha': 1.440092408727581, 'subsample': 0.9732236807283735, 'colsample_bytree': 0.8366237379302486, 'max_depth': 3, 'min_child_weight': 7, 'eta': 0.1958759538354686, 'gamma': 2.400380329546358, 'rate_drop': 1.7387153316414552e-08, 'skip_drop': 4.3240998928318314e-08}. Best is trial 137 with value: -1.165362986830467.
[I 2025-06-22 08:33:53,367] Trial 445 finished with value: -1.2221325800487914 and parameters: {'booster': 'dart', 'lambda': 6.290058479555234, 'alpha': 0.9562191129355765, 'subsample': 0.9547295101877638, 'colsample_bytree': 0.8230535917540553, 'max_depth': 3, 'min_child_weight': 6, 'eta': 0.2144250742925117, 'gamma': 2.640175573659763, 'rate_drop': 6.74707156832305e-08, 'skip_drop': 5.894694724188351e-08}. Best is trial 137 with value: -1.165362986830467.
[I 2025-06-22 08:34:01,895] Trial 446 finished with value: -1.55483254887141 and parameters: {'booster': 'dart', 'lambda': 1.5448272625595545, 'alpha': 3.9715540564697687, 'subsample': 0.940632044149547, 'colsample_bytree': 0.7808765381599047, 'max_depth': 3, 'min_child_weight': 7, 'eta': 0.004033260380283763, 'gamma': 1.2378291906732866, 'rate_drop': 0.017457698156131105, 'skip_drop': 2.016284142933422e-08}. Best is trial 137 with value: -1.165362986830467.
[I 2025-06-22 08:34:03,031] Trial 447 finished with value: -1.2086508659119308 and parameters: {'booster': 'dart', 'lambda': 0.6311140722615566, 'alpha': 0.561290212881797, 'subsample': 0.9868910263858041, 'colsample_bytree': 0.7571658821491574, 'max_depth': 3, 'min_child_weight': 7, 'eta': 0.17710826896782197, 'gamma': 0.9148596497441048, 'rate_drop': 3.743439908064436e-06, 'skip_drop': 4.450312194108468e-07}. Best is trial 137 with value: -1.165362986830467.
[I 2025-06-22 08:34:03,475] Trial 448 finished with value: -1.2226519588682971 and parameters: {'booster': 'dart', 'lambda': 2.7013036635258945, 'alpha': 2.45240914702099, 'subsample': 0.9644114980288144, 'colsample_bytree': 0.7066368690405, 'max_depth': 3, 'min_child_weight': 7, 'eta': 0.2677099087050508, 'gamma': 2.3045704313974547, 'rate_drop': 3.7084575866131824e-08, 'skip_drop': 1.466532387014586e-07}. Best is trial 137 with value: -1.165362986830467.
[I 2025-06-22 08:34:06,804] Trial 449 finished with value: -1.263103876973478 and parameters: {'booster': 'dart', 'lambda': 9.433573855109692, 'alpha': 6.245785706572991, 'subsample': 0.9538375907324661, 'colsample_bytree': 0.7326527313683756, 'max_depth': 3, 'min_child_weight': 8, 'eta': 0.14279001920505516, 'gamma': 4.143403830114302, 'rate_drop': 1.4524241382965008e-08, 'skip_drop': 2.6301370892759677e-07}. Best is trial 137 with value: -1.165362986830467.
[I 2025-06-22 08:34:07,953] Trial 450 finished with value: -1.207328196482068 and parameters: {'booster': 'dart', 'lambda': 1.9646208721442748, 'alpha': 1.603118272125295, 'subsample': 0.9084532894589, 'colsample_bytree': 0.7482626426403667, 'max_depth': 3, 'min_child_weight': 6, 'eta': 0.10560456607035269, 'gamma': 1.0712530301211591, 'rate_drop': 2.4117604296840742e-06, 'skip_drop': 9.62114105020628e-08}. Best is trial 137 with value: -1.165362986830467.
[I 2025-06-22 08:34:09,663] Trial 451 finished with value: -1.2152023253694875 and parameters: {'booster': 'dart', 'lambda': 3.4211946801876767, 'alpha': 3.0380656673667836, 'subsample': 0.9770289532997424, 'colsample_bytree': 0.6900215069905918, 'max_depth': 3, 'min_child_weight': 7, 'eta': 0.13063690866462768, 'gamma': 1.1776807348206466, 'rate_drop': 2.0950681636267262e-08, 'skip_drop': 3.503071748268861e-08}. Best is trial 137 with value: -1.165362986830467.
[I 2025-06-22 08:34:11,041] Trial 452 finished with value: -1.2541819889175954 and parameters: {'booster': 'dart', 'lambda': 0.1305240659946095, 'alpha': 8.892280735973294e-06, 'subsample': 0.9999720846287553, 'colsample_bytree': 0.796434630562211, 'max_depth': 3, 'min_child_weight': 7, 'eta': 0.1571075622869349, 'gamma': 1.5214157106413828, 'rate_drop': 8.265460246226453e-07, 'skip_drop': 7.023560050207003e-08}. Best is trial 137 with value: -1.165362986830467.
[I 2025-06-22 08:34:11,853] Trial 453 finished with value: -1.220885592522997 and parameters: {'booster': 'dart', 'lambda': 0.3800641326978807, 'alpha': 1.2802758099754623, 'subsample': 0.9277316470833237, 'colsample_bytree': 0.7191980946900065, 'max_depth': 3, 'min_child_weight': 7, 'eta': 0.23892370685000078, 'gamma': 1.4395566273503348, 'rate_drop': 2.9073893262049526e-08, 'skip_drop': 1.8692696935638298e-07}. Best is trial 137 with value: -1.165362986830467.
[I 2025-06-22 08:34:13,272] Trial 454 finished with value: -1.2041080527280843 and parameters: {'booster': 'dart', 'lambda': 0.001368194835617912, 'alpha': 4.947231137360572, 'subsample': 0.9655219692917356, 'colsample_bytree': 0.6981260446906877, 'max_depth': 3, 'min_child_weight': 7, 'eta': 0.19220782513757617, 'gamma': 3.0514588314967193, 'rate_drop': 8.447624865044798e-08, 'skip_drop': 8.633160871228407e-06}. Best is trial 137 with value: -1.165362986830467.
[I 2025-06-22 08:34:14,651] Trial 455 finished with value: -1.2038422190884883 and parameters: {'booster': 'dart', 'lambda': 0.8969723003107668, 'alpha': 2.6721017377268848e-05, 'subsample': 0.9407035140108632, 'colsample_bytree': 0.7664870139770854, 'max_depth': 3, 'min_child_weight': 7, 'eta': 0.21052489432391297, 'gamma': 2.2003805625325477, 'rate_drop': 4.65561473817599e-08, 'skip_drop': 3.121014466141197e-06}. Best is trial 137 with value: -1.165362986830467.
[I 2025-06-22 08:34:17,855] Trial 456 finished with value: -1.2166924169901367 and parameters: {'booster': 'dart', 'lambda': 0.08001897592419344, 'alpha': 2.0336380967373473, 'subsample': 0.9838599389161193, 'colsample_bytree': 0.8080354041666927, 'max_depth': 3, 'min_child_weight': 8, 'eta': 0.11849836680516633, 'gamma': 2.570468723267114, 'rate_drop': 1.3600465888641319e-08, 'skip_drop': 0.0015154746853995457}. Best is trial 137 with value: -1.165362986830467.
[I 2025-06-22 08:34:18,309] Trial 457 finished with value: -1.244630665430628 and parameters: {'booster': 'dart', 'lambda': 5.069497980626671, 'alpha': 9.36972766090062e-05, 'subsample': 0.9498251662429932, 'colsample_bytree': 0.7837611474138467, 'max_depth': 3, 'min_child_weight': 6, 'eta': 0.29914230488727345, 'gamma': 2.433832039003182, 'rate_drop': 1.986786823009304e-05, 'skip_drop': 1.1629692788064845e-07}. Best is trial 137 with value: -1.165362986830467.
[I 2025-06-22 08:34:22,124] Trial 458 finished with value: -1.220237868563743 and parameters: {'booster': 'dart', 'lambda': 0.0004936409564475897, 'alpha': 1.1731891209811803e-07, 'subsample': 0.971926818347106, 'colsample_bytree': 0.7386601769946665, 'max_depth': 3, 'min_child_weight': 7, 'eta': 0.17693426169433413, 'gamma': 2.7544925466256385, 'rate_drop': 2.2897762226575266e-08, 'skip_drop': 5.231774236129193e-08}. Best is trial 137 with value: -1.165362986830467.
[I 2025-06-22 08:34:22,479] Trial 459 finished with value: -1.3136782406709524 and parameters: {'booster': 'dart', 'lambda': 0.23090764047086682, 'alpha': 0.9921754232162379, 'subsample': 0.9581624029056222, 'colsample_bytree': 0.7576306530227639, 'max_depth': 5, 'min_child_weight': 7, 'eta': 0.26449623713159487, 'gamma': 2.919090752594575, 'rate_drop': 1.4540701423540632e-06, 'skip_drop': 1.87563935768174e-08}. Best is trial 137 with value: -1.165362986830467.
[I 2025-06-22 08:34:23,729] Trial 460 finished with value: -1.192121114088275 and parameters: {'booster': 'dart', 'lambda': 1.4462968537141756, 'alpha': 3.630525201713199, 'subsample': 0.9804122300333563, 'colsample_bytree': 0.7914286433265552, 'max_depth': 3, 'min_child_weight': 7, 'eta': 0.15821947471766196, 'gamma': 2.6522368652560213, 'rate_drop': 1.0225209629885483e-08, 'skip_drop': 2.8435593315665883e-08}. Best is trial 137 with value: -1.165362986830467.
[I 2025-06-22 08:34:26,412] Trial 461 finished with value: -1.2263852227364476 and parameters: {'booster': 'dart', 'lambda': 0.5728471988327088, 'alpha': 6.417869926088482, 'subsample': 0.9785296127810863, 'colsample_bytree': 0.7970252622270299, 'max_depth': 3, 'min_child_weight': 7, 'eta': 0.14006529976896698, 'gamma': 2.664202807577431, 'rate_drop': 1.0423355330748283e-08, 'skip_drop': 2.924976469333233e-08}. Best is trial 137 with value: -1.165362986830467.
[I 2025-06-22 08:34:27,929] Trial 462 finished with value: -1.2005984008221193 and parameters: {'booster': 'dart', 'lambda': 1.6067874487263665, 'alpha': 3.9961210565120235, 'subsample': 0.9187271548805316, 'colsample_bytree': 0.7881623826558081, 'max_depth': 3, 'min_child_weight': 7, 'eta': 0.15737618781534862, 'gamma': 2.557910474507866, 'rate_drop': 1.3873119593901301e-08, 'skip_drop': 2.570549257381655e-08}. Best is trial 137 with value: -1.165362986830467.
[I 2025-06-22 08:34:28,102] Trial 463 finished with value: -1.2648253599322243 and parameters: {'booster': 'gbtree', 'lambda': 1.0494507938391653, 'alpha': 2.835663007572298, 'subsample': 0.9830107668289001, 'colsample_bytree': 0.774622671478281, 'max_depth': 4, 'min_child_weight': 6, 'eta': 0.12736880911034557, 'gamma': 2.810365235144241}. Best is trial 137 with value: -1.165362986830467.
[I 2025-06-22 08:34:29,926] Trial 464 finished with value: -1.2127469391367964 and parameters: {'booster': 'dart', 'lambda': 0.781866018485032, 'alpha': 4.169134758830266, 'subsample': 0.7640424280522496, 'colsample_bytree': 0.8012844106150436, 'max_depth': 3, 'min_child_weight': 7, 'eta': 0.10582548167253113, 'gamma': 2.5208480902225383, 'rate_drop': 1.027634286530138e-08, 'skip_drop': 1.4245422143376628e-08}. Best is trial 137 with value: -1.165362986830467.
[I 2025-06-22 08:34:30,867] Trial 465 finished with value: -1.2138213543136063 and parameters: {'booster': 'dart', 'lambda': 1.3025931540534545e-06, 'alpha': 2.521550104316573, 'subsample': 0.9941613332778018, 'colsample_bytree': 0.7880516091724808, 'max_depth': 3, 'min_child_weight': 8, 'eta': 0.15110566647113746, 'gamma': 2.6442779144421054, 'rate_drop': 1.9335293355390806e-08, 'skip_drop': 1.0249092962903874e-08}. Best is trial 137 with value: -1.165362986830467.
[I 2025-06-22 08:34:33,512] Trial 466 finished with value: -1.2283953874669968 and parameters: {'booster': 'dart', 'lambda': 0.004192743799609928, 'alpha': 5.989934344107134, 'subsample': 0.9343101266843695, 'colsample_bytree': 0.8209916557040452, 'max_depth': 3, 'min_child_weight': 7, 'eta': 0.08834660821378423, 'gamma': 2.7345769103464446, 'rate_drop': 1.773281111716478e-08, 'skip_drop': 3.921134278075508e-08}. Best is trial 137 with value: -1.165362986830467.
[I 2025-06-22 08:34:35,007] Trial 467 finished with value: -1.1945159342305038 and parameters: {'booster': 'dart', 'lambda': 1.3033777562372693, 'alpha': 3.648777095992781, 'subsample': 0.9031550809531632, 'colsample_bytree': 0.779563738359603, 'max_depth': 3, 'min_child_weight': 9, 'eta': 0.11354877692385748, 'gamma': 2.4767917908057573, 'rate_drop': 3.450718190526759e-08, 'skip_drop': 2.0252513974187356e-08}. Best is trial 137 with value: -1.165362986830467.
[I 2025-06-22 08:34:36,947] Trial 468 finished with value: -1.2283506599230987 and parameters: {'booster': 'dart', 'lambda': 4.0032812545064323e-08, 'alpha': 7.8568851043801144, 'subsample': 0.9107531403352225, 'colsample_bytree': 0.7757074590348909, 'max_depth': 3, 'min_child_weight': 9, 'eta': 0.09300599050336232, 'gamma': 2.670407794054599, 'rate_drop': 3.637601967891062e-08, 'skip_drop': 2.1148351910697404e-08}. Best is trial 137 with value: -1.165362986830467.
[I 2025-06-22 08:34:38,481] Trial 469 finished with value: -1.223718203462014 and parameters: {'booster': 'dart', 'lambda': 0.4536328786276753, 'alpha': 3.8812362713718795, 'subsample': 0.9179563488925179, 'colsample_bytree': 0.7810680498346387, 'max_depth': 3, 'min_child_weight': 8, 'eta': 0.10765848988886087, 'gamma': 2.4685833378804944, 'rate_drop': 1.0019997241391888e-08, 'skip_drop': 1.6009652363881017e-08}. Best is trial 137 with value: -1.165362986830467.
[I 2025-06-22 08:34:39,983] Trial 470 finished with value: -1.2016659357611141 and parameters: {'booster': 'dart', 'lambda': 1.0285539673800248, 'alpha': 4.209820080758825, 'subsample': 0.9021052807986213, 'colsample_bytree': 0.7659119050922569, 'max_depth': 3, 'min_child_weight': 8, 'eta': 0.11969574670526352, 'gamma': 2.8580581824260354, 'rate_drop': 5.961118254797378e-08, 'skip_drop': 2.720287926553344e-08}. Best is trial 137 with value: -1.165362986830467.
[I 2025-06-22 08:34:41,890] Trial 471 finished with value: -1.226933952000346 and parameters: {'booster': 'dart', 'lambda': 2.661716010962518, 'alpha': 7.499616031321032, 'subsample': 0.8994516470428768, 'colsample_bytree': 0.8079208730487333, 'max_depth': 3, 'min_child_weight': 10, 'eta': 0.09831526537191694, 'gamma': 2.6345175267598218, 'rate_drop': 2.8078012817707302e-08, 'skip_drop': 3.4600462651584436e-08}. Best is trial 137 with value: -1.165362986830467.
