[I 2025-06-22 08:23:29,362] Trial 143 finished with value: -1.193615503042566 and parameters: {'booster': 'dart', 'lambda': 0.16636955907550485, 'alpha': 1.8950751083180204, 'subsample': 0.921433736432116, 'colsample_bytree': 0.801546153514024, 'max_depth': 3, 'min_child_weight': 7, 'eta': 0.20564375090453751, 'gamma': 2.6062030457889507, 'rate_drop': 2.9510754891878673e-08, 'skip_drop': 1.351826435793173e-07}. Best is trial 137 with value: -1.165362986830467.
[I 2025-06-22 08:23:30,482] Trial 144 finished with value: -1.2006468570087967 and parameters: {'booster': 'dart', 'lambda': 2.4325038416012457, 'alpha': 1.8162353831105125, 'subsample': 0.9236479512515794, 'colsample_bytree': 0.8179231725272585, 'max_depth': 3, 'min_child_weight': 7, 'eta': 0.1985841075755054, 'gamma': 2.641515521919656, 'rate_drop': 2.4607766854090068e-08, 'skip_drop': 1.3599582259425697e-07}. Best is trial 137 with value: -1.165362986830467.
[I 2025-06-22 08:23:30,926] Trial 145 finished with value: -1.2319208685911789 and parameters: {'booster': 'dart', 'lambda': 2.474703190008977, 'alpha': 0.7455612427960346, 'subsample': 0.7810510241664596, 'colsample_bytree': 0.8277495986126927, 'max_depth': 3, 'min_child_weight': 7, 'eta': 0.2998265267434115, 'gamma': 2.593492603564794, 'rate_drop': 2.7591264790537263e-08, 'skip_drop': 1.2797721879215356e-07}. Best is trial 137 with value: -1.165362986830467.
[I 2025-06-22 08:23:32,864] Trial 146 finished with value: -1.2165212714535347 and parameters: {'booster': 'dart', 'lambda': 6.452671291339783, 'alpha': 1.1462042161386474, 'subsample': 0.9207535511529777, 'colsample_bytree': 0.7979409149923791, 'max_depth': 3, 'min_child_weight': 7, 'eta': 0.20766581890757083, 'gamma': 2.926191377660162, 'rate_drop': 3.1216638317147404e-08, 'skip_drop': 6.835050932519365e-08}. Best is trial 137 with value: -1.165362986830467.
[I 2025-06-22 08:23:34,713] Trial 147 finished with value: -1.190350320567749 and parameters: {'booster': 'dart', 'lambda': 3.377717952131278, 'alpha': 1.758075086428176, 'subsample': 0.932098766505988, 'colsample_bytree': 0.802855326412178, 'max_depth': 3, 'min_child_weight': 8, 'eta': 0.2532394224507414, 'gamma': 2.7708651461278317, 'rate_drop': 1.1326684334214271e-08, 'skip_drop': 9.818929032346186e-08}. Best is trial 137 with value: -1.165362986830467.
[I 2025-06-22 08:23:36,676] Trial 148 finished with value: -1.2060134713065036 and parameters: {'booster': 'dart', 'lambda': 3.7151446561507875, 'alpha': 1.7065260562621176, 'subsample': 0.9341765758898857, 'colsample_bytree': 0.8200541606917965, 'max_depth': 3, 'min_child_weight': 8, 'eta': 0.2585211802398245, 'gamma': 2.6889502361196707, 'rate_drop': 1.378164990695294e-08, 'skip_drop': 2.450979972166482e-07}. Best is trial 137 with value: -1.165362986830467.
[I 2025-06-22 08:23:37,126] Trial 149 finished with value: -1.224239655599301 and parameters: {'booster': 'dart', 'lambda': 1.8011099089425036, 'alpha': 0.447218522405702, 'subsample': 0.9496245071530435, 'colsample_bytree': 0.8087978052691273, 'max_depth': 3, 'min_child_weight': 8, 'eta': 0.22771883730694034, 'gamma': 2.4475902799690283, 'rate_drop': 3.93429985304888e-08, 'skip_drop': 1.4515390078215153e-07}. Best is trial 137 with value: -1.165362986830467.
[I 2025-06-22 08:23:37,619] Trial 150 finished with value: -1.244247996060286 and parameters: {'booster': 'dart', 'lambda': 5.065340092714701, 'alpha': 2.02780983721136, 'subsample': 0.9239429810586582, 'colsample_bytree': 0.7853424053370186, 'max_depth': 3, 'min_child_weight': 6, 'eta': 0.26782593858068976, 'gamma': 2.6770526379909514, 'rate_drop': 6.512166589043454e-08, 'skip_drop': 9.387686535275367e-08}. Best is trial 137 with value: -1.165362986830467.
[I 2025-06-22 08:23:39,020] Trial 151 finished with value: -1.205413121939761 and parameters: {'booster': 'dart', 'lambda': 2.497772057569632, 'alpha': 2.657625969576997, 'subsample': 0.9143489590770912, 'colsample_bytree': 0.8046926464898692, 'max_depth': 3, 'min_child_weight': 7, 'eta': 0.20053946695651834, 'gamma': 2.5434933883665134, 'rate_drop': 1.2904313147559801e-08, 'skip_drop': 5.3603578928556466e-08}. Best is trial 137 with value: -1.165362986830467.
[I 2025-06-22 08:23:39,536] Trial 152 finished with value: -1.2318516271689715 and parameters: {'booster': 'dart', 'lambda': 0.5242381047809667, 'alpha': 1.1965330196737112, 'subsample': 0.9358423098582156, 'colsample_bytree': 0.7799402975432542, 'max_depth': 3, 'min_child_weight': 7, 'eta': 0.24133481866970255, 'gamma': 2.312663508160255, 'rate_drop': 2.1113830276717893e-08, 'skip_drop': 9.804561745537385e-08}. Best is trial 137 with value: -1.165362986830467.
[I 2025-06-22 08:23:40,981] Trial 153 finished with value: -1.1998163866177438 and parameters: {'booster': 'dart', 'lambda': 1.0611143650883323, 'alpha': 0.6387375384071872, 'subsample': 0.9637409053199005, 'colsample_bytree': 0.7732033466635018, 'max_depth': 3, 'min_child_weight': 7, 'eta': 0.18013831158988597, 'gamma': 2.8110377370054485, 'rate_drop': 4.670964094588894e-08, 'skip_drop': 1.46454204597214e-07}. Best is trial 137 with value: -1.165362986830467.
[I 2025-06-22 08:23:41,130] Trial 154 finished with value: -1.272412029342319 and parameters: {'booster': 'gbtree', 'lambda': 1.3433845971005047, 'alpha': 0.21687467871865293, 'subsample': 0.9686399637371633, 'colsample_bytree': 0.7710370614000013, 'max_depth': 3, 'min_child_weight': 8, 'eta': 0.1769635984677642, 'gamma': 3.1375197718262258}. Best is trial 137 with value: -1.165362986830467.
[I 2025-06-22 08:23:41,643] Trial 155 finished with value: -1.2296370156345537 and parameters: {'booster': 'dart', 'lambda': 3.627006939412348, 'alpha': 0.8270298452955743, 'subsample': 0.9884017120191971, 'colsample_bytree': 0.8369267994495766, 'max_depth': 3, 'min_child_weight': 7, 'eta': 0.21515870710844942, 'gamma': 2.816319547734221, 'rate_drop': 5.6441177891588034e-08, 'skip_drop': 1.8938509710062133e-07}. Best is trial 137 with value: -1.165362986830467.
[I 2025-06-22 08:23:44,223] Trial 156 finished with value: -1.2191402580541693 and parameters: {'booster': 'dart', 'lambda': 1.9878759752940174, 'alpha': 0.42107710436741175, 'subsample': 0.9453465527186167, 'colsample_bytree': 0.749307753438446, 'max_depth': 3, 'min_child_weight': 7, 'eta': 0.19240955735689447, 'gamma': 2.5594316923170783, 'rate_drop': 1.026064914970145e-08, 'skip_drop': 2.5469184821988456e-07}. Best is trial 137 with value: -1.165362986830467.
[I 2025-06-22 08:23:44,644] Trial 157 finished with value: -1.2653312278568651 and parameters: {'booster': 'dart', 'lambda': 1.3238317457621668e-06, 'alpha': 1.7419390616258572, 'subsample': 0.9580642390000053, 'colsample_bytree': 0.7976458064668239, 'max_depth': 3, 'min_child_weight': 7, 'eta': 0.24766274478704153, 'gamma': 2.8457379815955908, 'rate_drop': 1.2437619857236508e-07, 'skip_drop': 1.416301209668145e-07}. Best is trial 137 with value: -1.165362986830467.
[I 2025-06-22 08:23:53,340] Trial 158 finished with value: -1.3064980731966815 and parameters: {'booster': 'dart', 'lambda': 1.0354501012329589, 'alpha': 0.652804295040527, 'subsample': 0.9766452947519882, 'colsample_bytree': 0.759590627791067, 'max_depth': 3, 'min_child_weight': 8, 'eta': 0.014296388501603412, 'gamma': 2.767438331905596, 'rate_drop': 3.0208859291454886e-08, 'skip_drop': 5.936309425443405e-05}. Best is trial 137 with value: -1.165362986830467.
[I 2025-06-22 08:23:55,117] Trial 159 finished with value: -1.196045366575818 and parameters: {'booster': 'dart', 'lambda': 4.95363575339662, 'alpha': 0.2749438087321226, 'subsample': 0.9228004983287099, 'colsample_bytree': 0.7880415936578672, 'max_depth': 3, 'min_child_weight': 6, 'eta': 0.16617304284929038, 'gamma': 2.985265458771291, 'rate_drop': 4.092137142590291e-08, 'skip_drop': 4.407771852017166e-08}. Best is trial 137 with value: -1.165362986830467.
[I 2025-06-22 08:23:55,589] Trial 160 finished with value: -1.2774023046259564 and parameters: {'booster': 'dart', 'lambda': 0.552321579468398, 'alpha': 0.5961238602674501, 'subsample': 0.9291435889267718, 'colsample_bytree': 0.8317705032797696, 'max_depth': 6, 'min_child_weight': 6, 'eta': 0.1612140552766349, 'gamma': 2.634445797043545, 'rate_drop': 4.0479944207025623e-08, 'skip_drop': 5.399194154872518e-08}. Best is trial 137 with value: -1.165362986830467.
[I 2025-06-22 08:23:57,782] Trial 161 finished with value: -1.2321438615583065 and parameters: {'booster': 'dart', 'lambda': 7.837289421091338, 'alpha': 1.0735672526935203, 'subsample': 0.9450796719390737, 'colsample_bytree': 0.7806981185754323, 'max_depth': 3, 'min_child_weight': 6, 'eta': 0.21900133654468584, 'gamma': 3.0145788218048515, 'rate_drop': 8.453553668004335e-08, 'skip_drop': 4.029927766231827e-08}. Best is trial 137 with value: -1.165362986830467.
[I 2025-06-22 08:23:58,852] Trial 162 finished with value: -1.2031917664145497 and parameters: {'booster': 'dart', 'lambda': 4.589993127844954, 'alpha': 0.2856972837441515, 'subsample': 0.9180843348868843, 'colsample_bytree': 0.8200410285206768, 'max_depth': 3, 'min_child_weight': 6, 'eta': 0.19282544202635127, 'gamma': 2.950501325959762, 'rate_drop': 1.601248813098376e-08, 'skip_drop': 8.027389720626267e-08}. Best is trial 137 with value: -1.165362986830467.
[I 2025-06-22 08:24:03,412] Trial 163 finished with value: -1.191866894303861 and parameters: {'booster': 'dart', 'lambda': 2.53883241839547, 'alpha': 2.714653925967529, 'subsample': 0.964875560934548, 'colsample_bytree': 0.8022407149284493, 'max_depth': 3, 'min_child_weight': 7, 'eta': 0.17135270729066565, 'gamma': 2.4381264497691086, 'rate_drop': 2.3669670056579796e-08, 'skip_drop': 2.8824454582998497e-08}. Best is trial 137 with value: -1.165362986830467.
[I 2025-06-22 08:24:04,374] Trial 164 finished with value: -1.1993083711516208 and parameters: {'booster': 'dart', 'lambda': 1.3989547187637756, 'alpha': 0.00020073851992383974, 'subsample': 0.9033610989142742, 'colsample_bytree': 0.7950241636911674, 'max_depth': 3, 'min_child_weight': 7, 'eta': 0.17197857292974225, 'gamma': 2.424202475027209, 'rate_drop': 2.6253123470900542e-08, 'skip_drop': 3.1055689334077775e-08}. Best is trial 137 with value: -1.165362986830467.
[I 2025-06-22 08:24:05,719] Trial 165 finished with value: -1.2383540137009639 and parameters: {'booster': 'dart', 'lambda': 1.3129161895742891, 'alpha': 0.00017867868063073134, 'subsample': 0.898461806758121, 'colsample_bytree': 0.7990379992966494, 'max_depth': 3, 'min_child_weight': 7, 'eta': 0.14531359957197823, 'gamma': 2.4724785881630367, 'rate_drop': 5.722653821289895e-08, 'skip_drop': 2.3729064708442688e-08}. Best is trial 137 with value: -1.165362986830467.
[I 2025-06-22 08:24:07,102] Trial 166 finished with value: -1.2234804462549034 and parameters: {'booster': 'dart', 'lambda': 0.316791609939329, 'alpha': 0.002767576027668275, 'subsample': 0.9025164848501928, 'colsample_bytree': 0.7752379501203127, 'max_depth': 3, 'min_child_weight': 7, 'eta': 0.1627604911910214, 'gamma': 3.3832813849581416, 'rate_drop': 4.2031484734511274e-08, 'skip_drop': 3.120896452243969e-08}. Best is trial 137 with value: -1.165362986830467.
[I 2025-06-22 08:24:09,670] Trial 167 finished with value: -1.1972842635106595 and parameters: {'booster': 'dart', 'lambda': 2.84304181182921, 'alpha': 0.0002068527234689484, 'subsample': 0.9554649120724601, 'colsample_bytree': 0.7889644291914515, 'max_depth': 3, 'min_child_weight': 7, 'eta': 0.1700549012471054, 'gamma': 2.18619480541007, 'rate_drop': 1.7626027311294167e-08, 'skip_drop': 1.602511587329042e-08}. Best is trial 137 with value: -1.165362986830467.
[I 2025-06-22 08:24:10,984] Trial 168 finished with value: -1.2636489547931986 and parameters: {'booster': 'dart', 'lambda': 1.7734811482052268, 'alpha': 0.00011162357870187865, 'subsample': 0.9993880587166366, 'colsample_bytree': 0.7874868984771247, 'max_depth': 3, 'min_child_weight': 7, 'eta': 0.12923979629843502, 'gamma': 2.3449969898461744, 'rate_drop': 1.62779410779627e-08, 'skip_drop': 1.013954054984939e-08}. Best is trial 137 with value: -1.165362986830467.
[I 2025-06-22 08:24:12,055] Trial 169 finished with value: -1.1941524930952778 and parameters: {'booster': 'dart', 'lambda': 3.377840374017314, 'alpha': 0.00021153781274630066, 'subsample': 0.9389437102585956, 'colsample_bytree': 0.8095630251304687, 'max_depth': 3, 'min_child_weight': 7, 'eta': 0.15047221394569824, 'gamma': 2.2351559804850343, 'rate_drop': 2.724786354783892e-08, 'skip_drop': 1.7442491554507968e-08}. Best is trial 137 with value: -1.165362986830467.
[I 2025-06-22 08:24:14,124] Trial 170 finished with value: -1.2224417161668928 and parameters: {'booster': 'dart', 'lambda': 2.908756357309116, 'alpha': 0.0004114195430813992, 'subsample': 0.9390862234222956, 'colsample_bytree': 0.8037481025358986, 'max_depth': 3, 'min_child_weight': 8, 'eta': 0.1380551241013977, 'gamma': 2.211281152173461, 'rate_drop': 1.0353955080220959e-08, 'skip_drop': 1.305455881684682e-08}. Best is trial 137 with value: -1.165362986830467.
[I 2025-06-22 08:24:15,222] Trial 171 finished with value: -1.224131776255872 and parameters: {'booster': 'dart', 'lambda': 6.971682416432301, 'alpha': 0.00017832456975985846, 'subsample': 0.9519173745053191, 'colsample_bytree': 0.792947704598641, 'max_depth': 3, 'min_child_weight': 7, 'eta': 0.16710828061274693, 'gamma': 2.4705470198022175, 'rate_drop': 1.9662570787666807e-08, 'skip_drop': 1.656914734689752e-08}. Best is trial 137 with value: -1.165362986830467.
[I 2025-06-22 08:24:16,333] Trial 172 finished with value: -1.2212501784061522 and parameters: {'booster': 'dart', 'lambda': 3.266796803778173, 'alpha': 0.00030089746239819694, 'subsample': 0.936834063537722, 'colsample_bytree': 0.7294980565994097, 'max_depth': 3, 'min_child_weight': 7, 'eta': 0.15078147533562852, 'gamma': 2.2756091224849535, 'rate_drop': 3.3220500063495055e-08, 'skip_drop': 2.0114931162237855e-08}. Best is trial 137 with value: -1.165362986830467.
[I 2025-06-22 08:24:18,572] Trial 173 finished with value: -1.213947178128099 and parameters: {'booster': 'dart', 'lambda': 1.975128670198086, 'alpha': 6.487864562990075e-05, 'subsample': 0.9079911415666203, 'colsample_bytree': 0.8090032261841277, 'max_depth': 3, 'min_child_weight': 7, 'eta': 0.12000867447565473, 'gamma': 2.0686669042236936, 'rate_drop': 2.42590570604439e-08, 'skip_drop': 3.519892875901268e-08}. Best is trial 137 with value: -1.165362986830467.
[I 2025-06-22 08:24:19,679] Trial 174 finished with value: -1.284985600518781 and parameters: {'booster': 'dart', 'lambda': 0.1669585234212401, 'alpha': 0.00016196438067820764, 'subsample': 0.9283816858375513, 'colsample_bytree': 0.8133227892500671, 'max_depth': 3, 'min_child_weight': 7, 'eta': 0.16715689062276576, 'gamma': 2.3947659847425946, 'rate_drop': 7.81599068075413e-08, 'skip_drop': 3.099017147067742e-08}. Best is trial 137 with value: -1.165362986830467.
[I 2025-06-22 08:24:20,780] Trial 175 finished with value: -1.1936790447079124 and parameters: {'booster': 'dart', 'lambda': 4.370930563794247, 'alpha': 0.000552686197598503, 'subsample': 0.9141054110479838, 'colsample_bytree': 0.7573093173197234, 'max_depth': 3, 'min_child_weight': 7, 'eta': 0.21634387558691995, 'gamma': 2.2217804907664687, 'rate_drop': 3.014477136598668e-08, 'skip_drop': 4.7375770087218876e-08}. Best is trial 137 with value: -1.165362986830467.
[I 2025-06-22 08:24:22,197] Trial 176 finished with value: -1.2191917945090687 and parameters: {'booster': 'dart', 'lambda': 4.952781064022785, 'alpha': 1.0018322781401546e-08, 'subsample': 0.9520809273204818, 'colsample_bytree': 0.7555708570522961, 'max_depth': 3, 'min_child_weight': 7, 'eta': 0.2237452755768405, 'gamma': 2.2755472543618587, 'rate_drop': 1.5837108212829102e-07, 'skip_drop': 5.226811620084665e-08}. Best is trial 137 with value: -1.165362986830467.
[I 2025-06-22 08:24:22,734] Trial 177 finished with value: -1.211245051802871 and parameters: {'booster': 'dart', 'lambda': 7.95313774618783, 'alpha': 0.000736715951237074, 'subsample': 0.9760679612414321, 'colsample_bytree': 0.7616558241678286, 'max_depth': 3, 'min_child_weight': 7, 'eta': 0.27146080473630446, 'gamma': 2.180692964298528, 'rate_drop': 9.622127394917317e-08, 'skip_drop': 1.980402879860757e-08}. Best is trial 137 with value: -1.165362986830467.
[I 2025-06-22 08:24:22,915] Trial 178 finished with value: -1.215756113140875 and parameters: {'booster': 'gbtree', 'lambda': 3.5140137765691044, 'alpha': 3.8297282168751265e-05, 'subsample': 0.9160830956929656, 'colsample_bytree': 0.7403830682864386, 'max_depth': 3, 'min_child_weight': 7, 'eta': 0.2031021424479, 'gamma': 2.122168294072555}. Best is trial 137 with value: -1.165362986830467.
[I 2025-06-22 08:24:31,084] Trial 179 finished with value: -1.271400742659995 and parameters: {'booster': 'dart', 'lambda': 0.6520631683299357, 'alpha': 2.7276594156321288, 'subsample': 0.9685821109994239, 'colsample_bytree': 0.7306086903916676, 'max_depth': 3, 'min_child_weight': 8, 'eta': 0.14770162169458928, 'gamma': 2.736021491450951, 'rate_drop': 0.14967596046642817, 'skip_drop': 6.834315580178793e-08}. Best is trial 137 with value: -1.165362986830467.
[I 2025-06-22 08:24:32,715] Trial 180 finished with value: -1.2125385404688513 and parameters: {'booster': 'dart', 'lambda': 0.00018921608815828183, 'alpha': 2.658250003653751, 'subsample': 0.9421969475891457, 'colsample_bytree': 0.8608415119690946, 'max_depth': 3, 'min_child_weight': 6, 'eta': 0.1853817679592264, 'gamma': 2.5449387600681255, 'rate_drop': 1.5686937497680786e-08, 'skip_drop': 4.223419200366381e-08}. Best is trial 137 with value: -1.165362986830467.
[I 2025-06-22 08:24:33,848] Trial 181 finished with value: -1.2314215478240402 and parameters: {'booster': 'dart', 'lambda': 1.4589116133683884, 'alpha': 0.0012186416369529523, 'subsample': 0.9070616852564561, 'colsample_bytree': 0.7891512593278992, 'max_depth': 3, 'min_child_weight': 7, 'eta': 0.16841180070302994, 'gamma': 2.397356088712187, 'rate_drop': 2.7431698544744438e-08, 'skip_drop': 1.49534708778959e-08}. Best is trial 137 with value: -1.165362986830467.
[I 2025-06-22 08:24:34,994] Trial 182 finished with value: -1.2220367858354197 and parameters: {'booster': 'dart', 'lambda': 2.250975644917155, 'alpha': 0.00029374637320529127, 'subsample': 0.9287226275509678, 'colsample_bytree': 0.7022384984617659, 'max_depth': 3, 'min_child_weight': 9, 'eta': 0.20976875013926016, 'gamma': 2.484579969617993, 'rate_drop': 3.511908251024473e-08, 'skip_drop': 2.3740716502386804e-08}. Best is trial 137 with value: -1.165362986830467.
[I 2025-06-22 08:24:36,521] Trial 183 finished with value: -1.2114530962102201 and parameters: {'booster': 'dart', 'lambda': 5.42134273273604, 'alpha': 2.163452404705312e-05, 'subsample': 0.8866167884783672, 'colsample_bytree': 0.7940797962474032, 'max_depth': 3, 'min_child_weight': 7, 'eta': 0.1360889516024643, 'gamma': 2.3478249539345772, 'rate_drop': 5.893399372209886e-08, 'skip_drop': 2.7890616318341294e-08}. Best is trial 137 with value: -1.165362986830467.
[I 2025-06-22 08:24:37,939] Trial 184 finished with value: -1.229462113533299 and parameters: {'booster': 'dart', 'lambda': 0.9171440492541113, 'alpha': 0.00023831532468293392, 'subsample': 0.8922150399193519, 'colsample_bytree': 0.7800557088926415, 'max_depth': 3, 'min_child_weight': 7, 'eta': 0.18189407040989708, 'gamma': 2.1870388346992558, 'rate_drop': 4.7187856858410697e-08, 'skip_drop': 0.0004509332585974269}. Best is trial 137 with value: -1.165362986830467.
[I 2025-06-22 08:24:38,735] Trial 185 finished with value: -1.2159609061958736 and parameters: {'booster': 'dart', 'lambda': 2.98787488711769, 'alpha': 0.0006276780904180082, 'subsample': 0.9167027380391107, 'colsample_bytree': 0.8399501314238851, 'max_depth': 3, 'min_child_weight': 7, 'eta': 0.23023460601528928, 'gamma': 2.586192993191939, 'rate_drop': 2.466559183672287e-08, 'skip_drop': 6.741283400498932e-08}. Best is trial 137 with value: -1.165362986830467.
[I 2025-06-22 08:24:40,040] Trial 186 finished with value: -1.2380121502377341 and parameters: {'booster': 'dart', 'lambda': 0.46497148884532513, 'alpha': 0.00013995076455771349, 'subsample': 0.9566851416986467, 'colsample_bytree': 0.7511774945615209, 'max_depth': 3, 'min_child_weight': 7, 'eta': 0.15330606642271147, 'gamma': 2.0427813051979102, 'rate_drop': 1.7837383490239247e-08, 'skip_drop': 0.06585894678448993}. Best is trial 137 with value: -1.165362986830467.
[I 2025-06-22 08:24:40,476] Trial 187 finished with value: -1.2525754111857736 and parameters: {'booster': 'dart', 'lambda': 0.2534381987375712, 'alpha': 1.3936678219693879, 'subsample': 0.9828639342036739, 'colsample_bytree': 0.7656749253310929, 'max_depth': 3, 'min_child_weight': 7, 'eta': 0.28030551866182424, 'gamma': 2.901594201627084, 'rate_drop': 1.376242128726534e-08, 'skip_drop': 5.018102184210785e-08}. Best is trial 137 with value: -1.165362986830467.
[I 2025-06-22 08:24:41,978] Trial 188 finished with value: -1.214815682333109 and parameters: {'booster': 'dart', 'lambda': 1.4424685012198255, 'alpha': 0.0004913438628362903, 'subsample': 0.8994035865233041, 'colsample_bytree': 0.8086573711509262, 'max_depth': 3, 'min_child_weight': 7, 'eta': 0.11164155952419468, 'gamma': 3.0721473572024958, 'rate_drop': 3.326208875864649e-08, 'skip_drop': 3.781585144541105e-08}. Best is trial 137 with value: -1.165362986830467.
[I 2025-06-22 08:24:43,892] Trial 189 finished with value: -1.2306197509464962 and parameters: {'booster': 'dart', 'lambda': 9.820438990679689, 'alpha': 0.008771876677421958, 'subsample': 0.9327442386347582, 'colsample_bytree': 0.7846156544681874, 'max_depth': 3, 'min_child_weight': 6, 'eta': 0.1838983879033496, 'gamma': 2.434235188105987, 'rate_drop': 7.355496998713296e-08, 'skip_drop': 9.877754962458286e-08}. Best is trial 137 with value: -1.165362986830467.
