[I 2025-06-22 08:34:43,287] Trial 472 finished with value: -1.2258812458538801 and parameters: {'booster': 'dart', 'lambda': 1.251026167254711, 'alpha': 5.194718061319749e-05, 'subsample': 0.9259671698150078, 'colsample_bytree': 0.7956835257014412, 'max_depth': 3, 'min_child_weight': 10, 'eta': 0.12279622159657586, 'gamma': 2.978355634625912, 'rate_drop': 1.7591974182172833e-08, 'skip_drop': 1.8350785447241735e-08}. Best is trial 137 with value: -1.165362986830467.
[I 2025-06-22 08:34:46,724] Trial 473 finished with value: -1.2060389809177374 and parameters: {'booster': 'dart', 'lambda': 0.00020860001446832847, 'alpha': 2.7798244432453534, 'subsample': 0.9479236332842188, 'colsample_bytree': 0.7870297231350473, 'max_depth': 4, 'min_child_weight': 9, 'eta': 0.08145817620755672, 'gamma': 2.761617357484162, 'rate_drop': 3.8400437742487505e-08, 'skip_drop': 6.52354644698742e-08}. Best is trial 137 with value: -1.165362986830467.
[I 2025-06-22 08:34:47,604] Trial 474 finished with value: -1.2837745852803786 and parameters: {'booster': 'dart', 'lambda': 0.33539411210912046, 'alpha': 0.011884896330334793, 'subsample': 0.9899734331390618, 'colsample_bytree': 0.7752038945541397, 'max_depth': 3, 'min_child_weight': 7, 'eta': 0.22839315731046553, 'gamma': 2.602093355090171, 'rate_drop': 2.5347422882772564e-08, 'skip_drop': 4.743635443616091e-08}. Best is trial 137 with value: -1.165362986830467.
[I 2025-06-22 08:34:48,255] Trial 475 finished with value: -1.2283815173368082 and parameters: {'booster': 'dart', 'lambda': 4.260891864684464, 'alpha': 1.979511280857883, 'subsample': 0.9679575105819733, 'colsample_bytree': 0.7615662496049816, 'max_depth': 3, 'min_child_weight': 9, 'eta': 0.25404812167422075, 'gamma': 2.86879925274801, 'rate_drop': 9.97037638542945e-05, 'skip_drop': 1.4091160866080324e-08}. Best is trial 137 with value: -1.165362986830467.
[I 2025-06-22 08:34:50,099] Trial 476 finished with value: -1.2170292148141313 and parameters: {'booster': 'dart', 'lambda': 0.6243717867422609, 'alpha': 3.3698358047331975, 'subsample': 0.9340265985854881, 'colsample_bytree': 0.803915044294784, 'max_depth': 3, 'min_child_weight': 9, 'eta': 0.11601825148768123, 'gamma': 2.4510021133787463, 'rate_drop': 5.6615294729089144e-08, 'skip_drop': 2.8572437049973074e-08}. Best is trial 137 with value: -1.165362986830467.
[I 2025-06-22 08:34:51,484] Trial 477 finished with value: -1.2604752678959412 and parameters: {'booster': 'dart', 'lambda': 1.6266015348737006, 'alpha': 5.326523638753288, 'subsample': 0.9769353835491927, 'colsample_bytree': 0.7910618824479881, 'max_depth': 3, 'min_child_weight': 9, 'eta': 0.21424693415364623, 'gamma': 3.74430687211559, 'rate_drop': 1.1019676940350026e-07, 'skip_drop': 2.0931218133333015e-08}. Best is trial 137 with value: -1.165362986830467.
[I 2025-06-22 08:34:57,437] Trial 478 finished with value: -1.1959310228984572 and parameters: {'booster': 'dart', 'lambda': 2.7888808002981316, 'alpha': 2.1549216908786635, 'subsample': 0.53065259608263, 'colsample_bytree': 0.749372523476375, 'max_depth': 3, 'min_child_weight': 7, 'eta': 0.13451601540039834, 'gamma': 3.554396640800611, 'rate_drop': 1.552006791927082e-08, 'skip_drop': 4.947929430042039e-08}. Best is trial 137 with value: -1.165362986830467.
[I 2025-06-22 08:34:58,783] Trial 479 finished with value: -1.2841380397564064 and parameters: {'booster': 'dart', 'lambda': 5.491620339549507, 'alpha': 9.506867360615052, 'subsample': 0.9597251605082444, 'colsample_bytree': 0.8163027078443217, 'max_depth': 3, 'min_child_weight': 7, 'eta': 0.10458704967733345, 'gamma': 2.703263289632654, 'rate_drop': 1.5565792004523103e-07, 'skip_drop': 8.758312831276703e-08}. Best is trial 137 with value: -1.165362986830467.
[I 2025-06-22 08:35:00,977] Trial 480 finished with value: -1.2247532660083011 and parameters: {'booster': 'dart', 'lambda': 1.9753800777247277, 'alpha': 4.6346339020452545, 'subsample': 0.9226730011009441, 'colsample_bytree': 0.7846110590211769, 'max_depth': 8, 'min_child_weight': 7, 'eta': 0.2735946675686085, 'gamma': 3.3189658549449614, 'rate_drop': 2.597195320932491e-08, 'skip_drop': 3.229778153060562e-08}. Best is trial 137 with value: -1.165362986830467.
[I 2025-06-22 08:35:02,371] Trial 481 finished with value: -1.2175775736018386 and parameters: {'booster': 'dart', 'lambda': 0.20302394191708692, 'alpha': 2.72047337254731e-07, 'subsample': 0.9821621068257549, 'colsample_bytree': 0.7682822553500454, 'max_depth': 3, 'min_child_weight': 7, 'eta': 0.23955396956960423, 'gamma': 2.53636067044093, 'rate_drop': 1.3083465498337208e-05, 'skip_drop': 1.0228713195186434e-08}. Best is trial 137 with value: -1.165362986830467.
[I 2025-06-22 08:35:02,708] Trial 482 finished with value: -1.211179694178914 and parameters: {'booster': 'gbtree', 'lambda': 1.3482816653127687, 'alpha': 2.8335686573903214, 'subsample': 0.9058006677663781, 'colsample_bytree': 0.7514550182242159, 'max_depth': 3, 'min_child_weight': 7, 'eta': 0.05930653893661508, 'gamma': 2.39357968659372}. Best is trial 137 with value: -1.165362986830467.
[I 2025-06-22 08:35:04,151] Trial 483 finished with value: -1.2210941743695658 and parameters: {'booster': 'dart', 'lambda': 0.009414260298717394, 'alpha': 1.7935240047114054, 'subsample': 0.94517897706176, 'colsample_bytree': 0.8039579194192324, 'max_depth': 3, 'min_child_weight': 7, 'eta': 0.19321816900656075, 'gamma': 2.813562616981061, 'rate_drop': 4.165999866909452e-08, 'skip_drop': 5.361760146128895e-08}. Best is trial 137 with value: -1.165362986830467.
[I 2025-06-22 08:35:07,591] Trial 484 finished with value: -1.2374581911275468 and parameters: {'booster': 'dart', 'lambda': 3.603286144972946, 'alpha': 6.977801915545886, 'subsample': 0.6815186857011655, 'colsample_bytree': 0.7739400723155362, 'max_depth': 3, 'min_child_weight': 7, 'eta': 0.1361689470758106, 'gamma': 2.5839397610847166, 'rate_drop': 1.9353839805966117e-08, 'skip_drop': 8.829714322505306e-08}. Best is trial 137 with value: -1.165362986830467.
[I 2025-06-22 08:35:09,233] Trial 485 finished with value: -1.1780808178448607 and parameters: {'booster': 'dart', 'lambda': 0.036116493303556936, 'alpha': 3.5676818210364476, 'subsample': 0.9697403255347036, 'colsample_bytree': 0.741049395701223, 'max_depth': 3, 'min_child_weight': 7, 'eta': 0.1638932924072237, 'gamma': 1.8989916870136763, 'rate_drop': 7.105896862823002e-08, 'skip_drop': 1.880841826356166e-08}. Best is trial 137 with value: -1.165362986830467.
[I 2025-06-22 08:35:10,727] Trial 486 finished with value: -1.2126932282316274 and parameters: {'booster': 'dart', 'lambda': 0.021636295593525274, 'alpha': 2.7157379989400816, 'subsample': 0.9721313076466662, 'colsample_bytree': 0.7445540856841386, 'max_depth': 3, 'min_child_weight': 7, 'eta': 0.16398437447157835, 'gamma': 1.7256687980189123, 'rate_drop': 0.0031834767795588348, 'skip_drop': 3.769264962330455e-08}. Best is trial 137 with value: -1.165362986830467.
[I 2025-06-22 08:35:13,230] Trial 487 finished with value: -1.1906910421311092 and parameters: {'booster': 'dart', 'lambda': 0.13504349611491048, 'alpha': 5.082041254820788, 'subsample': 0.9610945306099893, 'colsample_bytree': 0.7363197347789895, 'max_depth': 3, 'min_child_weight': 7, 'eta': 0.17436167871706446, 'gamma': 2.077167958962783, 'rate_drop': 1.0025691231701941e-07, 'skip_drop': 1.1883409073944081e-07}. Best is trial 137 with value: -1.165362986830467.
[I 2025-06-22 08:35:16,297] Trial 488 finished with value: -1.2445776526799506 and parameters: {'booster': 'dart', 'lambda': 0.110599148533495, 'alpha': 5.2861260410587265, 'subsample': 0.9635294106459272, 'colsample_bytree': 0.7391390261632632, 'max_depth': 7, 'min_child_weight': 7, 'eta': 0.2059638841718541, 'gamma': 1.9265096876559926, 'rate_drop': 1.6110638102866523e-07, 'skip_drop': 1.4320020484602835e-07}. Best is trial 137 with value: -1.165362986830467.
[I 2025-06-22 08:35:17,859] Trial 489 finished with value: -1.2192611681633705 and parameters: {'booster': 'dart', 'lambda': 0.050108233625126626, 'alpha': 6.697519188999652, 'subsample': 0.989361295743838, 'colsample_bytree': 0.7289381145351943, 'max_depth': 3, 'min_child_weight': 7, 'eta': 0.1796679469195413, 'gamma': 1.892311076741106, 'rate_drop': 9.428028187020457e-08, 'skip_drop': 1.286284232351984e-07}. Best is trial 137 with value: -1.165362986830467.
[I 2025-06-22 08:35:20,945] Trial 490 finished with value: -1.1897273173795757 and parameters: {'booster': 'dart', 'lambda': 0.012806905753110578, 'alpha': 3.564792342971979, 'subsample': 0.9709126845455109, 'colsample_bytree': 0.7255349468188358, 'max_depth': 3, 'min_child_weight': 7, 'eta': 0.21969419034747778, 'gamma': 2.0827757139596828, 'rate_drop': 2.3886405226014986e-07, 'skip_drop': 8.76434517721499e-08}. Best is trial 137 with value: -1.165362986830467.
[I 2025-06-22 08:35:21,844] Trial 491 finished with value: -1.2303828278427869 and parameters: {'booster': 'dart', 'lambda': 0.016126627261281, 'alpha': 4.578365441039325, 'subsample': 0.9722425848377981, 'colsample_bytree': 0.7330475954394806, 'max_depth': 3, 'min_child_weight': 7, 'eta': 0.22057483475398845, 'gamma': 2.015072316917029, 'rate_drop': 2.3783851877345224e-07, 'skip_drop': 8.212622264268715e-08}. Best is trial 137 with value: -1.165362986830467.
[I 2025-06-22 08:35:23,232] Trial 492 finished with value: -1.2239642602808407 and parameters: {'booster': 'dart', 'lambda': 0.061260849306187706, 'alpha': 9.796624947140584, 'subsample': 0.9617297013082123, 'colsample_bytree': 0.7274789643460834, 'max_depth': 3, 'min_child_weight': 7, 'eta': 0.20082198101494106, 'gamma': 1.9900299712845677, 'rate_drop': 1.5264183477361952e-07, 'skip_drop': 1.071512206135523e-07}. Best is trial 137 with value: -1.165362986830467.
[I 2025-06-22 08:35:23,816] Trial 493 finished with value: -1.2534083267312255 and parameters: {'booster': 'dart', 'lambda': 0.03278759529092718, 'alpha': 3.715832102583168, 'subsample': 0.9801118366896421, 'colsample_bytree': 0.7410317692819506, 'max_depth': 3, 'min_child_weight': 7, 'eta': 0.23768715469930357, 'gamma': 1.9745647589874729, 'rate_drop': 3.1941991846722184e-07, 'skip_drop': 7.251125336016127e-08}. Best is trial 137 with value: -1.165362986830467.
[I 2025-06-22 08:35:25,290] Trial 494 finished with value: -1.176770994105477 and parameters: {'booster': 'dart', 'lambda': 0.006117188625601496, 'alpha': 5.777190373468315, 'subsample': 0.9579039591123516, 'colsample_bytree': 0.736647530074061, 'max_depth': 3, 'min_child_weight': 7, 'eta': 0.18751015004672256, 'gamma': 1.781034020247835, 'rate_drop': 1.628800665487235e-07, 'skip_drop': 5.8085840276475356e-08}. Best is trial 137 with value: -1.165362986830467.
[I 2025-06-22 08:35:27,707] Trial 495 finished with value: -1.179605010589514 and parameters: {'booster': 'dart', 'lambda': 0.007656834465220612, 'alpha': 6.727628098450856, 'subsample': 0.9542641215771096, 'colsample_bytree': 0.7271552873267859, 'max_depth': 3, 'min_child_weight': 7, 'eta': 0.1748354659471317, 'gamma': 1.8729620162031624, 'rate_drop': 2.8645435302573804e-07, 'skip_drop': 6.242380256276021e-08}. Best is trial 137 with value: -1.165362986830467.
[I 2025-06-22 08:35:31,503] Trial 496 finished with value: -1.2191055103526185 and parameters: {'booster': 'dart', 'lambda': 0.011527865439764445, 'alpha': 8.006056040033119, 'subsample': 0.9561018325580792, 'colsample_bytree': 0.7222791408440279, 'max_depth': 3, 'min_child_weight': 7, 'eta': 0.1607728250651018, 'gamma': 1.8569832276375915, 'rate_drop': 2.517947981887213e-07, 'skip_drop': 5.901699051541308e-08}. Best is trial 137 with value: -1.165362986830467.
[I 2025-06-22 08:35:32,809] Trial 497 finished with value: -1.1940162884567367 and parameters: {'booster': 'dart', 'lambda': 0.010718718290815223, 'alpha': 6.410722372706703, 'subsample': 0.9648113821978388, 'colsample_bytree': 0.7220556813964641, 'max_depth': 3, 'min_child_weight': 7, 'eta': 0.17938752019554266, 'gamma': 1.757215570225637, 'rate_drop': 2.533424009084967e-07, 'skip_drop': 6.813570058583733e-08}. Best is trial 137 with value: -1.165362986830467.
[I 2025-06-22 08:35:35,417] Trial 498 finished with value: -1.1960188493628157 and parameters: {'booster': 'dart', 'lambda': 0.0047218660887599455, 'alpha': 5.685920452552169, 'subsample': 0.9547292362599212, 'colsample_bytree': 0.7369404891060718, 'max_depth': 3, 'min_child_weight': 7, 'eta': 0.17177751176190828, 'gamma': 1.8120070230875907, 'rate_drop': 3.8059909314998645e-07, 'skip_drop': 1.0325309722921381e-07}. Best is trial 137 with value: -1.165362986830467.
[I 2025-06-22 08:35:37,742] Trial 499 finished with value: -1.2197970341836266 and parameters: {'booster': 'dart', 'lambda': 0.007135410458357342, 'alpha': 7.253583678717135, 'subsample': 0.9702711398644301, 'colsample_bytree': 0.7323675543589204, 'max_depth': 6, 'min_child_weight': 7, 'eta': 0.18757908240926724, 'gamma': 1.6657368769317336, 'rate_drop': 1.74626699710579e-07, 'skip_drop': 5.171209989398372e-08}. Best is trial 137 with value: -1.165362986830467.
Number of finished trials:  500
Best trial:
  Value (RMSE): 1.1654
  MSE: 1.3581
  R²: 0.5342
  Params: 
    booster: dart
    lambda: 0.24003760620680895
    alpha: 3.79549881644242
    subsample: 0.9504995784940309
    colsample_bytree: 0.7604044716048105
    max_depth: 3
    min_child_weight: 7
    eta: 0.24614488950672417
    gamma: 2.899307590851688
    rate_drop: 3.847435689452973e-08
    skip_drop: 6.96148271568361e-08
Model saved to /vol/models/tbtl_student_score_predictor_optuna_xgb.pkl