[I 2025-06-22 08:26:26,660] Trial 237 finished with value: -1.2118003044341301 and parameters: {'booster': 'dart', 'lambda': 0.28934426287183906, 'alpha': 1.5618822740945126, 'subsample': 0.9670497463164586, 'colsample_bytree': 0.7207937811321031, 'max_depth': 3, 'min_child_weight': 7, 'eta': 0.15772515442979657, 'gamma': 3.135072914628687, 'rate_drop': 7.474417210263004e-08, 'skip_drop': 2.2843867949585446e-08}. Best is trial 137 with value: -1.165362986830467.
[I 2025-06-22 08:26:29,004] Trial 238 finished with value: -1.2653311430120486 and parameters: {'booster': 'dart', 'lambda': 0.018009124730651853, 'alpha': 1.9396960217201357e-06, 'subsample': 0.9963023441198279, 'colsample_bytree': 0.7664269435579937, 'max_depth': 3, 'min_child_weight': 7, 'eta': 0.10765860057094535, 'gamma': 2.880071757303445, 'rate_drop': 1.0087409810992805e-08, 'skip_drop': 6.66374562684712e-08}. Best is trial 137 with value: -1.165362986830467.
[I 2025-06-22 08:26:29,593] Trial 239 finished with value: -1.238814326813876 and parameters: {'booster': 'dart', 'lambda': 0.7547749278069441, 'alpha': 2.2466595492245305, 'subsample': 0.9775510970416385, 'colsample_bytree': 0.811472339444963, 'max_depth': 3, 'min_child_weight': 6, 'eta': 0.2592523579991775, 'gamma': 3.749201677757138, 'rate_drop': 3.4430708647009464e-08, 'skip_drop': 4.143812917153123e-08}. Best is trial 137 with value: -1.165362986830467.
[I 2025-06-22 08:26:36,476] Trial 240 finished with value: -1.193742347473095 and parameters: {'booster': 'dart', 'lambda': 0.0006215806891613559, 'alpha': 0.7534191555349605, 'subsample': 0.7556751308436503, 'colsample_bytree': 0.7092714085687343, 'max_depth': 3, 'min_child_weight': 7, 'eta': 0.07230081714534749, 'gamma': 1.1084044519222551, 'rate_drop': 2.0000684471084818e-06, 'skip_drop': 3.108405509388228e-07}. Best is trial 137 with value: -1.165362986830467.
[I 2025-06-22 08:26:40,026] Trial 241 finished with value: -1.2095418016199817 and parameters: {'booster': 'dart', 'lambda': 3.7391877960473074, 'alpha': 1.0227943941887283, 'subsample': 0.7448843641779179, 'colsample_bytree': 0.7133851386109082, 'max_depth': 3, 'min_child_weight': 7, 'eta': 0.06070252512337258, 'gamma': 1.1424894610990703, 'rate_drop': 1.8734271215821886e-06, 'skip_drop': 3.653059111887824e-07}. Best is trial 137 with value: -1.165362986830467.
[I 2025-06-22 08:26:42,213] Trial 242 finished with value: -1.264799201383272 and parameters: {'booster': 'dart', 'lambda': 0.005629155085355472, 'alpha': 1.522567758249977, 'subsample': 0.9584905624726041, 'colsample_bytree': 0.6941050232792543, 'max_depth': 3, 'min_child_weight': 7, 'eta': 0.08464526219841108, 'gamma': 1.0940327169426718, 'rate_drop': 3.470747671915267e-06, 'skip_drop': 2.6422171159889065e-07}. Best is trial 137 with value: -1.165362986830467.
[I 2025-06-22 08:26:44,618] Trial 243 finished with value: -1.2184521210636146 and parameters: {'booster': 'dart', 'lambda': 0.003866488421727136, 'alpha': 0.5800717644523599, 'subsample': 0.9652322497770548, 'colsample_bytree': 0.679012407278455, 'max_depth': 3, 'min_child_weight': 7, 'eta': 0.1395544450863249, 'gamma': 1.2355828871872672, 'rate_drop': 2.6612704138471295e-06, 'skip_drop': 1.4493527847055986e-07}. Best is trial 137 with value: -1.165362986830467.
[I 2025-06-22 08:26:53,043] Trial 244 finished with value: -1.2411391924019244 and parameters: {'booster': 'dart', 'lambda': 0.0009875647472215572, 'alpha': 2.822336535210787, 'subsample': 0.6370180418739865, 'colsample_bytree': 0.7059069985963914, 'max_depth': 3, 'min_child_weight': 7, 'eta': 0.029673751288795062, 'gamma': 0.898774008805689, 'rate_drop': 1.549233303319294e-08, 'skip_drop': 2.676206439875237e-08}. Best is trial 137 with value: -1.165362986830467.
[I 2025-06-22 08:26:54,855] Trial 245 finished with value: -1.223511896057442 and parameters: {'booster': 'dart', 'lambda': 0.0003450610556943911, 'alpha': 0.8158299117587519, 'subsample': 0.8089354330882106, 'colsample_bytree': 0.7274846685873574, 'max_depth': 3, 'min_child_weight': 7, 'eta': 0.10251917317194018, 'gamma': 2.7178009838343318, 'rate_drop': 7.673302743893259e-06, 'skip_drop': 5.805291953814172e-07}. Best is trial 137 with value: -1.165362986830467.
[I 2025-06-22 08:27:03,448] Trial 246 finished with value: -1.6411875969762424 and parameters: {'booster': 'dart', 'lambda': 0.18676400650673777, 'alpha': 2.8989445922042645, 'subsample': 0.9269345964008784, 'colsample_bytree': 0.7456398165957703, 'max_depth': 3, 'min_child_weight': 7, 'eta': 0.0010611292571225794, 'gamma': 1.0060318286976413, 'rate_drop': 1.3046516624391779e-06, 'skip_drop': 1.2545807617531281e-05}. Best is trial 137 with value: -1.165362986830467.
[I 2025-06-22 08:27:07,440] Trial 247 finished with value: -1.2371840726018384 and parameters: {'booster': 'dart', 'lambda': 1.682061981147347e-05, 'alpha': 1.6309845424749967, 'subsample': 0.9136953057133588, 'colsample_bytree': 0.5951052116726931, 'max_depth': 3, 'min_child_weight': 7, 'eta': 0.07893829593089853, 'gamma': 1.482653015421347, 'rate_drop': 2.7015443028881163e-08, 'skip_drop': 2.925990379909489e-07}. Best is trial 137 with value: -1.165362986830467.
[I 2025-06-22 08:27:08,090] Trial 248 finished with value: -1.2586369429839326 and parameters: {'booster': 'dart', 'lambda': 0.0007356120429802136, 'alpha': 5.238863297409447, 'subsample': 0.714277636893319, 'colsample_bytree': 0.7733179570248141, 'max_depth': 3, 'min_child_weight': 7, 'eta': 0.2192742482183226, 'gamma': 1.2640786073319532, 'rate_drop': 2.1778606206152265e-06, 'skip_drop': 1.0623037880781543e-07}. Best is trial 137 with value: -1.165362986830467.
[I 2025-06-22 08:27:08,678] Trial 249 finished with value: -1.2879157174413567 and parameters: {'booster': 'dart', 'lambda': 0.0023209048890482347, 'alpha': 2.1120556620005928e-08, 'subsample': 0.9744745318184422, 'colsample_bytree': 0.8033780261378725, 'max_depth': 3, 'min_child_weight': 7, 'eta': 0.17575354648547528, 'gamma': 2.1491859731766474, 'rate_drop': 4.7994152993917376e-08, 'skip_drop': 6.73003117661147e-08}. Best is trial 137 with value: -1.165362986830467.
[I 2025-06-22 08:27:08,833] Trial 250 finished with value: -1.3144791429471014 and parameters: {'booster': 'gbtree', 'lambda': 1.1288716312430704, 'alpha': 2.6052349234763246, 'subsample': 0.5101600839604001, 'colsample_bytree': 0.7880644068973306, 'max_depth': 3, 'min_child_weight': 9, 'eta': 0.205790622259583, 'gamma': 2.336595444067978}. Best is trial 137 with value: -1.165362986830467.
[I 2025-06-22 08:27:12,404] Trial 251 finished with value: -1.2066789955347577 and parameters: {'booster': 'dart', 'lambda': 2.4004426302632607, 'alpha': 1.3604093106301123, 'subsample': 0.9502761270561255, 'colsample_bytree': 0.7571628199006413, 'max_depth': 3, 'min_child_weight': 6, 'eta': 0.07324800141845125, 'gamma': 1.5636168155343562, 'rate_drop': 1.916293857609923e-08, 'skip_drop': 1.7407398493130536e-07}. Best is trial 137 with value: -1.165362986830467.
[I 2025-06-22 08:27:13,283] Trial 252 finished with value: -1.2192299437108307 and parameters: {'booster': 'dart', 'lambda': 4.145634198125549, 'alpha': 0.7969987563738632, 'subsample': 0.9879959190460371, 'colsample_bytree': 0.7101557318731888, 'max_depth': 3, 'min_child_weight': 8, 'eta': 0.14541956568891143, 'gamma': 3.3507335460073393, 'rate_drop': 3.321777428674502e-08, 'skip_drop': 4.190330413170292e-08}. Best is trial 137 with value: -1.165362986830467.
[I 2025-06-22 08:27:14,560] Trial 253 finished with value: -1.2045628190498003 and parameters: {'booster': 'dart', 'lambda': 0.409213114939264, 'alpha': 4.403325034222291, 'subsample': 0.958556439113007, 'colsample_bytree': 0.6224875422828506, 'max_depth': 3, 'min_child_weight': 7, 'eta': 0.24078871982989206, 'gamma': 1.3695528996303745, 'rate_drop': 1.465908619968705e-08, 'skip_drop': 7.823880507082817e-07}. Best is trial 137 with value: -1.165362986830467.
[I 2025-06-22 08:27:15,299] Trial 254 finished with value: -1.2169025143898582 and parameters: {'booster': 'dart', 'lambda': 0.0001684226091536058, 'alpha': 2.1283910078360053, 'subsample': 0.6691072782043854, 'colsample_bytree': 0.7237509473470507, 'max_depth': 3, 'min_child_weight': 7, 'eta': 0.1865301801926777, 'gamma': 2.807929705926362, 'rate_drop': 2.2138248298652465e-07, 'skip_drop': 1.5857569067042076e-08}. Best is trial 137 with value: -1.165362986830467.
[I 2025-06-22 08:27:16,417] Trial 255 finished with value: -1.2252493482644093 and parameters: {'booster': 'dart', 'lambda': 1.9166743369112607, 'alpha': 0.42831050475191174, 'subsample': 0.780832802456122, 'colsample_bytree': 0.6946876928523492, 'max_depth': 3, 'min_child_weight': 7, 'eta': 0.15623966492936678, 'gamma': 4.709154050263078, 'rate_drop': 5.828977734881012e-08, 'skip_drop': 8.494092029361635e-08}. Best is trial 137 with value: -1.165362986830467.
[I 2025-06-22 08:27:17,541] Trial 256 finished with value: -1.3142398073221937 and parameters: {'booster': 'dart', 'lambda': 1.2478211497466756, 'alpha': 1.0070526562388928e-06, 'subsample': 0.8497584591932139, 'colsample_bytree': 0.7945538325704452, 'max_depth': 5, 'min_child_weight': 6, 'eta': 0.16985870918008894, 'gamma': 1.0509411144955627, 'rate_drop': 2.6412358745790967e-08, 'skip_drop': 2.3085025947256654e-08}. Best is trial 137 with value: -1.165362986830467.
[I 2025-06-22 08:27:19,347] Trial 257 finished with value: -1.2126813186615604 and parameters: {'booster': 'dart', 'lambda': 2.6488951643973873, 'alpha': 1.8273270421562246e-07, 'subsample': 0.9327669876660839, 'colsample_bytree': 0.7346400319356237, 'max_depth': 3, 'min_child_weight': 7, 'eta': 0.11494987323910402, 'gamma': 1.1613543462144436, 'rate_drop': 9.766838358544741e-08, 'skip_drop': 3.8593239285096954e-07}. Best is trial 137 with value: -1.165362986830467.
[I 2025-06-22 08:27:28,148] Trial 258 finished with value: -1.388557416458553 and parameters: {'booster': 'dart', 'lambda': 0.7587808478862634, 'alpha': 3.7772424511797245, 'subsample': 0.9710663658163472, 'colsample_bytree': 0.7798625525452825, 'max_depth': 3, 'min_child_weight': 7, 'eta': 0.008856049551308916, 'gamma': 2.5102787473234107, 'rate_drop': 1.1458665343411108e-06, 'skip_drop': 2.390544927166578e-07}. Best is trial 137 with value: -1.165362986830467.
[I 2025-06-22 08:27:28,916] Trial 259 finished with value: -1.245998048699195 and parameters: {'booster': 'dart', 'lambda': 0.26820903657212797, 'alpha': 6.921961948214472, 'subsample': 0.9096023760981562, 'colsample_bytree': 0.8106954630074936, 'max_depth': 3, 'min_child_weight': 7, 'eta': 0.2741934609206212, 'gamma': 2.6507191380197, 'rate_drop': 2.0488128774919324e-08, 'skip_drop': 1.3660941246627683e-07}. Best is trial 137 with value: -1.165362986830467.
[I 2025-06-22 08:27:30,720] Trial 260 finished with value: -1.2320263590955545 and parameters: {'booster': 'dart', 'lambda': 0.5591309983235287, 'alpha': 1.2618416417143024, 'subsample': 0.9221684896790284, 'colsample_bytree': 0.7488395367586221, 'max_depth': 3, 'min_child_weight': 8, 'eta': 0.13004092989649763, 'gamma': 2.980348924795929, 'rate_drop': 3.9610633970193485e-08, 'skip_drop': 4.6944073373445153e-08}. Best is trial 137 with value: -1.165362986830467.
[I 2025-06-22 08:27:31,488] Trial 261 finished with value: -1.214773806170959 and parameters: {'booster': 'dart', 'lambda': 6.53229164536081e-05, 'alpha': 2.1375101146277844, 'subsample': 0.8674963972555475, 'colsample_bytree': 0.6712414808694285, 'max_depth': 3, 'min_child_weight': 7, 'eta': 0.22347877099966093, 'gamma': 2.2416044548312017, 'rate_drop': 3.6427985110644028e-06, 'skip_drop': 1.0749429643071467e-08}. Best is trial 137 with value: -1.165362986830467.
[I 2025-06-22 08:27:32,957] Trial 262 finished with value: -1.2201631956938246 and parameters: {'booster': 'dart', 'lambda': 5.614424346832254, 'alpha': 3.0421106915671707, 'subsample': 0.9812951726815158, 'colsample_bytree': 0.7175690337666054, 'max_depth': 3, 'min_child_weight': 7, 'eta': 0.19619989530330156, 'gamma': 1.2724526166118073, 'rate_drop': 1.3718886360022456e-08, 'skip_drop': 3.0150152268512525e-08}. Best is trial 137 with value: -1.165362986830467.
[I 2025-06-22 08:27:34,412] Trial 263 finished with value: -1.2175140227582373 and parameters: {'booster': 'dart', 'lambda': 1.3551727176114259, 'alpha': 0.7476757466130243, 'subsample': 0.9568500677145024, 'colsample_bytree': 0.7596262665794237, 'max_depth': 3, 'min_child_weight': 6, 'eta': 0.1465446232857877, 'gamma': 3.2266636539048874, 'rate_drop': 2.500416706660196e-08, 'skip_drop': 6.24280917916305e-08}. Best is trial 137 with value: -1.165362986830467.
[I 2025-06-22 08:27:37,685] Trial 264 finished with value: -1.2248267811583848 and parameters: {'booster': 'dart', 'lambda': 2.9775579874937583, 'alpha': 7.006309673633069, 'subsample': 0.8916956457767156, 'colsample_bytree': 0.6362179077722149, 'max_depth': 3, 'min_child_weight': 7, 'eta': 0.09774064217017808, 'gamma': 0.8316634426456897, 'rate_drop': 2.2676086171337303e-06, 'skip_drop': 1.1255922400271937e-07}. Best is trial 137 with value: -1.165362986830467.
[I 2025-06-22 08:27:38,174] Trial 265 finished with value: -1.2111086525834445 and parameters: {'booster': 'dart', 'lambda': 0.0004703361557380763, 'alpha': 1.6555285475091717, 'subsample': 0.9378395912998557, 'colsample_bytree': 0.7981487236947752, 'max_depth': 3, 'min_child_weight': 7, 'eta': 0.2562057809506966, 'gamma': 1.9717986331498616, 'rate_drop': 1.0225680734459922e-08, 'skip_drop': 0.014188548420846575}. Best is trial 137 with value: -1.165362986830467.
[I 2025-06-22 08:27:38,692] Trial 266 finished with value: -1.3329651791364967 and parameters: {'booster': 'dart', 'lambda': 0.10831116716779272, 'alpha': 0.05112730145647906, 'subsample': 0.9678735080615644, 'colsample_bytree': 0.7686982881478972, 'max_depth': 10, 'min_child_weight': 7, 'eta': 0.1725738900829302, 'gamma': 0.9798508951723637, 'rate_drop': 7.296943188011513e-08, 'skip_drop': 2.09050149779182e-07}. Best is trial 137 with value: -1.165362986830467.
[I 2025-06-22 08:27:38,817] Trial 267 finished with value: -1.2365946261197924 and parameters: {'booster': 'gbtree', 'lambda': 1.9566063706518046, 'alpha': 0.2904245308722505, 'subsample': 0.9522177078703118, 'colsample_bytree': 0.8215236746636677, 'max_depth': 3, 'min_child_weight': 8, 'eta': 0.2080902763660958, 'gamma': 2.7553254089912733}. Best is trial 137 with value: -1.165362986830467.
[I 2025-06-22 08:27:40,275] Trial 268 finished with value: -1.1966868941652815 and parameters: {'booster': 'dart', 'lambda': 4.106370717872597, 'alpha': 1.5650310397215503e-05, 'subsample': 0.9242972983033197, 'colsample_bytree': 0.7437098984314429, 'max_depth': 3, 'min_child_weight': 6, 'eta': 0.1313472460385745, 'gamma': 2.886115366474938, 'rate_drop': 4.175733854054078e-08, 'skip_drop': 4.5637583184845425e-07}. Best is trial 137 with value: -1.165362986830467.
[I 2025-06-22 08:27:44,838] Trial 269 finished with value: -1.2357396378747534 and parameters: {'booster': 'dart', 'lambda': 5.163388030325464, 'alpha': 1.8288279253810544e-05, 'subsample': 0.9992048393904261, 'colsample_bytree': 0.7488047054402758, 'max_depth': 3, 'min_child_weight': 6, 'eta': 0.039609331822396864, 'gamma': 2.9644815813605443, 'rate_drop': 4.824607021561187e-06, 'skip_drop': 5.420624364681789e-07}. Best is trial 137 with value: -1.165362986830467.
[I 2025-06-22 08:27:49,149] Trial 270 finished with value: -1.2357777312354161 and parameters: {'booster': 'dart', 'lambda': 9.593858332097703, 'alpha': 5.689743758832562, 'subsample': 0.7597642175660082, 'colsample_bytree': 0.7852493514631311, 'max_depth': 3, 'min_child_weight': 6, 'eta': 0.11982619373710628, 'gamma': 2.8751417883287487, 'rate_drop': 1.7030923723955117e-08, 'skip_drop': 7.762544775792994e-07}. Best is trial 137 with value: -1.165362986830467.
[I 2025-06-22 08:27:51,006] Trial 271 finished with value: -1.2323451076762815 and parameters: {'booster': 'dart', 'lambda': 0.011166039437916928, 'alpha': 2.602526482862781e-06, 'subsample': 0.9216441853890274, 'colsample_bytree': 0.6847736413750556, 'max_depth': 3, 'min_child_weight': 6, 'eta': 0.12849235434052106, 'gamma': 3.013843077999048, 'rate_drop': 2.803470081487921e-08, 'skip_drop': 3.8158606391809777e-07}. Best is trial 137 with value: -1.165362986830467.
[I 2025-06-22 08:27:53,426] Trial 272 finished with value: -1.217405790765208 and parameters: {'booster': 'dart', 'lambda': 3.8553800983083897, 'alpha': 1.3749715242461075e-05, 'subsample': 0.8776762709301934, 'colsample_bytree': 0.7392626583026667, 'max_depth': 3, 'min_child_weight': 6, 'eta': 0.10777583388534948, 'gamma': 1.1069431735826076, 'rate_drop': 5.177002353494922e-08, 'skip_drop': 2.1635705647152866e-08}. Best is trial 137 with value: -1.165362986830467.
[I 2025-06-22 08:27:54,534] Trial 273 finished with value: -1.2287842675817047 and parameters: {'booster': 'dart', 'lambda': 6.295169254822545, 'alpha': 3.9944477258078623, 'subsample': 0.9048489803390184, 'colsample_bytree': 0.7673547415216854, 'max_depth': 3, 'min_child_weight': 6, 'eta': 0.14388774233058, 'gamma': 1.1695822858018838, 'rate_drop': 1.6099416710756203e-07, 'skip_drop': 4.848913603877439e-08}. Best is trial 137 with value: -1.165362986830467.
[I 2025-06-22 08:27:58,851] Trial 274 finished with value: -1.2299111147459878 and parameters: {'booster': 'dart', 'lambda': 2.744492383631779, 'alpha': 3.939247347499948e-05, 'subsample': 0.9812809188812159, 'colsample_bytree': 0.7009118662480791, 'max_depth': 3, 'min_child_weight': 6, 'eta': 0.047994339372692735, 'gamma': 3.100494065329258, 'rate_drop': 1.9892786106042797e-08, 'skip_drop': 3.097641547633917e-08}. Best is trial 137 with value: -1.165362986830467.
[I 2025-06-22 08:28:00,496] Trial 275 finished with value: -1.206732759959584 and parameters: {'booster': 'dart', 'lambda': 4.503308078474295e-06, 'alpha': 1.0695197341274268e-05, 'subsample': 0.9640636586059206, 'colsample_bytree': 0.7586648456131581, 'max_depth': 3, 'min_child_weight': 1, 'eta': 0.13432314754368502, 'gamma': 1.3802508438035055, 'rate_drop': 3.6864845745187135e-08, 'skip_drop': 1.27022989408611e-06}. Best is trial 137 with value: -1.165362986830467.
[I 2025-06-22 08:28:02,388] Trial 276 finished with value: -1.213841799643326 and parameters: {'booster': 'dart', 'lambda': 0.21432371848241785, 'alpha': 5.542369187072153e-06, 'subsample': 0.9429187576244283, 'colsample_bytree': 0.7778489686776868, 'max_depth': 3, 'min_child_weight': 7, 'eta': 0.1565196606450624, 'gamma': 2.849757553725494, 'rate_drop': 1.6664914094150914e-06, 'skip_drop': 7.502254147900246e-08}. Best is trial 137 with value: -1.165362986830467.
[I 2025-06-22 08:28:03,868] Trial 277 finished with value: -1.2715951647186161 and parameters: {'booster': 'dart', 'lambda': 0.4530505584507309, 'alpha': 0.002229253802366984, 'subsample': 0.9139470444897834, 'colsample_bytree': 0.612305498531308, 'max_depth': 3, 'min_child_weight': 7, 'eta': 0.08737823738922601, 'gamma': 4.406889026276663, 'rate_drop': 9.89528705609064e-07, 'skip_drop': 1.4706313163275004e-08}. Best is trial 137 with value: -1.165362986830467.
[I 2025-06-22 08:28:04,298] Trial 278 finished with value: -1.2997138446833199 and parameters: {'booster': 'dart', 'lambda': 0.9124926912507099, 'alpha': 1.0136140941088758, 'subsample': 0.9728733785116095, 'colsample_bytree': 0.7480414582728971, 'max_depth': 4, 'min_child_weight': 7, 'eta': 0.29162703263893763, 'gamma': 1.4465578366891707, 'rate_drop': 1.4989653260944873e-08, 'skip_drop': 4.966608544934753e-07}. Best is trial 137 with value: -1.165362986830467.
[I 2025-06-22 08:28:08,582] Trial 279 finished with value: -1.1879576616001022 and parameters: {'booster': 'dart', 'lambda': 4.212758134309209, 'alpha': 0.01770766905969088, 'subsample': 0.9883322239425818, 'colsample_bytree': 0.8075882097415968, 'max_depth': 3, 'min_child_weight': 7, 'eta': 0.11249433465426964, 'gamma': 1.2429927002970995, 'rate_drop': 9.597525206891093e-08, 'skip_drop': 2.4895389152328635e-05}. Best is trial 137 with value: -1.165362986830467.
[I 2025-06-22 08:28:09,563] Trial 280 finished with value: -1.2008212228531976 and parameters: {'booster': 'dart', 'lambda': 3.8451669252282215, 'alpha': 0.6243506916080653, 'subsample': 0.9920683904184221, 'colsample_bytree': 0.803895984399025, 'max_depth': 3, 'min_child_weight': 7, 'eta': 0.2314262510151463, 'gamma': 1.2658531128516142, 'rate_drop': 1.1159810111726663e-07, 'skip_drop': 0.00010170208313582975}. Best is trial 137 with value: -1.165362986830467.
[I 2025-06-22 08:28:10,378] Trial 281 finished with value: -1.2531157589790396 and parameters: {'booster': 'dart', 'lambda': 6.564390919497459, 'alpha': 0.005360236559344951, 'subsample': 0.7348002251553842, 'colsample_bytree': 0.816273246019606, 'max_depth': 3, 'min_child_weight': 8, 'eta': 0.1645759624705805, 'gamma': 1.6277691164848087, 'rate_drop': 6.9787017917139e-08, 'skip_drop': 1.9364634873216068e-05}. Best is trial 137 with value: -1.165362986830467.
[I 2025-06-22 08:28:13,509] Trial 282 finished with value: -1.2077835458458053 and parameters: {'booster': 'dart', 'lambda': 3.94559791836452, 'alpha': 2.813510415126011e-05, 'subsample': 0.9764993473392798, 'colsample_bytree': 0.7926212875791832, 'max_depth': 3, 'min_child_weight': 6, 'eta': 0.06623483341821582, 'gamma': 1.1777263396618873, 'rate_drop': 8.241223378669471e-08, 'skip_drop': 3.1723988051906326e-07}. Best is trial 137 with value: -1.165362986830467.
[I 2025-06-22 08:28:16,997] Trial 283 finished with value: -1.2010645991811977 and parameters: {'booster': 'dart', 'lambda': 2.312057670278342, 'alpha': 6.658375847186223e-07, 'subsample': 0.9874932629290263, 'colsample_bytree': 0.8088671219050791, 'max_depth': 3, 'min_child_weight': 7, 'eta': 0.09604619030893566, 'gamma': 1.3361398950308685, 'rate_drop': 1.1082348983738273e-07, 'skip_drop': 7.1364613881878095e-06}. Best is trial 137 with value: -1.165362986830467.
