[I 2025-06-22 08:22:12,301] Trial 96 finished with value: -1.252490587953702 and parameters: {'booster': 'dart', 'lambda': 1.7095658465080639, 'alpha': 0.28869889386620257, 'subsample': 0.9512446051884522, 'colsample_bytree': 0.610754408333592, 'max_depth': 3, 'min_child_weight': 8, 'eta': 0.1218489042260504, 'gamma': 1.2460208785804259, 'rate_drop': 9.790123162692799e-07, 'skip_drop': 2.2134999521804104e-07}. Best is trial 58 with value: -1.170529255460205.
[I 2025-06-22 08:22:13,363] Trial 97 finished with value: -1.2375981426049723 and parameters: {'booster': 'dart', 'lambda': 0.37574000402669744, 'alpha': 0.5966143365305437, 'subsample': 0.9790444408389863, 'colsample_bytree': 0.7206831965635385, 'max_depth': 3, 'min_child_weight': 6, 'eta': 0.2605072014121734, 'gamma': 0.982679034542048, 'rate_drop': 8.440796605761394e-06, 'skip_drop': 2.7909077568651807e-08}. Best is trial 58 with value: -1.170529255460205.
[I 2025-06-22 08:22:15,219] Trial 98 finished with value: -1.2317061573338806 and parameters: {'booster': 'dart', 'lambda': 0.07327854263247738, 'alpha': 3.9345931176052518, 'subsample': 0.9263594926043568, 'colsample_bytree': 0.7451551430549654, 'max_depth': 4, 'min_child_weight': 7, 'eta': 0.08517359418883123, 'gamma': 2.6769470079852806, 'rate_drop': 1.9941820342154993e-06, 'skip_drop': 1.5280920701364003e-08}. Best is trial 58 with value: -1.170529255460205.
[I 2025-06-22 08:22:17,301] Trial 99 finished with value: -1.2133207971818398 and parameters: {'booster': 'dart', 'lambda': 3.121449827375652, 'alpha': 4.644434745762095e-05, 'subsample': 0.9433579017970104, 'colsample_bytree': 0.6848471190822434, 'max_depth': 3, 'min_child_weight': 7, 'eta': 0.11201974579188223, 'gamma': 1.732861055463319, 'rate_drop': 2.723464995067704e-07, 'skip_drop': 9.806285462630185e-08}. Best is trial 58 with value: -1.170529255460205.
[I 2025-06-22 08:22:18,129] Trial 100 finished with value: -1.271938738960416 and parameters: {'booster': 'dart', 'lambda': 0.7026207585712354, 'alpha': 6.070150443787578e-06, 'subsample': 0.8909940629067046, 'colsample_bytree': 0.7001201030211579, 'max_depth': 4, 'min_child_weight': 6, 'eta': 0.21563576958006167, 'gamma': 2.2281515481314385, 'rate_drop': 5.447141597154978e-06, 'skip_drop': 1.853986086607915e-07}. Best is trial 58 with value: -1.170529255460205.
[I 2025-06-22 08:22:19,238] Trial 101 finished with value: -1.197357320193656 and parameters: {'booster': 'dart', 'lambda': 0.1471549283853426, 'alpha': 2.2313648070970062, 'subsample': 0.9097673735145876, 'colsample_bytree': 0.6356309852409753, 'max_depth': 3, 'min_child_weight': 7, 'eta': 0.14510670588616223, 'gamma': 1.1542069385245393, 'rate_drop': 2.5287248631391147e-06, 'skip_drop': 5.097202440627856e-07}. Best is trial 58 with value: -1.170529255460205.
[I 2025-06-22 08:22:20,767] Trial 102 finished with value: -1.2292962309812894 and parameters: {'booster': 'dart', 'lambda': 0.14045323812699856, 'alpha': 2.650811475382867, 'subsample': 0.9643136702394057, 'colsample_bytree': 0.536104547373819, 'max_depth': 3, 'min_child_weight': 7, 'eta': 0.16343722069002017, 'gamma': 1.1870097870193974, 'rate_drop': 6.749338553351996e-07, 'skip_drop': 1.4655827716540177e-07}. Best is trial 58 with value: -1.170529255460205.
[I 2025-06-22 08:22:21,478] Trial 103 finished with value: -1.2428248161845565 and parameters: {'booster': 'dart', 'lambda': 1.2426590103643318, 'alpha': 1.5067984912462, 'subsample': 0.8705993297189238, 'colsample_bytree': 0.6276660585965874, 'max_depth': 3, 'min_child_weight': 7, 'eta': 0.19218636171940687, 'gamma': 0.8849068542742272, 'rate_drop': 2.5268450424906297e-06, 'skip_drop': 1.3834346434890181e-06}. Best is trial 58 with value: -1.170529255460205.
[I 2025-06-22 08:22:23,258] Trial 104 finished with value: -1.2340219235458674 and parameters: {'booster': 'dart', 'lambda': 0.3262609884386281, 'alpha': 4.39298891243461, 'subsample': 0.8887426928840857, 'colsample_bytree': 0.5988289686209409, 'max_depth': 3, 'min_child_weight': 8, 'eta': 0.1393439060415562, 'gamma': 1.4139894972252294, 'rate_drop': 1.6340178581725416e-06, 'skip_drop': 4.788039185142103e-08}. Best is trial 58 with value: -1.170529255460205.
[I 2025-06-22 08:22:25,171] Trial 105 finished with value: -1.206129478640019 and parameters: {'booster': 'dart', 'lambda': 0.5758767451982169, 'alpha': 1.044989049526806, 'subsample': 0.915621585383482, 'colsample_bytree': 0.6368901494675785, 'max_depth': 3, 'min_child_weight': 6, 'eta': 0.17165966520780163, 'gamma': 2.3885479257507782, 'rate_drop': 1.7512641668874767e-07, 'skip_drop': 7.805904773474323e-08}. Best is trial 58 with value: -1.170529255460205.
[I 2025-06-22 08:22:27,999] Trial 106 finished with value: -1.2528328321524596 and parameters: {'booster': 'dart', 'lambda': 0.17175542877325084, 'alpha': 1.948638860086036, 'subsample': 0.9874801484692595, 'colsample_bytree': 0.6581078371245885, 'max_depth': 3, 'min_child_weight': 7, 'eta': 0.11435010039475028, 'gamma': 1.636218850727092, 'rate_drop': 3.7041153218827895e-07, 'skip_drop': 2.6909721649488917e-07}. Best is trial 58 with value: -1.170529255460205.
[I 2025-06-22 08:22:28,140] Trial 107 finished with value: -1.2896131907579964 and parameters: {'booster': 'gbtree', 'lambda': 0.023230243273657993, 'alpha': 0.6094211671354991, 'subsample': 0.9570745611708524, 'colsample_bytree': 0.6086847932112549, 'max_depth': 3, 'min_child_weight': 8, 'eta': 0.266714211315777, 'gamma': 0.6999214507740207}. Best is trial 58 with value: -1.170529255460205.
[I 2025-06-22 08:22:29,479] Trial 108 finished with value: -1.240161199589284 and parameters: {'booster': 'dart', 'lambda': 6.488790578157288, 'alpha': 6.83222964596307, 'subsample': 0.9422382937062985, 'colsample_bytree': 0.6160337489821115, 'max_depth': 4, 'min_child_weight': 7, 'eta': 0.2197053130158991, 'gamma': 1.1169350474664088, 'rate_drop': 5.677802233466376e-08, 'skip_drop': 1.3112671818118206e-08}. Best is trial 58 with value: -1.170529255460205.
[I 2025-06-22 08:22:30,587] Trial 109 finished with value: -1.231999703806946 and parameters: {'booster': 'dart', 'lambda': 2.291935967406946, 'alpha': 2.6380829982859146, 'subsample': 0.8523500288480407, 'colsample_bytree': 0.5879226673653851, 'max_depth': 3, 'min_child_weight': 6, 'eta': 0.15055098383453028, 'gamma': 0.8299367587562994, 'rate_drop': 1.061659344510774e-06, 'skip_drop': 3.5783358898176504e-08}. Best is trial 58 with value: -1.170529255460205.
[I 2025-06-22 08:22:32,512] Trial 110 finished with value: -1.2302499709357926 and parameters: {'booster': 'dart', 'lambda': 4.01980579575311, 'alpha': 0.3608980278369019, 'subsample': 0.9289923776991933, 'colsample_bytree': 0.6717507511008475, 'max_depth': 4, 'min_child_weight': 8, 'eta': 0.09741039651279575, 'gamma': 1.2814479884476275, 'rate_drop': 3.2860299761865178e-06, 'skip_drop': 1.4013959316394015e-07}. Best is trial 58 with value: -1.170529255460205.
[I 2025-06-22 08:22:37,367] Trial 111 finished with value: -1.478613952707419 and parameters: {'booster': 'dart', 'lambda': 1.3410089312376838, 'alpha': 4.081695626712671, 'subsample': 0.9083430414666218, 'colsample_bytree': 0.6432331098908556, 'max_depth': 3, 'min_child_weight': 7, 'eta': 0.19525367211670763, 'gamma': 1.125415386625916, 'rate_drop': 0.9241714053534597, 'skip_drop': 6.029552425613525e-07}. Best is trial 58 with value: -1.170529255460205.
[I 2025-06-22 08:22:38,846] Trial 112 finished with value: -1.2212873406676028 and parameters: {'booster': 'dart', 'lambda': 0.927401942263734, 'alpha': 7.372228120624741, 'subsample': 0.9033410149639715, 'colsample_bytree': 0.6224545179303298, 'max_depth': 3, 'min_child_weight': 7, 'eta': 0.13196322413634326, 'gamma': 1.006030139334425, 'rate_drop': 2.1184598115755866e-06, 'skip_drop': 4.5891435537144093e-07}. Best is trial 58 with value: -1.170529255460205.
[I 2025-06-22 08:22:40,518] Trial 113 finished with value: -1.2383330116050673 and parameters: {'booster': 'dart', 'lambda': 0.6196865774577831, 'alpha': 0.8001643766636141, 'subsample': 0.9739970404645318, 'colsample_bytree': 0.662502622289856, 'max_depth': 3, 'min_child_weight': 7, 'eta': 0.14048598265211856, 'gamma': 1.4944168219423708, 'rate_drop': 6.629191436874641e-07, 'skip_drop': 9.877710229775444e-07}. Best is trial 58 with value: -1.170529255460205.
[I 2025-06-22 08:22:41,935] Trial 114 finished with value: -1.2350968432594778 and parameters: {'booster': 'dart', 'lambda': 0.8615825734558871, 'alpha': 6.5020416863439765, 'subsample': 0.920311660411702, 'colsample_bytree': 0.6542304396528413, 'max_depth': 3, 'min_child_weight': 1, 'eta': 0.16071742677124629, 'gamma': 0.43515185569102566, 'rate_drop': 1.103055839086538e-05, 'skip_drop': 3.2353026762027725e-07}. Best is trial 58 with value: -1.170529255460205.
[I 2025-06-22 08:22:42,948] Trial 115 finished with value: -1.2165429507254828 and parameters: {'booster': 'dart', 'lambda': 0.2997103415951896, 'alpha': 1.8515530520743742, 'subsample': 0.8684137331700842, 'colsample_bytree': 0.6333918620784162, 'max_depth': 3, 'min_child_weight': 7, 'eta': 0.1276033674925166, 'gamma': 1.3486984022284751, 'rate_drop': 6.53561372480318e-06, 'skip_drop': 1.7306925460474778e-06}. Best is trial 58 with value: -1.170529255460205.
[I 2025-06-22 08:22:46,055] Trial 116 finished with value: -1.2619474379417903 and parameters: {'booster': 'dart', 'lambda': 1.8154591907896949, 'alpha': 9.739735632999494, 'subsample': 0.8884114717198119, 'colsample_bytree': 0.6802792230468624, 'max_depth': 3, 'min_child_weight': 6, 'eta': 0.29815667418499653, 'gamma': 1.1554246764034413, 'rate_drop': 1.1175732611546776e-07, 'skip_drop': 5.9205370528960156e-08}. Best is trial 58 with value: -1.170529255460205.
[I 2025-06-22 08:22:47,096] Trial 117 finished with value: -1.2200541014463295 and parameters: {'booster': 'dart', 'lambda': 2.5018090294854276, 'alpha': 4.420355456711562, 'subsample': 0.8328494059888474, 'colsample_bytree': 0.720894342763105, 'max_depth': 3, 'min_child_weight': 7, 'eta': 0.23935100699956544, 'gamma': 1.390734509950532, 'rate_drop': 2.553039277778139e-05, 'skip_drop': 2.341642946919906e-08}. Best is trial 58 with value: -1.170529255460205.
[I 2025-06-22 08:22:48,296] Trial 118 finished with value: -1.211679466834081 and parameters: {'booster': 'dart', 'lambda': 4.776263448096332, 'alpha': 2.7975841308127474, 'subsample': 0.994107185493617, 'colsample_bytree': 0.6910865876068651, 'max_depth': 3, 'min_child_weight': 7, 'eta': 0.17952330001073122, 'gamma': 1.5725276556279755, 'rate_drop': 1.2442267097001897e-06, 'skip_drop': 2.7542432994933783e-06}. Best is trial 58 with value: -1.170529255460205.
[I 2025-06-22 08:22:53,084] Trial 119 finished with value: -1.2125581217596355 and parameters: {'booster': 'dart', 'lambda': 9.966261114504157, 'alpha': 1.2829784296102107, 'subsample': 0.9806581894004017, 'colsample_bytree': 0.6480057393220232, 'max_depth': 3, 'min_child_weight': 8, 'eta': 0.08379574276143936, 'gamma': 0.7552465928806447, 'rate_drop': 2.7430440874898787e-06, 'skip_drop': 9.524340388641582e-08}. Best is trial 58 with value: -1.170529255460205.
[I 2025-06-22 08:22:54,383] Trial 120 finished with value: -1.2188590041695633 and parameters: {'booster': 'dart', 'lambda': 0.14078010871065688, 'alpha': 0.9390637348673663, 'subsample': 0.9675200243245957, 'colsample_bytree': 0.7083244912283737, 'max_depth': 3, 'min_child_weight': 6, 'eta': 0.2037387750409416, 'gamma': 1.0397346352496384, 'rate_drop': 2.1654405579594788e-08, 'skip_drop': 1.5433784174793557e-07}. Best is trial 58 with value: -1.170529255460205.
[I 2025-06-22 08:22:55,455] Trial 121 finished with value: -1.2317787322617413 and parameters: {'booster': 'dart', 'lambda': 0.7845603043244852, 'alpha': 5.800797050559, 'subsample': 0.8742036994583993, 'colsample_bytree': 0.6540589332997033, 'max_depth': 3, 'min_child_weight': 7, 'eta': 0.1404467489605674, 'gamma': 1.127580404869196, 'rate_drop': 1.5493318433223995e-06, 'skip_drop': 8.41040172727123e-07}. Best is trial 58 with value: -1.170529255460205.
[I 2025-06-22 08:22:56,554] Trial 122 finished with value: -1.218015632179266 and parameters: {'booster': 'dart', 'lambda': 0.5197801102577824, 'alpha': 4.20091338178181, 'subsample': 0.8994562848402343, 'colsample_bytree': 0.668081856091546, 'max_depth': 3, 'min_child_weight': 7, 'eta': 0.15953198237918578, 'gamma': 1.287547939077494, 'rate_drop': 1.0487341333374773e-06, 'skip_drop': 5.371565372027399e-07}. Best is trial 58 with value: -1.170529255460205.
[I 2025-06-22 08:22:57,628] Trial 123 finished with value: -1.210023518039462 and parameters: {'booster': 'dart', 'lambda': 1.0159270793708597, 'alpha': 2.4346399251574655, 'subsample': 0.9319592460305796, 'colsample_bytree': 0.6305267772228752, 'max_depth': 3, 'min_child_weight': 7, 'eta': 0.14983409760394073, 'gamma': 0.9568229272122677, 'rate_drop': 4.307499266751297e-06, 'skip_drop': 2.9918745522859196e-07}. Best is trial 58 with value: -1.170529255460205.
[I 2025-06-22 08:22:59,541] Trial 124 finished with value: -1.2285362900878736 and parameters: {'booster': 'dart', 'lambda': 0.33231862945430485, 'alpha': 6.675437662570244, 'subsample': 0.8815819671147888, 'colsample_bytree': 0.6412623761358003, 'max_depth': 3, 'min_child_weight': 7, 'eta': 0.11102519205989379, 'gamma': 1.468312676287867, 'rate_drop': 6.052161350619873e-07, 'skip_drop': 5.548024479920674e-06}. Best is trial 58 with value: -1.170529255460205.
[I 2025-06-22 08:23:00,391] Trial 125 finished with value: -1.2326992127350263 and parameters: {'booster': 'dart', 'lambda': 1.5893482332183626, 'alpha': 1.407788887930894, 'subsample': 0.8530824229407297, 'colsample_bytree': 0.6181030720602818, 'max_depth': 4, 'min_child_weight': 6, 'eta': 0.18473989983430786, 'gamma': 0.8425679175672309, 'rate_drop': 2.2245773180455226e-07, 'skip_drop': 7.826325205490402e-07}. Best is trial 58 with value: -1.170529255460205.
[I 2025-06-22 08:23:01,975] Trial 126 finished with value: -1.2098126896007164 and parameters: {'booster': 'dart', 'lambda': 3.238756589726892, 'alpha': 3.5219005623709045, 'subsample': 0.9450490260407863, 'colsample_bytree': 0.7734440483186202, 'max_depth': 3, 'min_child_weight': 7, 'eta': 0.1294566970254507, 'gamma': 1.1818125040338003, 'rate_drop': 3.7661355045527803e-07, 'skip_drop': 0.9689887842367202}. Best is trial 58 with value: -1.170529255460205.
[I 2025-06-22 08:23:02,123] Trial 127 finished with value: -1.2674656932794257 and parameters: {'booster': 'gbtree', 'lambda': 0.6414458664899656, 'alpha': 1.9538217329924579, 'subsample': 0.9574288308370716, 'colsample_bytree': 0.6801250284775296, 'max_depth': 3, 'min_child_weight': 8, 'eta': 0.22224732592070645, 'gamma': 0.6326542240659196}. Best is trial 58 with value: -1.170529255460205.
[I 2025-06-22 08:23:10,679] Trial 128 finished with value: -1.4898471869236574 and parameters: {'booster': 'dart', 'lambda': 0.21452291388158956, 'alpha': 0.5023535189226125, 'subsample': 0.9098450690716169, 'colsample_bytree': 0.6476557851441643, 'max_depth': 3, 'min_child_weight': 6, 'eta': 0.003994407783241519, 'gamma': 1.8647385270813097, 'rate_drop': 1.641381640556367e-06, 'skip_drop': 2.1694501926788582e-07}. Best is trial 58 with value: -1.170529255460205.
[I 2025-06-22 08:23:12,523] Trial 129 finished with value: -1.2025866070920745 and parameters: {'booster': 'dart', 'lambda': 0.06588502664862728, 'alpha': 4.779802853545552, 'subsample': 0.8594135950124486, 'colsample_bytree': 0.7393556089204354, 'max_depth': 4, 'min_child_weight': 5, 'eta': 0.10162787402829117, 'gamma': 1.6716165090117094, 'rate_drop': 8.425415054348183e-07, 'skip_drop': 4.0170653874925586e-07}. Best is trial 58 with value: -1.170529255460205.
[I 2025-06-22 08:23:13,942] Trial 130 finished with value: -1.2220345720068466 and parameters: {'booster': 'dart', 'lambda': 0.12707255644200458, 'alpha': 0.0007827404786791498, 'subsample': 0.8424759587428073, 'colsample_bytree': 0.7493145442363601, 'max_depth': 4, 'min_child_weight': 5, 'eta': 0.098229632501218, 'gamma': 1.726106167864716, 'rate_drop': 8.372492491887324e-07, 'skip_drop': 4.4720987603632995e-07}. Best is trial 58 with value: -1.170529255460205.
[I 2025-06-22 08:23:15,315] Trial 131 finished with value: -1.2158555580566792 and parameters: {'booster': 'dart', 'lambda': 0.060305180750399215, 'alpha': 5.14564209334907, 'subsample': 0.8607597503433464, 'colsample_bytree': 0.7333855693965741, 'max_depth': 3, 'min_child_weight': 4, 'eta': 0.1195695824782501, 'gamma': 1.6050304901196761, 'rate_drop': 2.673143548519126e-06, 'skip_drop': 1.0481252073937636e-07}. Best is trial 58 with value: -1.170529255460205.
[I 2025-06-22 08:23:16,498] Trial 132 finished with value: -1.257234768580108 and parameters: {'booster': 'dart', 'lambda': 0.4420170504042563, 'alpha': 9.646607566984295, 'subsample': 0.882326557484457, 'colsample_bytree': 0.7895189195760903, 'max_depth': 5, 'min_child_weight': 5, 'eta': 0.15344875878322206, 'gamma': 1.282170486906414, 'rate_drop': 5.145712694441451e-07, 'skip_drop': 3.5524035575522115e-07}. Best is trial 58 with value: -1.170529255460205.
[I 2025-06-22 08:23:17,589] Trial 133 finished with value: -1.2434311624939316 and parameters: {'booster': 'dart', 'lambda': 0.9038153234591462, 'alpha': 2.909023907382242, 'subsample': 0.8959185054404829, 'colsample_bytree': 0.6969475181174365, 'max_depth': 3, 'min_child_weight': 5, 'eta': 0.1708699033107925, 'gamma': 1.421368848910478, 'rate_drop': 1.446012748119183e-06, 'skip_drop': 1.2534697192813624e-06}. Best is trial 58 with value: -1.170529255460205.
[I 2025-06-22 08:23:20,070] Trial 134 finished with value: -1.1890367616719415 and parameters: {'booster': 'dart', 'lambda': 0.2482564026627956, 'alpha': 4.793810864814873, 'subsample': 0.8676542232704686, 'colsample_bytree': 0.7595603198756445, 'max_depth': 3, 'min_child_weight': 7, 'eta': 0.24905042999987992, 'gamma': 1.0885893709146095, 'rate_drop': 4.954264826216633e-06, 'skip_drop': 4.810521172692386e-08}. Best is trial 58 with value: -1.170529255460205.
[I 2025-06-22 08:23:20,868] Trial 135 finished with value: -1.2591794578367441 and parameters: {'booster': 'dart', 'lambda': 0.09895467212823068, 'alpha': 1.460597905467243, 'subsample': 0.8267038175826067, 'colsample_bytree': 0.7166448143268382, 'max_depth': 3, 'min_child_weight': 7, 'eta': 0.25702200348177423, 'gamma': 1.9681892298919728, 'rate_drop': 5.69764511687185e-06, 'skip_drop': 5.0399730218022953e-08}. Best is trial 58 with value: -1.170529255460205.
[I 2025-06-22 08:23:22,383] Trial 136 finished with value: -1.2310306173924084 and parameters: {'booster': 'dart', 'lambda': 0.033327862021296964, 'alpha': 0.9287259621393621, 'subsample': 0.8607409026976284, 'colsample_bytree': 0.7420507136943246, 'max_depth': 3, 'min_child_weight': 6, 'eta': 0.20787417266365996, 'gamma': 0.9465994479138573, 'rate_drop': 4.039577825366726e-06, 'skip_drop': 3.1120066209247e-08}. Best is trial 58 with value: -1.170529255460205.
[I 2025-06-22 08:23:23,770] Trial 137 finished with value: -1.165362986830467 and parameters: {'booster': 'dart', 'lambda': 0.24003760620680895, 'alpha': 3.79549881644242, 'subsample': 0.9504995784940309, 'colsample_bytree': 0.7604044716048105, 'max_depth': 3, 'min_child_weight': 7, 'eta': 0.24614488950672417, 'gamma': 2.899307590851688, 'rate_drop': 3.847435689452973e-08, 'skip_drop': 6.96148271568361e-08}. Best is trial 137 with value: -1.165362986830467.
[I 2025-06-22 08:23:24,159] Trial 138 finished with value: -1.3232030661080298 and parameters: {'booster': 'dart', 'lambda': 0.2185394690994147, 'alpha': 5.51257274460625e-07, 'subsample': 0.9667534824490559, 'colsample_bytree': 0.7669746933837646, 'max_depth': 4, 'min_child_weight': 6, 'eta': 0.2762310416636831, 'gamma': 3.2078545064910693, 'rate_drop': 4.5731531469295575e-08, 'skip_drop': 7.244653700477921e-08}. Best is trial 137 with value: -1.165362986830467.
[I 2025-06-22 08:23:24,626] Trial 139 finished with value: -1.2580566809653504 and parameters: {'booster': 'dart', 'lambda': 0.07684200875216143, 'alpha': 2.4518112162812247, 'subsample': 0.95313669633422, 'colsample_bytree': 0.7632217371623976, 'max_depth': 3, 'min_child_weight': 7, 'eta': 0.23046172302671458, 'gamma': 2.869238191638132, 'rate_drop': 1.7410479268091006e-08, 'skip_drop': 2.2478697981156904e-08}. Best is trial 137 with value: -1.165362986830467.
[I 2025-06-22 08:23:25,100] Trial 140 finished with value: -1.2318587098552864 and parameters: {'booster': 'dart', 'lambda': 0.3639136346295396, 'alpha': 3.867092087953909, 'subsample': 0.9798485579181642, 'colsample_bytree': 0.7552171930951105, 'max_depth': 3, 'min_child_weight': 5, 'eta': 0.24375559067909336, 'gamma': 3.0322519463244757, 'rate_drop': 8.905500605202526e-08, 'skip_drop': 3.923905863390649e-08}. Best is trial 137 with value: -1.165362986830467.
[I 2025-06-22 08:23:26,619] Trial 141 finished with value: -1.2044069491022718 and parameters: {'booster': 'dart', 'lambda': 1.420895171688964, 'alpha': 6.45969042238612, 'subsample': 0.9384676986219723, 'colsample_bytree': 0.721676212350263, 'max_depth': 3, 'min_child_weight': 7, 'eta': 0.18804016905080434, 'gamma': 1.0373147220078072, 'rate_drop': 2.1675876010641657e-06, 'skip_drop': 1.8123324458323905e-07}. Best is trial 137 with value: -1.165362986830467.
[I 2025-06-22 08:23:28,091] Trial 142 finished with value: -1.199147362344076 and parameters: {'booster': 'dart', 'lambda': 1.4898617239856755, 'alpha': 1.8221111025216374, 'subsample': 0.9337825067252434, 'colsample_bytree': 0.7289409939572382, 'max_depth': 3, 'min_child_weight': 7, 'eta': 0.1942661939745298, 'gamma': 2.558473035431669, 'rate_drop': 4.0987709523096776e-08, 'skip_drop': 1.6828428485828946e-07}. Best is trial 137 with value: -1.165362986830467.
