[I 2025-06-22 08:24:44,359] Trial 190 finished with value: -1.215130026973952 and parameters: {'booster': 'dart', 'lambda': 4.194604636767358, 'alpha': 5.460337056796448e-08, 'subsample': 0.9217859642891488, 'colsample_bytree': 0.8199418614775077, 'max_depth': 3, 'min_child_weight': 7, 'eta': 0.2997663320002571, 'gamma': 3.1812914953021325, 'rate_drop': 1.0876913754835688e-07, 'skip_drop': 1.266341563864102e-08}. Best is trial 137 with value: -1.165362986830467.
[I 2025-06-22 08:24:45,848] Trial 191 finished with value: -1.2398296625230263 and parameters: {'booster': 'dart', 'lambda': 1.1794628956395063, 'alpha': 6.5170399411629e-05, 'subsample': 0.9639932399123038, 'colsample_bytree': 0.7684789305043112, 'max_depth': 3, 'min_child_weight': 7, 'eta': 0.16618485222906257, 'gamma': 2.7966023977566565, 'rate_drop': 4.9941404773499006e-08, 'skip_drop': 6.46219433917442e-08}. Best is trial 137 with value: -1.165362986830467.
[I 2025-06-22 08:24:47,263] Trial 192 finished with value: -1.2676934618819813 and parameters: {'booster': 'dart', 'lambda': 0.7657722211946374, 'alpha': 0.0002335495535765367, 'subsample': 0.9613451473826229, 'colsample_bytree': 0.7762781848063471, 'max_depth': 3, 'min_child_weight': 7, 'eta': 0.18077422804157486, 'gamma': 2.6831753632310025, 'rate_drop': 2.2486848379503404e-08, 'skip_drop': 0.00021646204794495118}. Best is trial 137 with value: -1.165362986830467.
[I 2025-06-22 08:24:47,801] Trial 193 finished with value: -1.2465860942404619 and parameters: {'booster': 'dart', 'lambda': 2.0407991041292033, 'alpha': 8.939146102094666e-05, 'subsample': 0.9465079691908126, 'colsample_bytree': 0.7064477767909941, 'max_depth': 3, 'min_child_weight': 7, 'eta': 0.2114500062943873, 'gamma': 2.7598606496059572, 'rate_drop': 4.322930618822748e-08, 'skip_drop': 1.1456293542915535e-07}. Best is trial 137 with value: -1.165362986830467.
[I 2025-06-22 08:24:50,678] Trial 194 finished with value: -1.1894796074123724 and parameters: {'booster': 'dart', 'lambda': 1.035717557283173, 'alpha': 2.3905845205729024e-06, 'subsample': 0.9711356691006705, 'colsample_bytree': 0.7973718853686129, 'max_depth': 3, 'min_child_weight': 7, 'eta': 0.24252873473857783, 'gamma': 2.963046047086606, 'rate_drop': 3.283036094543353e-08, 'skip_drop': 2.578172407632875e-07}. Best is trial 137 with value: -1.165362986830467.
[I 2025-06-22 08:24:51,435] Trial 195 finished with value: -1.2438270869264674 and parameters: {'booster': 'dart', 'lambda': 4.595666119770704e-05, 'alpha': 1.522807673832391e-05, 'subsample': 0.9888384582360815, 'colsample_bytree': 0.8018043438822204, 'max_depth': 3, 'min_child_weight': 7, 'eta': 0.24907829677931811, 'gamma': 2.9314265367261005, 'rate_drop': 2.9491641491650346e-08, 'skip_drop': 3.1949420759163073e-07}. Best is trial 137 with value: -1.165362986830467.
[I 2025-06-22 08:24:53,596] Trial 196 finished with value: -1.2115023906200841 and parameters: {'booster': 'dart', 'lambda': 2.8388679580123335, 'alpha': 8.32640332418656e-07, 'subsample': 0.9740088123800903, 'colsample_bytree': 0.7134342000065459, 'max_depth': 3, 'min_child_weight': 8, 'eta': 0.23768336353102204, 'gamma': 3.0090611768836175, 'rate_drop': 2.201788065708407e-08, 'skip_drop': 1.9725722440493468e-07}. Best is trial 137 with value: -1.165362986830467.
[I 2025-06-22 08:24:54,849] Trial 197 finished with value: -1.2753245574008005 and parameters: {'booster': 'dart', 'lambda': 0.38216599758938846, 'alpha': 8.683253873224124e-06, 'subsample': 0.8724248210593265, 'colsample_bytree': 0.7987568044206752, 'max_depth': 3, 'min_child_weight': 7, 'eta': 0.2073205728683335, 'gamma': 1.2016129189696338, 'rate_drop': 1.1430153491747593e-08, 'skip_drop': 2.3791203359024195e-08}. Best is trial 137 with value: -1.165362986830467.
[I 2025-06-22 08:24:56,371] Trial 198 finished with value: -1.2297015786596712 and parameters: {'booster': 'dart', 'lambda': 0.6300224621971338, 'alpha': 0.0038945197787184564, 'subsample': 0.9127883899462291, 'colsample_bytree': 0.6891941319006043, 'max_depth': 3, 'min_child_weight': 6, 'eta': 0.1310902330537807, 'gamma': 2.3077047384966374, 'rate_drop': 7.611877970950103e-08, 'skip_drop': 3.952776334246518e-08}. Best is trial 137 with value: -1.165362986830467.
[I 2025-06-22 08:24:56,960] Trial 199 finished with value: -1.2148711441349962 and parameters: {'booster': 'dart', 'lambda': 1.6171857760407502, 'alpha': 3.556619798132632, 'subsample': 0.9472400463763865, 'colsample_bytree': 0.8136981338962846, 'max_depth': 3, 'min_child_weight': 7, 'eta': 0.25902850109304737, 'gamma': 2.555784636883893, 'rate_drop': 3.377034787912548e-08, 'skip_drop': 5.165141071080747e-08}. Best is trial 137 with value: -1.165362986830467.
[I 2025-06-22 08:24:58,806] Trial 200 finished with value: -1.277708474627603 and parameters: {'booster': 'dart', 'lambda': 0.1726925323482627, 'alpha': 3.946556662628647e-06, 'subsample': 0.9335909932470796, 'colsample_bytree': 0.7906405948597913, 'max_depth': 3, 'min_child_weight': 7, 'eta': 0.1475590434803939, 'gamma': 2.246997333866263, 'rate_drop': 1.2834733401248886e-07, 'skip_drop': 7.437723176164051e-08}. Best is trial 137 with value: -1.165362986830467.
[I 2025-06-22 08:25:00,308] Trial 201 finished with value: -1.2113149394139127 and parameters: {'booster': 'dart', 'lambda': 0.9776418684556663, 'alpha': 0.02566451356729321, 'subsample': 0.9617346027020672, 'colsample_bytree': 0.7796352930566702, 'max_depth': 3, 'min_child_weight': 7, 'eta': 0.17333373300571586, 'gamma': 3.064954148045354, 'rate_drop': 5.435040284349078e-08, 'skip_drop': 2.097752575181234e-07}. Best is trial 137 with value: -1.165362986830467.
[I 2025-06-22 08:25:01,008] Trial 202 finished with value: -1.2529798976343296 and parameters: {'booster': 'dart', 'lambda': 1.1334196007141426, 'alpha': 1.4754858289598146e-07, 'subsample': 0.9721518464262425, 'colsample_bytree': 0.7610845649241378, 'max_depth': 3, 'min_child_weight': 7, 'eta': 0.19792949812797703, 'gamma': 2.828722052556908, 'rate_drop': 3.8470392700755015e-08, 'skip_drop': 5.792423118679927e-07}. Best is trial 137 with value: -1.165362986830467.
[I 2025-06-22 08:25:04,103] Trial 203 finished with value: -1.191349685608582 and parameters: {'booster': 'dart', 'lambda': 2.1041530940851305, 'alpha': 1.7311365203538576, 'subsample': 0.9827367629413359, 'colsample_bytree': 0.769554702459022, 'max_depth': 3, 'min_child_weight': 7, 'eta': 0.2263099578645361, 'gamma': 3.309873377404125, 'rate_drop': 1.838083905183123e-08, 'skip_drop': 1.2771515651431858e-07}. Best is trial 137 with value: -1.165362986830467.
[I 2025-06-22 08:25:05,240] Trial 204 finished with value: -1.2066666460552566 and parameters: {'booster': 'dart', 'lambda': 2.362136634095794, 'alpha': 1.8761021488566787, 'subsample': 0.9834489777646416, 'colsample_bytree': 0.789569785338349, 'max_depth': 3, 'min_child_weight': 7, 'eta': 0.2179307229283828, 'gamma': 1.3680888310101433, 'rate_drop': 1.620854540438506e-08, 'skip_drop': 9.663553222310859e-08}. Best is trial 137 with value: -1.165362986830467.
[I 2025-06-22 08:25:06,614] Trial 205 finished with value: -1.2549866588922407 and parameters: {'booster': 'dart', 'lambda': 4.085177376878549, 'alpha': 3.3238782438515167e-06, 'subsample': 0.9945608401649118, 'colsample_bytree': 0.747601108147781, 'max_depth': 3, 'min_child_weight': 7, 'eta': 0.23647234975147619, 'gamma': 2.630182699300661, 'rate_drop': 2.3094898570513198e-08, 'skip_drop': 3.118356012157195e-07}. Best is trial 137 with value: -1.165362986830467.
[I 2025-06-22 08:25:07,098] Trial 206 finished with value: -1.2081335636862658 and parameters: {'booster': 'dart', 'lambda': 1.8815214461344443, 'alpha': 1.1376075992310806, 'subsample': 0.9532819545525765, 'colsample_bytree': 0.825887532460325, 'max_depth': 3, 'min_child_weight': 7, 'eta': 0.2506342311105696, 'gamma': 3.4266090421664557, 'rate_drop': 1.3088355722272168e-08, 'skip_drop': 3.396928762624058e-08}. Best is trial 137 with value: -1.165362986830467.
[I 2025-06-22 08:25:11,164] Trial 207 finished with value: -1.225505557779688 and parameters: {'booster': 'dart', 'lambda': 5.759192978829882, 'alpha': 3.364628128378857, 'subsample': 0.9819616439452283, 'colsample_bytree': 0.7552714292128005, 'max_depth': 3, 'min_child_weight': 6, 'eta': 0.19847944432411282, 'gamma': 3.2858122244064036, 'rate_drop': 8.828635614387827e-05, 'skip_drop': 0.0013442476003847537}. Best is trial 137 with value: -1.165362986830467.
[I 2025-06-22 08:25:19,751] Trial 208 finished with value: -1.4796527588876844 and parameters: {'booster': 'dart', 'lambda': 3.317063029446944, 'alpha': 2.0496962192726516, 'subsample': 0.5858090839544369, 'colsample_bytree': 0.768588172391921, 'max_depth': 3, 'min_child_weight': 7, 'eta': 0.005247243085171731, 'gamma': 2.44238790869031, 'rate_drop': 1.0755076240840636e-05, 'skip_drop': 1.1525560891474315e-07}. Best is trial 137 with value: -1.165362986830467.
[I 2025-06-22 08:25:20,174] Trial 209 finished with value: -1.5988579238766862 and parameters: {'booster': 'gbtree', 'lambda': 0.001578253107845504, 'alpha': 1.4595614710544458, 'subsample': 0.924466641965214, 'colsample_bytree': 0.8024701463680236, 'max_depth': 3, 'min_child_weight': 8, 'eta': 0.0016323697514898736, 'gamma': 1.0927659741988123}. Best is trial 137 with value: -1.165362986830467.
[I 2025-06-22 08:25:21,524] Trial 210 finished with value: -1.1845270472825327 and parameters: {'booster': 'dart', 'lambda': 0.007157297781717013, 'alpha': 4.061013526552973, 'subsample': 0.9695594068838903, 'colsample_bytree': 0.7383474310549373, 'max_depth': 3, 'min_child_weight': 7, 'eta': 0.1540246112787199, 'gamma': 3.875989741106187, 'rate_drop': 1.903044897239542e-08, 'skip_drop': 1.885409815341457e-08}. Best is trial 137 with value: -1.165362986830467.
[I 2025-06-22 08:25:22,873] Trial 211 finished with value: -1.2224447464734898 and parameters: {'booster': 'dart', 'lambda': 0.24856941008674688, 'alpha': 5.1815407011016505, 'subsample': 0.9709281922029344, 'colsample_bytree': 0.7235803561337613, 'max_depth': 3, 'min_child_weight': 7, 'eta': 0.15775044926346987, 'gamma': 3.883412382907632, 'rate_drop': 1.8690640032896304e-08, 'skip_drop': 2.0355893366924994e-08}. Best is trial 137 with value: -1.165362986830467.
[I 2025-06-22 08:25:31,615] Trial 212 finished with value: -1.2466132498284002 and parameters: {'booster': 'dart', 'lambda': 0.008188039317555263, 'alpha': 2.8498130380746916, 'subsample': 0.9605154429793581, 'colsample_bytree': 0.7381100005484299, 'max_depth': 3, 'min_child_weight': 7, 'eta': 0.020849618329684717, 'gamma': 4.1599119030862255, 'rate_drop': 2.8214061033070138e-08, 'skip_drop': 1.7453578755848662e-08}. Best is trial 137 with value: -1.165362986830467.
[I 2025-06-22 08:25:33,419] Trial 213 finished with value: -1.199236340880695 and parameters: {'booster': 'dart', 'lambda': 1.5187874394089649, 'alpha': 3.837068999851427, 'subsample': 0.9407956800136823, 'colsample_bytree': 0.7389454250796543, 'max_depth': 3, 'min_child_weight': 7, 'eta': 0.12300925594372247, 'gamma': 2.4933617430773527, 'rate_drop': 1.0442285723496441e-08, 'skip_drop': 3.193802932277976e-08}. Best is trial 137 with value: -1.165362986830467.
[I 2025-06-22 08:25:37,197] Trial 214 finished with value: -1.2133496286230343 and parameters: {'booster': 'dart', 'lambda': 0.13503887127160505, 'alpha': 3.8646454761827846, 'subsample': 0.9425069429353298, 'colsample_bytree': 0.7317879972147129, 'max_depth': 3, 'min_child_weight': 7, 'eta': 0.12766811395392835, 'gamma': 4.543550890921668, 'rate_drop': 1.0698309242371847e-08, 'skip_drop': 7.816617500973085e-08}. Best is trial 137 with value: -1.165362986830467.
[I 2025-06-22 08:25:38,679] Trial 215 finished with value: -1.2037636132044958 and parameters: {'booster': 'dart', 'lambda': 2.5184412480339753, 'alpha': 2.162899265814913, 'subsample': 0.982374737202364, 'colsample_bytree': 0.7443145862797936, 'max_depth': 3, 'min_child_weight': 7, 'eta': 0.14075017654021307, 'gamma': 3.9851245850873425, 'rate_drop': 2.0141969107173315e-08, 'skip_drop': 2.4254451127182765e-07}. Best is trial 137 with value: -1.165362986830467.
[I 2025-06-22 08:25:39,833] Trial 216 finished with value: -1.1984898380606264 and parameters: {'booster': 'dart', 'lambda': 0.7890939330101874, 'alpha': 3.7718727843546866, 'subsample': 0.9523413881842794, 'colsample_bytree': 0.7194896298253501, 'max_depth': 3, 'min_child_weight': 7, 'eta': 0.11838040341429068, 'gamma': 4.320076539186001, 'rate_drop': 1.6049696644216447e-08, 'skip_drop': 4.61973995603762e-08}. Best is trial 137 with value: -1.165362986830467.
[I 2025-06-22 08:25:43,219] Trial 217 finished with value: -1.2160544049057946 and parameters: {'booster': 'dart', 'lambda': 0.38273129747969586, 'alpha': 1.0469904830923638, 'subsample': 0.9709742333543017, 'colsample_bytree': 0.7127444830341734, 'max_depth': 3, 'min_child_weight': 6, 'eta': 0.11063136347629692, 'gamma': 4.225840840831511, 'rate_drop': 3.727937863798652e-08, 'skip_drop': 5.0673300287476705e-08}. Best is trial 137 with value: -1.165362986830467.
[I 2025-06-22 08:25:44,604] Trial 218 finished with value: -1.212379377457856 and parameters: {'booster': 'dart', 'lambda': 0.5793024585710316, 'alpha': 6.403922385218984, 'subsample': 0.9530137866653956, 'colsample_bytree': 0.7226482978076479, 'max_depth': 3, 'min_child_weight': 7, 'eta': 0.22582125269811307, 'gamma': 4.775868072119276, 'rate_drop': 1.5758868633929083e-08, 'skip_drop': 1.1010888256174852e-08}. Best is trial 137 with value: -1.165362986830467.
[I 2025-06-22 08:25:47,229] Trial 219 finished with value: -1.234811901512308 and parameters: {'booster': 'dart', 'lambda': 0.8759731250079762, 'alpha': 2.1927116221221477, 'subsample': 0.9900983952330628, 'colsample_bytree': 0.6993091023671977, 'max_depth': 3, 'min_child_weight': 7, 'eta': 0.27811379594936353, 'gamma': 3.793228820620043, 'rate_drop': 3.3767783747126695e-06, 'skip_drop': 1.6542008234574833e-07}. Best is trial 137 with value: -1.165362986830467.
[I 2025-06-22 08:25:47,980] Trial 220 finished with value: -1.2503596563731152 and parameters: {'booster': 'dart', 'lambda': 0.6915007502186412, 'alpha': 9.939007840669753, 'subsample': 0.9588265734020133, 'colsample_bytree': 0.7545145844169899, 'max_depth': 3, 'min_child_weight': 7, 'eta': 0.19107678384945267, 'gamma': 3.547147841945018, 'rate_drop': 5.813750503614463e-08, 'skip_drop': 8.43931106006118e-08}. Best is trial 137 with value: -1.165362986830467.
[I 2025-06-22 08:25:51,129] Trial 221 finished with value: -1.2220721451283023 and parameters: {'booster': 'dart', 'lambda': 1.657035634642381, 'alpha': 4.067684259989501, 'subsample': 0.9400727240386161, 'colsample_bytree': 0.7329258623349181, 'max_depth': 3, 'min_child_weight': 7, 'eta': 0.12571607413230382, 'gamma': 4.3426451801305905, 'rate_drop': 1.0415569585883348e-08, 'skip_drop': 2.5880398986690845e-08}. Best is trial 137 with value: -1.165362986830467.
[I 2025-06-22 08:25:53,383] Trial 222 finished with value: -1.177409025773366 and parameters: {'booster': 'dart', 'lambda': 3.626787623461472, 'alpha': 2.693710174291325e-07, 'subsample': 0.9471679615642926, 'colsample_bytree': 0.7419716781203813, 'max_depth': 3, 'min_child_weight': 7, 'eta': 0.1179973038352857, 'gamma': 1.271434039765616, 'rate_drop': 1.5874933735726167e-08, 'skip_drop': 5.4181599242406076e-08}. Best is trial 137 with value: -1.165362986830467.
[I 2025-06-22 08:25:55,284] Trial 223 finished with value: -1.2083438395395645 and parameters: {'booster': 'dart', 'lambda': 4.575316663184964, 'alpha': 2.209504885406728e-08, 'subsample': 0.9502503017611781, 'colsample_bytree': 0.7162701876675764, 'max_depth': 3, 'min_child_weight': 7, 'eta': 0.0952914201364174, 'gamma': 3.6461620752525246, 'rate_drop': 0.0002967842592580181, 'skip_drop': 5.0983990425261704e-08}. Best is trial 137 with value: -1.165362986830467.
[I 2025-06-22 08:25:56,381] Trial 224 finished with value: -1.211309092189227 and parameters: {'booster': 'dart', 'lambda': 3.042485177032933, 'alpha': 1.6162254107064722, 'subsample': 0.9683223684803163, 'colsample_bytree': 0.7488443998266222, 'max_depth': 3, 'min_child_weight': 7, 'eta': 0.15287826965764872, 'gamma': 1.2299992605179826, 'rate_drop': 1.8256662395128877e-08, 'skip_drop': 1.2840450075912477e-07}. Best is trial 137 with value: -1.165362986830467.
[I 2025-06-22 08:25:57,934] Trial 225 finished with value: -1.2342413480881298 and parameters: {'booster': 'dart', 'lambda': 2.0806584972784596e-08, 'alpha': 2.925164102017623, 'subsample': 0.9298721032430172, 'colsample_bytree': 0.7718809032393805, 'max_depth': 3, 'min_child_weight': 7, 'eta': 0.10432279168751292, 'gamma': 1.5002870017932444, 'rate_drop': 2.8830917686624877e-08, 'skip_drop': 6.853287327500871e-08}. Best is trial 137 with value: -1.165362986830467.
[I 2025-06-22 08:25:59,642] Trial 226 finished with value: -1.2278641702779551 and parameters: {'booster': 'dart', 'lambda': 0.10488519432968253, 'alpha': 1.2252391078667417, 'subsample': 0.9764227180687554, 'colsample_bytree': 0.6064665266066709, 'max_depth': 3, 'min_child_weight': 7, 'eta': 0.14092326636557834, 'gamma': 1.4123475053596546, 'rate_drop': 1.6018891829571642e-08, 'skip_drop': 4.244072255515685e-08}. Best is trial 137 with value: -1.165362986830467.
[I 2025-06-22 08:26:00,856] Trial 227 finished with value: -1.2156685484265477 and parameters: {'booster': 'dart', 'lambda': 7.2321555981797125, 'alpha': 1.1269024424669372e-07, 'subsample': 0.9561760725910675, 'colsample_bytree': 0.6885949604427872, 'max_depth': 3, 'min_child_weight': 6, 'eta': 0.15888140712891485, 'gamma': 4.065645331042415, 'rate_drop': 0.0038634641115740764, 'skip_drop': 4.386229926077538e-07}. Best is trial 137 with value: -1.165362986830467.
[I 2025-06-22 08:26:02,258] Trial 228 finished with value: -1.2455858781501947 and parameters: {'booster': 'dart', 'lambda': 2.2368035517700315, 'alpha': 3.055844489274511e-07, 'subsample': 0.9636612198412299, 'colsample_bytree': 0.7622753327308639, 'max_depth': 3, 'min_child_weight': 7, 'eta': 0.22960228403409516, 'gamma': 1.3255210865004596, 'rate_drop': 4.747244889913215e-08, 'skip_drop': 1.7683615002623338e-08}. Best is trial 137 with value: -1.165362986830467.
[I 2025-06-22 08:26:03,516] Trial 229 finished with value: -1.211420654591197 and parameters: {'booster': 'dart', 'lambda': 5.853858847479935, 'alpha': 0.9225199569992021, 'subsample': 0.947228197206569, 'colsample_bytree': 0.7832096671252958, 'max_depth': 3, 'min_child_weight': 8, 'eta': 0.19582706624409224, 'gamma': 4.525452838358285, 'rate_drop': 2.6147434099825693e-08, 'skip_drop': 0.005083702889303627}. Best is trial 137 with value: -1.165362986830467.
[I 2025-06-22 08:26:04,649] Trial 230 finished with value: -1.2516999216918359 and parameters: {'booster': 'dart', 'lambda': 0.045719181002968234, 'alpha': 1.594571324834441e-06, 'subsample': 0.9347046055400448, 'colsample_bytree': 0.7036999750826042, 'max_depth': 3, 'min_child_weight': 7, 'eta': 0.11883517257218197, 'gamma': 1.1698323099126382, 'rate_drop': 5.154745786197245e-06, 'skip_drop': 9.910623883425615e-08}. Best is trial 137 with value: -1.165362986830467.
[I 2025-06-22 08:26:06,144] Trial 231 finished with value: -1.2178163148503318 and parameters: {'booster': 'dart', 'lambda': 1.2907871764564651, 'alpha': 4.318301035920783, 'subsample': 0.9404604077562055, 'colsample_bytree': 0.7280575235644418, 'max_depth': 3, 'min_child_weight': 7, 'eta': 0.1315875717014313, 'gamma': 1.3072885533548615, 'rate_drop': 1.6270543464834086e-08, 'skip_drop': 3.056809095505549e-08}. Best is trial 137 with value: -1.165362986830467.
[I 2025-06-22 08:26:07,256] Trial 232 finished with value: -1.224721473879386 and parameters: {'booster': 'dart', 'lambda': 3.270129549953961, 'alpha': 3.3390181499127953, 'subsample': 0.9194662967909608, 'colsample_bytree': 0.7405923237779848, 'max_depth': 3, 'min_child_weight': 7, 'eta': 0.11678435315003784, 'gamma': 1.0199054277278152, 'rate_drop': 1.2553978335391795e-08, 'skip_drop': 3.753471641506245e-08}. Best is trial 137 with value: -1.165362986830467.
[I 2025-06-22 08:26:10,570] Trial 233 finished with value: -1.217720903063695 and parameters: {'booster': 'dart', 'lambda': 1.8279111846814453, 'alpha': 6.06708981108397, 'subsample': 0.9469509934557659, 'colsample_bytree': 0.7380652046464685, 'max_depth': 3, 'min_child_weight': 7, 'eta': 0.17703342692007237, 'gamma': 2.607772962772116, 'rate_drop': 2.2047594536294e-08, 'skip_drop': 5.6663787243764686e-08}. Best is trial 137 with value: -1.165362986830467.
[I 2025-06-22 08:26:15,332] Trial 234 finished with value: -1.184279831089708 and parameters: {'booster': 'dart', 'lambda': 0.9780505074236898, 'alpha': 2.1870370225841587, 'subsample': 0.97618828565882, 'colsample_bytree': 0.7469488720125274, 'max_depth': 3, 'min_child_weight': 7, 'eta': 0.08980959897776104, 'gamma': 2.7312567871874127, 'rate_drop': 1.027485208316994e-08, 'skip_drop': 2.5380771756731626e-08}. Best is trial 137 with value: -1.165362986830467.
[I 2025-06-22 08:26:16,265] Trial 235 finished with value: -1.2887496868150525 and parameters: {'booster': 'dart', 'lambda': 0.9629828125914216, 'alpha': 3.464227907244184e-07, 'subsample': 0.9760675165524075, 'colsample_bytree': 0.7568213154244424, 'max_depth': 6, 'min_child_weight': 7, 'eta': 0.08959343747887817, 'gamma': 2.941442640388321, 'rate_drop': 3.733761856326407e-08, 'skip_drop': 1.615072354722504e-08}. Best is trial 137 with value: -1.165362986830467.
[I 2025-06-22 08:26:25,240] Trial 236 finished with value: -1.552733960568766 and parameters: {'booster': 'dart', 'lambda': 0.4982873200548474, 'alpha': 2.158806979836341, 'subsample': 0.9867401556831604, 'colsample_bytree': 0.7511887569829967, 'max_depth': 3, 'min_child_weight': 7, 'eta': 0.002537774257886693, 'gamma': 2.7262858139121673, 'rate_drop': 2.0586031606892386e-08, 'skip_drop': 1.9533218633400222e-07}. Best is trial 137 with value: -1.165362986830467.
