[I 2025-06-22 08:20:50,386] Trial 48 finished with value: -1.2524632027884879 and parameters: {'booster': 'gbtree', 'lambda': 0.12804300135481636, 'alpha': 8.423440628843844, 'subsample': 0.8483542601774522, 'colsample_bytree': 0.7361623846630033, 'max_depth': 4, 'min_child_weight': 3, 'eta': 0.04221421437122035, 'gamma': 0.9157979880349414}. Best is trial 6 with value: -1.2209337807112228.
[I 2025-06-22 08:20:51,899] Trial 49 finished with value: -1.214795619207943 and parameters: {'booster': 'dart', 'lambda': 0.05661280026068538, 'alpha': 0.7770068425028753, 'subsample': 0.8925486257250956, 'colsample_bytree': 0.7781914330527882, 'max_depth': 3, 'min_child_weight': 6, 'eta': 0.10474655743866239, 'gamma': 2.1044869513455224, 'rate_drop': 0.00016941212720454513, 'skip_drop': 5.97061097649843e-06}. Best is trial 49 with value: -1.214795619207943.
[I 2025-06-22 08:20:53,408] Trial 50 finished with value: -1.2181203915072447 and parameters: {'booster': 'dart', 'lambda': 7.1795031051957094, 'alpha': 2.970496842345448, 'subsample': 0.900905321009807, 'colsample_bytree': 0.7607648970549816, 'max_depth': 3, 'min_child_weight': 6, 'eta': 0.1066754542048941, 'gamma': 2.076241496181865, 'rate_drop': 3.008169655657037e-07, 'skip_drop': 6.974320902341848e-07}. Best is trial 49 with value: -1.214795619207943.
[I 2025-06-22 08:20:54,975] Trial 51 finished with value: -1.2339916050397821 and parameters: {'booster': 'dart', 'lambda': 4.995680660143531, 'alpha': 3.503289253906498, 'subsample': 0.9038547168865692, 'colsample_bytree': 0.7663383958476983, 'max_depth': 3, 'min_child_weight': 6, 'eta': 0.1059075543234262, 'gamma': 2.147550074697549, 'rate_drop': 2.5153153848182707e-07, 'skip_drop': 3.1732578836833314e-07}. Best is trial 49 with value: -1.214795619207943.
[I 2025-06-22 08:20:57,467] Trial 52 finished with value: -1.1949627946268155 and parameters: {'booster': 'dart', 'lambda': 1.6688323108483367, 'alpha': 0.8395620683440235, 'subsample': 0.8694570617446037, 'colsample_bytree': 0.7055609947573632, 'max_depth': 3, 'min_child_weight': 6, 'eta': 0.15332005420799208, 'gamma': 2.3794026974240463, 'rate_drop': 1.4578461360215323e-06, 'skip_drop': 1.0318472871644895e-06}. Best is trial 52 with value: -1.1949627946268155.
[I 2025-06-22 08:20:58,467] Trial 53 finished with value: -1.2279601775888604 and parameters: {'booster': 'dart', 'lambda': 9.507630126663043, 'alpha': 3.3602232574820805, 'subsample': 0.8596433515541521, 'colsample_bytree': 0.7943337146129182, 'max_depth': 3, 'min_child_weight': 6, 'eta': 0.2412885329026432, 'gamma': 2.373776431456816, 'rate_drop': 4.1770291083578024e-08, 'skip_drop': 9.450216868538155e-07}. Best is trial 52 with value: -1.1949627946268155.
[I 2025-06-22 08:20:59,285] Trial 54 finished with value: -1.2088298291746034 and parameters: {'booster': 'dart', 'lambda': 1.2450169543748233, 'alpha': 4.1385564724148205, 'subsample': 0.8812192906020423, 'colsample_bytree': 0.6948063076917104, 'max_depth': 3, 'min_child_weight': 6, 'eta': 0.23365367453148347, 'gamma': 2.038641774413045, 'rate_drop': 4.122703492994612e-08, 'skip_drop': 7.181965729962763e-07}. Best is trial 52 with value: -1.1949627946268155.
[I 2025-06-22 08:21:00,668] Trial 55 finished with value: -1.1957697922591888 and parameters: {'booster': 'dart', 'lambda': 1.5738232129159682, 'alpha': 0.6436221829131091, 'subsample': 0.8791159727248985, 'colsample_bytree': 0.7520105163274818, 'max_depth': 3, 'min_child_weight': 7, 'eta': 0.19911299414649997, 'gamma': 1.4637946415318126, 'rate_drop': 1.980166491862143e-07, 'skip_drop': 3.856498128059536e-08}. Best is trial 52 with value: -1.1949627946268155.
[I 2025-06-22 08:21:02,130] Trial 56 finished with value: -1.226580205983478 and parameters: {'booster': 'dart', 'lambda': 1.4540008259712045, 'alpha': 9.673094309491995, 'subsample': 0.8781739505846872, 'colsample_bytree': 0.7080244162258662, 'max_depth': 3, 'min_child_weight': 7, 'eta': 0.20441622713896895, 'gamma': 1.3852136839049383, 'rate_drop': 4.956830416757113e-07, 'skip_drop': 4.6344658887459453e-08}. Best is trial 52 with value: -1.1949627946268155.
[I 2025-06-22 08:21:03,519] Trial 57 finished with value: -1.2515348018293955 and parameters: {'booster': 'dart', 'lambda': 0.4179576676496747, 'alpha': 0.6195051901969443, 'subsample': 0.9603539360801703, 'colsample_bytree': 0.7497220667684474, 'max_depth': 3, 'min_child_weight': 6, 'eta': 0.2717563823298869, 'gamma': 1.9428264741186263, 'rate_drop': 2.695408852019887e-08, 'skip_drop': 1.007765316775238e-08}. Best is trial 52 with value: -1.1949627946268155.
[I 2025-06-22 08:21:04,625] Trial 58 finished with value: -1.170529255460205 and parameters: {'booster': 'dart', 'lambda': 2.8698482086028787, 'alpha': 2.205061122582891, 'subsample': 0.9122206276306527, 'colsample_bytree': 0.6708775019806382, 'max_depth': 3, 'min_child_weight': 7, 'eta': 0.16495310372649533, 'gamma': 1.4767726888245454, 'rate_drop': 8.777366237610312e-08, 'skip_drop': 4.9991746432029486e-08}. Best is trial 58 with value: -1.170529255460205.
[I 2025-06-22 08:21:05,082] Trial 59 finished with value: -1.2445412441483747 and parameters: {'booster': 'dart', 'lambda': 3.2785134629424593, 'alpha': 2.170483372889691, 'subsample': 0.9115573592548751, 'colsample_bytree': 0.6732207145581979, 'max_depth': 3, 'min_child_weight': 7, 'eta': 0.29976447004599627, 'gamma': 1.5066880133599199, 'rate_drop': 7.597377800355554e-08, 'skip_drop': 3.9938251040819815e-08}. Best is trial 58 with value: -1.170529255460205.
[I 2025-06-22 08:21:05,241] Trial 60 finished with value: -1.2692299245373755 and parameters: {'booster': 'gbtree', 'lambda': 1.6925410550514681, 'alpha': 0.742264393448485, 'subsample': 0.9317456058214109, 'colsample_bytree': 0.6929676924777417, 'max_depth': 4, 'min_child_weight': 6, 'eta': 0.1456453872477794, 'gamma': 1.9447522148573142}. Best is trial 58 with value: -1.170529255460205.
[I 2025-06-22 08:21:06,145] Trial 61 finished with value: -1.2051988145259442 and parameters: {'booster': 'dart', 'lambda': 0.7252486550373836, 'alpha': 5.545846222362553, 'subsample': 0.8792476118312879, 'colsample_bytree': 0.6522867707470074, 'max_depth': 3, 'min_child_weight': 7, 'eta': 0.15210576837343598, 'gamma': 1.110818565875198, 'rate_drop': 1.3670132656813964e-06, 'skip_drop': 7.700827172698711e-07}. Best is trial 58 with value: -1.170529255460205.
[I 2025-06-22 08:21:07,247] Trial 62 finished with value: -1.2019210230455006 and parameters: {'booster': 'dart', 'lambda': 0.8247868919032126, 'alpha': 3.9794841837926156, 'subsample': 0.8840390440065502, 'colsample_bytree': 0.6504886036068274, 'max_depth': 3, 'min_child_weight': 7, 'eta': 0.18541133192527678, 'gamma': 1.2640657589244673, 'rate_drop': 1.6728481337318537e-06, 'skip_drop': 9.578263838552755e-08}. Best is trial 58 with value: -1.170529255460205.
[I 2025-06-22 08:21:09,428] Trial 63 finished with value: -1.2458430841758936 and parameters: {'booster': 'dart', 'lambda': 0.7427634033311106, 'alpha': 6.0484998036482605, 'subsample': 0.8775701446187745, 'colsample_bytree': 0.6489065515661956, 'max_depth': 4, 'min_child_weight': 7, 'eta': 0.215056592487799, 'gamma': 1.2288352919550638, 'rate_drop': 3.027757480785784e-06, 'skip_drop': 7.183672914830281e-08}. Best is trial 58 with value: -1.170529255460205.
[I 2025-06-22 08:21:10,521] Trial 64 finished with value: -1.1805786223259869 and parameters: {'booster': 'dart', 'lambda': 0.26178653528288265, 'alpha': 1.7456336064787508, 'subsample': 0.9616902506624593, 'colsample_bytree': 0.637923771562947, 'max_depth': 3, 'min_child_weight': 7, 'eta': 0.16601200420326775, 'gamma': 0.9982008590495746, 'rate_drop': 7.264133883148265e-07, 'skip_drop': 2.5548251913213586e-07}. Best is trial 58 with value: -1.170529255460205.
[I 2025-06-22 08:21:11,629] Trial 65 finished with value: -1.202087264706526 and parameters: {'booster': 'dart', 'lambda': 0.2917835458856667, 'alpha': 5.016336478037988, 'subsample': 0.9587896026288565, 'colsample_bytree': 0.6515785085189613, 'max_depth': 3, 'min_child_weight': 7, 'eta': 0.16639100922404926, 'gamma': 0.9471752102705489, 'rate_drop': 1.375839917248209e-06, 'skip_drop': 1.4751837980956625e-08}. Best is trial 58 with value: -1.170529255460205.
[I 2025-06-22 08:21:13,139] Trial 66 finished with value: -1.2419843888316355 and parameters: {'booster': 'dart', 'lambda': 0.26894405627679835, 'alpha': 1.921680866139893, 'subsample': 0.9988216770862155, 'colsample_bytree': 0.6367027047676532, 'max_depth': 3, 'min_child_weight': 7, 'eta': 0.1679993711627843, 'gamma': 0.9111975692915883, 'rate_drop': 1.235803554952569e-06, 'skip_drop': 1.796474893206798e-08}. Best is trial 58 with value: -1.170529255460205.
[I 2025-06-22 08:21:13,695] Trial 67 finished with value: -1.268214410238768 and parameters: {'booster': 'dart', 'lambda': 0.6407409468912063, 'alpha': 0.07001717091145622, 'subsample': 0.9535268356383826, 'colsample_bytree': 0.6127703632894688, 'max_depth': 4, 'min_child_weight': 7, 'eta': 0.15149597491403438, 'gamma': 0.521513164878507, 'rate_drop': 1.4272514946535735e-06, 'skip_drop': 2.2604168790760198e-07}. Best is trial 58 with value: -1.170529255460205.
[I 2025-06-22 08:21:15,214] Trial 68 finished with value: -1.2233362312100464 and parameters: {'booster': 'dart', 'lambda': 2.5339937599462505, 'alpha': 4.849684140678907, 'subsample': 0.9802965244817837, 'colsample_bytree': 0.6694652754279334, 'max_depth': 3, 'min_child_weight': 8, 'eta': 0.19002023263903906, 'gamma': 1.046060821787794, 'rate_drop': 4.4553356279792303e-07, 'skip_drop': 2.081902239480197e-08}. Best is trial 58 with value: -1.170529255460205.
[I 2025-06-22 08:21:17,323] Trial 69 finished with value: -1.2575457503892076 and parameters: {'booster': 'dart', 'lambda': 0.19592247673912652, 'alpha': 1.6373161982249154, 'subsample': 0.9183951478825152, 'colsample_bytree': 0.6597143550822483, 'max_depth': 4, 'min_child_weight': 7, 'eta': 0.13054936018038935, 'gamma': 0.2926525803522132, 'rate_drop': 1.4627201294131046e-07, 'skip_drop': 7.116895447943048e-08}. Best is trial 58 with value: -1.170529255460205.
[I 2025-06-22 08:21:21,101] Trial 70 finished with value: -1.2287047284101749 and parameters: {'booster': 'dart', 'lambda': 0.4274099678629092, 'alpha': 0.25033324323291795, 'subsample': 0.9484625679402536, 'colsample_bytree': 0.6309571575910934, 'max_depth': 3, 'min_child_weight': 8, 'eta': 0.15626062163734564, 'gamma': 0.8151593584368875, 'rate_drop': 1.039140844012321e-06, 'skip_drop': 1.5017198328488822e-07}. Best is trial 58 with value: -1.170529255460205.
[I 2025-06-22 08:21:22,645] Trial 71 finished with value: -1.1931348075104904 and parameters: {'booster': 'dart', 'lambda': 1.038656821041498, 'alpha': 5.33327206122754, 'subsample': 0.9818499882560241, 'colsample_bytree': 0.6874826128276309, 'max_depth': 3, 'min_child_weight': 7, 'eta': 0.23774469420897706, 'gamma': 1.5397789344984405, 'rate_drop': 6.63024184624501e-08, 'skip_drop': 3.8019164251745036e-07}. Best is trial 58 with value: -1.170529255460205.
[I 2025-06-22 08:21:23,782] Trial 72 finished with value: -1.243373242964129 and parameters: {'booster': 'dart', 'lambda': 0.08654226558342419, 'alpha': 9.723532975700545, 'subsample': 0.9728617412449546, 'colsample_bytree': 0.6026831701135539, 'max_depth': 3, 'min_child_weight': 7, 'eta': 0.24839490328657066, 'gamma': 1.2350625234720536, 'rate_drop': 7.862473561724533e-08, 'skip_drop': 3.1241683415998837e-07}. Best is trial 58 with value: -1.170529255460205.
[I 2025-06-22 08:21:32,536] Trial 73 finished with value: -1.5475540293007468 and parameters: {'booster': 'dart', 'lambda': 3.9246616629763755, 'alpha': 5.69387751842989, 'subsample': 0.985929928899291, 'colsample_bytree': 0.68751053446735, 'max_depth': 3, 'min_child_weight': 7, 'eta': 0.0032964334051350927, 'gamma': 1.5533807881913542, 'rate_drop': 1.0149671799523426e-08, 'skip_drop': 2.430746973889108e-08}. Best is trial 58 with value: -1.170529255460205.
[I 2025-06-22 08:21:33,615] Trial 74 finished with value: -1.2681817819301935 and parameters: {'booster': 'dart', 'lambda': 0.9453096052173223, 'alpha': 0.7774114066904948, 'subsample': 0.9283952619285765, 'colsample_bytree': 0.7081005916923031, 'max_depth': 3, 'min_child_weight': 7, 'eta': 0.19727508989631387, 'gamma': 1.0621069230431495, 'rate_drop': 4.940695656056845e-06, 'skip_drop': 1.0117085423285011e-08}. Best is trial 58 with value: -1.170529255460205.
[I 2025-06-22 08:21:34,777] Trial 75 finished with value: -1.2500442846699256 and parameters: {'booster': 'dart', 'lambda': 0.47903646589337673, 'alpha': 2.2532040960875825, 'subsample': 0.945154067043112, 'colsample_bytree': 0.5622870887513558, 'max_depth': 4, 'min_child_weight': 8, 'eta': 0.12647617093832889, 'gamma': 0.5703913022394993, 'rate_drop': 5.075915629012517e-07, 'skip_drop': 8.822734388280535e-08}. Best is trial 58 with value: -1.170529255460205.
[I 2025-06-22 08:21:34,951] Trial 76 finished with value: -1.2519759696266184 and parameters: {'booster': 'gbtree', 'lambda': 0.22063353589459206, 'alpha': 1.0648100102215474, 'subsample': 0.8630657667417247, 'colsample_bytree': 0.7371294014396206, 'max_depth': 4, 'min_child_weight': 7, 'eta': 0.1819519868707001, 'gamma': 1.3635609119946446}. Best is trial 58 with value: -1.170529255460205.
[I 2025-06-22 08:21:35,428] Trial 77 finished with value: -1.246716713759074 and parameters: {'booster': 'dart', 'lambda': 2.0415394822870354, 'alpha': 0.41938701491295216, 'subsample': 0.9863276817845187, 'colsample_bytree': 0.660006103543822, 'max_depth': 3, 'min_child_weight': 8, 'eta': 0.2943120536768722, 'gamma': 0.7738588474111137, 'rate_drop': 1.5431670261113318e-07, 'skip_drop': 4.741314487111177e-08}. Best is trial 58 with value: -1.170529255460205.
[I 2025-06-22 08:21:36,768] Trial 78 finished with value: -1.2058436744342726 and parameters: {'booster': 'dart', 'lambda': 9.775872554736628, 'alpha': 5.8546367480971275, 'subsample': 0.9610000299179485, 'colsample_bytree': 0.6279603064277013, 'max_depth': 3, 'min_child_weight': 6, 'eta': 0.23139693147869125, 'gamma': 1.8025994701650265, 'rate_drop': 3.26261115857715e-07, 'skip_drop': 1.7954458653507883e-07}. Best is trial 58 with value: -1.170529255460205.
[I 2025-06-22 08:21:40,385] Trial 79 finished with value: -1.2440415100691857 and parameters: {'booster': 'dart', 'lambda': 1.1226691735436374, 'alpha': 2.355262833798017, 'subsample': 0.8381696161586596, 'colsample_bytree': 0.6459679812916568, 'max_depth': 4, 'min_child_weight': 7, 'eta': 0.09185910347118018, 'gamma': 1.3200611923432843, 'rate_drop': 1.907741640161539e-08, 'skip_drop': 3.867621730202956e-07}. Best is trial 58 with value: -1.170529255460205.
[I 2025-06-22 08:21:41,806] Trial 80 finished with value: -1.2797846701464803 and parameters: {'booster': 'dart', 'lambda': 0.10874408007538397, 'alpha': 5.096777694198919e-08, 'subsample': 0.8077588702966132, 'colsample_bytree': 0.5839862227201986, 'max_depth': 3, 'min_child_weight': 7, 'eta': 0.14178258887549794, 'gamma': 1.4773082643545605, 'rate_drop': 1.7275406104594249e-06, 'skip_drop': 1.213384198240635e-06}. Best is trial 58 with value: -1.170529255460205.
[I 2025-06-22 08:21:43,334] Trial 81 finished with value: -1.2008362449724947 and parameters: {'booster': 'dart', 'lambda': 5.1475107205005965, 'alpha': 5.021618477894104, 'subsample': 0.9658638788319365, 'colsample_bytree': 0.6262289206579241, 'max_depth': 3, 'min_child_weight': 6, 'eta': 0.2449672017869273, 'gamma': 1.8132425166096955, 'rate_drop': 6.418311408398064e-07, 'skip_drop': 1.6292073906458236e-07}. Best is trial 58 with value: -1.170529255460205.
[I 2025-06-22 08:21:44,439] Trial 82 finished with value: -1.2152782179155803 and parameters: {'booster': 'dart', 'lambda': 4.804362288921197, 'alpha': 5.609718515990187, 'subsample': 0.9373670244730459, 'colsample_bytree': 0.6822659516444419, 'max_depth': 3, 'min_child_weight': 5, 'eta': 0.17897574442087727, 'gamma': 1.0150504658914137, 'rate_drop': 6.876243401232712e-07, 'skip_drop': 3.0432461115513386e-08}. Best is trial 58 with value: -1.170529255460205.
[I 2025-06-22 08:21:44,941] Trial 83 finished with value: -1.250614351406119 and parameters: {'booster': 'dart', 'lambda': 2.440592365334161, 'alpha': 1.2454265970020284, 'subsample': 0.9234719813698612, 'colsample_bytree': 0.6606524399497672, 'max_depth': 3, 'min_child_weight': 6, 'eta': 0.24165487347160003, 'gamma': 1.6576536371207893, 'rate_drop': 3.760732256167598e-06, 'skip_drop': 1.0907902801538032e-07}. Best is trial 58 with value: -1.170529255460205.
[I 2025-06-22 08:21:47,390] Trial 84 finished with value: -1.187986103082658 and parameters: {'booster': 'dart', 'lambda': 0.7563487456064673, 'alpha': 3.2383912932168184, 'subsample': 0.9699754135373078, 'colsample_bytree': 0.7048344598818415, 'max_depth': 3, 'min_child_weight': 6, 'eta': 0.12069999899202018, 'gamma': 1.21253455511938, 'rate_drop': 8.689018488796177e-06, 'skip_drop': 6.055052319560228e-08}. Best is trial 58 with value: -1.170529255460205.
[I 2025-06-22 08:21:48,596] Trial 85 finished with value: -1.2535534196609293 and parameters: {'booster': 'dart', 'lambda': 0.28188537108126877, 'alpha': 0.4615683586442875, 'subsample': 0.9745144927377212, 'colsample_bytree': 0.7113994816132101, 'max_depth': 4, 'min_child_weight': 6, 'eta': 0.11935125805802983, 'gamma': 1.7906973699041437, 'rate_drop': 1.0718575935794267e-07, 'skip_drop': 5.771316912106825e-08}. Best is trial 58 with value: -1.170529255460205.
[I 2025-06-22 08:21:50,133] Trial 86 finished with value: -1.2171984880565392 and parameters: {'booster': 'dart', 'lambda': 0.043877513943927665, 'alpha': 3.092306799662211, 'subsample': 0.9898719663878895, 'colsample_bytree': 0.728385189005463, 'max_depth': 3, 'min_child_weight': 5, 'eta': 0.20043611983286264, 'gamma': 1.2198154974209434, 'rate_drop': 8.560005278509762e-06, 'skip_drop': 1.6238981672482414e-08}. Best is trial 58 with value: -1.170529255460205.
[I 2025-06-22 08:21:51,886] Trial 87 finished with value: -1.2627074745557083 and parameters: {'booster': 'dart', 'lambda': 8.148655614803495e-08, 'alpha': 0.17141155938793423, 'subsample': 0.9624432786249945, 'colsample_bytree': 0.6227853713177388, 'max_depth': 3, 'min_child_weight': 6, 'eta': 0.26882128148179263, 'gamma': 1.4332156087279835, 'rate_drop': 8.058694063281521e-07, 'skip_drop': 2.3193618159413036e-07}. Best is trial 58 with value: -1.170529255460205.
[I 2025-06-22 08:21:53,539] Trial 88 finished with value: -1.2433769091225777 and parameters: {'booster': 'dart', 'lambda': 1.8333923562414545, 'alpha': 0.9140180820956536, 'subsample': 0.9126422368963746, 'colsample_bytree': 0.6994548268828865, 'max_depth': 4, 'min_child_weight': 8, 'eta': 0.07465494509223745, 'gamma': 1.600122278232392, 'rate_drop': 6.029021054228129e-08, 'skip_drop': 3.662872950991874e-08}. Best is trial 58 with value: -1.170529255460205.
[I 2025-06-22 08:21:53,697] Trial 89 finished with value: -1.2739156079874934 and parameters: {'booster': 'gbtree', 'lambda': 3.6254791834912896, 'alpha': 1.4151519391233511, 'subsample': 0.9530439123723278, 'colsample_bytree': 0.6769522207972759, 'max_depth': 5, 'min_child_weight': 6, 'eta': 0.16124021532174782, 'gamma': 1.8742276624067575}. Best is trial 58 with value: -1.170529255460205.
[I 2025-06-22 08:22:02,327] Trial 90 finished with value: -1.3614562802994086 and parameters: {'booster': 'dart', 'lambda': 0.4636857385372546, 'alpha': 0.07980303764761341, 'subsample': 0.9364864958675271, 'colsample_bytree': 0.5988448146779184, 'max_depth': 3, 'min_child_weight': 5, 'eta': 0.009574053340264066, 'gamma': 0.9089278149390695, 'rate_drop': 2.9702421679074594e-05, 'skip_drop': 1.194426267069297e-07}. Best is trial 58 with value: -1.170529255460205.
[I 2025-06-22 08:22:03,915] Trial 91 finished with value: -1.2044782137731782 and parameters: {'booster': 'dart', 'lambda': 0.8311323378983416, 'alpha': 7.435492245561078, 'subsample': 0.9085668734735313, 'colsample_bytree': 0.6467935905407337, 'max_depth': 3, 'min_child_weight': 7, 'eta': 0.13842463428467455, 'gamma': 1.110017252882586, 'rate_drop': 2.4836159685135715e-06, 'skip_drop': 4.72595315703038e-07}. Best is trial 58 with value: -1.170529255460205.
[I 2025-06-22 08:22:04,984] Trial 92 finished with value: -1.2119938480795993 and parameters: {'booster': 'dart', 'lambda': 1.14041221213966, 'alpha': 9.240340218637426, 'subsample': 0.8992288069468583, 'colsample_bytree': 0.6408568301273495, 'max_depth': 3, 'min_child_weight': 7, 'eta': 0.22071776553449468, 'gamma': 1.325241024023823, 'rate_drop': 3.6304861735785607e-06, 'skip_drop': 3.8806215444098015e-07}. Best is trial 58 with value: -1.170529255460205.
[I 2025-06-22 08:22:06,097] Trial 93 finished with value: -1.233912048319719 and parameters: {'booster': 'dart', 'lambda': 6.19240554093569, 'alpha': 3.164831076520963, 'subsample': 0.998796039002885, 'colsample_bytree': 0.668440572088622, 'max_depth': 3, 'min_child_weight': 6, 'eta': 0.17924224691601517, 'gamma': 0.6375199217273333, 'rate_drop': 2.001308060517414e-07, 'skip_drop': 5.279644765802332e-07}. Best is trial 58 with value: -1.170529255460205.
[I 2025-06-22 08:22:08,143] Trial 94 finished with value: -1.198331723847265 and parameters: {'booster': 'dart', 'lambda': 0.6548020858649737, 'alpha': 1.9840211774888876, 'subsample': 0.9716938599623929, 'colsample_bytree': 0.6153412179288217, 'max_depth': 3, 'min_child_weight': 7, 'eta': 0.11357299914599628, 'gamma': 1.229713147074657, 'rate_drop': 2.1197563794384893e-06, 'skip_drop': 1.772773663609471e-07}. Best is trial 58 with value: -1.170529255460205.
[I 2025-06-22 08:22:10,377] Trial 95 finished with value: -1.2671938414319253 and parameters: {'booster': 'dart', 'lambda': 0.19818203490634378, 'alpha': 1.8389829191385547, 'subsample': 0.9706328899011482, 'colsample_bytree': 0.5704156930128453, 'max_depth': 3, 'min_child_weight': 7, 'eta': 0.09873389350837415, 'gamma': 1.5203222225266628, 'rate_drop': 4.348040755859338e-07, 'skip_drop': 6.666703466730186e-08}. Best is trial 58 with value: -1.170529255460205.
