[I 2025-06-22 08:18:07,747] A new study created in memory with name: no-name-62df3022-e685-48ff-8caa-6235265c91e5
[I 2025-06-22 08:18:10,606] Trial 0 finished with value: -1.2820363727359738 and parameters: {'booster': 'gbtree', 'lambda': 0.0007078912640383961, 'alpha': 0.0003545925729880624, 'subsample': 0.7720375181957171, 'colsample_bytree': 0.5115541046581595, 'max_depth': 8, 'min_child_weight': 2, 'eta': 0.034995661613840594, 'gamma': 0.6503483257440418}. Best is trial 0 with value: -1.2820363727359738.
[I 2025-06-22 08:18:17,320] Trial 1 finished with value: -1.5186087687751013 and parameters: {'booster': 'dart', 'lambda': 7.5606620928315335e-06, 'alpha': 0.00012607375795543795, 'subsample': 0.6655606758139226, 'colsample_bytree': 0.8792883774518996, 'max_depth': 5, 'min_child_weight': 5, 'eta': 0.02956042612286191, 'gamma': 4.013127217781455, 'rate_drop': 0.4152572292816689, 'skip_drop': 0.006876176268707524}. Best is trial 0 with value: -1.2820363727359738.
[I 2025-06-22 08:18:21,102] Trial 2 finished with value: -1.2235281492878864 and parameters: {'booster': 'dart', 'lambda': 0.00044768910078335625, 'alpha': 0.0007638576065102586, 'subsample': 0.5300156703460951, 'colsample_bytree': 0.5618833877860487, 'max_depth': 10, 'min_child_weight': 4, 'eta': 0.049947635574239785, 'gamma': 2.292539665905751, 'rate_drop': 2.356059190491502e-07, 'skip_drop': 2.0076479677220374e-05}. Best is trial 2 with value: -1.2235281492878864.
[I 2025-06-22 08:18:28,065] Trial 3 finished with value: -1.2723225548202008 and parameters: {'booster': 'dart', 'lambda': 5.4330513765702504e-05, 'alpha': 0.0006693430576140649, 'subsample': 0.6047959575401499, 'colsample_bytree': 0.5009193408968531, 'max_depth': 9, 'min_child_weight': 5, 'eta': 0.01694817615275737, 'gamma': 0.6420460939399264, 'rate_drop': 5.518040669712242e-05, 'skip_drop': 0.09751220434694548}. Best is trial 2 with value: -1.2235281492878864.
[I 2025-06-22 08:18:37,034] Trial 4 finished with value: -1.2846041937908022 and parameters: {'booster': 'dart', 'lambda': 0.00048516748152887374, 'alpha': 0.010860029157747171, 'subsample': 0.7554394642188391, 'colsample_bytree': 0.5274632150022749, 'max_depth': 7, 'min_child_weight': 1, 'eta': 0.024614478129393796, 'gamma': 3.215410326759443, 'rate_drop': 4.25890132278766e-06, 'skip_drop': 0.13347472023659016}. Best is trial 2 with value: -1.2235281492878864.
[I 2025-06-22 08:18:45,441] Trial 5 finished with value: -1.6093427637137434 and parameters: {'booster': 'dart', 'lambda': 1.6201292028088924e-08, 'alpha': 0.001978736921577012, 'subsample': 0.9390359819619045, 'colsample_bytree': 0.6763581138660615, 'max_depth': 3, 'min_child_weight': 10, 'eta': 0.001528117603411804, 'gamma': 4.427325119098246, 'rate_drop': 0.001844210371306122, 'skip_drop': 4.070118555667342e-05}. Best is trial 2 with value: -1.2235281492878864.
[I 2025-06-22 08:18:46,510] Trial 6 finished with value: -1.2209337807112228 and parameters: {'booster': 'dart', 'lambda': 7.217360815798063, 'alpha': 1.140262310188646, 'subsample': 0.8493412077506584, 'colsample_bytree': 0.8951638725599643, 'max_depth': 8, 'min_child_weight': 10, 'eta': 0.10786200604257237, 'gamma': 0.9400425599644568, 'rate_drop': 1.8413752812171915e-07, 'skip_drop': 2.5840310951087887e-06}. Best is trial 6 with value: -1.2209337807112228.
[I 2025-06-22 08:18:47,029] Trial 7 finished with value: -1.572471073168763 and parameters: {'booster': 'gbtree', 'lambda': 1.10337079445966e-08, 'alpha': 4.874127128644158, 'subsample': 0.7689959541392226, 'colsample_bytree': 0.5055769405544424, 'max_depth': 9, 'min_child_weight': 7, 'eta': 0.0018950700796676143, 'gamma': 1.4881271566334249}. Best is trial 6 with value: -1.2209337807112228.
[I 2025-06-22 08:18:53,451] Trial 8 finished with value: -1.4506541721403186 and parameters: {'booster': 'dart', 'lambda': 1.3296302441184795e-05, 'alpha': 4.616378841800265e-07, 'subsample': 0.816723407004674, 'colsample_bytree': 0.7596175253417368, 'max_depth': 3, 'min_child_weight': 1, 'eta': 0.12829818959920336, 'gamma': 4.780197068683182, 'rate_drop': 0.5543181802183581, 'skip_drop': 3.644496949323109e-08}. Best is trial 6 with value: -1.2209337807112228.
[I 2025-06-22 08:19:02,962] Trial 9 finished with value: -1.3111019324650843 and parameters: {'booster': 'dart', 'lambda': 7.499541803089395e-05, 'alpha': 0.018132031135012855, 'subsample': 0.7930999718984073, 'colsample_bytree': 0.6739588807641118, 'max_depth': 4, 'min_child_weight': 6, 'eta': 0.011588108598316606, 'gamma': 0.7511345252821899, 'rate_drop': 0.005053770204881648, 'skip_drop': 0.00018216612994545727}. Best is trial 6 with value: -1.2209337807112228.
[I 2025-06-22 08:19:03,077] Trial 10 finished with value: -1.2527288423361491 and parameters: {'booster': 'gbtree', 'lambda': 5.637761201847634, 'alpha': 1.4372499894586832, 'subsample': 0.9973902499809636, 'colsample_bytree': 0.9952850559236002, 'max_depth': 6, 'min_child_weight': 10, 'eta': 0.21883204487243743, 'gamma': 1.9473691569169915}. Best is trial 6 with value: -1.2209337807112228.
[I 2025-06-22 08:19:05,294] Trial 11 finished with value: -1.2479256365423768 and parameters: {'booster': 'dart', 'lambda': 5.589513410916125, 'alpha': 1.3270757435559403e-06, 'subsample': 0.5096489552004402, 'colsample_bytree': 0.8440188942687917, 'max_depth': 10, 'min_child_weight': 3, 'eta': 0.08563984997877981, 'gamma': 2.5763131791153113, 'rate_drop': 1.0987442468166326e-08, 'skip_drop': 9.846232891287451e-07}. Best is trial 6 with value: -1.2209337807112228.
[I 2025-06-22 08:19:06,529] Trial 12 finished with value: -1.3126813048013144 and parameters: {'booster': 'dart', 'lambda': 0.053030689956376324, 'alpha': 0.07102840007800772, 'subsample': 0.8809232699656437, 'colsample_bytree': 0.9931098696969507, 'max_depth': 10, 'min_child_weight': 8, 'eta': 0.06823689469899744, 'gamma': 1.6128988825833037, 'rate_drop': 7.015766571516327e-08, 'skip_drop': 1.2626738590472256e-05}. Best is trial 6 with value: -1.2209337807112228.
[I 2025-06-22 08:19:06,800] Trial 13 finished with value: -1.3991331419191537 and parameters: {'booster': 'dart', 'lambda': 0.02802263106152713, 'alpha': 9.416548996551483e-06, 'subsample': 0.6509872035208587, 'colsample_bytree': 0.613559990121844, 'max_depth': 8, 'min_child_weight': 4, 'eta': 0.29295506683760847, 'gamma': 2.806789354102701, 'rate_drop': 6.256379718950239e-07, 'skip_drop': 4.120164697521871e-07}. Best is trial 6 with value: -1.2209337807112228.
[I 2025-06-22 08:19:07,301] Trial 14 finished with value: -1.4494905983418593 and parameters: {'booster': 'gbtree', 'lambda': 0.14102262380318462, 'alpha': 1.0712920788063801e-08, 'subsample': 0.5043023778698347, 'colsample_bytree': 0.8619099156720279, 'max_depth': 8, 'min_child_weight': 8, 'eta': 0.0036954738993946307, 'gamma': 0.1447983415228702}. Best is trial 6 with value: -1.2209337807112228.
[I 2025-06-22 08:19:16,049] Trial 15 finished with value: -1.3051940774120503 and parameters: {'booster': 'dart', 'lambda': 7.971219163407734e-07, 'alpha': 0.3881491868050983, 'subsample': 0.8660435190168169, 'colsample_bytree': 0.7783064178220064, 'max_depth': 10, 'min_child_weight': 3, 'eta': 0.007445275772318436, 'gamma': 2.006040483963366, 'rate_drop': 7.566010721171821e-07, 'skip_drop': 0.0003457006679603748}. Best is trial 6 with value: -1.2209337807112228.
[I 2025-06-22 08:19:17,891] Trial 16 finished with value: -1.2327282690017465 and parameters: {'booster': 'dart', 'lambda': 0.0030278758109053257, 'alpha': 0.24046521677703084, 'subsample': 0.7001956886227094, 'colsample_bytree': 0.9280012051224806, 'max_depth': 7, 'min_child_weight': 8, 'eta': 0.05353137315128125, 'gamma': 3.577658431261151, 'rate_drop': 1.5119785196127492e-05, 'skip_drop': 1.9644681249871584e-06}. Best is trial 6 with value: -1.2209337807112228.
[I 2025-06-22 08:19:18,504] Trial 17 finished with value: -1.2530139413104475 and parameters: {'booster': 'dart', 'lambda': 3.037127798635443e-07, 'alpha': 2.829901979437372e-05, 'subsample': 0.5813192820450743, 'colsample_bytree': 0.591024929421598, 'max_depth': 9, 'min_child_weight': 6, 'eta': 0.13607610798563857, 'gamma': 0.05326857773004079, 'rate_drop': 1.0452826485488817e-07, 'skip_drop': 2.035791874982073e-08}. Best is trial 6 with value: -1.2209337807112228.
[I 2025-06-22 08:19:18,905] Trial 18 finished with value: -1.2590023320514847 and parameters: {'booster': 'gbtree', 'lambda': 0.4221415614308188, 'alpha': 9.29009041411626, 'subsample': 0.8471381268583085, 'colsample_bytree': 0.693886393099501, 'max_depth': 6, 'min_child_weight': 9, 'eta': 0.050256123998632565, 'gamma': 1.3539507753717692}. Best is trial 6 with value: -1.2209337807112228.
[I 2025-06-22 08:19:19,431] Trial 19 finished with value: -1.2327164604301348 and parameters: {'booster': 'dart', 'lambda': 0.006840824487798673, 'alpha': 0.010317668119933492, 'subsample': 0.7042090175870367, 'colsample_bytree': 0.8077675616017941, 'max_depth': 9, 'min_child_weight': 4, 'eta': 0.14043952350618977, 'gamma': 2.2719659516943835, 'rate_drop': 0.0005659694539091564, 'skip_drop': 0.002376296233661318}. Best is trial 6 with value: -1.2209337807112228.
[I 2025-06-22 08:19:28,797] Trial 20 finished with value: -1.3463182580955446 and parameters: {'booster': 'dart', 'lambda': 0.774847550094425, 'alpha': 9.065365661532107e-08, 'subsample': 0.9208707456783262, 'colsample_bytree': 0.9237276179371288, 'max_depth': 8, 'min_child_weight': 7, 'eta': 0.006934041752222846, 'gamma': 1.1069183324613925, 'rate_drop': 1.3991376713697329e-08, 'skip_drop': 3.8836349610986205e-06}. Best is trial 6 with value: -1.2209337807112228.
[I 2025-06-22 08:19:30,142] Trial 21 finished with value: -1.2949547485305133 and parameters: {'booster': 'dart', 'lambda': 0.0061409316762731266, 'alpha': 0.004696139644213336, 'subsample': 0.7156159274445703, 'colsample_bytree': 0.8134358084928492, 'max_depth': 9, 'min_child_weight': 4, 'eta': 0.13209114400929822, 'gamma': 2.176427997578145, 'rate_drop': 0.0013780541017547982, 'skip_drop': 0.0020403319631062157}. Best is trial 6 with value: -1.2209337807112228.
[I 2025-06-22 08:19:31,332] Trial 22 finished with value: -1.3316001967348636 and parameters: {'booster': 'dart', 'lambda': 0.003987347764331673, 'alpha': 0.04108337923839779, 'subsample': 0.5450396018983006, 'colsample_bytree': 0.8060499156099398, 'max_depth': 10, 'min_child_weight': 4, 'eta': 0.09495102073144249, 'gamma': 2.9800708977111343, 'rate_drop': 0.0002409824362456501, 'skip_drop': 0.003981107878715835}. Best is trial 6 with value: -1.2209337807112228.
[I 2025-06-22 08:19:32,219] Trial 23 finished with value: -1.2573740757201546 and parameters: {'booster': 'dart', 'lambda': 1.2493215542571845, 'alpha': 0.44197292211337624, 'subsample': 0.6066643198619606, 'colsample_bytree': 0.7172487640893103, 'max_depth': 9, 'min_child_weight': 3, 'eta': 0.2608429147964956, 'gamma': 2.2968242822669493, 'rate_drop': 0.024213137410568367, 'skip_drop': 4.0241531786818075e-05}. Best is trial 6 with value: -1.2209337807112228.
[I 2025-06-22 08:19:33,692] Trial 24 finished with value: -1.2362527034229716 and parameters: {'booster': 'dart', 'lambda': 0.009860537017519686, 'alpha': 0.001686932149068695, 'subsample': 0.715779640087079, 'colsample_bytree': 0.9348899069666993, 'max_depth': 7, 'min_child_weight': 2, 'eta': 0.17563256353980625, 'gamma': 3.440455445125522, 'rate_drop': 2.343784098181076e-06, 'skip_drop': 0.0006083583242558111}. Best is trial 6 with value: -1.2209337807112228.
[I 2025-06-22 08:19:35,084] Trial 25 finished with value: -1.2649900048514682 and parameters: {'booster': 'dart', 'lambda': 0.00012141359294718702, 'alpha': 8.663592769263559e-05, 'subsample': 0.8230787372405296, 'colsample_bytree': 0.6173151005140146, 'max_depth': 8, 'min_child_weight': 5, 'eta': 0.043276676615730196, 'gamma': 1.8043525253934276, 'rate_drop': 0.00020393180764348244, 'skip_drop': 2.0640409370941124e-07}. Best is trial 6 with value: -1.2209337807112228.
[I 2025-06-22 08:19:35,415] Trial 26 finished with value: -1.2680396254410313 and parameters: {'booster': 'gbtree', 'lambda': 0.0011496439717343413, 'alpha': 0.044473573109620745, 'subsample': 0.6475522955724711, 'colsample_bytree': 0.8935155379261929, 'max_depth': 10, 'min_child_weight': 4, 'eta': 0.08108827707987062, 'gamma': 2.4816944514634303}. Best is trial 6 with value: -1.2209337807112228.
[I 2025-06-22 08:19:44,964] Trial 27 finished with value: -1.2863090966738286 and parameters: {'booster': 'dart', 'lambda': 0.08959632666316622, 'alpha': 1.9279288749960037, 'subsample': 0.9373999741724713, 'colsample_bytree': 0.7267051436200384, 'max_depth': 9, 'min_child_weight': 6, 'eta': 0.0208805234536995, 'gamma': 1.1506389640817778, 'rate_drop': 1.3264922031366447e-07, 'skip_drop': 9.653862307404886e-06}. Best is trial 6 with value: -1.2209337807112228.
[I 2025-06-22 08:19:45,513] Trial 28 finished with value: -1.2791430578536052 and parameters: {'booster': 'dart', 'lambda': 4.292014204729175e-06, 'alpha': 0.13599833213746798, 'subsample': 0.6882283437431161, 'colsample_bytree': 0.8161700467982044, 'max_depth': 7, 'min_child_weight': 2, 'eta': 0.110688271511312, 'gamma': 3.876944930063587, 'rate_drop': 2.6318253244222255e-05, 'skip_drop': 4.850693283918261e-05}. Best is trial 6 with value: -1.2209337807112228.
[I 2025-06-22 08:19:45,952] Trial 29 finished with value: -1.2749784761431737 and parameters: {'booster': 'gbtree', 'lambda': 0.0003394907773717695, 'alpha': 0.00045717491214164083, 'subsample': 0.573390117998169, 'colsample_bytree': 0.5797365272962698, 'max_depth': 8, 'min_child_weight': 7, 'eta': 0.03922137885256827, 'gamma': 0.701895502789895}. Best is trial 6 with value: -1.2209337807112228.
[I 2025-06-22 08:19:46,528] Trial 30 finished with value: -1.3423884855029402 and parameters: {'booster': 'dart', 'lambda': 0.015528899914936676, 'alpha': 7.124129313135891e-06, 'subsample': 0.8927501371026939, 'colsample_bytree': 0.7825550616107743, 'max_depth': 10, 'min_child_weight': 3, 'eta': 0.17401591792247054, 'gamma': 0.39674090975377707, 'rate_drop': 5.811790209705373e-06, 'skip_drop': 0.021778417129635037}. Best is trial 6 with value: -1.2209337807112228.
[I 2025-06-22 08:19:47,668] Trial 31 finished with value: -1.2358867926477963 and parameters: {'booster': 'dart', 'lambda': 0.002340793958948727, 'alpha': 0.29157881545225806, 'subsample': 0.7099701760942649, 'colsample_bytree': 0.9421434150241856, 'max_depth': 7, 'min_child_weight': 9, 'eta': 0.06709202003963481, 'gamma': 3.5871109123147864, 'rate_drop': 1.4382998467984015e-05, 'skip_drop': 2.213237969715431e-06}. Best is trial 6 with value: -1.2209337807112228.
[I 2025-06-22 08:19:49,875] Trial 32 finished with value: -1.2540846405008703 and parameters: {'booster': 'dart', 'lambda': 0.001238891606461017, 'alpha': 0.00683457242067163, 'subsample': 0.7333891682348617, 'colsample_bytree': 0.9015592993446403, 'max_depth': 6, 'min_child_weight': 9, 'eta': 0.05169385555415795, 'gamma': 2.8530931550246708, 'rate_drop': 8.312543726083273e-07, 'skip_drop': 1.278912447224684e-07}. Best is trial 6 with value: -1.2209337807112228.
[I 2025-06-22 08:20:00,052] Trial 33 finished with value: -1.252150990457434 and parameters: {'booster': 'dart', 'lambda': 0.00020295530745952786, 'alpha': 1.086176356868458, 'subsample': 0.6765044711801316, 'colsample_bytree': 0.9661536674693101, 'max_depth': 8, 'min_child_weight': 10, 'eta': 0.027643153529363716, 'gamma': 4.124705881428692, 'rate_drop': 0.000496449990402944, 'skip_drop': 8.201182643485053e-06}. Best is trial 6 with value: -1.2209337807112228.
[I 2025-06-22 08:20:10,413] Trial 34 finished with value: -1.306406510264959 and parameters: {'booster': 'dart', 'lambda': 0.2579177276361393, 'alpha': 0.0014909678697353672, 'subsample': 0.6344574091062938, 'colsample_bytree': 0.9055058457907926, 'max_depth': 9, 'min_child_weight': 5, 'eta': 0.013714831383622993, 'gamma': 3.269772465307961, 'rate_drop': 0.013900215836227567, 'skip_drop': 2.3186666815238823e-06}. Best is trial 6 with value: -1.2209337807112228.
[I 2025-06-22 08:20:12,654] Trial 35 finished with value: -1.2795780727299841 and parameters: {'booster': 'dart', 'lambda': 9.503705003039561e-06, 'alpha': 0.00010186946067669736, 'subsample': 0.7934187903936225, 'colsample_bytree': 0.8473896332488573, 'max_depth': 7, 'min_child_weight': 8, 'eta': 0.032370446620399056, 'gamma': 3.701388975206256, 'rate_drop': 2.5832270472662707e-07, 'skip_drop': 5.589207442790415e-07}. Best is trial 6 with value: -1.2209337807112228.
[I 2025-06-22 08:20:14,233] Trial 36 finished with value: -1.2576710667597912 and parameters: {'booster': 'dart', 'lambda': 2.4801070053579283e-05, 'alpha': 0.016904565762153385, 'subsample': 0.7472858095160276, 'colsample_bytree': 0.8752757281068725, 'max_depth': 9, 'min_child_weight': 5, 'eta': 0.06259792349315947, 'gamma': 2.5460884531129677, 'rate_drop': 3.2424735053408345e-08, 'skip_drop': 0.00012311645496661534}. Best is trial 6 with value: -1.2209337807112228.
[I 2025-06-22 08:20:14,890] Trial 37 finished with value: -1.2471542786737588 and parameters: {'booster': 'dart', 'lambda': 0.0007727860029051809, 'alpha': 0.12910949131553545, 'subsample': 0.6109340656119443, 'colsample_bytree': 0.5341666250796895, 'max_depth': 5, 'min_child_weight': 9, 'eta': 0.16626835890937358, 'gamma': 4.906985345864811, 'rate_drop': 0.11852568684569552, 'skip_drop': 0.01944820242642197}. Best is trial 6 with value: -1.2209337807112228.
[I 2025-06-22 08:20:22,118] Trial 38 finished with value: -1.2898531891902862 and parameters: {'booster': 'dart', 'lambda': 2.6757892801784124, 'alpha': 0.00501655836834933, 'subsample': 0.9680741800037393, 'colsample_bytree': 0.9677855039077568, 'max_depth': 8, 'min_child_weight': 10, 'eta': 0.01849972587775719, 'gamma': 4.233964444859607, 'rate_drop': 6.793846450628683e-05, 'skip_drop': 0.0009437310182582631}. Best is trial 6 with value: -1.2209337807112228.
[I 2025-06-22 08:20:22,408] Trial 39 finished with value: -1.2878681241400547 and parameters: {'booster': 'gbtree', 'lambda': 3.321572062268169e-06, 'alpha': 0.0004072533477099054, 'subsample': 0.7988915993201867, 'colsample_bytree': 0.8258358008200495, 'max_depth': 5, 'min_child_weight': 7, 'eta': 0.03399992156613837, 'gamma': 3.0947365794171953}. Best is trial 6 with value: -1.2209337807112228.
[I 2025-06-22 08:20:31,906] Trial 40 finished with value: -1.618819037633245 and parameters: {'booster': 'dart', 'lambda': 2.887893585132503e-05, 'alpha': 3.452066600103755, 'subsample': 0.7654309640528829, 'colsample_bytree': 0.6482266323181098, 'max_depth': 6, 'min_child_weight': 5, 'eta': 0.0011419958673835574, 'gamma': 4.529727602691467, 'rate_drop': 7.3571733051137265e-06, 'skip_drop': 0.3840102577402468}. Best is trial 6 with value: -1.2209337807112228.
[I 2025-06-22 08:20:34,274] Trial 41 finished with value: -1.251453370153672 and parameters: {'booster': 'dart', 'lambda': 0.0024528456653563737, 'alpha': 0.34276551440951836, 'subsample': 0.7009863770719017, 'colsample_bytree': 0.9428736977767047, 'max_depth': 7, 'min_child_weight': 9, 'eta': 0.06829402412195294, 'gamma': 3.597311035044169, 'rate_drop': 1.2410463541823423e-05, 'skip_drop': 1.5543603200769357e-06}. Best is trial 6 with value: -1.2209337807112228.
[I 2025-06-22 08:20:35,450] Trial 42 finished with value: -1.2364150877612259 and parameters: {'booster': 'dart', 'lambda': 0.003397883295506962, 'alpha': 0.5277806010750034, 'subsample': 0.7324751679857263, 'colsample_bytree': 0.9629670360503289, 'max_depth': 7, 'min_child_weight': 8, 'eta': 0.09163159072033145, 'gamma': 3.4936001029021586, 'rate_drop': 1.8459238139109368e-05, 'skip_drop': 3.4330726579265677e-06}. Best is trial 6 with value: -1.2209337807112228.
[I 2025-06-22 08:20:36,960] Trial 43 finished with value: -1.2407044622897223 and parameters: {'booster': 'dart', 'lambda': 0.00042962552028805384, 'alpha': 0.023772576837023995, 'subsample': 0.6765223540816749, 'colsample_bytree': 0.9145875673916032, 'max_depth': 7, 'min_child_weight': 9, 'eta': 0.05746865102945437, 'gamma': 3.9249624449467975, 'rate_drop': 2.2363233445725575e-06, 'skip_drop': 1.7259293723859507e-05}. Best is trial 6 with value: -1.2209337807112228.
[I 2025-06-22 08:20:37,477] Trial 44 finished with value: -1.2907356087766497 and parameters: {'booster': 'dart', 'lambda': 0.03185195444284979, 'alpha': 0.11085620548501005, 'subsample': 0.6283656270412665, 'colsample_bytree': 0.8755812663012599, 'max_depth': 8, 'min_child_weight': 10, 'eta': 0.2079090631238449, 'gamma': 3.3009898036704097, 'rate_drop': 5.339406664451137e-05, 'skip_drop': 1.0624828796244233e-07}. Best is trial 6 with value: -1.2209337807112228.
[I 2025-06-22 08:20:39,074] Trial 45 finished with value: -1.3327226110820563 and parameters: {'booster': 'dart', 'lambda': 9.570113355208817e-05, 'alpha': 0.18985722585890785, 'subsample': 0.5377350104606299, 'colsample_bytree': 0.9435373065873266, 'max_depth': 9, 'min_child_weight': 10, 'eta': 0.12042856454173817, 'gamma': 2.743700295700811, 'rate_drop': 0.000833278169423413, 'skip_drop': 2.6325892499851418e-05}. Best is trial 6 with value: -1.2209337807112228.
[I 2025-06-22 08:20:41,106] Trial 46 finished with value: -1.2327684449767826 and parameters: {'booster': 'dart', 'lambda': 0.01290424786155057, 'alpha': 1.21121529464534, 'subsample': 0.8221885192092596, 'colsample_bytree': 0.850618529449303, 'max_depth': 4, 'min_child_weight': 9, 'eta': 0.07588936448773388, 'gamma': 1.7228688436474104, 'rate_drop': 0.00013789446576375266, 'skip_drop': 3.998179276673918e-06}. Best is trial 6 with value: -1.2209337807112228.
[I 2025-06-22 08:20:50,011] Trial 47 finished with value: -1.2530900434902636 and parameters: {'booster': 'dart', 'lambda': 0.016607044319512886, 'alpha': 1.3287975701492145, 'subsample': 0.8333599498132884, 'colsample_bytree': 0.8534341028474224, 'max_depth': 4, 'min_child_weight': 8, 'eta': 0.02571220762890951, 'gamma': 1.6765938439960693, 'rate_drop': 0.005790678563923158, 'skip_drop': 0.00011527503628870647}. Best is trial 6 with value: -1.2209337807112228.
