[I 2025-06-22 08:31:25,295] Trial 378 finished with value: -1.3118474159977298 and parameters: {'booster': 'dart', 'lambda': 0.6036020152791075, 'alpha': 2.277503220454013, 'subsample': 0.9733545619398967, 'colsample_bytree': 0.7666724319963657, 'max_depth': 7, 'min_child_weight': 7, 'eta': 0.1565250693275605, 'gamma': 1.244783682801193, 'rate_drop': 1.0109279323801166e-05, 'skip_drop': 1.0455111267455221e-07}. Best is trial 137 with value: -1.165362986830467.
[I 2025-06-22 08:31:34,036] Trial 379 finished with value: -1.2164585871715503 and parameters: {'booster': 'dart', 'lambda': 1.6535312292454578, 'alpha': 0.002023673700872211, 'subsample': 0.9426046504512458, 'colsample_bytree': 0.7395255482752887, 'max_depth': 3, 'min_child_weight': 3, 'eta': 0.03392776192390269, 'gamma': 2.631091030435417, 'rate_drop': 2.3938530336562228e-08, 'skip_drop': 3.99547151330055e-07}. Best is trial 137 with value: -1.165362986830467.
[I 2025-06-22 08:31:34,697] Trial 380 finished with value: -1.2380381612319757 and parameters: {'booster': 'dart', 'lambda': 0.4744662074840551, 'alpha': 1.1885371279585408, 'subsample': 0.9551792339820577, 'colsample_bytree': 0.8134294967381215, 'max_depth': 3, 'min_child_weight': 7, 'eta': 0.1961277454120862, 'gamma': 2.758216719268341, 'rate_drop': 3.548223710503629e-08, 'skip_drop': 7.057012344793815e-08}. Best is trial 137 with value: -1.165362986830467.
[I 2025-06-22 08:31:37,221] Trial 381 finished with value: -1.2243832609688006 and parameters: {'booster': 'dart', 'lambda': 1.1216162161582124, 'alpha': 4.730924261186757, 'subsample': 0.8039647984683047, 'colsample_bytree': 0.7501533721701444, 'max_depth': 3, 'min_child_weight': 7, 'eta': 0.230258787725857, 'gamma': 2.5313429804397263, 'rate_drop': 1.068601526176867e-06, 'skip_drop': 1.9115384103306086e-07}. Best is trial 137 with value: -1.165362986830467.
[I 2025-06-22 08:31:39,057] Trial 382 finished with value: -1.1961997700397282 and parameters: {'booster': 'dart', 'lambda': 0.0012086940069665475, 'alpha': 2.957327406549038, 'subsample': 0.9790864250517789, 'colsample_bytree': 0.852099465658039, 'max_depth': 3, 'min_child_weight': 7, 'eta': 0.1349085351936534, 'gamma': 1.0896983572389063, 'rate_drop': 1.9644756212511517e-07, 'skip_drop': 3.3831968357944443e-07}. Best is trial 137 with value: -1.165362986830467.
[I 2025-06-22 08:31:41,501] Trial 383 finished with value: -1.2580281481141067 and parameters: {'booster': 'dart', 'lambda': 2.207659870825269, 'alpha': 0.03568847279410496, 'subsample': 0.9627750208960888, 'colsample_bytree': 0.7991155677935773, 'max_depth': 8, 'min_child_weight': 7, 'eta': 0.1749156548280349, 'gamma': 4.02638879969324, 'rate_drop': 4.8213878545301184e-06, 'skip_drop': 2.5932938325672463e-08}. Best is trial 137 with value: -1.165362986830467.
[I 2025-06-22 08:31:41,979] Trial 384 finished with value: -1.2726979047524207 and parameters: {'booster': 'dart', 'lambda': 0.2989543514966523, 'alpha': 1.5763410116082426, 'subsample': 0.9479818012082594, 'colsample_bytree': 0.7784014143368919, 'max_depth': 5, 'min_child_weight': 7, 'eta': 0.2523496773484937, 'gamma': 1.3542323677426729, 'rate_drop': 1.9085334849932026e-08, 'skip_drop': 6.472141732344943e-07}. Best is trial 137 with value: -1.165362986830467.
[I 2025-06-22 08:31:42,176] Trial 385 finished with value: -1.245977106540818 and parameters: {'booster': 'gbtree', 'lambda': 0.14480355957906643, 'alpha': 7.506913453994551, 'subsample': 0.9889535355943684, 'colsample_bytree': 0.7606920359410072, 'max_depth': 3, 'min_child_weight': 7, 'eta': 0.08662099518213899, 'gamma': 2.641477285646663}. Best is trial 137 with value: -1.165362986830467.
[I 2025-06-22 08:31:43,687] Trial 386 finished with value: -1.2108949463851464 and parameters: {'booster': 'dart', 'lambda': 3.107189235760656, 'alpha': 2.4194530637865377, 'subsample': 0.9314425612938583, 'colsample_bytree': 0.8855706044098361, 'max_depth': 3, 'min_child_weight': 7, 'eta': 0.20699267727340176, 'gamma': 2.4056574019421144, 'rate_drop': 4.980111098622206e-08, 'skip_drop': 1.2207341179147195e-07}. Best is trial 137 with value: -1.165362986830467.
[I 2025-06-22 08:31:47,181] Trial 387 finished with value: -1.2240368825597574 and parameters: {'booster': 'dart', 'lambda': 0.808658932359558, 'alpha': 4.830900374028836, 'subsample': 0.9735105781193798, 'colsample_bytree': 0.7104572123826605, 'max_depth': 3, 'min_child_weight': 8, 'eta': 0.1475844872417194, 'gamma': 2.8884510626026527, 'rate_drop': 0.00016034387107537014, 'skip_drop': 6.190980338111429e-08}. Best is trial 137 with value: -1.165362986830467.
[I 2025-06-22 08:31:49,605] Trial 388 finished with value: -1.1952895822664664 and parameters: {'booster': 'dart', 'lambda': 1.5929843002515156, 'alpha': 0.9880011561212303, 'subsample': 0.9583169891297695, 'colsample_bytree': 0.6725502852589522, 'max_depth': 3, 'min_child_weight': 7, 'eta': 0.11778029112818378, 'gamma': 0.9937932826186301, 'rate_drop': 1.1261483481026507e-07, 'skip_drop': 1.4385154832533929e-08}. Best is trial 137 with value: -1.165362986830467.
[I 2025-06-22 08:31:51,178] Trial 389 finished with value: -1.2231093146263163 and parameters: {'booster': 'dart', 'lambda': 1.7969065846735395, 'alpha': 1.1467474029165832, 'subsample': 0.9587490419473867, 'colsample_bytree': 0.687466319208827, 'max_depth': 3, 'min_child_weight': 7, 'eta': 0.11494770896324864, 'gamma': 1.0383357636093455, 'rate_drop': 2.7567796995919644e-08, 'skip_drop': 1.387761419485114e-08}. Best is trial 137 with value: -1.165362986830467.
[I 2025-06-22 08:31:53,194] Trial 390 finished with value: -1.212453240161901 and parameters: {'booster': 'dart', 'lambda': 3.153307312671364, 'alpha': 1.6941159363388312, 'subsample': 0.9426318395035416, 'colsample_bytree': 0.6689441780878183, 'max_depth': 3, 'min_child_weight': 7, 'eta': 0.09944227951584295, 'gamma': 0.9982500512085211, 'rate_drop': 1.6233097630969564e-05, 'skip_drop': 1.8331690169803344e-08}. Best is trial 137 with value: -1.165362986830467.
[I 2025-06-22 08:32:01,571] Trial 391 finished with value: -1.227256576230506 and parameters: {'booster': 'dart', 'lambda': 1.3723355068798673, 'alpha': 3.539520913539617, 'subsample': 0.9675465617629039, 'colsample_bytree': 0.6792609322971442, 'max_depth': 3, 'min_child_weight': 7, 'eta': 0.12348565531364422, 'gamma': 0.8632144867264101, 'rate_drop': 0.07374608408134871, 'skip_drop': 1.2685274525669511e-08}. Best is trial 137 with value: -1.165362986830467.
[I 2025-06-22 08:32:03,981] Trial 392 finished with value: -1.2475517265324585 and parameters: {'booster': 'dart', 'lambda': 0.06939598515839297, 'alpha': 8.407987115089832e-08, 'subsample': 0.9582326338869752, 'colsample_bytree': 0.6525439355325977, 'max_depth': 3, 'min_child_weight': 7, 'eta': 0.1099272921971894, 'gamma': 0.6285026771450357, 'rate_drop': 6.849144612711981e-06, 'skip_drop': 1.0582714615631845e-08}. Best is trial 137 with value: -1.165362986830467.
[I 2025-06-22 08:32:05,874] Trial 393 finished with value: -1.1954609687367301 and parameters: {'booster': 'dart', 'lambda': 2.3125757289408386, 'alpha': 2.4799227280946794, 'subsample': 0.9799941488551711, 'colsample_bytree': 0.6966417779494676, 'max_depth': 3, 'min_child_weight': 7, 'eta': 0.13903105292053974, 'gamma': 0.9700635189269127, 'rate_drop': 2.3536557082102716e-06, 'skip_drop': 2.473222626506582e-08}. Best is trial 137 with value: -1.165362986830467.
[I 2025-06-22 08:32:06,934] Trial 394 finished with value: -1.284191223972552 and parameters: {'booster': 'dart', 'lambda': 0.0002866673110585356, 'alpha': 0.8606877341928478, 'subsample': 0.9361275319466873, 'colsample_bytree': 0.8201331946085237, 'max_depth': 4, 'min_child_weight': 7, 'eta': 0.1197958250407208, 'gamma': 1.1387861273605606, 'rate_drop': 1.4648087136414414e-08, 'skip_drop': 1.7377394532553874e-08}. Best is trial 137 with value: -1.165362986830467.
[I 2025-06-22 08:32:08,311] Trial 395 finished with value: -1.2125347693904507 and parameters: {'booster': 'dart', 'lambda': 0.47191894052198985, 'alpha': 5.855941636386317, 'subsample': 0.9506117150820725, 'colsample_bytree': 0.6545102424476326, 'max_depth': 3, 'min_child_weight': 8, 'eta': 0.09617003349435267, 'gamma': 2.546690367120694, 'rate_drop': 1.0263416949818416e-07, 'skip_drop': 1.3758628267200949e-07}. Best is trial 137 with value: -1.165362986830467.
[I 2025-06-22 08:32:09,855] Trial 396 finished with value: -1.2612366181497705 and parameters: {'booster': 'dart', 'lambda': 0.20304432083371038, 'alpha': 1.7075839306567107, 'subsample': 0.9691029964433202, 'colsample_bytree': 0.6664333865122778, 'max_depth': 3, 'min_child_weight': 10, 'eta': 0.1531757035424518, 'gamma': 1.21907936937413, 'rate_drop': 5.0220664748380465e-08, 'skip_drop': 2.7742197455272443e-07}. Best is trial 137 with value: -1.165362986830467.
[I 2025-06-22 08:32:11,569] Trial 397 finished with value: -1.2134519118730334 and parameters: {'booster': 'dart', 'lambda': 0.9681636629402924, 'alpha': 3.420013943309833, 'subsample': 0.9895113884683573, 'colsample_bytree': 0.6746994964416478, 'max_depth': 3, 'min_child_weight': 7, 'eta': 0.13025160758582907, 'gamma': 0.7874939223118722, 'rate_drop': 1.0103361728749435e-08, 'skip_drop': 3.441752522914991e-08}. Best is trial 137 with value: -1.165362986830467.
[I 2025-06-22 08:32:20,214] Trial 398 finished with value: -1.2733386763755765 and parameters: {'booster': 'dart', 'lambda': 4.7808880273217245, 'alpha': 1.1207446680494548, 'subsample': 0.9543723121771841, 'colsample_bytree': 0.8053728330540116, 'max_depth': 3, 'min_child_weight': 7, 'eta': 0.017307284399395866, 'gamma': 1.9462317442269654, 'rate_drop': 2.129509334814816e-08, 'skip_drop': 7.502734227426704e-08}. Best is trial 137 with value: -1.165362986830467.
[I 2025-06-22 08:32:22,202] Trial 399 finished with value: -1.1983795017177554 and parameters: {'booster': 'dart', 'lambda': 1.8912390774255368, 'alpha': 2.5505112726448322, 'subsample': 0.9808841998134908, 'colsample_bytree': 0.7902791309324746, 'max_depth': 3, 'min_child_weight': 7, 'eta': 0.106130950304959, 'gamma': 1.067524145590746, 'rate_drop': 3.390724174322871e-08, 'skip_drop': 4.5911731312409294e-08}. Best is trial 137 with value: -1.165362986830467.
[I 2025-06-22 08:32:22,674] Trial 400 finished with value: -1.1813856919035572 and parameters: {'booster': 'dart', 'lambda': 2.6979843686097356, 'alpha': 4.578060099425518, 'subsample': 0.9656939024940046, 'colsample_bytree': 0.7055238938552617, 'max_depth': 3, 'min_child_weight': 7, 'eta': 0.2786244088766303, 'gamma': 2.784321083831286, 'rate_drop': 1.7689451989225935e-08, 'skip_drop': 1.8998599194135005e-07}. Best is trial 137 with value: -1.165362986830467.
[I 2025-06-22 08:32:23,311] Trial 401 finished with value: -1.2265171766959067 and parameters: {'booster': 'dart', 'lambda': 3.4385528736643933, 'alpha': 6.872165195341935, 'subsample': 0.9734059463354626, 'colsample_bytree': 0.7047405339547302, 'max_depth': 3, 'min_child_weight': 7, 'eta': 0.28821312018446976, 'gamma': 2.810705438088136, 'rate_drop': 1.7650718163295286e-08, 'skip_drop': 2.0946712466943608e-07}. Best is trial 137 with value: -1.165362986830467.
[I 2025-06-22 08:32:23,740] Trial 402 finished with value: -1.274338673005364 and parameters: {'booster': 'dart', 'lambda': 4.572280943889601, 'alpha': 4.573976320585418, 'subsample': 0.9988869099245403, 'colsample_bytree': 0.7167804806956833, 'max_depth': 3, 'min_child_weight': 8, 'eta': 0.2966709332652117, 'gamma': 2.726871531548543, 'rate_drop': 1.3515084848658757e-08, 'skip_drop': 5.220555101681264e-07}. Best is trial 137 with value: -1.165362986830467.
[I 2025-06-22 08:32:28,290] Trial 403 finished with value: -1.1967642576656405 and parameters: {'booster': 'dart', 'lambda': 3.130588929550135, 'alpha': 3.740161210465932, 'subsample': 0.9660421658196188, 'colsample_bytree': 0.7018208875520124, 'max_depth': 3, 'min_child_weight': 7, 'eta': 0.24763783435959677, 'gamma': 2.900169144018628, 'rate_drop': 2.512806223441386e-08, 'skip_drop': 1.4299005777423055e-07}. Best is trial 137 with value: -1.165362986830467.
[I 2025-06-22 08:32:29,370] Trial 404 finished with value: -1.239746694941533 and parameters: {'booster': 'dart', 'lambda': 5.973755268967012, 'alpha': 9.424021137150204, 'subsample': 0.9807395268229343, 'colsample_bytree': 0.6935991397612172, 'max_depth': 3, 'min_child_weight': 7, 'eta': 0.2746313444186428, 'gamma': 2.647555349879698, 'rate_drop': 1.8881002362718347e-08, 'skip_drop': 3.231964330640058e-07}. Best is trial 137 with value: -1.165362986830467.
[I 2025-06-22 08:32:29,508] Trial 405 finished with value: -1.2623688100055905 and parameters: {'booster': 'gbtree', 'lambda': 2.2903897329134892, 'alpha': 5.832806869186249, 'subsample': 0.9466408643852992, 'colsample_bytree': 0.7277767940763054, 'max_depth': 3, 'min_child_weight': 7, 'eta': 0.2511839018142844, 'gamma': 2.208743168425779}. Best is trial 137 with value: -1.165362986830467.
[I 2025-06-22 08:32:29,898] Trial 406 finished with value: -1.3311453197695933 and parameters: {'booster': 'dart', 'lambda': 0.27463602571537127, 'alpha': 1.6181404227862776e-08, 'subsample': 0.9868056433550647, 'colsample_bytree': 0.575631135408706, 'max_depth': 10, 'min_child_weight': 5, 'eta': 0.2163064120661813, 'gamma': 2.8331215725634324, 'rate_drop': 3.4794961618282474e-08, 'skip_drop': 1.8580486594297844e-07}. Best is trial 137 with value: -1.165362986830467.
[I 2025-06-22 08:32:30,404] Trial 407 finished with value: -1.222630573063575 and parameters: {'booster': 'dart', 'lambda': 0.10249560904156602, 'alpha': 3.0813187656197583, 'subsample': 0.9377697323704548, 'colsample_bytree': 0.708619284669983, 'max_depth': 3, 'min_child_weight': 7, 'eta': 0.2705442962219914, 'gamma': 2.318898429732186, 'rate_drop': 1.0143206255441026e-08, 'skip_drop': 8.930192089535746e-08}. Best is trial 137 with value: -1.165362986830467.
[I 2025-06-22 08:32:31,478] Trial 408 finished with value: -1.2760391324627118 and parameters: {'booster': 'dart', 'lambda': 0.676280889359944, 'alpha': 1.8242732317309547e-07, 'subsample': 0.9643872091519354, 'colsample_bytree': 0.7202250646364019, 'max_depth': 3, 'min_child_weight': 7, 'eta': 0.230350564296228, 'gamma': 2.502182511915498, 'rate_drop': 2.6253833185795818e-08, 'skip_drop': 2.260975034867407e-07}. Best is trial 137 with value: -1.165362986830467.
[I 2025-06-22 08:32:32,295] Trial 409 finished with value: -1.2577347101260903 and parameters: {'booster': 'dart', 'lambda': 2.8316137520334115, 'alpha': 2.4198758113888132, 'subsample': 0.7478360660748373, 'colsample_bytree': 0.7985494221406418, 'max_depth': 4, 'min_child_weight': 4, 'eta': 0.17259479494310517, 'gamma': 2.6833108663307317, 'rate_drop': 1.4756221801014404e-08, 'skip_drop': 1.1940304836454973e-07}. Best is trial 137 with value: -1.165362986830467.
[I 2025-06-22 08:32:33,547] Trial 410 finished with value: -1.2165995579174067 and parameters: {'booster': 'dart', 'lambda': 1.4379395125222976, 'alpha': 5.169215124254571, 'subsample': 0.9733173579015315, 'colsample_bytree': 0.7814178496736028, 'max_depth': 3, 'min_child_weight': 9, 'eta': 0.19366431900566142, 'gamma': 2.776639528948925, 'rate_drop': 2.122242782508002e-08, 'skip_drop': 3.82519554515742e-07}. Best is trial 137 with value: -1.165362986830467.
[I 2025-06-22 08:32:34,037] Trial 411 finished with value: -1.2482118225661116 and parameters: {'booster': 'dart', 'lambda': 1.0186840091034244, 'alpha': 1.8572619550701865, 'subsample': 0.9510914266602921, 'colsample_bytree': 0.8268187514965244, 'max_depth': 3, 'min_child_weight': 6, 'eta': 0.29833131434081894, 'gamma': 2.9454898871215596, 'rate_drop': 1.7564250119906063e-06, 'skip_drop': 9.178962755091155e-08}. Best is trial 137 with value: -1.165362986830467.
[I 2025-06-22 08:32:34,581] Trial 412 finished with value: -1.220690025893177 and parameters: {'booster': 'dart', 'lambda': 4.8374176443290455, 'alpha': 4.13213946081723, 'subsample': 0.9321781054629796, 'colsample_bytree': 0.7131101668629232, 'max_depth': 3, 'min_child_weight': 7, 'eta': 0.2382750130741543, 'gamma': 2.5601520946681164, 'rate_drop': 3.364472731846707e-06, 'skip_drop': 1.0444135816087003e-06}. Best is trial 137 with value: -1.165362986830467.
[I 2025-06-22 08:32:35,427] Trial 413 finished with value: -1.2273799953545528 and parameters: {'booster': 'dart', 'lambda': 0.36011498099837574, 'alpha': 1.7539035422450304, 'subsample': 0.9201159959777897, 'colsample_bytree': 0.7342816953098513, 'max_depth': 3, 'min_child_weight': 8, 'eta': 0.21411791479570144, 'gamma': 2.3791147914461748, 'rate_drop': 3.997700032432197e-08, 'skip_drop': 5.5424594075291374e-08}. Best is trial 137 with value: -1.165362986830467.
[I 2025-06-22 08:32:38,066] Trial 414 finished with value: -1.2334711900409108 and parameters: {'booster': 'dart', 'lambda': 2.204801739459217, 'alpha': 9.508524050723118, 'subsample': 0.9627199820078294, 'colsample_bytree': 0.6972713705301103, 'max_depth': 3, 'min_child_weight': 7, 'eta': 0.16855006408228937, 'gamma': 2.6246757469421875, 'rate_drop': 6.127130558295883e-08, 'skip_drop': 2.005722245842539e-07}. Best is trial 137 with value: -1.165362986830467.
[I 2025-06-22 08:32:38,549] Trial 415 finished with value: -1.2341677499428523 and parameters: {'booster': 'dart', 'lambda': 3.1465876543890268, 'alpha': 3.180722368883262, 'subsample': 0.9897092553742494, 'colsample_bytree': 0.7723712249157213, 'max_depth': 3, 'min_child_weight': 6, 'eta': 0.2542754895061336, 'gamma': 3.062937488586934, 'rate_drop': 2.839397953699247e-08, 'skip_drop': 1.4214711253540785e-07}. Best is trial 137 with value: -1.165362986830467.
[I 2025-06-22 08:32:47,130] Trial 416 finished with value: -1.562288609303027 and parameters: {'booster': 'dart', 'lambda': 0.0068373568759512214, 'alpha': 6.119362864747619e-07, 'subsample': 0.9735477648197719, 'colsample_bytree': 0.6866407512449065, 'max_depth': 3, 'min_child_weight': 7, 'eta': 0.0022971262474498827, 'gamma': 2.459145577270923, 'rate_drop': 1.5148496258728537e-08, 'skip_drop': 7.315985029666335e-08}. Best is trial 137 with value: -1.165362986830467.
[I 2025-06-22 08:32:48,203] Trial 417 finished with value: -1.2395144639219928 and parameters: {'booster': 'dart', 'lambda': 1.9514323005516424e-05, 'alpha': 2.081811493178721, 'subsample': 0.9791111036047554, 'colsample_bytree': 0.8103039690609714, 'max_depth': 3, 'min_child_weight': 7, 'eta': 0.19083856087100567, 'gamma': 2.7307341767890807, 'rate_drop': 1.913228519442802e-08, 'skip_drop': 6.889141542221075e-07}. Best is trial 137 with value: -1.165362986830467.
[I 2025-06-22 08:32:49,591] Trial 418 finished with value: -1.2177626931815462 and parameters: {'booster': 'dart', 'lambda': 0.0007635163651011959, 'alpha': 6.1990153990226, 'subsample': 0.9431259531703398, 'colsample_bytree': 0.7857171888744613, 'max_depth': 3, 'min_child_weight': 7, 'eta': 0.22247587961974094, 'gamma': 2.841287273064037, 'rate_drop': 4.1708138253581716e-08, 'skip_drop': 1.835837080347985e-06}. Best is trial 137 with value: -1.165362986830467.
[I 2025-06-22 08:32:51,211] Trial 419 finished with value: -1.2012311228139352 and parameters: {'booster': 'dart', 'lambda': 9.619359207667775e-06, 'alpha': 1.4465558340173137, 'subsample': 0.9571287858648635, 'colsample_bytree': 0.7607245749580903, 'max_depth': 3, 'min_child_weight': 7, 'eta': 0.1570439692649302, 'gamma': 3.4507564798924437, 'rate_drop': 4.560833234342639e-06, 'skip_drop': 2.944583435658534e-07}. Best is trial 137 with value: -1.165362986830467.
[I 2025-06-22 08:32:51,649] Trial 420 finished with value: -1.254851003590912 and parameters: {'booster': 'dart', 'lambda': 0.04304765271134361, 'alpha': 3.4182789440703854, 'subsample': 0.9663646246990493, 'colsample_bytree': 0.7453474788276088, 'max_depth': 3, 'min_child_weight': 6, 'eta': 0.26813660862061134, 'gamma': 1.3138574602769995, 'rate_drop': 2.6063656422558758e-08, 'skip_drop': 3.493360531097465e-08}. Best is trial 137 with value: -1.165362986830467.
[I 2025-06-22 08:32:53,581] Trial 421 finished with value: -1.2021556991849043 and parameters: {'booster': 'dart', 'lambda': 1.293531052292112, 'alpha': 2.4010167861054375, 'subsample': 0.9499219237636721, 'colsample_bytree': 0.7248536845999995, 'max_depth': 3, 'min_child_weight': 8, 'eta': 0.0840842367905517, 'gamma': 2.5608520320264248, 'rate_drop': 6.862207453172123e-08, 'skip_drop': 5.237195086804918e-08}. Best is trial 137 with value: -1.165362986830467.
[I 2025-06-22 08:32:54,746] Trial 422 finished with value: -1.2458464846527975 and parameters: {'booster': 'dart', 'lambda': 0.7594218574816043, 'alpha': 1.2931267318251292, 'subsample': 0.9933879581306695, 'colsample_bytree': 0.7930322437361487, 'max_depth': 3, 'min_child_weight': 7, 'eta': 0.19319730130700463, 'gamma': 1.1600254459076593, 'rate_drop': 1.2430189687561517e-08, 'skip_drop': 1.0548614221432542e-07}. Best is trial 137 with value: -1.165362986830467.
[I 2025-06-22 08:32:56,818] Trial 423 finished with value: -1.2648384492578997 and parameters: {'booster': 'dart', 'lambda': 9.881873014038255e-05, 'alpha': 0.004191861543461725, 'subsample': 0.9813466742033276, 'colsample_bytree': 0.7057846126803871, 'max_depth': 3, 'min_child_weight': 7, 'eta': 0.1731395109888793, 'gamma': 2.138008651399569, 'rate_drop': 3.1591947128947044e-05, 'skip_drop': 4.5724231245343654e-07}. Best is trial 137 with value: -1.165362986830467.
[I 2025-06-22 08:32:57,038] Trial 424 finished with value: -1.2702563360121575 and parameters: {'booster': 'gbtree', 'lambda': 7.081205429715156, 'alpha': 0.611862333898183, 'subsample': 0.9302531618086649, 'colsample_bytree': 0.642145442563401, 'max_depth': 9, 'min_child_weight': 7, 'eta': 0.14626902090414648, 'gamma': 2.3604944141219057}. Best is trial 137 with value: -1.165362986830467.
