[I 2025-06-22 08:29:34,412] Trial 331 finished with value: -1.1800429699435164 and parameters: {'booster': 'dart', 'lambda': 0.005346980656040645, 'alpha': 3.3119403325006243, 'subsample': 0.9615447122017358, 'colsample_bytree': 0.706248759704529, 'max_depth': 3, 'min_child_weight': 6, 'eta': 0.22116273209513465, 'gamma': 2.4887987687068813, 'rate_drop': 4.645456815071282e-08, 'skip_drop': 9.616846954249498e-08}. Best is trial 137 with value: -1.165362986830467.
[I 2025-06-22 08:29:34,919] Trial 332 finished with value: -1.237835249372189 and parameters: {'booster': 'dart', 'lambda': 0.004326737680993562, 'alpha': 4.621940482210947, 'subsample': 0.9599135210203322, 'colsample_bytree': 0.7004883389004988, 'max_depth': 3, 'min_child_weight': 7, 'eta': 0.2540758508190117, 'gamma': 2.4957622875030143, 'rate_drop': 4.5513926753354395e-08, 'skip_drop': 1.337746083225845e-07}. Best is trial 137 with value: -1.165362986830467.
[I 2025-06-22 08:29:36,015] Trial 333 finished with value: -1.252736670675126 and parameters: {'booster': 'dart', 'lambda': 0.008528452180064195, 'alpha': 9.785956629513803, 'subsample': 0.9839192197379296, 'colsample_bytree': 0.7107459672662622, 'max_depth': 3, 'min_child_weight': 7, 'eta': 0.22997722694956743, 'gamma': 2.693277041882987, 'rate_drop': 1.3740941941506563e-05, 'skip_drop': 1.0749376260898248e-07}. Best is trial 137 with value: -1.165362986830467.
[I 2025-06-22 08:29:44,871] Trial 334 finished with value: -1.2392859158933434 and parameters: {'booster': 'dart', 'lambda': 0.00028151154040644173, 'alpha': 2.1230312361562835, 'subsample': 0.8178521251372488, 'colsample_bytree': 0.6921267214689008, 'max_depth': 3, 'min_child_weight': 7, 'eta': 0.023426117218846368, 'gamma': 2.5788706971506694, 'rate_drop': 3.2006103040916474e-08, 'skip_drop': 2.3501803170305063e-07}. Best is trial 137 with value: -1.165362986830467.
[I 2025-06-22 08:29:45,324] Trial 335 finished with value: -1.281343974612738 and parameters: {'booster': 'dart', 'lambda': 0.719367734504658, 'alpha': 2.0723187056756875e-06, 'subsample': 0.9669287437049358, 'colsample_bytree': 0.6782256184209425, 'max_depth': 4, 'min_child_weight': 6, 'eta': 0.2146212470601575, 'gamma': 2.314091137467688, 'rate_drop': 5.9457212402428155e-08, 'skip_drop': 6.048217316710507e-08}. Best is trial 137 with value: -1.165362986830467.
[I 2025-06-22 08:29:45,862] Trial 336 finished with value: -1.246899558537878 and parameters: {'booster': 'dart', 'lambda': 0.04740724696111772, 'alpha': 0.8815430963291425, 'subsample': 0.9533383203788242, 'colsample_bytree': 0.8079601230920681, 'max_depth': 3, 'min_child_weight': 7, 'eta': 0.2685694560507975, 'gamma': 2.408474141590416, 'rate_drop': 2.144941090940048e-08, 'skip_drop': 1.7803807325236806e-07}. Best is trial 137 with value: -1.165362986830467.
[I 2025-06-22 08:29:47,557] Trial 337 finished with value: -1.2413288074164386 and parameters: {'booster': 'dart', 'lambda': 1.7066083175003077, 'alpha': 0.007584286419757448, 'subsample': 0.9659183094007051, 'colsample_bytree': 0.7063374956106714, 'max_depth': 3, 'min_child_weight': 7, 'eta': 0.1985461328601897, 'gamma': 1.55126415678678, 'rate_drop': 4.256961254688484e-08, 'skip_drop': 0.0008080252726014966}. Best is trial 137 with value: -1.165362986830467.
[I 2025-06-22 08:29:47,990] Trial 338 finished with value: -1.3465541504161993 and parameters: {'booster': 'dart', 'lambda': 0.0009834546990253928, 'alpha': 0.2407903908097068, 'subsample': 0.9767667089202279, 'colsample_bytree': 0.6947735760957329, 'max_depth': 9, 'min_child_weight': 6, 'eta': 0.23906068439974723, 'gamma': 2.623439268275082, 'rate_drop': 3.231898058674384e-08, 'skip_drop': 4.546155948587548e-08}. Best is trial 137 with value: -1.165362986830467.
[I 2025-06-22 08:29:51,879] Trial 339 finished with value: -1.1963580520913863 and parameters: {'booster': 'dart', 'lambda': 2.2487870763513955, 'alpha': 3.3752720360301818, 'subsample': 0.6112113952192543, 'colsample_bytree': 0.7225707280734892, 'max_depth': 3, 'min_child_weight': 7, 'eta': 0.10639749745710096, 'gamma': 2.4758794033650813, 'rate_drop': 7.978983130912764e-08, 'skip_drop': 8.137054217844396e-08}. Best is trial 137 with value: -1.165362986830467.
[I 2025-06-22 08:29:53,881] Trial 340 finished with value: -1.20836500184656 and parameters: {'booster': 'dart', 'lambda': 0.5247450775205962, 'alpha': 3.336613836241095, 'subsample': 0.7054442222191633, 'colsample_bytree': 0.7112147063207241, 'max_depth': 3, 'min_child_weight': 7, 'eta': 0.10825795781027407, 'gamma': 2.4728556110697357, 'rate_drop': 1.2318836305487135e-07, 'skip_drop': 8.175944437495197e-08}. Best is trial 137 with value: -1.165362986830467.
[I 2025-06-22 08:29:55,306] Trial 341 finished with value: -1.2079318567871726 and parameters: {'booster': 'dart', 'lambda': 8.261132917381457e-05, 'alpha': 4.165229813513279, 'subsample': 0.8440547815058258, 'colsample_bytree': 0.7149266271287095, 'max_depth': 3, 'min_child_weight': 7, 'eta': 0.10273666490521739, 'gamma': 2.4786428150742656, 'rate_drop': 7.061123363496955e-08, 'skip_drop': 1.0044154412831758e-07}. Best is trial 137 with value: -1.165362986830467.
[I 2025-06-22 08:30:01,267] Trial 342 finished with value: -1.2257976956894368 and parameters: {'booster': 'dart', 'lambda': 2.384827406709774, 'alpha': 6.453774728859696, 'subsample': 0.6003787616387525, 'colsample_bytree': 0.7313646145708168, 'max_depth': 3, 'min_child_weight': 7, 'eta': 0.09043172311319861, 'gamma': 2.42526386583388, 'rate_drop': 3.244508096432029e-05, 'skip_drop': 6.262317715893214e-08}. Best is trial 137 with value: -1.165362986830467.
[I 2025-06-22 08:30:02,352] Trial 343 finished with value: -1.2153857508855046 and parameters: {'booster': 'dart', 'lambda': 0.005674903035137418, 'alpha': 1.5241764884545297, 'subsample': 0.9854970046008745, 'colsample_bytree': 0.7247186132555294, 'max_depth': 3, 'min_child_weight': 7, 'eta': 0.2006896118378493, 'gamma': 2.5570513489438107, 'rate_drop': 1.5164232037722316e-07, 'skip_drop': 1.427744150234811e-07}. Best is trial 137 with value: -1.165362986830467.
[I 2025-06-22 08:30:02,741] Trial 344 finished with value: -1.2737822126759957 and parameters: {'booster': 'dart', 'lambda': 1.1447926941421718, 'alpha': 2.724588641603017, 'subsample': 0.9911494482184002, 'colsample_bytree': 0.8160718270830543, 'max_depth': 5, 'min_child_weight': 8, 'eta': 0.28486650355965076, 'gamma': 2.289431062657748, 'rate_drop': 8.534183618781314e-08, 'skip_drop': 3.5827718596372715e-08}. Best is trial 137 with value: -1.165362986830467.
[I 2025-06-22 08:30:05,943] Trial 345 finished with value: -1.202135872013013 and parameters: {'booster': 'dart', 'lambda': 0.0001428328255997563, 'alpha': 5.685387714683306, 'subsample': 0.9590752499547822, 'colsample_bytree': 0.7223906660979902, 'max_depth': 3, 'min_child_weight': 7, 'eta': 0.21821356669138492, 'gamma': 1.3215858477801694, 'rate_drop': 1.3631199606675313e-08, 'skip_drop': 9.647324816198076e-08}. Best is trial 137 with value: -1.165362986830467.
[I 2025-06-22 08:30:06,399] Trial 346 finished with value: -1.225518555288248 and parameters: {'booster': 'gbtree', 'lambda': 0.24123433459283108, 'alpha': 1.8105108421502327, 'subsample': 0.9768305267673475, 'colsample_bytree': 0.5470038362451308, 'max_depth': 3, 'min_child_weight': 7, 'eta': 0.07224449498142414, 'gamma': 2.3547091442775794}. Best is trial 137 with value: -1.165362986830467.
[I 2025-06-22 08:30:07,508] Trial 347 finished with value: -1.2423404749493447 and parameters: {'booster': 'dart', 'lambda': 0.0005715618230078793, 'alpha': 3.351676562200491e-08, 'subsample': 0.7728506734288494, 'colsample_bytree': 0.7938346722460181, 'max_depth': 3, 'min_child_weight': 7, 'eta': 0.23643719593717397, 'gamma': 2.702332841217806, 'rate_drop': 6.809028345746314e-06, 'skip_drop': 2.08652300432513e-08}. Best is trial 137 with value: -1.165362986830467.
[I 2025-06-22 08:30:08,679] Trial 348 finished with value: -1.2262063291364207 and parameters: {'booster': 'dart', 'lambda': 1.4588515502526944, 'alpha': 0.5189432549722485, 'subsample': 0.9464876922260717, 'colsample_bytree': 0.7042062752260495, 'max_depth': 3, 'min_child_weight': 9, 'eta': 0.18381658280940183, 'gamma': 1.2046804855786113, 'rate_drop': 2.8006616644013115e-06, 'skip_drop': 5.1495983296659616e-08}. Best is trial 137 with value: -1.165362986830467.
[I 2025-06-22 08:30:11,311] Trial 349 finished with value: -1.1971720233059304 and parameters: {'booster': 'dart', 'lambda': 0.8623557397192472, 'alpha': 3.7810347394077652, 'subsample': 0.967945300422137, 'colsample_bytree': 0.7872039681290741, 'max_depth': 3, 'min_child_weight': 7, 'eta': 0.08141575227875608, 'gamma': 0.008044458582893821, 'rate_drop': 1.0304321868068933e-08, 'skip_drop': 1.4417608873478296e-08}. Best is trial 137 with value: -1.165362986830467.
[I 2025-06-22 08:30:12,400] Trial 350 finished with value: -1.251593634526274 and parameters: {'booster': 'dart', 'lambda': 2.546247618309605, 'alpha': 1.0199483489331145, 'subsample': 0.8284523572329351, 'colsample_bytree': 0.803676469139643, 'max_depth': 3, 'min_child_weight': 7, 'eta': 0.16178183683175626, 'gamma': 2.609314421729147, 'rate_drop': 2.0988422605896168e-08, 'skip_drop': 8.113096811479168e-08}. Best is trial 137 with value: -1.165362986830467.
[I 2025-06-22 08:30:13,010] Trial 351 finished with value: -1.2322796287961746 and parameters: {'booster': 'dart', 'lambda': 1.5093695974396808, 'alpha': 2.4334107573323998, 'subsample': 0.6541107225784426, 'colsample_bytree': 0.8327014856294053, 'max_depth': 3, 'min_child_weight': 7, 'eta': 0.26124676921426304, 'gamma': 3.8171047387111985, 'rate_drop': 8.637073331065877e-08, 'skip_drop': 2.7066217137561663e-08}. Best is trial 137 with value: -1.165362986830467.
[I 2025-06-22 08:30:13,484] Trial 352 finished with value: -1.270625728697101 and parameters: {'booster': 'dart', 'lambda': 0.020203421571244273, 'alpha': 1.3483932985914062, 'subsample': 0.9493862710242351, 'colsample_bytree': 0.6964353336498527, 'max_depth': 3, 'min_child_weight': 8, 'eta': 0.2979937935066398, 'gamma': 1.125782724224293, 'rate_drop': 5.305125896693156e-08, 'skip_drop': 6.021528972007869e-08}. Best is trial 137 with value: -1.165362986830467.
[I 2025-06-22 08:30:14,040] Trial 353 finished with value: -1.2325364717657379 and parameters: {'booster': 'dart', 'lambda': 0.34030125887489276, 'alpha': 4.792859868010811, 'subsample': 0.7239184954997677, 'colsample_bytree': 0.7200234375427851, 'max_depth': 3, 'min_child_weight': 7, 'eta': 0.21299813901930395, 'gamma': 1.4369494685726893, 'rate_drop': 2.8338340540379807e-08, 'skip_drop': 1.2434704861032624e-07}. Best is trial 137 with value: -1.165362986830467.
[I 2025-06-22 08:30:17,954] Trial 354 finished with value: -1.2053923196349092 and parameters: {'booster': 'dart', 'lambda': 0.6611126112401137, 'alpha': 3.0132562086971215, 'subsample': 0.6947918003112569, 'colsample_bytree': 0.6836463854496874, 'max_depth': 3, 'min_child_weight': 7, 'eta': 0.1225546305651917, 'gamma': 1.60975147239361, 'rate_drop': 4.5217973289407666e-06, 'skip_drop': 2.841451128280769e-05}. Best is trial 137 with value: -1.165362986830467.
[I 2025-06-22 08:30:19,926] Trial 355 finished with value: -1.2152788825788552 and parameters: {'booster': 'dart', 'lambda': 2.2718983971473055, 'alpha': 0.09559649883486925, 'subsample': 0.9361318556800636, 'colsample_bytree': 0.7758005690941528, 'max_depth': 3, 'min_child_weight': 7, 'eta': 0.09078374566010419, 'gamma': 2.413704151441458, 'rate_drop': 1.963854959180641e-08, 'skip_drop': 3.816570758908576e-08}. Best is trial 137 with value: -1.165362986830467.
[I 2025-06-22 08:30:21,117] Trial 356 finished with value: -1.2277475133539828 and parameters: {'booster': 'dart', 'lambda': 2.9018577705262416, 'alpha': 2.0447864341394055, 'subsample': 0.5035152875798496, 'colsample_bytree': 0.762417232212583, 'max_depth': 4, 'min_child_weight': 7, 'eta': 0.14946449655226654, 'gamma': 2.532388317151819, 'rate_drop': 2.01486043816057e-06, 'skip_drop': 1.80669319952417e-07}. Best is trial 137 with value: -1.165362986830467.
[I 2025-06-22 08:30:26,149] Trial 357 finished with value: -1.199040548553674 and parameters: {'booster': 'dart', 'lambda': 0.10053904919220864, 'alpha': 0.42390199305438286, 'subsample': 0.5605957597068714, 'colsample_bytree': 0.8160080128046241, 'max_depth': 3, 'min_child_weight': 7, 'eta': 0.054190436986989304, 'gamma': 1.2773561715079396, 'rate_drop': 5.574169215734469e-08, 'skip_drop': 2.6720922769644146e-08}. Best is trial 137 with value: -1.165362986830467.
[I 2025-06-22 08:30:27,744] Trial 358 finished with value: -1.2021381268312608 and parameters: {'booster': 'dart', 'lambda': 0.002951177463427513, 'alpha': 0.7773075475717679, 'subsample': 0.9598684249015839, 'colsample_bytree': 0.8262753208303776, 'max_depth': 3, 'min_child_weight': 7, 'eta': 0.19239598924009363, 'gamma': 3.5678573138975866, 'rate_drop': 1.4939415200643747e-08, 'skip_drop': 4.505386626132815e-06}. Best is trial 137 with value: -1.165362986830467.
[I 2025-06-22 08:30:31,449] Trial 359 finished with value: -1.1920975538277676 and parameters: {'booster': 'dart', 'lambda': 1.657317538706483, 'alpha': 1.21992878768194, 'subsample': 0.977002626852176, 'colsample_bytree': 0.7326225739279206, 'max_depth': 3, 'min_child_weight': 7, 'eta': 0.10445406876291248, 'gamma': 2.701364487192311, 'rate_drop': 0.0001447703965040333, 'skip_drop': 4.74550297945422e-08}. Best is trial 137 with value: -1.165362986830467.
[I 2025-06-22 08:30:33,004] Trial 360 finished with value: -1.235179478987068 and parameters: {'booster': 'dart', 'lambda': 0.9768133288362207, 'alpha': 1.1094585049123873, 'subsample': 0.9783537703552828, 'colsample_bytree': 0.798308868356616, 'max_depth': 3, 'min_child_weight': 8, 'eta': 0.17370189325126892, 'gamma': 2.8277612742507214, 'rate_drop': 0.0007237006267910569, 'skip_drop': 4.300132037609027e-08}. Best is trial 137 with value: -1.165362986830467.
[I 2025-06-22 08:30:33,452] Trial 361 finished with value: -1.2792689592288797 and parameters: {'booster': 'dart', 'lambda': 0.0020103600732160687, 'alpha': 0.622031098850013, 'subsample': 0.9911652540688416, 'colsample_bytree': 0.7552412501363882, 'max_depth': 3, 'min_child_weight': 8, 'eta': 0.2477098339133914, 'gamma': 2.7149682890721993, 'rate_drop': 0.009218570997576775, 'skip_drop': 1.9028661129269694e-08}. Best is trial 137 with value: -1.165362986830467.
[I 2025-06-22 08:30:42,240] Trial 362 finished with value: -1.5077070951111047 and parameters: {'booster': 'dart', 'lambda': 0.012232698694134557, 'alpha': 1.4623820294774912, 'subsample': 0.9694902751889085, 'colsample_bytree': 0.7353134179868226, 'max_depth': 3, 'min_child_weight': 7, 'eta': 0.006211307017582427, 'gamma': 2.671456825400824, 'rate_drop': 0.024574875134608758, 'skip_drop': 1.198645067307279e-08}. Best is trial 137 with value: -1.165362986830467.
[I 2025-06-22 08:30:43,508] Trial 363 finished with value: -1.2400838039001334 and parameters: {'booster': 'dart', 'lambda': 0.47840579129781885, 'alpha': 0.19120312887217158, 'subsample': 0.9800746400887866, 'colsample_bytree': 0.7795853527472077, 'max_depth': 3, 'min_child_weight': 7, 'eta': 0.1369752015252968, 'gamma': 1.0667899021396683, 'rate_drop': 5.17119496153152e-05, 'skip_drop': 3.002105400648014e-08}. Best is trial 137 with value: -1.165362986830467.
[I 2025-06-22 08:30:47,584] Trial 364 finished with value: -1.228824175141717 and parameters: {'booster': 'dart', 'lambda': 1.4114278900094128, 'alpha': 0.9730551538298782, 'subsample': 0.9631785607987655, 'colsample_bytree': 0.7652507522072558, 'max_depth': 3, 'min_child_weight': 5, 'eta': 0.22071109350981666, 'gamma': 2.8106987404756474, 'rate_drop': 2.9294771301925892e-08, 'skip_drop': 5.2326071592861456e-08}. Best is trial 137 with value: -1.165362986830467.
[I 2025-06-22 08:30:47,747] Trial 365 finished with value: -1.3194942299347918 and parameters: {'booster': 'gbtree', 'lambda': 0.0314499227323271, 'alpha': 0.39343031940333045, 'subsample': 0.9993205411679801, 'colsample_bytree': 0.6756325098401695, 'max_depth': 3, 'min_child_weight': 7, 'eta': 0.1887536695572681, 'gamma': 1.380781203689244}. Best is trial 137 with value: -1.165362986830467.
[I 2025-06-22 08:30:49,585] Trial 366 finished with value: -1.2209533376725308 and parameters: {'booster': 'dart', 'lambda': 3.4562749092536627, 'alpha': 1.8632121686250565, 'subsample': 0.9710861648934674, 'colsample_bytree': 0.8068094968615345, 'max_depth': 3, 'min_child_weight': 7, 'eta': 0.1620915215857155, 'gamma': 1.1797067426068988, 'rate_drop': 1.5092382865463385e-08, 'skip_drop': 2.73815840590803e-07}. Best is trial 137 with value: -1.165362986830467.
[I 2025-06-22 08:30:52,225] Trial 367 finished with value: -1.2264766307307078 and parameters: {'booster': 'dart', 'lambda': 0.18480751842681414, 'alpha': 1.4335492884121923, 'subsample': 0.9856961400656123, 'colsample_bytree': 0.7942210657675942, 'max_depth': 4, 'min_child_weight': 7, 'eta': 0.23848204341478485, 'gamma': 3.3226149731827976, 'rate_drop': 1.4683175466108362e-06, 'skip_drop': 1.2140802486848439e-05}. Best is trial 137 with value: -1.165362986830467.
[I 2025-06-22 08:30:54,842] Trial 368 finished with value: -1.2580856313184745 and parameters: {'booster': 'dart', 'lambda': 0.7055353272168753, 'alpha': 0.8033303107048316, 'subsample': 0.9545002892545007, 'colsample_bytree': 0.6917504870182138, 'max_depth': 3, 'min_child_weight': 7, 'eta': 0.12025427475340375, 'gamma': 3.669026867715135, 'rate_drop': 0.00024140299689850276, 'skip_drop': 3.938356558442164e-08}. Best is trial 137 with value: -1.165362986830467.
[I 2025-06-22 08:30:55,534] Trial 369 finished with value: -1.2029907494053267 and parameters: {'booster': 'dart', 'lambda': 1.8979658648785855, 'alpha': 2.2307271802048354, 'subsample': 0.9436063360439804, 'colsample_bytree': 0.6598267239671372, 'max_depth': 3, 'min_child_weight': 7, 'eta': 0.21314332527914126, 'gamma': 3.030342668570908, 'rate_drop': 2.2323688334689953e-08, 'skip_drop': 1.8393186813459917e-08}. Best is trial 137 with value: -1.165362986830467.
[I 2025-06-22 08:31:04,293] Trial 370 finished with value: -1.3863637669840017 and parameters: {'booster': 'dart', 'lambda': 4.159905436898768, 'alpha': 6.439968074746552, 'subsample': 0.973244300214966, 'colsample_bytree': 0.7720675642754135, 'max_depth': 3, 'min_child_weight': 6, 'eta': 0.01077042207179372, 'gamma': 2.1088342725047156, 'rate_drop': 0.00010192159543442724, 'skip_drop': 6.928580057064668e-08}. Best is trial 137 with value: -1.165362986830467.
[I 2025-06-22 08:31:07,313] Trial 371 finished with value: -1.1921338891053692 and parameters: {'booster': 'dart', 'lambda': 1.0714549152531039, 'alpha': 2.789905107797915, 'subsample': 0.95674561484793, 'colsample_bytree': 0.7856435831756085, 'max_depth': 3, 'min_child_weight': 7, 'eta': 0.15468326255041154, 'gamma': 2.742724813398132, 'rate_drop': 4.040229364720798e-08, 'skip_drop': 1.3100559546994986e-07}. Best is trial 137 with value: -1.165362986830467.
[I 2025-06-22 08:31:08,145] Trial 372 finished with value: -1.208061600792299 and parameters: {'booster': 'dart', 'lambda': 1.0901141706168533, 'alpha': 3.4330288488355025, 'subsample': 0.9579747643114058, 'colsample_bytree': 0.7478527210984683, 'max_depth': 3, 'min_child_weight': 7, 'eta': 0.1485055371802126, 'gamma': 2.593497427162276, 'rate_drop': 0.0022447927509519692, 'skip_drop': 1.681042085606611e-07}. Best is trial 137 with value: -1.165362986830467.
[I 2025-06-22 08:31:10,118] Trial 373 finished with value: -1.2091656218950853 and parameters: {'booster': 'dart', 'lambda': 0.33635944201323076, 'alpha': 5.280570751661455, 'subsample': 0.9672093196891127, 'colsample_bytree': 0.7044608669966269, 'max_depth': 3, 'min_child_weight': 7, 'eta': 0.1355224205571297, 'gamma': 2.7004747807685043, 'rate_drop': 3.3031932791433437e-06, 'skip_drop': 2.2322409500817796e-07}. Best is trial 137 with value: -1.165362986830467.
[I 2025-06-22 08:31:10,592] Trial 374 finished with value: -1.2246460054463841 and parameters: {'booster': 'dart', 'lambda': 0.6499497321245346, 'alpha': 2.4874986708806235, 'subsample': 0.9516745547511514, 'colsample_bytree': 0.7553670720755936, 'max_depth': 3, 'min_child_weight': 8, 'eta': 0.2649521786578492, 'gamma': 1.6681256196396248, 'rate_drop': 3.691545860999333e-08, 'skip_drop': 1.4071062283317708e-07}. Best is trial 137 with value: -1.165362986830467.
[I 2025-06-22 08:31:12,540] Trial 375 finished with value: -1.241742992706005 and parameters: {'booster': 'dart', 'lambda': 1.1471884836649133, 'alpha': 9.141111058232331, 'subsample': 0.9830855309366091, 'colsample_bytree': 0.7853247045429169, 'max_depth': 3, 'min_child_weight': 7, 'eta': 0.0982214903582794, 'gamma': 1.4978299943657287, 'rate_drop': 1.4476693961599311e-08, 'skip_drop': 0.06683239162433584}. Best is trial 137 with value: -1.165362986830467.
[I 2025-06-22 08:31:17,521] Trial 376 finished with value: -1.2233877682782186 and parameters: {'booster': 'dart', 'lambda': 1.5948771301624667, 'alpha': 1.7146906919647233, 'subsample': 0.9923302798450734, 'colsample_bytree': 0.7310378585862355, 'max_depth': 3, 'min_child_weight': 7, 'eta': 0.11095461752290293, 'gamma': 2.760992618365911, 'rate_drop': 1.048882179916929e-08, 'skip_drop': 1.0528253178510255e-07}. Best is trial 137 with value: -1.165362986830467.
[I 2025-06-22 08:31:24,727] Trial 377 finished with value: -1.3870544149345891 and parameters: {'booster': 'dart', 'lambda': 0.9109373250277755, 'alpha': 3.722213078784406, 'subsample': 0.9644129587083586, 'colsample_bytree': 0.6837771092563081, 'max_depth': 3, 'min_child_weight': 7, 'eta': 0.1816295108672035, 'gamma': 2.2565369960162336, 'rate_drop': 0.41206950453005725, 'skip_drop': 2.4959261412053036e-07}. Best is trial 137 with value: -1.165362986830467.
