[I 2025-06-23 10:48:47,521] Trial 49 finished with value: -1.4954784859104502 and parameters: {'booster': 'gbtree', 'lambda': 3.861733849117462e-06, 'alpha': 0.0006549937394251607, 'subsample': 0.5145452907849185, 'colsample_bytree': 0.6697206421735966, 'max_depth': 6, 'min_child_weight': 4, 'eta': 0.03150318930415142, 'gamma': 1.6223659609072087}. Best is trial 48 with value: -1.4195230200447957.
Number of finished trials:  50
Best trial:
  Value (RMSE): 1.4195
  MSE: 2.0150
  R²: 0.6030
Model saved to th_student_score_predictor_optuna_xgb_scaled.pkl
PS D:\machile_nearning\wecode_score_prediction\dataset-core-extracted\XGBoost-TH> python .\predict_scaled.py
Found 735 students without TH scores
C:\Users\ASUS\AppData\Local\Packages\PythonSoftwareFoundation.Python.3.13_qbz5n2kfra8p0\LocalCache\local-packages\Python313\site-packages\xgboost\core.py:729: UserWarning: [10:50:46] WARNING: C:\actions-runner\_work\xgboost\xgboost\src\common\error_msg.cc:27: The tree method `gpu_hist` is deprecated since 2.0.0. To use GPU training, set the `device` parameter to CUDA instead.

    E.g. tree_method = "hist", device = "cuda"

  return func(**kwargs)
Predictions saved to th_score_predictions.csv
Sample predictions:
                                  student_id  predicted_th_score
3   0134f9f410c65ad0e8c2254a7e9288670e02a183            7.738634
20  035f97702f2c01d26ab1fae8f39ea2f98a0caa3c            7.774920
40  06024da8147b5cf6105beb4c403f67cf1ff0aea1            9.770609
68  0aaebc88f6106684d6993c156104c1ef36cf94e0            7.792124
80  0bf111a9caedf02804f6991792490e63bc21058a            9.515445