PS D:\machile_nearning\wecode_score_prediction\dataset-core-extracted\XGBoost-TH> python .\train_hard_solved_scaled.py
[I 2025-06-23 10:48:12,201] A new study created in memory with name: no-name-667080e1-c940-4e25-ac86-fa1fcf89a743
[I 2025-06-23 10:48:12,495] Trial 0 finished with value: -1.536697977786498 and parameters: {'booster': 'dart', 'lambda': 1.0631155528782678e-07, 'alpha': 2.104537444991901e-05, 'subsample': 0.9808335775582939, 'colsample_bytree': 0.5171555228808116, 'max_depth': 4, 'min_child_weight': 5, 'eta': 0.20568990120517827, 'gamma': 3.6223731210235295, 'rate_drop': 1.3742708140738227e-08, 'skip_drop': 0.06709243065977567}. Best is trial 0 with value: -1.536697977786498.
[I 2025-06-23 10:48:12,586] Trial 1 finished with value: -1.4343197247763027 and parameters: {'booster': 'gbtree', 'lambda': 2.548529286487331e-06, 'alpha': 1.0889562161271118, 'subsample': 0.550654570434153, 'colsample_bytree': 0.7724238484240727, 'max_depth': 9, 'min_child_weight': 8, 'eta': 0.027462212231753123, 'gamma': 4.326745562697305}. Best is trial 1 with value: -1.4343197247763027.
[I 2025-06-23 10:48:13,688] Trial 2 finished with value: -1.5114552205939649 and parameters: {'booster': 'dart', 'lambda': 0.011026509422236248, 'alpha': 0.08112329364025961, 'subsample': 0.6627949294318869, 'colsample_bytree': 0.9413967895826602, 'max_depth': 7, 'min_child_weight': 6, 'eta': 0.03408861752172446, 'gamma': 3.17995514348504, 'rate_drop': 2.5979692525023284e-06, 'skip_drop': 3.0130908082700673e-06}. Best is trial 1 with value: -1.4343197247763027.
[I 2025-06-23 10:48:13,964] Trial 3 finished with value: -1.6249085504707743 and parameters: {'booster': 'gbtree', 'lambda': 0.00014844559632766415, 'alpha': 1.3610781745023328, 'subsample': 0.8500215911662008, 'colsample_bytree': 0.7487198510450624, 'max_depth': 10, 'min_child_weight': 5, 'eta': 0.002872936903333541, 'gamma': 3.9424450248049507}. Best is trial 1 with value: -1.4343197247763027.
[I 2025-06-23 10:48:13,996] Trial 4 finished with value: -1.614471463154083 and parameters: {'booster': 'gbtree', 'lambda': 2.7953180547814025e-07, 'alpha': 1.0067982522818383e-07, 'subsample': 0.6710852379274502, 'colsample_bytree': 0.5001532876250839, 'max_depth': 8, 'min_child_weight': 3, 'eta': 0.22806291235427203, 'gamma': 3.721254535314449}. Best is trial 1 with value: -1.4343197247763027.
[I 2025-06-23 10:48:14,086] Trial 5 finished with value: -1.4626977006416932 and parameters: {'booster': 'gbtree', 'lambda': 0.21460603947293957, 'alpha': 0.004880289923210644, 'subsample': 0.6142457626343321, 'colsample_bytree': 0.9186968552104626, 'max_depth': 6, 'min_child_weight': 7, 'eta': 0.04007748866954319, 'gamma': 1.184359593326001}. Best is trial 1 with value: -1.4343197247763027.
[I 2025-06-23 10:48:14,190] Trial 6 finished with value: -1.4818000132100342 and parameters: {'booster': 'gbtree', 'lambda': 4.017374247676539e-07, 'alpha': 2.7676885595854888, 'subsample': 0.5526782698524806, 'colsample_bytree': 0.519570749193028, 'max_depth': 7, 'min_child_weight': 4, 'eta': 0.028916174706730108, 'gamma': 2.2951400169449645}. Best is trial 1 with value: -1.4343197247763027.
[I 2025-06-23 10:48:20,834] Trial 7 finished with value: -1.6113055601161541 and parameters: {'booster': 'dart', 'lambda': 0.00035935544298961136, 'alpha': 2.4176415081110006e-08, 'subsample': 0.8029548827365021, 'colsample_bytree': 0.8335121568464139, 'max_depth': 3, 'min_child_weight': 6, 'eta': 0.003933275613686033, 'gamma': 3.4975960309219434, 'rate_drop': 1.5243525383255533e-08, 'skip_drop': 0.00019552021074240042}. Best is trial 1 with value: -1.4343197247763027.
[I 2025-06-23 10:48:20,954] Trial 8 finished with value: -1.4569118804048249 and parameters: {'booster': 'gbtree', 'lambda': 5.40644773000794e-07, 'alpha': 3.398087606436894, 'subsample': 0.6785262591701624, 'colsample_bytree': 0.5809024304182934, 'max_depth': 5, 'min_child_weight': 10, 'eta': 0.030065162323331316, 'gamma': 1.013056302783451}. Best is trial 1 with value: -1.4343197247763027.
[I 2025-06-23 10:48:28,073] Trial 9 finished with value: -1.648396817285472 and parameters: {'booster': 'dart', 'lambda': 0.10498206012915436, 'alpha': 1.7087676305745977e-06, 'subsample': 0.5282778692572874, 'colsample_bytree': 0.7022313604722202, 'max_depth': 5, 'min_child_weight': 4, 'eta': 0.002653706356574459, 'gamma': 4.624409073044434, 'rate_drop': 6.168237365012805e-05, 'skip_drop': 7.848388059750544e-06}. Best is trial 1 with value: -1.4343197247763027.
[I 2025-06-23 10:48:28,349] Trial 10 finished with value: -1.539907605904809 and parameters: {'booster': 'gbtree', 'lambda': 9.430899313052548e-05, 'alpha': 0.0005082949557946531, 'subsample': 0.9235689167329225, 'colsample_bytree': 0.650939448997702, 'max_depth': 10, 'min_child_weight': 1, 'eta': 0.009914194786276566, 'gamma': 4.877310518487783}. Best is trial 1 with value: -1.4343197247763027.
[I 2025-06-23 10:48:28,452] Trial 11 finished with value: -1.4941530052499676 and parameters: {'booster': 'gbtree', 'lambda': 4.36874794749429e-06, 'alpha': 0.07379463554697861, 'subsample': 0.730592431356819, 'colsample_bytree': 0.6218555732426979, 'max_depth': 9, 'min_child_weight': 10, 'eta': 0.09537755914931237, 'gamma': 0.020604882174914962}. Best is trial 1 with value: -1.4343197247763027.
[I 2025-06-23 10:48:28,696] Trial 12 finished with value: -1.4510279655491152 and parameters: {'booster': 'gbtree', 'lambda': 6.276818703021528e-06, 'alpha': 4.250801260904824, 'subsample': 0.59897061014075, 'colsample_bytree': 0.8318967765728807, 'max_depth': 5, 'min_child_weight': 10, 'eta': 0.010947551905790383, 'gamma': 1.8689461953467972}. Best is trial 1 with value: -1.4343197247763027.
[I 2025-06-23 10:48:29,017] Trial 13 finished with value: -1.4433959369984761 and parameters: {'booster': 'gbtree', 'lambda': 1.2140494142405947e-08, 'alpha': 0.0776280477136443, 'subsample': 0.5104369771043854, 'colsample_bytree': 0.8314760385009995, 'max_depth': 8, 'min_child_weight': 8, 'eta': 0.009856281816605923, 'gamma': 2.3360864593690365}. Best is trial 1 with value: -1.4343197247763027.
[I 2025-06-23 10:48:29,353] Trial 14 finished with value: -1.8907180246041584 and parameters: {'booster': 'gbtree', 'lambda': 1.4429911437549487e-08, 'alpha': 0.04780447205194023, 'subsample': 0.5096736428378709, 'colsample_bytree': 0.8393429958930109, 'max_depth': 8, 'min_child_weight': 8, 'eta': 0.0010191888096289332, 'gamma': 2.6738670681334464}. Best is trial 1 with value: -1.4343197247763027.
[I 2025-06-23 10:48:29,702] Trial 15 finished with value: -1.4411119235252756 and parameters: {'booster': 'gbtree', 'lambda': 2.8005303430998156e-08, 'alpha': 0.004678724572058196, 'subsample': 0.585853170698466, 'colsample_bytree': 0.9921169721490566, 'max_depth': 9, 'min_child_weight': 8, 'eta': 0.008130593767183175, 'gamma': 2.7366071630925903}. Best is trial 1 with value: -1.4343197247763027.
[I 2025-06-23 10:48:29,798] Trial 16 finished with value: -1.480978347877232 and parameters: {'booster': 'gbtree', 'lambda': 9.433597968837458e-06, 'alpha': 0.0009210043481301304, 'subsample': 0.5942080250744607, 'colsample_bytree': 0.9771799099239447, 'max_depth': 9, 'min_child_weight': 8, 'eta': 0.06819783192215424, 'gamma': 4.404495154516148}. Best is trial 1 with value: -1.4343197247763027.
[I 2025-06-23 10:48:30,253] Trial 17 finished with value: -1.4578453714822126 and parameters: {'booster': 'gbtree', 'lambda': 4.270789091497985e-08, 'alpha': 3.5244776288998845e-05, 'subsample': 0.737453997457481, 'colsample_bytree': 0.9069003133389525, 'max_depth': 9, 'min_child_weight': 9, 'eta': 0.005241114256424001, 'gamma': 2.978085989609248}. Best is trial 1 with value: -1.4343197247763027.
[I 2025-06-23 10:48:35,832] Trial 18 finished with value: -2.09255321109056 and parameters: {'booster': 'dart', 'lambda': 2.4693424307663303, 'alpha': 0.0069013032515084565, 'subsample': 0.5786561686909996, 'colsample_bytree': 0.7556140294104657, 'max_depth': 10, 'min_child_weight': 7, 'eta': 0.01790051232124679, 'gamma': 4.195370234098771, 'rate_drop': 0.5261994988707578, 'skip_drop': 3.649326041461045e-08}. Best is trial 1 with value: -1.4343197247763027.
[I 2025-06-23 10:48:35,927] Trial 19 finished with value: -1.497982432053341 and parameters: {'booster': 'gbtree', 'lambda': 0.002799379888459596, 'alpha': 0.4696413716728756, 'subsample': 0.6344951003175276, 'colsample_bytree': 0.9843479838732371, 'max_depth': 9, 'min_child_weight': 9, 'eta': 0.09573897625843193, 'gamma': 1.5309982317885795}. Best is trial 1 with value: -1.4343197247763027.
[I 2025-06-23 10:48:36,262] Trial 20 finished with value: -1.868078587288361 and parameters: {'booster': 'gbtree', 'lambda': 2.6951415324635427e-06, 'alpha': 0.005633140719697825, 'subsample': 0.7916922089990617, 'colsample_bytree': 0.7635569379122876, 'max_depth': 7, 'min_child_weight': 7, 'eta': 0.001048333331821678, 'gamma': 0.4204997747623942}. Best is trial 1 with value: -1.4343197247763027.
[I 2025-06-23 10:48:36,553] Trial 21 finished with value: -1.4435862909345925 and parameters: {'booster': 'gbtree', 'lambda': 1.7544509958547784e-08, 'alpha': 0.2142125034920612, 'subsample': 0.5042492286884677, 'colsample_bytree': 0.8542455266797446, 'max_depth': 8, 'min_child_weight': 8, 'eta': 0.007802501329915988, 'gamma': 2.353812791753491}. Best is trial 1 with value: -1.4343197247763027.
[I 2025-06-23 10:48:36,752] Trial 22 finished with value: -1.471867469791763 and parameters: {'booster': 'gbtree', 'lambda': 1.0343262623012738e-08, 'alpha': 0.013629456957857371, 'subsample': 0.5565577053933584, 'colsample_bytree': 0.8010707419761267, 'max_depth': 8, 'min_child_weight': 9, 'eta': 0.01727645862388717, 'gamma': 1.9210470710753356}. Best is trial 1 with value: -1.4343197247763027.
[I 2025-06-23 10:48:36,937] Trial 23 finished with value: -1.4350515943288746 and parameters: {'booster': 'gbtree', 'lambda': 8.270889609294848e-07, 'alpha': 7.34084788522268e-05, 'subsample': 0.5451319314992313, 'colsample_bytree': 0.8812995904367898, 'max_depth': 9, 'min_child_weight': 8, 'eta': 0.017259839013567573, 'gamma': 2.8629817427577873}. Best is trial 1 with value: -1.4343197247763027.
[I 2025-06-23 10:48:37,134] Trial 24 finished with value: -1.4352984672400453 and parameters: {'booster': 'gbtree', 'lambda': 4.641856973279762e-05, 'alpha': 6.356230349579922e-05, 'subsample': 0.6358714997750371, 'colsample_bytree': 0.8919940528160595, 'max_depth': 10, 'min_child_weight': 7, 'eta': 0.015731255277620815, 'gamma': 2.9962273645790773}. Best is trial 1 with value: -1.4343197247763027.
[I 2025-06-23 10:48:37,346] Trial 25 finished with value: -1.4701193907014385 and parameters: {'booster': 'gbtree', 'lambda': 3.687700638879725e-05, 'alpha': 3.811966607445753e-05, 'subsample': 0.6993561035504279, 'colsample_bytree': 0.8840040806675383, 'max_depth': 10, 'min_child_weight': 7, 'eta': 0.017868516945136356, 'gamma': 3.1070899906148624}. Best is trial 1 with value: -1.4343197247763027.
[I 2025-06-23 10:48:38,001] Trial 26 finished with value: -1.462100359624261 and parameters: {'booster': 'dart', 'lambda': 0.0005753242440086877, 'alpha': 1.562517438128974e-06, 'subsample': 0.6314257293093769, 'colsample_bytree': 0.7014346425624886, 'max_depth': 10, 'min_child_weight': 6, 'eta': 0.05413415407410949, 'gamma': 4.085732165361627, 'rate_drop': 0.38644855460624744, 'skip_drop': 0.9034845960717153}. Best is trial 1 with value: -1.4343197247763027.
[I 2025-06-23 10:48:38,180] Trial 27 finished with value: -1.4308665460226828 and parameters: {'booster': 'gbtree', 'lambda': 2.6096254333078793e-05, 'alpha': 7.627729898019001e-06, 'subsample': 0.5518688338697488, 'colsample_bytree': 0.78212394865854, 'max_depth': 9, 'min_child_weight': 9, 'eta': 0.020364306561638467, 'gamma': 4.940960421855256}. Best is trial 27 with value: -1.4308665460226828.
[I 2025-06-23 10:48:38,308] Trial 28 finished with value: -1.4444067243177303 and parameters: {'booster': 'gbtree', 'lambda': 1.0110163450926697e-06, 'alpha': 2.919248546832261e-06, 'subsample': 0.5516884606851872, 'colsample_bytree': 0.7154658762819048, 'max_depth': 6, 'min_child_weight': 9, 'eta': 0.04932662455040172, 'gamma': 4.99070548495537}. Best is trial 27 with value: -1.4308665460226828.
[I 2025-06-23 10:48:40,321] Trial 29 finished with value: -1.463814563546629 and parameters: {'booster': 'dart', 'lambda': 1.4350391547117176e-07, 'alpha': 5.203541800996352e-06, 'subsample': 0.5530139657528743, 'colsample_bytree': 0.7682829885549967, 'max_depth': 9, 'min_child_weight': 9, 'eta': 0.024870485904885494, 'gamma': 3.541709317692196, 'rate_drop': 0.004478334828726605, 'skip_drop': 0.0029081716362452034}. Best is trial 27 with value: -1.4308665460226828.
[I 2025-06-23 10:48:40,401] Trial 30 finished with value: -1.4832228533049454 and parameters: {'booster': 'gbtree', 'lambda': 2.5344198499989676e-05, 'alpha': 0.00015275932487039041, 'subsample': 0.9773162290681663, 'colsample_bytree': 0.7927756755995985, 'max_depth': 7, 'min_child_weight': 10, 'eta': 0.1574925682821904, 'gamma': 4.57397517628761}. Best is trial 27 with value: -1.4308665460226828.
[I 2025-06-23 10:48:40,594] Trial 31 finished with value: -1.447554896079554 and parameters: {'booster': 'gbtree', 'lambda': 1.4619442515300282e-06, 'alpha': 2.8452918908021036e-07, 'subsample': 0.6275327860411453, 'colsample_bytree': 0.8779785152551899, 'max_depth': 10, 'min_child_weight': 7, 'eta': 0.016992156080825983, 'gamma': 3.8395665664071483}. Best is trial 27 with value: -1.4308665460226828.
[I 2025-06-23 10:48:40,789] Trial 32 finished with value: -1.4435637148156437 and parameters: {'booster': 'gbtree', 'lambda': 2.8355257811257462e-05, 'alpha': 0.0001256872831777628, 'subsample': 0.5365721996536355, 'colsample_bytree': 0.9405634359424775, 'max_depth': 9, 'min_child_weight': 8, 'eta': 0.014347796380103646, 'gamma': 3.3057571176538354}. Best is trial 27 with value: -1.4308665460226828.
[I 2025-06-23 10:48:40,926] Trial 33 finished with value: -1.502894660242337 and parameters: {'booster': 'gbtree', 'lambda': 0.0011818318940031618, 'alpha': 8.24138876809301e-06, 'subsample': 0.6514349591607609, 'colsample_bytree': 0.8893722489924973, 'max_depth': 10, 'min_child_weight': 5, 'eta': 0.024434020564631648, 'gamma': 4.361138014570517}. Best is trial 27 with value: -1.4308665460226828.
[I 2025-06-23 10:48:41,263] Trial 34 finished with value: -1.4612306890478446 and parameters: {'booster': 'gbtree', 'lambda': 0.00013784924798005392, 'alpha': 0.001137342394999303, 'subsample': 0.5739189443855156, 'colsample_bytree': 0.7944865629685464, 'max_depth': 8, 'min_child_weight': 6, 'eta': 0.006228445040162601, 'gamma': 4.678619958121828}. Best is trial 27 with value: -1.4308665460226828.
[I 2025-06-23 10:48:41,381] Trial 35 finished with value: -1.4425902834630773 and parameters: {'booster': 'gbtree', 'lambda': 1.5465959259361494e-05, 'alpha': 1.369616322695254e-05, 'subsample': 0.6972386695359047, 'colsample_bytree': 0.9272927305589203, 'max_depth': 9, 'min_child_weight': 9, 'eta': 0.0374427691603811, 'gamma': 3.9112826747091916}. Best is trial 27 with value: -1.4308665460226828.
[I 2025-06-23 10:48:44,439] Trial 36 finished with value: -1.459652184549204 and parameters: {'booster': 'dart', 'lambda': 1.3650361241629942e-07, 'alpha': 4.4169893704071243e-07, 'subsample': 0.6113034979327812, 'colsample_bytree': 0.9630232914859568, 'max_depth': 10, 'min_child_weight': 7, 'eta': 0.013115119688037852, 'gamma': 2.994044350549983, 'rate_drop': 2.6056864436233772e-06, 'skip_drop': 2.033982267943566e-08}. Best is trial 27 with value: -1.4308665460226828.
[I 2025-06-23 10:48:44,596] Trial 37 finished with value: -1.4752166495556043 and parameters: {'booster': 'gbtree', 'lambda': 6.896385666805435e-05, 'alpha': 0.0002703504739336964, 'subsample': 0.6597278293559359, 'colsample_bytree': 0.7263917511954966, 'max_depth': 8, 'min_child_weight': 5, 'eta': 0.024330670809572724, 'gamma': 3.333079561958196}. Best is trial 27 with value: -1.4308665460226828.
[I 2025-06-23 10:48:44,714] Trial 38 finished with value: -1.491300129672419 and parameters: {'booster': 'gbtree', 'lambda': 0.00728064470913257, 'alpha': 6.692356823775256e-05, 'subsample': 0.7739029166020989, 'colsample_bytree': 0.6694762915300709, 'max_depth': 9, 'min_child_weight': 6, 'eta': 0.04109992159571817, 'gamma': 2.671389892479265}. Best is trial 27 with value: -1.4308665460226828.
[I 2025-06-23 10:48:44,931] Trial 39 finished with value: -1.643653330936837 and parameters: {'booster': 'gbtree', 'lambda': 2.0634490448318423e-06, 'alpha': 1.0561648379973758e-08, 'subsample': 0.8340353601896826, 'colsample_bytree': 0.8069120283771328, 'max_depth': 4, 'min_child_weight': 2, 'eta': 0.0030381972825632686, 'gamma': 3.629754427468943}. Best is trial 27 with value: -1.4308665460226828.
[I 2025-06-23 10:48:45,585] Trial 40 finished with value: -1.5265690575921071 and parameters: {'booster': 'dart', 'lambda': 3.701028213912464e-07, 'alpha': 7.512702107991628e-07, 'subsample': 0.5333486204703882, 'colsample_bytree': 0.8644852702037304, 'max_depth': 7, 'min_child_weight': 8, 'eta': 0.06229273993728959, 'gamma': 2.031623719066093, 'rate_drop': 0.0015111833384092862, 'skip_drop': 0.003855387865660213}. Best is trial 27 with value: -1.4308665460226828.
[I 2025-06-23 10:48:45,882] Trial 41 finished with value: -1.4571029799551414 and parameters: {'booster': 'gbtree', 'lambda': 6.413086036817791e-08, 'alpha': 0.880843318008506, 'subsample': 0.583945004149778, 'colsample_bytree': 0.9082701051484502, 'max_depth': 9, 'min_child_weight': 8, 'eta': 0.005799187059577109, 'gamma': 2.7504444180581338}. Best is trial 27 with value: -1.4308665460226828.
[I 2025-06-23 10:48:46,100] Trial 42 finished with value: -1.4916678823559733 and parameters: {'booster': 'gbtree', 'lambda': 4.902853904006609e-07, 'alpha': 9.538146562340536, 'subsample': 0.56770699903682, 'colsample_bytree': 0.9534351404462323, 'max_depth': 10, 'min_child_weight': 7, 'eta': 0.011352249460425057, 'gamma': 2.843302739384087}. Best is trial 27 with value: -1.4308665460226828.
[I 2025-06-23 10:48:46,413] Trial 43 finished with value: -1.4389525627981348 and parameters: {'booster': 'gbtree', 'lambda': 8.035730989877722e-06, 'alpha': 0.002148680656465394, 'subsample': 0.52720596260645, 'colsample_bytree': 0.9949534263328448, 'max_depth': 9, 'min_child_weight': 8, 'eta': 0.008230465104442888, 'gamma': 2.5261435872197353}. Best is trial 27 with value: -1.4308665460226828.
[I 2025-06-23 10:48:46,628] Trial 44 finished with value: -1.4303498695642922 and parameters: {'booster': 'gbtree', 'lambda': 7.740050730140182e-06, 'alpha': 0.0018040386407623139, 'subsample': 0.5289654792944958, 'colsample_bytree': 0.7818524119961774, 'max_depth': 8, 'min_child_weight': 9, 'eta': 0.02130276973524167, 'gamma': 1.6462084973947895}. Best is trial 44 with value: -1.4303498695642922.
[I 2025-06-23 10:48:46,757] Trial 45 finished with value: -1.4386378371546265 and parameters: {'booster': 'gbtree', 'lambda': 0.0005026073878516548, 'alpha': 1.788456500121881e-05, 'subsample': 0.6113354365344406, 'colsample_bytree': 0.7306027552557375, 'max_depth': 8, 'min_child_weight': 10, 'eta': 0.03248808890598854, 'gamma': 1.5632643831548616}. Best is trial 44 with value: -1.4303498695642922.
[I 2025-06-23 10:48:46,976] Trial 46 finished with value: -1.4535830260411482 and parameters: {'booster': 'gbtree', 'lambda': 0.0002148726528545396, 'alpha': 0.01888638535764086, 'subsample': 0.5265356946263161, 'colsample_bytree': 0.8173785673382288, 'max_depth': 8, 'min_child_weight': 9, 'eta': 0.022909952094361963, 'gamma': 0.9429867981211782}. Best is trial 44 with value: -1.4303498695642922.
[I 2025-06-23 10:48:47,207] Trial 47 finished with value: -1.4461839081871555 and parameters: {'booster': 'gbtree', 'lambda': 5.936812293255726e-05, 'alpha': 7.378566738378705e-08, 'subsample': 0.5464338610777154, 'colsample_bytree': 0.7770648725391319, 'max_depth': 10, 'min_child_weight': 10, 'eta': 0.014103889614418857, 'gamma': 2.1492990387914306}. Best is trial 44 with value: -1.4303498695642922.
[I 2025-06-23 10:48:47,408] Trial 48 finished with value: -1.4195230200447957 and parameters: {'booster': 'gbtree', 'lambda': 3.7858859455959705e-06, 'alpha': 0.00029766210784676344, 'subsample': 0.5005356388472988, 'colsample_bytree': 0.6862258729689589, 'max_depth': 7, 'min_child_weight': 9, 'eta': 0.020946094764021404, 'gamma': 1.6251585580597574}. Best is trial 48 with value: -1.4195230200447957.
