PS D:\machile_nearning\wecode_score_prediction\dataset-student-performance\XGBoost-CK_v2> python .\train.py
[I 2025-06-27 21:59:22,879] A new study created in memory with name: no-name-e4336cf1-79bd-414c-be51-363ed1066b92
[I 2025-06-27 21:59:23,882] Trial 0 finished with value: -1.5839767668542355 and parameters: {'booster': 'dart', 'lambda': 1.5650614548983687e-08, 'alpha': 5.527824191896742e-05, 'subsample': 0.562994423035954, 'colsample_bytree': 0.8399344318325812, 'max_depth': 3, 'min_child_weight': 1, 'eta': 0.05201017148820813, 'gamma': 3.856021732000523, 'rate_drop': 4.078503736347415e-06, 'skip_drop': 0.0003960408738023459}. Best is trial 0 with value: -1.5839767668542355.
[I 2025-06-27 21:59:24,091] Trial 1 finished with value: -1.5876573197735255 and parameters: {'booster': 'gbtree', 'lambda': 2.256872906573646, 'alpha': 1.8925238993067379e-07, 'subsample': 0.9550682147860929, 'colsample_bytree': 0.9634182941849372, 'max_depth': 8, 'min_child_weight': 7, 'eta': 0.011903655257655682, 'gamma': 4.3165647743399305}. Best is trial 0 with value: -1.5839767668542355.
[I 2025-06-27 21:59:24,298] Trial 2 finished with value: -1.622761752211975 and parameters: {'booster': 'dart', 'lambda': 7.418564502809994, 'alpha': 1.1170123483663955e-08, 'subsample': 0.9458915236071825, 'colsample_bytree': 0.8028274742681059, 'max_depth': 5, 'min_child_weight': 4, 'eta': 0.19504266756498173, 'gamma': 4.580000684404974, 'rate_drop': 0.0017853222382142276, 'skip_drop': 1.4764296258012725e-08}. Best is trial 0 with value: -1.5839767668542355.
[I 2025-06-27 21:59:24,339] Trial 3 finished with value: -1.679443555682067 and parameters: {'booster': 'gbtree', 'lambda': 1.0361377729394213e-06, 'alpha': 0.0022351115640470444, 'subsample': 0.9326454331047987, 'colsample_bytree': 0.5104467031790393, 'max_depth': 10, 'min_child_weight': 9, 'eta': 0.19665263127696372, 'gamma': 1.712250629469045}. Best is trial 0 with value: -1.5839767668542355.
[I 2025-06-27 21:59:24,502] Trial 4 finished with value: -1.575782431886251 and parameters: {'booster': 'gbtree', 'lambda': 0.0002548073883708728, 'alpha': 0.678442313630733, 'subsample': 0.7976015796878846, 'colsample_bytree': 0.6290844855740578, 'max_depth': 7, 'min_child_weight': 9, 'eta': 0.010202595097415184, 'gamma': 0.501773507512771}. Best is trial 4 with value: -1.575782431886251.
[I 2025-06-27 21:59:24,697] Trial 5 finished with value: -1.5775495356314457 and parameters: {'booster': 'gbtree', 'lambda': 0.002048953695244354, 'alpha': 3.876400728202872e-05, 'subsample': 0.5149953120327438, 'colsample_bytree': 0.7361578033904312, 'max_depth': 8, 'min_child_weight': 9, 'eta': 0.008217049063260472, 'gamma': 3.2736579186009926}. Best is trial 4 with value: -1.575782431886251.
[I 2025-06-27 21:59:24,996] Trial 6 finished with value: -1.5777601604611364 and parameters: {'booster': 'gbtree', 'lambda': 0.1416248353135746, 'alpha': 1.8257408195227794e-07, 'subsample': 0.6400455689428148, 'colsample_bytree': 0.9708453467767011, 'max_depth': 7, 'min_child_weight': 7, 'eta': 0.003404541351913889, 'gamma': 4.263026639129963}. Best is trial 4 with value: -1.575782431886251.
[I 2025-06-27 21:59:34,430] Trial 7 finished with value: -1.7134233885151162 and parameters: {'booster': 'dart', 'lambda': 7.589037108509164e-06, 'alpha': 9.633195334870103e-05, 'subsample': 0.7549853686407553, 'colsample_bytree': 0.5372569539232498, 'max_depth': 9, 'min_child_weight': 5, 'eta': 0.0014213065236603948, 'gamma': 2.792872655282487, 'rate_drop': 2.634452984798275e-06, 'skip_drop': 1.2179635355813105e-07}. Best is trial 4 with value: -1.575782431886251.
[I 2025-06-27 21:59:35,937] Trial 8 finished with value: -1.5825534916903095 and parameters: {'booster': 'dart', 'lambda': 3.930133993387479e-07, 'alpha': 0.4230499221899326, 'subsample': 0.5006009741833897, 'colsample_bytree': 0.8092986226846064, 'max_depth': 9, 'min_child_weight': 7, 'eta': 0.02277519520741183, 'gamma': 3.7171342828609837, 'rate_drop': 3.7821832888558695e-05, 'skip_drop': 0.0013723100516889308}. Best is trial 4 with value: -1.575782431886251.
[I 2025-06-27 21:59:35,985] Trial 9 finished with value: -1.8561472801658276 and parameters: {'booster': 'gbtree', 'lambda': 0.016750044551674892, 'alpha': 1.2510573842047499, 'subsample': 0.607866252916972, 'colsample_bytree': 0.548922851348745, 'max_depth': 9, 'min_child_weight': 8, 'eta': 0.2763868953865394, 'gamma': 0.6487089288512959}. Best is trial 4 with value: -1.575782431886251.
[I 2025-06-27 21:59:36,098] Trial 10 finished with value: -1.592810325407809 and parameters: {'booster': 'gbtree', 'lambda': 6.749111406442325e-05, 'alpha': 0.02162455416537721, 'subsample': 0.8105567244003361, 'colsample_bytree': 0.6710421555537629, 'max_depth': 5, 'min_child_weight': 10, 'eta': 0.04761895073185356, 'gamma': 0.026031972600650044}. Best is trial 4 with value: -1.575782431886251.
[I 2025-06-27 21:59:36,386] Trial 11 finished with value: -1.6073144027772213 and parameters: {'booster': 'gbtree', 'lambda': 0.0019519601211534909, 'alpha': 8.925186784576887, 'subsample': 0.8351112360880044, 'colsample_bytree': 0.6698349221707713, 'max_depth': 6, 'min_child_weight': 10, 'eta': 0.006570966374413612, 'gamma': 2.146875393486452}. Best is trial 4 with value: -1.575782431886251.
[I 2025-06-27 21:59:36,772] Trial 12 finished with value: -1.5845142527601779 and parameters: {'booster': 'gbtree', 'lambda': 0.0005540423509033296, 'alpha': 1.3381951943068305e-05, 'subsample': 0.6871036376504452, 'colsample_bytree': 0.6964337819651696, 'max_depth': 7, 'min_child_weight': 3, 'eta': 0.004176610079192028, 'gamma': 3.0050019542598787}. Best is trial 4 with value: -1.575782431886251.
[I 2025-06-27 21:59:36,945] Trial 13 finished with value: -1.5759920949919273 and parameters: {'booster': 'gbtree', 'lambda': 0.014832781455842605, 'alpha': 0.007379160598399591, 'subsample': 0.8400229242745114, 'colsample_bytree': 0.6107645266566057, 'max_depth': 6, 'min_child_weight': 9, 'eta': 0.01676279720176386, 'gamma': 1.2985327024964626}. Best is trial 4 with value: -1.575782431886251.
[I 2025-06-27 21:59:37,087] Trial 14 finished with value: -1.5701389938413697 and parameters: {'booster': 'gbtree', 'lambda': 0.07363292191521692, 'alpha': 0.05016619920694564, 'subsample': 0.8462427920126144, 'colsample_bytree': 0.6065132811667311, 'max_depth': 5, 'min_child_weight': 6, 'eta': 0.024959146487896645, 'gamma': 1.1796724322944752}. Best is trial 14 with value: -1.5701389938413697.
[I 2025-06-27 21:59:37,188] Trial 15 finished with value: -1.5823062065387357 and parameters: {'booster': 'gbtree', 'lambda': 0.11085850777670023, 'alpha': 0.11581071080870042, 'subsample': 0.8924156563999333, 'colsample_bytree': 0.6090366961518552, 'max_depth': 3, 'min_child_weight': 6, 'eta': 0.04295507624525445, 'gamma': 0.9296966357494639}. Best is trial 14 with value: -1.5701389938413697.
[I 2025-06-27 21:59:37,307] Trial 16 finished with value: -1.598642577518112 and parameters: {'booster': 'gbtree', 'lambda': 3.49771323709524e-05, 'alpha': 5.731616291352437, 'subsample': 0.7510348821837255, 'colsample_bytree': 0.5772299684291352, 'max_depth': 4, 'min_child_weight': 2, 'eta': 0.028821919768566157, 'gamma': 0.018383897986692654}. Best is trial 14 with value: -1.5701389938413697.
[I 2025-06-27 21:59:37,604] Trial 17 finished with value: -1.758669523559959 and parameters: {'booster': 'gbtree', 'lambda': 0.6599542058012642, 'alpha': 0.0008796383281843587, 'subsample': 0.6967565636042796, 'colsample_bytree': 0.6347487248213272, 'max_depth': 5, 'min_child_weight': 5, 'eta': 0.0012181002039450453, 'gamma': 2.126470499597835}. Best is trial 14 with value: -1.5701389938413697.
[I 2025-06-27 21:59:38,130] Trial 18 finished with value: -1.5843557567517896 and parameters: {'booster': 'dart', 'lambda': 0.023244011345482575, 'alpha': 0.04304565842884459, 'subsample': 0.8725684969529223, 'colsample_bytree': 0.8967361381104104, 'max_depth': 4, 'min_child_weight': 4, 'eta': 0.07422929008829525, 'gamma': 0.8353504664344269, 'rate_drop': 0.19804074311226783, 'skip_drop': 0.5871813675245995}. Best is trial 14 with value: -1.5701389938413697.
[I 2025-06-27 21:59:38,208] Trial 19 finished with value: -1.6037517638419199 and parameters: {'booster': 'gbtree', 'lambda': 8.186906989071608e-05, 'alpha': 0.3549396045258787, 'subsample': 0.7891772014276632, 'colsample_bytree': 0.729967281138007, 'max_depth': 6, 'min_child_weight': 6, 'eta': 0.1223856344258393, 'gamma': 1.5253046531897692}. Best is trial 14 with value: -1.5701389938413697.
[I 2025-06-27 21:59:38,575] Trial 20 finished with value: -1.6109897481398276 and parameters: {'booster': 'gbtree', 'lambda': 0.001313393954390334, 'alpha': 0.0046186471118557, 'subsample': 0.9939512771140389, 'colsample_bytree': 0.5883919737870457, 'max_depth': 7, 'min_child_weight': 8, 'eta': 0.0028036193980388443, 'gamma': 0.5280713547182501}. Best is trial 14 with value: -1.5701389938413697.
[I 2025-06-27 21:59:38,747] Trial 21 finished with value: -1.5699641041461958 and parameters: {'booster': 'gbtree', 'lambda': 0.012265019638412986, 'alpha': 0.015742645098900675, 'subsample': 0.8529354837439249, 'colsample_bytree': 0.6445863298242195, 'max_depth': 6, 'min_child_weight': 9, 'eta': 0.013246887780902413, 'gamma': 1.336884857522446}. Best is trial 21 with value: -1.5699641041461958.
[I 2025-06-27 21:59:38,928] Trial 22 finished with value: -1.5646831410926718 and parameters: {'booster': 'gbtree', 'lambda': 0.12458054002080508, 'alpha': 0.06962051915095449, 'subsample': 0.8719735394649452, 'colsample_bytree': 0.6498176669100035, 'max_depth': 5, 'min_child_weight': 8, 'eta': 0.013779425779314092, 'gamma': 1.9565653057434984}. Best is trial 22 with value: -1.5646831410926718.
[I 2025-06-27 21:59:39,085] Trial 23 finished with value: -1.589348520096237 and parameters: {'booster': 'gbtree', 'lambda': 0.28795656412110343, 'alpha': 0.050187169354253186, 'subsample': 0.8960727888094668, 'colsample_bytree': 0.6875117805778423, 'max_depth': 4, 'min_child_weight': 8, 'eta': 0.016971557778376424, 'gamma': 2.0192864271964335}. Best is trial 22 with value: -1.5646831410926718.
[I 2025-06-27 21:59:39,385] Trial 24 finished with value: -1.5606989165804945 and parameters: {'booster': 'gbtree', 'lambda': 0.04189604857061038, 'alpha': 0.000919586011990217, 'subsample': 0.8691443204975091, 'colsample_bytree': 0.6527132962505829, 'max_depth': 5, 'min_child_weight': 7, 'eta': 0.006145908237877642, 'gamma': 1.202019937060523}. Best is trial 24 with value: -1.5606989165804945.
[I 2025-06-27 21:59:39,757] Trial 25 finished with value: -1.5731501526226521 and parameters: {'booster': 'gbtree', 'lambda': 0.006972841932310001, 'alpha': 0.0005646739360592004, 'subsample': 0.9171374594937637, 'colsample_bytree': 0.7559958005240434, 'max_depth': 6, 'min_child_weight': 8, 'eta': 0.005631650984081058, 'gamma': 2.4758754960477147}. Best is trial 24 with value: -1.5606989165804945.
[I 2025-06-27 21:59:48,614] Trial 26 finished with value: -1.6528298850875731 and parameters: {'booster': 'dart', 'lambda': 1.1151700309348536, 'alpha': 5.729465463880333e-06, 'subsample': 0.9950083888337002, 'colsample_bytree': 0.6475687974840845, 'max_depth': 4, 'min_child_weight': 10, 'eta': 0.002506796611560645, 'gamma': 1.7184149947301044, 'rate_drop': 1.3182112491963796e-08, 'skip_drop': 0.6195299650080532}. Best is trial 24 with value: -1.5606989165804945.
[I 2025-06-27 21:59:48,846] Trial 27 finished with value: -1.5704461455857153 and parameters: {'booster': 'gbtree', 'lambda': 4.835643568065831, 'alpha': 0.000244453582775223, 'subsample': 0.8686265128806419, 'colsample_bytree': 0.7109379716651782, 'max_depth': 5, 'min_child_weight': 7, 'eta': 0.011659418716782013, 'gamma': 2.5273979495590853}. Best is trial 24 with value: -1.5606989165804945.
[I 2025-06-27 21:59:49,183] Trial 28 finished with value: -1.6510061543337309 and parameters: {'booster': 'gbtree', 'lambda': 0.06670857614810528, 'alpha': 0.009096843464914801, 'subsample': 0.7126877415373029, 'colsample_bytree': 0.7651651362417844, 'max_depth': 6, 'min_child_weight': 8, 'eta': 0.0018483655202859, 'gamma': 1.2139625386905517}. Best is trial 24 with value: -1.5606989165804945.
[I 2025-06-27 21:59:53,781] Trial 29 finished with value: -2.0008941099887836 and parameters: {'booster': 'dart', 'lambda': 1.4822819547246145e-08, 'alpha': 0.0007314952031607129, 'subsample': 0.7726029741248279, 'colsample_bytree': 0.5661286708892104, 'max_depth': 3, 'min_child_weight': 1, 'eta': 0.005156232530060089, 'gamma': 1.903286679138621, 'rate_drop': 0.6812984703293775, 'skip_drop': 2.4648659853486393e-06}. Best is trial 24 with value: -1.5606989165804945.
[I 2025-06-27 21:59:53,879] Trial 30 finished with value: -1.5676127390930832 and parameters: {'booster': 'gbtree', 'lambda': 0.004957882192649429, 'alpha': 0.0021247422790481164, 'subsample': 0.8232688634331605, 'colsample_bytree': 0.503119481566993, 'max_depth': 4, 'min_child_weight': 9, 'eta': 0.03403918158135951, 'gamma': 1.4364990487135856}. Best is trial 24 with value: -1.5606989165804945.
[I 2025-06-27 21:59:53,999] Trial 31 finished with value: -1.5829413707337936 and parameters: {'booster': 'gbtree', 'lambda': 0.0038154650508607476, 'alpha': 0.002028937066249318, 'subsample': 0.8302556683232106, 'colsample_bytree': 0.512278812607853, 'max_depth': 4, 'min_child_weight': 9, 'eta': 0.035129957400623295, 'gamma': 1.5500447321405537}. Best is trial 24 with value: -1.5606989165804945.
[I 2025-06-27 21:59:54,157] Trial 32 finished with value: -1.5880126305282305 and parameters: {'booster': 'gbtree', 'lambda': 0.03683837396971062, 'alpha': 0.01292756651226699, 'subsample': 0.8676076444034504, 'colsample_bytree': 0.903589565640317, 'max_depth': 3, 'min_child_weight': 10, 'eta': 0.014697724262928417, 'gamma': 1.0094862789788066}. Best is trial 24 with value: -1.5606989165804945.
[I 2025-06-27 21:59:54,238] Trial 33 finished with value: -1.6001901998141073 and parameters: {'booster': 'gbtree', 'lambda': 0.6872803032974806, 'alpha': 0.14035893958044174, 'subsample': 0.9097195157685338, 'colsample_bytree': 0.7851977248285885, 'max_depth': 5, 'min_child_weight': 7, 'eta': 0.08498470094986618, 'gamma': 2.2874577154974185}. Best is trial 24 with value: -1.5606989165804945.
[I 2025-06-27 21:59:54,459] Trial 34 finished with value: -1.5699955713785672 and parameters: {'booster': 'gbtree', 'lambda': 0.009634611333416527, 'alpha': 0.00014609036147973848, 'subsample': 0.9600051844418329, 'colsample_bytree': 0.5239820735454939, 'max_depth': 5, 'min_child_weight': 9, 'eta': 0.009354007978515627, 'gamma': 1.3753128803748214}. Best is trial 24 with value: -1.5606989165804945.
[I 2025-06-27 21:59:54,688] Trial 35 finished with value: -1.5590530944572496 and parameters: {'booster': 'gbtree', 'lambda': 0.32278872924242025, 'alpha': 0.001503720281492366, 'subsample': 0.808428084225325, 'colsample_bytree': 0.6570895457559208, 'max_depth': 4, 'min_child_weight': 8, 'eta': 0.007878403148950972, 'gamma': 1.7713001301987736}. Best is trial 35 with value: -1.5590530944572496.
[I 2025-06-27 21:59:54,921] Trial 36 finished with value: -1.5681198371443763 and parameters: {'booster': 'gbtree', 'lambda': 0.3722940498648466, 'alpha': 0.0036924374532216015, 'subsample': 0.8089505414278616, 'colsample_bytree': 0.8398190201356043, 'max_depth': 4, 'min_child_weight': 8, 'eta': 0.007423356299147819, 'gamma': 4.958858452982526}. Best is trial 35 with value: -1.5590530944572496.
[I 2025-06-27 21:59:57,624] Trial 37 finished with value: -1.5879322384276 and parameters: {'booster': 'dart', 'lambda': 2.7339184747966403, 'alpha': 3.2597198889146234e-05, 'subsample': 0.9384537344751742, 'colsample_bytree': 0.5002646857038316, 'max_depth': 3, 'min_child_weight': 7, 'eta': 0.021982176262679322, 'gamma': 1.8074541154184707, 'rate_drop': 1.2282160175457436e-08, 'skip_drop': 1.0877401966865266e-05}. Best is trial 35 with value: -1.5590530944572496.
[I 2025-06-27 21:59:57,718] Trial 38 finished with value: -1.5837034508623868 and parameters: {'booster': 'gbtree', 'lambda': 6.9024808438459315, 'alpha': 2.155327639103057e-06, 'subsample': 0.7376328759284906, 'colsample_bytree': 0.5548975846197315, 'max_depth': 4, 'min_child_weight': 6, 'eta': 0.06899297562451266, 'gamma': 2.627509001270739}. Best is trial 35 with value: -1.5590530944572496.
[I 2025-06-27 21:59:58,015] Trial 39 finished with value: -1.5679114901208149 and parameters: {'booster': 'gbtree', 'lambda': 0.16839387779174786, 'alpha': 0.0013679288275827248, 'subsample': 0.7841708182323665, 'colsample_bytree': 0.715471026344001, 'max_depth': 5, 'min_child_weight': 8, 'eta': 0.004227336561190283, 'gamma': 3.269731030081836}. Best is trial 35 with value: -1.5590530944572496.
[I 2025-06-27 22:00:06,259] Trial 40 finished with value: -1.5777799501276095 and parameters: {'booster': 'dart', 'lambda': 0.0006258696908875992, 'alpha': 1.424863081655537e-08, 'subsample': 0.9644914047259071, 'colsample_bytree': 0.6648876063622134, 'max_depth': 3, 'min_child_weight': 5, 'eta': 0.009904722128809171, 'gamma': 0.2834672300012928, 'rate_drop': 0.005281951941121682, 'skip_drop': 0.009572388490916812}. Best is trial 35 with value: -1.5590530944572496.
[I 2025-06-27 22:00:06,561] Trial 41 finished with value: -1.5867661277582261 and parameters: {'booster': 'gbtree', 'lambda': 0.2088657518521666, 'alpha': 0.0017114672710772233, 'subsample': 0.7789622040677625, 'colsample_bytree': 0.7081898919239276, 'max_depth': 5, 'min_child_weight': 8, 'eta': 0.0032972081293734965, 'gamma': 3.590545444348595}. Best is trial 35 with value: -1.5590530944572496.
[I 2025-06-27 22:00:06,819] Trial 42 finished with value: -1.5771946593092319 and parameters: {'booster': 'gbtree', 'lambda': 1.505205669078873, 'alpha': 0.0003729458042854751, 'subsample': 0.813213966053569, 'colsample_bytree': 0.7384999871106086, 'max_depth': 4, 'min_child_weight': 9, 'eta': 0.00452404643979702, 'gamma': 3.3891441816359436}. Best is trial 35 with value: -1.5590530944572496.
[I 2025-06-27 22:00:07,116] Trial 43 finished with value: -1.5730670211552213 and parameters: {'booster': 'gbtree', 'lambda': 9.496288367007869e-08, 'alpha': 6.545416840515198e-05, 'subsample': 0.8841440089573052, 'colsample_bytree': 0.6809665411853498, 'max_depth': 5, 'min_child_weight': 7, 'eta': 0.006403309377582714, 'gamma': 4.251517721677957}. Best is trial 35 with value: -1.5590530944572496.
[I 2025-06-27 22:00:07,376] Trial 44 finished with value: -1.6727387736343529 and parameters: {'booster': 'gbtree', 'lambda': 0.03992266748980353, 'alpha': 0.0012829572138566602, 'subsample': 0.8212018613437141, 'colsample_bytree': 0.7222096618774676, 'max_depth': 4, 'min_child_weight': 8, 'eta': 0.0019386287189824833, 'gamma': 2.894531730479099}. Best is trial 35 with value: -1.5590530944572496.
[I 2025-06-27 22:00:07,634] Trial 45 finished with value: -1.5617649523784434 and parameters: {'booster': 'gbtree', 'lambda': 0.0036195917357060782, 'alpha': 1.359004855970551, 'subsample': 0.7297636005358465, 'colsample_bytree': 0.6271691236983773, 'max_depth': 5, 'min_child_weight': 7, 'eta': 0.00826868688061815, 'gamma': 4.04139530445792}. Best is trial 35 with value: -1.5590530944572496.
[I 2025-06-27 22:00:07,909] Trial 46 finished with value: -1.578439100349181 and parameters: {'booster': 'gbtree', 'lambda': 0.0039558439458103325, 'alpha': 0.7283897083000088, 'subsample': 0.7227449525458869, 'colsample_bytree': 0.6218910530287813, 'max_depth': 10, 'min_child_weight': 7, 'eta': 0.007904135435085375, 'gamma': 1.6035457003046236}. Best is trial 35 with value: -1.5590530944572496.
[I 2025-06-27 22:00:08,049] Trial 47 finished with value: -1.5612596500831466 and parameters: {'booster': 'gbtree', 'lambda': 0.00036650531849380835, 'alpha': 2.1181161651123146, 'subsample': 0.6634562864099377, 'colsample_bytree': 0.5961075892020433, 'max_depth': 5, 'min_child_weight': 6, 'eta': 0.021481308080953262, 'gamma': 3.9156438811409133}. Best is trial 35 with value: -1.5590530944572496.
[I 2025-06-27 22:00:08,306] Trial 48 finished with value: -1.5639169178417505 and parameters: {'booster': 'gbtree', 'lambda': 0.00021581500841943795, 'alpha': 3.2163226927374087, 'subsample': 0.6431795448668141, 'colsample_bytree': 0.5910860919733947, 'max_depth': 7, 'min_child_weight': 6, 'eta': 0.009991084982646583, 'gamma': 4.191698596623532}. Best is trial 35 with value: -1.5590530944572496.
[I 2025-06-27 22:00:08,577] Trial 49 finished with value: -1.5650903975405812 and parameters: {'booster': 'gbtree', 'lambda': 0.00019507606059217532, 'alpha': 2.5956585466927717, 'subsample': 0.613213026066033, 'colsample_bytree': 0.5359214760570036, 'max_depth': 8, 'min_child_weight': 5, 'eta': 0.009512708050258955, 'gamma': 4.051081539943249}. Best is trial 35 with value: -1.5590530944572496.
Number of finished trials:  50
Best trial:
  Value (RMSE): 1.5591
  MSE: 2.4306
  R²: 0.4003
Model saved to ck_student_score_predictor_optuna_xgb.pkl
PS D:\machile_nearning\wecode_score_prediction\dataset-student-performance\XGBoost-CK_v2> python .\predict.py
Found 733 students without CK scores
Predictions saved to ck_score_predictions.csv
Sample predictions:
                                  student_id  predicted_ck_score
3   0134f9f410c65ad0e8c2254a7e9288670e02a183            6.915674
20  035f97702f2c01d26ab1fae8f39ea2f98a0caa3c            7.097991
40  06024da8147b5cf6105beb4c403f67cf1ff0aea1            7.755717
68  0aaebc88f6106684d6993c156104c1ef36cf94e0            6.855416
80  0bf111a9caedf02804f6991792490e63bc21058a            7.613768