PS D:\machile_nearning\wecode_score_prediction\dataset-core-extracted\XGBoost-CK> python .\train_without_th_score.py 
[I 2025-06-23 11:46:19,204] A new study created in memory with name: no-name-28a5b3cc-f3e4-45a1-8a8f-eea6d29ad5f8
[I 2025-06-23 11:46:19,385] Trial 0 finished with value: -1.579972472437206 and parameters: {'booster': 'gbtree', 'lambda': 3.1777905673347245e-07, 'alpha': 0.0010065180970982822, 'subsample': 0.573909100130881, 'colsample_bytree': 0.7782257740130681, 'max_depth': 4, 'min_child_weight': 7, 'eta': 0.0039205405747570424, 'gamma': 3.6616797608744456}. Best is trial 0 with value: -1.579972472437206.
[I 2025-06-23 11:46:19,713] Trial 1 finished with value: -1.5549790417073146 and parameters: {'booster': 'dart', 'lambda': 0.014924380634334182, 'alpha': 0.18983075564302881, 'subsample': 0.7934367748533692, 'colsample_bytree': 0.6488441133898161, 'max_depth': 7, 'min_child_weight': 3, 'eta': 0.09709581598045068, 'gamma': 3.691852781138975, 'rate_drop': 0.0025762467872222977, 'skip_drop': 2.1202219727979428e-05}. Best is trial 1 with value: -1.5549790417073146.
[I 2025-06-23 11:46:19,742] Trial 2 finished with value: -1.6334394974527702 and parameters: {'booster': 'gbtree', 'lambda': 6.991875865552586e-06, 'alpha': 3.968945190293346e-05, 'subsample': 0.9322584367158953, 'colsample_bytree': 0.8596245578315991, 'max_depth': 3, 'min_child_weight': 3, 'eta': 0.2950418143603011, 'gamma': 3.190490885472302}. Best is trial 1 with value: -1.5549790417073146.
[I 2025-06-23 11:46:19,789] Trial 3 finished with value: -1.6612319248646485 and parameters: {'booster': 'gbtree', 'lambda': 1.298854251875963e-07, 'alpha': 0.0043117717595300776, 'subsample': 0.677669675954417, 'colsample_bytree': 0.9704229386760984, 'max_depth': 6, 'min_child_weight': 1, 'eta': 0.07071183116152596, 'gamma': 3.5168927221546737}. Best is trial 1 with value: -1.5549790417073146.
[I 2025-06-23 11:46:20,015] Trial 4 finished with value: -1.5689404512411356 and parameters: {'booster': 'gbtree', 'lambda': 1.3976914248361105e-08, 'alpha': 3.262637289832665, 'subsample': 0.547326178169931, 'colsample_bytree': 0.733312293682441, 'max_depth': 9, 'min_child_weight': 5, 'eta': 0.009240458616487443, 'gamma': 2.5425006392481904}. Best is trial 1 with value: -1.5549790417073146.
[I 2025-06-23 11:46:20,100] Trial 5 finished with value: -1.5848398023705124 and parameters: {'booster': 'gbtree', 'lambda': 0.02679273243018287, 'alpha': 3.388540702636777e-08, 'subsample': 0.8344024888407031, 'colsample_bytree': 0.5899254599120302, 'max_depth': 5, 'min_child_weight': 8, 'eta': 0.022694292476897034, 'gamma': 0.4938666923067958}. Best is trial 1 with value: -1.5549790417073146.
[I 2025-06-23 11:46:20,332] Trial 6 finished with value: -1.6009455455531836 and parameters: {'booster': 'dart', 'lambda': 1.931875262266737e-05, 'alpha': 4.377664704698598e-05, 'subsample': 0.694856731971137, 'colsample_bytree': 0.8352172972816978, 'max_depth': 6, 'min_child_weight': 7, 'eta': 0.18172117363278392, 'gamma': 4.481396756666562, 'rate_drop': 3.5414629356501684e-05, 'skip_drop': 5.6501474821461216e-05}. Best is trial 1 with value: -1.5549790417073146.
[I 2025-06-23 11:46:26,868] Trial 7 finished with value: -1.842132416715035 and parameters: {'booster': 'dart', 'lambda': 0.03165795336180337, 'alpha': 0.002294580974046074, 'subsample': 0.6741975543397645, 'colsample_bytree': 0.8288314910705559, 'max_depth': 7, 'min_child_weight': 5, 'eta': 0.004844705745287697, 'gamma': 4.785240870963015, 'rate_drop': 0.08744420249631264, 'skip_drop': 1.307737864899564e-06}. Best is trial 1 with value: -1.5549790417073146.
[I 2025-06-23 11:46:26,900] Trial 8 finished with value: -1.6459857711836374 and parameters: {'booster': 'gbtree', 'lambda': 0.00028112898302300936, 'alpha': 1.8470298247899506, 'subsample': 0.7743434859365714, 'colsample_bytree': 0.8717688446065253, 'max_depth': 10, 'min_child_weight': 2, 'eta': 0.18632054514113428, 'gamma': 3.8204136146586536}. Best is trial 1 with value: -1.5549790417073146.
[I 2025-06-23 11:46:33,735] Trial 9 finished with value: -1.879537107480575 and parameters: {'booster': 'dart', 'lambda': 4.058768690587208, 'alpha': 0.39328629405668797, 'subsample': 0.9793686017459764, 'colsample_bytree': 0.6786299953439001, 'max_depth': 4, 'min_child_weight': 2, 'eta': 0.006279801755103075, 'gamma': 2.9385787402046857, 'rate_drop': 0.1121001095413195, 'skip_drop': 1.2673803840918323e-06}. Best is trial 1 with value: -1.5549790417073146.
[I 2025-06-23 11:46:34,411] Trial 10 finished with value: -1.5920249912127966 and parameters: {'booster': 'dart', 'lambda': 0.061013804191594016, 'alpha': 0.04726782469686927, 'subsample': 0.8687214396293224, 'colsample_bytree': 0.5145761294151292, 'max_depth': 8, 'min_child_weight': 10, 'eta': 0.037507961317395914, 'gamma': 1.5239514691975917, 'rate_drop': 1.1612134766405093e-07, 'skip_drop': 0.27010459107305107}. Best is trial 1 with value: -1.5549790417073146.
[I 2025-06-23 11:46:42,156] Trial 11 finished with value: -1.7895581830207232 and parameters: {'booster': 'dart', 'lambda': 1.3455894261690252e-08, 'alpha': 7.165442509571641, 'subsample': 0.5020677456880208, 'colsample_bytree': 0.6747383138173246, 'max_depth': 9, 'min_child_weight': 4, 'eta': 0.0013164432249178645, 'gamma': 1.9865919563896952, 'rate_drop': 0.0001984951516230343, 'skip_drop': 0.01205516193961239}. Best is trial 1 with value: -1.5549790417073146.
[I 2025-06-23 11:46:44,187] Trial 12 finished with value: -1.5912360730301978 and parameters: {'booster': 'dart', 'lambda': 0.0015843652438368133, 'alpha': 0.24226850210253453, 'subsample': 0.5969867735811283, 'colsample_bytree': 0.6757489667534309, 'max_depth': 8, 'min_child_weight': 5, 'eta': 0.011519009782936277, 'gamma': 2.2426331937037394, 'rate_drop': 0.0005864593681898841, 'skip_drop': 5.070145558809471e-08}. Best is trial 1 with value: -1.5549790417073146.
[I 2025-06-23 11:46:44,277] Trial 13 finished with value: -1.5811713928681241 and parameters: {'booster': 'gbtree', 'lambda': 0.6998346363469151, 'alpha': 8.392588594037209, 'subsample': 0.7644411918961839, 'colsample_bytree': 0.6048989925824928, 'max_depth': 10, 'min_child_weight': 4, 'eta': 0.06656554599462042, 'gamma': 1.3311900045230565}. Best is trial 1 with value: -1.5549790417073146.
[I 2025-06-23 11:46:44,431] Trial 14 finished with value: -1.5757479541836619 and parameters: {'booster': 'gbtree', 'lambda': 0.0005108058185067004, 'alpha': 0.028572694785183848, 'subsample': 0.8365994028736953, 'colsample_bytree': 0.7402842011041274, 'max_depth': 8, 'min_child_weight': 6, 'eta': 0.013400382574710743, 'gamma': 2.6767881200382977}. Best is trial 1 with value: -1.5549790417073146.
[I 2025-06-23 11:46:52,426] Trial 15 finished with value: -1.7002963312542079 and parameters: {'booster': 'dart', 'lambda': 8.401788578053193e-06, 'alpha': 3.462609279375421e-07, 'subsample': 0.5019349886305888, 'colsample_bytree': 0.5832466732512905, 'max_depth': 7, 'min_child_weight': 3, 'eta': 0.0018230299166164985, 'gamma': 4.217733929095258, 'rate_drop': 3.995846326952261e-08, 'skip_drop': 0.0005351385533321888}. Best is trial 1 with value: -1.5549790417073146.
[I 2025-06-23 11:46:52,541] Trial 16 finished with value: -1.637229367503768 and parameters: {'booster': 'gbtree', 'lambda': 0.003595991773368291, 'alpha': 0.18221116981655572, 'subsample': 0.6190391692472271, 'colsample_bytree': 0.7405088211059909, 'max_depth': 9, 'min_child_weight': 9, 'eta': 0.061663636316730636, 'gamma': 0.8173939234096865}. Best is trial 1 with value: -1.5549790417073146.
[I 2025-06-23 11:46:54,156] Trial 17 finished with value: -1.5795323987787677 and parameters: {'booster': 'dart', 'lambda': 9.235658472588137e-05, 'alpha': 7.87954783816816e-05, 'subsample': 0.712533475731466, 'colsample_bytree': 0.5026354742221917, 'max_depth': 9, 'min_child_weight': 6, 'eta': 0.025895507823877322, 'gamma': 2.4118966585156456, 'rate_drop': 0.0043664405461193885, 'skip_drop': 4.787543768839169e-05}. Best is trial 1 with value: -1.5549790417073146.
[I 2025-06-23 11:46:56,878] Trial 18 finished with value: -1.5872028561148408 and parameters: {'booster': 'dart', 'lambda': 1.4405740402595068e-06, 'alpha': 2.8565014044982956e-06, 'subsample': 0.7966100390574026, 'colsample_bytree': 0.9376050058787863, 'max_depth': 7, 'min_child_weight': 4, 'eta': 0.008876233207376693, 'gamma': 0.05920700745047114, 'rate_drop': 3.25992415399991e-06, 'skip_drop': 1.0091884555939765e-08}. Best is trial 1 with value: -1.5549790417073146.
[I 2025-06-23 11:46:57,111] Trial 19 finished with value: -1.7059770543939279 and parameters: {'booster': 'gbtree', 'lambda': 1.8127003991106517e-08, 'alpha': 0.013568176492375524, 'subsample': 0.8857760046542412, 'colsample_bytree': 0.6447508271022119, 'max_depth': 5, 'min_child_weight': 1, 'eta': 0.002308457887099207, 'gamma': 4.130514358906621}. Best is trial 1 with value: -1.5549790417073146.
[I 2025-06-23 11:46:57,529] Trial 20 finished with value: -1.6595073211007063 and parameters: {'booster': 'dart', 'lambda': 0.4547080499309714, 'alpha': 1.0503832005232119, 'subsample': 0.5536286955693113, 'colsample_bytree': 0.780223555952001, 'max_depth': 8, 'min_child_weight': 3, 'eta': 0.12674838356482077, 'gamma': 3.297176494101814, 'rate_drop': 0.005970759143459187, 'skip_drop': 0.003288303805616313}. Best is trial 1 with value: -1.5549790417073146.
[I 2025-06-23 11:46:57,690] Trial 21 finished with value: -1.56507827397656 and parameters: {'booster': 'gbtree', 'lambda': 0.0023593688783081416, 'alpha': 0.028015298329904303, 'subsample': 0.8355289861538928, 'colsample_bytree': 0.7289297017013023, 'max_depth': 8, 'min_child_weight': 6, 'eta': 0.013923182032224334, 'gamma': 2.83282951805322}. Best is trial 1 with value: -1.5549790417073146.
[I 2025-06-23 11:46:57,842] Trial 22 finished with value: -1.5900417242544207 and parameters: {'booster': 'gbtree', 'lambda': 0.01666486945258427, 'alpha': 0.07511766462807204, 'subsample': 0.7384163022050129, 'colsample_bytree': 0.7118901221284392, 'max_depth': 9, 'min_child_weight': 7, 'eta': 0.01925241723537943, 'gamma': 2.8447377532793148}. Best is trial 1 with value: -1.5549790417073146.
[I 2025-06-23 11:46:57,936] Trial 23 finished with value: -1.6101743631078314 and parameters: {'booster': 'gbtree', 'lambda': 0.0041714778776163605, 'alpha': 1.4495543308978132, 'subsample': 0.8219195281856362, 'colsample_bytree': 0.6308865260241852, 'max_depth': 10, 'min_child_weight': 5, 'eta': 0.039267067705965504, 'gamma': 1.8768886299200345}. Best is trial 1 with value: -1.5549790417073146.
[I 2025-06-23 11:46:58,177] Trial 24 finished with value: -1.572131886324997 and parameters: {'booster': 'gbtree', 'lambda': 8.412235881995504e-05, 'alpha': 0.011698159622424409, 'subsample': 0.9072492790015892, 'colsample_bytree': 0.7902643486362574, 'max_depth': 7, 'min_child_weight': 6, 'eta': 0.007662849595820753, 'gamma': 2.9254671785250683}. Best is trial 1 with value: -1.5549790417073146.
[I 2025-06-23 11:46:58,479] Trial 25 finished with value: -1.6129987164901436 and parameters: {'booster': 'gbtree', 'lambda': 0.3443085681143299, 'alpha': 0.00021954266612170777, 'subsample': 0.6478291551617785, 'colsample_bytree': 0.5493781981024729, 'max_depth': 8, 'min_child_weight': 4, 'eta': 0.0034798531129713217, 'gamma': 4.96484756351053}. Best is trial 1 with value: -1.5549790417073146.
[I 2025-06-23 11:46:58,614] Trial 26 finished with value: -1.5649122294970788 and parameters: {'booster': 'gbtree', 'lambda': 0.0018430937270188753, 'alpha': 0.404261415880409, 'subsample': 0.7359538051083634, 'colsample_bytree': 0.7104283717352256, 'max_depth': 6, 'min_child_weight': 8, 'eta': 0.013617490363389464, 'gamma': 3.912964961033261}. Best is trial 1 with value: -1.5549790417073146.
[I 2025-06-23 11:46:58,693] Trial 27 finished with value: -1.5811254690012821 and parameters: {'booster': 'gbtree', 'lambda': 0.0016970775107695271, 'alpha': 0.35425121553097394, 'subsample': 0.7376855290668801, 'colsample_bytree': 0.6947935707089133, 'max_depth': 6, 'min_child_weight': 8, 'eta': 0.03646310237034346, 'gamma': 3.969667571607499}. Best is trial 1 with value: -1.5549790417073146.
[I 2025-06-23 11:47:02,364] Trial 28 finished with value: -1.9465220836563495 and parameters: {'booster': 'dart', 'lambda': 0.00958199164034748, 'alpha': 0.0006804465300254667, 'subsample': 0.8146295017797924, 'colsample_bytree': 0.6363883931361047, 'max_depth': 5, 'min_child_weight': 8, 'eta': 0.01657062399009137, 'gamma': 4.523109213404338, 'rate_drop': 0.8131858774231522, 'skip_drop': 9.24434136406796e-07}. Best is trial 1 with value: -1.5549790417073146.
[I 2025-06-23 11:47:02,626] Trial 29 finished with value: -1.5795025813167476 and parameters: {'booster': 'gbtree', 'lambda': 0.10386468115520078, 'alpha': 0.07840231733346459, 'subsample': 0.8618063861868346, 'colsample_bytree': 0.7811869377222606, 'max_depth': 6, 'min_child_weight': 7, 'eta': 0.003520161978793998, 'gamma': 3.4614805333874967}. Best is trial 1 with value: -1.5549790417073146.
[I 2025-06-23 11:47:02,689] Trial 30 finished with value: -1.6131486771660097 and parameters: {'booster': 'gbtree', 'lambda': 0.00016502024742413114, 'alpha': 0.003035459421363258, 'subsample': 0.9569686377405037, 'colsample_bytree': 0.5557287861341781, 'max_depth': 4, 'min_child_weight': 10, 'eta': 0.10139709454429265, 'gamma': 3.640613745778039}. Best is trial 1 with value: -1.5549790417073146.
[I 2025-06-23 11:47:02,865] Trial 31 finished with value: -1.5704843317297865 and parameters: {'booster': 'gbtree', 'lambda': 0.0012333352714730007, 'alpha': 2.0361722153660007, 'subsample': 0.5442186597540525, 'colsample_bytree': 0.7162464180100404, 'max_depth': 7, 'min_child_weight': 9, 'eta': 0.010757068799391553, 'gamma': 3.1616282445029005}. Best is trial 1 with value: -1.5549790417073146.
[I 2025-06-23 11:47:03,144] Trial 32 finished with value: -1.5874965966261265 and parameters: {'booster': 'gbtree', 'lambda': 6.366102719511354e-07, 'alpha': 4.015818568356081, 'subsample': 0.9136097041722041, 'colsample_bytree': 0.7509917894371824, 'max_depth': 9, 'min_child_weight': 7, 'eta': 0.006111873968055505, 'gamma': 2.4914043243107016}. Best is trial 1 with value: -1.5549790417073146.
[I 2025-06-23 11:47:03,288] Trial 33 finished with value: -1.5840115163764534 and parameters: {'booster': 'gbtree', 'lambda': 2.2573109710368942e-05, 'alpha': 0.5065673001836883, 'subsample': 0.788927178664498, 'colsample_bytree': 0.6579879256083008, 'max_depth': 8, 'min_child_weight': 5, 'eta': 0.01553788216025, 'gamma': 3.7830892550864963}. Best is trial 1 with value: -1.5549790417073146.
[I 2025-06-23 11:47:03,391] Trial 34 finished with value: -1.5937768125159955 and parameters: {'booster': 'gbtree', 'lambda': 1.319649000854588e-07, 'alpha': 0.13537138377260768, 'subsample': 0.6418075711633922, 'colsample_bytree': 0.7127854797550365, 'max_depth': 6, 'min_child_weight': 3, 'eta': 0.02870716064066046, 'gamma': 3.293059144097451}. Best is trial 1 with value: -1.5549790417073146.
[I 2025-06-23 11:47:03,553] Trial 35 finished with value: -1.5726236171166998 and parameters: {'booster': 'gbtree', 'lambda': 0.007198456524978717, 'alpha': 0.026911595541760033, 'subsample': 0.7209842646679733, 'colsample_bytree': 0.7533362688870303, 'max_depth': 5, 'min_child_weight': 6, 'eta': 0.010567518803538603, 'gamma': 2.07249645614731}. Best is trial 1 with value: -1.5549790417073146.
[I 2025-06-23 11:47:03,673] Trial 36 finished with value: -1.5901047882232455 and parameters: {'booster': 'gbtree', 'lambda': 0.0006297887511942622, 'alpha': 0.9069391356108285, 'subsample': 0.8505595908802522, 'colsample_bytree': 0.8169519431574144, 'max_depth': 3, 'min_child_weight': 2, 'eta': 0.021025761547249965, 'gamma': 4.409708523859118}. Best is trial 1 with value: -1.5549790417073146.
[I 2025-06-23 11:47:03,966] Trial 37 finished with value: -1.5798224962678664 and parameters: {'booster': 'gbtree', 'lambda': 0.12023449271955988, 'alpha': 0.006530510591780948, 'subsample': 0.6840450297326556, 'colsample_bytree': 0.6186495478099959, 'max_depth': 7, 'min_child_weight': 8, 'eta': 0.005469728150687638, 'gamma': 1.622766196033104}. Best is trial 1 with value: -1.5549790417073146.
[I 2025-06-23 11:47:04,424] Trial 38 finished with value: -1.5802973201482193 and parameters: {'booster': 'dart', 'lambda': 3.6490343040990085, 'alpha': 8.606268507423756, 'subsample': 0.7658534334092693, 'colsample_bytree': 0.9146675707057956, 'max_depth': 6, 'min_child_weight': 9, 'eta': 0.23753130307732578, 'gamma': 3.1102390742281005, 'rate_drop': 3.026498065643634e-06, 'skip_drop': 0.25841334910471087}. Best is trial 1 with value: -1.5549790417073146.
[I 2025-06-23 11:47:04,514] Trial 39 finished with value: -1.6318108484108131 and parameters: {'booster': 'gbtree', 'lambda': 3.2563921969773435e-05, 'alpha': 1.4626659080253011e-08, 'subsample': 0.8020955883454997, 'colsample_bytree': 0.8016130136304799, 'max_depth': 7, 'min_child_weight': 1, 'eta': 0.04446287012940165, 'gamma': 3.551618382706485}. Best is trial 1 with value: -1.5549790417073146.
[I 2025-06-23 11:47:12,265] Trial 40 finished with value: -1.570145574303074 and parameters: {'booster': 'dart', 'lambda': 4.279945687177949e-06, 'alpha': 0.0017792529131818826, 'subsample': 0.587745811578811, 'colsample_bytree': 0.8487423343550117, 'max_depth': 8, 'min_child_weight': 5, 'eta': 0.00402336356445585, 'gamma': 2.733565787058874, 'rate_drop': 7.506297974622202e-06, 'skip_drop': 1.0457370538005652e-05}. Best is trial 1 with value: -1.5549790417073146.
[I 2025-06-23 11:47:20,346] Trial 41 finished with value: -1.565733600359833 and parameters: {'booster': 'dart', 'lambda': 2.5890879716025936e-06, 'alpha': 0.0016041559980460025, 'subsample': 0.5766520377304433, 'colsample_bytree': 0.8589352169992801, 'max_depth': 8, 'min_child_weight': 5, 'eta': 0.0041020935792328884, 'gamma': 2.3891852195472123, 'rate_drop': 9.556448976452956e-06, 'skip_drop': 1.195322728465706e-05}. Best is trial 1 with value: -1.5549790417073146.
[I 2025-06-23 11:47:24,215] Trial 42 finished with value: -1.5728265582952015 and parameters: {'booster': 'dart', 'lambda': 4.2355906817059464e-08, 'alpha': 0.0005470920405387464, 'subsample': 0.5254627729449136, 'colsample_bytree': 0.8799714404768758, 'max_depth': 9, 'min_child_weight': 4, 'eta': 0.007799565705898434, 'gamma': 2.3466754183518566, 'rate_drop': 3.895149903467244e-07, 'skip_drop': 0.0009801283269399105}. Best is trial 1 with value: -1.5549790417073146.
[I 2025-06-23 11:47:32,098] Trial 43 finished with value: -1.6015334007499504 and parameters: {'booster': 'dart', 'lambda': 1.304169149673984e-07, 'alpha': 1.2496150008173038e-05, 'subsample': 0.5522024408217081, 'colsample_bytree': 0.9994397929015879, 'max_depth': 8, 'min_child_weight': 6, 'eta': 0.0028017534879220107, 'gamma': 2.5956985680411147, 'rate_drop': 0.003716734545540088, 'skip_drop': 7.425659897153711e-06}. Best is trial 1 with value: -1.5549790417073146.
[I 2025-06-23 11:47:33,680] Trial 44 finished with value: -1.5951207691816143 and parameters: {'booster': 'dart', 'lambda': 0.02875534084456735, 'alpha': 0.012843998524720138, 'subsample': 0.6228619421771245, 'colsample_bytree': 0.7614599842547761, 'max_depth': 10, 'min_child_weight': 7, 'eta': 0.013988475338466607, 'gamma': 2.1772735916555326, 'rate_drop': 4.221527983660936e-05, 'skip_drop': 7.698721163007984e-08}. Best is trial 1 with value: -1.5549790417073146.
[I 2025-06-23 11:47:41,133] Trial 45 finished with value: -1.5726785086722994 and parameters: {'booster': 'dart', 'lambda': 2.500455476896506e-06, 'alpha': 0.042239073618516025, 'subsample': 0.5692607054913935, 'colsample_bytree': 0.6926382474392441, 'max_depth': 7, 'min_child_weight': 4, 'eta': 0.0051533599174705905, 'gamma': 1.2143094612759047, 'rate_drop': 0.0010230310339571149, 'skip_drop': 0.00020986350133037987}. Best is trial 1 with value: -1.5549790417073146.
[I 2025-06-23 11:47:49,883] Trial 46 finished with value: -1.7623105916445745 and parameters: {'booster': 'dart', 'lambda': 0.000491774056336804, 'alpha': 2.860469696098448, 'subsample': 0.6632407025894221, 'colsample_bytree': 0.7258108481501322, 'max_depth': 9, 'min_child_weight': 5, 'eta': 0.0011955212344723642, 'gamma': 1.8186911410504814, 'rate_drop': 5.667484250462106e-07, 'skip_drop': 0.02494481202889575}. Best is trial 1 with value: -1.5549790417073146.
[I 2025-06-23 11:47:57,935] Trial 47 finished with value: -1.6678152762493248 and parameters: {'booster': 'dart', 'lambda': 5.006922200533475e-08, 'alpha': 0.5310207829424872, 'subsample': 0.6056027435252016, 'colsample_bytree': 0.6559671730394515, 'max_depth': 8, 'min_child_weight': 6, 'eta': 0.009010677545285254, 'gamma': 3.062623377707136, 'rate_drop': 0.03852310924052493, 'skip_drop': 9.639815488663331e-06}. Best is trial 1 with value: -1.5549790417073146.
[I 2025-06-23 11:47:58,062] Trial 48 finished with value: -1.5877072896773328 and parameters: {'booster': 'gbtree', 'lambda': 9.048784693616109e-06, 'alpha': 0.14879989176083058, 'subsample': 0.5205312960179713, 'colsample_bytree': 0.8893457894209624, 'max_depth': 8, 'min_child_weight': 4, 'eta': 0.02683452098660551, 'gamma': 4.112304526595498}. Best is trial 1 with value: -1.5549790417073146.
