[I 2025-06-23 11:48:05,460] Trial 49 finished with value: -1.6051265315387644 and parameters: {'booster': 'dart', 'lambda': 5.429532882937554e-07, 'alpha': 0.0002161671768916463, 'subsample': 0.7039553758370738, 'colsample_bytree': 0.6830334252279096, 'max_depth': 9, 'min_child_weight': 2, 'eta': 0.013113041772687321, 'gamma': 3.8999572824167528, 'rate_drop': 1.5714495106594355e-08, 'skip_drop': 1.9377258370334087e-07}. Best [I 2025-06-23 11:48:05,460] Trial 49 finished with value: -1.6051265315387644 and parameters: {'booster': 'dart', 'lambda': 5.429532882937554e-07, 'alpha': 0.0002161671768916463, 'subsample': 0.7039553758370738, 'colsample_bytree': 0.6830334252279096, 'max_depth': 9, 'min_child_weight': 2, 'eta': 0.013113041772687321, 'gamma': 3.8999572824167528, 'rate_drop': 1.5714495106594355e-08, 'skip_drop': 1.9377258370334087e-07}. Best 07, 'alpha': 0.0002161671768916463, 'subsample': 0.7039553758370738, 'colsample_bytree': 0.6830334252279096, 'max_depth': 9, 'min_child_weight': 2, 'eta': 0.013113041772687321, 'gamma': 3.8999572824167528, 'rate_drop': 1.5714495106594355e-08, 'skip_drop': 1.9377258370334087e-07}. Best : 2, 'eta': 0.013113041772687321, 'gamma': 3.8999572824167528, 'rate_drop': 1.5714495106594355e-08, 'skip_drop': 1.9377258370334087e-07}. Best is trial 1 with value: -1.5549790417073146.
Number of finished trials:  50
Best trial:
  Value (RMSE): 1.5550
  MSE: 2.4180
  R²: 0.4034
Model saved to ck_student_score_predictor_optuna_xgb_without_th_score.pkl
PS D:\machile_nearning\wecode_score_prediction\dataset-core-extracted\XGBoost-CK> python .\predict_without_th_score.py
Found 733 students without CK scores
Predictions saved to ck_score_predictions_without_th_score.csv
Sample predictions:
                                  student_id  predicted_ck_score
3   0134f9f410c65ad0e8c2254a7e9288670e02a183            6.936844
20  035f97702f2c01d26ab1fae8f39ea2f98a0caa3c            7.541006
40  06024da8147b5cf6105beb4c403f67cf1ff0aea1            8.567120
68  0aaebc88f6106684d6993c156104c1ef36cf94e0            7.658039
80  0bf111a9caedf02804f6991792490e63bc21058a            7.396189